--------------------
Model 1
--------------------

Epoch 0/19
----------
[train]
LOSS - 1.0226
ACC - 0.4000
PPV - ALL: 0.4222  COVID-19: 0.4737  PNEUMONIA: 0.4000  NORMAL: 0.3929 
RECALL - ALL: 0.4167  COVID-19: 0.3750  PNEUMONIA: 0.4167  NORMAL: 0.4583 
F1 - ALL: 0.4166  COVID-19: 0.4186  PNEUMONIA: 0.4082  NORMAL: 0.4231 
Mask ratio's range: 1.0 ~ 1.0

[val]
LOSS - 1.0073
ACC - 0.4367
PPV - ALL: 0.6585  COVID-19: 1.0000  PNEUMONIA: 0.5882  NORMAL: 0.3872 
RECALL - ALL: 0.4493  COVID-19: 0.1000  PNEUMONIA: 0.3000  NORMAL: 0.9479 
F1 - ALL: 0.3763  COVID-19: 0.1818  PNEUMONIA: 0.3973  NORMAL: 0.5498 

Epoch 1/19
----------
[train]
LOSS - 0.6938
ACC - 0.8933
PPV - ALL: 0.9338  COVID-19: 1.0000  PNEUMONIA: 0.9167  NORMAL: 0.8846 
RECALL - ALL: 0.9306  COVID-19: 0.9167  PNEUMONIA: 0.9167  NORMAL: 0.9583 
F1 - ALL: 0.9311  COVID-19: 0.9565  PNEUMONIA: 0.9167  NORMAL: 0.9200 
Mask ratio's range: 1.0 ~ 1.0

[val]
LOSS - 0.8369
ACC - 0.7067
PPV - ALL: 0.7425  COVID-19: 0.8824  PNEUMONIA: 0.6279  NORMAL: 0.7172 
RECALL - ALL: 0.7165  COVID-19: 0.6000  PNEUMONIA: 0.8100  NORMAL: 0.7396 
F1 - ALL: 0.7166  COVID-19: 0.7143  PNEUMONIA: 0.7074  NORMAL: 0.7282 

Epoch 2/19
----------
[train]
LOSS - 0.3380
ACC - 0.9600
PPV - ALL: 1.0000  COVID-19: 1.0000  PNEUMONIA: 1.0000  NORMAL: 1.0000 
RECALL - ALL: 1.0000  COVID-19: 1.0000  PNEUMONIA: 1.0000  NORMAL: 1.0000 
F1 - ALL: 1.0000  COVID-19: 1.0000  PNEUMONIA: 1.0000  NORMAL: 1.0000 
Mask ratio's range: 1.0 ~ 1.0

[val]
LOSS - 0.6948
ACC - 0.7533
PPV - ALL: 0.7762  COVID-19: 0.8784  PNEUMONIA: 0.7222  NORMAL: 0.7281 
RECALL - ALL: 0.7649  COVID-19: 0.6500  PNEUMONIA: 0.7800  NORMAL: 0.8646 
F1 - ALL: 0.7625  COVID-19: 0.7471  PNEUMONIA: 0.7500  NORMAL: 0.7905 

Epoch 3/19
----------
[train]
LOSS - 0.1336
ACC - 0.9600
PPV - ALL: 1.0000  COVID-19: 1.0000  PNEUMONIA: 1.0000  NORMAL: 1.0000 
RECALL - ALL: 1.0000  COVID-19: 1.0000  PNEUMONIA: 1.0000  NORMAL: 1.0000 
F1 - ALL: 1.0000  COVID-19: 1.0000  PNEUMONIA: 1.0000  NORMAL: 1.0000 
Mask ratio's range: 1.0 ~ 1.0

[val]
LOSS - 0.6002
ACC - 0.7833
PPV - ALL: 0.7972  COVID-19: 0.8409  PNEUMONIA: 0.7568  NORMAL: 0.7938 
RECALL - ALL: 0.7940  COVID-19: 0.7400  PNEUMONIA: 0.8400  NORMAL: 0.8021 
F1 - ALL: 0.7938  COVID-19: 0.7872  PNEUMONIA: 0.7962  NORMAL: 0.7979 

Epoch 4/19
----------
[train]
LOSS - 0.0564
ACC - 0.9600
PPV - ALL: 1.0000  COVID-19: 1.0000  PNEUMONIA: 1.0000  NORMAL: 1.0000 
RECALL - ALL: 1.0000  COVID-19: 1.0000  PNEUMONIA: 1.0000  NORMAL: 1.0000 
F1 - ALL: 1.0000  COVID-19: 1.0000  PNEUMONIA: 1.0000  NORMAL: 1.0000 
Mask ratio's range: 0.9375 ~ 1.0

[val]
LOSS - 0.5763
ACC - 0.7867
PPV - ALL: 0.8011  COVID-19: 0.8621  PNEUMONIA: 0.7570  NORMAL: 0.7843 
RECALL - ALL: 0.7978  COVID-19: 0.7500  PNEUMONIA: 0.8100  NORMAL: 0.8333 
F1 - ALL: 0.7976  COVID-19: 0.8022  PNEUMONIA: 0.7826  NORMAL: 0.8081 

Epoch 5/19
----------
[train]
LOSS - 0.0391
ACC - 0.9600
PPV - ALL: 1.0000  COVID-19: 1.0000  PNEUMONIA: 1.0000  NORMAL: 1.0000 
RECALL - ALL: 1.0000  COVID-19: 1.0000  PNEUMONIA: 1.0000  NORMAL: 1.0000 
F1 - ALL: 1.0000  COVID-19: 1.0000  PNEUMONIA: 1.0000  NORMAL: 1.0000 
Mask ratio's range: 0.9375 ~ 1.0

[val]
LOSS - 0.5654
ACC - 0.7900
PPV - ALL: 0.8040  COVID-19: 0.8636  PNEUMONIA: 0.7642  NORMAL: 0.7843 
RECALL - ALL: 0.8011  COVID-19: 0.7600  PNEUMONIA: 0.8100  NORMAL: 0.8333 
F1 - ALL: 0.8010  COVID-19: 0.8085  PNEUMONIA: 0.7864  NORMAL: 0.8081 

Epoch 6/19
----------
[train]
LOSS - 0.0398
ACC - 0.9600
PPV - ALL: 1.0000  COVID-19: 1.0000  PNEUMONIA: 1.0000  NORMAL: 1.0000 
RECALL - ALL: 1.0000  COVID-19: 1.0000  PNEUMONIA: 1.0000  NORMAL: 1.0000 
F1 - ALL: 1.0000  COVID-19: 1.0000  PNEUMONIA: 1.0000  NORMAL: 1.0000 
Mask ratio's range: 0.9375 ~ 1.0

[val]
LOSS - 0.5486
ACC - 0.7900
PPV - ALL: 0.8036  COVID-19: 0.8556  PNEUMONIA: 0.7593  NORMAL: 0.7959 
RECALL - ALL: 0.8008  COVID-19: 0.7700  PNEUMONIA: 0.8200  NORMAL: 0.8125 
F1 - ALL: 0.8010  COVID-19: 0.8105  PNEUMONIA: 0.7885  NORMAL: 0.8041 

Epoch 7/19
----------
[train]
LOSS - 0.0221
ACC - 0.9600
PPV - ALL: 1.0000  COVID-19: 1.0000  PNEUMONIA: 1.0000  NORMAL: 1.0000 
RECALL - ALL: 1.0000  COVID-19: 1.0000  PNEUMONIA: 1.0000  NORMAL: 1.0000 
F1 - ALL: 1.0000  COVID-19: 1.0000  PNEUMONIA: 1.0000  NORMAL: 1.0000 
Mask ratio's range: 0.9375 ~ 1.0

[val]
LOSS - 0.5364
ACC - 0.8000
PPV - ALL: 0.8137  COVID-19: 0.8667  PNEUMONIA: 0.7664  NORMAL: 0.8081 
RECALL - ALL: 0.8111  COVID-19: 0.7800  PNEUMONIA: 0.8200  NORMAL: 0.8333 
F1 - ALL: 0.8113  COVID-19: 0.8211  PNEUMONIA: 0.7923  NORMAL: 0.8205 

Epoch 8/19
----------
[train]
LOSS - 0.0220
ACC - 0.9600
PPV - ALL: 1.0000  COVID-19: 1.0000  PNEUMONIA: 1.0000  NORMAL: 1.0000 
RECALL - ALL: 1.0000  COVID-19: 1.0000  PNEUMONIA: 1.0000  NORMAL: 1.0000 
F1 - ALL: 1.0000  COVID-19: 1.0000  PNEUMONIA: 1.0000  NORMAL: 1.0000 
Mask ratio's range: 0.9375 ~ 1.0

[val]
LOSS - 0.5386
ACC - 0.7867
PPV - ALL: 0.8030  COVID-19: 0.8621  PNEUMONIA: 0.7345  NORMAL: 0.8125 
RECALL - ALL: 0.7975  COVID-19: 0.7500  PNEUMONIA: 0.8300  NORMAL: 0.8125 
F1 - ALL: 0.7980  COVID-19: 0.8022  PNEUMONIA: 0.7793  NORMAL: 0.8125 

Epoch 9/19
----------
[train]
LOSS - 0.0213
ACC - 0.9600
PPV - ALL: 1.0000  COVID-19: 1.0000  PNEUMONIA: 1.0000  NORMAL: 1.0000 
RECALL - ALL: 1.0000  COVID-19: 1.0000  PNEUMONIA: 1.0000  NORMAL: 1.0000 
F1 - ALL: 1.0000  COVID-19: 1.0000  PNEUMONIA: 1.0000  NORMAL: 1.0000 
Mask ratio's range: 0.875 ~ 1.0

[val]
LOSS - 0.5434
ACC - 0.7867
PPV - ALL: 0.8039  COVID-19: 0.8621  PNEUMONIA: 0.7304  NORMAL: 0.8191 
RECALL - ALL: 0.7974  COVID-19: 0.7500  PNEUMONIA: 0.8400  NORMAL: 0.8021 
F1 - ALL: 0.7980  COVID-19: 0.8022  PNEUMONIA: 0.7814  NORMAL: 0.8105 

Epoch 10/19
----------
[train]
LOSS - 0.0343
ACC - 0.9600
PPV - ALL: 1.0000  COVID-19: 1.0000  PNEUMONIA: 1.0000  NORMAL: 1.0000 
RECALL - ALL: 1.0000  COVID-19: 1.0000  PNEUMONIA: 1.0000  NORMAL: 1.0000 
F1 - ALL: 1.0000  COVID-19: 1.0000  PNEUMONIA: 1.0000  NORMAL: 1.0000 
Mask ratio's range: 0.875 ~ 0.9375

[val]
LOSS - 0.5430
ACC - 0.7767
PPV - ALL: 0.7963  COVID-19: 0.8554  PNEUMONIA: 0.7143  NORMAL: 0.8191 
RECALL - ALL: 0.7874  COVID-19: 0.7100  PNEUMONIA: 0.8500  NORMAL: 0.8021 
F1 - ALL: 0.7876  COVID-19: 0.7759  PNEUMONIA: 0.7763  NORMAL: 0.8105 

Epoch 11/19
----------
[train]
LOSS - 0.0420
ACC - 0.9600
PPV - ALL: 1.0000  COVID-19: 1.0000  PNEUMONIA: 1.0000  NORMAL: 1.0000 
RECALL - ALL: 1.0000  COVID-19: 1.0000  PNEUMONIA: 1.0000  NORMAL: 1.0000 
F1 - ALL: 1.0000  COVID-19: 1.0000  PNEUMONIA: 1.0000  NORMAL: 1.0000 
Mask ratio's range: 0.75 ~ 0.9375

[val]
LOSS - 0.5850
ACC - 0.7400
PPV - ALL: 0.7769  COVID-19: 0.8649  PNEUMONIA: 0.6423  NORMAL: 0.8235 
RECALL - ALL: 0.7497  COVID-19: 0.6400  PNEUMONIA: 0.8800  NORMAL: 0.7292 
F1 - ALL: 0.7506  COVID-19: 0.7356  PNEUMONIA: 0.7426  NORMAL: 0.7735 

Epoch 12/19
----------
[train]
LOSS - 0.0565
ACC - 0.9600
PPV - ALL: 1.0000  COVID-19: 1.0000  PNEUMONIA: 1.0000  NORMAL: 1.0000 
RECALL - ALL: 1.0000  COVID-19: 1.0000  PNEUMONIA: 1.0000  NORMAL: 1.0000 
F1 - ALL: 1.0000  COVID-19: 1.0000  PNEUMONIA: 1.0000  NORMAL: 1.0000 
Mask ratio's range: 0.6875 ~ 0.875

[val]
LOSS - 0.6162
ACC - 0.7200
PPV - ALL: 0.7701  COVID-19: 0.8406  PNEUMONIA: 0.6107  NORMAL: 0.8590 
RECALL - ALL: 0.7293  COVID-19: 0.5800  PNEUMONIA: 0.9100  NORMAL: 0.6979 
F1 - ALL: 0.7291  COVID-19: 0.6864  PNEUMONIA: 0.7309  NORMAL: 0.7701 

Epoch 13/19
----------
[train]
LOSS - 0.0454
ACC - 0.9600
PPV - ALL: 1.0000  COVID-19: 1.0000  PNEUMONIA: 1.0000  NORMAL: 1.0000 
RECALL - ALL: 1.0000  COVID-19: 1.0000  PNEUMONIA: 1.0000  NORMAL: 1.0000 
F1 - ALL: 1.0000  COVID-19: 1.0000  PNEUMONIA: 1.0000  NORMAL: 1.0000 
Mask ratio's range: 0.5625 ~ 0.875

[val]
LOSS - 0.6787
ACC - 0.6933
PPV - ALL: 0.7623  COVID-19: 0.8772  PNEUMONIA: 0.5723  NORMAL: 0.8375 
RECALL - ALL: 0.7026  COVID-19: 0.5000  PNEUMONIA: 0.9100  NORMAL: 0.6979 
F1 - ALL: 0.7003  COVID-19: 0.6369  PNEUMONIA: 0.7027  NORMAL: 0.7614 

Epoch 14/19
----------
[train]
LOSS - 0.0534
ACC - 0.9600
PPV - ALL: 1.0000  COVID-19: 1.0000  PNEUMONIA: 1.0000  NORMAL: 1.0000 
RECALL - ALL: 1.0000  COVID-19: 1.0000  PNEUMONIA: 1.0000  NORMAL: 1.0000 
F1 - ALL: 1.0000  COVID-19: 1.0000  PNEUMONIA: 1.0000  NORMAL: 1.0000 
Mask ratio's range: 0.5625 ~ 0.8125

[val]
LOSS - 0.7806
ACC - 0.6800
PPV - ALL: 0.7503  COVID-19: 0.8846  PNEUMONIA: 0.5687  NORMAL: 0.7976 
RECALL - ALL: 0.6893  COVID-19: 0.4600  PNEUMONIA: 0.9100  NORMAL: 0.6979 
F1 - ALL: 0.6832  COVID-19: 0.6053  PNEUMONIA: 0.7000  NORMAL: 0.7444 

Epoch 15/19
----------
[train]
LOSS - 0.0457
ACC - 0.9600
PPV - ALL: 1.0000  COVID-19: 1.0000  PNEUMONIA: 1.0000  NORMAL: 1.0000 
RECALL - ALL: 1.0000  COVID-19: 1.0000  PNEUMONIA: 1.0000  NORMAL: 1.0000 
F1 - ALL: 1.0000  COVID-19: 1.0000  PNEUMONIA: 1.0000  NORMAL: 1.0000 
Mask ratio's range: 0.5625 ~ 0.75

[val]
LOSS - 0.7595
ACC - 0.6867
PPV - ALL: 0.7542  COVID-19: 0.8704  PNEUMONIA: 0.5750  NORMAL: 0.8171 
RECALL - ALL: 0.6960  COVID-19: 0.4700  PNEUMONIA: 0.9200  NORMAL: 0.6979 
F1 - ALL: 0.6903  COVID-19: 0.6104  PNEUMONIA: 0.7077  NORMAL: 0.7528 

Epoch 16/19
----------
[train]
LOSS - 0.0551
ACC - 0.9600
PPV - ALL: 1.0000  COVID-19: 1.0000  PNEUMONIA: 1.0000  NORMAL: 1.0000 
RECALL - ALL: 1.0000  COVID-19: 1.0000  PNEUMONIA: 1.0000  NORMAL: 1.0000 
F1 - ALL: 1.0000  COVID-19: 1.0000  PNEUMONIA: 1.0000  NORMAL: 1.0000 
Mask ratio's range: 0.5625 ~ 0.75

[val]
LOSS - 0.8177
ACC - 0.6933
PPV - ALL: 0.7602  COVID-19: 0.8727  PNEUMONIA: 0.5786  NORMAL: 0.8293 
RECALL - ALL: 0.7028  COVID-19: 0.4800  PNEUMONIA: 0.9200  NORMAL: 0.7083 
F1 - ALL: 0.6979  COVID-19: 0.6193  PNEUMONIA: 0.7104  NORMAL: 0.7640 

Epoch 17/19
----------
[train]
LOSS - 0.0392
ACC - 0.9600
PPV - ALL: 1.0000  COVID-19: 1.0000  PNEUMONIA: 1.0000  NORMAL: 1.0000 
RECALL - ALL: 1.0000  COVID-19: 1.0000  PNEUMONIA: 1.0000  NORMAL: 1.0000 
F1 - ALL: 1.0000  COVID-19: 1.0000  PNEUMONIA: 1.0000  NORMAL: 1.0000 
Mask ratio's range: 0.5625 ~ 0.6875

[val]
LOSS - 0.7823
ACC - 0.6800
PPV - ALL: 0.7525  COVID-19: 0.8800  PNEUMONIA: 0.5679  NORMAL: 0.8095 
RECALL - ALL: 0.6894  COVID-19: 0.4400  PNEUMONIA: 0.9200  NORMAL: 0.7083 
F1 - ALL: 0.6815  COVID-19: 0.5867  PNEUMONIA: 0.7023  NORMAL: 0.7555 

Epoch 18/19
----------
[train]
LOSS - 0.0395
ACC - 0.9600
PPV - ALL: 1.0000  COVID-19: 1.0000  PNEUMONIA: 1.0000  NORMAL: 1.0000 
RECALL - ALL: 1.0000  COVID-19: 1.0000  PNEUMONIA: 1.0000  NORMAL: 1.0000 
F1 - ALL: 1.0000  COVID-19: 1.0000  PNEUMONIA: 1.0000  NORMAL: 1.0000 
Mask ratio's range: 0.5 ~ 0.6875

[val]
LOSS - 0.7776
ACC - 0.6800
PPV - ALL: 0.7547  COVID-19: 0.8776  PNEUMONIA: 0.5671  NORMAL: 0.8193 
RECALL - ALL: 0.6894  COVID-19: 0.4300  PNEUMONIA: 0.9300  NORMAL: 0.7083 
F1 - ALL: 0.6805  COVID-19: 0.5772  PNEUMONIA: 0.7046  NORMAL: 0.7598 

Epoch 19/19
----------
[train]
LOSS - 0.0497
ACC - 0.9600
PPV - ALL: 1.0000  COVID-19: 1.0000  PNEUMONIA: 1.0000  NORMAL: 1.0000 
RECALL - ALL: 1.0000  COVID-19: 1.0000  PNEUMONIA: 1.0000  NORMAL: 1.0000 
F1 - ALL: 1.0000  COVID-19: 1.0000  PNEUMONIA: 1.0000  NORMAL: 1.0000 
Mask ratio's range: 0.5 ~ 0.6875

[val]
LOSS - 0.7949
ACC - 0.6833
PPV - ALL: 0.7545  COVID-19: 0.8776  PNEUMONIA: 0.5741  NORMAL: 0.8118 
RECALL - ALL: 0.6929  COVID-19: 0.4300  PNEUMONIA: 0.9300  NORMAL: 0.7188 
F1 - ALL: 0.6832  COVID-19: 0.5772  PNEUMONIA: 0.7099  NORMAL: 0.7625 


--------------------
[Best results]
ACC - 0.8000
PPV - ALL: 0.8137  COVID-19: 0.8667  PNEUMONIA: 0.7664  NORMAL: 0.8081 
RECALL - ALL: 0.8111  COVID-19: 0.7800  PNEUMONIA: 0.8200  NORMAL: 0.8333 
F1 - ALL: 0.8113  COVID-19: 0.8211  PNEUMONIA: 0.7923  NORMAL: 0.8205 

Training complete in 1m 31s
-------------------- 

--------------------
Model 2
--------------------

Epoch 0/19
----------
[train]
LOSS - 1.0195
ACC - 0.4133
PPV - ALL: 0.4462  COVID-19: 0.3214  PNEUMONIA: 0.5556  NORMAL: 0.4615 
RECALL - ALL: 0.4306  COVID-19: 0.3750  PNEUMONIA: 0.4167  NORMAL: 0.5000 
F1 - ALL: 0.4341  COVID-19: 0.3461  PNEUMONIA: 0.4762  NORMAL: 0.4800 
Mask ratio's range: 1.0 ~ 1.0

[val]
LOSS - 0.9858
ACC - 0.5500
PPV - ALL: 0.7028  COVID-19: 1.0000  PNEUMONIA: 0.5743  NORMAL: 0.5342 
RECALL - ALL: 0.5608  COVID-19: 0.0200  PNEUMONIA: 0.8500  NORMAL: 0.8125 
F1 - ALL: 0.4564  COVID-19: 0.0392  PNEUMONIA: 0.6855  NORMAL: 0.6446 

Epoch 1/19
----------
[train]
LOSS - 0.6956
ACC - 0.8533
PPV - ALL: 0.9013  COVID-19: 0.9474  PNEUMONIA: 0.9565  NORMAL: 0.8000 
RECALL - ALL: 0.8889  COVID-19: 0.7500  PNEUMONIA: 0.9167  NORMAL: 1.0000 
F1 - ALL: 0.8874  COVID-19: 0.8372  PNEUMONIA: 0.9362  NORMAL: 0.8889 
Mask ratio's range: 1.0 ~ 1.0

[val]
LOSS - 0.7608
ACC - 0.7767
PPV - ALL: 0.7914  COVID-19: 0.7615  PNEUMONIA: 0.8434  NORMAL: 0.7692 
RECALL - ALL: 0.7878  COVID-19: 0.8300  PNEUMONIA: 0.7000  NORMAL: 0.8333 
F1 - ALL: 0.7864  COVID-19: 0.7943  PNEUMONIA: 0.7650  NORMAL: 0.8000 

Epoch 2/19
----------
[train]
LOSS - 0.2863
ACC - 0.9600
PPV - ALL: 1.0000  COVID-19: 1.0000  PNEUMONIA: 1.0000  NORMAL: 1.0000 
RECALL - ALL: 1.0000  COVID-19: 1.0000  PNEUMONIA: 1.0000  NORMAL: 1.0000 
F1 - ALL: 1.0000  COVID-19: 1.0000  PNEUMONIA: 1.0000  NORMAL: 1.0000 
Mask ratio's range: 1.0 ~ 1.0

[val]
LOSS - 0.6003
ACC - 0.7700
PPV - ALL: 0.8044  COVID-19: 0.9394  PNEUMONIA: 0.7097  NORMAL: 0.7642 
RECALL - ALL: 0.7813  COVID-19: 0.6200  PNEUMONIA: 0.8800  NORMAL: 0.8438 
F1 - ALL: 0.7782  COVID-19: 0.7470  PNEUMONIA: 0.7857  NORMAL: 0.8020 

Epoch 3/19
----------
[train]
LOSS - 0.1051
ACC - 0.9600
PPV - ALL: 1.0000  COVID-19: 1.0000  PNEUMONIA: 1.0000  NORMAL: 1.0000 
RECALL - ALL: 1.0000  COVID-19: 1.0000  PNEUMONIA: 1.0000  NORMAL: 1.0000 
F1 - ALL: 1.0000  COVID-19: 1.0000  PNEUMONIA: 1.0000  NORMAL: 1.0000 
Mask ratio's range: 1.0 ~ 1.0

[val]
LOSS - 0.5159
ACC - 0.8067
PPV - ALL: 0.8174  COVID-19: 0.8350  PNEUMONIA: 0.8020  NORMAL: 0.8152 
RECALL - ALL: 0.8171  COVID-19: 0.8600  PNEUMONIA: 0.8100  NORMAL: 0.7812 
F1 - ALL: 0.8170  COVID-19: 0.8473  PNEUMONIA: 0.8060  NORMAL: 0.7978 

Epoch 4/19
----------
[train]
LOSS - 0.0489
ACC - 0.9600
PPV - ALL: 1.0000  COVID-19: 1.0000  PNEUMONIA: 1.0000  NORMAL: 1.0000 
RECALL - ALL: 1.0000  COVID-19: 1.0000  PNEUMONIA: 1.0000  NORMAL: 1.0000 
F1 - ALL: 1.0000  COVID-19: 1.0000  PNEUMONIA: 1.0000  NORMAL: 1.0000 
Mask ratio's range: 0.9375 ~ 1.0

[val]
LOSS - 0.5245
ACC - 0.8233
PPV - ALL: 0.8374  COVID-19: 0.8913  PNEUMONIA: 0.7928  NORMAL: 0.8280 
RECALL - ALL: 0.8340  COVID-19: 0.8200  PNEUMONIA: 0.8800  NORMAL: 0.8021 
F1 - ALL: 0.8344  COVID-19: 0.8542  PNEUMONIA: 0.8341  NORMAL: 0.8148 

Epoch 5/19
----------
[train]
LOSS - 0.0632
ACC - 0.9600
PPV - ALL: 1.0000  COVID-19: 1.0000  PNEUMONIA: 1.0000  NORMAL: 1.0000 
RECALL - ALL: 1.0000  COVID-19: 1.0000  PNEUMONIA: 1.0000  NORMAL: 1.0000 
F1 - ALL: 1.0000  COVID-19: 1.0000  PNEUMONIA: 1.0000  NORMAL: 1.0000 
Mask ratio's range: 0.8125 ~ 1.0

[val]
LOSS - 0.5716
ACC - 0.7933
PPV - ALL: 0.8102  COVID-19: 0.8824  PNEUMONIA: 0.7544  NORMAL: 0.7938 
RECALL - ALL: 0.8040  COVID-19: 0.7500  PNEUMONIA: 0.8600  NORMAL: 0.8021 
F1 - ALL: 0.8041  COVID-19: 0.8108  PNEUMONIA: 0.8037  NORMAL: 0.7979 

Epoch 6/19
----------
[train]
LOSS - 0.0456
ACC - 0.9600
PPV - ALL: 1.0000  COVID-19: 1.0000  PNEUMONIA: 1.0000  NORMAL: 1.0000 
RECALL - ALL: 1.0000  COVID-19: 1.0000  PNEUMONIA: 1.0000  NORMAL: 1.0000 
F1 - ALL: 1.0000  COVID-19: 1.0000  PNEUMONIA: 1.0000  NORMAL: 1.0000 
Mask ratio's range: 0.75 ~ 1.0

[val]
LOSS - 0.5380
ACC - 0.8233
PPV - ALL: 0.8404  COVID-19: 0.9302  PNEUMONIA: 0.7909  NORMAL: 0.8000 
RECALL - ALL: 0.8344  COVID-19: 0.8000  PNEUMONIA: 0.8700  NORMAL: 0.8333 
F1 - ALL: 0.8350  COVID-19: 0.8602  PNEUMONIA: 0.8286  NORMAL: 0.8163 

Epoch 7/19
----------
[train]
LOSS - 0.0522
ACC - 0.9600
PPV - ALL: 1.0000  COVID-19: 1.0000  PNEUMONIA: 1.0000  NORMAL: 1.0000 
RECALL - ALL: 1.0000  COVID-19: 1.0000  PNEUMONIA: 1.0000  NORMAL: 1.0000 
F1 - ALL: 1.0000  COVID-19: 1.0000  PNEUMONIA: 1.0000  NORMAL: 1.0000 
Mask ratio's range: 0.75 ~ 0.9375

[val]
LOSS - 0.4953
ACC - 0.8133
PPV - ALL: 0.8346  COVID-19: 0.9506  PNEUMONIA: 0.7963  NORMAL: 0.7570 
RECALL - ALL: 0.8246  COVID-19: 0.7700  PNEUMONIA: 0.8600  NORMAL: 0.8438 
F1 - ALL: 0.8252  COVID-19: 0.8508  PNEUMONIA: 0.8269  NORMAL: 0.7980 

Epoch 8/19
----------
[train]
LOSS - 0.0556
ACC - 0.9600
PPV - ALL: 1.0000  COVID-19: 1.0000  PNEUMONIA: 1.0000  NORMAL: 1.0000 
RECALL - ALL: 1.0000  COVID-19: 1.0000  PNEUMONIA: 1.0000  NORMAL: 1.0000 
F1 - ALL: 1.0000  COVID-19: 1.0000  PNEUMONIA: 1.0000  NORMAL: 1.0000 
Mask ratio's range: 0.75 ~ 0.9375

[val]
LOSS - 0.4846
ACC - 0.8100
PPV - ALL: 0.8329  COVID-19: 0.9494  PNEUMONIA: 0.8037  NORMAL: 0.7455 
RECALL - ALL: 0.8214  COVID-19: 0.7500  PNEUMONIA: 0.8600  NORMAL: 0.8542 
F1 - ALL: 0.8217  COVID-19: 0.8380  PNEUMONIA: 0.8309  NORMAL: 0.7962 

Epoch 9/19
----------
[train]
LOSS - 0.0469
ACC - 0.9600
PPV - ALL: 1.0000  COVID-19: 1.0000  PNEUMONIA: 1.0000  NORMAL: 1.0000 
RECALL - ALL: 1.0000  COVID-19: 1.0000  PNEUMONIA: 1.0000  NORMAL: 1.0000 
F1 - ALL: 1.0000  COVID-19: 1.0000  PNEUMONIA: 1.0000  NORMAL: 1.0000 
Mask ratio's range: 0.6875 ~ 0.875

[val]
LOSS - 0.4956
ACC - 0.8100
PPV - ALL: 0.8331  COVID-19: 0.9487  PNEUMONIA: 0.7982  NORMAL: 0.7523 
RECALL - ALL: 0.8214  COVID-19: 0.7400  PNEUMONIA: 0.8700  NORMAL: 0.8542 
F1 - ALL: 0.8214  COVID-19: 0.8315  PNEUMONIA: 0.8326  NORMAL: 0.8000 

Epoch 10/19
----------
[train]
LOSS - 0.0857
ACC - 0.9600
PPV - ALL: 1.0000  COVID-19: 1.0000  PNEUMONIA: 1.0000  NORMAL: 1.0000 
RECALL - ALL: 1.0000  COVID-19: 1.0000  PNEUMONIA: 1.0000  NORMAL: 1.0000 
F1 - ALL: 1.0000  COVID-19: 1.0000  PNEUMONIA: 1.0000  NORMAL: 1.0000 
Mask ratio's range: 0.625 ~ 0.8125

[val]
LOSS - 0.5101
ACC - 0.8200
PPV - ALL: 0.8467  COVID-19: 0.9600  PNEUMONIA: 0.8365  NORMAL: 0.7436 
RECALL - ALL: 0.8321  COVID-19: 0.7200  PNEUMONIA: 0.8700  NORMAL: 0.9062 
F1 - ALL: 0.8309  COVID-19: 0.8229  PNEUMONIA: 0.8529  NORMAL: 0.8169 

Epoch 11/19
----------
[train]
LOSS - 0.0863
ACC - 0.9600
PPV - ALL: 1.0000  COVID-19: 1.0000  PNEUMONIA: 1.0000  NORMAL: 1.0000 
RECALL - ALL: 1.0000  COVID-19: 1.0000  PNEUMONIA: 1.0000  NORMAL: 1.0000 
F1 - ALL: 1.0000  COVID-19: 1.0000  PNEUMONIA: 1.0000  NORMAL: 1.0000 
Mask ratio's range: 0.5625 ~ 0.8125

[val]
LOSS - 0.5745
ACC - 0.7667
PPV - ALL: 0.8058  COVID-19: 0.9508  PNEUMONIA: 0.7699  NORMAL: 0.6967 
RECALL - ALL: 0.7785  COVID-19: 0.5800  PNEUMONIA: 0.8700  NORMAL: 0.8854 
F1 - ALL: 0.7724  COVID-19: 0.7205  PNEUMONIA: 0.8169  NORMAL: 0.7798 

Epoch 12/19
----------
[train]
LOSS - 0.0830
ACC - 0.9600
PPV - ALL: 1.0000  COVID-19: 1.0000  PNEUMONIA: 1.0000  NORMAL: 1.0000 
RECALL - ALL: 1.0000  COVID-19: 1.0000  PNEUMONIA: 1.0000  NORMAL: 1.0000 
F1 - ALL: 1.0000  COVID-19: 1.0000  PNEUMONIA: 1.0000  NORMAL: 1.0000 
Mask ratio's range: 0.5 ~ 0.8125

[val]
LOSS - 0.5937
ACC - 0.7600
PPV - ALL: 0.8044  COVID-19: 0.9655  PNEUMONIA: 0.7565  NORMAL: 0.6911 
RECALL - ALL: 0.7718  COVID-19: 0.5600  PNEUMONIA: 0.8700  NORMAL: 0.8854 
F1 - ALL: 0.7648  COVID-19: 0.7089  PNEUMONIA: 0.8093  NORMAL: 0.7763 

Epoch 13/19
----------
[train]
LOSS - 0.0746
ACC - 0.9600
PPV - ALL: 1.0000  COVID-19: 1.0000  PNEUMONIA: 1.0000  NORMAL: 1.0000 
RECALL - ALL: 1.0000  COVID-19: 1.0000  PNEUMONIA: 1.0000  NORMAL: 1.0000 
F1 - ALL: 1.0000  COVID-19: 1.0000  PNEUMONIA: 1.0000  NORMAL: 1.0000 
Mask ratio's range: 0.4375 ~ 0.8125

[val]
LOSS - 0.5815
ACC - 0.7867
PPV - ALL: 0.8238  COVID-19: 0.9692  PNEUMONIA: 0.7890  NORMAL: 0.7131 
RECALL - ALL: 0.7987  COVID-19: 0.6300  PNEUMONIA: 0.8600  NORMAL: 0.9062 
F1 - ALL: 0.7949  COVID-19: 0.7636  PNEUMONIA: 0.8230  NORMAL: 0.7981 

Epoch 14/19
----------
[train]
LOSS - 0.0515
ACC - 0.9600
PPV - ALL: 1.0000  COVID-19: 1.0000  PNEUMONIA: 1.0000  NORMAL: 1.0000 
RECALL - ALL: 1.0000  COVID-19: 1.0000  PNEUMONIA: 1.0000  NORMAL: 1.0000 
F1 - ALL: 1.0000  COVID-19: 1.0000  PNEUMONIA: 1.0000  NORMAL: 1.0000 
Mask ratio's range: 0.4375 ~ 0.8125

[val]
LOSS - 0.5935
ACC - 0.7767
PPV - ALL: 0.8183  COVID-19: 0.9667  PNEUMONIA: 0.7818  NORMAL: 0.7063 
RECALL - ALL: 0.7890  COVID-19: 0.5800  PNEUMONIA: 0.8600  NORMAL: 0.9271 
F1 - ALL: 0.7819  COVID-19: 0.7250  PNEUMONIA: 0.8190  NORMAL: 0.8018 

Epoch 15/19
----------
[train]
LOSS - 0.0452
ACC - 0.9600
PPV - ALL: 1.0000  COVID-19: 1.0000  PNEUMONIA: 1.0000  NORMAL: 1.0000 
RECALL - ALL: 1.0000  COVID-19: 1.0000  PNEUMONIA: 1.0000  NORMAL: 1.0000 
F1 - ALL: 1.0000  COVID-19: 1.0000  PNEUMONIA: 1.0000  NORMAL: 1.0000 
Mask ratio's range: 0.4375 ~ 0.8125

[val]
LOSS - 0.6148
ACC - 0.7633
PPV - ALL: 0.8083  COVID-19: 0.9643  PNEUMONIA: 0.7565  NORMAL: 0.7040 
RECALL - ALL: 0.7756  COVID-19: 0.5400  PNEUMONIA: 0.8700  NORMAL: 0.9167 
F1 - ALL: 0.7660  COVID-19: 0.6923  PNEUMONIA: 0.8093  NORMAL: 0.7964 

Epoch 16/19
----------
[train]
LOSS - 0.0336
ACC - 0.9600
PPV - ALL: 1.0000  COVID-19: 1.0000  PNEUMONIA: 1.0000  NORMAL: 1.0000 
RECALL - ALL: 1.0000  COVID-19: 1.0000  PNEUMONIA: 1.0000  NORMAL: 1.0000 
F1 - ALL: 1.0000  COVID-19: 1.0000  PNEUMONIA: 1.0000  NORMAL: 1.0000 
Mask ratio's range: 0.4375 ~ 0.8125

[val]
LOSS - 0.6028
ACC - 0.7700
PPV - ALL: 0.8119  COVID-19: 0.9661  PNEUMONIA: 0.7565  NORMAL: 0.7131 
RECALL - ALL: 0.7821  COVID-19: 0.5700  PNEUMONIA: 0.8700  NORMAL: 0.9062 
F1 - ALL: 0.7748  COVID-19: 0.7170  PNEUMONIA: 0.8093  NORMAL: 0.7981 

Epoch 17/19
----------
[train]
LOSS - 0.0379
ACC - 0.9600
PPV - ALL: 1.0000  COVID-19: 1.0000  PNEUMONIA: 1.0000  NORMAL: 1.0000 
RECALL - ALL: 1.0000  COVID-19: 1.0000  PNEUMONIA: 1.0000  NORMAL: 1.0000 
F1 - ALL: 1.0000  COVID-19: 1.0000  PNEUMONIA: 1.0000  NORMAL: 1.0000 
Mask ratio's range: 0.375 ~ 0.75

[val]
LOSS - 0.6108
ACC - 0.7733
PPV - ALL: 0.8137  COVID-19: 0.9672  PNEUMONIA: 0.7632  NORMAL: 0.7107 
RECALL - ALL: 0.7853  COVID-19: 0.5900  PNEUMONIA: 0.8700  NORMAL: 0.8958 
F1 - ALL: 0.7795  COVID-19: 0.7329  PNEUMONIA: 0.8131  NORMAL: 0.7926 

Epoch 18/19
----------
[train]
LOSS - 0.0417
ACC - 0.9600
PPV - ALL: 1.0000  COVID-19: 1.0000  PNEUMONIA: 1.0000  NORMAL: 1.0000 
RECALL - ALL: 1.0000  COVID-19: 1.0000  PNEUMONIA: 1.0000  NORMAL: 1.0000 
F1 - ALL: 1.0000  COVID-19: 1.0000  PNEUMONIA: 1.0000  NORMAL: 1.0000 
Mask ratio's range: 0.375 ~ 0.6875

[val]
LOSS - 0.6347
ACC - 0.7533
PPV - ALL: 0.7993  COVID-19: 0.9643  PNEUMONIA: 0.7311  NORMAL: 0.7025 
RECALL - ALL: 0.7651  COVID-19: 0.5400  PNEUMONIA: 0.8700  NORMAL: 0.8854 
F1 - ALL: 0.7567  COVID-19: 0.6923  PNEUMONIA: 0.7945  NORMAL: 0.7834 

Epoch 19/19
----------
[train]
LOSS - 0.0411
ACC - 0.9600
PPV - ALL: 1.0000  COVID-19: 1.0000  PNEUMONIA: 1.0000  NORMAL: 1.0000 
RECALL - ALL: 1.0000  COVID-19: 1.0000  PNEUMONIA: 1.0000  NORMAL: 1.0000 
F1 - ALL: 1.0000  COVID-19: 1.0000  PNEUMONIA: 1.0000  NORMAL: 1.0000 
Mask ratio's range: 0.375 ~ 0.625

[val]
LOSS - 0.6821
ACC - 0.7500
PPV - ALL: 0.7976  COVID-19: 0.9630  PNEUMONIA: 0.7190  NORMAL: 0.7107 
RECALL - ALL: 0.7619  COVID-19: 0.5200  PNEUMONIA: 0.8700  NORMAL: 0.8958 
F1 - ALL: 0.7517  COVID-19: 0.6753  PNEUMONIA: 0.7873  NORMAL: 0.7926 


--------------------
[Best results]
ACC - 0.8233
PPV - ALL: 0.8374  COVID-19: 0.8913  PNEUMONIA: 0.7928  NORMAL: 0.8280 
RECALL - ALL: 0.8340  COVID-19: 0.8200  PNEUMONIA: 0.8800  NORMAL: 0.8021 
F1 - ALL: 0.8344  COVID-19: 0.8542  PNEUMONIA: 0.8341  NORMAL: 0.8148 

Training complete in 1m 29s
-------------------- 

--------------------
Model 3
--------------------

Epoch 0/19
----------
[train]
LOSS - 0.9902
ACC - 0.5333
PPV - ALL: 0.5548  COVID-19: 0.5714  PNEUMONIA: 0.5217  NORMAL: 0.5714 
RECALL - ALL: 0.5556  COVID-19: 0.5000  PNEUMONIA: 0.5000  NORMAL: 0.6667 
F1 - ALL: 0.5531  COVID-19: 0.5333  PNEUMONIA: 0.5106  NORMAL: 0.6154 
Mask ratio's range: 1.0 ~ 1.0

[val]
LOSS - 0.9684
ACC - 0.5367
PPV - ALL: 0.6399  COVID-19: 0.8684  PNEUMONIA: 0.5882  NORMAL: 0.4632 
RECALL - ALL: 0.5489  COVID-19: 0.3300  PNEUMONIA: 0.4000  NORMAL: 0.9167 
F1 - ALL: 0.5233  COVID-19: 0.4783  PNEUMONIA: 0.4762  NORMAL: 0.6154 

Epoch 1/19
----------
[train]
LOSS - 0.6022
ACC - 0.8933
PPV - ALL: 0.9363  COVID-19: 1.0000  PNEUMONIA: 0.9200  NORMAL: 0.8889 
RECALL - ALL: 0.9305  COVID-19: 0.8333  PNEUMONIA: 0.9583  NORMAL: 1.0000 
F1 - ALL: 0.9297  COVID-19: 0.9091  PNEUMONIA: 0.9388  NORMAL: 0.9412 
Mask ratio's range: 1.0 ~ 1.0

[val]
LOSS - 0.7117
ACC - 0.7867
PPV - ALL: 0.8022  COVID-19: 0.8690  PNEUMONIA: 0.7757  NORMAL: 0.7619 
RECALL - ALL: 0.7978  COVID-19: 0.7300  PNEUMONIA: 0.8300  NORMAL: 0.8333 
F1 - ALL: 0.7971  COVID-19: 0.7935  PNEUMONIA: 0.8019  NORMAL: 0.7960 

Epoch 2/19
----------
[train]
LOSS - 0.2429
ACC - 0.9600
PPV - ALL: 1.0000  COVID-19: 1.0000  PNEUMONIA: 1.0000  NORMAL: 1.0000 
RECALL - ALL: 1.0000  COVID-19: 1.0000  PNEUMONIA: 1.0000  NORMAL: 1.0000 
F1 - ALL: 1.0000  COVID-19: 1.0000  PNEUMONIA: 1.0000  NORMAL: 1.0000 
Mask ratio's range: 1.0 ~ 1.0

[val]
LOSS - 0.5699
ACC - 0.8233
PPV - ALL: 0.8362  COVID-19: 0.8660  PNEUMONIA: 0.7982  NORMAL: 0.8444 
RECALL - ALL: 0.8339  COVID-19: 0.8400  PNEUMONIA: 0.8700  NORMAL: 0.7917 
F1 - ALL: 0.8342  COVID-19: 0.8528  PNEUMONIA: 0.8326  NORMAL: 0.8172 

Epoch 3/19
----------
[train]
LOSS - 0.0866
ACC - 0.9600
PPV - ALL: 1.0000  COVID-19: 1.0000  PNEUMONIA: 1.0000  NORMAL: 1.0000 
RECALL - ALL: 1.0000  COVID-19: 1.0000  PNEUMONIA: 1.0000  NORMAL: 1.0000 
F1 - ALL: 1.0000  COVID-19: 1.0000  PNEUMONIA: 1.0000  NORMAL: 1.0000 
Mask ratio's range: 1.0 ~ 1.0

[val]
LOSS - 0.4983
ACC - 0.8167
PPV - ALL: 0.8292  COVID-19: 0.8485  PNEUMONIA: 0.7963  NORMAL: 0.8427 
RECALL - ALL: 0.8271  COVID-19: 0.8400  PNEUMONIA: 0.8600  NORMAL: 0.7812 
F1 - ALL: 0.8273  COVID-19: 0.8442  PNEUMONIA: 0.8269  NORMAL: 0.8108 

Epoch 4/19
----------
[train]
LOSS - 0.0367
ACC - 0.9600
PPV - ALL: 1.0000  COVID-19: 1.0000  PNEUMONIA: 1.0000  NORMAL: 1.0000 
RECALL - ALL: 1.0000  COVID-19: 1.0000  PNEUMONIA: 1.0000  NORMAL: 1.0000 
F1 - ALL: 1.0000  COVID-19: 1.0000  PNEUMONIA: 1.0000  NORMAL: 1.0000 
Mask ratio's range: 1.0 ~ 1.0

[val]
LOSS - 0.4677
ACC - 0.8200
PPV - ALL: 0.8329  COVID-19: 0.8500  PNEUMONIA: 0.7963  NORMAL: 0.8523 
RECALL - ALL: 0.8304  COVID-19: 0.8500  PNEUMONIA: 0.8600  NORMAL: 0.7812 
F1 - ALL: 0.8307  COVID-19: 0.8500  PNEUMONIA: 0.8269  NORMAL: 0.8152 

Epoch 5/19
----------
[train]
LOSS - 0.0418
ACC - 0.9600
PPV - ALL: 1.0000  COVID-19: 1.0000  PNEUMONIA: 1.0000  NORMAL: 1.0000 
RECALL - ALL: 1.0000  COVID-19: 1.0000  PNEUMONIA: 1.0000  NORMAL: 1.0000 
F1 - ALL: 1.0000  COVID-19: 1.0000  PNEUMONIA: 1.0000  NORMAL: 1.0000 
Mask ratio's range: 0.8125 ~ 1.0

[val]
LOSS - 0.4516
ACC - 0.8233
PPV - ALL: 0.8358  COVID-19: 0.8515  PNEUMONIA: 0.8019  NORMAL: 0.8539 
RECALL - ALL: 0.8339  COVID-19: 0.8600  PNEUMONIA: 0.8500  NORMAL: 0.7917 
F1 - ALL: 0.8342  COVID-19: 0.8557  PNEUMONIA: 0.8252  NORMAL: 0.8216 

Epoch 6/19
----------
[train]
LOSS - 0.0376
ACC - 0.9600
PPV - ALL: 1.0000  COVID-19: 1.0000  PNEUMONIA: 1.0000  NORMAL: 1.0000 
RECALL - ALL: 1.0000  COVID-19: 1.0000  PNEUMONIA: 1.0000  NORMAL: 1.0000 
F1 - ALL: 1.0000  COVID-19: 1.0000  PNEUMONIA: 1.0000  NORMAL: 1.0000 
Mask ratio's range: 0.75 ~ 1.0

[val]
LOSS - 0.4443
ACC - 0.8233
PPV - ALL: 0.8362  COVID-19: 0.8571  PNEUMONIA: 0.7944  NORMAL: 0.8571 
RECALL - ALL: 0.8342  COVID-19: 0.8400  PNEUMONIA: 0.8500  NORMAL: 0.8125 
F1 - ALL: 0.8347  COVID-19: 0.8485  PNEUMONIA: 0.8213  NORMAL: 0.8342 

Epoch 7/19
----------
[train]
LOSS - 0.0735
ACC - 0.9600
PPV - ALL: 1.0000  COVID-19: 1.0000  PNEUMONIA: 1.0000  NORMAL: 1.0000 
RECALL - ALL: 1.0000  COVID-19: 1.0000  PNEUMONIA: 1.0000  NORMAL: 1.0000 
F1 - ALL: 1.0000  COVID-19: 1.0000  PNEUMONIA: 1.0000  NORMAL: 1.0000 
Mask ratio's range: 0.6875 ~ 0.9375

[val]
LOSS - 0.4345
ACC - 0.8133
PPV - ALL: 0.8269  COVID-19: 0.8602  PNEUMONIA: 0.7818  NORMAL: 0.8387 
RECALL - ALL: 0.8242  COVID-19: 0.8000  PNEUMONIA: 0.8600  NORMAL: 0.8125 
F1 - ALL: 0.8245  COVID-19: 0.8290  PNEUMONIA: 0.8190  NORMAL: 0.8254 

Epoch 8/19
----------
[train]
LOSS - 0.1038
ACC - 0.9600
PPV - ALL: 1.0000  COVID-19: 1.0000  PNEUMONIA: 1.0000  NORMAL: 1.0000 
RECALL - ALL: 1.0000  COVID-19: 1.0000  PNEUMONIA: 1.0000  NORMAL: 1.0000 
F1 - ALL: 1.0000  COVID-19: 1.0000  PNEUMONIA: 1.0000  NORMAL: 1.0000 
Mask ratio's range: 0.625 ~ 0.9375

[val]
LOSS - 0.4625
ACC - 0.8033
PPV - ALL: 0.8253  COVID-19: 0.9231  PNEUMONIA: 0.7627  NORMAL: 0.7900 
RECALL - ALL: 0.8143  COVID-19: 0.7200  PNEUMONIA: 0.9000  NORMAL: 0.8229 
F1 - ALL: 0.8136  COVID-19: 0.8090  PNEUMONIA: 0.8257  NORMAL: 0.8061 

Epoch 9/19
----------
[train]
LOSS - 0.0698
ACC - 0.9600
PPV - ALL: 1.0000  COVID-19: 1.0000  PNEUMONIA: 1.0000  NORMAL: 1.0000 
RECALL - ALL: 1.0000  COVID-19: 1.0000  PNEUMONIA: 1.0000  NORMAL: 1.0000 
F1 - ALL: 1.0000  COVID-19: 1.0000  PNEUMONIA: 1.0000  NORMAL: 1.0000 
Mask ratio's range: 0.5625 ~ 0.875

[val]
LOSS - 0.5094
ACC - 0.7967
PPV - ALL: 0.8304  COVID-19: 0.9710  PNEUMONIA: 0.7360  NORMAL: 0.7843 
RECALL - ALL: 0.8078  COVID-19: 0.6700  PNEUMONIA: 0.9200  NORMAL: 0.8333 
F1 - ALL: 0.8063  COVID-19: 0.7929  PNEUMONIA: 0.8178  NORMAL: 0.8081 

Epoch 10/19
----------
[train]
LOSS - 0.0701
ACC - 0.9600
PPV - ALL: 1.0000  COVID-19: 1.0000  PNEUMONIA: 1.0000  NORMAL: 1.0000 
RECALL - ALL: 1.0000  COVID-19: 1.0000  PNEUMONIA: 1.0000  NORMAL: 1.0000 
F1 - ALL: 1.0000  COVID-19: 1.0000  PNEUMONIA: 1.0000  NORMAL: 1.0000 
Mask ratio's range: 0.5625 ~ 0.8125

[val]
LOSS - 0.5465
ACC - 0.7800
PPV - ALL: 0.8158  COVID-19: 0.9701  PNEUMONIA: 0.7295  NORMAL: 0.7477 
RECALL - ALL: 0.7911  COVID-19: 0.6500  PNEUMONIA: 0.8900  NORMAL: 0.8333 
F1 - ALL: 0.7895  COVID-19: 0.7784  PNEUMONIA: 0.8018  NORMAL: 0.7882 

Epoch 11/19
----------
[train]
LOSS - 0.0510
ACC - 0.9600
PPV - ALL: 1.0000  COVID-19: 1.0000  PNEUMONIA: 1.0000  NORMAL: 1.0000 
RECALL - ALL: 1.0000  COVID-19: 1.0000  PNEUMONIA: 1.0000  NORMAL: 1.0000 
F1 - ALL: 1.0000  COVID-19: 1.0000  PNEUMONIA: 1.0000  NORMAL: 1.0000 
Mask ratio's range: 0.5625 ~ 0.75

[val]
LOSS - 0.5513
ACC - 0.7833
PPV - ALL: 0.8218  COVID-19: 0.9848  PNEUMONIA: 0.7258  NORMAL: 0.7547 
RECALL - ALL: 0.7944  COVID-19: 0.6500  PNEUMONIA: 0.9000  NORMAL: 0.8333 
F1 - ALL: 0.7929  COVID-19: 0.7831  PNEUMONIA: 0.8036  NORMAL: 0.7921 

Epoch 12/19
----------
[train]
LOSS - 0.0566
ACC - 0.9600
PPV - ALL: 1.0000  COVID-19: 1.0000  PNEUMONIA: 1.0000  NORMAL: 1.0000 
RECALL - ALL: 1.0000  COVID-19: 1.0000  PNEUMONIA: 1.0000  NORMAL: 1.0000 
F1 - ALL: 1.0000  COVID-19: 1.0000  PNEUMONIA: 1.0000  NORMAL: 1.0000 
Mask ratio's range: 0.5 ~ 0.6875

[val]
LOSS - 0.5933
ACC - 0.7833
PPV - ALL: 0.8177  COVID-19: 0.9706  PNEUMONIA: 0.7395  NORMAL: 0.7431 
RECALL - ALL: 0.7946  COVID-19: 0.6600  PNEUMONIA: 0.8800  NORMAL: 0.8438 
F1 - ALL: 0.7932  COVID-19: 0.7857  PNEUMONIA: 0.8037  NORMAL: 0.7903 

Epoch 13/19
----------
[train]
LOSS - 0.0468
ACC - 0.9600
PPV - ALL: 1.0000  COVID-19: 1.0000  PNEUMONIA: 1.0000  NORMAL: 1.0000 
RECALL - ALL: 1.0000  COVID-19: 1.0000  PNEUMONIA: 1.0000  NORMAL: 1.0000 
F1 - ALL: 1.0000  COVID-19: 1.0000  PNEUMONIA: 1.0000  NORMAL: 1.0000 
Mask ratio's range: 0.4375 ~ 0.6875

[val]
LOSS - 0.5682
ACC - 0.7867
PPV - ALL: 0.8235  COVID-19: 0.9851  PNEUMONIA: 0.7355  NORMAL: 0.7500 
RECALL - ALL: 0.7979  COVID-19: 0.6600  PNEUMONIA: 0.8900  NORMAL: 0.8438 
F1 - ALL: 0.7966  COVID-19: 0.7904  PNEUMONIA: 0.8054  NORMAL: 0.7941 

Epoch 14/19
----------
[train]
LOSS - 0.0499
ACC - 0.9600
PPV - ALL: 1.0000  COVID-19: 1.0000  PNEUMONIA: 1.0000  NORMAL: 1.0000 
RECALL - ALL: 1.0000  COVID-19: 1.0000  PNEUMONIA: 1.0000  NORMAL: 1.0000 
F1 - ALL: 1.0000  COVID-19: 1.0000  PNEUMONIA: 1.0000  NORMAL: 1.0000 
Mask ratio's range: 0.4375 ~ 0.625

[val]
LOSS - 0.5950
ACC - 0.7767
PPV - ALL: 0.8092  COVID-19: 0.9565  PNEUMONIA: 0.7373  NORMAL: 0.7339 
RECALL - ALL: 0.7878  COVID-19: 0.6600  PNEUMONIA: 0.8700  NORMAL: 0.8333 
F1 - ALL: 0.7866  COVID-19: 0.7811  PNEUMONIA: 0.7982  NORMAL: 0.7804 

Epoch 15/19
----------
[train]
LOSS - 0.0415
ACC - 0.9600
PPV - ALL: 1.0000  COVID-19: 1.0000  PNEUMONIA: 1.0000  NORMAL: 1.0000 
RECALL - ALL: 1.0000  COVID-19: 1.0000  PNEUMONIA: 1.0000  NORMAL: 1.0000 
F1 - ALL: 1.0000  COVID-19: 1.0000  PNEUMONIA: 1.0000  NORMAL: 1.0000 
Mask ratio's range: 0.4375 ~ 0.625

[val]
LOSS - 0.6285
ACC - 0.7767
PPV - ALL: 0.8124  COVID-19: 0.9701  PNEUMONIA: 0.7333  NORMAL: 0.7339 
RECALL - ALL: 0.7878  COVID-19: 0.6500  PNEUMONIA: 0.8800  NORMAL: 0.8333 
F1 - ALL: 0.7863  COVID-19: 0.7784  PNEUMONIA: 0.8000  NORMAL: 0.7804 

Epoch 16/19
----------
[train]
LOSS - 0.0569
ACC - 0.9600
PPV - ALL: 1.0000  COVID-19: 1.0000  PNEUMONIA: 1.0000  NORMAL: 1.0000 
RECALL - ALL: 1.0000  COVID-19: 1.0000  PNEUMONIA: 1.0000  NORMAL: 1.0000 
F1 - ALL: 1.0000  COVID-19: 1.0000  PNEUMONIA: 1.0000  NORMAL: 1.0000 
Mask ratio's range: 0.4375 ~ 0.625

[val]
LOSS - 0.6964
ACC - 0.7600
PPV - ALL: 0.8094  COVID-19: 1.0000  PNEUMONIA: 0.7177  NORMAL: 0.7105 
RECALL - ALL: 0.7713  COVID-19: 0.5800  PNEUMONIA: 0.8900  NORMAL: 0.8438 
F1 - ALL: 0.7667  COVID-19: 0.7342  PNEUMONIA: 0.7946  NORMAL: 0.7714 

Epoch 17/19
----------
[train]
LOSS - 0.0425
ACC - 0.9600
PPV - ALL: 1.0000  COVID-19: 1.0000  PNEUMONIA: 1.0000  NORMAL: 1.0000 
RECALL - ALL: 1.0000  COVID-19: 1.0000  PNEUMONIA: 1.0000  NORMAL: 1.0000 
F1 - ALL: 1.0000  COVID-19: 1.0000  PNEUMONIA: 1.0000  NORMAL: 1.0000 
Mask ratio's range: 0.3125 ~ 0.625

[val]
LOSS - 0.7052
ACC - 0.7533
PPV - ALL: 0.8074  COVID-19: 1.0000  PNEUMONIA: 0.7054  NORMAL: 0.7168 
RECALL - ALL: 0.7646  COVID-19: 0.5400  PNEUMONIA: 0.9100  NORMAL: 0.8438 
F1 - ALL: 0.7570  COVID-19: 0.7013  PNEUMONIA: 0.7947  NORMAL: 0.7751 

Epoch 18/19
----------
[train]
LOSS - 0.0731
ACC - 0.9600
PPV - ALL: 1.0000  COVID-19: 1.0000  PNEUMONIA: 1.0000  NORMAL: 1.0000 
RECALL - ALL: 1.0000  COVID-19: 1.0000  PNEUMONIA: 1.0000  NORMAL: 1.0000 
F1 - ALL: 1.0000  COVID-19: 1.0000  PNEUMONIA: 1.0000  NORMAL: 1.0000 
Mask ratio's range: 0.25 ~ 0.625

[val]
LOSS - 0.7284
ACC - 0.7500
PPV - ALL: 0.8056  COVID-19: 1.0000  PNEUMONIA: 0.7000  NORMAL: 0.7168 
RECALL - ALL: 0.7613  COVID-19: 0.5300  PNEUMONIA: 0.9100  NORMAL: 0.8438 
F1 - ALL: 0.7531  COVID-19: 0.6928  PNEUMONIA: 0.7913  NORMAL: 0.7751 

Epoch 19/19
----------
[train]
LOSS - 0.0712
ACC - 0.9600
PPV - ALL: 1.0000  COVID-19: 1.0000  PNEUMONIA: 1.0000  NORMAL: 1.0000 
RECALL - ALL: 1.0000  COVID-19: 1.0000  PNEUMONIA: 1.0000  NORMAL: 1.0000 
F1 - ALL: 1.0000  COVID-19: 1.0000  PNEUMONIA: 1.0000  NORMAL: 1.0000 
Mask ratio's range: 0.25 ~ 0.5625

[val]
LOSS - 0.7872
ACC - 0.7633
PPV - ALL: 0.8142  COVID-19: 1.0000  PNEUMONIA: 0.7154  NORMAL: 0.7273 
RECALL - ALL: 0.7744  COVID-19: 0.5600  PNEUMONIA: 0.9300  NORMAL: 0.8333 
F1 - ALL: 0.7678  COVID-19: 0.7179  PNEUMONIA: 0.8087  NORMAL: 0.7767 


--------------------
[Best results]
ACC - 0.8233
PPV - ALL: 0.8362  COVID-19: 0.8660  PNEUMONIA: 0.7982  NORMAL: 0.8444 
RECALL - ALL: 0.8339  COVID-19: 0.8400  PNEUMONIA: 0.8700  NORMAL: 0.7917 
F1 - ALL: 0.8342  COVID-19: 0.8528  PNEUMONIA: 0.8326  NORMAL: 0.8172 

Training complete in 1m 30s
-------------------- 

--------------------
Model 4
--------------------

Epoch 0/19
----------
[train]
LOSS - 1.0112
ACC - 0.5067
PPV - ALL: 0.5267  COVID-19: 0.4583  PNEUMONIA: 0.5217  NORMAL: 0.6000 
RECALL - ALL: 0.5278  COVID-19: 0.4583  PNEUMONIA: 0.5000  NORMAL: 0.6250 
F1 - ALL: 0.5270  COVID-19: 0.4583  PNEUMONIA: 0.5106  NORMAL: 0.6122 
Mask ratio's range: 1.0 ~ 1.0

[val]
LOSS - 0.9903
ACC - 0.5333
PPV - ALL: 0.7216  COVID-19: 1.0000  PNEUMONIA: 0.7160  NORMAL: 0.4488 
RECALL - ALL: 0.5461  COVID-19: 0.1000  PNEUMONIA: 0.5800  NORMAL: 0.9583 
F1 - ALL: 0.4780  COVID-19: 0.1818  PNEUMONIA: 0.6409  NORMAL: 0.6113 

Epoch 1/19
----------
[train]
LOSS - 0.6352
ACC - 0.9067
PPV - ALL: 0.9477  COVID-19: 1.0000  PNEUMONIA: 0.9200  NORMAL: 0.9231 
RECALL - ALL: 0.9444  COVID-19: 0.8750  PNEUMONIA: 0.9583  NORMAL: 1.0000 
F1 - ALL: 0.9440  COVID-19: 0.9333  PNEUMONIA: 0.9388  NORMAL: 0.9600 
Mask ratio's range: 1.0 ~ 1.0

[val]
LOSS - 0.7602
ACC - 0.7567
PPV - ALL: 0.7701  COVID-19: 0.7857  PNEUMONIA: 0.7156  NORMAL: 0.8090 
RECALL - ALL: 0.7667  COVID-19: 0.7700  PNEUMONIA: 0.7800  NORMAL: 0.7500 
F1 - ALL: 0.7675  COVID-19: 0.7778  PNEUMONIA: 0.7464  NORMAL: 0.7784 

Epoch 2/19
----------
[train]
LOSS - 0.2771
ACC - 0.9467
PPV - ALL: 0.9867  COVID-19: 1.0000  PNEUMONIA: 1.0000  NORMAL: 0.9600 
RECALL - ALL: 0.9861  COVID-19: 1.0000  PNEUMONIA: 0.9583  NORMAL: 1.0000 
F1 - ALL: 0.9861  COVID-19: 1.0000  PNEUMONIA: 0.9787  NORMAL: 0.9796 
Mask ratio's range: 1.0 ~ 1.0

[val]
LOSS - 0.6213
ACC - 0.7700
PPV - ALL: 0.7941  COVID-19: 0.8816  PNEUMONIA: 0.7049  NORMAL: 0.7959 
RECALL - ALL: 0.7808  COVID-19: 0.6700  PNEUMONIA: 0.8600  NORMAL: 0.8125 
F1 - ALL: 0.7801  COVID-19: 0.7614  PNEUMONIA: 0.7748  NORMAL: 0.8041 

Epoch 3/19
----------
[train]
LOSS - 0.1017
ACC - 0.9600
PPV - ALL: 1.0000  COVID-19: 1.0000  PNEUMONIA: 1.0000  NORMAL: 1.0000 
RECALL - ALL: 1.0000  COVID-19: 1.0000  PNEUMONIA: 1.0000  NORMAL: 1.0000 
F1 - ALL: 1.0000  COVID-19: 1.0000  PNEUMONIA: 1.0000  NORMAL: 1.0000 
Mask ratio's range: 1.0 ~ 1.0

[val]
LOSS - 0.5625
ACC - 0.7767
PPV - ALL: 0.7966  COVID-19: 0.8444  PNEUMONIA: 0.7083  NORMAL: 0.8372 
RECALL - ALL: 0.7867  COVID-19: 0.7600  PNEUMONIA: 0.8500  NORMAL: 0.7500 
F1 - ALL: 0.7880  COVID-19: 0.8000  PNEUMONIA: 0.7727  NORMAL: 0.7912 

Epoch 4/19
----------
[train]
LOSS - 0.0588
ACC - 0.9600
PPV - ALL: 1.0000  COVID-19: 1.0000  PNEUMONIA: 1.0000  NORMAL: 1.0000 
RECALL - ALL: 1.0000  COVID-19: 1.0000  PNEUMONIA: 1.0000  NORMAL: 1.0000 
F1 - ALL: 1.0000  COVID-19: 1.0000  PNEUMONIA: 1.0000  NORMAL: 1.0000 
Mask ratio's range: 0.875 ~ 1.0

[val]
LOSS - 0.5272
ACC - 0.7767
PPV - ALL: 0.7889  COVID-19: 0.8085  PNEUMONIA: 0.7477  NORMAL: 0.8105 
RECALL - ALL: 0.7874  COVID-19: 0.7600  PNEUMONIA: 0.8000  NORMAL: 0.8021 
F1 - ALL: 0.7876  COVID-19: 0.7835  PNEUMONIA: 0.7730  NORMAL: 0.8063 

Epoch 5/19
----------
[train]
LOSS - 0.0413
ACC - 0.9600
PPV - ALL: 1.0000  COVID-19: 1.0000  PNEUMONIA: 1.0000  NORMAL: 1.0000 
RECALL - ALL: 1.0000  COVID-19: 1.0000  PNEUMONIA: 1.0000  NORMAL: 1.0000 
F1 - ALL: 1.0000  COVID-19: 1.0000  PNEUMONIA: 1.0000  NORMAL: 1.0000 
Mask ratio's range: 0.875 ~ 1.0

[val]
LOSS - 0.5142
ACC - 0.7767
PPV - ALL: 0.7891  COVID-19: 0.8000  PNEUMONIA: 0.7500  NORMAL: 0.8172 
RECALL - ALL: 0.7872  COVID-19: 0.7600  PNEUMONIA: 0.8100  NORMAL: 0.7917 
F1 - ALL: 0.7875  COVID-19: 0.7795  PNEUMONIA: 0.7788  NORMAL: 0.8042 

Epoch 6/19
----------
[train]
LOSS - 0.0300
ACC - 0.9600
PPV - ALL: 1.0000  COVID-19: 1.0000  PNEUMONIA: 1.0000  NORMAL: 1.0000 
RECALL - ALL: 1.0000  COVID-19: 1.0000  PNEUMONIA: 1.0000  NORMAL: 1.0000 
F1 - ALL: 1.0000  COVID-19: 1.0000  PNEUMONIA: 1.0000  NORMAL: 1.0000 
Mask ratio's range: 0.875 ~ 1.0

[val]
LOSS - 0.5106
ACC - 0.7667
PPV - ALL: 0.7779  COVID-19: 0.7755  PNEUMONIA: 0.7476  NORMAL: 0.8105 
RECALL - ALL: 0.7774  COVID-19: 0.7600  PNEUMONIA: 0.7700  NORMAL: 0.8021 
F1 - ALL: 0.7775  COVID-19: 0.7677  PNEUMONIA: 0.7586  NORMAL: 0.8063 

Epoch 7/19
----------
[train]
LOSS - 0.0334
ACC - 0.9600
PPV - ALL: 1.0000  COVID-19: 1.0000  PNEUMONIA: 1.0000  NORMAL: 1.0000 
RECALL - ALL: 1.0000  COVID-19: 1.0000  PNEUMONIA: 1.0000  NORMAL: 1.0000 
F1 - ALL: 1.0000  COVID-19: 1.0000  PNEUMONIA: 1.0000  NORMAL: 1.0000 
Mask ratio's range: 0.8125 ~ 0.9375

[val]
LOSS - 0.5125
ACC - 0.7567
PPV - ALL: 0.7675  COVID-19: 0.7708  PNEUMONIA: 0.7379  NORMAL: 0.7938 
RECALL - ALL: 0.7674  COVID-19: 0.7400  PNEUMONIA: 0.7600  NORMAL: 0.8021 
F1 - ALL: 0.7673  COVID-19: 0.7551  PNEUMONIA: 0.7488  NORMAL: 0.7979 

Epoch 8/19
----------
[train]
LOSS - 0.0373
ACC - 0.9600
PPV - ALL: 1.0000  COVID-19: 1.0000  PNEUMONIA: 1.0000  NORMAL: 1.0000 
RECALL - ALL: 1.0000  COVID-19: 1.0000  PNEUMONIA: 1.0000  NORMAL: 1.0000 
F1 - ALL: 1.0000  COVID-19: 1.0000  PNEUMONIA: 1.0000  NORMAL: 1.0000 
Mask ratio's range: 0.8125 ~ 0.9375

[val]
LOSS - 0.5419
ACC - 0.7700
PPV - ALL: 0.7815  COVID-19: 0.8132  PNEUMONIA: 0.7600  NORMAL: 0.7714 
RECALL - ALL: 0.7813  COVID-19: 0.7400  PNEUMONIA: 0.7600  NORMAL: 0.8438 
F1 - ALL: 0.7803  COVID-19: 0.7749  PNEUMONIA: 0.7600  NORMAL: 0.8060 

Epoch 9/19
----------
[train]
LOSS - 0.0340
ACC - 0.9600
PPV - ALL: 1.0000  COVID-19: 1.0000  PNEUMONIA: 1.0000  NORMAL: 1.0000 
RECALL - ALL: 1.0000  COVID-19: 1.0000  PNEUMONIA: 1.0000  NORMAL: 1.0000 
F1 - ALL: 1.0000  COVID-19: 1.0000  PNEUMONIA: 1.0000  NORMAL: 1.0000 
Mask ratio's range: 0.75 ~ 0.9375

[val]
LOSS - 0.5649
ACC - 0.7700
PPV - ALL: 0.7818  COVID-19: 0.8111  PNEUMONIA: 0.7700  NORMAL: 0.7642 
RECALL - ALL: 0.7813  COVID-19: 0.7300  PNEUMONIA: 0.7700  NORMAL: 0.8438 
F1 - ALL: 0.7801  COVID-19: 0.7684  PNEUMONIA: 0.7700  NORMAL: 0.8020 

Epoch 10/19
----------
[train]
LOSS - 0.0667
ACC - 0.9600
PPV - ALL: 1.0000  COVID-19: 1.0000  PNEUMONIA: 1.0000  NORMAL: 1.0000 
RECALL - ALL: 1.0000  COVID-19: 1.0000  PNEUMONIA: 1.0000  NORMAL: 1.0000 
F1 - ALL: 1.0000  COVID-19: 1.0000  PNEUMONIA: 1.0000  NORMAL: 1.0000 
Mask ratio's range: 0.75 ~ 0.9375

[val]
LOSS - 0.5938
ACC - 0.7767
PPV - ALL: 0.7894  COVID-19: 0.8295  PNEUMONIA: 0.7723  NORMAL: 0.7664 
RECALL - ALL: 0.7881  COVID-19: 0.7300  PNEUMONIA: 0.7800  NORMAL: 0.8542 
F1 - ALL: 0.7869  COVID-19: 0.7766  PNEUMONIA: 0.7761  NORMAL: 0.8079 

Epoch 11/19
----------
[train]
LOSS - 0.0340
ACC - 0.9600
PPV - ALL: 1.0000  COVID-19: 1.0000  PNEUMONIA: 1.0000  NORMAL: 1.0000 
RECALL - ALL: 1.0000  COVID-19: 1.0000  PNEUMONIA: 1.0000  NORMAL: 1.0000 
F1 - ALL: 1.0000  COVID-19: 1.0000  PNEUMONIA: 1.0000  NORMAL: 1.0000 
Mask ratio's range: 0.6875 ~ 0.875

[val]
LOSS - 0.5639
ACC - 0.7800
PPV - ALL: 0.7952  COVID-19: 0.8588  PNEUMONIA: 0.7383  NORMAL: 0.7885 
RECALL - ALL: 0.7914  COVID-19: 0.7300  PNEUMONIA: 0.7900  NORMAL: 0.8542 
F1 - ALL: 0.7908  COVID-19: 0.7892  PNEUMONIA: 0.7633  NORMAL: 0.8200 

Epoch 12/19
----------
[train]
LOSS - 0.0591
ACC - 0.9600
PPV - ALL: 1.0000  COVID-19: 1.0000  PNEUMONIA: 1.0000  NORMAL: 1.0000 
RECALL - ALL: 1.0000  COVID-19: 1.0000  PNEUMONIA: 1.0000  NORMAL: 1.0000 
F1 - ALL: 1.0000  COVID-19: 1.0000  PNEUMONIA: 1.0000  NORMAL: 1.0000 
Mask ratio's range: 0.625 ~ 0.875

[val]
LOSS - 0.5794
ACC - 0.7733
PPV - ALL: 0.7866  COVID-19: 0.8409  PNEUMONIA: 0.7476  NORMAL: 0.7714 
RECALL - ALL: 0.7846  COVID-19: 0.7400  PNEUMONIA: 0.7700  NORMAL: 0.8438 
F1 - ALL: 0.7839  COVID-19: 0.7872  PNEUMONIA: 0.7586  NORMAL: 0.8060 

Epoch 13/19
----------
[train]
LOSS - 0.0532
ACC - 0.9600
PPV - ALL: 1.0000  COVID-19: 1.0000  PNEUMONIA: 1.0000  NORMAL: 1.0000 
RECALL - ALL: 1.0000  COVID-19: 1.0000  PNEUMONIA: 1.0000  NORMAL: 1.0000 
F1 - ALL: 1.0000  COVID-19: 1.0000  PNEUMONIA: 1.0000  NORMAL: 1.0000 
Mask ratio's range: 0.5625 ~ 0.875

[val]
LOSS - 0.5862
ACC - 0.7833
PPV - ALL: 0.7979  COVID-19: 0.8605  PNEUMONIA: 0.7619  NORMAL: 0.7714 
RECALL - ALL: 0.7946  COVID-19: 0.7400  PNEUMONIA: 0.8000  NORMAL: 0.8438 
F1 - ALL: 0.7941  COVID-19: 0.7957  PNEUMONIA: 0.7805  NORMAL: 0.8060 

Epoch 14/19
----------
[train]
LOSS - 0.0403
ACC - 0.9600
PPV - ALL: 1.0000  COVID-19: 1.0000  PNEUMONIA: 1.0000  NORMAL: 1.0000 
RECALL - ALL: 1.0000  COVID-19: 1.0000  PNEUMONIA: 1.0000  NORMAL: 1.0000 
F1 - ALL: 1.0000  COVID-19: 1.0000  PNEUMONIA: 1.0000  NORMAL: 1.0000 
Mask ratio's range: 0.5625 ~ 0.875

[val]
LOSS - 0.5733
ACC - 0.7800
PPV - ALL: 0.7974  COVID-19: 0.8780  PNEUMONIA: 0.7596  NORMAL: 0.7545 
RECALL - ALL: 0.7915  COVID-19: 0.7200  PNEUMONIA: 0.7900  NORMAL: 0.8646 
F1 - ALL: 0.7905  COVID-19: 0.7912  PNEUMONIA: 0.7745  NORMAL: 0.8058 

Epoch 15/19
----------
[train]
LOSS - 0.0954
ACC - 0.9600
PPV - ALL: 1.0000  COVID-19: 1.0000  PNEUMONIA: 1.0000  NORMAL: 1.0000 
RECALL - ALL: 1.0000  COVID-19: 1.0000  PNEUMONIA: 1.0000  NORMAL: 1.0000 
F1 - ALL: 1.0000  COVID-19: 1.0000  PNEUMONIA: 1.0000  NORMAL: 1.0000 
Mask ratio's range: 0.5 ~ 0.8125

[val]
LOSS - 0.6809
ACC - 0.7700
PPV - ALL: 0.7916  COVID-19: 0.8701  PNEUMONIA: 0.7835  NORMAL: 0.7213 
RECALL - ALL: 0.7822  COVID-19: 0.6700  PNEUMONIA: 0.7600  NORMAL: 0.9167 
F1 - ALL: 0.7787  COVID-19: 0.7571  PNEUMONIA: 0.7716  NORMAL: 0.8073 

Epoch 16/19
----------
[train]
LOSS - 0.0567
ACC - 0.9600
PPV - ALL: 1.0000  COVID-19: 1.0000  PNEUMONIA: 1.0000  NORMAL: 1.0000 
RECALL - ALL: 1.0000  COVID-19: 1.0000  PNEUMONIA: 1.0000  NORMAL: 1.0000 
F1 - ALL: 1.0000  COVID-19: 1.0000  PNEUMONIA: 1.0000  NORMAL: 1.0000 
Mask ratio's range: 0.5 ~ 0.6875

[val]
LOSS - 0.6470
ACC - 0.7567
PPV - ALL: 0.7886  COVID-19: 0.9000  PNEUMONIA: 0.7835  NORMAL: 0.6822 
RECALL - ALL: 0.7689  COVID-19: 0.6300  PNEUMONIA: 0.7600  NORMAL: 0.9167 
F1 - ALL: 0.7650  COVID-19: 0.7412  PNEUMONIA: 0.7716  NORMAL: 0.7823 

Epoch 17/19
----------
[train]
LOSS - 0.0531
ACC - 0.9600
PPV - ALL: 1.0000  COVID-19: 1.0000  PNEUMONIA: 1.0000  NORMAL: 1.0000 
RECALL - ALL: 1.0000  COVID-19: 1.0000  PNEUMONIA: 1.0000  NORMAL: 1.0000 
F1 - ALL: 1.0000  COVID-19: 1.0000  PNEUMONIA: 1.0000  NORMAL: 1.0000 
Mask ratio's range: 0.4375 ~ 0.6875

[val]
LOSS - 0.6891
ACC - 0.7533
PPV - ALL: 0.7958  COVID-19: 0.9375  PNEUMONIA: 0.7857  NORMAL: 0.6642 
RECALL - ALL: 0.7657  COVID-19: 0.6000  PNEUMONIA: 0.7700  NORMAL: 0.9271 
F1 - ALL: 0.7611  COVID-19: 0.7317  PNEUMONIA: 0.7778  NORMAL: 0.7739 

Epoch 18/19
----------
[train]
LOSS - 0.0778
ACC - 0.9600
PPV - ALL: 1.0000  COVID-19: 1.0000  PNEUMONIA: 1.0000  NORMAL: 1.0000 
RECALL - ALL: 1.0000  COVID-19: 1.0000  PNEUMONIA: 1.0000  NORMAL: 1.0000 
F1 - ALL: 1.0000  COVID-19: 1.0000  PNEUMONIA: 1.0000  NORMAL: 1.0000 
Mask ratio's range: 0.4375 ~ 0.625

[val]
LOSS - 0.7128
ACC - 0.7467
PPV - ALL: 0.7947  COVID-19: 0.9344  PNEUMONIA: 0.8021  NORMAL: 0.6475 
RECALL - ALL: 0.7592  COVID-19: 0.5700  PNEUMONIA: 0.7700  NORMAL: 0.9375 
F1 - ALL: 0.7533  COVID-19: 0.7081  PNEUMONIA: 0.7857  NORMAL: 0.7660 

Epoch 19/19
----------
[train]
LOSS - 0.0488
ACC - 0.9600
PPV - ALL: 1.0000  COVID-19: 1.0000  PNEUMONIA: 1.0000  NORMAL: 1.0000 
RECALL - ALL: 1.0000  COVID-19: 1.0000  PNEUMONIA: 1.0000  NORMAL: 1.0000 
F1 - ALL: 1.0000  COVID-19: 1.0000  PNEUMONIA: 1.0000  NORMAL: 1.0000 
Mask ratio's range: 0.4375 ~ 0.625

[val]
LOSS - 0.7335
ACC - 0.7433
PPV - ALL: 0.7914  COVID-19: 0.9500  PNEUMONIA: 0.7723  NORMAL: 0.6519 
RECALL - ALL: 0.7556  COVID-19: 0.5700  PNEUMONIA: 0.7800  NORMAL: 0.9167 
F1 - ALL: 0.7502  COVID-19: 0.7125  PNEUMONIA: 0.7761  NORMAL: 0.7619 


--------------------
[Best results]
ACC - 0.7833
PPV - ALL: 0.7979  COVID-19: 0.8605  PNEUMONIA: 0.7619  NORMAL: 0.7714 
RECALL - ALL: 0.7946  COVID-19: 0.7400  PNEUMONIA: 0.8000  NORMAL: 0.8438 
F1 - ALL: 0.7941  COVID-19: 0.7957  PNEUMONIA: 0.7805  NORMAL: 0.8060 

Training complete in 1m 31s
-------------------- 

--------------------
Model 5
--------------------

Epoch 0/19
----------
[train]
LOSS - 1.0431
ACC - 0.3333
PPV - ALL: 0.3523  COVID-19: 0.4286  PNEUMONIA: 0.3158  NORMAL: 0.3125 
RECALL - ALL: 0.3472  COVID-19: 0.3750  PNEUMONIA: 0.2500  NORMAL: 0.4167 
F1 - ALL: 0.3454  COVID-19: 0.4000  PNEUMONIA: 0.2791  NORMAL: 0.3572 
Mask ratio's range: 1.0 ~ 1.0

[val]
LOSS - 0.9491
ACC - 0.6267
PPV - ALL: 0.6429  COVID-19: 0.6848  PNEUMONIA: 0.5439  NORMAL: 0.7000 
RECALL - ALL: 0.6354  COVID-19: 0.6300  PNEUMONIA: 0.6200  NORMAL: 0.6562 
F1 - ALL: 0.6377  COVID-19: 0.6563  PNEUMONIA: 0.5795  NORMAL: 0.6774 

Epoch 1/19
----------
[train]
LOSS - 0.6655
ACC - 0.8933
PPV - ALL: 0.9316  COVID-19: 0.9565  PNEUMONIA: 0.9583  NORMAL: 0.8800 
RECALL - ALL: 0.9306  COVID-19: 0.9167  PNEUMONIA: 0.9583  NORMAL: 0.9167 
F1 - ALL: 0.9308  COVID-19: 0.9362  PNEUMONIA: 0.9583  NORMAL: 0.8980 
Mask ratio's range: 1.0 ~ 1.0

[val]
LOSS - 0.7718
ACC - 0.7300
PPV - ALL: 0.7704  COVID-19: 0.9180  PNEUMONIA: 0.7290  NORMAL: 0.6641 
RECALL - ALL: 0.7418  COVID-19: 0.5600  PNEUMONIA: 0.7800  NORMAL: 0.8854 
F1 - ALL: 0.7360  COVID-19: 0.6956  PNEUMONIA: 0.7536  NORMAL: 0.7589 

Epoch 2/19
----------
[train]
LOSS - 0.3088
ACC - 0.9600
PPV - ALL: 1.0000  COVID-19: 1.0000  PNEUMONIA: 1.0000  NORMAL: 1.0000 
RECALL - ALL: 1.0000  COVID-19: 1.0000  PNEUMONIA: 1.0000  NORMAL: 1.0000 
F1 - ALL: 1.0000  COVID-19: 1.0000  PNEUMONIA: 1.0000  NORMAL: 1.0000 
Mask ratio's range: 1.0 ~ 1.0

[val]
LOSS - 0.6232
ACC - 0.7667
PPV - ALL: 0.7783  COVID-19: 0.7978  PNEUMONIA: 0.7778  NORMAL: 0.7593 
RECALL - ALL: 0.7781  COVID-19: 0.7100  PNEUMONIA: 0.7700  NORMAL: 0.8542 
F1 - ALL: 0.7764  COVID-19: 0.7513  PNEUMONIA: 0.7739  NORMAL: 0.8040 

Epoch 3/19
----------
[train]
LOSS - 0.1084
ACC - 0.9600
PPV - ALL: 1.0000  COVID-19: 1.0000  PNEUMONIA: 1.0000  NORMAL: 1.0000 
RECALL - ALL: 1.0000  COVID-19: 1.0000  PNEUMONIA: 1.0000  NORMAL: 1.0000 
F1 - ALL: 1.0000  COVID-19: 1.0000  PNEUMONIA: 1.0000  NORMAL: 1.0000 
Mask ratio's range: 1.0 ~ 1.0

[val]
LOSS - 0.5484
ACC - 0.7900
PPV - ALL: 0.8077  COVID-19: 0.8765  PNEUMONIA: 0.7921  NORMAL: 0.7544 
RECALL - ALL: 0.8019  COVID-19: 0.7100  PNEUMONIA: 0.8000  NORMAL: 0.8958 
F1 - ALL: 0.7998  COVID-19: 0.7845  PNEUMONIA: 0.7960  NORMAL: 0.8190 

Epoch 4/19
----------
[train]
LOSS - 0.0547
ACC - 0.9600
PPV - ALL: 1.0000  COVID-19: 1.0000  PNEUMONIA: 1.0000  NORMAL: 1.0000 
RECALL - ALL: 1.0000  COVID-19: 1.0000  PNEUMONIA: 1.0000  NORMAL: 1.0000 
F1 - ALL: 1.0000  COVID-19: 1.0000  PNEUMONIA: 1.0000  NORMAL: 1.0000 
Mask ratio's range: 0.9375 ~ 1.0

[val]
LOSS - 0.5434
ACC - 0.7767
PPV - ALL: 0.7905  COVID-19: 0.8333  PNEUMONIA: 0.7745  NORMAL: 0.7636 
RECALL - ALL: 0.7883  COVID-19: 0.7000  PNEUMONIA: 0.7900  NORMAL: 0.8750 
F1 - ALL: 0.7862  COVID-19: 0.7609  PNEUMONIA: 0.7822  NORMAL: 0.8155 

Epoch 5/19
----------
[train]
LOSS - 0.0472
ACC - 0.9600
PPV - ALL: 1.0000  COVID-19: 1.0000  PNEUMONIA: 1.0000  NORMAL: 1.0000 
RECALL - ALL: 1.0000  COVID-19: 1.0000  PNEUMONIA: 1.0000  NORMAL: 1.0000 
F1 - ALL: 1.0000  COVID-19: 1.0000  PNEUMONIA: 1.0000  NORMAL: 1.0000 
Mask ratio's range: 0.875 ~ 1.0

[val]
LOSS - 0.5039
ACC - 0.7867
PPV - ALL: 0.7994  COVID-19: 0.8295  PNEUMONIA: 0.7980  NORMAL: 0.7706 
RECALL - ALL: 0.7983  COVID-19: 0.7300  PNEUMONIA: 0.7900  NORMAL: 0.8750 
F1 - ALL: 0.7967  COVID-19: 0.7766  PNEUMONIA: 0.7940  NORMAL: 0.8195 

Epoch 6/19
----------
[train]
LOSS - 0.0647
ACC - 0.9600
PPV - ALL: 1.0000  COVID-19: 1.0000  PNEUMONIA: 1.0000  NORMAL: 1.0000 
RECALL - ALL: 1.0000  COVID-19: 1.0000  PNEUMONIA: 1.0000  NORMAL: 1.0000 
F1 - ALL: 1.0000  COVID-19: 1.0000  PNEUMONIA: 1.0000  NORMAL: 1.0000 
Mask ratio's range: 0.875 ~ 1.0

[val]
LOSS - 0.5399
ACC - 0.7800
PPV - ALL: 0.7946  COVID-19: 0.8434  PNEUMONIA: 0.7767  NORMAL: 0.7636 
RECALL - ALL: 0.7917  COVID-19: 0.7000  PNEUMONIA: 0.8000  NORMAL: 0.8750 
F1 - ALL: 0.7896  COVID-19: 0.7650  PNEUMONIA: 0.7882  NORMAL: 0.8155 

Epoch 7/19
----------
[train]
LOSS - 0.0776
ACC - 0.9600
PPV - ALL: 1.0000  COVID-19: 1.0000  PNEUMONIA: 1.0000  NORMAL: 1.0000 
RECALL - ALL: 1.0000  COVID-19: 1.0000  PNEUMONIA: 1.0000  NORMAL: 1.0000 
F1 - ALL: 1.0000  COVID-19: 1.0000  PNEUMONIA: 1.0000  NORMAL: 1.0000 
Mask ratio's range: 0.8125 ~ 0.9375

[val]
LOSS - 0.5698
ACC - 0.7733
PPV - ALL: 0.7927  COVID-19: 0.8684  PNEUMONIA: 0.7642  NORMAL: 0.7456 
RECALL - ALL: 0.7851  COVID-19: 0.6600  PNEUMONIA: 0.8100  NORMAL: 0.8854 
F1 - ALL: 0.7820  COVID-19: 0.7500  PNEUMONIA: 0.7864  NORMAL: 0.8095 

Epoch 8/19
----------
[train]
LOSS - 0.0554
ACC - 0.9600
PPV - ALL: 1.0000  COVID-19: 1.0000  PNEUMONIA: 1.0000  NORMAL: 1.0000 
RECALL - ALL: 1.0000  COVID-19: 1.0000  PNEUMONIA: 1.0000  NORMAL: 1.0000 
F1 - ALL: 1.0000  COVID-19: 1.0000  PNEUMONIA: 1.0000  NORMAL: 1.0000 
Mask ratio's range: 0.8125 ~ 0.9375

[val]
LOSS - 0.5942
ACC - 0.7667
PPV - ALL: 0.7886  COVID-19: 0.8767  PNEUMONIA: 0.7500  NORMAL: 0.7391 
RECALL - ALL: 0.7785  COVID-19: 0.6400  PNEUMONIA: 0.8100  NORMAL: 0.8854 
F1 - ALL: 0.7748  COVID-19: 0.7399  PNEUMONIA: 0.7788  NORMAL: 0.8057 

Epoch 9/19
----------
[train]
LOSS - 0.0670
ACC - 0.9600
PPV - ALL: 1.0000  COVID-19: 1.0000  PNEUMONIA: 1.0000  NORMAL: 1.0000 
RECALL - ALL: 1.0000  COVID-19: 1.0000  PNEUMONIA: 1.0000  NORMAL: 1.0000 
F1 - ALL: 1.0000  COVID-19: 1.0000  PNEUMONIA: 1.0000  NORMAL: 1.0000 
Mask ratio's range: 0.75 ~ 0.9375

[val]
LOSS - 0.6365
ACC - 0.7700
PPV - ALL: 0.7923  COVID-19: 0.8767  PNEUMONIA: 0.7714  NORMAL: 0.7288 
RECALL - ALL: 0.7819  COVID-19: 0.6400  PNEUMONIA: 0.8100  NORMAL: 0.8958 
F1 - ALL: 0.7779  COVID-19: 0.7399  PNEUMONIA: 0.7902  NORMAL: 0.8037 

Epoch 10/19
----------
[train]
LOSS - 0.0705
ACC - 0.9600
PPV - ALL: 1.0000  COVID-19: 1.0000  PNEUMONIA: 1.0000  NORMAL: 1.0000 
RECALL - ALL: 1.0000  COVID-19: 1.0000  PNEUMONIA: 1.0000  NORMAL: 1.0000 
F1 - ALL: 1.0000  COVID-19: 1.0000  PNEUMONIA: 1.0000  NORMAL: 1.0000 
Mask ratio's range: 0.5625 ~ 0.9375

[val]
LOSS - 0.6509
ACC - 0.7667
PPV - ALL: 0.7918  COVID-19: 0.8873  PNEUMONIA: 0.7692  NORMAL: 0.7190 
RECALL - ALL: 0.7787  COVID-19: 0.6300  PNEUMONIA: 0.8000  NORMAL: 0.9062 
F1 - ALL: 0.7743  COVID-19: 0.7368  PNEUMONIA: 0.7843  NORMAL: 0.8018 

Epoch 11/19
----------
[train]
LOSS - 0.1028
ACC - 0.9600
PPV - ALL: 1.0000  COVID-19: 1.0000  PNEUMONIA: 1.0000  NORMAL: 1.0000 
RECALL - ALL: 1.0000  COVID-19: 1.0000  PNEUMONIA: 1.0000  NORMAL: 1.0000 
F1 - ALL: 1.0000  COVID-19: 1.0000  PNEUMONIA: 1.0000  NORMAL: 1.0000 
Mask ratio's range: 0.4375 ~ 0.875

[val]
LOSS - 0.7467
ACC - 0.7433
PPV - ALL: 0.7900  COVID-19: 0.9444  PNEUMONIA: 0.7411  NORMAL: 0.6846 
RECALL - ALL: 0.7557  COVID-19: 0.5100  PNEUMONIA: 0.8300  NORMAL: 0.9271 
F1 - ALL: 0.7443  COVID-19: 0.6623  PNEUMONIA: 0.7830  NORMAL: 0.7876 

Epoch 12/19
----------
[train]
LOSS - 0.0651
ACC - 0.9600
PPV - ALL: 1.0000  COVID-19: 1.0000  PNEUMONIA: 1.0000  NORMAL: 1.0000 
RECALL - ALL: 1.0000  COVID-19: 1.0000  PNEUMONIA: 1.0000  NORMAL: 1.0000 
F1 - ALL: 1.0000  COVID-19: 1.0000  PNEUMONIA: 1.0000  NORMAL: 1.0000 
Mask ratio's range: 0.4375 ~ 0.8125

[val]
LOSS - 0.8201
ACC - 0.7333
PPV - ALL: 0.7835  COVID-19: 0.9245  PNEUMONIA: 0.7810  NORMAL: 0.6449 
RECALL - ALL: 0.7457  COVID-19: 0.4900  PNEUMONIA: 0.8200  NORMAL: 0.9271 
F1 - ALL: 0.7337  COVID-19: 0.6405  PNEUMONIA: 0.8000  NORMAL: 0.7607 

Epoch 13/19
----------
[train]
LOSS - 0.0515
ACC - 0.9600
PPV - ALL: 1.0000  COVID-19: 1.0000  PNEUMONIA: 1.0000  NORMAL: 1.0000 
RECALL - ALL: 1.0000  COVID-19: 1.0000  PNEUMONIA: 1.0000  NORMAL: 1.0000 
F1 - ALL: 1.0000  COVID-19: 1.0000  PNEUMONIA: 1.0000  NORMAL: 1.0000 
Mask ratio's range: 0.375 ~ 0.75

[val]
LOSS - 0.7580
ACC - 0.7200
PPV - ALL: 0.7590  COVID-19: 0.8727  PNEUMONIA: 0.7477  NORMAL: 0.6567 
RECALL - ALL: 0.7322  COVID-19: 0.4800  PNEUMONIA: 0.8000  NORMAL: 0.9167 
F1 - ALL: 0.7192  COVID-19: 0.6193  PNEUMONIA: 0.7730  NORMAL: 0.7652 

Epoch 14/19
----------
[train]
LOSS - 0.0444
ACC - 0.9600
PPV - ALL: 1.0000  COVID-19: 1.0000  PNEUMONIA: 1.0000  NORMAL: 1.0000 
RECALL - ALL: 1.0000  COVID-19: 1.0000  PNEUMONIA: 1.0000  NORMAL: 1.0000 
F1 - ALL: 1.0000  COVID-19: 1.0000  PNEUMONIA: 1.0000  NORMAL: 1.0000 
Mask ratio's range: 0.375 ~ 0.75

[val]
LOSS - 0.7667
ACC - 0.7300
PPV - ALL: 0.7714  COVID-19: 0.8929  PNEUMONIA: 0.7619  NORMAL: 0.6593 
RECALL - ALL: 0.7424  COVID-19: 0.5000  PNEUMONIA: 0.8000  NORMAL: 0.9271 
F1 - ALL: 0.7307  COVID-19: 0.6410  PNEUMONIA: 0.7805  NORMAL: 0.7706 

Epoch 15/19
----------
[train]
LOSS - 0.0381
ACC - 0.9600
PPV - ALL: 1.0000  COVID-19: 1.0000  PNEUMONIA: 1.0000  NORMAL: 1.0000 
RECALL - ALL: 1.0000  COVID-19: 1.0000  PNEUMONIA: 1.0000  NORMAL: 1.0000 
F1 - ALL: 1.0000  COVID-19: 1.0000  PNEUMONIA: 1.0000  NORMAL: 1.0000 
Mask ratio's range: 0.375 ~ 0.75

[val]
LOSS - 0.7533
ACC - 0.7333
PPV - ALL: 0.7744  COVID-19: 0.8947  PNEUMONIA: 0.7692  NORMAL: 0.6593 
RECALL - ALL: 0.7457  COVID-19: 0.5100  PNEUMONIA: 0.8000  NORMAL: 0.9271 
F1 - ALL: 0.7349  COVID-19: 0.6497  PNEUMONIA: 0.7843  NORMAL: 0.7706 

Epoch 16/19
----------
[train]
LOSS - 0.0432
ACC - 0.9600
PPV - ALL: 1.0000  COVID-19: 1.0000  PNEUMONIA: 1.0000  NORMAL: 1.0000 
RECALL - ALL: 1.0000  COVID-19: 1.0000  PNEUMONIA: 1.0000  NORMAL: 1.0000 
F1 - ALL: 1.0000  COVID-19: 1.0000  PNEUMONIA: 1.0000  NORMAL: 1.0000 
Mask ratio's range: 0.375 ~ 0.75

[val]
LOSS - 0.7568
ACC - 0.7367
PPV - ALL: 0.7775  COVID-19: 0.8966  PNEUMONIA: 0.7767  NORMAL: 0.6593 
RECALL - ALL: 0.7490  COVID-19: 0.5200  PNEUMONIA: 0.8000  NORMAL: 0.9271 
F1 - ALL: 0.7390  COVID-19: 0.6582  PNEUMONIA: 0.7882  NORMAL: 0.7706 

Epoch 17/19
----------
[train]
LOSS - 0.0370
ACC - 0.9600
PPV - ALL: 1.0000  COVID-19: 1.0000  PNEUMONIA: 1.0000  NORMAL: 1.0000 
RECALL - ALL: 1.0000  COVID-19: 1.0000  PNEUMONIA: 1.0000  NORMAL: 1.0000 
F1 - ALL: 1.0000  COVID-19: 1.0000  PNEUMONIA: 1.0000  NORMAL: 1.0000 
Mask ratio's range: 0.375 ~ 0.6875

[val]
LOSS - 0.8100
ACC - 0.7233
PPV - ALL: 0.7756  COVID-19: 0.9123  PNEUMONIA: 0.7895  NORMAL: 0.6250 
RECALL - ALL: 0.7358  COVID-19: 0.5200  PNEUMONIA: 0.7500  NORMAL: 0.9375 
F1 - ALL: 0.7272  COVID-19: 0.6624  PNEUMONIA: 0.7692  NORMAL: 0.7500 

Epoch 18/19
----------
[train]
LOSS - 0.0748
ACC - 0.9600
PPV - ALL: 1.0000  COVID-19: 1.0000  PNEUMONIA: 1.0000  NORMAL: 1.0000 
RECALL - ALL: 1.0000  COVID-19: 1.0000  PNEUMONIA: 1.0000  NORMAL: 1.0000 
F1 - ALL: 1.0000  COVID-19: 1.0000  PNEUMONIA: 1.0000  NORMAL: 1.0000 
Mask ratio's range: 0.375 ~ 0.625

[val]
LOSS - 0.8198
ACC - 0.7400
PPV - ALL: 0.7874  COVID-19: 0.9153  PNEUMONIA: 0.8041  NORMAL: 0.6429 
RECALL - ALL: 0.7525  COVID-19: 0.5400  PNEUMONIA: 0.7800  NORMAL: 0.9375 
F1 - ALL: 0.7446  COVID-19: 0.6793  PNEUMONIA: 0.7919  NORMAL: 0.7627 

Epoch 19/19
----------
[train]
LOSS - 0.0454
ACC - 0.9600
PPV - ALL: 1.0000  COVID-19: 1.0000  PNEUMONIA: 1.0000  NORMAL: 1.0000 
RECALL - ALL: 1.0000  COVID-19: 1.0000  PNEUMONIA: 1.0000  NORMAL: 1.0000 
F1 - ALL: 1.0000  COVID-19: 1.0000  PNEUMONIA: 1.0000  NORMAL: 1.0000 
Mask ratio's range: 0.3125 ~ 0.625

[val]
LOSS - 0.7629
ACC - 0.7333
PPV - ALL: 0.7823  COVID-19: 0.9123  PNEUMONIA: 0.7938  NORMAL: 0.6408 
RECALL - ALL: 0.7460  COVID-19: 0.5200  PNEUMONIA: 0.7700  NORMAL: 0.9479 
F1 - ALL: 0.7363  COVID-19: 0.6624  PNEUMONIA: 0.7817  NORMAL: 0.7647 


--------------------
[Best results]
ACC - 0.7900
PPV - ALL: 0.8077  COVID-19: 0.8765  PNEUMONIA: 0.7921  NORMAL: 0.7544 
RECALL - ALL: 0.8019  COVID-19: 0.7100  PNEUMONIA: 0.8000  NORMAL: 0.8958 
F1 - ALL: 0.7998  COVID-19: 0.7845  PNEUMONIA: 0.7960  NORMAL: 0.8190 

Training complete in 1m 32s
-------------------- 

[Mean results]
ACC - 0.8040 (0.02)
PPV - ALL: 0.8186 (0.02)  COVID-19: 0.8722 (0.01)  PNEUMONIA: 0.7823 (0.02)  NORMAL: 0.8013 (0.03) 
RECALL - ALL: 0.8151 (0.02)  COVID-19: 0.7780 (0.05)  PNEUMONIA: 0.8340 (0.03)  NORMAL: 0.8333 (0.04) 
F1 - ALL: 0.8148 (0.02)  COVID-19: 0.8217 (0.03)  PNEUMONIA: 0.8071 (0.02)  NORMAL: 0.8155 (0.01) 

