--------------------
Model 1
--------------------

Epoch 0/19
----------
[train]
LOSS - 1.0226
ACC - 0.4000
PPV - ALL: 0.4222  COVID-19: 0.4737  PNEUMONIA: 0.4000  NORMAL: 0.3929 
RECALL - ALL: 0.4167  COVID-19: 0.3750  PNEUMONIA: 0.4167  NORMAL: 0.4583 
F1 - ALL: 0.4166  COVID-19: 0.4186  PNEUMONIA: 0.4082  NORMAL: 0.4231 
Mask ratio's range: 1.0 ~ 1.0

[val]
LOSS - 1.0073
ACC - 0.4367
PPV - ALL: 0.6585  COVID-19: 1.0000  PNEUMONIA: 0.5882  NORMAL: 0.3872 
RECALL - ALL: 0.4493  COVID-19: 0.1000  PNEUMONIA: 0.3000  NORMAL: 0.9479 
F1 - ALL: 0.3763  COVID-19: 0.1818  PNEUMONIA: 0.3973  NORMAL: 0.5498 

Epoch 1/19
----------
[train]
LOSS - 0.6938
ACC - 0.8933
PPV - ALL: 0.9338  COVID-19: 1.0000  PNEUMONIA: 0.9167  NORMAL: 0.8846 
RECALL - ALL: 0.9306  COVID-19: 0.9167  PNEUMONIA: 0.9167  NORMAL: 0.9583 
F1 - ALL: 0.9311  COVID-19: 0.9565  PNEUMONIA: 0.9167  NORMAL: 0.9200 
Mask ratio's range: 1.0 ~ 1.0

[val]
LOSS - 0.8369
ACC - 0.7067
PPV - ALL: 0.7425  COVID-19: 0.8824  PNEUMONIA: 0.6279  NORMAL: 0.7172 
RECALL - ALL: 0.7165  COVID-19: 0.6000  PNEUMONIA: 0.8100  NORMAL: 0.7396 
F1 - ALL: 0.7166  COVID-19: 0.7143  PNEUMONIA: 0.7074  NORMAL: 0.7282 

Epoch 2/19
----------
[train]
LOSS - 0.3380
ACC - 0.9600
PPV - ALL: 1.0000  COVID-19: 1.0000  PNEUMONIA: 1.0000  NORMAL: 1.0000 
RECALL - ALL: 1.0000  COVID-19: 1.0000  PNEUMONIA: 1.0000  NORMAL: 1.0000 
F1 - ALL: 1.0000  COVID-19: 1.0000  PNEUMONIA: 1.0000  NORMAL: 1.0000 
Mask ratio's range: 1.0 ~ 1.0

[val]
LOSS - 0.6948
ACC - 0.7533
PPV - ALL: 0.7762  COVID-19: 0.8784  PNEUMONIA: 0.7222  NORMAL: 0.7281 
RECALL - ALL: 0.7649  COVID-19: 0.6500  PNEUMONIA: 0.7800  NORMAL: 0.8646 
F1 - ALL: 0.7625  COVID-19: 0.7471  PNEUMONIA: 0.7500  NORMAL: 0.7905 

Epoch 3/19
----------
[train]
LOSS - 0.1336
ACC - 0.9600
PPV - ALL: 1.0000  COVID-19: 1.0000  PNEUMONIA: 1.0000  NORMAL: 1.0000 
RECALL - ALL: 1.0000  COVID-19: 1.0000  PNEUMONIA: 1.0000  NORMAL: 1.0000 
F1 - ALL: 1.0000  COVID-19: 1.0000  PNEUMONIA: 1.0000  NORMAL: 1.0000 
Mask ratio's range: 1.0 ~ 1.0

[val]
LOSS - 0.6002
ACC - 0.7833
PPV - ALL: 0.7972  COVID-19: 0.8409  PNEUMONIA: 0.7568  NORMAL: 0.7938 
RECALL - ALL: 0.7940  COVID-19: 0.7400  PNEUMONIA: 0.8400  NORMAL: 0.8021 
F1 - ALL: 0.7938  COVID-19: 0.7872  PNEUMONIA: 0.7962  NORMAL: 0.7979 

Epoch 4/19
----------
[train]
LOSS - 0.0523
ACC - 0.9600
PPV - ALL: 1.0000  COVID-19: 1.0000  PNEUMONIA: 1.0000  NORMAL: 1.0000 
RECALL - ALL: 1.0000  COVID-19: 1.0000  PNEUMONIA: 1.0000  NORMAL: 1.0000 
F1 - ALL: 1.0000  COVID-19: 1.0000  PNEUMONIA: 1.0000  NORMAL: 1.0000 
Mask ratio's range: 1.0 ~ 1.0

[val]
LOSS - 0.5705
ACC - 0.7833
PPV - ALL: 0.7993  COVID-19: 0.8690  PNEUMONIA: 0.7523  NORMAL: 0.7767 
RECALL - ALL: 0.7944  COVID-19: 0.7300  PNEUMONIA: 0.8200  NORMAL: 0.8333 
F1 - ALL: 0.7941  COVID-19: 0.7935  PNEUMONIA: 0.7847  NORMAL: 0.8040 

Epoch 5/19
----------
[train]
LOSS - 0.0316
ACC - 0.9600
PPV - ALL: 1.0000  COVID-19: 1.0000  PNEUMONIA: 1.0000  NORMAL: 1.0000 
RECALL - ALL: 1.0000  COVID-19: 1.0000  PNEUMONIA: 1.0000  NORMAL: 1.0000 
F1 - ALL: 1.0000  COVID-19: 1.0000  PNEUMONIA: 1.0000  NORMAL: 1.0000 
Mask ratio's range: 0.9375 ~ 1.0

[val]
LOSS - 0.5562
ACC - 0.7867
PPV - ALL: 0.8011  COVID-19: 0.8621  PNEUMONIA: 0.7570  NORMAL: 0.7843 
RECALL - ALL: 0.7978  COVID-19: 0.7500  PNEUMONIA: 0.8100  NORMAL: 0.8333 
F1 - ALL: 0.7976  COVID-19: 0.8022  PNEUMONIA: 0.7826  NORMAL: 0.8081 

Epoch 6/19
----------
[train]
LOSS - 0.0302
ACC - 0.9600
PPV - ALL: 1.0000  COVID-19: 1.0000  PNEUMONIA: 1.0000  NORMAL: 1.0000 
RECALL - ALL: 1.0000  COVID-19: 1.0000  PNEUMONIA: 1.0000  NORMAL: 1.0000 
F1 - ALL: 1.0000  COVID-19: 1.0000  PNEUMONIA: 1.0000  NORMAL: 1.0000 
Mask ratio's range: 0.9375 ~ 1.0

[val]
LOSS - 0.5444
ACC - 0.7967
PPV - ALL: 0.8086  COVID-19: 0.8511  PNEUMONIA: 0.7788  NORMAL: 0.7959 
RECALL - ALL: 0.8075  COVID-19: 0.8000  PNEUMONIA: 0.8100  NORMAL: 0.8125 
F1 - ALL: 0.8077  COVID-19: 0.8248  PNEUMONIA: 0.7941  NORMAL: 0.8041 

Epoch 7/19
----------
[train]
LOSS - 0.0142
ACC - 0.9600
PPV - ALL: 1.0000  COVID-19: 1.0000  PNEUMONIA: 1.0000  NORMAL: 1.0000 
RECALL - ALL: 1.0000  COVID-19: 1.0000  PNEUMONIA: 1.0000  NORMAL: 1.0000 
F1 - ALL: 1.0000  COVID-19: 1.0000  PNEUMONIA: 1.0000  NORMAL: 1.0000 
Mask ratio's range: 0.9375 ~ 1.0

[val]
LOSS - 0.5311
ACC - 0.8033
PPV - ALL: 0.8163  COVID-19: 0.8681  PNEUMONIA: 0.7788  NORMAL: 0.8020 
RECALL - ALL: 0.8146  COVID-19: 0.7900  PNEUMONIA: 0.8100  NORMAL: 0.8438 
F1 - ALL: 0.8146  COVID-19: 0.8272  PNEUMONIA: 0.7941  NORMAL: 0.8224 

Epoch 8/19
----------
[train]
LOSS - 0.0146
ACC - 0.9600
PPV - ALL: 1.0000  COVID-19: 1.0000  PNEUMONIA: 1.0000  NORMAL: 1.0000 
RECALL - ALL: 1.0000  COVID-19: 1.0000  PNEUMONIA: 1.0000  NORMAL: 1.0000 
F1 - ALL: 1.0000  COVID-19: 1.0000  PNEUMONIA: 1.0000  NORMAL: 1.0000 
Mask ratio's range: 0.9375 ~ 1.0

[val]
LOSS - 0.5460
ACC - 0.8033
PPV - ALL: 0.8166  COVID-19: 0.8681  PNEUMONIA: 0.7736  NORMAL: 0.8081 
RECALL - ALL: 0.8144  COVID-19: 0.7900  PNEUMONIA: 0.8200  NORMAL: 0.8333 
F1 - ALL: 0.8146  COVID-19: 0.8272  PNEUMONIA: 0.7961  NORMAL: 0.8205 

Epoch 9/19
----------
[train]
LOSS - 0.0149
ACC - 0.9600
PPV - ALL: 1.0000  COVID-19: 1.0000  PNEUMONIA: 1.0000  NORMAL: 1.0000 
RECALL - ALL: 1.0000  COVID-19: 1.0000  PNEUMONIA: 1.0000  NORMAL: 1.0000 
F1 - ALL: 1.0000  COVID-19: 1.0000  PNEUMONIA: 1.0000  NORMAL: 1.0000 
Mask ratio's range: 0.9375 ~ 1.0

[val]
LOSS - 0.5458
ACC - 0.7967
PPV - ALL: 0.8107  COVID-19: 0.8667  PNEUMONIA: 0.7593  NORMAL: 0.8061 
RECALL - ALL: 0.8076  COVID-19: 0.7800  PNEUMONIA: 0.8200  NORMAL: 0.8229 
F1 - ALL: 0.8080  COVID-19: 0.8211  PNEUMONIA: 0.7885  NORMAL: 0.8144 

Epoch 10/19
----------
[train]
LOSS - 0.0275
ACC - 0.9600
PPV - ALL: 1.0000  COVID-19: 1.0000  PNEUMONIA: 1.0000  NORMAL: 1.0000 
RECALL - ALL: 1.0000  COVID-19: 1.0000  PNEUMONIA: 1.0000  NORMAL: 1.0000 
F1 - ALL: 1.0000  COVID-19: 1.0000  PNEUMONIA: 1.0000  NORMAL: 1.0000 
Mask ratio's range: 0.9375 ~ 1.0

[val]
LOSS - 0.5291
ACC - 0.7967
PPV - ALL: 0.8109  COVID-19: 0.8652  PNEUMONIA: 0.7615  NORMAL: 0.8061 
RECALL - ALL: 0.8076  COVID-19: 0.7700  PNEUMONIA: 0.8300  NORMAL: 0.8229 
F1 - ALL: 0.8078  COVID-19: 0.8148  PNEUMONIA: 0.7943  NORMAL: 0.8144 

Epoch 11/19
----------
[train]
LOSS - 0.0152
ACC - 0.9600
PPV - ALL: 1.0000  COVID-19: 1.0000  PNEUMONIA: 1.0000  NORMAL: 1.0000 
RECALL - ALL: 1.0000  COVID-19: 1.0000  PNEUMONIA: 1.0000  NORMAL: 1.0000 
F1 - ALL: 1.0000  COVID-19: 1.0000  PNEUMONIA: 1.0000  NORMAL: 1.0000 
Mask ratio's range: 0.9375 ~ 1.0

[val]
LOSS - 0.5360
ACC - 0.7900
PPV - ALL: 0.8082  COVID-19: 0.8706  PNEUMONIA: 0.7350  NORMAL: 0.8191 
RECALL - ALL: 0.8007  COVID-19: 0.7400  PNEUMONIA: 0.8600  NORMAL: 0.8021 
F1 - ALL: 0.8010  COVID-19: 0.8000  PNEUMONIA: 0.7926  NORMAL: 0.8105 

Epoch 12/19
----------
[train]
LOSS - 0.0121
ACC - 0.9600
PPV - ALL: 1.0000  COVID-19: 1.0000  PNEUMONIA: 1.0000  NORMAL: 1.0000 
RECALL - ALL: 1.0000  COVID-19: 1.0000  PNEUMONIA: 1.0000  NORMAL: 1.0000 
F1 - ALL: 1.0000  COVID-19: 1.0000  PNEUMONIA: 1.0000  NORMAL: 1.0000 
Mask ratio's range: 0.9375 ~ 1.0

[val]
LOSS - 0.5301
ACC - 0.7900
PPV - ALL: 0.8084  COVID-19: 0.8690  PNEUMONIA: 0.7350  NORMAL: 0.8211 
RECALL - ALL: 0.8008  COVID-19: 0.7300  PNEUMONIA: 0.8600  NORMAL: 0.8125 
F1 - ALL: 0.8010  COVID-19: 0.7935  PNEUMONIA: 0.7926  NORMAL: 0.8168 

Epoch 13/19
----------
[train]
LOSS - 0.0099
ACC - 0.9600
PPV - ALL: 1.0000  COVID-19: 1.0000  PNEUMONIA: 1.0000  NORMAL: 1.0000 
RECALL - ALL: 1.0000  COVID-19: 1.0000  PNEUMONIA: 1.0000  NORMAL: 1.0000 
F1 - ALL: 1.0000  COVID-19: 1.0000  PNEUMONIA: 1.0000  NORMAL: 1.0000 
Mask ratio's range: 0.9375 ~ 1.0

[val]
LOSS - 0.5367
ACC - 0.7867
PPV - ALL: 0.8058  COVID-19: 0.8675  PNEUMONIA: 0.7288  NORMAL: 0.8211 
RECALL - ALL: 0.7975  COVID-19: 0.7200  PNEUMONIA: 0.8600  NORMAL: 0.8125 
F1 - ALL: 0.7976  COVID-19: 0.7869  PNEUMONIA: 0.7890  NORMAL: 0.8168 

Epoch 14/19
----------
[train]
LOSS - 0.0089
ACC - 0.9600
PPV - ALL: 1.0000  COVID-19: 1.0000  PNEUMONIA: 1.0000  NORMAL: 1.0000 
RECALL - ALL: 1.0000  COVID-19: 1.0000  PNEUMONIA: 1.0000  NORMAL: 1.0000 
F1 - ALL: 1.0000  COVID-19: 1.0000  PNEUMONIA: 1.0000  NORMAL: 1.0000 
Mask ratio's range: 0.9375 ~ 1.0

[val]
LOSS - 0.5296
ACC - 0.7900
PPV - ALL: 0.8074  COVID-19: 0.8706  PNEUMONIA: 0.7391  NORMAL: 0.8125 
RECALL - ALL: 0.8008  COVID-19: 0.7400  PNEUMONIA: 0.8500  NORMAL: 0.8125 
F1 - ALL: 0.8011  COVID-19: 0.8000  PNEUMONIA: 0.7907  NORMAL: 0.8125 

Epoch 15/19
----------
[train]
LOSS - 0.0100
ACC - 0.9600
PPV - ALL: 1.0000  COVID-19: 1.0000  PNEUMONIA: 1.0000  NORMAL: 1.0000 
RECALL - ALL: 1.0000  COVID-19: 1.0000  PNEUMONIA: 1.0000  NORMAL: 1.0000 
F1 - ALL: 1.0000  COVID-19: 1.0000  PNEUMONIA: 1.0000  NORMAL: 1.0000 
Mask ratio's range: 0.9375 ~ 1.0

[val]
LOSS - 0.5313
ACC - 0.7867
PPV - ALL: 0.8048  COVID-19: 0.8690  PNEUMONIA: 0.7328  NORMAL: 0.8125 
RECALL - ALL: 0.7975  COVID-19: 0.7300  PNEUMONIA: 0.8500  NORMAL: 0.8125 
F1 - ALL: 0.7977  COVID-19: 0.7935  PNEUMONIA: 0.7871  NORMAL: 0.8125 

Epoch 16/19
----------
[train]
LOSS - 0.0112
ACC - 0.9600
PPV - ALL: 1.0000  COVID-19: 1.0000  PNEUMONIA: 1.0000  NORMAL: 1.0000 
RECALL - ALL: 1.0000  COVID-19: 1.0000  PNEUMONIA: 1.0000  NORMAL: 1.0000 
F1 - ALL: 1.0000  COVID-19: 1.0000  PNEUMONIA: 1.0000  NORMAL: 1.0000 
Mask ratio's range: 0.9375 ~ 1.0

[val]
LOSS - 0.5283
ACC - 0.7867
PPV - ALL: 0.8048  COVID-19: 0.8690  PNEUMONIA: 0.7328  NORMAL: 0.8125 
RECALL - ALL: 0.7975  COVID-19: 0.7300  PNEUMONIA: 0.8500  NORMAL: 0.8125 
F1 - ALL: 0.7977  COVID-19: 0.7935  PNEUMONIA: 0.7871  NORMAL: 0.8125 

Epoch 17/19
----------
[train]
LOSS - 0.0098
ACC - 0.9600
PPV - ALL: 1.0000  COVID-19: 1.0000  PNEUMONIA: 1.0000  NORMAL: 1.0000 
RECALL - ALL: 1.0000  COVID-19: 1.0000  PNEUMONIA: 1.0000  NORMAL: 1.0000 
F1 - ALL: 1.0000  COVID-19: 1.0000  PNEUMONIA: 1.0000  NORMAL: 1.0000 
Mask ratio's range: 0.875 ~ 1.0

[val]
LOSS - 0.5319
ACC - 0.7833
PPV - ALL: 0.8022  COVID-19: 0.8675  PNEUMONIA: 0.7265  NORMAL: 0.8125 
RECALL - ALL: 0.7942  COVID-19: 0.7200  PNEUMONIA: 0.8500  NORMAL: 0.8125 
F1 - ALL: 0.7943  COVID-19: 0.7869  PNEUMONIA: 0.7834  NORMAL: 0.8125 

Epoch 18/19
----------
[train]
LOSS - 0.0150
ACC - 0.9600
PPV - ALL: 1.0000  COVID-19: 1.0000  PNEUMONIA: 1.0000  NORMAL: 1.0000 
RECALL - ALL: 1.0000  COVID-19: 1.0000  PNEUMONIA: 1.0000  NORMAL: 1.0000 
F1 - ALL: 1.0000  COVID-19: 1.0000  PNEUMONIA: 1.0000  NORMAL: 1.0000 
Mask ratio's range: 0.875 ~ 1.0

[val]
LOSS - 0.5319
ACC - 0.7867
PPV - ALL: 0.8058  COVID-19: 0.8675  PNEUMONIA: 0.7288  NORMAL: 0.8211 
RECALL - ALL: 0.7975  COVID-19: 0.7200  PNEUMONIA: 0.8600  NORMAL: 0.8125 
F1 - ALL: 0.7976  COVID-19: 0.7869  PNEUMONIA: 0.7890  NORMAL: 0.8168 

Epoch 19/19
----------
[train]
LOSS - 0.0112
ACC - 0.9600
PPV - ALL: 1.0000  COVID-19: 1.0000  PNEUMONIA: 1.0000  NORMAL: 1.0000 
RECALL - ALL: 1.0000  COVID-19: 1.0000  PNEUMONIA: 1.0000  NORMAL: 1.0000 
F1 - ALL: 1.0000  COVID-19: 1.0000  PNEUMONIA: 1.0000  NORMAL: 1.0000 
Mask ratio's range: 0.875 ~ 0.9375

[val]
LOSS - 0.5388
ACC - 0.7767
PPV - ALL: 0.7981  COVID-19: 0.8625  PNEUMONIA: 0.7107  NORMAL: 0.8211 
RECALL - ALL: 0.7875  COVID-19: 0.6900  PNEUMONIA: 0.8600  NORMAL: 0.8125 
F1 - ALL: 0.7873  COVID-19: 0.7667  PNEUMONIA: 0.7783  NORMAL: 0.8168 


--------------------
[Best results]
ACC - 0.8033
PPV - ALL: 0.8163  COVID-19: 0.8681  PNEUMONIA: 0.7788  NORMAL: 0.8020 
RECALL - ALL: 0.8146  COVID-19: 0.7900  PNEUMONIA: 0.8100  NORMAL: 0.8438 
F1 - ALL: 0.8146  COVID-19: 0.8272  PNEUMONIA: 0.7941  NORMAL: 0.8224 

Training complete in 1m 30s
-------------------- 

--------------------
Model 2
--------------------

Epoch 0/19
----------
[train]
LOSS - 1.0195
ACC - 0.4133
PPV - ALL: 0.4462  COVID-19: 0.3214  PNEUMONIA: 0.5556  NORMAL: 0.4615 
RECALL - ALL: 0.4306  COVID-19: 0.3750  PNEUMONIA: 0.4167  NORMAL: 0.5000 
F1 - ALL: 0.4341  COVID-19: 0.3461  PNEUMONIA: 0.4762  NORMAL: 0.4800 
Mask ratio's range: 1.0 ~ 1.0

[val]
LOSS - 0.9858
ACC - 0.5500
PPV - ALL: 0.7028  COVID-19: 1.0000  PNEUMONIA: 0.5743  NORMAL: 0.5342 
RECALL - ALL: 0.5608  COVID-19: 0.0200  PNEUMONIA: 0.8500  NORMAL: 0.8125 
F1 - ALL: 0.4564  COVID-19: 0.0392  PNEUMONIA: 0.6855  NORMAL: 0.6446 

Epoch 1/19
----------
[train]
LOSS - 0.6956
ACC - 0.8533
PPV - ALL: 0.9013  COVID-19: 0.9474  PNEUMONIA: 0.9565  NORMAL: 0.8000 
RECALL - ALL: 0.8889  COVID-19: 0.7500  PNEUMONIA: 0.9167  NORMAL: 1.0000 
F1 - ALL: 0.8874  COVID-19: 0.8372  PNEUMONIA: 0.9362  NORMAL: 0.8889 
Mask ratio's range: 1.0 ~ 1.0

[val]
LOSS - 0.7608
ACC - 0.7767
PPV - ALL: 0.7914  COVID-19: 0.7615  PNEUMONIA: 0.8434  NORMAL: 0.7692 
RECALL - ALL: 0.7878  COVID-19: 0.8300  PNEUMONIA: 0.7000  NORMAL: 0.8333 
F1 - ALL: 0.7864  COVID-19: 0.7943  PNEUMONIA: 0.7650  NORMAL: 0.8000 

Epoch 2/19
----------
[train]
LOSS - 0.2863
ACC - 0.9600
PPV - ALL: 1.0000  COVID-19: 1.0000  PNEUMONIA: 1.0000  NORMAL: 1.0000 
RECALL - ALL: 1.0000  COVID-19: 1.0000  PNEUMONIA: 1.0000  NORMAL: 1.0000 
F1 - ALL: 1.0000  COVID-19: 1.0000  PNEUMONIA: 1.0000  NORMAL: 1.0000 
Mask ratio's range: 1.0 ~ 1.0

[val]
LOSS - 0.6003
ACC - 0.7700
PPV - ALL: 0.8044  COVID-19: 0.9394  PNEUMONIA: 0.7097  NORMAL: 0.7642 
RECALL - ALL: 0.7813  COVID-19: 0.6200  PNEUMONIA: 0.8800  NORMAL: 0.8438 
F1 - ALL: 0.7782  COVID-19: 0.7470  PNEUMONIA: 0.7857  NORMAL: 0.8020 

Epoch 3/19
----------
[train]
LOSS - 0.1051
ACC - 0.9600
PPV - ALL: 1.0000  COVID-19: 1.0000  PNEUMONIA: 1.0000  NORMAL: 1.0000 
RECALL - ALL: 1.0000  COVID-19: 1.0000  PNEUMONIA: 1.0000  NORMAL: 1.0000 
F1 - ALL: 1.0000  COVID-19: 1.0000  PNEUMONIA: 1.0000  NORMAL: 1.0000 
Mask ratio's range: 1.0 ~ 1.0

[val]
LOSS - 0.5159
ACC - 0.8067
PPV - ALL: 0.8174  COVID-19: 0.8350  PNEUMONIA: 0.8020  NORMAL: 0.8152 
RECALL - ALL: 0.8171  COVID-19: 0.8600  PNEUMONIA: 0.8100  NORMAL: 0.7812 
F1 - ALL: 0.8170  COVID-19: 0.8473  PNEUMONIA: 0.8060  NORMAL: 0.7978 

Epoch 4/19
----------
[train]
LOSS - 0.0418
ACC - 0.9600
PPV - ALL: 1.0000  COVID-19: 1.0000  PNEUMONIA: 1.0000  NORMAL: 1.0000 
RECALL - ALL: 1.0000  COVID-19: 1.0000  PNEUMONIA: 1.0000  NORMAL: 1.0000 
F1 - ALL: 1.0000  COVID-19: 1.0000  PNEUMONIA: 1.0000  NORMAL: 1.0000 
Mask ratio's range: 1.0 ~ 1.0

[val]
LOSS - 0.4980
ACC - 0.8267
PPV - ALL: 0.8402  COVID-19: 0.8925  PNEUMONIA: 0.8000  NORMAL: 0.8280 
RECALL - ALL: 0.8374  COVID-19: 0.8300  PNEUMONIA: 0.8800  NORMAL: 0.8021 
F1 - ALL: 0.8377  COVID-19: 0.8601  PNEUMONIA: 0.8381  NORMAL: 0.8148 

Epoch 5/19
----------
[train]
LOSS - 0.0232
ACC - 0.9600
PPV - ALL: 1.0000  COVID-19: 1.0000  PNEUMONIA: 1.0000  NORMAL: 1.0000 
RECALL - ALL: 1.0000  COVID-19: 1.0000  PNEUMONIA: 1.0000  NORMAL: 1.0000 
F1 - ALL: 1.0000  COVID-19: 1.0000  PNEUMONIA: 1.0000  NORMAL: 1.0000 
Mask ratio's range: 0.9375 ~ 1.0

[val]
LOSS - 0.4857
ACC - 0.8167
PPV - ALL: 0.8323  COVID-19: 0.8989  PNEUMONIA: 0.7788  NORMAL: 0.8191 
RECALL - ALL: 0.8274  COVID-19: 0.8000  PNEUMONIA: 0.8800  NORMAL: 0.8021 
F1 - ALL: 0.8278  COVID-19: 0.8466  PNEUMONIA: 0.8263  NORMAL: 0.8105 

Epoch 6/19
----------
[train]
LOSS - 0.0176
ACC - 0.9600
PPV - ALL: 1.0000  COVID-19: 1.0000  PNEUMONIA: 1.0000  NORMAL: 1.0000 
RECALL - ALL: 1.0000  COVID-19: 1.0000  PNEUMONIA: 1.0000  NORMAL: 1.0000 
F1 - ALL: 1.0000  COVID-19: 1.0000  PNEUMONIA: 1.0000  NORMAL: 1.0000 
Mask ratio's range: 0.9375 ~ 1.0

[val]
LOSS - 0.4698
ACC - 0.8200
PPV - ALL: 0.8347  COVID-19: 0.9011  PNEUMONIA: 0.7838  NORMAL: 0.8191 
RECALL - ALL: 0.8307  COVID-19: 0.8200  PNEUMONIA: 0.8700  NORMAL: 0.8021 
F1 - ALL: 0.8313  COVID-19: 0.8586  PNEUMONIA: 0.8247  NORMAL: 0.8105 

Epoch 7/19
----------
[train]
LOSS - 0.0141
ACC - 0.9600
PPV - ALL: 1.0000  COVID-19: 1.0000  PNEUMONIA: 1.0000  NORMAL: 1.0000 
RECALL - ALL: 1.0000  COVID-19: 1.0000  PNEUMONIA: 1.0000  NORMAL: 1.0000 
F1 - ALL: 1.0000  COVID-19: 1.0000  PNEUMONIA: 1.0000  NORMAL: 1.0000 
Mask ratio's range: 0.9375 ~ 1.0

[val]
LOSS - 0.4688
ACC - 0.8200
PPV - ALL: 0.8369  COVID-19: 0.9195  PNEUMONIA: 0.7788  NORMAL: 0.8125 
RECALL - ALL: 0.8308  COVID-19: 0.8000  PNEUMONIA: 0.8800  NORMAL: 0.8125 
F1 - ALL: 0.8315  COVID-19: 0.8556  PNEUMONIA: 0.8263  NORMAL: 0.8125 

Epoch 8/19
----------
[train]
LOSS - 0.0138
ACC - 0.9600
PPV - ALL: 1.0000  COVID-19: 1.0000  PNEUMONIA: 1.0000  NORMAL: 1.0000 
RECALL - ALL: 1.0000  COVID-19: 1.0000  PNEUMONIA: 1.0000  NORMAL: 1.0000 
F1 - ALL: 1.0000  COVID-19: 1.0000  PNEUMONIA: 1.0000  NORMAL: 1.0000 
Mask ratio's range: 0.875 ~ 1.0

[val]
LOSS - 0.4710
ACC - 0.8167
PPV - ALL: 0.8338  COVID-19: 0.9186  PNEUMONIA: 0.7788  NORMAL: 0.8041 
RECALL - ALL: 0.8275  COVID-19: 0.7900  PNEUMONIA: 0.8800  NORMAL: 0.8125 
F1 - ALL: 0.8280  COVID-19: 0.8495  PNEUMONIA: 0.8263  NORMAL: 0.8083 

Epoch 9/19
----------
[train]
LOSS - 0.0179
ACC - 0.9600
PPV - ALL: 1.0000  COVID-19: 1.0000  PNEUMONIA: 1.0000  NORMAL: 1.0000 
RECALL - ALL: 1.0000  COVID-19: 1.0000  PNEUMONIA: 1.0000  NORMAL: 1.0000 
F1 - ALL: 1.0000  COVID-19: 1.0000  PNEUMONIA: 1.0000  NORMAL: 1.0000 
Mask ratio's range: 0.875 ~ 1.0

[val]
LOSS - 0.4944
ACC - 0.8167
PPV - ALL: 0.8364  COVID-19: 0.9167  PNEUMONIA: 0.7627  NORMAL: 0.8298 
RECALL - ALL: 0.8275  COVID-19: 0.7700  PNEUMONIA: 0.9000  NORMAL: 0.8125 
F1 - ALL: 0.8279  COVID-19: 0.8370  PNEUMONIA: 0.8257  NORMAL: 0.8211 

Epoch 10/19
----------
[train]
LOSS - 0.0149
ACC - 0.9600
PPV - ALL: 1.0000  COVID-19: 1.0000  PNEUMONIA: 1.0000  NORMAL: 1.0000 
RECALL - ALL: 1.0000  COVID-19: 1.0000  PNEUMONIA: 1.0000  NORMAL: 1.0000 
F1 - ALL: 1.0000  COVID-19: 1.0000  PNEUMONIA: 1.0000  NORMAL: 1.0000 
Mask ratio's range: 0.875 ~ 1.0

[val]
LOSS - 0.4755
ACC - 0.8167
PPV - ALL: 0.8364  COVID-19: 0.9167  PNEUMONIA: 0.7627  NORMAL: 0.8298 
RECALL - ALL: 0.8275  COVID-19: 0.7700  PNEUMONIA: 0.9000  NORMAL: 0.8125 
F1 - ALL: 0.8279  COVID-19: 0.8370  PNEUMONIA: 0.8257  NORMAL: 0.8211 

Epoch 11/19
----------
[train]
LOSS - 0.0220
ACC - 0.9600
PPV - ALL: 1.0000  COVID-19: 1.0000  PNEUMONIA: 1.0000  NORMAL: 1.0000 
RECALL - ALL: 1.0000  COVID-19: 1.0000  PNEUMONIA: 1.0000  NORMAL: 1.0000 
F1 - ALL: 1.0000  COVID-19: 1.0000  PNEUMONIA: 1.0000  NORMAL: 1.0000 
Mask ratio's range: 0.8125 ~ 1.0

[val]
LOSS - 0.4812
ACC - 0.8067
PPV - ALL: 0.8279  COVID-19: 0.9146  PNEUMONIA: 0.7479  NORMAL: 0.8211 
RECALL - ALL: 0.8175  COVID-19: 0.7500  PNEUMONIA: 0.8900  NORMAL: 0.8125 
F1 - ALL: 0.8179  COVID-19: 0.8242  PNEUMONIA: 0.8128  NORMAL: 0.8168 

Epoch 12/19
----------
[train]
LOSS - 0.0161
ACC - 0.9600
PPV - ALL: 1.0000  COVID-19: 1.0000  PNEUMONIA: 1.0000  NORMAL: 1.0000 
RECALL - ALL: 1.0000  COVID-19: 1.0000  PNEUMONIA: 1.0000  NORMAL: 1.0000 
F1 - ALL: 1.0000  COVID-19: 1.0000  PNEUMONIA: 1.0000  NORMAL: 1.0000 
Mask ratio's range: 0.75 ~ 1.0

[val]
LOSS - 0.4848
ACC - 0.7967
PPV - ALL: 0.8206  COVID-19: 0.9221  PNEUMONIA: 0.7417  NORMAL: 0.7980 
RECALL - ALL: 0.8076  COVID-19: 0.7100  PNEUMONIA: 0.8900  NORMAL: 0.8229 
F1 - ALL: 0.8072  COVID-19: 0.8023  PNEUMONIA: 0.8091  NORMAL: 0.8103 

Epoch 13/19
----------
[train]
LOSS - 0.0140
ACC - 0.9600
PPV - ALL: 1.0000  COVID-19: 1.0000  PNEUMONIA: 1.0000  NORMAL: 1.0000 
RECALL - ALL: 1.0000  COVID-19: 1.0000  PNEUMONIA: 1.0000  NORMAL: 1.0000 
F1 - ALL: 1.0000  COVID-19: 1.0000  PNEUMONIA: 1.0000  NORMAL: 1.0000 
Mask ratio's range: 0.75 ~ 1.0

[val]
LOSS - 0.4870
ACC - 0.8067
PPV - ALL: 0.8274  COVID-19: 0.9250  PNEUMONIA: 0.7672  NORMAL: 0.7900 
RECALL - ALL: 0.8176  COVID-19: 0.7400  PNEUMONIA: 0.8900  NORMAL: 0.8229 
F1 - ALL: 0.8175  COVID-19: 0.8222  PNEUMONIA: 0.8241  NORMAL: 0.8061 

Epoch 14/19
----------
[train]
LOSS - 0.0288
ACC - 0.9600
PPV - ALL: 1.0000  COVID-19: 1.0000  PNEUMONIA: 1.0000  NORMAL: 1.0000 
RECALL - ALL: 1.0000  COVID-19: 1.0000  PNEUMONIA: 1.0000  NORMAL: 1.0000 
F1 - ALL: 1.0000  COVID-19: 1.0000  PNEUMONIA: 1.0000  NORMAL: 1.0000 
Mask ratio's range: 0.75 ~ 1.0

[val]
LOSS - 0.4858
ACC - 0.8100
PPV - ALL: 0.8330  COVID-19: 0.9487  PNEUMONIA: 0.7788  NORMAL: 0.7714 
RECALL - ALL: 0.8213  COVID-19: 0.7400  PNEUMONIA: 0.8800  NORMAL: 0.8438 
F1 - ALL: 0.8213  COVID-19: 0.8315  PNEUMONIA: 0.8263  NORMAL: 0.8060 

Epoch 15/19
----------
[train]
LOSS - 0.0230
ACC - 0.9600
PPV - ALL: 1.0000  COVID-19: 1.0000  PNEUMONIA: 1.0000  NORMAL: 1.0000 
RECALL - ALL: 1.0000  COVID-19: 1.0000  PNEUMONIA: 1.0000  NORMAL: 1.0000 
F1 - ALL: 1.0000  COVID-19: 1.0000  PNEUMONIA: 1.0000  NORMAL: 1.0000 
Mask ratio's range: 0.8125 ~ 1.0

[val]
LOSS - 0.4621
ACC - 0.8200
PPV - ALL: 0.8403  COVID-19: 0.9512  PNEUMONIA: 0.7909  NORMAL: 0.7788 
RECALL - ALL: 0.8313  COVID-19: 0.7800  PNEUMONIA: 0.8700  NORMAL: 0.8438 
F1 - ALL: 0.8319  COVID-19: 0.8571  PNEUMONIA: 0.8286  NORMAL: 0.8100 

Epoch 16/19
----------
[train]
LOSS - 0.0196
ACC - 0.9600
PPV - ALL: 1.0000  COVID-19: 1.0000  PNEUMONIA: 1.0000  NORMAL: 1.0000 
RECALL - ALL: 1.0000  COVID-19: 1.0000  PNEUMONIA: 1.0000  NORMAL: 1.0000 
F1 - ALL: 1.0000  COVID-19: 1.0000  PNEUMONIA: 1.0000  NORMAL: 1.0000 
Mask ratio's range: 0.8125 ~ 0.9375

[val]
LOSS - 0.4620
ACC - 0.8167
PPV - ALL: 0.8348  COVID-19: 0.9286  PNEUMONIA: 0.8095  NORMAL: 0.7664 
RECALL - ALL: 0.8281  COVID-19: 0.7800  PNEUMONIA: 0.8500  NORMAL: 0.8542 
F1 - ALL: 0.8283  COVID-19: 0.8478  PNEUMONIA: 0.8293  NORMAL: 0.8079 

Epoch 17/19
----------
[train]
LOSS - 0.0197
ACC - 0.9600
PPV - ALL: 1.0000  COVID-19: 1.0000  PNEUMONIA: 1.0000  NORMAL: 1.0000 
RECALL - ALL: 1.0000  COVID-19: 1.0000  PNEUMONIA: 1.0000  NORMAL: 1.0000 
F1 - ALL: 1.0000  COVID-19: 1.0000  PNEUMONIA: 1.0000  NORMAL: 1.0000 
Mask ratio's range: 0.8125 ~ 0.9375

[val]
LOSS - 0.4713
ACC - 0.8100
PPV - ALL: 0.8305  COVID-19: 0.9383  PNEUMONIA: 0.7818  NORMAL: 0.7714 
RECALL - ALL: 0.8213  COVID-19: 0.7600  PNEUMONIA: 0.8600  NORMAL: 0.8438 
F1 - ALL: 0.8216  COVID-19: 0.8398  PNEUMONIA: 0.8190  NORMAL: 0.8060 

Epoch 18/19
----------
[train]
LOSS - 0.0245
ACC - 0.9600
PPV - ALL: 1.0000  COVID-19: 1.0000  PNEUMONIA: 1.0000  NORMAL: 1.0000 
RECALL - ALL: 1.0000  COVID-19: 1.0000  PNEUMONIA: 1.0000  NORMAL: 1.0000 
F1 - ALL: 1.0000  COVID-19: 1.0000  PNEUMONIA: 1.0000  NORMAL: 1.0000 
Mask ratio's range: 0.75 ~ 0.9375

[val]
LOSS - 0.4781
ACC - 0.8100
PPV - ALL: 0.8288  COVID-19: 0.9277  PNEUMONIA: 0.7944  NORMAL: 0.7642 
RECALL - ALL: 0.8213  COVID-19: 0.7700  PNEUMONIA: 0.8500  NORMAL: 0.8438 
F1 - ALL: 0.8216  COVID-19: 0.8415  PNEUMONIA: 0.8213  NORMAL: 0.8020 

Epoch 19/19
----------
[train]
LOSS - 0.0556
ACC - 0.9600
PPV - ALL: 1.0000  COVID-19: 1.0000  PNEUMONIA: 1.0000  NORMAL: 1.0000 
RECALL - ALL: 1.0000  COVID-19: 1.0000  PNEUMONIA: 1.0000  NORMAL: 1.0000 
F1 - ALL: 1.0000  COVID-19: 1.0000  PNEUMONIA: 1.0000  NORMAL: 1.0000 
Mask ratio's range: 0.75 ~ 0.9375

[val]
LOSS - 0.4913
ACC - 0.8000
PPV - ALL: 0.8211  COVID-19: 0.9146  PNEUMONIA: 0.8182  NORMAL: 0.7304 
RECALL - ALL: 0.8117  COVID-19: 0.7500  PNEUMONIA: 0.8100  NORMAL: 0.8750 
F1 - ALL: 0.8115  COVID-19: 0.8242  PNEUMONIA: 0.8141  NORMAL: 0.7962 


--------------------
[Best results]
ACC - 0.8267
PPV - ALL: 0.8402  COVID-19: 0.8925  PNEUMONIA: 0.8000  NORMAL: 0.8280 
RECALL - ALL: 0.8374  COVID-19: 0.8300  PNEUMONIA: 0.8800  NORMAL: 0.8021 
F1 - ALL: 0.8377  COVID-19: 0.8601  PNEUMONIA: 0.8381  NORMAL: 0.8148 

Training complete in 1m 29s
-------------------- 

--------------------
Model 3
--------------------

Epoch 0/19
----------
[train]
LOSS - 0.9902
ACC - 0.5333
PPV - ALL: 0.5548  COVID-19: 0.5714  PNEUMONIA: 0.5217  NORMAL: 0.5714 
RECALL - ALL: 0.5556  COVID-19: 0.5000  PNEUMONIA: 0.5000  NORMAL: 0.6667 
F1 - ALL: 0.5531  COVID-19: 0.5333  PNEUMONIA: 0.5106  NORMAL: 0.6154 
Mask ratio's range: 1.0 ~ 1.0

[val]
LOSS - 0.9684
ACC - 0.5367
PPV - ALL: 0.6399  COVID-19: 0.8684  PNEUMONIA: 0.5882  NORMAL: 0.4632 
RECALL - ALL: 0.5489  COVID-19: 0.3300  PNEUMONIA: 0.4000  NORMAL: 0.9167 
F1 - ALL: 0.5233  COVID-19: 0.4783  PNEUMONIA: 0.4762  NORMAL: 0.6154 

Epoch 1/19
----------
[train]
LOSS - 0.6022
ACC - 0.8933
PPV - ALL: 0.9363  COVID-19: 1.0000  PNEUMONIA: 0.9200  NORMAL: 0.8889 
RECALL - ALL: 0.9305  COVID-19: 0.8333  PNEUMONIA: 0.9583  NORMAL: 1.0000 
F1 - ALL: 0.9297  COVID-19: 0.9091  PNEUMONIA: 0.9388  NORMAL: 0.9412 
Mask ratio's range: 1.0 ~ 1.0

[val]
LOSS - 0.7117
ACC - 0.7867
PPV - ALL: 0.8022  COVID-19: 0.8690  PNEUMONIA: 0.7757  NORMAL: 0.7619 
RECALL - ALL: 0.7978  COVID-19: 0.7300  PNEUMONIA: 0.8300  NORMAL: 0.8333 
F1 - ALL: 0.7971  COVID-19: 0.7935  PNEUMONIA: 0.8019  NORMAL: 0.7960 

Epoch 2/19
----------
[train]
LOSS - 0.2429
ACC - 0.9600
PPV - ALL: 1.0000  COVID-19: 1.0000  PNEUMONIA: 1.0000  NORMAL: 1.0000 
RECALL - ALL: 1.0000  COVID-19: 1.0000  PNEUMONIA: 1.0000  NORMAL: 1.0000 
F1 - ALL: 1.0000  COVID-19: 1.0000  PNEUMONIA: 1.0000  NORMAL: 1.0000 
Mask ratio's range: 1.0 ~ 1.0

[val]
LOSS - 0.5699
ACC - 0.8233
PPV - ALL: 0.8362  COVID-19: 0.8660  PNEUMONIA: 0.7982  NORMAL: 0.8444 
RECALL - ALL: 0.8339  COVID-19: 0.8400  PNEUMONIA: 0.8700  NORMAL: 0.7917 
F1 - ALL: 0.8342  COVID-19: 0.8528  PNEUMONIA: 0.8326  NORMAL: 0.8172 

Epoch 3/19
----------
[train]
LOSS - 0.0866
ACC - 0.9600
PPV - ALL: 1.0000  COVID-19: 1.0000  PNEUMONIA: 1.0000  NORMAL: 1.0000 
RECALL - ALL: 1.0000  COVID-19: 1.0000  PNEUMONIA: 1.0000  NORMAL: 1.0000 
F1 - ALL: 1.0000  COVID-19: 1.0000  PNEUMONIA: 1.0000  NORMAL: 1.0000 
Mask ratio's range: 1.0 ~ 1.0

[val]
LOSS - 0.4983
ACC - 0.8167
PPV - ALL: 0.8292  COVID-19: 0.8485  PNEUMONIA: 0.7963  NORMAL: 0.8427 
RECALL - ALL: 0.8271  COVID-19: 0.8400  PNEUMONIA: 0.8600  NORMAL: 0.7812 
F1 - ALL: 0.8273  COVID-19: 0.8442  PNEUMONIA: 0.8269  NORMAL: 0.8108 

Epoch 4/19
----------
[train]
LOSS - 0.0367
ACC - 0.9600
PPV - ALL: 1.0000  COVID-19: 1.0000  PNEUMONIA: 1.0000  NORMAL: 1.0000 
RECALL - ALL: 1.0000  COVID-19: 1.0000  PNEUMONIA: 1.0000  NORMAL: 1.0000 
F1 - ALL: 1.0000  COVID-19: 1.0000  PNEUMONIA: 1.0000  NORMAL: 1.0000 
Mask ratio's range: 1.0 ~ 1.0

[val]
LOSS - 0.4677
ACC - 0.8200
PPV - ALL: 0.8329  COVID-19: 0.8500  PNEUMONIA: 0.7963  NORMAL: 0.8523 
RECALL - ALL: 0.8304  COVID-19: 0.8500  PNEUMONIA: 0.8600  NORMAL: 0.7812 
F1 - ALL: 0.8307  COVID-19: 0.8500  PNEUMONIA: 0.8269  NORMAL: 0.8152 

Epoch 5/19
----------
[train]
LOSS - 0.0205
ACC - 0.9600
PPV - ALL: 1.0000  COVID-19: 1.0000  PNEUMONIA: 1.0000  NORMAL: 1.0000 
RECALL - ALL: 1.0000  COVID-19: 1.0000  PNEUMONIA: 1.0000  NORMAL: 1.0000 
F1 - ALL: 1.0000  COVID-19: 1.0000  PNEUMONIA: 1.0000  NORMAL: 1.0000 
Mask ratio's range: 1.0 ~ 1.0

[val]
LOSS - 0.4556
ACC - 0.8200
PPV - ALL: 0.8324  COVID-19: 0.8431  PNEUMONIA: 0.8019  NORMAL: 0.8523 
RECALL - ALL: 0.8304  COVID-19: 0.8600  PNEUMONIA: 0.8500  NORMAL: 0.7812 
F1 - ALL: 0.8306  COVID-19: 0.8515  PNEUMONIA: 0.8252  NORMAL: 0.8152 

Epoch 6/19
----------
[train]
LOSS - 0.0142
ACC - 0.9600
PPV - ALL: 1.0000  COVID-19: 1.0000  PNEUMONIA: 1.0000  NORMAL: 1.0000 
RECALL - ALL: 1.0000  COVID-19: 1.0000  PNEUMONIA: 1.0000  NORMAL: 1.0000 
F1 - ALL: 1.0000  COVID-19: 1.0000  PNEUMONIA: 1.0000  NORMAL: 1.0000 
Mask ratio's range: 1.0 ~ 1.0

[val]
LOSS - 0.4490
ACC - 0.8200
PPV - ALL: 0.8324  COVID-19: 0.8431  PNEUMONIA: 0.8019  NORMAL: 0.8523 
RECALL - ALL: 0.8304  COVID-19: 0.8600  PNEUMONIA: 0.8500  NORMAL: 0.7812 
F1 - ALL: 0.8306  COVID-19: 0.8515  PNEUMONIA: 0.8252  NORMAL: 0.8152 

Epoch 7/19
----------
[train]
LOSS - 0.0116
ACC - 0.9600
PPV - ALL: 1.0000  COVID-19: 1.0000  PNEUMONIA: 1.0000  NORMAL: 1.0000 
RECALL - ALL: 1.0000  COVID-19: 1.0000  PNEUMONIA: 1.0000  NORMAL: 1.0000 
F1 - ALL: 1.0000  COVID-19: 1.0000  PNEUMONIA: 1.0000  NORMAL: 1.0000 
Mask ratio's range: 0.9375 ~ 1.0

[val]
LOSS - 0.4409
ACC - 0.8200
PPV - ALL: 0.8324  COVID-19: 0.8431  PNEUMONIA: 0.8019  NORMAL: 0.8523 
RECALL - ALL: 0.8304  COVID-19: 0.8600  PNEUMONIA: 0.8500  NORMAL: 0.7812 
F1 - ALL: 0.8306  COVID-19: 0.8515  PNEUMONIA: 0.8252  NORMAL: 0.8152 

Epoch 8/19
----------
[train]
LOSS - 0.0128
ACC - 0.9600
PPV - ALL: 1.0000  COVID-19: 1.0000  PNEUMONIA: 1.0000  NORMAL: 1.0000 
RECALL - ALL: 1.0000  COVID-19: 1.0000  PNEUMONIA: 1.0000  NORMAL: 1.0000 
F1 - ALL: 1.0000  COVID-19: 1.0000  PNEUMONIA: 1.0000  NORMAL: 1.0000 
Mask ratio's range: 0.9375 ~ 1.0

[val]
LOSS - 0.4358
ACC - 0.8200
PPV - ALL: 0.8324  COVID-19: 0.8431  PNEUMONIA: 0.8019  NORMAL: 0.8523 
RECALL - ALL: 0.8304  COVID-19: 0.8600  PNEUMONIA: 0.8500  NORMAL: 0.7812 
F1 - ALL: 0.8306  COVID-19: 0.8515  PNEUMONIA: 0.8252  NORMAL: 0.8152 

Epoch 9/19
----------
[train]
LOSS - 0.0120
ACC - 0.9600
PPV - ALL: 1.0000  COVID-19: 1.0000  PNEUMONIA: 1.0000  NORMAL: 1.0000 
RECALL - ALL: 1.0000  COVID-19: 1.0000  PNEUMONIA: 1.0000  NORMAL: 1.0000 
F1 - ALL: 1.0000  COVID-19: 1.0000  PNEUMONIA: 1.0000  NORMAL: 1.0000 
Mask ratio's range: 0.9375 ~ 1.0

[val]
LOSS - 0.4323
ACC - 0.8200
PPV - ALL: 0.8324  COVID-19: 0.8431  PNEUMONIA: 0.8019  NORMAL: 0.8523 
RECALL - ALL: 0.8304  COVID-19: 0.8600  PNEUMONIA: 0.8500  NORMAL: 0.7812 
F1 - ALL: 0.8306  COVID-19: 0.8515  PNEUMONIA: 0.8252  NORMAL: 0.8152 

Epoch 10/19
----------
[train]
LOSS - 0.0142
ACC - 0.9600
PPV - ALL: 1.0000  COVID-19: 1.0000  PNEUMONIA: 1.0000  NORMAL: 1.0000 
RECALL - ALL: 1.0000  COVID-19: 1.0000  PNEUMONIA: 1.0000  NORMAL: 1.0000 
F1 - ALL: 1.0000  COVID-19: 1.0000  PNEUMONIA: 1.0000  NORMAL: 1.0000 
Mask ratio's range: 0.8125 ~ 1.0

[val]
LOSS - 0.4318
ACC - 0.8300
PPV - ALL: 0.8418  COVID-19: 0.8462  PNEUMONIA: 0.8252  NORMAL: 0.8539 
RECALL - ALL: 0.8406  COVID-19: 0.8800  PNEUMONIA: 0.8500  NORMAL: 0.7917 
F1 - ALL: 0.8406  COVID-19: 0.8628  PNEUMONIA: 0.8374  NORMAL: 0.8216 

Epoch 11/19
----------
[train]
LOSS - 0.0204
ACC - 0.9600
PPV - ALL: 1.0000  COVID-19: 1.0000  PNEUMONIA: 1.0000  NORMAL: 1.0000 
RECALL - ALL: 1.0000  COVID-19: 1.0000  PNEUMONIA: 1.0000  NORMAL: 1.0000 
F1 - ALL: 1.0000  COVID-19: 1.0000  PNEUMONIA: 1.0000  NORMAL: 1.0000 
Mask ratio's range: 0.8125 ~ 1.0

[val]
LOSS - 0.4235
ACC - 0.8300
PPV - ALL: 0.8422  COVID-19: 0.8600  PNEUMONIA: 0.8095  NORMAL: 0.8571 
RECALL - ALL: 0.8408  COVID-19: 0.8600  PNEUMONIA: 0.8500  NORMAL: 0.8125 
F1 - ALL: 0.8412  COVID-19: 0.8600  PNEUMONIA: 0.8293  NORMAL: 0.8342 

Epoch 12/19
----------
[train]
LOSS - 0.0323
ACC - 0.9600
PPV - ALL: 1.0000  COVID-19: 1.0000  PNEUMONIA: 1.0000  NORMAL: 1.0000 
RECALL - ALL: 1.0000  COVID-19: 1.0000  PNEUMONIA: 1.0000  NORMAL: 1.0000 
F1 - ALL: 1.0000  COVID-19: 1.0000  PNEUMONIA: 1.0000  NORMAL: 1.0000 
Mask ratio's range: 0.8125 ~ 1.0

[val]
LOSS - 0.4213
ACC - 0.8267
PPV - ALL: 0.8392  COVID-19: 0.8660  PNEUMONIA: 0.8037  NORMAL: 0.8478 
RECALL - ALL: 0.8375  COVID-19: 0.8400  PNEUMONIA: 0.8600  NORMAL: 0.8125 
F1 - ALL: 0.8378  COVID-19: 0.8528  PNEUMONIA: 0.8309  NORMAL: 0.8298 

Epoch 13/19
----------
[train]
LOSS - 0.0238
ACC - 0.9600
PPV - ALL: 1.0000  COVID-19: 1.0000  PNEUMONIA: 1.0000  NORMAL: 1.0000 
RECALL - ALL: 1.0000  COVID-19: 1.0000  PNEUMONIA: 1.0000  NORMAL: 1.0000 
F1 - ALL: 1.0000  COVID-19: 1.0000  PNEUMONIA: 1.0000  NORMAL: 1.0000 
Mask ratio's range: 0.75 ~ 1.0

[val]
LOSS - 0.4211
ACC - 0.8300
PPV - ALL: 0.8427  COVID-19: 0.8673  PNEUMONIA: 0.8037  NORMAL: 0.8571 
RECALL - ALL: 0.8408  COVID-19: 0.8500  PNEUMONIA: 0.8600  NORMAL: 0.8125 
F1 - ALL: 0.8412  COVID-19: 0.8586  PNEUMONIA: 0.8309  NORMAL: 0.8342 

Epoch 14/19
----------
[train]
LOSS - 0.0274
ACC - 0.9600
PPV - ALL: 1.0000  COVID-19: 1.0000  PNEUMONIA: 1.0000  NORMAL: 1.0000 
RECALL - ALL: 1.0000  COVID-19: 1.0000  PNEUMONIA: 1.0000  NORMAL: 1.0000 
F1 - ALL: 1.0000  COVID-19: 1.0000  PNEUMONIA: 1.0000  NORMAL: 1.0000 
Mask ratio's range: 0.75 ~ 1.0

[val]
LOSS - 0.4179
ACC - 0.8333
PPV - ALL: 0.8471  COVID-19: 0.8842  PNEUMONIA: 0.8000  NORMAL: 0.8571 
RECALL - ALL: 0.8442  COVID-19: 0.8400  PNEUMONIA: 0.8800  NORMAL: 0.8125 
F1 - ALL: 0.8446  COVID-19: 0.8615  PNEUMONIA: 0.8381  NORMAL: 0.8342 

Epoch 15/19
----------
[train]
LOSS - 0.0419
ACC - 0.9600
PPV - ALL: 1.0000  COVID-19: 1.0000  PNEUMONIA: 1.0000  NORMAL: 1.0000 
RECALL - ALL: 1.0000  COVID-19: 1.0000  PNEUMONIA: 1.0000  NORMAL: 1.0000 
F1 - ALL: 1.0000  COVID-19: 1.0000  PNEUMONIA: 1.0000  NORMAL: 1.0000 
Mask ratio's range: 0.75 ~ 1.0

[val]
LOSS - 0.4276
ACC - 0.8233
PPV - ALL: 0.8388  COVID-19: 0.8804  PNEUMONIA: 0.7788  NORMAL: 0.8571 
RECALL - ALL: 0.8342  COVID-19: 0.8100  PNEUMONIA: 0.8800  NORMAL: 0.8125 
F1 - ALL: 0.8347  COVID-19: 0.8437  PNEUMONIA: 0.8263  NORMAL: 0.8342 

Epoch 16/19
----------
[train]
LOSS - 0.0331
ACC - 0.9600
PPV - ALL: 1.0000  COVID-19: 1.0000  PNEUMONIA: 1.0000  NORMAL: 1.0000 
RECALL - ALL: 1.0000  COVID-19: 1.0000  PNEUMONIA: 1.0000  NORMAL: 1.0000 
F1 - ALL: 1.0000  COVID-19: 1.0000  PNEUMONIA: 1.0000  NORMAL: 1.0000 
Mask ratio's range: 0.75 ~ 1.0

[val]
LOSS - 0.4415
ACC - 0.8067
PPV - ALL: 0.8253  COVID-19: 0.8941  PNEUMONIA: 0.7521  NORMAL: 0.8298 
RECALL - ALL: 0.8175  COVID-19: 0.7600  PNEUMONIA: 0.8800  NORMAL: 0.8125 
F1 - ALL: 0.8179  COVID-19: 0.8216  PNEUMONIA: 0.8110  NORMAL: 0.8211 

Epoch 17/19
----------
[train]
LOSS - 0.0255
ACC - 0.9600
PPV - ALL: 1.0000  COVID-19: 1.0000  PNEUMONIA: 1.0000  NORMAL: 1.0000 
RECALL - ALL: 1.0000  COVID-19: 1.0000  PNEUMONIA: 1.0000  NORMAL: 1.0000 
F1 - ALL: 1.0000  COVID-19: 1.0000  PNEUMONIA: 1.0000  NORMAL: 1.0000 
Mask ratio's range: 0.75 ~ 0.9375

[val]
LOSS - 0.4681
ACC - 0.8067
PPV - ALL: 0.8321  COVID-19: 0.9241  PNEUMONIA: 0.7317  NORMAL: 0.8404 
RECALL - ALL: 0.8176  COVID-19: 0.7300  PNEUMONIA: 0.9000  NORMAL: 0.8229 
F1 - ALL: 0.8182  COVID-19: 0.8157  PNEUMONIA: 0.8072  NORMAL: 0.8316 

Epoch 18/19
----------
[train]
LOSS - 0.0219
ACC - 0.9600
PPV - ALL: 1.0000  COVID-19: 1.0000  PNEUMONIA: 1.0000  NORMAL: 1.0000 
RECALL - ALL: 1.0000  COVID-19: 1.0000  PNEUMONIA: 1.0000  NORMAL: 1.0000 
F1 - ALL: 1.0000  COVID-19: 1.0000  PNEUMONIA: 1.0000  NORMAL: 1.0000 
Mask ratio's range: 0.75 ~ 0.9375

[val]
LOSS - 0.4783
ACC - 0.8033
PPV - ALL: 0.8325  COVID-19: 0.9467  PNEUMONIA: 0.7280  NORMAL: 0.8229 
RECALL - ALL: 0.8143  COVID-19: 0.7100  PNEUMONIA: 0.9100  NORMAL: 0.8229 
F1 - ALL: 0.8144  COVID-19: 0.8114  PNEUMONIA: 0.8089  NORMAL: 0.8229 

Epoch 19/19
----------
[train]
LOSS - 0.0196
ACC - 0.9600
PPV - ALL: 1.0000  COVID-19: 1.0000  PNEUMONIA: 1.0000  NORMAL: 1.0000 
RECALL - ALL: 1.0000  COVID-19: 1.0000  PNEUMONIA: 1.0000  NORMAL: 1.0000 
F1 - ALL: 1.0000  COVID-19: 1.0000  PNEUMONIA: 1.0000  NORMAL: 1.0000 
Mask ratio's range: 0.75 ~ 0.9375

[val]
LOSS - 0.4841
ACC - 0.8033
PPV - ALL: 0.8287  COVID-19: 0.9125  PNEUMONIA: 0.7258  NORMAL: 0.8478 
RECALL - ALL: 0.8142  COVID-19: 0.7300  PNEUMONIA: 0.9000  NORMAL: 0.8125 
F1 - ALL: 0.8148  COVID-19: 0.8111  PNEUMONIA: 0.8036  NORMAL: 0.8298 


--------------------
[Best results]
ACC - 0.8333
PPV - ALL: 0.8471  COVID-19: 0.8842  PNEUMONIA: 0.8000  NORMAL: 0.8571 
RECALL - ALL: 0.8442  COVID-19: 0.8400  PNEUMONIA: 0.8800  NORMAL: 0.8125 
F1 - ALL: 0.8446  COVID-19: 0.8615  PNEUMONIA: 0.8381  NORMAL: 0.8342 

Training complete in 1m 30s
-------------------- 

--------------------
Model 4
--------------------

Epoch 0/19
----------
[train]
LOSS - 1.0112
ACC - 0.5067
PPV - ALL: 0.5267  COVID-19: 0.4583  PNEUMONIA: 0.5217  NORMAL: 0.6000 
RECALL - ALL: 0.5278  COVID-19: 0.4583  PNEUMONIA: 0.5000  NORMAL: 0.6250 
F1 - ALL: 0.5270  COVID-19: 0.4583  PNEUMONIA: 0.5106  NORMAL: 0.6122 
Mask ratio's range: 1.0 ~ 1.0

[val]
LOSS - 0.9903
ACC - 0.5333
PPV - ALL: 0.7216  COVID-19: 1.0000  PNEUMONIA: 0.7160  NORMAL: 0.4488 
RECALL - ALL: 0.5461  COVID-19: 0.1000  PNEUMONIA: 0.5800  NORMAL: 0.9583 
F1 - ALL: 0.4780  COVID-19: 0.1818  PNEUMONIA: 0.6409  NORMAL: 0.6113 

Epoch 1/19
----------
[train]
LOSS - 0.6352
ACC - 0.9067
PPV - ALL: 0.9477  COVID-19: 1.0000  PNEUMONIA: 0.9200  NORMAL: 0.9231 
RECALL - ALL: 0.9444  COVID-19: 0.8750  PNEUMONIA: 0.9583  NORMAL: 1.0000 
F1 - ALL: 0.9440  COVID-19: 0.9333  PNEUMONIA: 0.9388  NORMAL: 0.9600 
Mask ratio's range: 1.0 ~ 1.0

[val]
LOSS - 0.7602
ACC - 0.7567
PPV - ALL: 0.7701  COVID-19: 0.7857  PNEUMONIA: 0.7156  NORMAL: 0.8090 
RECALL - ALL: 0.7667  COVID-19: 0.7700  PNEUMONIA: 0.7800  NORMAL: 0.7500 
F1 - ALL: 0.7675  COVID-19: 0.7778  PNEUMONIA: 0.7464  NORMAL: 0.7784 

Epoch 2/19
----------
[train]
LOSS - 0.2771
ACC - 0.9467
PPV - ALL: 0.9867  COVID-19: 1.0000  PNEUMONIA: 1.0000  NORMAL: 0.9600 
RECALL - ALL: 0.9861  COVID-19: 1.0000  PNEUMONIA: 0.9583  NORMAL: 1.0000 
F1 - ALL: 0.9861  COVID-19: 1.0000  PNEUMONIA: 0.9787  NORMAL: 0.9796 
Mask ratio's range: 1.0 ~ 1.0

[val]
LOSS - 0.6213
ACC - 0.7700
PPV - ALL: 0.7941  COVID-19: 0.8816  PNEUMONIA: 0.7049  NORMAL: 0.7959 
RECALL - ALL: 0.7808  COVID-19: 0.6700  PNEUMONIA: 0.8600  NORMAL: 0.8125 
F1 - ALL: 0.7801  COVID-19: 0.7614  PNEUMONIA: 0.7748  NORMAL: 0.8041 

Epoch 3/19
----------
[train]
LOSS - 0.1017
ACC - 0.9600
PPV - ALL: 1.0000  COVID-19: 1.0000  PNEUMONIA: 1.0000  NORMAL: 1.0000 
RECALL - ALL: 1.0000  COVID-19: 1.0000  PNEUMONIA: 1.0000  NORMAL: 1.0000 
F1 - ALL: 1.0000  COVID-19: 1.0000  PNEUMONIA: 1.0000  NORMAL: 1.0000 
Mask ratio's range: 1.0 ~ 1.0

[val]
LOSS - 0.5625
ACC - 0.7767
PPV - ALL: 0.7966  COVID-19: 0.8444  PNEUMONIA: 0.7083  NORMAL: 0.8372 
RECALL - ALL: 0.7867  COVID-19: 0.7600  PNEUMONIA: 0.8500  NORMAL: 0.7500 
F1 - ALL: 0.7880  COVID-19: 0.8000  PNEUMONIA: 0.7727  NORMAL: 0.7912 

Epoch 4/19
----------
[train]
LOSS - 0.0415
ACC - 0.9600
PPV - ALL: 1.0000  COVID-19: 1.0000  PNEUMONIA: 1.0000  NORMAL: 1.0000 
RECALL - ALL: 1.0000  COVID-19: 1.0000  PNEUMONIA: 1.0000  NORMAL: 1.0000 
F1 - ALL: 1.0000  COVID-19: 1.0000  PNEUMONIA: 1.0000  NORMAL: 1.0000 
Mask ratio's range: 1.0 ~ 1.0

[val]
LOSS - 0.5316
ACC - 0.7767
PPV - ALL: 0.7913  COVID-19: 0.8132  PNEUMONIA: 0.7345  NORMAL: 0.8261 
RECALL - ALL: 0.7872  COVID-19: 0.7400  PNEUMONIA: 0.8300  NORMAL: 0.7917 
F1 - ALL: 0.7876  COVID-19: 0.7749  PNEUMONIA: 0.7793  NORMAL: 0.8085 

Epoch 5/19
----------
[train]
LOSS - 0.0268
ACC - 0.9600
PPV - ALL: 1.0000  COVID-19: 1.0000  PNEUMONIA: 1.0000  NORMAL: 1.0000 
RECALL - ALL: 1.0000  COVID-19: 1.0000  PNEUMONIA: 1.0000  NORMAL: 1.0000 
F1 - ALL: 1.0000  COVID-19: 1.0000  PNEUMONIA: 1.0000  NORMAL: 1.0000 
Mask ratio's range: 0.9375 ~ 1.0

[val]
LOSS - 0.5198
ACC - 0.7767
PPV - ALL: 0.7922  COVID-19: 0.8152  PNEUMONIA: 0.7281  NORMAL: 0.8333 
RECALL - ALL: 0.7871  COVID-19: 0.7500  PNEUMONIA: 0.8300  NORMAL: 0.7812 
F1 - ALL: 0.7878  COVID-19: 0.7812  PNEUMONIA: 0.7757  NORMAL: 0.8064 

Epoch 6/19
----------
[train]
LOSS - 0.0203
ACC - 0.9600
PPV - ALL: 1.0000  COVID-19: 1.0000  PNEUMONIA: 1.0000  NORMAL: 1.0000 
RECALL - ALL: 1.0000  COVID-19: 1.0000  PNEUMONIA: 1.0000  NORMAL: 1.0000 
F1 - ALL: 1.0000  COVID-19: 1.0000  PNEUMONIA: 1.0000  NORMAL: 1.0000 
Mask ratio's range: 0.9375 ~ 1.0

[val]
LOSS - 0.5146
ACC - 0.7700
PPV - ALL: 0.7835  COVID-19: 0.7857  PNEUMONIA: 0.7315  NORMAL: 0.8333 
RECALL - ALL: 0.7804  COVID-19: 0.7700  PNEUMONIA: 0.7900  NORMAL: 0.7812 
F1 - ALL: 0.7813  COVID-19: 0.7778  PNEUMONIA: 0.7596  NORMAL: 0.8064 

Epoch 7/19
----------
[train]
LOSS - 0.0203
ACC - 0.9600
PPV - ALL: 1.0000  COVID-19: 1.0000  PNEUMONIA: 1.0000  NORMAL: 1.0000 
RECALL - ALL: 1.0000  COVID-19: 1.0000  PNEUMONIA: 1.0000  NORMAL: 1.0000 
F1 - ALL: 1.0000  COVID-19: 1.0000  PNEUMONIA: 1.0000  NORMAL: 1.0000 
Mask ratio's range: 0.875 ~ 1.0

[val]
LOSS - 0.5119
ACC - 0.7733
PPV - ALL: 0.7867  COVID-19: 0.8085  PNEUMONIA: 0.7364  NORMAL: 0.8152 
RECALL - ALL: 0.7837  COVID-19: 0.7600  PNEUMONIA: 0.8100  NORMAL: 0.7812 
F1 - ALL: 0.7842  COVID-19: 0.7835  PNEUMONIA: 0.7714  NORMAL: 0.7978 

Epoch 8/19
----------
[train]
LOSS - 0.0148
ACC - 0.9600
PPV - ALL: 1.0000  COVID-19: 1.0000  PNEUMONIA: 1.0000  NORMAL: 1.0000 
RECALL - ALL: 1.0000  COVID-19: 1.0000  PNEUMONIA: 1.0000  NORMAL: 1.0000 
F1 - ALL: 1.0000  COVID-19: 1.0000  PNEUMONIA: 1.0000  NORMAL: 1.0000 
Mask ratio's range: 0.875 ~ 1.0

[val]
LOSS - 0.5123
ACC - 0.7733
PPV - ALL: 0.7854  COVID-19: 0.7835  PNEUMONIA: 0.7429  NORMAL: 0.8298 
RECALL - ALL: 0.7842  COVID-19: 0.7600  PNEUMONIA: 0.7800  NORMAL: 0.8125 
F1 - ALL: 0.7846  COVID-19: 0.7716  PNEUMONIA: 0.7610  NORMAL: 0.8211 

Epoch 9/19
----------
[train]
LOSS - 0.0228
ACC - 0.9600
PPV - ALL: 1.0000  COVID-19: 1.0000  PNEUMONIA: 1.0000  NORMAL: 1.0000 
RECALL - ALL: 1.0000  COVID-19: 1.0000  PNEUMONIA: 1.0000  NORMAL: 1.0000 
F1 - ALL: 1.0000  COVID-19: 1.0000  PNEUMONIA: 1.0000  NORMAL: 1.0000 
Mask ratio's range: 0.875 ~ 1.0

[val]
LOSS - 0.5045
ACC - 0.7800
PPV - ALL: 0.7918  COVID-19: 0.8085  PNEUMONIA: 0.7524  NORMAL: 0.8144 
RECALL - ALL: 0.7910  COVID-19: 0.7600  PNEUMONIA: 0.7900  NORMAL: 0.8229 
F1 - ALL: 0.7909  COVID-19: 0.7835  PNEUMONIA: 0.7707  NORMAL: 0.8186 

Epoch 10/19
----------
[train]
LOSS - 0.0229
ACC - 0.9600
PPV - ALL: 1.0000  COVID-19: 1.0000  PNEUMONIA: 1.0000  NORMAL: 1.0000 
RECALL - ALL: 1.0000  COVID-19: 1.0000  PNEUMONIA: 1.0000  NORMAL: 1.0000 
F1 - ALL: 1.0000  COVID-19: 1.0000  PNEUMONIA: 1.0000  NORMAL: 1.0000 
Mask ratio's range: 0.8125 ~ 1.0

[val]
LOSS - 0.5102
ACC - 0.7667
PPV - ALL: 0.7770  COVID-19: 0.7755  PNEUMONIA: 0.7576  NORMAL: 0.7980 
RECALL - ALL: 0.7776  COVID-19: 0.7600  PNEUMONIA: 0.7500  NORMAL: 0.8229 
F1 - ALL: 0.7773  COVID-19: 0.7677  PNEUMONIA: 0.7538  NORMAL: 0.8103 

Epoch 11/19
----------
[train]
LOSS - 0.0256
ACC - 0.9600
PPV - ALL: 1.0000  COVID-19: 1.0000  PNEUMONIA: 1.0000  NORMAL: 1.0000 
RECALL - ALL: 1.0000  COVID-19: 1.0000  PNEUMONIA: 1.0000  NORMAL: 1.0000 
F1 - ALL: 1.0000  COVID-19: 1.0000  PNEUMONIA: 1.0000  NORMAL: 1.0000 
Mask ratio's range: 0.8125 ~ 1.0

[val]
LOSS - 0.5129
ACC - 0.7600
PPV - ALL: 0.7701  COVID-19: 0.7549  PNEUMONIA: 0.7634  NORMAL: 0.7921 
RECALL - ALL: 0.7711  COVID-19: 0.7700  PNEUMONIA: 0.7100  NORMAL: 0.8333 
F1 - ALL: 0.7701  COVID-19: 0.7624  PNEUMONIA: 0.7357  NORMAL: 0.8122 

Epoch 12/19
----------
[train]
LOSS - 0.0186
ACC - 0.9600
PPV - ALL: 1.0000  COVID-19: 1.0000  PNEUMONIA: 1.0000  NORMAL: 1.0000 
RECALL - ALL: 1.0000  COVID-19: 1.0000  PNEUMONIA: 1.0000  NORMAL: 1.0000 
F1 - ALL: 1.0000  COVID-19: 1.0000  PNEUMONIA: 1.0000  NORMAL: 1.0000 
Mask ratio's range: 0.8125 ~ 1.0

[val]
LOSS - 0.5148
ACC - 0.7600
PPV - ALL: 0.7709  COVID-19: 0.7549  PNEUMONIA: 0.7865  NORMAL: 0.7714 
RECALL - ALL: 0.7713  COVID-19: 0.7700  PNEUMONIA: 0.7000  NORMAL: 0.8438 
F1 - ALL: 0.7697  COVID-19: 0.7624  PNEUMONIA: 0.7407  NORMAL: 0.8060 

Epoch 13/19
----------
[train]
LOSS - 0.0161
ACC - 0.9600
PPV - ALL: 1.0000  COVID-19: 1.0000  PNEUMONIA: 1.0000  NORMAL: 1.0000 
RECALL - ALL: 1.0000  COVID-19: 1.0000  PNEUMONIA: 1.0000  NORMAL: 1.0000 
F1 - ALL: 1.0000  COVID-19: 1.0000  PNEUMONIA: 1.0000  NORMAL: 1.0000 
Mask ratio's range: 0.8125 ~ 1.0

[val]
LOSS - 0.5057
ACC - 0.7567
PPV - ALL: 0.7667  COVID-19: 0.7708  PNEUMONIA: 0.7449  NORMAL: 0.7843 
RECALL - ALL: 0.7678  COVID-19: 0.7400  PNEUMONIA: 0.7300  NORMAL: 0.8333 
F1 - ALL: 0.7669  COVID-19: 0.7551  PNEUMONIA: 0.7374  NORMAL: 0.8081 

Epoch 14/19
----------
[train]
LOSS - 0.0175
ACC - 0.9600
PPV - ALL: 1.0000  COVID-19: 1.0000  PNEUMONIA: 1.0000  NORMAL: 1.0000 
RECALL - ALL: 1.0000  COVID-19: 1.0000  PNEUMONIA: 1.0000  NORMAL: 1.0000 
F1 - ALL: 1.0000  COVID-19: 1.0000  PNEUMONIA: 1.0000  NORMAL: 1.0000 
Mask ratio's range: 0.8125 ~ 0.9375

[val]
LOSS - 0.5134
ACC - 0.7533
PPV - ALL: 0.7636  COVID-19: 0.7766  PNEUMONIA: 0.7500  NORMAL: 0.7642 
RECALL - ALL: 0.7646  COVID-19: 0.7300  PNEUMONIA: 0.7200  NORMAL: 0.8438 
F1 - ALL: 0.7631  COVID-19: 0.7526  PNEUMONIA: 0.7347  NORMAL: 0.8020 

Epoch 15/19
----------
[train]
LOSS - 0.0172
ACC - 0.9600
PPV - ALL: 1.0000  COVID-19: 1.0000  PNEUMONIA: 1.0000  NORMAL: 1.0000 
RECALL - ALL: 1.0000  COVID-19: 1.0000  PNEUMONIA: 1.0000  NORMAL: 1.0000 
F1 - ALL: 1.0000  COVID-19: 1.0000  PNEUMONIA: 1.0000  NORMAL: 1.0000 
Mask ratio's range: 0.8125 ~ 0.9375

[val]
LOSS - 0.5304
ACC - 0.7700
PPV - ALL: 0.7807  COVID-19: 0.7957  PNEUMONIA: 0.7677  NORMAL: 0.7788 
RECALL - ALL: 0.7813  COVID-19: 0.7400  PNEUMONIA: 0.7600  NORMAL: 0.8438 
F1 - ALL: 0.7802  COVID-19: 0.7668  PNEUMONIA: 0.7638  NORMAL: 0.8100 

Epoch 16/19
----------
[train]
LOSS - 0.0116
ACC - 0.9600
PPV - ALL: 1.0000  COVID-19: 1.0000  PNEUMONIA: 1.0000  NORMAL: 1.0000 
RECALL - ALL: 1.0000  COVID-19: 1.0000  PNEUMONIA: 1.0000  NORMAL: 1.0000 
F1 - ALL: 1.0000  COVID-19: 1.0000  PNEUMONIA: 1.0000  NORMAL: 1.0000 
Mask ratio's range: 0.8125 ~ 0.9375

[val]
LOSS - 0.5169
ACC - 0.7700
PPV - ALL: 0.7806  COVID-19: 0.7979  PNEUMONIA: 0.7576  NORMAL: 0.7864 
RECALL - ALL: 0.7813  COVID-19: 0.7500  PNEUMONIA: 0.7500  NORMAL: 0.8438 
F1 - ALL: 0.7804  COVID-19: 0.7732  PNEUMONIA: 0.7538  NORMAL: 0.8141 

Epoch 17/19
----------
[train]
LOSS - 0.0170
ACC - 0.9600
PPV - ALL: 1.0000  COVID-19: 1.0000  PNEUMONIA: 1.0000  NORMAL: 1.0000 
RECALL - ALL: 1.0000  COVID-19: 1.0000  PNEUMONIA: 1.0000  NORMAL: 1.0000 
F1 - ALL: 1.0000  COVID-19: 1.0000  PNEUMONIA: 1.0000  NORMAL: 1.0000 
Mask ratio's range: 0.8125 ~ 0.9375

[val]
LOSS - 0.5234
ACC - 0.7667
PPV - ALL: 0.7770  COVID-19: 0.7895  PNEUMONIA: 0.7604  NORMAL: 0.7810 
RECALL - ALL: 0.7781  COVID-19: 0.7500  PNEUMONIA: 0.7300  NORMAL: 0.8542 
F1 - ALL: 0.7767  COVID-19: 0.7692  PNEUMONIA: 0.7449  NORMAL: 0.8160 

Epoch 18/19
----------
[train]
LOSS - 0.0168
ACC - 0.9600
PPV - ALL: 1.0000  COVID-19: 1.0000  PNEUMONIA: 1.0000  NORMAL: 1.0000 
RECALL - ALL: 1.0000  COVID-19: 1.0000  PNEUMONIA: 1.0000  NORMAL: 1.0000 
F1 - ALL: 1.0000  COVID-19: 1.0000  PNEUMONIA: 1.0000  NORMAL: 1.0000 
Mask ratio's range: 0.8125 ~ 0.9375

[val]
LOSS - 0.5223
ACC - 0.7700
PPV - ALL: 0.7806  COVID-19: 0.7979  PNEUMONIA: 0.7629  NORMAL: 0.7810 
RECALL - ALL: 0.7814  COVID-19: 0.7500  PNEUMONIA: 0.7400  NORMAL: 0.8542 
F1 - ALL: 0.7802  COVID-19: 0.7732  PNEUMONIA: 0.7513  NORMAL: 0.8160 

Epoch 19/19
----------
[train]
LOSS - 0.0087
ACC - 0.9600
PPV - ALL: 1.0000  COVID-19: 1.0000  PNEUMONIA: 1.0000  NORMAL: 1.0000 
RECALL - ALL: 1.0000  COVID-19: 1.0000  PNEUMONIA: 1.0000  NORMAL: 1.0000 
F1 - ALL: 1.0000  COVID-19: 1.0000  PNEUMONIA: 1.0000  NORMAL: 1.0000 
Mask ratio's range: 0.8125 ~ 0.875

[val]
LOSS - 0.5139
ACC - 0.7733
PPV - ALL: 0.7839  COVID-19: 0.7979  PNEUMONIA: 0.7653  NORMAL: 0.7885 
RECALL - ALL: 0.7847  COVID-19: 0.7500  PNEUMONIA: 0.7500  NORMAL: 0.8542 
F1 - ALL: 0.7836  COVID-19: 0.7732  PNEUMONIA: 0.7576  NORMAL: 0.8200 


--------------------
[Best results]
ACC - 0.7800
PPV - ALL: 0.7918  COVID-19: 0.8085  PNEUMONIA: 0.7524  NORMAL: 0.8144 
RECALL - ALL: 0.7910  COVID-19: 0.7600  PNEUMONIA: 0.7900  NORMAL: 0.8229 
F1 - ALL: 0.7909  COVID-19: 0.7835  PNEUMONIA: 0.7707  NORMAL: 0.8186 

Training complete in 1m 31s
-------------------- 

--------------------
Model 5
--------------------

Epoch 0/19
----------
[train]
LOSS - 1.0431
ACC - 0.3333
PPV - ALL: 0.3523  COVID-19: 0.4286  PNEUMONIA: 0.3158  NORMAL: 0.3125 
RECALL - ALL: 0.3472  COVID-19: 0.3750  PNEUMONIA: 0.2500  NORMAL: 0.4167 
F1 - ALL: 0.3454  COVID-19: 0.4000  PNEUMONIA: 0.2791  NORMAL: 0.3572 
Mask ratio's range: 1.0 ~ 1.0

[val]
LOSS - 0.9491
ACC - 0.6267
PPV - ALL: 0.6429  COVID-19: 0.6848  PNEUMONIA: 0.5439  NORMAL: 0.7000 
RECALL - ALL: 0.6354  COVID-19: 0.6300  PNEUMONIA: 0.6200  NORMAL: 0.6562 
F1 - ALL: 0.6377  COVID-19: 0.6563  PNEUMONIA: 0.5795  NORMAL: 0.6774 

Epoch 1/19
----------
[train]
LOSS - 0.6655
ACC - 0.8933
PPV - ALL: 0.9316  COVID-19: 0.9565  PNEUMONIA: 0.9583  NORMAL: 0.8800 
RECALL - ALL: 0.9306  COVID-19: 0.9167  PNEUMONIA: 0.9583  NORMAL: 0.9167 
F1 - ALL: 0.9308  COVID-19: 0.9362  PNEUMONIA: 0.9583  NORMAL: 0.8980 
Mask ratio's range: 1.0 ~ 1.0

[val]
LOSS - 0.7718
ACC - 0.7300
PPV - ALL: 0.7704  COVID-19: 0.9180  PNEUMONIA: 0.7290  NORMAL: 0.6641 
RECALL - ALL: 0.7418  COVID-19: 0.5600  PNEUMONIA: 0.7800  NORMAL: 0.8854 
F1 - ALL: 0.7360  COVID-19: 0.6956  PNEUMONIA: 0.7536  NORMAL: 0.7589 

Epoch 2/19
----------
[train]
LOSS - 0.3088
ACC - 0.9600
PPV - ALL: 1.0000  COVID-19: 1.0000  PNEUMONIA: 1.0000  NORMAL: 1.0000 
RECALL - ALL: 1.0000  COVID-19: 1.0000  PNEUMONIA: 1.0000  NORMAL: 1.0000 
F1 - ALL: 1.0000  COVID-19: 1.0000  PNEUMONIA: 1.0000  NORMAL: 1.0000 
Mask ratio's range: 1.0 ~ 1.0

[val]
LOSS - 0.6232
ACC - 0.7667
PPV - ALL: 0.7783  COVID-19: 0.7978  PNEUMONIA: 0.7778  NORMAL: 0.7593 
RECALL - ALL: 0.7781  COVID-19: 0.7100  PNEUMONIA: 0.7700  NORMAL: 0.8542 
F1 - ALL: 0.7764  COVID-19: 0.7513  PNEUMONIA: 0.7739  NORMAL: 0.8040 

Epoch 3/19
----------
[train]
LOSS - 0.1084
ACC - 0.9600
PPV - ALL: 1.0000  COVID-19: 1.0000  PNEUMONIA: 1.0000  NORMAL: 1.0000 
RECALL - ALL: 1.0000  COVID-19: 1.0000  PNEUMONIA: 1.0000  NORMAL: 1.0000 
F1 - ALL: 1.0000  COVID-19: 1.0000  PNEUMONIA: 1.0000  NORMAL: 1.0000 
Mask ratio's range: 1.0 ~ 1.0

[val]
LOSS - 0.5484
ACC - 0.7900
PPV - ALL: 0.8077  COVID-19: 0.8765  PNEUMONIA: 0.7921  NORMAL: 0.7544 
RECALL - ALL: 0.8019  COVID-19: 0.7100  PNEUMONIA: 0.8000  NORMAL: 0.8958 
F1 - ALL: 0.7998  COVID-19: 0.7845  PNEUMONIA: 0.7960  NORMAL: 0.8190 

Epoch 4/19
----------
[train]
LOSS - 0.0442
ACC - 0.9600
PPV - ALL: 1.0000  COVID-19: 1.0000  PNEUMONIA: 1.0000  NORMAL: 1.0000 
RECALL - ALL: 1.0000  COVID-19: 1.0000  PNEUMONIA: 1.0000  NORMAL: 1.0000 
F1 - ALL: 1.0000  COVID-19: 1.0000  PNEUMONIA: 1.0000  NORMAL: 1.0000 
Mask ratio's range: 1.0 ~ 1.0

[val]
LOSS - 0.5231
ACC - 0.7767
PPV - ALL: 0.7913  COVID-19: 0.8434  PNEUMONIA: 0.7619  NORMAL: 0.7685 
RECALL - ALL: 0.7882  COVID-19: 0.7000  PNEUMONIA: 0.8000  NORMAL: 0.8646 
F1 - ALL: 0.7864  COVID-19: 0.7650  PNEUMONIA: 0.7805  NORMAL: 0.8137 

Epoch 5/19
----------
[train]
LOSS - 0.0231
ACC - 0.9600
PPV - ALL: 1.0000  COVID-19: 1.0000  PNEUMONIA: 1.0000  NORMAL: 1.0000 
RECALL - ALL: 1.0000  COVID-19: 1.0000  PNEUMONIA: 1.0000  NORMAL: 1.0000 
F1 - ALL: 1.0000  COVID-19: 1.0000  PNEUMONIA: 1.0000  NORMAL: 1.0000 
Mask ratio's range: 1.0 ~ 1.0

[val]
LOSS - 0.5031
ACC - 0.7833
PPV - ALL: 0.7953  COVID-19: 0.8132  PNEUMONIA: 0.8021  NORMAL: 0.7706 
RECALL - ALL: 0.7950  COVID-19: 0.7400  PNEUMONIA: 0.7700  NORMAL: 0.8750 
F1 - ALL: 0.7934  COVID-19: 0.7749  PNEUMONIA: 0.7857  NORMAL: 0.8195 

Epoch 6/19
----------
[train]
LOSS - 0.0308
ACC - 0.9600
PPV - ALL: 1.0000  COVID-19: 1.0000  PNEUMONIA: 1.0000  NORMAL: 1.0000 
RECALL - ALL: 1.0000  COVID-19: 1.0000  PNEUMONIA: 1.0000  NORMAL: 1.0000 
F1 - ALL: 1.0000  COVID-19: 1.0000  PNEUMONIA: 1.0000  NORMAL: 1.0000 
Mask ratio's range: 0.9375 ~ 1.0

[val]
LOSS - 0.4921
ACC - 0.7900
PPV - ALL: 0.8020  COVID-19: 0.8242  PNEUMONIA: 0.8041  NORMAL: 0.7778 
RECALL - ALL: 0.8017  COVID-19: 0.7500  PNEUMONIA: 0.7800  NORMAL: 0.8750 
F1 - ALL: 0.8003  COVID-19: 0.7854  PNEUMONIA: 0.7919  NORMAL: 0.8235 

Epoch 7/19
----------
[train]
LOSS - 0.0159
ACC - 0.9600
PPV - ALL: 1.0000  COVID-19: 1.0000  PNEUMONIA: 1.0000  NORMAL: 1.0000 
RECALL - ALL: 1.0000  COVID-19: 1.0000  PNEUMONIA: 1.0000  NORMAL: 1.0000 
F1 - ALL: 1.0000  COVID-19: 1.0000  PNEUMONIA: 1.0000  NORMAL: 1.0000 
Mask ratio's range: 0.9375 ~ 1.0

[val]
LOSS - 0.4951
ACC - 0.7833
PPV - ALL: 0.7949  COVID-19: 0.8132  PNEUMONIA: 0.7938  NORMAL: 0.7778 
RECALL - ALL: 0.7950  COVID-19: 0.7400  PNEUMONIA: 0.7700  NORMAL: 0.8750 
F1 - ALL: 0.7934  COVID-19: 0.7749  PNEUMONIA: 0.7817  NORMAL: 0.8235 

Epoch 8/19
----------
[train]
LOSS - 0.0205
ACC - 0.9600
PPV - ALL: 1.0000  COVID-19: 1.0000  PNEUMONIA: 1.0000  NORMAL: 1.0000 
RECALL - ALL: 1.0000  COVID-19: 1.0000  PNEUMONIA: 1.0000  NORMAL: 1.0000 
F1 - ALL: 1.0000  COVID-19: 1.0000  PNEUMONIA: 1.0000  NORMAL: 1.0000 
Mask ratio's range: 0.9375 ~ 1.0

[val]
LOSS - 0.4964
ACC - 0.7800
PPV - ALL: 0.7908  COVID-19: 0.7938  PNEUMONIA: 0.7957  NORMAL: 0.7830 
RECALL - ALL: 0.7915  COVID-19: 0.7700  PNEUMONIA: 0.7400  NORMAL: 0.8646 
F1 - ALL: 0.7901  COVID-19: 0.7817  PNEUMONIA: 0.7668  NORMAL: 0.8218 

Epoch 9/19
----------
[train]
LOSS - 0.0204
ACC - 0.9600
PPV - ALL: 1.0000  COVID-19: 1.0000  PNEUMONIA: 1.0000  NORMAL: 1.0000 
RECALL - ALL: 1.0000  COVID-19: 1.0000  PNEUMONIA: 1.0000  NORMAL: 1.0000 
F1 - ALL: 1.0000  COVID-19: 1.0000  PNEUMONIA: 1.0000  NORMAL: 1.0000 
Mask ratio's range: 0.9375 ~ 1.0

[val]
LOSS - 0.4933
ACC - 0.7800
PPV - ALL: 0.7918  COVID-19: 0.7917  PNEUMONIA: 0.8132  NORMAL: 0.7706 
RECALL - ALL: 0.7917  COVID-19: 0.7600  PNEUMONIA: 0.7400  NORMAL: 0.8750 
F1 - ALL: 0.7900  COVID-19: 0.7755  PNEUMONIA: 0.7749  NORMAL: 0.8195 

Epoch 10/19
----------
[train]
LOSS - 0.0138
ACC - 0.9600
PPV - ALL: 1.0000  COVID-19: 1.0000  PNEUMONIA: 1.0000  NORMAL: 1.0000 
RECALL - ALL: 1.0000  COVID-19: 1.0000  PNEUMONIA: 1.0000  NORMAL: 1.0000 
F1 - ALL: 1.0000  COVID-19: 1.0000  PNEUMONIA: 1.0000  NORMAL: 1.0000 
Mask ratio's range: 0.9375 ~ 1.0

[val]
LOSS - 0.4973
ACC - 0.7833
PPV - ALL: 0.7953  COVID-19: 0.7979  PNEUMONIA: 0.8152  NORMAL: 0.7727 
RECALL - ALL: 0.7951  COVID-19: 0.7500  PNEUMONIA: 0.7500  NORMAL: 0.8854 
F1 - ALL: 0.7932  COVID-19: 0.7732  PNEUMONIA: 0.7812  NORMAL: 0.8252 

Epoch 11/19
----------
[train]
LOSS - 0.0369
ACC - 0.9600
PPV - ALL: 1.0000  COVID-19: 1.0000  PNEUMONIA: 1.0000  NORMAL: 1.0000 
RECALL - ALL: 1.0000  COVID-19: 1.0000  PNEUMONIA: 1.0000  NORMAL: 1.0000 
F1 - ALL: 1.0000  COVID-19: 1.0000  PNEUMONIA: 1.0000  NORMAL: 1.0000 
Mask ratio's range: 0.875 ~ 1.0

[val]
LOSS - 0.5180
ACC - 0.7800
PPV - ALL: 0.7947  COVID-19: 0.8452  PNEUMONIA: 0.7800  NORMAL: 0.7589 
RECALL - ALL: 0.7918  COVID-19: 0.7100  PNEUMONIA: 0.7800  NORMAL: 0.8854 
F1 - ALL: 0.7897  COVID-19: 0.7717  PNEUMONIA: 0.7800  NORMAL: 0.8173 

Epoch 12/19
----------
[train]
LOSS - 0.0126
ACC - 0.9600
PPV - ALL: 1.0000  COVID-19: 1.0000  PNEUMONIA: 1.0000  NORMAL: 1.0000 
RECALL - ALL: 1.0000  COVID-19: 1.0000  PNEUMONIA: 1.0000  NORMAL: 1.0000 
F1 - ALL: 1.0000  COVID-19: 1.0000  PNEUMONIA: 1.0000  NORMAL: 1.0000 
Mask ratio's range: 0.875 ~ 1.0

[val]
LOSS - 0.5168
ACC - 0.7767
PPV - ALL: 0.7919  COVID-19: 0.8434  PNEUMONIA: 0.7800  NORMAL: 0.7522 
RECALL - ALL: 0.7885  COVID-19: 0.7000  PNEUMONIA: 0.7800  NORMAL: 0.8854 
F1 - ALL: 0.7861  COVID-19: 0.7650  PNEUMONIA: 0.7800  NORMAL: 0.8134 

Epoch 13/19
----------
[train]
LOSS - 0.0156
ACC - 0.9600
PPV - ALL: 1.0000  COVID-19: 1.0000  PNEUMONIA: 1.0000  NORMAL: 1.0000 
RECALL - ALL: 1.0000  COVID-19: 1.0000  PNEUMONIA: 1.0000  NORMAL: 1.0000 
F1 - ALL: 1.0000  COVID-19: 1.0000  PNEUMONIA: 1.0000  NORMAL: 1.0000 
Mask ratio's range: 0.875 ~ 1.0

[val]
LOSS - 0.5140
ACC - 0.7800
PPV - ALL: 0.7948  COVID-19: 0.8434  PNEUMONIA: 0.7822  NORMAL: 0.7589 
RECALL - ALL: 0.7918  COVID-19: 0.7000  PNEUMONIA: 0.7900  NORMAL: 0.8854 
F1 - ALL: 0.7895  COVID-19: 0.7650  PNEUMONIA: 0.7861  NORMAL: 0.8173 

Epoch 14/19
----------
[train]
LOSS - 0.0354
ACC - 0.9600
PPV - ALL: 1.0000  COVID-19: 1.0000  PNEUMONIA: 1.0000  NORMAL: 1.0000 
RECALL - ALL: 1.0000  COVID-19: 1.0000  PNEUMONIA: 1.0000  NORMAL: 1.0000 
F1 - ALL: 1.0000  COVID-19: 1.0000  PNEUMONIA: 1.0000  NORMAL: 1.0000 
Mask ratio's range: 0.8125 ~ 1.0

[val]
LOSS - 0.5573
ACC - 0.7800
PPV - ALL: 0.7986  COVID-19: 0.8608  PNEUMONIA: 0.8000  NORMAL: 0.7350 
RECALL - ALL: 0.7919  COVID-19: 0.6800  PNEUMONIA: 0.8000  NORMAL: 0.8958 
F1 - ALL: 0.7891  COVID-19: 0.7598  PNEUMONIA: 0.8000  NORMAL: 0.8075 

Epoch 15/19
----------
[train]
LOSS - 0.0203
ACC - 0.9600
PPV - ALL: 1.0000  COVID-19: 1.0000  PNEUMONIA: 1.0000  NORMAL: 1.0000 
RECALL - ALL: 1.0000  COVID-19: 1.0000  PNEUMONIA: 1.0000  NORMAL: 1.0000 
F1 - ALL: 1.0000  COVID-19: 1.0000  PNEUMONIA: 1.0000  NORMAL: 1.0000 
Mask ratio's range: 0.8125 ~ 1.0

[val]
LOSS - 0.5654
ACC - 0.7800
PPV - ALL: 0.7986  COVID-19: 0.8608  PNEUMONIA: 0.8000  NORMAL: 0.7350 
RECALL - ALL: 0.7919  COVID-19: 0.6800  PNEUMONIA: 0.8000  NORMAL: 0.8958 
F1 - ALL: 0.7891  COVID-19: 0.7598  PNEUMONIA: 0.8000  NORMAL: 0.8075 

Epoch 16/19
----------
[train]
LOSS - 0.0191
ACC - 0.9600
PPV - ALL: 1.0000  COVID-19: 1.0000  PNEUMONIA: 1.0000  NORMAL: 1.0000 
RECALL - ALL: 1.0000  COVID-19: 1.0000  PNEUMONIA: 1.0000  NORMAL: 1.0000 
F1 - ALL: 1.0000  COVID-19: 1.0000  PNEUMONIA: 1.0000  NORMAL: 1.0000 
Mask ratio's range: 0.8125 ~ 1.0

[val]
LOSS - 0.5593
ACC - 0.7700
PPV - ALL: 0.7860  COVID-19: 0.8293  PNEUMONIA: 0.7938  NORMAL: 0.7350 
RECALL - ALL: 0.7819  COVID-19: 0.6800  PNEUMONIA: 0.7700  NORMAL: 0.8958 
F1 - ALL: 0.7788  COVID-19: 0.7473  PNEUMONIA: 0.7817  NORMAL: 0.8075 

Epoch 17/19
----------
[train]
LOSS - 0.0166
ACC - 0.9600
PPV - ALL: 1.0000  COVID-19: 1.0000  PNEUMONIA: 1.0000  NORMAL: 1.0000 
RECALL - ALL: 1.0000  COVID-19: 1.0000  PNEUMONIA: 1.0000  NORMAL: 1.0000 
F1 - ALL: 1.0000  COVID-19: 1.0000  PNEUMONIA: 1.0000  NORMAL: 1.0000 
Mask ratio's range: 0.8125 ~ 0.9375

[val]
LOSS - 0.5703
ACC - 0.7767
PPV - ALL: 0.7965  COVID-19: 0.8500  PNEUMONIA: 0.8229  NORMAL: 0.7167 
RECALL - ALL: 0.7886  COVID-19: 0.6800  PNEUMONIA: 0.7900  NORMAL: 0.8958 
F1 - ALL: 0.7860  COVID-19: 0.7556  PNEUMONIA: 0.8061  NORMAL: 0.7963 

Epoch 18/19
----------
[train]
LOSS - 0.0176
ACC - 0.9600
PPV - ALL: 1.0000  COVID-19: 1.0000  PNEUMONIA: 1.0000  NORMAL: 1.0000 
RECALL - ALL: 1.0000  COVID-19: 1.0000  PNEUMONIA: 1.0000  NORMAL: 1.0000 
F1 - ALL: 1.0000  COVID-19: 1.0000  PNEUMONIA: 1.0000  NORMAL: 1.0000 
Mask ratio's range: 0.8125 ~ 0.9375

[val]
LOSS - 0.5840
ACC - 0.7767
PPV - ALL: 0.7950  COVID-19: 0.8500  PNEUMONIA: 0.8061  NORMAL: 0.7288 
RECALL - ALL: 0.7886  COVID-19: 0.6800  PNEUMONIA: 0.7900  NORMAL: 0.8958 
F1 - ALL: 0.7858  COVID-19: 0.7556  PNEUMONIA: 0.7980  NORMAL: 0.8037 

Epoch 19/19
----------
[train]
LOSS - 0.0336
ACC - 0.9600
PPV - ALL: 1.0000  COVID-19: 1.0000  PNEUMONIA: 1.0000  NORMAL: 1.0000 
RECALL - ALL: 1.0000  COVID-19: 1.0000  PNEUMONIA: 1.0000  NORMAL: 1.0000 
F1 - ALL: 1.0000  COVID-19: 1.0000  PNEUMONIA: 1.0000  NORMAL: 1.0000 
Mask ratio's range: 0.8125 ~ 0.9375

[val]
LOSS - 0.5707
ACC - 0.7733
PPV - ALL: 0.7918  COVID-19: 0.8235  PNEUMONIA: 0.8352  NORMAL: 0.7167 
RECALL - ALL: 0.7853  COVID-19: 0.7000  PNEUMONIA: 0.7600  NORMAL: 0.8958 
F1 - ALL: 0.7829  COVID-19: 0.7567  PNEUMONIA: 0.7958  NORMAL: 0.7963 


--------------------
[Best results]
ACC - 0.7900
PPV - ALL: 0.8077  COVID-19: 0.8765  PNEUMONIA: 0.7921  NORMAL: 0.7544 
RECALL - ALL: 0.8019  COVID-19: 0.7100  PNEUMONIA: 0.8000  NORMAL: 0.8958 
F1 - ALL: 0.7998  COVID-19: 0.7845  PNEUMONIA: 0.7960  NORMAL: 0.8190 

Training complete in 1m 31s
-------------------- 

[Mean results]
ACC - 0.8067 (0.02)
PPV - ALL: 0.8206 (0.02)  COVID-19: 0.8660 (0.03)  PNEUMONIA: 0.7847 (0.02)  NORMAL: 0.8112 (0.03) 
RECALL - ALL: 0.8178 (0.02)  COVID-19: 0.7860 (0.05)  PNEUMONIA: 0.8320 (0.04)  NORMAL: 0.8354 (0.03) 
F1 - ALL: 0.8175 (0.02)  COVID-19: 0.8234 (0.03)  PNEUMONIA: 0.8074 (0.03)  NORMAL: 0.8218 (0.01) 

