--------------------
Model 1
--------------------

Epoch 0/19
----------
[train]
LOSS - 1.0226
ACC - 0.4000
PPV - ALL: 0.4222  COVID-19: 0.4737  PNEUMONIA: 0.4000  NORMAL: 0.3929 
RECALL - ALL: 0.4167  COVID-19: 0.3750  PNEUMONIA: 0.4167  NORMAL: 0.4583 
F1 - ALL: 0.4166  COVID-19: 0.4186  PNEUMONIA: 0.4082  NORMAL: 0.4231 
Mask ratio's range: 1.0 ~ 1.0

[val]
LOSS - 1.0073
ACC - 0.4367
PPV - ALL: 0.6585  COVID-19: 1.0000  PNEUMONIA: 0.5882  NORMAL: 0.3872 
RECALL - ALL: 0.4493  COVID-19: 0.1000  PNEUMONIA: 0.3000  NORMAL: 0.9479 
F1 - ALL: 0.3763  COVID-19: 0.1818  PNEUMONIA: 0.3973  NORMAL: 0.5498 

Epoch 1/19
----------
[train]
LOSS - 0.6938
ACC - 0.8933
PPV - ALL: 0.9338  COVID-19: 1.0000  PNEUMONIA: 0.9167  NORMAL: 0.8846 
RECALL - ALL: 0.9306  COVID-19: 0.9167  PNEUMONIA: 0.9167  NORMAL: 0.9583 
F1 - ALL: 0.9311  COVID-19: 0.9565  PNEUMONIA: 0.9167  NORMAL: 0.9200 
Mask ratio's range: 1.0 ~ 1.0

[val]
LOSS - 0.8369
ACC - 0.7067
PPV - ALL: 0.7425  COVID-19: 0.8824  PNEUMONIA: 0.6279  NORMAL: 0.7172 
RECALL - ALL: 0.7165  COVID-19: 0.6000  PNEUMONIA: 0.8100  NORMAL: 0.7396 
F1 - ALL: 0.7166  COVID-19: 0.7143  PNEUMONIA: 0.7074  NORMAL: 0.7282 

Epoch 2/19
----------
[train]
LOSS - 0.3380
ACC - 0.9600
PPV - ALL: 1.0000  COVID-19: 1.0000  PNEUMONIA: 1.0000  NORMAL: 1.0000 
RECALL - ALL: 1.0000  COVID-19: 1.0000  PNEUMONIA: 1.0000  NORMAL: 1.0000 
F1 - ALL: 1.0000  COVID-19: 1.0000  PNEUMONIA: 1.0000  NORMAL: 1.0000 
Mask ratio's range: 1.0 ~ 1.0

[val]
LOSS - 0.6948
ACC - 0.7533
PPV - ALL: 0.7762  COVID-19: 0.8784  PNEUMONIA: 0.7222  NORMAL: 0.7281 
RECALL - ALL: 0.7649  COVID-19: 0.6500  PNEUMONIA: 0.7800  NORMAL: 0.8646 
F1 - ALL: 0.7625  COVID-19: 0.7471  PNEUMONIA: 0.7500  NORMAL: 0.7905 

Epoch 3/19
----------
[train]
LOSS - 0.1336
ACC - 0.9600
PPV - ALL: 1.0000  COVID-19: 1.0000  PNEUMONIA: 1.0000  NORMAL: 1.0000 
RECALL - ALL: 1.0000  COVID-19: 1.0000  PNEUMONIA: 1.0000  NORMAL: 1.0000 
F1 - ALL: 1.0000  COVID-19: 1.0000  PNEUMONIA: 1.0000  NORMAL: 1.0000 
Mask ratio's range: 1.0 ~ 1.0

[val]
LOSS - 0.6002
ACC - 0.7833
PPV - ALL: 0.7972  COVID-19: 0.8409  PNEUMONIA: 0.7568  NORMAL: 0.7938 
RECALL - ALL: 0.7940  COVID-19: 0.7400  PNEUMONIA: 0.8400  NORMAL: 0.8021 
F1 - ALL: 0.7938  COVID-19: 0.7872  PNEUMONIA: 0.7962  NORMAL: 0.7979 

Epoch 4/19
----------
[train]
LOSS - 0.0543
ACC - 0.9600
PPV - ALL: 1.0000  COVID-19: 1.0000  PNEUMONIA: 1.0000  NORMAL: 1.0000 
RECALL - ALL: 1.0000  COVID-19: 1.0000  PNEUMONIA: 1.0000  NORMAL: 1.0000 
F1 - ALL: 1.0000  COVID-19: 1.0000  PNEUMONIA: 1.0000  NORMAL: 1.0000 
Mask ratio's range: 0.9375 ~ 1.0

[val]
LOSS - 0.5734
ACC - 0.7900
PPV - ALL: 0.8052  COVID-19: 0.8721  PNEUMONIA: 0.7593  NORMAL: 0.7843 
RECALL - ALL: 0.8011  COVID-19: 0.7500  PNEUMONIA: 0.8200  NORMAL: 0.8333 
F1 - ALL: 0.8010  COVID-19: 0.8065  PNEUMONIA: 0.7885  NORMAL: 0.8081 

Epoch 5/19
----------
[train]
LOSS - 0.0331
ACC - 0.9600
PPV - ALL: 1.0000  COVID-19: 1.0000  PNEUMONIA: 1.0000  NORMAL: 1.0000 
RECALL - ALL: 1.0000  COVID-19: 1.0000  PNEUMONIA: 1.0000  NORMAL: 1.0000 
F1 - ALL: 1.0000  COVID-19: 1.0000  PNEUMONIA: 1.0000  NORMAL: 1.0000 
Mask ratio's range: 0.9375 ~ 1.0

[val]
LOSS - 0.5615
ACC - 0.7867
PPV - ALL: 0.8011  COVID-19: 0.8621  PNEUMONIA: 0.7570  NORMAL: 0.7843 
RECALL - ALL: 0.7978  COVID-19: 0.7500  PNEUMONIA: 0.8100  NORMAL: 0.8333 
F1 - ALL: 0.7976  COVID-19: 0.8022  PNEUMONIA: 0.7826  NORMAL: 0.8081 

Epoch 6/19
----------
[train]
LOSS - 0.0297
ACC - 0.9600
PPV - ALL: 1.0000  COVID-19: 1.0000  PNEUMONIA: 1.0000  NORMAL: 1.0000 
RECALL - ALL: 1.0000  COVID-19: 1.0000  PNEUMONIA: 1.0000  NORMAL: 1.0000 
F1 - ALL: 1.0000  COVID-19: 1.0000  PNEUMONIA: 1.0000  NORMAL: 1.0000 
Mask ratio's range: 0.9375 ~ 1.0

[val]
LOSS - 0.5486
ACC - 0.7867
PPV - ALL: 0.8012  COVID-19: 0.8621  PNEUMONIA: 0.7593  NORMAL: 0.7822 
RECALL - ALL: 0.7976  COVID-19: 0.7500  PNEUMONIA: 0.8200  NORMAL: 0.8229 
F1 - ALL: 0.7976  COVID-19: 0.8022  PNEUMONIA: 0.7885  NORMAL: 0.8020 

Epoch 7/19
----------
[train]
LOSS - 0.0184
ACC - 0.9600
PPV - ALL: 1.0000  COVID-19: 1.0000  PNEUMONIA: 1.0000  NORMAL: 1.0000 
RECALL - ALL: 1.0000  COVID-19: 1.0000  PNEUMONIA: 1.0000  NORMAL: 1.0000 
F1 - ALL: 1.0000  COVID-19: 1.0000  PNEUMONIA: 1.0000  NORMAL: 1.0000 
Mask ratio's range: 0.9375 ~ 1.0

[val]
LOSS - 0.5359
ACC - 0.7967
PPV - ALL: 0.8105  COVID-19: 0.8652  PNEUMONIA: 0.7664  NORMAL: 0.8000 
RECALL - ALL: 0.8078  COVID-19: 0.7700  PNEUMONIA: 0.8200  NORMAL: 0.8333 
F1 - ALL: 0.8078  COVID-19: 0.8148  PNEUMONIA: 0.7923  NORMAL: 0.8163 

Epoch 8/19
----------
[train]
LOSS - 0.0174
ACC - 0.9600
PPV - ALL: 1.0000  COVID-19: 1.0000  PNEUMONIA: 1.0000  NORMAL: 1.0000 
RECALL - ALL: 1.0000  COVID-19: 1.0000  PNEUMONIA: 1.0000  NORMAL: 1.0000 
F1 - ALL: 1.0000  COVID-19: 1.0000  PNEUMONIA: 1.0000  NORMAL: 1.0000 
Mask ratio's range: 0.9375 ~ 1.0

[val]
LOSS - 0.5365
ACC - 0.7900
PPV - ALL: 0.8046  COVID-19: 0.8636  PNEUMONIA: 0.7523  NORMAL: 0.7980 
RECALL - ALL: 0.8010  COVID-19: 0.7600  PNEUMONIA: 0.8200  NORMAL: 0.8229 
F1 - ALL: 0.8012  COVID-19: 0.8085  PNEUMONIA: 0.7847  NORMAL: 0.8103 

Epoch 9/19
----------
[train]
LOSS - 0.0126
ACC - 0.9600
PPV - ALL: 1.0000  COVID-19: 1.0000  PNEUMONIA: 1.0000  NORMAL: 1.0000 
RECALL - ALL: 1.0000  COVID-19: 1.0000  PNEUMONIA: 1.0000  NORMAL: 1.0000 
F1 - ALL: 1.0000  COVID-19: 1.0000  PNEUMONIA: 1.0000  NORMAL: 1.0000 
Mask ratio's range: 0.9375 ~ 1.0

[val]
LOSS - 0.5361
ACC - 0.7867
PPV - ALL: 0.8017  COVID-19: 0.8636  PNEUMONIA: 0.7455  NORMAL: 0.7959 
RECALL - ALL: 0.7975  COVID-19: 0.7600  PNEUMONIA: 0.8200  NORMAL: 0.8125 
F1 - ALL: 0.7979  COVID-19: 0.8085  PNEUMONIA: 0.7810  NORMAL: 0.8041 

Epoch 10/19
----------
[train]
LOSS - 0.0237
ACC - 0.9600
PPV - ALL: 1.0000  COVID-19: 1.0000  PNEUMONIA: 1.0000  NORMAL: 1.0000 
RECALL - ALL: 1.0000  COVID-19: 1.0000  PNEUMONIA: 1.0000  NORMAL: 1.0000 
F1 - ALL: 1.0000  COVID-19: 1.0000  PNEUMONIA: 1.0000  NORMAL: 1.0000 
Mask ratio's range: 0.875 ~ 1.0

[val]
LOSS - 0.5299
ACC - 0.7900
PPV - ALL: 0.8046  COVID-19: 0.8636  PNEUMONIA: 0.7523  NORMAL: 0.7980 
RECALL - ALL: 0.8010  COVID-19: 0.7600  PNEUMONIA: 0.8200  NORMAL: 0.8229 
F1 - ALL: 0.8012  COVID-19: 0.8085  PNEUMONIA: 0.7847  NORMAL: 0.8103 

Epoch 11/19
----------
[train]
LOSS - 0.0171
ACC - 0.9600
PPV - ALL: 1.0000  COVID-19: 1.0000  PNEUMONIA: 1.0000  NORMAL: 1.0000 
RECALL - ALL: 1.0000  COVID-19: 1.0000  PNEUMONIA: 1.0000  NORMAL: 1.0000 
F1 - ALL: 1.0000  COVID-19: 1.0000  PNEUMONIA: 1.0000  NORMAL: 1.0000 
Mask ratio's range: 0.875 ~ 0.9375

[val]
LOSS - 0.5430
ACC - 0.7900
PPV - ALL: 0.8076  COVID-19: 0.8690  PNEUMONIA: 0.7414  NORMAL: 0.8125 
RECALL - ALL: 0.8008  COVID-19: 0.7300  PNEUMONIA: 0.8600  NORMAL: 0.8125 
F1 - ALL: 0.8008  COVID-19: 0.7935  PNEUMONIA: 0.7963  NORMAL: 0.8125 

Epoch 12/19
----------
[train]
LOSS - 0.0159
ACC - 0.9600
PPV - ALL: 1.0000  COVID-19: 1.0000  PNEUMONIA: 1.0000  NORMAL: 1.0000 
RECALL - ALL: 1.0000  COVID-19: 1.0000  PNEUMONIA: 1.0000  NORMAL: 1.0000 
F1 - ALL: 1.0000  COVID-19: 1.0000  PNEUMONIA: 1.0000  NORMAL: 1.0000 
Mask ratio's range: 0.875 ~ 0.9375

[val]
LOSS - 0.5361
ACC - 0.7833
PPV - ALL: 0.8017  COVID-19: 0.8659  PNEUMONIA: 0.7350  NORMAL: 0.8041 
RECALL - ALL: 0.7942  COVID-19: 0.7100  PNEUMONIA: 0.8600  NORMAL: 0.8125 
F1 - ALL: 0.7937  COVID-19: 0.7802  PNEUMONIA: 0.7926  NORMAL: 0.8083 

Epoch 13/19
----------
[train]
LOSS - 0.0153
ACC - 0.9600
PPV - ALL: 1.0000  COVID-19: 1.0000  PNEUMONIA: 1.0000  NORMAL: 1.0000 
RECALL - ALL: 1.0000  COVID-19: 1.0000  PNEUMONIA: 1.0000  NORMAL: 1.0000 
F1 - ALL: 1.0000  COVID-19: 1.0000  PNEUMONIA: 1.0000  NORMAL: 1.0000 
Mask ratio's range: 0.8125 ~ 0.9375

[val]
LOSS - 0.5366
ACC - 0.7800
PPV - ALL: 0.7988  COVID-19: 0.8659  PNEUMONIA: 0.7265  NORMAL: 0.8041 
RECALL - ALL: 0.7908  COVID-19: 0.7100  PNEUMONIA: 0.8500  NORMAL: 0.8125 
F1 - ALL: 0.7906  COVID-19: 0.7802  PNEUMONIA: 0.7834  NORMAL: 0.8083 

Epoch 14/19
----------
[train]
LOSS - 0.0198
ACC - 0.9600
PPV - ALL: 1.0000  COVID-19: 1.0000  PNEUMONIA: 1.0000  NORMAL: 1.0000 
RECALL - ALL: 1.0000  COVID-19: 1.0000  PNEUMONIA: 1.0000  NORMAL: 1.0000 
F1 - ALL: 1.0000  COVID-19: 1.0000  PNEUMONIA: 1.0000  NORMAL: 1.0000 
Mask ratio's range: 0.75 ~ 0.9375

[val]
LOSS - 0.5491
ACC - 0.7767
PPV - ALL: 0.7962  COVID-19: 0.8642  PNEUMONIA: 0.7203  NORMAL: 0.8041 
RECALL - ALL: 0.7875  COVID-19: 0.7000  PNEUMONIA: 0.8500  NORMAL: 0.8125 
F1 - ALL: 0.7872  COVID-19: 0.7735  PNEUMONIA: 0.7798  NORMAL: 0.8083 

Epoch 15/19
----------
[train]
LOSS - 0.0201
ACC - 0.9600
PPV - ALL: 1.0000  COVID-19: 1.0000  PNEUMONIA: 1.0000  NORMAL: 1.0000 
RECALL - ALL: 1.0000  COVID-19: 1.0000  PNEUMONIA: 1.0000  NORMAL: 1.0000 
F1 - ALL: 1.0000  COVID-19: 1.0000  PNEUMONIA: 1.0000  NORMAL: 1.0000 
Mask ratio's range: 0.75 ~ 0.9375

[val]
LOSS - 0.5509
ACC - 0.7567
PPV - ALL: 0.7793  COVID-19: 0.8533  PNEUMONIA: 0.6967  NORMAL: 0.7879 
RECALL - ALL: 0.7675  COVID-19: 0.6400  PNEUMONIA: 0.8500  NORMAL: 0.8125 
F1 - ALL: 0.7657  COVID-19: 0.7314  PNEUMONIA: 0.7658  NORMAL: 0.8000 

Epoch 16/19
----------
[train]
LOSS - 0.0264
ACC - 0.9600
PPV - ALL: 1.0000  COVID-19: 1.0000  PNEUMONIA: 1.0000  NORMAL: 1.0000 
RECALL - ALL: 1.0000  COVID-19: 1.0000  PNEUMONIA: 1.0000  NORMAL: 1.0000 
F1 - ALL: 1.0000  COVID-19: 1.0000  PNEUMONIA: 1.0000  NORMAL: 1.0000 
Mask ratio's range: 0.6875 ~ 0.9375

[val]
LOSS - 0.5546
ACC - 0.7467
PPV - ALL: 0.7717  COVID-19: 0.8472  PNEUMONIA: 0.6800  NORMAL: 0.7879 
RECALL - ALL: 0.7575  COVID-19: 0.6100  PNEUMONIA: 0.8500  NORMAL: 0.8125 
F1 - ALL: 0.7550  COVID-19: 0.7093  PNEUMONIA: 0.7556  NORMAL: 0.8000 

Epoch 17/19
----------
[train]
LOSS - 0.0399
ACC - 0.9600
PPV - ALL: 1.0000  COVID-19: 1.0000  PNEUMONIA: 1.0000  NORMAL: 1.0000 
RECALL - ALL: 1.0000  COVID-19: 1.0000  PNEUMONIA: 1.0000  NORMAL: 1.0000 
F1 - ALL: 1.0000  COVID-19: 1.0000  PNEUMONIA: 1.0000  NORMAL: 1.0000 
Mask ratio's range: 0.625 ~ 0.875

[val]
LOSS - 0.5996
ACC - 0.7500
PPV - ALL: 0.7798  COVID-19: 0.8806  PNEUMONIA: 0.6800  NORMAL: 0.7788 
RECALL - ALL: 0.7613  COVID-19: 0.5900  PNEUMONIA: 0.8500  NORMAL: 0.8438 
F1 - ALL: 0.7574  COVID-19: 0.7066  PNEUMONIA: 0.7556  NORMAL: 0.8100 

Epoch 18/19
----------
[train]
LOSS - 0.0353
ACC - 0.9600
PPV - ALL: 1.0000  COVID-19: 1.0000  PNEUMONIA: 1.0000  NORMAL: 1.0000 
RECALL - ALL: 1.0000  COVID-19: 1.0000  PNEUMONIA: 1.0000  NORMAL: 1.0000 
F1 - ALL: 1.0000  COVID-19: 1.0000  PNEUMONIA: 1.0000  NORMAL: 1.0000 
Mask ratio's range: 0.5625 ~ 0.875

[val]
LOSS - 0.6077
ACC - 0.7433
PPV - ALL: 0.7743  COVID-19: 0.8769  PNEUMONIA: 0.6746  NORMAL: 0.7714 
RECALL - ALL: 0.7546  COVID-19: 0.5700  PNEUMONIA: 0.8500  NORMAL: 0.8438 
F1 - ALL: 0.7497  COVID-19: 0.6909  PNEUMONIA: 0.7522  NORMAL: 0.8060 

Epoch 19/19
----------
[train]
LOSS - 0.0438
ACC - 0.9600
PPV - ALL: 1.0000  COVID-19: 1.0000  PNEUMONIA: 1.0000  NORMAL: 1.0000 
RECALL - ALL: 1.0000  COVID-19: 1.0000  PNEUMONIA: 1.0000  NORMAL: 1.0000 
F1 - ALL: 1.0000  COVID-19: 1.0000  PNEUMONIA: 1.0000  NORMAL: 1.0000 
Mask ratio's range: 0.5 ~ 0.8125

[val]
LOSS - 0.6066
ACC - 0.7467
PPV - ALL: 0.7768  COVID-19: 0.8769  PNEUMONIA: 0.6800  NORMAL: 0.7736 
RECALL - ALL: 0.7581  COVID-19: 0.5700  PNEUMONIA: 0.8500  NORMAL: 0.8542 
F1 - ALL: 0.7528  COVID-19: 0.6909  PNEUMONIA: 0.7556  NORMAL: 0.8119 


--------------------
[Best results]
ACC - 0.7967
PPV - ALL: 0.8105  COVID-19: 0.8652  PNEUMONIA: 0.7664  NORMAL: 0.8000 
RECALL - ALL: 0.8078  COVID-19: 0.7700  PNEUMONIA: 0.8200  NORMAL: 0.8333 
F1 - ALL: 0.8078  COVID-19: 0.8148  PNEUMONIA: 0.7923  NORMAL: 0.8163 

Training complete in 1m 30s
-------------------- 

--------------------
Model 2
--------------------

Epoch 0/19
----------
[train]
LOSS - 1.0195
ACC - 0.4133
PPV - ALL: 0.4462  COVID-19: 0.3214  PNEUMONIA: 0.5556  NORMAL: 0.4615 
RECALL - ALL: 0.4306  COVID-19: 0.3750  PNEUMONIA: 0.4167  NORMAL: 0.5000 
F1 - ALL: 0.4341  COVID-19: 0.3461  PNEUMONIA: 0.4762  NORMAL: 0.4800 
Mask ratio's range: 1.0 ~ 1.0

[val]
LOSS - 0.9858
ACC - 0.5500
PPV - ALL: 0.7028  COVID-19: 1.0000  PNEUMONIA: 0.5743  NORMAL: 0.5342 
RECALL - ALL: 0.5608  COVID-19: 0.0200  PNEUMONIA: 0.8500  NORMAL: 0.8125 
F1 - ALL: 0.4564  COVID-19: 0.0392  PNEUMONIA: 0.6855  NORMAL: 0.6446 

Epoch 1/19
----------
[train]
LOSS - 0.6956
ACC - 0.8533
PPV - ALL: 0.9013  COVID-19: 0.9474  PNEUMONIA: 0.9565  NORMAL: 0.8000 
RECALL - ALL: 0.8889  COVID-19: 0.7500  PNEUMONIA: 0.9167  NORMAL: 1.0000 
F1 - ALL: 0.8874  COVID-19: 0.8372  PNEUMONIA: 0.9362  NORMAL: 0.8889 
Mask ratio's range: 1.0 ~ 1.0

[val]
LOSS - 0.7608
ACC - 0.7767
PPV - ALL: 0.7914  COVID-19: 0.7615  PNEUMONIA: 0.8434  NORMAL: 0.7692 
RECALL - ALL: 0.7878  COVID-19: 0.8300  PNEUMONIA: 0.7000  NORMAL: 0.8333 
F1 - ALL: 0.7864  COVID-19: 0.7943  PNEUMONIA: 0.7650  NORMAL: 0.8000 

Epoch 2/19
----------
[train]
LOSS - 0.2863
ACC - 0.9600
PPV - ALL: 1.0000  COVID-19: 1.0000  PNEUMONIA: 1.0000  NORMAL: 1.0000 
RECALL - ALL: 1.0000  COVID-19: 1.0000  PNEUMONIA: 1.0000  NORMAL: 1.0000 
F1 - ALL: 1.0000  COVID-19: 1.0000  PNEUMONIA: 1.0000  NORMAL: 1.0000 
Mask ratio's range: 1.0 ~ 1.0

[val]
LOSS - 0.6003
ACC - 0.7700
PPV - ALL: 0.8044  COVID-19: 0.9394  PNEUMONIA: 0.7097  NORMAL: 0.7642 
RECALL - ALL: 0.7813  COVID-19: 0.6200  PNEUMONIA: 0.8800  NORMAL: 0.8438 
F1 - ALL: 0.7782  COVID-19: 0.7470  PNEUMONIA: 0.7857  NORMAL: 0.8020 

Epoch 3/19
----------
[train]
LOSS - 0.1051
ACC - 0.9600
PPV - ALL: 1.0000  COVID-19: 1.0000  PNEUMONIA: 1.0000  NORMAL: 1.0000 
RECALL - ALL: 1.0000  COVID-19: 1.0000  PNEUMONIA: 1.0000  NORMAL: 1.0000 
F1 - ALL: 1.0000  COVID-19: 1.0000  PNEUMONIA: 1.0000  NORMAL: 1.0000 
Mask ratio's range: 1.0 ~ 1.0

[val]
LOSS - 0.5159
ACC - 0.8067
PPV - ALL: 0.8174  COVID-19: 0.8350  PNEUMONIA: 0.8020  NORMAL: 0.8152 
RECALL - ALL: 0.8171  COVID-19: 0.8600  PNEUMONIA: 0.8100  NORMAL: 0.7812 
F1 - ALL: 0.8170  COVID-19: 0.8473  PNEUMONIA: 0.8060  NORMAL: 0.7978 

Epoch 4/19
----------
[train]
LOSS - 0.0466
ACC - 0.9600
PPV - ALL: 1.0000  COVID-19: 1.0000  PNEUMONIA: 1.0000  NORMAL: 1.0000 
RECALL - ALL: 1.0000  COVID-19: 1.0000  PNEUMONIA: 1.0000  NORMAL: 1.0000 
F1 - ALL: 1.0000  COVID-19: 1.0000  PNEUMONIA: 1.0000  NORMAL: 1.0000 
Mask ratio's range: 0.875 ~ 1.0

[val]
LOSS - 0.5187
ACC - 0.8267
PPV - ALL: 0.8402  COVID-19: 0.8925  PNEUMONIA: 0.8000  NORMAL: 0.8280 
RECALL - ALL: 0.8374  COVID-19: 0.8300  PNEUMONIA: 0.8800  NORMAL: 0.8021 
F1 - ALL: 0.8377  COVID-19: 0.8601  PNEUMONIA: 0.8381  NORMAL: 0.8148 

Epoch 5/19
----------
[train]
LOSS - 0.0363
ACC - 0.9600
PPV - ALL: 1.0000  COVID-19: 1.0000  PNEUMONIA: 1.0000  NORMAL: 1.0000 
RECALL - ALL: 1.0000  COVID-19: 1.0000  PNEUMONIA: 1.0000  NORMAL: 1.0000 
F1 - ALL: 1.0000  COVID-19: 1.0000  PNEUMONIA: 1.0000  NORMAL: 1.0000 
Mask ratio's range: 0.875 ~ 1.0

[val]
LOSS - 0.4851
ACC - 0.8133
PPV - ALL: 0.8311  COVID-19: 0.9070  PNEUMONIA: 0.7672  NORMAL: 0.8191 
RECALL - ALL: 0.8240  COVID-19: 0.7800  PNEUMONIA: 0.8900  NORMAL: 0.8021 
F1 - ALL: 0.8244  COVID-19: 0.8387  PNEUMONIA: 0.8241  NORMAL: 0.8105 

Epoch 6/19
----------
[train]
LOSS - 0.0347
ACC - 0.9600
PPV - ALL: 1.0000  COVID-19: 1.0000  PNEUMONIA: 1.0000  NORMAL: 1.0000 
RECALL - ALL: 1.0000  COVID-19: 1.0000  PNEUMONIA: 1.0000  NORMAL: 1.0000 
F1 - ALL: 1.0000  COVID-19: 1.0000  PNEUMONIA: 1.0000  NORMAL: 1.0000 
Mask ratio's range: 0.75 ~ 1.0

[val]
LOSS - 0.5088
ACC - 0.8167
PPV - ALL: 0.8314  COVID-19: 0.9000  PNEUMONIA: 0.7838  NORMAL: 0.8105 
RECALL - ALL: 0.8274  COVID-19: 0.8100  PNEUMONIA: 0.8700  NORMAL: 0.8021 
F1 - ALL: 0.8279  COVID-19: 0.8526  PNEUMONIA: 0.8247  NORMAL: 0.8063 

Epoch 7/19
----------
[train]
LOSS - 0.0378
ACC - 0.9600
PPV - ALL: 1.0000  COVID-19: 1.0000  PNEUMONIA: 1.0000  NORMAL: 1.0000 
RECALL - ALL: 1.0000  COVID-19: 1.0000  PNEUMONIA: 1.0000  NORMAL: 1.0000 
F1 - ALL: 1.0000  COVID-19: 1.0000  PNEUMONIA: 1.0000  NORMAL: 1.0000 
Mask ratio's range: 0.75 ~ 1.0

[val]
LOSS - 0.4833
ACC - 0.8200
PPV - ALL: 0.8377  COVID-19: 0.9294  PNEUMONIA: 0.7857  NORMAL: 0.7980 
RECALL - ALL: 0.8310  COVID-19: 0.7900  PNEUMONIA: 0.8800  NORMAL: 0.8229 
F1 - ALL: 0.8315  COVID-19: 0.8540  PNEUMONIA: 0.8302  NORMAL: 0.8103 

Epoch 8/19
----------
[train]
LOSS - 0.0317
ACC - 0.9600
PPV - ALL: 1.0000  COVID-19: 1.0000  PNEUMONIA: 1.0000  NORMAL: 1.0000 
RECALL - ALL: 1.0000  COVID-19: 1.0000  PNEUMONIA: 1.0000  NORMAL: 1.0000 
F1 - ALL: 1.0000  COVID-19: 1.0000  PNEUMONIA: 1.0000  NORMAL: 1.0000 
Mask ratio's range: 0.75 ~ 0.9375

[val]
LOSS - 0.4733
ACC - 0.8200
PPV - ALL: 0.8392  COVID-19: 0.9398  PNEUMONIA: 0.7857  NORMAL: 0.7921 
RECALL - ALL: 0.8311  COVID-19: 0.7800  PNEUMONIA: 0.8800  NORMAL: 0.8333 
F1 - ALL: 0.8316  COVID-19: 0.8525  PNEUMONIA: 0.8302  NORMAL: 0.8122 

Epoch 9/19
----------
[train]
LOSS - 0.0254
ACC - 0.9600
PPV - ALL: 1.0000  COVID-19: 1.0000  PNEUMONIA: 1.0000  NORMAL: 1.0000 
RECALL - ALL: 1.0000  COVID-19: 1.0000  PNEUMONIA: 1.0000  NORMAL: 1.0000 
F1 - ALL: 1.0000  COVID-19: 1.0000  PNEUMONIA: 1.0000  NORMAL: 1.0000 
Mask ratio's range: 0.75 ~ 0.9375

[val]
LOSS - 0.4717
ACC - 0.8167
PPV - ALL: 0.8363  COVID-19: 0.9390  PNEUMONIA: 0.7857  NORMAL: 0.7843 
RECALL - ALL: 0.8278  COVID-19: 0.7700  PNEUMONIA: 0.8800  NORMAL: 0.8333 
F1 - ALL: 0.8281  COVID-19: 0.8461  PNEUMONIA: 0.8302  NORMAL: 0.8081 

Epoch 10/19
----------
[train]
LOSS - 0.0446
ACC - 0.9600
PPV - ALL: 1.0000  COVID-19: 1.0000  PNEUMONIA: 1.0000  NORMAL: 1.0000 
RECALL - ALL: 1.0000  COVID-19: 1.0000  PNEUMONIA: 1.0000  NORMAL: 1.0000 
F1 - ALL: 1.0000  COVID-19: 1.0000  PNEUMONIA: 1.0000  NORMAL: 1.0000 
Mask ratio's range: 0.75 ~ 0.875

[val]
LOSS - 0.4563
ACC - 0.8200
PPV - ALL: 0.8409  COVID-19: 0.9506  PNEUMONIA: 0.8056  NORMAL: 0.7664 
RECALL - ALL: 0.8314  COVID-19: 0.7700  PNEUMONIA: 0.8700  NORMAL: 0.8542 
F1 - ALL: 0.8318  COVID-19: 0.8508  PNEUMONIA: 0.8366  NORMAL: 0.8079 

Epoch 11/19
----------
[train]
LOSS - 0.0386
ACC - 0.9600
PPV - ALL: 1.0000  COVID-19: 1.0000  PNEUMONIA: 1.0000  NORMAL: 1.0000 
RECALL - ALL: 1.0000  COVID-19: 1.0000  PNEUMONIA: 1.0000  NORMAL: 1.0000 
F1 - ALL: 1.0000  COVID-19: 1.0000  PNEUMONIA: 1.0000  NORMAL: 1.0000 
Mask ratio's range: 0.6875 ~ 0.875

[val]
LOSS - 0.4793
ACC - 0.8167
PPV - ALL: 0.8384  COVID-19: 0.9500  PNEUMONIA: 0.7788  NORMAL: 0.7864 
RECALL - ALL: 0.8279  COVID-19: 0.7600  PNEUMONIA: 0.8800  NORMAL: 0.8438 
F1 - ALL: 0.8283  COVID-19: 0.8444  PNEUMONIA: 0.8263  NORMAL: 0.8141 

Epoch 12/19
----------
[train]
LOSS - 0.0397
ACC - 0.9600
PPV - ALL: 1.0000  COVID-19: 1.0000  PNEUMONIA: 1.0000  NORMAL: 1.0000 
RECALL - ALL: 1.0000  COVID-19: 1.0000  PNEUMONIA: 1.0000  NORMAL: 1.0000 
F1 - ALL: 1.0000  COVID-19: 1.0000  PNEUMONIA: 1.0000  NORMAL: 1.0000 
Mask ratio's range: 0.5625 ~ 0.875

[val]
LOSS - 0.4918
ACC - 0.7933
PPV - ALL: 0.8197  COVID-19: 0.9459  PNEUMONIA: 0.7632  NORMAL: 0.7500 
RECALL - ALL: 0.8046  COVID-19: 0.7000  PNEUMONIA: 0.8700  NORMAL: 0.8438 
F1 - ALL: 0.8039  COVID-19: 0.8046  PNEUMONIA: 0.8131  NORMAL: 0.7941 

Epoch 13/19
----------
[train]
LOSS - 0.0404
ACC - 0.9600
PPV - ALL: 1.0000  COVID-19: 1.0000  PNEUMONIA: 1.0000  NORMAL: 1.0000 
RECALL - ALL: 1.0000  COVID-19: 1.0000  PNEUMONIA: 1.0000  NORMAL: 1.0000 
F1 - ALL: 1.0000  COVID-19: 1.0000  PNEUMONIA: 1.0000  NORMAL: 1.0000 
Mask ratio's range: 0.5625 ~ 0.875

[val]
LOSS - 0.4974
ACC - 0.8000
PPV - ALL: 0.8248  COVID-19: 0.9474  PNEUMONIA: 0.7838  NORMAL: 0.7431 
RECALL - ALL: 0.8113  COVID-19: 0.7200  PNEUMONIA: 0.8700  NORMAL: 0.8438 
F1 - ALL: 0.8111  COVID-19: 0.8182  PNEUMONIA: 0.8247  NORMAL: 0.7903 

Epoch 14/19
----------
[train]
LOSS - 0.0377
ACC - 0.9600
PPV - ALL: 1.0000  COVID-19: 1.0000  PNEUMONIA: 1.0000  NORMAL: 1.0000 
RECALL - ALL: 1.0000  COVID-19: 1.0000  PNEUMONIA: 1.0000  NORMAL: 1.0000 
F1 - ALL: 1.0000  COVID-19: 1.0000  PNEUMONIA: 1.0000  NORMAL: 1.0000 
Mask ratio's range: 0.5625 ~ 0.875

[val]
LOSS - 0.5056
ACC - 0.8033
PPV - ALL: 0.8275  COVID-19: 0.9481  PNEUMONIA: 0.7890  NORMAL: 0.7455 
RECALL - ALL: 0.8147  COVID-19: 0.7300  PNEUMONIA: 0.8600  NORMAL: 0.8542 
F1 - ALL: 0.8147  COVID-19: 0.8249  PNEUMONIA: 0.8230  NORMAL: 0.7962 

Epoch 15/19
----------
[train]
LOSS - 0.0369
ACC - 0.9600
PPV - ALL: 1.0000  COVID-19: 1.0000  PNEUMONIA: 1.0000  NORMAL: 1.0000 
RECALL - ALL: 1.0000  COVID-19: 1.0000  PNEUMONIA: 1.0000  NORMAL: 1.0000 
F1 - ALL: 1.0000  COVID-19: 1.0000  PNEUMONIA: 1.0000  NORMAL: 1.0000 
Mask ratio's range: 0.5625 ~ 0.875

[val]
LOSS - 0.5062
ACC - 0.8000
PPV - ALL: 0.8249  COVID-19: 0.9474  PNEUMONIA: 0.7818  NORMAL: 0.7455 
RECALL - ALL: 0.8114  COVID-19: 0.7200  PNEUMONIA: 0.8600  NORMAL: 0.8542 
F1 - ALL: 0.8111  COVID-19: 0.8182  PNEUMONIA: 0.8190  NORMAL: 0.7962 

Epoch 16/19
----------
[train]
LOSS - 0.0391
ACC - 0.9600
PPV - ALL: 1.0000  COVID-19: 1.0000  PNEUMONIA: 1.0000  NORMAL: 1.0000 
RECALL - ALL: 1.0000  COVID-19: 1.0000  PNEUMONIA: 1.0000  NORMAL: 1.0000 
F1 - ALL: 1.0000  COVID-19: 1.0000  PNEUMONIA: 1.0000  NORMAL: 1.0000 
Mask ratio's range: 0.5 ~ 0.8125

[val]
LOSS - 0.5246
ACC - 0.7967
PPV - ALL: 0.8227  COVID-19: 0.9459  PNEUMONIA: 0.7768  NORMAL: 0.7455 
RECALL - ALL: 0.8081  COVID-19: 0.7000  PNEUMONIA: 0.8700  NORMAL: 0.8542 
F1 - ALL: 0.8072  COVID-19: 0.8046  PNEUMONIA: 0.8208  NORMAL: 0.7962 

Epoch 17/19
----------
[train]
LOSS - 0.0354
ACC - 0.9600
PPV - ALL: 1.0000  COVID-19: 1.0000  PNEUMONIA: 1.0000  NORMAL: 1.0000 
RECALL - ALL: 1.0000  COVID-19: 1.0000  PNEUMONIA: 1.0000  NORMAL: 1.0000 
F1 - ALL: 1.0000  COVID-19: 1.0000  PNEUMONIA: 1.0000  NORMAL: 1.0000 
Mask ratio's range: 0.4375 ~ 0.8125

[val]
LOSS - 0.5367
ACC - 0.8033
PPV - ALL: 0.8298  COVID-19: 0.9600  PNEUMONIA: 0.7818  NORMAL: 0.7477 
RECALL - ALL: 0.8149  COVID-19: 0.7200  PNEUMONIA: 0.8600  NORMAL: 0.8646 
F1 - ALL: 0.8146  COVID-19: 0.8229  PNEUMONIA: 0.8190  NORMAL: 0.8019 

Epoch 18/19
----------
[train]
LOSS - 0.0357
ACC - 0.9600
PPV - ALL: 1.0000  COVID-19: 1.0000  PNEUMONIA: 1.0000  NORMAL: 1.0000 
RECALL - ALL: 1.0000  COVID-19: 1.0000  PNEUMONIA: 1.0000  NORMAL: 1.0000 
F1 - ALL: 1.0000  COVID-19: 1.0000  PNEUMONIA: 1.0000  NORMAL: 1.0000 
Mask ratio's range: 0.4375 ~ 0.8125

[val]
LOSS - 0.5465
ACC - 0.7867
PPV - ALL: 0.8175  COVID-19: 0.9571  PNEUMONIA: 0.7478  NORMAL: 0.7477 
RECALL - ALL: 0.7982  COVID-19: 0.6700  PNEUMONIA: 0.8600  NORMAL: 0.8646 
F1 - ALL: 0.7967  COVID-19: 0.7882  PNEUMONIA: 0.8000  NORMAL: 0.8019 

Epoch 19/19
----------
[train]
LOSS - 0.0295
ACC - 0.9600
PPV - ALL: 1.0000  COVID-19: 1.0000  PNEUMONIA: 1.0000  NORMAL: 1.0000 
RECALL - ALL: 1.0000  COVID-19: 1.0000  PNEUMONIA: 1.0000  NORMAL: 1.0000 
F1 - ALL: 1.0000  COVID-19: 1.0000  PNEUMONIA: 1.0000  NORMAL: 1.0000 
Mask ratio's range: 0.4375 ~ 0.8125

[val]
LOSS - 0.5642
ACC - 0.7833
PPV - ALL: 0.8145  COVID-19: 0.9571  PNEUMONIA: 0.7478  NORMAL: 0.7387 
RECALL - ALL: 0.7947  COVID-19: 0.6700  PNEUMONIA: 0.8600  NORMAL: 0.8542 
F1 - ALL: 0.7935  COVID-19: 0.7882  PNEUMONIA: 0.8000  NORMAL: 0.7923 


--------------------
[Best results]
ACC - 0.8267
PPV - ALL: 0.8402  COVID-19: 0.8925  PNEUMONIA: 0.8000  NORMAL: 0.8280 
RECALL - ALL: 0.8374  COVID-19: 0.8300  PNEUMONIA: 0.8800  NORMAL: 0.8021 
F1 - ALL: 0.8377  COVID-19: 0.8601  PNEUMONIA: 0.8381  NORMAL: 0.8148 

Training complete in 1m 29s
-------------------- 

--------------------
Model 3
--------------------

Epoch 0/19
----------
[train]
LOSS - 0.9902
ACC - 0.5333
PPV - ALL: 0.5548  COVID-19: 0.5714  PNEUMONIA: 0.5217  NORMAL: 0.5714 
RECALL - ALL: 0.5556  COVID-19: 0.5000  PNEUMONIA: 0.5000  NORMAL: 0.6667 
F1 - ALL: 0.5531  COVID-19: 0.5333  PNEUMONIA: 0.5106  NORMAL: 0.6154 
Mask ratio's range: 1.0 ~ 1.0

[val]
LOSS - 0.9684
ACC - 0.5367
PPV - ALL: 0.6399  COVID-19: 0.8684  PNEUMONIA: 0.5882  NORMAL: 0.4632 
RECALL - ALL: 0.5489  COVID-19: 0.3300  PNEUMONIA: 0.4000  NORMAL: 0.9167 
F1 - ALL: 0.5233  COVID-19: 0.4783  PNEUMONIA: 0.4762  NORMAL: 0.6154 

Epoch 1/19
----------
[train]
LOSS - 0.6022
ACC - 0.8933
PPV - ALL: 0.9363  COVID-19: 1.0000  PNEUMONIA: 0.9200  NORMAL: 0.8889 
RECALL - ALL: 0.9305  COVID-19: 0.8333  PNEUMONIA: 0.9583  NORMAL: 1.0000 
F1 - ALL: 0.9297  COVID-19: 0.9091  PNEUMONIA: 0.9388  NORMAL: 0.9412 
Mask ratio's range: 1.0 ~ 1.0

[val]
LOSS - 0.7117
ACC - 0.7867
PPV - ALL: 0.8022  COVID-19: 0.8690  PNEUMONIA: 0.7757  NORMAL: 0.7619 
RECALL - ALL: 0.7978  COVID-19: 0.7300  PNEUMONIA: 0.8300  NORMAL: 0.8333 
F1 - ALL: 0.7971  COVID-19: 0.7935  PNEUMONIA: 0.8019  NORMAL: 0.7960 

Epoch 2/19
----------
[train]
LOSS - 0.2429
ACC - 0.9600
PPV - ALL: 1.0000  COVID-19: 1.0000  PNEUMONIA: 1.0000  NORMAL: 1.0000 
RECALL - ALL: 1.0000  COVID-19: 1.0000  PNEUMONIA: 1.0000  NORMAL: 1.0000 
F1 - ALL: 1.0000  COVID-19: 1.0000  PNEUMONIA: 1.0000  NORMAL: 1.0000 
Mask ratio's range: 1.0 ~ 1.0

[val]
LOSS - 0.5699
ACC - 0.8233
PPV - ALL: 0.8362  COVID-19: 0.8660  PNEUMONIA: 0.7982  NORMAL: 0.8444 
RECALL - ALL: 0.8339  COVID-19: 0.8400  PNEUMONIA: 0.8700  NORMAL: 0.7917 
F1 - ALL: 0.8342  COVID-19: 0.8528  PNEUMONIA: 0.8326  NORMAL: 0.8172 

Epoch 3/19
----------
[train]
LOSS - 0.0866
ACC - 0.9600
PPV - ALL: 1.0000  COVID-19: 1.0000  PNEUMONIA: 1.0000  NORMAL: 1.0000 
RECALL - ALL: 1.0000  COVID-19: 1.0000  PNEUMONIA: 1.0000  NORMAL: 1.0000 
F1 - ALL: 1.0000  COVID-19: 1.0000  PNEUMONIA: 1.0000  NORMAL: 1.0000 
Mask ratio's range: 1.0 ~ 1.0

[val]
LOSS - 0.4983
ACC - 0.8167
PPV - ALL: 0.8292  COVID-19: 0.8485  PNEUMONIA: 0.7963  NORMAL: 0.8427 
RECALL - ALL: 0.8271  COVID-19: 0.8400  PNEUMONIA: 0.8600  NORMAL: 0.7812 
F1 - ALL: 0.8273  COVID-19: 0.8442  PNEUMONIA: 0.8269  NORMAL: 0.8108 

Epoch 4/19
----------
[train]
LOSS - 0.0367
ACC - 0.9600
PPV - ALL: 1.0000  COVID-19: 1.0000  PNEUMONIA: 1.0000  NORMAL: 1.0000 
RECALL - ALL: 1.0000  COVID-19: 1.0000  PNEUMONIA: 1.0000  NORMAL: 1.0000 
F1 - ALL: 1.0000  COVID-19: 1.0000  PNEUMONIA: 1.0000  NORMAL: 1.0000 
Mask ratio's range: 1.0 ~ 1.0

[val]
LOSS - 0.4677
ACC - 0.8200
PPV - ALL: 0.8329  COVID-19: 0.8500  PNEUMONIA: 0.7963  NORMAL: 0.8523 
RECALL - ALL: 0.8304  COVID-19: 0.8500  PNEUMONIA: 0.8600  NORMAL: 0.7812 
F1 - ALL: 0.8307  COVID-19: 0.8500  PNEUMONIA: 0.8269  NORMAL: 0.8152 

Epoch 5/19
----------
[train]
LOSS - 0.0311
ACC - 0.9600
PPV - ALL: 1.0000  COVID-19: 1.0000  PNEUMONIA: 1.0000  NORMAL: 1.0000 
RECALL - ALL: 1.0000  COVID-19: 1.0000  PNEUMONIA: 1.0000  NORMAL: 1.0000 
F1 - ALL: 1.0000  COVID-19: 1.0000  PNEUMONIA: 1.0000  NORMAL: 1.0000 
Mask ratio's range: 0.8125 ~ 1.0

[val]
LOSS - 0.4534
ACC - 0.8200
PPV - ALL: 0.8324  COVID-19: 0.8431  PNEUMONIA: 0.8019  NORMAL: 0.8523 
RECALL - ALL: 0.8304  COVID-19: 0.8600  PNEUMONIA: 0.8500  NORMAL: 0.7812 
F1 - ALL: 0.8306  COVID-19: 0.8515  PNEUMONIA: 0.8252  NORMAL: 0.8152 

Epoch 6/19
----------
[train]
LOSS - 0.0228
ACC - 0.9600
PPV - ALL: 1.0000  COVID-19: 1.0000  PNEUMONIA: 1.0000  NORMAL: 1.0000 
RECALL - ALL: 1.0000  COVID-19: 1.0000  PNEUMONIA: 1.0000  NORMAL: 1.0000 
F1 - ALL: 1.0000  COVID-19: 1.0000  PNEUMONIA: 1.0000  NORMAL: 1.0000 
Mask ratio's range: 0.75 ~ 1.0

[val]
LOSS - 0.4453
ACC - 0.8167
PPV - ALL: 0.8294  COVID-19: 0.8416  PNEUMONIA: 0.7944  NORMAL: 0.8523 
RECALL - ALL: 0.8271  COVID-19: 0.8500  PNEUMONIA: 0.8500  NORMAL: 0.7812 
F1 - ALL: 0.8274  COVID-19: 0.8458  PNEUMONIA: 0.8213  NORMAL: 0.8152 

Epoch 7/19
----------
[train]
LOSS - 0.0396
ACC - 0.9600
PPV - ALL: 1.0000  COVID-19: 1.0000  PNEUMONIA: 1.0000  NORMAL: 1.0000 
RECALL - ALL: 1.0000  COVID-19: 1.0000  PNEUMONIA: 1.0000  NORMAL: 1.0000 
F1 - ALL: 1.0000  COVID-19: 1.0000  PNEUMONIA: 1.0000  NORMAL: 1.0000 
Mask ratio's range: 0.75 ~ 1.0

[val]
LOSS - 0.4337
ACC - 0.8267
PPV - ALL: 0.8393  COVID-19: 0.8586  PNEUMONIA: 0.8037  NORMAL: 0.8556 
RECALL - ALL: 0.8374  COVID-19: 0.8500  PNEUMONIA: 0.8600  NORMAL: 0.8021 
F1 - ALL: 0.8377  COVID-19: 0.8543  PNEUMONIA: 0.8309  NORMAL: 0.8280 

Epoch 8/19
----------
[train]
LOSS - 0.0433
ACC - 0.9600
PPV - ALL: 1.0000  COVID-19: 1.0000  PNEUMONIA: 1.0000  NORMAL: 1.0000 
RECALL - ALL: 1.0000  COVID-19: 1.0000  PNEUMONIA: 1.0000  NORMAL: 1.0000 
F1 - ALL: 1.0000  COVID-19: 1.0000  PNEUMONIA: 1.0000  NORMAL: 1.0000 
Mask ratio's range: 0.75 ~ 0.9375

[val]
LOSS - 0.4312
ACC - 0.8233
PPV - ALL: 0.8369  COVID-19: 0.8646  PNEUMONIA: 0.7890  NORMAL: 0.8571 
RECALL - ALL: 0.8342  COVID-19: 0.8300  PNEUMONIA: 0.8600  NORMAL: 0.8125 
F1 - ALL: 0.8347  COVID-19: 0.8469  PNEUMONIA: 0.8230  NORMAL: 0.8342 

Epoch 9/19
----------
[train]
LOSS - 0.0357
ACC - 0.9600
PPV - ALL: 1.0000  COVID-19: 1.0000  PNEUMONIA: 1.0000  NORMAL: 1.0000 
RECALL - ALL: 1.0000  COVID-19: 1.0000  PNEUMONIA: 1.0000  NORMAL: 1.0000 
F1 - ALL: 1.0000  COVID-19: 1.0000  PNEUMONIA: 1.0000  NORMAL: 1.0000 
Mask ratio's range: 0.6875 ~ 0.9375

[val]
LOSS - 0.4394
ACC - 0.8200
PPV - ALL: 0.8364  COVID-19: 0.8876  PNEUMONIA: 0.7739  NORMAL: 0.8478 
RECALL - ALL: 0.8308  COVID-19: 0.7900  PNEUMONIA: 0.8900  NORMAL: 0.8125 
F1 - ALL: 0.8312  COVID-19: 0.8360  PNEUMONIA: 0.8279  NORMAL: 0.8298 

Epoch 10/19
----------
[train]
LOSS - 0.0498
ACC - 0.9600
PPV - ALL: 1.0000  COVID-19: 1.0000  PNEUMONIA: 1.0000  NORMAL: 1.0000 
RECALL - ALL: 1.0000  COVID-19: 1.0000  PNEUMONIA: 1.0000  NORMAL: 1.0000 
F1 - ALL: 1.0000  COVID-19: 1.0000  PNEUMONIA: 1.0000  NORMAL: 1.0000 
Mask ratio's range: 0.625 ~ 0.875

[val]
LOSS - 0.4547
ACC - 0.8167
PPV - ALL: 0.8334  COVID-19: 0.8966  PNEUMONIA: 0.7739  NORMAL: 0.8298 
RECALL - ALL: 0.8275  COVID-19: 0.7800  PNEUMONIA: 0.8900  NORMAL: 0.8125 
F1 - ALL: 0.8277  COVID-19: 0.8342  PNEUMONIA: 0.8279  NORMAL: 0.8211 

Epoch 11/19
----------
[train]
LOSS - 0.0445
ACC - 0.9600
PPV - ALL: 1.0000  COVID-19: 1.0000  PNEUMONIA: 1.0000  NORMAL: 1.0000 
RECALL - ALL: 1.0000  COVID-19: 1.0000  PNEUMONIA: 1.0000  NORMAL: 1.0000 
F1 - ALL: 1.0000  COVID-19: 1.0000  PNEUMONIA: 1.0000  NORMAL: 1.0000 
Mask ratio's range: 0.5625 ~ 0.875

[val]
LOSS - 0.4674
ACC - 0.8067
PPV - ALL: 0.8304  COVID-19: 0.9241  PNEUMONIA: 0.7459  NORMAL: 0.8211 
RECALL - ALL: 0.8175  COVID-19: 0.7300  PNEUMONIA: 0.9100  NORMAL: 0.8125 
F1 - ALL: 0.8174  COVID-19: 0.8157  PNEUMONIA: 0.8198  NORMAL: 0.8168 

Epoch 12/19
----------
[train]
LOSS - 0.0447
ACC - 0.9600
PPV - ALL: 1.0000  COVID-19: 1.0000  PNEUMONIA: 1.0000  NORMAL: 1.0000 
RECALL - ALL: 1.0000  COVID-19: 1.0000  PNEUMONIA: 1.0000  NORMAL: 1.0000 
F1 - ALL: 1.0000  COVID-19: 1.0000  PNEUMONIA: 1.0000  NORMAL: 1.0000 
Mask ratio's range: 0.5 ~ 0.8125

[val]
LOSS - 0.4888
ACC - 0.8000
PPV - ALL: 0.8282  COVID-19: 0.9467  PNEUMONIA: 0.7317  NORMAL: 0.8061 
RECALL - ALL: 0.8110  COVID-19: 0.7100  PNEUMONIA: 0.9000  NORMAL: 0.8229 
F1 - ALL: 0.8110  COVID-19: 0.8114  PNEUMONIA: 0.8072  NORMAL: 0.8144 

Epoch 13/19
----------
[train]
LOSS - 0.0424
ACC - 0.9600
PPV - ALL: 1.0000  COVID-19: 1.0000  PNEUMONIA: 1.0000  NORMAL: 1.0000 
RECALL - ALL: 1.0000  COVID-19: 1.0000  PNEUMONIA: 1.0000  NORMAL: 1.0000 
F1 - ALL: 1.0000  COVID-19: 1.0000  PNEUMONIA: 1.0000  NORMAL: 1.0000 
Mask ratio's range: 0.5 ~ 0.75

[val]
LOSS - 0.4910
ACC - 0.7933
PPV - ALL: 0.8223  COVID-19: 0.9452  PNEUMONIA: 0.7317  NORMAL: 0.7900 
RECALL - ALL: 0.8043  COVID-19: 0.6900  PNEUMONIA: 0.9000  NORMAL: 0.8229 
F1 - ALL: 0.8037  COVID-19: 0.7977  PNEUMONIA: 0.8072  NORMAL: 0.8061 

Epoch 14/19
----------
[train]
LOSS - 0.0335
ACC - 0.9600
PPV - ALL: 1.0000  COVID-19: 1.0000  PNEUMONIA: 1.0000  NORMAL: 1.0000 
RECALL - ALL: 1.0000  COVID-19: 1.0000  PNEUMONIA: 1.0000  NORMAL: 1.0000 
F1 - ALL: 1.0000  COVID-19: 1.0000  PNEUMONIA: 1.0000  NORMAL: 1.0000 
Mask ratio's range: 0.5 ~ 0.75

[val]
LOSS - 0.4929
ACC - 0.7933
PPV - ALL: 0.8230  COVID-19: 0.9452  PNEUMONIA: 0.7258  NORMAL: 0.7980 
RECALL - ALL: 0.8043  COVID-19: 0.6900  PNEUMONIA: 0.9000  NORMAL: 0.8229 
F1 - ALL: 0.8039  COVID-19: 0.7977  PNEUMONIA: 0.8036  NORMAL: 0.8103 

Epoch 15/19
----------
[train]
LOSS - 0.0318
ACC - 0.9600
PPV - ALL: 1.0000  COVID-19: 1.0000  PNEUMONIA: 1.0000  NORMAL: 1.0000 
RECALL - ALL: 1.0000  COVID-19: 1.0000  PNEUMONIA: 1.0000  NORMAL: 1.0000 
F1 - ALL: 1.0000  COVID-19: 1.0000  PNEUMONIA: 1.0000  NORMAL: 1.0000 
Mask ratio's range: 0.5 ~ 0.75

[val]
LOSS - 0.4940
ACC - 0.7933
PPV - ALL: 0.8227  COVID-19: 0.9444  PNEUMONIA: 0.7317  NORMAL: 0.7921 
RECALL - ALL: 0.8044  COVID-19: 0.6800  PNEUMONIA: 0.9000  NORMAL: 0.8333 
F1 - ALL: 0.8034  COVID-19: 0.7907  PNEUMONIA: 0.8072  NORMAL: 0.8122 

Epoch 16/19
----------
[train]
LOSS - 0.0495
ACC - 0.9600
PPV - ALL: 1.0000  COVID-19: 1.0000  PNEUMONIA: 1.0000  NORMAL: 1.0000 
RECALL - ALL: 1.0000  COVID-19: 1.0000  PNEUMONIA: 1.0000  NORMAL: 1.0000 
F1 - ALL: 1.0000  COVID-19: 1.0000  PNEUMONIA: 1.0000  NORMAL: 1.0000 
Mask ratio's range: 0.5 ~ 0.75

[val]
LOSS - 0.5646
ACC - 0.7933
PPV - ALL: 0.8226  COVID-19: 0.9437  PNEUMONIA: 0.7398  NORMAL: 0.7843 
RECALL - ALL: 0.8044  COVID-19: 0.6700  PNEUMONIA: 0.9100  NORMAL: 0.8333 
F1 - ALL: 0.8026  COVID-19: 0.7836  PNEUMONIA: 0.8161  NORMAL: 0.8081 

Epoch 17/19
----------
[train]
LOSS - 0.0345
ACC - 0.9600
PPV - ALL: 1.0000  COVID-19: 1.0000  PNEUMONIA: 1.0000  NORMAL: 1.0000 
RECALL - ALL: 1.0000  COVID-19: 1.0000  PNEUMONIA: 1.0000  NORMAL: 1.0000 
F1 - ALL: 1.0000  COVID-19: 1.0000  PNEUMONIA: 1.0000  NORMAL: 1.0000 
Mask ratio's range: 0.5 ~ 0.75

[val]
LOSS - 0.5434
ACC - 0.7900
PPV - ALL: 0.8270  COVID-19: 0.9851  PNEUMONIA: 0.7339  NORMAL: 0.7619 
RECALL - ALL: 0.8011  COVID-19: 0.6600  PNEUMONIA: 0.9100  NORMAL: 0.8333 
F1 - ALL: 0.7996  COVID-19: 0.7904  PNEUMONIA: 0.8125  NORMAL: 0.7960 

Epoch 18/19
----------
[train]
LOSS - 0.0440
ACC - 0.9600
PPV - ALL: 1.0000  COVID-19: 1.0000  PNEUMONIA: 1.0000  NORMAL: 1.0000 
RECALL - ALL: 1.0000  COVID-19: 1.0000  PNEUMONIA: 1.0000  NORMAL: 1.0000 
F1 - ALL: 1.0000  COVID-19: 1.0000  PNEUMONIA: 1.0000  NORMAL: 1.0000 
Mask ratio's range: 0.4375 ~ 0.6875

[val]
LOSS - 0.5662
ACC - 0.7900
PPV - ALL: 0.8312  COVID-19: 1.0000  PNEUMONIA: 0.7222  NORMAL: 0.7714 
RECALL - ALL: 0.8013  COVID-19: 0.6500  PNEUMONIA: 0.9100  NORMAL: 0.8438 
F1 - ALL: 0.7997  COVID-19: 0.7879  PNEUMONIA: 0.8053  NORMAL: 0.8060 

Epoch 19/19
----------
[train]
LOSS - 0.0393
ACC - 0.9600
PPV - ALL: 1.0000  COVID-19: 1.0000  PNEUMONIA: 1.0000  NORMAL: 1.0000 
RECALL - ALL: 1.0000  COVID-19: 1.0000  PNEUMONIA: 1.0000  NORMAL: 1.0000 
F1 - ALL: 1.0000  COVID-19: 1.0000  PNEUMONIA: 1.0000  NORMAL: 1.0000 
Mask ratio's range: 0.4375 ~ 0.6875

[val]
LOSS - 0.5512
ACC - 0.7867
PPV - ALL: 0.8175  COVID-19: 0.9420  PNEUMONIA: 0.7339  NORMAL: 0.7767 
RECALL - ALL: 0.7978  COVID-19: 0.6500  PNEUMONIA: 0.9100  NORMAL: 0.8333 
F1 - ALL: 0.7952  COVID-19: 0.7692  PNEUMONIA: 0.8125  NORMAL: 0.8040 


--------------------
[Best results]
ACC - 0.8267
PPV - ALL: 0.8393  COVID-19: 0.8586  PNEUMONIA: 0.8037  NORMAL: 0.8556 
RECALL - ALL: 0.8374  COVID-19: 0.8500  PNEUMONIA: 0.8600  NORMAL: 0.8021 
F1 - ALL: 0.8377  COVID-19: 0.8543  PNEUMONIA: 0.8309  NORMAL: 0.8280 

Training complete in 1m 30s
-------------------- 

--------------------
Model 4
--------------------

Epoch 0/19
----------
[train]
LOSS - 1.0112
ACC - 0.5067
PPV - ALL: 0.5267  COVID-19: 0.4583  PNEUMONIA: 0.5217  NORMAL: 0.6000 
RECALL - ALL: 0.5278  COVID-19: 0.4583  PNEUMONIA: 0.5000  NORMAL: 0.6250 
F1 - ALL: 0.5270  COVID-19: 0.4583  PNEUMONIA: 0.5106  NORMAL: 0.6122 
Mask ratio's range: 1.0 ~ 1.0

[val]
LOSS - 0.9903
ACC - 0.5333
PPV - ALL: 0.7216  COVID-19: 1.0000  PNEUMONIA: 0.7160  NORMAL: 0.4488 
RECALL - ALL: 0.5461  COVID-19: 0.1000  PNEUMONIA: 0.5800  NORMAL: 0.9583 
F1 - ALL: 0.4780  COVID-19: 0.1818  PNEUMONIA: 0.6409  NORMAL: 0.6113 

Epoch 1/19
----------
[train]
LOSS - 0.6352
ACC - 0.9067
PPV - ALL: 0.9477  COVID-19: 1.0000  PNEUMONIA: 0.9200  NORMAL: 0.9231 
RECALL - ALL: 0.9444  COVID-19: 0.8750  PNEUMONIA: 0.9583  NORMAL: 1.0000 
F1 - ALL: 0.9440  COVID-19: 0.9333  PNEUMONIA: 0.9388  NORMAL: 0.9600 
Mask ratio's range: 1.0 ~ 1.0

[val]
LOSS - 0.7602
ACC - 0.7567
PPV - ALL: 0.7701  COVID-19: 0.7857  PNEUMONIA: 0.7156  NORMAL: 0.8090 
RECALL - ALL: 0.7667  COVID-19: 0.7700  PNEUMONIA: 0.7800  NORMAL: 0.7500 
F1 - ALL: 0.7675  COVID-19: 0.7778  PNEUMONIA: 0.7464  NORMAL: 0.7784 

Epoch 2/19
----------
[train]
LOSS - 0.2771
ACC - 0.9467
PPV - ALL: 0.9867  COVID-19: 1.0000  PNEUMONIA: 1.0000  NORMAL: 0.9600 
RECALL - ALL: 0.9861  COVID-19: 1.0000  PNEUMONIA: 0.9583  NORMAL: 1.0000 
F1 - ALL: 0.9861  COVID-19: 1.0000  PNEUMONIA: 0.9787  NORMAL: 0.9796 
Mask ratio's range: 1.0 ~ 1.0

[val]
LOSS - 0.6213
ACC - 0.7700
PPV - ALL: 0.7941  COVID-19: 0.8816  PNEUMONIA: 0.7049  NORMAL: 0.7959 
RECALL - ALL: 0.7808  COVID-19: 0.6700  PNEUMONIA: 0.8600  NORMAL: 0.8125 
F1 - ALL: 0.7801  COVID-19: 0.7614  PNEUMONIA: 0.7748  NORMAL: 0.8041 

Epoch 3/19
----------
[train]
LOSS - 0.1017
ACC - 0.9600
PPV - ALL: 1.0000  COVID-19: 1.0000  PNEUMONIA: 1.0000  NORMAL: 1.0000 
RECALL - ALL: 1.0000  COVID-19: 1.0000  PNEUMONIA: 1.0000  NORMAL: 1.0000 
F1 - ALL: 1.0000  COVID-19: 1.0000  PNEUMONIA: 1.0000  NORMAL: 1.0000 
Mask ratio's range: 1.0 ~ 1.0

[val]
LOSS - 0.5625
ACC - 0.7767
PPV - ALL: 0.7966  COVID-19: 0.8444  PNEUMONIA: 0.7083  NORMAL: 0.8372 
RECALL - ALL: 0.7867  COVID-19: 0.7600  PNEUMONIA: 0.8500  NORMAL: 0.7500 
F1 - ALL: 0.7880  COVID-19: 0.8000  PNEUMONIA: 0.7727  NORMAL: 0.7912 

Epoch 4/19
----------
[train]
LOSS - 0.0501
ACC - 0.9600
PPV - ALL: 1.0000  COVID-19: 1.0000  PNEUMONIA: 1.0000  NORMAL: 1.0000 
RECALL - ALL: 1.0000  COVID-19: 1.0000  PNEUMONIA: 1.0000  NORMAL: 1.0000 
F1 - ALL: 1.0000  COVID-19: 1.0000  PNEUMONIA: 1.0000  NORMAL: 1.0000 
Mask ratio's range: 0.875 ~ 1.0

[val]
LOSS - 0.5290
ACC - 0.7800
PPV - ALL: 0.7934  COVID-19: 0.8152  PNEUMONIA: 0.7477  NORMAL: 0.8172 
RECALL - ALL: 0.7906  COVID-19: 0.7500  PNEUMONIA: 0.8300  NORMAL: 0.7917 
F1 - ALL: 0.7907  COVID-19: 0.7812  PNEUMONIA: 0.7867  NORMAL: 0.8042 

Epoch 5/19
----------
[train]
LOSS - 0.0319
ACC - 0.9600
PPV - ALL: 1.0000  COVID-19: 1.0000  PNEUMONIA: 1.0000  NORMAL: 1.0000 
RECALL - ALL: 1.0000  COVID-19: 1.0000  PNEUMONIA: 1.0000  NORMAL: 1.0000 
F1 - ALL: 1.0000  COVID-19: 1.0000  PNEUMONIA: 1.0000  NORMAL: 1.0000 
Mask ratio's range: 0.875 ~ 1.0

[val]
LOSS - 0.5170
ACC - 0.7800
PPV - ALL: 0.7950  COVID-19: 0.8172  PNEUMONIA: 0.7345  NORMAL: 0.8333 
RECALL - ALL: 0.7904  COVID-19: 0.7600  PNEUMONIA: 0.8300  NORMAL: 0.7812 
F1 - ALL: 0.7911  COVID-19: 0.7876  PNEUMONIA: 0.7793  NORMAL: 0.8064 

Epoch 6/19
----------
[train]
LOSS - 0.0238
ACC - 0.9600
PPV - ALL: 1.0000  COVID-19: 1.0000  PNEUMONIA: 1.0000  NORMAL: 1.0000 
RECALL - ALL: 1.0000  COVID-19: 1.0000  PNEUMONIA: 1.0000  NORMAL: 1.0000 
F1 - ALL: 1.0000  COVID-19: 1.0000  PNEUMONIA: 1.0000  NORMAL: 1.0000 
Mask ratio's range: 0.875 ~ 1.0

[val]
LOSS - 0.5122
ACC - 0.7700
PPV - ALL: 0.7820  COVID-19: 0.7700  PNEUMONIA: 0.7500  NORMAL: 0.8261 
RECALL - ALL: 0.7806  COVID-19: 0.7700  PNEUMONIA: 0.7800  NORMAL: 0.7917 
F1 - ALL: 0.7811  COVID-19: 0.7700  PNEUMONIA: 0.7647  NORMAL: 0.8085 

Epoch 7/19
----------
[train]
LOSS - 0.0271
ACC - 0.9600
PPV - ALL: 1.0000  COVID-19: 1.0000  PNEUMONIA: 1.0000  NORMAL: 1.0000 
RECALL - ALL: 1.0000  COVID-19: 1.0000  PNEUMONIA: 1.0000  NORMAL: 1.0000 
F1 - ALL: 1.0000  COVID-19: 1.0000  PNEUMONIA: 1.0000  NORMAL: 1.0000 
Mask ratio's range: 0.8125 ~ 1.0

[val]
LOSS - 0.5076
ACC - 0.7767
PPV - ALL: 0.7889  COVID-19: 0.8000  PNEUMONIA: 0.7477  NORMAL: 0.8191 
RECALL - ALL: 0.7874  COVID-19: 0.7600  PNEUMONIA: 0.8000  NORMAL: 0.8021 
F1 - ALL: 0.7877  COVID-19: 0.7795  PNEUMONIA: 0.7730  NORMAL: 0.8105 

Epoch 8/19
----------
[train]
LOSS - 0.0268
ACC - 0.9600
PPV - ALL: 1.0000  COVID-19: 1.0000  PNEUMONIA: 1.0000  NORMAL: 1.0000 
RECALL - ALL: 1.0000  COVID-19: 1.0000  PNEUMONIA: 1.0000  NORMAL: 1.0000 
F1 - ALL: 1.0000  COVID-19: 1.0000  PNEUMONIA: 1.0000  NORMAL: 1.0000 
Mask ratio's range: 0.8125 ~ 0.9375

[val]
LOSS - 0.5256
ACC - 0.7733
PPV - ALL: 0.7848  COVID-19: 0.7895  PNEUMONIA: 0.7524  NORMAL: 0.8125 
RECALL - ALL: 0.7842  COVID-19: 0.7500  PNEUMONIA: 0.7900  NORMAL: 0.8125 
F1 - ALL: 0.7841  COVID-19: 0.7692  PNEUMONIA: 0.7707  NORMAL: 0.8125 

Epoch 9/19
----------
[train]
LOSS - 0.0208
ACC - 0.9600
PPV - ALL: 1.0000  COVID-19: 1.0000  PNEUMONIA: 1.0000  NORMAL: 1.0000 
RECALL - ALL: 1.0000  COVID-19: 1.0000  PNEUMONIA: 1.0000  NORMAL: 1.0000 
F1 - ALL: 1.0000  COVID-19: 1.0000  PNEUMONIA: 1.0000  NORMAL: 1.0000 
Mask ratio's range: 0.8125 ~ 0.9375

[val]
LOSS - 0.5108
ACC - 0.7833
PPV - ALL: 0.7954  COVID-19: 0.8222  PNEUMONIA: 0.7619  NORMAL: 0.8020 
RECALL - ALL: 0.7946  COVID-19: 0.7400  PNEUMONIA: 0.8000  NORMAL: 0.8438 
F1 - ALL: 0.7939  COVID-19: 0.7789  PNEUMONIA: 0.7805  NORMAL: 0.8224 

Epoch 10/19
----------
[train]
LOSS - 0.0430
ACC - 0.9600
PPV - ALL: 1.0000  COVID-19: 1.0000  PNEUMONIA: 1.0000  NORMAL: 1.0000 
RECALL - ALL: 1.0000  COVID-19: 1.0000  PNEUMONIA: 1.0000  NORMAL: 1.0000 
F1 - ALL: 1.0000  COVID-19: 1.0000  PNEUMONIA: 1.0000  NORMAL: 1.0000 
Mask ratio's range: 0.8125 ~ 0.9375

[val]
LOSS - 0.5661
ACC - 0.7867
PPV - ALL: 0.7992  COVID-19: 0.8315  PNEUMONIA: 0.7642  NORMAL: 0.8020 
RECALL - ALL: 0.7979  COVID-19: 0.7400  PNEUMONIA: 0.8100  NORMAL: 0.8438 
F1 - ALL: 0.7973  COVID-19: 0.7831  PNEUMONIA: 0.7864  NORMAL: 0.8224 

Epoch 11/19
----------
[train]
LOSS - 0.0263
ACC - 0.9600
PPV - ALL: 1.0000  COVID-19: 1.0000  PNEUMONIA: 1.0000  NORMAL: 1.0000 
RECALL - ALL: 1.0000  COVID-19: 1.0000  PNEUMONIA: 1.0000  NORMAL: 1.0000 
F1 - ALL: 1.0000  COVID-19: 1.0000  PNEUMONIA: 1.0000  NORMAL: 1.0000 
Mask ratio's range: 0.75 ~ 0.9375

[val]
LOSS - 0.5326
ACC - 0.7800
PPV - ALL: 0.7931  COVID-19: 0.8295  PNEUMONIA: 0.7477  NORMAL: 0.8020 
RECALL - ALL: 0.7913  COVID-19: 0.7300  PNEUMONIA: 0.8000  NORMAL: 0.8438 
F1 - ALL: 0.7907  COVID-19: 0.7766  PNEUMONIA: 0.7730  NORMAL: 0.8224 

Epoch 12/19
----------
[train]
LOSS - 0.0373
ACC - 0.9600
PPV - ALL: 1.0000  COVID-19: 1.0000  PNEUMONIA: 1.0000  NORMAL: 1.0000 
RECALL - ALL: 1.0000  COVID-19: 1.0000  PNEUMONIA: 1.0000  NORMAL: 1.0000 
F1 - ALL: 1.0000  COVID-19: 1.0000  PNEUMONIA: 1.0000  NORMAL: 1.0000 
Mask ratio's range: 0.75 ~ 0.875

[val]
LOSS - 0.5499
ACC - 0.7700
PPV - ALL: 0.7819  COVID-19: 0.8111  PNEUMONIA: 0.7404  NORMAL: 0.7941 
RECALL - ALL: 0.7813  COVID-19: 0.7300  PNEUMONIA: 0.7700  NORMAL: 0.8438 
F1 - ALL: 0.7805  COVID-19: 0.7684  PNEUMONIA: 0.7549  NORMAL: 0.8182 

Epoch 13/19
----------
[train]
LOSS - 0.0290
ACC - 0.9600
PPV - ALL: 1.0000  COVID-19: 1.0000  PNEUMONIA: 1.0000  NORMAL: 1.0000 
RECALL - ALL: 1.0000  COVID-19: 1.0000  PNEUMONIA: 1.0000  NORMAL: 1.0000 
F1 - ALL: 1.0000  COVID-19: 1.0000  PNEUMONIA: 1.0000  NORMAL: 1.0000 
Mask ratio's range: 0.6875 ~ 0.875

[val]
LOSS - 0.5405
ACC - 0.7733
PPV - ALL: 0.7862  COVID-19: 0.8202  PNEUMONIA: 0.7383  NORMAL: 0.8000 
RECALL - ALL: 0.7844  COVID-19: 0.7300  PNEUMONIA: 0.7900  NORMAL: 0.8333 
F1 - ALL: 0.7840  COVID-19: 0.7725  PNEUMONIA: 0.7633  NORMAL: 0.8163 

Epoch 14/19
----------
[train]
LOSS - 0.0288
ACC - 0.9600
PPV - ALL: 1.0000  COVID-19: 1.0000  PNEUMONIA: 1.0000  NORMAL: 1.0000 
RECALL - ALL: 1.0000  COVID-19: 1.0000  PNEUMONIA: 1.0000  NORMAL: 1.0000 
F1 - ALL: 1.0000  COVID-19: 1.0000  PNEUMONIA: 1.0000  NORMAL: 1.0000 
Mask ratio's range: 0.6875 ~ 0.875

[val]
LOSS - 0.5662
ACC - 0.7767
PPV - ALL: 0.7904  COVID-19: 0.8372  PNEUMONIA: 0.7477  NORMAL: 0.7864 
RECALL - ALL: 0.7879  COVID-19: 0.7200  PNEUMONIA: 0.8000  NORMAL: 0.8438 
F1 - ALL: 0.7871  COVID-19: 0.7742  PNEUMONIA: 0.7730  NORMAL: 0.8141 

Epoch 15/19
----------
[train]
LOSS - 0.0263
ACC - 0.9600
PPV - ALL: 1.0000  COVID-19: 1.0000  PNEUMONIA: 1.0000  NORMAL: 1.0000 
RECALL - ALL: 1.0000  COVID-19: 1.0000  PNEUMONIA: 1.0000  NORMAL: 1.0000 
F1 - ALL: 1.0000  COVID-19: 1.0000  PNEUMONIA: 1.0000  NORMAL: 1.0000 
Mask ratio's range: 0.6875 ~ 0.875

[val]
LOSS - 0.5839
ACC - 0.7833
PPV - ALL: 0.7997  COVID-19: 0.8675  PNEUMONIA: 0.7431  NORMAL: 0.7885 
RECALL - ALL: 0.7947  COVID-19: 0.7200  PNEUMONIA: 0.8100  NORMAL: 0.8542 
F1 - ALL: 0.7940  COVID-19: 0.7869  PNEUMONIA: 0.7751  NORMAL: 0.8200 

Epoch 16/19
----------
[train]
LOSS - 0.0164
ACC - 0.9600
PPV - ALL: 1.0000  COVID-19: 1.0000  PNEUMONIA: 1.0000  NORMAL: 1.0000 
RECALL - ALL: 1.0000  COVID-19: 1.0000  PNEUMONIA: 1.0000  NORMAL: 1.0000 
F1 - ALL: 1.0000  COVID-19: 1.0000  PNEUMONIA: 1.0000  NORMAL: 1.0000 
Mask ratio's range: 0.6875 ~ 0.875

[val]
LOSS - 0.5176
ACC - 0.7733
PPV - ALL: 0.7866  COVID-19: 0.8295  PNEUMONIA: 0.7383  NORMAL: 0.7921 
RECALL - ALL: 0.7844  COVID-19: 0.7300  PNEUMONIA: 0.7900  NORMAL: 0.8333 
F1 - ALL: 0.7840  COVID-19: 0.7766  PNEUMONIA: 0.7633  NORMAL: 0.8122 

Epoch 17/19
----------
[train]
LOSS - 0.0233
ACC - 0.9600
PPV - ALL: 1.0000  COVID-19: 1.0000  PNEUMONIA: 1.0000  NORMAL: 1.0000 
RECALL - ALL: 1.0000  COVID-19: 1.0000  PNEUMONIA: 1.0000  NORMAL: 1.0000 
F1 - ALL: 1.0000  COVID-19: 1.0000  PNEUMONIA: 1.0000  NORMAL: 1.0000 
Mask ratio's range: 0.6875 ~ 0.8125

[val]
LOSS - 0.5206
ACC - 0.7800
PPV - ALL: 0.7954  COVID-19: 0.8588  PNEUMONIA: 0.7431  NORMAL: 0.7843 
RECALL - ALL: 0.7911  COVID-19: 0.7300  PNEUMONIA: 0.8100  NORMAL: 0.8333 
F1 - ALL: 0.7908  COVID-19: 0.7892  PNEUMONIA: 0.7751  NORMAL: 0.8081 

Epoch 18/19
----------
[train]
LOSS - 0.0195
ACC - 0.9600
PPV - ALL: 1.0000  COVID-19: 1.0000  PNEUMONIA: 1.0000  NORMAL: 1.0000 
RECALL - ALL: 1.0000  COVID-19: 1.0000  PNEUMONIA: 1.0000  NORMAL: 1.0000 
F1 - ALL: 1.0000  COVID-19: 1.0000  PNEUMONIA: 1.0000  NORMAL: 1.0000 
Mask ratio's range: 0.625 ~ 0.8125

[val]
LOSS - 0.5173
ACC - 0.7900
PPV - ALL: 0.8089  COVID-19: 0.8902  PNEUMONIA: 0.7345  NORMAL: 0.8020 
RECALL - ALL: 0.8013  COVID-19: 0.7300  PNEUMONIA: 0.8300  NORMAL: 0.8438 
F1 - ALL: 0.8013  COVID-19: 0.8022  PNEUMONIA: 0.7793  NORMAL: 0.8224 

Epoch 19/19
----------
[train]
LOSS - 0.0196
ACC - 0.9600
PPV - ALL: 1.0000  COVID-19: 1.0000  PNEUMONIA: 1.0000  NORMAL: 1.0000 
RECALL - ALL: 1.0000  COVID-19: 1.0000  PNEUMONIA: 1.0000  NORMAL: 1.0000 
F1 - ALL: 1.0000  COVID-19: 1.0000  PNEUMONIA: 1.0000  NORMAL: 1.0000 
Mask ratio's range: 0.625 ~ 0.8125

[val]
LOSS - 0.5484
ACC - 0.7900
PPV - ALL: 0.8121  COVID-19: 0.9012  PNEUMONIA: 0.7227  NORMAL: 0.8125 
RECALL - ALL: 0.8008  COVID-19: 0.7300  PNEUMONIA: 0.8600  NORMAL: 0.8125 
F1 - ALL: 0.8015  COVID-19: 0.8066  PNEUMONIA: 0.7854  NORMAL: 0.8125 


--------------------
[Best results]
ACC - 0.7900
PPV - ALL: 0.8089  COVID-19: 0.8902  PNEUMONIA: 0.7345  NORMAL: 0.8020 
RECALL - ALL: 0.8013  COVID-19: 0.7300  PNEUMONIA: 0.8300  NORMAL: 0.8438 
F1 - ALL: 0.8013  COVID-19: 0.8022  PNEUMONIA: 0.7793  NORMAL: 0.8224 

Training complete in 1m 31s
-------------------- 

--------------------
Model 5
--------------------

Epoch 0/19
----------
[train]
LOSS - 1.0431
ACC - 0.3333
PPV - ALL: 0.3523  COVID-19: 0.4286  PNEUMONIA: 0.3158  NORMAL: 0.3125 
RECALL - ALL: 0.3472  COVID-19: 0.3750  PNEUMONIA: 0.2500  NORMAL: 0.4167 
F1 - ALL: 0.3454  COVID-19: 0.4000  PNEUMONIA: 0.2791  NORMAL: 0.3572 
Mask ratio's range: 1.0 ~ 1.0

[val]
LOSS - 0.9491
ACC - 0.6267
PPV - ALL: 0.6429  COVID-19: 0.6848  PNEUMONIA: 0.5439  NORMAL: 0.7000 
RECALL - ALL: 0.6354  COVID-19: 0.6300  PNEUMONIA: 0.6200  NORMAL: 0.6562 
F1 - ALL: 0.6377  COVID-19: 0.6563  PNEUMONIA: 0.5795  NORMAL: 0.6774 

Epoch 1/19
----------
[train]
LOSS - 0.6655
ACC - 0.8933
PPV - ALL: 0.9316  COVID-19: 0.9565  PNEUMONIA: 0.9583  NORMAL: 0.8800 
RECALL - ALL: 0.9306  COVID-19: 0.9167  PNEUMONIA: 0.9583  NORMAL: 0.9167 
F1 - ALL: 0.9308  COVID-19: 0.9362  PNEUMONIA: 0.9583  NORMAL: 0.8980 
Mask ratio's range: 1.0 ~ 1.0

[val]
LOSS - 0.7718
ACC - 0.7300
PPV - ALL: 0.7704  COVID-19: 0.9180  PNEUMONIA: 0.7290  NORMAL: 0.6641 
RECALL - ALL: 0.7418  COVID-19: 0.5600  PNEUMONIA: 0.7800  NORMAL: 0.8854 
F1 - ALL: 0.7360  COVID-19: 0.6956  PNEUMONIA: 0.7536  NORMAL: 0.7589 

Epoch 2/19
----------
[train]
LOSS - 0.3088
ACC - 0.9600
PPV - ALL: 1.0000  COVID-19: 1.0000  PNEUMONIA: 1.0000  NORMAL: 1.0000 
RECALL - ALL: 1.0000  COVID-19: 1.0000  PNEUMONIA: 1.0000  NORMAL: 1.0000 
F1 - ALL: 1.0000  COVID-19: 1.0000  PNEUMONIA: 1.0000  NORMAL: 1.0000 
Mask ratio's range: 1.0 ~ 1.0

[val]
LOSS - 0.6232
ACC - 0.7667
PPV - ALL: 0.7783  COVID-19: 0.7978  PNEUMONIA: 0.7778  NORMAL: 0.7593 
RECALL - ALL: 0.7781  COVID-19: 0.7100  PNEUMONIA: 0.7700  NORMAL: 0.8542 
F1 - ALL: 0.7764  COVID-19: 0.7513  PNEUMONIA: 0.7739  NORMAL: 0.8040 

Epoch 3/19
----------
[train]
LOSS - 0.1084
ACC - 0.9600
PPV - ALL: 1.0000  COVID-19: 1.0000  PNEUMONIA: 1.0000  NORMAL: 1.0000 
RECALL - ALL: 1.0000  COVID-19: 1.0000  PNEUMONIA: 1.0000  NORMAL: 1.0000 
F1 - ALL: 1.0000  COVID-19: 1.0000  PNEUMONIA: 1.0000  NORMAL: 1.0000 
Mask ratio's range: 1.0 ~ 1.0

[val]
LOSS - 0.5484
ACC - 0.7900
PPV - ALL: 0.8077  COVID-19: 0.8765  PNEUMONIA: 0.7921  NORMAL: 0.7544 
RECALL - ALL: 0.8019  COVID-19: 0.7100  PNEUMONIA: 0.8000  NORMAL: 0.8958 
F1 - ALL: 0.7998  COVID-19: 0.7845  PNEUMONIA: 0.7960  NORMAL: 0.8190 

Epoch 4/19
----------
[train]
LOSS - 0.0494
ACC - 0.9600
PPV - ALL: 1.0000  COVID-19: 1.0000  PNEUMONIA: 1.0000  NORMAL: 1.0000 
RECALL - ALL: 1.0000  COVID-19: 1.0000  PNEUMONIA: 1.0000  NORMAL: 1.0000 
F1 - ALL: 1.0000  COVID-19: 1.0000  PNEUMONIA: 1.0000  NORMAL: 1.0000 
Mask ratio's range: 0.9375 ~ 1.0

[val]
LOSS - 0.5335
ACC - 0.7733
PPV - ALL: 0.7873  COVID-19: 0.8333  PNEUMONIA: 0.7670  NORMAL: 0.7615 
RECALL - ALL: 0.7849  COVID-19: 0.7000  PNEUMONIA: 0.7900  NORMAL: 0.8646 
F1 - ALL: 0.7830  COVID-19: 0.7609  PNEUMONIA: 0.7783  NORMAL: 0.8098 

Epoch 5/19
----------
[train]
LOSS - 0.0352
ACC - 0.9600
PPV - ALL: 1.0000  COVID-19: 1.0000  PNEUMONIA: 1.0000  NORMAL: 1.0000 
RECALL - ALL: 1.0000  COVID-19: 1.0000  PNEUMONIA: 1.0000  NORMAL: 1.0000 
F1 - ALL: 1.0000  COVID-19: 1.0000  PNEUMONIA: 1.0000  NORMAL: 1.0000 
Mask ratio's range: 0.875 ~ 1.0

[val]
LOSS - 0.5039
ACC - 0.7833
PPV - ALL: 0.7953  COVID-19: 0.8132  PNEUMONIA: 0.8021  NORMAL: 0.7706 
RECALL - ALL: 0.7950  COVID-19: 0.7400  PNEUMONIA: 0.7700  NORMAL: 0.8750 
F1 - ALL: 0.7934  COVID-19: 0.7749  PNEUMONIA: 0.7857  NORMAL: 0.8195 

Epoch 6/19
----------
[train]
LOSS - 0.0384
ACC - 0.9600
PPV - ALL: 1.0000  COVID-19: 1.0000  PNEUMONIA: 1.0000  NORMAL: 1.0000 
RECALL - ALL: 1.0000  COVID-19: 1.0000  PNEUMONIA: 1.0000  NORMAL: 1.0000 
F1 - ALL: 1.0000  COVID-19: 1.0000  PNEUMONIA: 1.0000  NORMAL: 1.0000 
Mask ratio's range: 0.875 ~ 1.0

[val]
LOSS - 0.5031
ACC - 0.7867
PPV - ALL: 0.7991  COVID-19: 0.8295  PNEUMONIA: 0.7900  NORMAL: 0.7778 
RECALL - ALL: 0.7983  COVID-19: 0.7300  PNEUMONIA: 0.7900  NORMAL: 0.8750 
F1 - ALL: 0.7967  COVID-19: 0.7766  PNEUMONIA: 0.7900  NORMAL: 0.8235 

Epoch 7/19
----------
[train]
LOSS - 0.0387
ACC - 0.9600
PPV - ALL: 1.0000  COVID-19: 1.0000  PNEUMONIA: 1.0000  NORMAL: 1.0000 
RECALL - ALL: 1.0000  COVID-19: 1.0000  PNEUMONIA: 1.0000  NORMAL: 1.0000 
F1 - ALL: 1.0000  COVID-19: 1.0000  PNEUMONIA: 1.0000  NORMAL: 1.0000 
Mask ratio's range: 0.8125 ~ 1.0

[val]
LOSS - 0.5252
ACC - 0.7867
PPV - ALL: 0.8007  COVID-19: 0.8471  PNEUMONIA: 0.7822  NORMAL: 0.7727 
RECALL - ALL: 0.7985  COVID-19: 0.7200  PNEUMONIA: 0.7900  NORMAL: 0.8854 
F1 - ALL: 0.7966  COVID-19: 0.7784  PNEUMONIA: 0.7861  NORMAL: 0.8252 

Epoch 8/19
----------
[train]
LOSS - 0.0411
ACC - 0.9600
PPV - ALL: 1.0000  COVID-19: 1.0000  PNEUMONIA: 1.0000  NORMAL: 1.0000 
RECALL - ALL: 1.0000  COVID-19: 1.0000  PNEUMONIA: 1.0000  NORMAL: 1.0000 
F1 - ALL: 1.0000  COVID-19: 1.0000  PNEUMONIA: 1.0000  NORMAL: 1.0000 
Mask ratio's range: 0.8125 ~ 0.9375

[val]
LOSS - 0.5258
ACC - 0.7867
PPV - ALL: 0.8028  COVID-19: 0.8642  PNEUMONIA: 0.7714  NORMAL: 0.7727 
RECALL - ALL: 0.7985  COVID-19: 0.7000  PNEUMONIA: 0.8100  NORMAL: 0.8854 
F1 - ALL: 0.7963  COVID-19: 0.7735  PNEUMONIA: 0.7902  NORMAL: 0.8252 

Epoch 9/19
----------
[train]
LOSS - 0.0401
ACC - 0.9600
PPV - ALL: 1.0000  COVID-19: 1.0000  PNEUMONIA: 1.0000  NORMAL: 1.0000 
RECALL - ALL: 1.0000  COVID-19: 1.0000  PNEUMONIA: 1.0000  NORMAL: 1.0000 
F1 - ALL: 1.0000  COVID-19: 1.0000  PNEUMONIA: 1.0000  NORMAL: 1.0000 
Mask ratio's range: 0.75 ~ 0.9375

[val]
LOSS - 0.5307
ACC - 0.7833
PPV - ALL: 0.8006  COVID-19: 0.8590  PNEUMONIA: 0.7885  NORMAL: 0.7544 
RECALL - ALL: 0.7953  COVID-19: 0.6700  PNEUMONIA: 0.8200  NORMAL: 0.8958 
F1 - ALL: 0.7919  COVID-19: 0.7528  PNEUMONIA: 0.8039  NORMAL: 0.8190 

Epoch 10/19
----------
[train]
LOSS - 0.0294
ACC - 0.9600
PPV - ALL: 1.0000  COVID-19: 1.0000  PNEUMONIA: 1.0000  NORMAL: 1.0000 
RECALL - ALL: 1.0000  COVID-19: 1.0000  PNEUMONIA: 1.0000  NORMAL: 1.0000 
F1 - ALL: 1.0000  COVID-19: 1.0000  PNEUMONIA: 1.0000  NORMAL: 1.0000 
Mask ratio's range: 0.75 ~ 0.9375

[val]
LOSS - 0.5328
ACC - 0.7800
PPV - ALL: 0.7976  COVID-19: 0.8608  PNEUMONIA: 0.7843  NORMAL: 0.7478 
RECALL - ALL: 0.7919  COVID-19: 0.6800  PNEUMONIA: 0.8000  NORMAL: 0.8958 
F1 - ALL: 0.7890  COVID-19: 0.7598  PNEUMONIA: 0.7921  NORMAL: 0.8151 

Epoch 11/19
----------
[train]
LOSS - 0.0330
ACC - 0.9600
PPV - ALL: 1.0000  COVID-19: 1.0000  PNEUMONIA: 1.0000  NORMAL: 1.0000 
RECALL - ALL: 1.0000  COVID-19: 1.0000  PNEUMONIA: 1.0000  NORMAL: 1.0000 
F1 - ALL: 1.0000  COVID-19: 1.0000  PNEUMONIA: 1.0000  NORMAL: 1.0000 
Mask ratio's range: 0.625 ~ 0.9375

[val]
LOSS - 0.5535
ACC - 0.7733
PPV - ALL: 0.7927  COVID-19: 0.8684  PNEUMONIA: 0.7642  NORMAL: 0.7456 
RECALL - ALL: 0.7851  COVID-19: 0.6600  PNEUMONIA: 0.8100  NORMAL: 0.8854 
F1 - ALL: 0.7820  COVID-19: 0.7500  PNEUMONIA: 0.7864  NORMAL: 0.8095 

Epoch 12/19
----------
[train]
LOSS - 0.0435
ACC - 0.9600
PPV - ALL: 1.0000  COVID-19: 1.0000  PNEUMONIA: 1.0000  NORMAL: 1.0000 
RECALL - ALL: 1.0000  COVID-19: 1.0000  PNEUMONIA: 1.0000  NORMAL: 1.0000 
F1 - ALL: 1.0000  COVID-19: 1.0000  PNEUMONIA: 1.0000  NORMAL: 1.0000 
Mask ratio's range: 0.5625 ~ 0.9375

[val]
LOSS - 0.5921
ACC - 0.7567
PPV - ALL: 0.7803  COVID-19: 0.8714  PNEUMONIA: 0.7431  NORMAL: 0.7265 
RECALL - ALL: 0.7685  COVID-19: 0.6100  PNEUMONIA: 0.8100  NORMAL: 0.8854 
F1 - ALL: 0.7636  COVID-19: 0.7176  PNEUMONIA: 0.7751  NORMAL: 0.7981 

Epoch 13/19
----------
[train]
LOSS - 0.0366
ACC - 0.9600
PPV - ALL: 1.0000  COVID-19: 1.0000  PNEUMONIA: 1.0000  NORMAL: 1.0000 
RECALL - ALL: 1.0000  COVID-19: 1.0000  PNEUMONIA: 1.0000  NORMAL: 1.0000 
F1 - ALL: 1.0000  COVID-19: 1.0000  PNEUMONIA: 1.0000  NORMAL: 1.0000 
Mask ratio's range: 0.5625 ~ 0.9375

[val]
LOSS - 0.6037
ACC - 0.7633
PPV - ALL: 0.7841  COVID-19: 0.8611  PNEUMONIA: 0.7411  NORMAL: 0.7500 
RECALL - ALL: 0.7750  COVID-19: 0.6200  PNEUMONIA: 0.8300  NORMAL: 0.8750 
F1 - ALL: 0.7705  COVID-19: 0.7209  PNEUMONIA: 0.7830  NORMAL: 0.8077 

Epoch 14/19
----------
[train]
LOSS - 0.0496
ACC - 0.9600
PPV - ALL: 1.0000  COVID-19: 1.0000  PNEUMONIA: 1.0000  NORMAL: 1.0000 
RECALL - ALL: 1.0000  COVID-19: 1.0000  PNEUMONIA: 1.0000  NORMAL: 1.0000 
F1 - ALL: 1.0000  COVID-19: 1.0000  PNEUMONIA: 1.0000  NORMAL: 1.0000 
Mask ratio's range: 0.5625 ~ 0.9375

[val]
LOSS - 0.6425
ACC - 0.7600
PPV - ALL: 0.7858  COVID-19: 0.8824  PNEUMONIA: 0.7523  NORMAL: 0.7227 
RECALL - ALL: 0.7719  COVID-19: 0.6000  PNEUMONIA: 0.8200  NORMAL: 0.8958 
F1 - ALL: 0.7663  COVID-19: 0.7143  PNEUMONIA: 0.7847  NORMAL: 0.8000 

Epoch 15/19
----------
[train]
LOSS - 0.0337
ACC - 0.9600
PPV - ALL: 1.0000  COVID-19: 1.0000  PNEUMONIA: 1.0000  NORMAL: 1.0000 
RECALL - ALL: 1.0000  COVID-19: 1.0000  PNEUMONIA: 1.0000  NORMAL: 1.0000 
F1 - ALL: 1.0000  COVID-19: 1.0000  PNEUMONIA: 1.0000  NORMAL: 1.0000 
Mask ratio's range: 0.5 ~ 0.9375

[val]
LOSS - 0.6377
ACC - 0.7633
PPV - ALL: 0.7893  COVID-19: 0.8824  PNEUMONIA: 0.7664  NORMAL: 0.7190 
RECALL - ALL: 0.7754  COVID-19: 0.6000  PNEUMONIA: 0.8200  NORMAL: 0.9062 
F1 - ALL: 0.7695  COVID-19: 0.7143  PNEUMONIA: 0.7923  NORMAL: 0.8018 

Epoch 16/19
----------
[train]
LOSS - 0.0387
ACC - 0.9600
PPV - ALL: 1.0000  COVID-19: 1.0000  PNEUMONIA: 1.0000  NORMAL: 1.0000 
RECALL - ALL: 1.0000  COVID-19: 1.0000  PNEUMONIA: 1.0000  NORMAL: 1.0000 
F1 - ALL: 1.0000  COVID-19: 1.0000  PNEUMONIA: 1.0000  NORMAL: 1.0000 
Mask ratio's range: 0.4375 ~ 0.875

[val]
LOSS - 0.6582
ACC - 0.7567
PPV - ALL: 0.7891  COVID-19: 0.9062  PNEUMONIA: 0.7570  NORMAL: 0.7040 
RECALL - ALL: 0.7689  COVID-19: 0.5800  PNEUMONIA: 0.8100  NORMAL: 0.9167 
F1 - ALL: 0.7621  COVID-19: 0.7073  PNEUMONIA: 0.7826  NORMAL: 0.7964 

Epoch 17/19
----------
[train]
LOSS - 0.0351
ACC - 0.9600
PPV - ALL: 1.0000  COVID-19: 1.0000  PNEUMONIA: 1.0000  NORMAL: 1.0000 
RECALL - ALL: 1.0000  COVID-19: 1.0000  PNEUMONIA: 1.0000  NORMAL: 1.0000 
F1 - ALL: 1.0000  COVID-19: 1.0000  PNEUMONIA: 1.0000  NORMAL: 1.0000 
Mask ratio's range: 0.4375 ~ 0.8125

[val]
LOSS - 0.6855
ACC - 0.7500
PPV - ALL: 0.7861  COVID-19: 0.9048  PNEUMONIA: 0.7767  NORMAL: 0.6769 
RECALL - ALL: 0.7622  COVID-19: 0.5700  PNEUMONIA: 0.8000  NORMAL: 0.9167 
F1 - ALL: 0.7555  COVID-19: 0.6994  PNEUMONIA: 0.7882  NORMAL: 0.7788 

Epoch 18/19
----------
[train]
LOSS - 0.0322
ACC - 0.9600
PPV - ALL: 1.0000  COVID-19: 1.0000  PNEUMONIA: 1.0000  NORMAL: 1.0000 
RECALL - ALL: 1.0000  COVID-19: 1.0000  PNEUMONIA: 1.0000  NORMAL: 1.0000 
F1 - ALL: 1.0000  COVID-19: 1.0000  PNEUMONIA: 1.0000  NORMAL: 1.0000 
Mask ratio's range: 0.4375 ~ 0.8125

[val]
LOSS - 0.7028
ACC - 0.7633
PPV - ALL: 0.7962  COVID-19: 0.9091  PNEUMONIA: 0.7843  NORMAL: 0.6953 
RECALL - ALL: 0.7757  COVID-19: 0.6000  PNEUMONIA: 0.8000  NORMAL: 0.9271 
F1 - ALL: 0.7699  COVID-19: 0.7229  PNEUMONIA: 0.7921  NORMAL: 0.7946 

Epoch 19/19
----------
[train]
LOSS - 0.0361
ACC - 0.9600
PPV - ALL: 1.0000  COVID-19: 1.0000  PNEUMONIA: 1.0000  NORMAL: 1.0000 
RECALL - ALL: 1.0000  COVID-19: 1.0000  PNEUMONIA: 1.0000  NORMAL: 1.0000 
F1 - ALL: 1.0000  COVID-19: 1.0000  PNEUMONIA: 1.0000  NORMAL: 1.0000 
Mask ratio's range: 0.4375 ~ 0.75

[val]
LOSS - 0.6743
ACC - 0.7667
PPV - ALL: 0.8043  COVID-19: 0.9365  PNEUMONIA: 0.7810  NORMAL: 0.6953 
RECALL - ALL: 0.7790  COVID-19: 0.5900  PNEUMONIA: 0.8200  NORMAL: 0.9271 
F1 - ALL: 0.7728  COVID-19: 0.7239  PNEUMONIA: 0.8000  NORMAL: 0.7946 


--------------------
[Best results]
ACC - 0.7900
PPV - ALL: 0.8077  COVID-19: 0.8765  PNEUMONIA: 0.7921  NORMAL: 0.7544 
RECALL - ALL: 0.8019  COVID-19: 0.7100  PNEUMONIA: 0.8000  NORMAL: 0.8958 
F1 - ALL: 0.7998  COVID-19: 0.7845  PNEUMONIA: 0.7960  NORMAL: 0.8190 

Training complete in 1m 32s
-------------------- 

[Mean results]
ACC - 0.8060 (0.02)
PPV - ALL: 0.8213 (0.02)  COVID-19: 0.8766 (0.01)  PNEUMONIA: 0.7793 (0.03)  NORMAL: 0.8080 (0.03) 
RECALL - ALL: 0.8171 (0.02)  COVID-19: 0.7780 (0.05)  PNEUMONIA: 0.8380 (0.03)  NORMAL: 0.8354 (0.03) 
F1 - ALL: 0.8169 (0.02)  COVID-19: 0.8232 (0.03)  PNEUMONIA: 0.8073 (0.02)  NORMAL: 0.8201 (0.00) 

