--------------------
Model 1
--------------------

Epoch 0/19
----------
[train]
LOSS - 1.0226
ACC - 0.4000
PPV - ALL: 0.4222  COVID-19: 0.4737  PNEUMONIA: 0.4000  NORMAL: 0.3929 
RECALL - ALL: 0.4167  COVID-19: 0.3750  PNEUMONIA: 0.4167  NORMAL: 0.4583 
F1 - ALL: 0.4166  COVID-19: 0.4186  PNEUMONIA: 0.4082  NORMAL: 0.4231 
Mask ratio's range: 1.0 ~ 1.0

[val]
LOSS - 1.0073
ACC - 0.4367
PPV - ALL: 0.6585  COVID-19: 1.0000  PNEUMONIA: 0.5882  NORMAL: 0.3872 
RECALL - ALL: 0.4493  COVID-19: 0.1000  PNEUMONIA: 0.3000  NORMAL: 0.9479 
F1 - ALL: 0.3763  COVID-19: 0.1818  PNEUMONIA: 0.3973  NORMAL: 0.5498 

Epoch 1/19
----------
[train]
LOSS - 0.6938
ACC - 0.8933
PPV - ALL: 0.9338  COVID-19: 1.0000  PNEUMONIA: 0.9167  NORMAL: 0.8846 
RECALL - ALL: 0.9306  COVID-19: 0.9167  PNEUMONIA: 0.9167  NORMAL: 0.9583 
F1 - ALL: 0.9311  COVID-19: 0.9565  PNEUMONIA: 0.9167  NORMAL: 0.9200 
Mask ratio's range: 1.0 ~ 1.0

[val]
LOSS - 0.8369
ACC - 0.7067
PPV - ALL: 0.7425  COVID-19: 0.8824  PNEUMONIA: 0.6279  NORMAL: 0.7172 
RECALL - ALL: 0.7165  COVID-19: 0.6000  PNEUMONIA: 0.8100  NORMAL: 0.7396 
F1 - ALL: 0.7166  COVID-19: 0.7143  PNEUMONIA: 0.7074  NORMAL: 0.7282 

Epoch 2/19
----------
[train]
LOSS - 0.3380
ACC - 0.9600
PPV - ALL: 1.0000  COVID-19: 1.0000  PNEUMONIA: 1.0000  NORMAL: 1.0000 
RECALL - ALL: 1.0000  COVID-19: 1.0000  PNEUMONIA: 1.0000  NORMAL: 1.0000 
F1 - ALL: 1.0000  COVID-19: 1.0000  PNEUMONIA: 1.0000  NORMAL: 1.0000 
Mask ratio's range: 1.0 ~ 1.0

[val]
LOSS - 0.6948
ACC - 0.7533
PPV - ALL: 0.7762  COVID-19: 0.8784  PNEUMONIA: 0.7222  NORMAL: 0.7281 
RECALL - ALL: 0.7649  COVID-19: 0.6500  PNEUMONIA: 0.7800  NORMAL: 0.8646 
F1 - ALL: 0.7625  COVID-19: 0.7471  PNEUMONIA: 0.7500  NORMAL: 0.7905 

Epoch 3/19
----------
[train]
LOSS - 0.1336
ACC - 0.9600
PPV - ALL: 1.0000  COVID-19: 1.0000  PNEUMONIA: 1.0000  NORMAL: 1.0000 
RECALL - ALL: 1.0000  COVID-19: 1.0000  PNEUMONIA: 1.0000  NORMAL: 1.0000 
F1 - ALL: 1.0000  COVID-19: 1.0000  PNEUMONIA: 1.0000  NORMAL: 1.0000 
Mask ratio's range: 1.0 ~ 1.0

[val]
LOSS - 0.6002
ACC - 0.7833
PPV - ALL: 0.7972  COVID-19: 0.8409  PNEUMONIA: 0.7568  NORMAL: 0.7938 
RECALL - ALL: 0.7940  COVID-19: 0.7400  PNEUMONIA: 0.8400  NORMAL: 0.8021 
F1 - ALL: 0.7938  COVID-19: 0.7872  PNEUMONIA: 0.7962  NORMAL: 0.7979 

Epoch 4/19
----------
[train]
LOSS - 0.0523
ACC - 0.9600
PPV - ALL: 1.0000  COVID-19: 1.0000  PNEUMONIA: 1.0000  NORMAL: 1.0000 
RECALL - ALL: 1.0000  COVID-19: 1.0000  PNEUMONIA: 1.0000  NORMAL: 1.0000 
F1 - ALL: 1.0000  COVID-19: 1.0000  PNEUMONIA: 1.0000  NORMAL: 1.0000 
Mask ratio's range: 1.0 ~ 1.0

[val]
LOSS - 0.5705
ACC - 0.7833
PPV - ALL: 0.7993  COVID-19: 0.8690  PNEUMONIA: 0.7523  NORMAL: 0.7767 
RECALL - ALL: 0.7944  COVID-19: 0.7300  PNEUMONIA: 0.8200  NORMAL: 0.8333 
F1 - ALL: 0.7941  COVID-19: 0.7935  PNEUMONIA: 0.7847  NORMAL: 0.8040 

Epoch 5/19
----------
[train]
LOSS - 0.0293
ACC - 0.9600
PPV - ALL: 1.0000  COVID-19: 1.0000  PNEUMONIA: 1.0000  NORMAL: 1.0000 
RECALL - ALL: 1.0000  COVID-19: 1.0000  PNEUMONIA: 1.0000  NORMAL: 1.0000 
F1 - ALL: 1.0000  COVID-19: 1.0000  PNEUMONIA: 1.0000  NORMAL: 1.0000 
Mask ratio's range: 0.9375 ~ 1.0

[val]
LOSS - 0.5572
ACC - 0.7867
PPV - ALL: 0.8011  COVID-19: 0.8621  PNEUMONIA: 0.7570  NORMAL: 0.7843 
RECALL - ALL: 0.7978  COVID-19: 0.7500  PNEUMONIA: 0.8100  NORMAL: 0.8333 
F1 - ALL: 0.7976  COVID-19: 0.8022  PNEUMONIA: 0.7826  NORMAL: 0.8081 

Epoch 6/19
----------
[train]
LOSS - 0.0243
ACC - 0.9600
PPV - ALL: 1.0000  COVID-19: 1.0000  PNEUMONIA: 1.0000  NORMAL: 1.0000 
RECALL - ALL: 1.0000  COVID-19: 1.0000  PNEUMONIA: 1.0000  NORMAL: 1.0000 
F1 - ALL: 1.0000  COVID-19: 1.0000  PNEUMONIA: 1.0000  NORMAL: 1.0000 
Mask ratio's range: 0.9375 ~ 1.0

[val]
LOSS - 0.5461
ACC - 0.7867
PPV - ALL: 0.8012  COVID-19: 0.8621  PNEUMONIA: 0.7593  NORMAL: 0.7822 
RECALL - ALL: 0.7976  COVID-19: 0.7500  PNEUMONIA: 0.8200  NORMAL: 0.8229 
F1 - ALL: 0.7976  COVID-19: 0.8022  PNEUMONIA: 0.7885  NORMAL: 0.8020 

Epoch 7/19
----------
[train]
LOSS - 0.0138
ACC - 0.9600
PPV - ALL: 1.0000  COVID-19: 1.0000  PNEUMONIA: 1.0000  NORMAL: 1.0000 
RECALL - ALL: 1.0000  COVID-19: 1.0000  PNEUMONIA: 1.0000  NORMAL: 1.0000 
F1 - ALL: 1.0000  COVID-19: 1.0000  PNEUMONIA: 1.0000  NORMAL: 1.0000 
Mask ratio's range: 0.9375 ~ 1.0

[val]
LOSS - 0.5325
ACC - 0.8033
PPV - ALL: 0.8163  COVID-19: 0.8681  PNEUMONIA: 0.7788  NORMAL: 0.8020 
RECALL - ALL: 0.8146  COVID-19: 0.7900  PNEUMONIA: 0.8100  NORMAL: 0.8438 
F1 - ALL: 0.8146  COVID-19: 0.8272  PNEUMONIA: 0.7941  NORMAL: 0.8224 

Epoch 8/19
----------
[train]
LOSS - 0.0128
ACC - 0.9600
PPV - ALL: 1.0000  COVID-19: 1.0000  PNEUMONIA: 1.0000  NORMAL: 1.0000 
RECALL - ALL: 1.0000  COVID-19: 1.0000  PNEUMONIA: 1.0000  NORMAL: 1.0000 
F1 - ALL: 1.0000  COVID-19: 1.0000  PNEUMONIA: 1.0000  NORMAL: 1.0000 
Mask ratio's range: 0.9375 ~ 1.0

[val]
LOSS - 0.5397
ACC - 0.7933
PPV - ALL: 0.8075  COVID-19: 0.8652  PNEUMONIA: 0.7593  NORMAL: 0.7980 
RECALL - ALL: 0.8043  COVID-19: 0.7700  PNEUMONIA: 0.8200  NORMAL: 0.8229 
F1 - ALL: 0.8045  COVID-19: 0.8148  PNEUMONIA: 0.7885  NORMAL: 0.8103 

Epoch 9/19
----------
[train]
LOSS - 0.0124
ACC - 0.9600
PPV - ALL: 1.0000  COVID-19: 1.0000  PNEUMONIA: 1.0000  NORMAL: 1.0000 
RECALL - ALL: 1.0000  COVID-19: 1.0000  PNEUMONIA: 1.0000  NORMAL: 1.0000 
F1 - ALL: 1.0000  COVID-19: 1.0000  PNEUMONIA: 1.0000  NORMAL: 1.0000 
Mask ratio's range: 0.9375 ~ 1.0

[val]
LOSS - 0.5393
ACC - 0.7933
PPV - ALL: 0.8075  COVID-19: 0.8652  PNEUMONIA: 0.7593  NORMAL: 0.7980 
RECALL - ALL: 0.8043  COVID-19: 0.7700  PNEUMONIA: 0.8200  NORMAL: 0.8229 
F1 - ALL: 0.8045  COVID-19: 0.8148  PNEUMONIA: 0.7885  NORMAL: 0.8103 

Epoch 10/19
----------
[train]
LOSS - 0.0184
ACC - 0.9600
PPV - ALL: 1.0000  COVID-19: 1.0000  PNEUMONIA: 1.0000  NORMAL: 1.0000 
RECALL - ALL: 1.0000  COVID-19: 1.0000  PNEUMONIA: 1.0000  NORMAL: 1.0000 
F1 - ALL: 1.0000  COVID-19: 1.0000  PNEUMONIA: 1.0000  NORMAL: 1.0000 
Mask ratio's range: 0.9375 ~ 1.0

[val]
LOSS - 0.5281
ACC - 0.7933
PPV - ALL: 0.8075  COVID-19: 0.8652  PNEUMONIA: 0.7593  NORMAL: 0.7980 
RECALL - ALL: 0.8043  COVID-19: 0.7700  PNEUMONIA: 0.8200  NORMAL: 0.8229 
F1 - ALL: 0.8045  COVID-19: 0.8148  PNEUMONIA: 0.7885  NORMAL: 0.8103 

Epoch 11/19
----------
[train]
LOSS - 0.0119
ACC - 0.9600
PPV - ALL: 1.0000  COVID-19: 1.0000  PNEUMONIA: 1.0000  NORMAL: 1.0000 
RECALL - ALL: 1.0000  COVID-19: 1.0000  PNEUMONIA: 1.0000  NORMAL: 1.0000 
F1 - ALL: 1.0000  COVID-19: 1.0000  PNEUMONIA: 1.0000  NORMAL: 1.0000 
Mask ratio's range: 0.9375 ~ 1.0

[val]
LOSS - 0.5325
ACC - 0.7900
PPV - ALL: 0.8046  COVID-19: 0.8636  PNEUMONIA: 0.7523  NORMAL: 0.7980 
RECALL - ALL: 0.8010  COVID-19: 0.7600  PNEUMONIA: 0.8200  NORMAL: 0.8229 
F1 - ALL: 0.8012  COVID-19: 0.8085  PNEUMONIA: 0.7847  NORMAL: 0.8103 

Epoch 12/19
----------
[train]
LOSS - 0.0106
ACC - 0.9600
PPV - ALL: 1.0000  COVID-19: 1.0000  PNEUMONIA: 1.0000  NORMAL: 1.0000 
RECALL - ALL: 1.0000  COVID-19: 1.0000  PNEUMONIA: 1.0000  NORMAL: 1.0000 
F1 - ALL: 1.0000  COVID-19: 1.0000  PNEUMONIA: 1.0000  NORMAL: 1.0000 
Mask ratio's range: 0.9375 ~ 1.0

[val]
LOSS - 0.5259
ACC - 0.7900
PPV - ALL: 0.8043  COVID-19: 0.8636  PNEUMONIA: 0.7593  NORMAL: 0.7900 
RECALL - ALL: 0.8010  COVID-19: 0.7600  PNEUMONIA: 0.8200  NORMAL: 0.8229 
F1 - ALL: 0.8010  COVID-19: 0.8085  PNEUMONIA: 0.7885  NORMAL: 0.8061 

Epoch 13/19
----------
[train]
LOSS - 0.0090
ACC - 0.9600
PPV - ALL: 1.0000  COVID-19: 1.0000  PNEUMONIA: 1.0000  NORMAL: 1.0000 
RECALL - ALL: 1.0000  COVID-19: 1.0000  PNEUMONIA: 1.0000  NORMAL: 1.0000 
F1 - ALL: 1.0000  COVID-19: 1.0000  PNEUMONIA: 1.0000  NORMAL: 1.0000 
Mask ratio's range: 0.9375 ~ 1.0

[val]
LOSS - 0.5308
ACC - 0.7900
PPV - ALL: 0.8046  COVID-19: 0.8636  PNEUMONIA: 0.7523  NORMAL: 0.7980 
RECALL - ALL: 0.8010  COVID-19: 0.7600  PNEUMONIA: 0.8200  NORMAL: 0.8229 
F1 - ALL: 0.8012  COVID-19: 0.8085  PNEUMONIA: 0.7847  NORMAL: 0.8103 

Epoch 14/19
----------
[train]
LOSS - 0.0079
ACC - 0.9600
PPV - ALL: 1.0000  COVID-19: 1.0000  PNEUMONIA: 1.0000  NORMAL: 1.0000 
RECALL - ALL: 1.0000  COVID-19: 1.0000  PNEUMONIA: 1.0000  NORMAL: 1.0000 
F1 - ALL: 1.0000  COVID-19: 1.0000  PNEUMONIA: 1.0000  NORMAL: 1.0000 
Mask ratio's range: 0.9375 ~ 1.0

[val]
LOSS - 0.5247
ACC - 0.7900
PPV - ALL: 0.8046  COVID-19: 0.8636  PNEUMONIA: 0.7523  NORMAL: 0.7980 
RECALL - ALL: 0.8010  COVID-19: 0.7600  PNEUMONIA: 0.8200  NORMAL: 0.8229 
F1 - ALL: 0.8012  COVID-19: 0.8085  PNEUMONIA: 0.7847  NORMAL: 0.8103 

Epoch 15/19
----------
[train]
LOSS - 0.0088
ACC - 0.9600
PPV - ALL: 1.0000  COVID-19: 1.0000  PNEUMONIA: 1.0000  NORMAL: 1.0000 
RECALL - ALL: 1.0000  COVID-19: 1.0000  PNEUMONIA: 1.0000  NORMAL: 1.0000 
F1 - ALL: 1.0000  COVID-19: 1.0000  PNEUMONIA: 1.0000  NORMAL: 1.0000 
Mask ratio's range: 0.9375 ~ 1.0

[val]
LOSS - 0.5248
ACC - 0.7900
PPV - ALL: 0.8051  COVID-19: 0.8636  PNEUMONIA: 0.7477  NORMAL: 0.8041 
RECALL - ALL: 0.8008  COVID-19: 0.7600  PNEUMONIA: 0.8300  NORMAL: 0.8125 
F1 - ALL: 0.8012  COVID-19: 0.8085  PNEUMONIA: 0.7867  NORMAL: 0.8083 

Epoch 16/19
----------
[train]
LOSS - 0.0097
ACC - 0.9600
PPV - ALL: 1.0000  COVID-19: 1.0000  PNEUMONIA: 1.0000  NORMAL: 1.0000 
RECALL - ALL: 1.0000  COVID-19: 1.0000  PNEUMONIA: 1.0000  NORMAL: 1.0000 
F1 - ALL: 1.0000  COVID-19: 1.0000  PNEUMONIA: 1.0000  NORMAL: 1.0000 
Mask ratio's range: 0.9375 ~ 1.0

[val]
LOSS - 0.5236
ACC - 0.7967
PPV - ALL: 0.8128  COVID-19: 0.8736  PNEUMONIA: 0.7522  NORMAL: 0.8125 
RECALL - ALL: 0.8075  COVID-19: 0.7600  PNEUMONIA: 0.8500  NORMAL: 0.8125 
F1 - ALL: 0.8078  COVID-19: 0.8129  PNEUMONIA: 0.7981  NORMAL: 0.8125 

Epoch 17/19
----------
[train]
LOSS - 0.0080
ACC - 0.9600
PPV - ALL: 1.0000  COVID-19: 1.0000  PNEUMONIA: 1.0000  NORMAL: 1.0000 
RECALL - ALL: 1.0000  COVID-19: 1.0000  PNEUMONIA: 1.0000  NORMAL: 1.0000 
F1 - ALL: 1.0000  COVID-19: 1.0000  PNEUMONIA: 1.0000  NORMAL: 1.0000 
Mask ratio's range: 0.9375 ~ 1.0

[val]
LOSS - 0.5260
ACC - 0.7933
PPV - ALL: 0.8101  COVID-19: 0.8721  PNEUMONIA: 0.7456  NORMAL: 0.8125 
RECALL - ALL: 0.8042  COVID-19: 0.7500  PNEUMONIA: 0.8500  NORMAL: 0.8125 
F1 - ALL: 0.8045  COVID-19: 0.8065  PNEUMONIA: 0.7944  NORMAL: 0.8125 

Epoch 18/19
----------
[train]
LOSS - 0.0100
ACC - 0.9600
PPV - ALL: 1.0000  COVID-19: 1.0000  PNEUMONIA: 1.0000  NORMAL: 1.0000 
RECALL - ALL: 1.0000  COVID-19: 1.0000  PNEUMONIA: 1.0000  NORMAL: 1.0000 
F1 - ALL: 1.0000  COVID-19: 1.0000  PNEUMONIA: 1.0000  NORMAL: 1.0000 
Mask ratio's range: 0.9375 ~ 1.0

[val]
LOSS - 0.5235
ACC - 0.7867
PPV - ALL: 0.8048  COVID-19: 0.8690  PNEUMONIA: 0.7328  NORMAL: 0.8125 
RECALL - ALL: 0.7975  COVID-19: 0.7300  PNEUMONIA: 0.8500  NORMAL: 0.8125 
F1 - ALL: 0.7977  COVID-19: 0.7935  PNEUMONIA: 0.7871  NORMAL: 0.8125 

Epoch 19/19
----------
[train]
LOSS - 0.0051
ACC - 0.9600
PPV - ALL: 1.0000  COVID-19: 1.0000  PNEUMONIA: 1.0000  NORMAL: 1.0000 
RECALL - ALL: 1.0000  COVID-19: 1.0000  PNEUMONIA: 1.0000  NORMAL: 1.0000 
F1 - ALL: 1.0000  COVID-19: 1.0000  PNEUMONIA: 1.0000  NORMAL: 1.0000 
Mask ratio's range: 0.9375 ~ 1.0

[val]
LOSS - 0.5273
ACC - 0.7967
PPV - ALL: 0.8128  COVID-19: 0.8736  PNEUMONIA: 0.7522  NORMAL: 0.8125 
RECALL - ALL: 0.8075  COVID-19: 0.7600  PNEUMONIA: 0.8500  NORMAL: 0.8125 
F1 - ALL: 0.8078  COVID-19: 0.8129  PNEUMONIA: 0.7981  NORMAL: 0.8125 


--------------------
[Best results]
ACC - 0.8033
PPV - ALL: 0.8163  COVID-19: 0.8681  PNEUMONIA: 0.7788  NORMAL: 0.8020 
RECALL - ALL: 0.8146  COVID-19: 0.7900  PNEUMONIA: 0.8100  NORMAL: 0.8438 
F1 - ALL: 0.8146  COVID-19: 0.8272  PNEUMONIA: 0.7941  NORMAL: 0.8224 

Training complete in 1m 30s
-------------------- 

--------------------
Model 2
--------------------

Epoch 0/19
----------
[train]
LOSS - 1.0195
ACC - 0.4133
PPV - ALL: 0.4462  COVID-19: 0.3214  PNEUMONIA: 0.5556  NORMAL: 0.4615 
RECALL - ALL: 0.4306  COVID-19: 0.3750  PNEUMONIA: 0.4167  NORMAL: 0.5000 
F1 - ALL: 0.4341  COVID-19: 0.3461  PNEUMONIA: 0.4762  NORMAL: 0.4800 
Mask ratio's range: 1.0 ~ 1.0

[val]
LOSS - 0.9858
ACC - 0.5500
PPV - ALL: 0.7028  COVID-19: 1.0000  PNEUMONIA: 0.5743  NORMAL: 0.5342 
RECALL - ALL: 0.5608  COVID-19: 0.0200  PNEUMONIA: 0.8500  NORMAL: 0.8125 
F1 - ALL: 0.4564  COVID-19: 0.0392  PNEUMONIA: 0.6855  NORMAL: 0.6446 

Epoch 1/19
----------
[train]
LOSS - 0.6956
ACC - 0.8533
PPV - ALL: 0.9013  COVID-19: 0.9474  PNEUMONIA: 0.9565  NORMAL: 0.8000 
RECALL - ALL: 0.8889  COVID-19: 0.7500  PNEUMONIA: 0.9167  NORMAL: 1.0000 
F1 - ALL: 0.8874  COVID-19: 0.8372  PNEUMONIA: 0.9362  NORMAL: 0.8889 
Mask ratio's range: 1.0 ~ 1.0

[val]
LOSS - 0.7608
ACC - 0.7767
PPV - ALL: 0.7914  COVID-19: 0.7615  PNEUMONIA: 0.8434  NORMAL: 0.7692 
RECALL - ALL: 0.7878  COVID-19: 0.8300  PNEUMONIA: 0.7000  NORMAL: 0.8333 
F1 - ALL: 0.7864  COVID-19: 0.7943  PNEUMONIA: 0.7650  NORMAL: 0.8000 

Epoch 2/19
----------
[train]
LOSS - 0.2863
ACC - 0.9600
PPV - ALL: 1.0000  COVID-19: 1.0000  PNEUMONIA: 1.0000  NORMAL: 1.0000 
RECALL - ALL: 1.0000  COVID-19: 1.0000  PNEUMONIA: 1.0000  NORMAL: 1.0000 
F1 - ALL: 1.0000  COVID-19: 1.0000  PNEUMONIA: 1.0000  NORMAL: 1.0000 
Mask ratio's range: 1.0 ~ 1.0

[val]
LOSS - 0.6003
ACC - 0.7700
PPV - ALL: 0.8044  COVID-19: 0.9394  PNEUMONIA: 0.7097  NORMAL: 0.7642 
RECALL - ALL: 0.7813  COVID-19: 0.6200  PNEUMONIA: 0.8800  NORMAL: 0.8438 
F1 - ALL: 0.7782  COVID-19: 0.7470  PNEUMONIA: 0.7857  NORMAL: 0.8020 

Epoch 3/19
----------
[train]
LOSS - 0.1051
ACC - 0.9600
PPV - ALL: 1.0000  COVID-19: 1.0000  PNEUMONIA: 1.0000  NORMAL: 1.0000 
RECALL - ALL: 1.0000  COVID-19: 1.0000  PNEUMONIA: 1.0000  NORMAL: 1.0000 
F1 - ALL: 1.0000  COVID-19: 1.0000  PNEUMONIA: 1.0000  NORMAL: 1.0000 
Mask ratio's range: 1.0 ~ 1.0

[val]
LOSS - 0.5159
ACC - 0.8067
PPV - ALL: 0.8174  COVID-19: 0.8350  PNEUMONIA: 0.8020  NORMAL: 0.8152 
RECALL - ALL: 0.8171  COVID-19: 0.8600  PNEUMONIA: 0.8100  NORMAL: 0.7812 
F1 - ALL: 0.8170  COVID-19: 0.8473  PNEUMONIA: 0.8060  NORMAL: 0.7978 

Epoch 4/19
----------
[train]
LOSS - 0.0418
ACC - 0.9600
PPV - ALL: 1.0000  COVID-19: 1.0000  PNEUMONIA: 1.0000  NORMAL: 1.0000 
RECALL - ALL: 1.0000  COVID-19: 1.0000  PNEUMONIA: 1.0000  NORMAL: 1.0000 
F1 - ALL: 1.0000  COVID-19: 1.0000  PNEUMONIA: 1.0000  NORMAL: 1.0000 
Mask ratio's range: 1.0 ~ 1.0

[val]
LOSS - 0.4980
ACC - 0.8267
PPV - ALL: 0.8402  COVID-19: 0.8925  PNEUMONIA: 0.8000  NORMAL: 0.8280 
RECALL - ALL: 0.8374  COVID-19: 0.8300  PNEUMONIA: 0.8800  NORMAL: 0.8021 
F1 - ALL: 0.8377  COVID-19: 0.8601  PNEUMONIA: 0.8381  NORMAL: 0.8148 

Epoch 5/19
----------
[train]
LOSS - 0.0226
ACC - 0.9600
PPV - ALL: 1.0000  COVID-19: 1.0000  PNEUMONIA: 1.0000  NORMAL: 1.0000 
RECALL - ALL: 1.0000  COVID-19: 1.0000  PNEUMONIA: 1.0000  NORMAL: 1.0000 
F1 - ALL: 1.0000  COVID-19: 1.0000  PNEUMONIA: 1.0000  NORMAL: 1.0000 
Mask ratio's range: 0.9375 ~ 1.0

[val]
LOSS - 0.4816
ACC - 0.8167
PPV - ALL: 0.8323  COVID-19: 0.8989  PNEUMONIA: 0.7788  NORMAL: 0.8191 
RECALL - ALL: 0.8274  COVID-19: 0.8000  PNEUMONIA: 0.8800  NORMAL: 0.8021 
F1 - ALL: 0.8278  COVID-19: 0.8466  PNEUMONIA: 0.8263  NORMAL: 0.8105 

Epoch 6/19
----------
[train]
LOSS - 0.0163
ACC - 0.9600
PPV - ALL: 1.0000  COVID-19: 1.0000  PNEUMONIA: 1.0000  NORMAL: 1.0000 
RECALL - ALL: 1.0000  COVID-19: 1.0000  PNEUMONIA: 1.0000  NORMAL: 1.0000 
F1 - ALL: 1.0000  COVID-19: 1.0000  PNEUMONIA: 1.0000  NORMAL: 1.0000 
Mask ratio's range: 0.9375 ~ 1.0

[val]
LOSS - 0.4676
ACC - 0.8200
PPV - ALL: 0.8347  COVID-19: 0.9011  PNEUMONIA: 0.7838  NORMAL: 0.8191 
RECALL - ALL: 0.8307  COVID-19: 0.8200  PNEUMONIA: 0.8700  NORMAL: 0.8021 
F1 - ALL: 0.8313  COVID-19: 0.8586  PNEUMONIA: 0.8247  NORMAL: 0.8105 

Epoch 7/19
----------
[train]
LOSS - 0.0129
ACC - 0.9600
PPV - ALL: 1.0000  COVID-19: 1.0000  PNEUMONIA: 1.0000  NORMAL: 1.0000 
RECALL - ALL: 1.0000  COVID-19: 1.0000  PNEUMONIA: 1.0000  NORMAL: 1.0000 
F1 - ALL: 1.0000  COVID-19: 1.0000  PNEUMONIA: 1.0000  NORMAL: 1.0000 
Mask ratio's range: 0.9375 ~ 1.0

[val]
LOSS - 0.4654
ACC - 0.8233
PPV - ALL: 0.8401  COVID-19: 0.9205  PNEUMONIA: 0.7788  NORMAL: 0.8211 
RECALL - ALL: 0.8342  COVID-19: 0.8100  PNEUMONIA: 0.8800  NORMAL: 0.8125 
F1 - ALL: 0.8349  COVID-19: 0.8617  PNEUMONIA: 0.8263  NORMAL: 0.8168 

Epoch 8/19
----------
[train]
LOSS - 0.0118
ACC - 0.9600
PPV - ALL: 1.0000  COVID-19: 1.0000  PNEUMONIA: 1.0000  NORMAL: 1.0000 
RECALL - ALL: 1.0000  COVID-19: 1.0000  PNEUMONIA: 1.0000  NORMAL: 1.0000 
F1 - ALL: 1.0000  COVID-19: 1.0000  PNEUMONIA: 1.0000  NORMAL: 1.0000 
Mask ratio's range: 0.875 ~ 1.0

[val]
LOSS - 0.4665
ACC - 0.8233
PPV - ALL: 0.8396  COVID-19: 0.9205  PNEUMONIA: 0.7857  NORMAL: 0.8125 
RECALL - ALL: 0.8342  COVID-19: 0.8100  PNEUMONIA: 0.8800  NORMAL: 0.8125 
F1 - ALL: 0.8348  COVID-19: 0.8617  PNEUMONIA: 0.8302  NORMAL: 0.8125 

Epoch 9/19
----------
[train]
LOSS - 0.0135
ACC - 0.9600
PPV - ALL: 1.0000  COVID-19: 1.0000  PNEUMONIA: 1.0000  NORMAL: 1.0000 
RECALL - ALL: 1.0000  COVID-19: 1.0000  PNEUMONIA: 1.0000  NORMAL: 1.0000 
F1 - ALL: 1.0000  COVID-19: 1.0000  PNEUMONIA: 1.0000  NORMAL: 1.0000 
Mask ratio's range: 0.875 ~ 1.0

[val]
LOSS - 0.4775
ACC - 0.8167
PPV - ALL: 0.8353  COVID-19: 0.9176  PNEUMONIA: 0.7672  NORMAL: 0.8211 
RECALL - ALL: 0.8275  COVID-19: 0.7800  PNEUMONIA: 0.8900  NORMAL: 0.8125 
F1 - ALL: 0.8280  COVID-19: 0.8432  PNEUMONIA: 0.8241  NORMAL: 0.8168 

Epoch 10/19
----------
[train]
LOSS - 0.0116
ACC - 0.9600
PPV - ALL: 1.0000  COVID-19: 1.0000  PNEUMONIA: 1.0000  NORMAL: 1.0000 
RECALL - ALL: 1.0000  COVID-19: 1.0000  PNEUMONIA: 1.0000  NORMAL: 1.0000 
F1 - ALL: 1.0000  COVID-19: 1.0000  PNEUMONIA: 1.0000  NORMAL: 1.0000 
Mask ratio's range: 0.875 ~ 1.0

[val]
LOSS - 0.4657
ACC - 0.8200
PPV - ALL: 0.8397  COVID-19: 0.9176  PNEUMONIA: 0.7627  NORMAL: 0.8387 
RECALL - ALL: 0.8308  COVID-19: 0.7800  PNEUMONIA: 0.9000  NORMAL: 0.8125 
F1 - ALL: 0.8314  COVID-19: 0.8432  PNEUMONIA: 0.8257  NORMAL: 0.8254 

Epoch 11/19
----------
[train]
LOSS - 0.0088
ACC - 0.9600
PPV - ALL: 1.0000  COVID-19: 1.0000  PNEUMONIA: 1.0000  NORMAL: 1.0000 
RECALL - ALL: 1.0000  COVID-19: 1.0000  PNEUMONIA: 1.0000  NORMAL: 1.0000 
F1 - ALL: 1.0000  COVID-19: 1.0000  PNEUMONIA: 1.0000  NORMAL: 1.0000 
Mask ratio's range: 0.875 ~ 1.0

[val]
LOSS - 0.4647
ACC - 0.8167
PPV - ALL: 0.8364  COVID-19: 0.9167  PNEUMONIA: 0.7627  NORMAL: 0.8298 
RECALL - ALL: 0.8275  COVID-19: 0.7700  PNEUMONIA: 0.9000  NORMAL: 0.8125 
F1 - ALL: 0.8279  COVID-19: 0.8370  PNEUMONIA: 0.8257  NORMAL: 0.8211 

Epoch 12/19
----------
[train]
LOSS - 0.0116
ACC - 0.9600
PPV - ALL: 1.0000  COVID-19: 1.0000  PNEUMONIA: 1.0000  NORMAL: 1.0000 
RECALL - ALL: 1.0000  COVID-19: 1.0000  PNEUMONIA: 1.0000  NORMAL: 1.0000 
F1 - ALL: 1.0000  COVID-19: 1.0000  PNEUMONIA: 1.0000  NORMAL: 1.0000 
Mask ratio's range: 0.8125 ~ 1.0

[val]
LOSS - 0.4678
ACC - 0.8167
PPV - ALL: 0.8364  COVID-19: 0.9167  PNEUMONIA: 0.7627  NORMAL: 0.8298 
RECALL - ALL: 0.8275  COVID-19: 0.7700  PNEUMONIA: 0.9000  NORMAL: 0.8125 
F1 - ALL: 0.8279  COVID-19: 0.8370  PNEUMONIA: 0.8257  NORMAL: 0.8211 

Epoch 13/19
----------
[train]
LOSS - 0.0172
ACC - 0.9600
PPV - ALL: 1.0000  COVID-19: 1.0000  PNEUMONIA: 1.0000  NORMAL: 1.0000 
RECALL - ALL: 1.0000  COVID-19: 1.0000  PNEUMONIA: 1.0000  NORMAL: 1.0000 
F1 - ALL: 1.0000  COVID-19: 1.0000  PNEUMONIA: 1.0000  NORMAL: 1.0000 
Mask ratio's range: 0.8125 ~ 1.0

[val]
LOSS - 0.4661
ACC - 0.8267
PPV - ALL: 0.8431  COVID-19: 0.9205  PNEUMONIA: 0.7876  NORMAL: 0.8211 
RECALL - ALL: 0.8375  COVID-19: 0.8100  PNEUMONIA: 0.8900  NORMAL: 0.8125 
F1 - ALL: 0.8381  COVID-19: 0.8617  PNEUMONIA: 0.8357  NORMAL: 0.8168 

Epoch 14/19
----------
[train]
LOSS - 0.0167
ACC - 0.9600
PPV - ALL: 1.0000  COVID-19: 1.0000  PNEUMONIA: 1.0000  NORMAL: 1.0000 
RECALL - ALL: 1.0000  COVID-19: 1.0000  PNEUMONIA: 1.0000  NORMAL: 1.0000 
F1 - ALL: 1.0000  COVID-19: 1.0000  PNEUMONIA: 1.0000  NORMAL: 1.0000 
Mask ratio's range: 0.8125 ~ 1.0

[val]
LOSS - 0.4647
ACC - 0.8200
PPV - ALL: 0.8368  COVID-19: 0.9186  PNEUMONIA: 0.7876  NORMAL: 0.8041 
RECALL - ALL: 0.8308  COVID-19: 0.7900  PNEUMONIA: 0.8900  NORMAL: 0.8125 
F1 - ALL: 0.8312  COVID-19: 0.8495  PNEUMONIA: 0.8357  NORMAL: 0.8083 

Epoch 15/19
----------
[train]
LOSS - 0.0127
ACC - 0.9600
PPV - ALL: 1.0000  COVID-19: 1.0000  PNEUMONIA: 1.0000  NORMAL: 1.0000 
RECALL - ALL: 1.0000  COVID-19: 1.0000  PNEUMONIA: 1.0000  NORMAL: 1.0000 
F1 - ALL: 1.0000  COVID-19: 1.0000  PNEUMONIA: 1.0000  NORMAL: 1.0000 
Mask ratio's range: 0.8125 ~ 1.0

[val]
LOSS - 0.4582
ACC - 0.8233
PPV - ALL: 0.8396  COVID-19: 0.9205  PNEUMONIA: 0.7857  NORMAL: 0.8125 
RECALL - ALL: 0.8342  COVID-19: 0.8100  PNEUMONIA: 0.8800  NORMAL: 0.8125 
F1 - ALL: 0.8348  COVID-19: 0.8617  PNEUMONIA: 0.8302  NORMAL: 0.8125 

Epoch 16/19
----------
[train]
LOSS - 0.0109
ACC - 0.9600
PPV - ALL: 1.0000  COVID-19: 1.0000  PNEUMONIA: 1.0000  NORMAL: 1.0000 
RECALL - ALL: 1.0000  COVID-19: 1.0000  PNEUMONIA: 1.0000  NORMAL: 1.0000 
F1 - ALL: 1.0000  COVID-19: 1.0000  PNEUMONIA: 1.0000  NORMAL: 1.0000 
Mask ratio's range: 0.8125 ~ 1.0

[val]
LOSS - 0.4592
ACC - 0.8133
PPV - ALL: 0.8304  COVID-19: 0.9176  PNEUMONIA: 0.7857  NORMAL: 0.7879 
RECALL - ALL: 0.8242  COVID-19: 0.7800  PNEUMONIA: 0.8800  NORMAL: 0.8125 
F1 - ALL: 0.8245  COVID-19: 0.8432  PNEUMONIA: 0.8302  NORMAL: 0.8000 

Epoch 17/19
----------
[train]
LOSS - 0.0173
ACC - 0.9600
PPV - ALL: 1.0000  COVID-19: 1.0000  PNEUMONIA: 1.0000  NORMAL: 1.0000 
RECALL - ALL: 1.0000  COVID-19: 1.0000  PNEUMONIA: 1.0000  NORMAL: 1.0000 
F1 - ALL: 1.0000  COVID-19: 1.0000  PNEUMONIA: 1.0000  NORMAL: 1.0000 
Mask ratio's range: 0.8125 ~ 1.0

[val]
LOSS - 0.4611
ACC - 0.8067
PPV - ALL: 0.8246  COVID-19: 0.9167  PNEUMONIA: 0.7748  NORMAL: 0.7822 
RECALL - ALL: 0.8176  COVID-19: 0.7700  PNEUMONIA: 0.8600  NORMAL: 0.8229 
F1 - ALL: 0.8181  COVID-19: 0.8370  PNEUMONIA: 0.8152  NORMAL: 0.8020 

Epoch 18/19
----------
[train]
LOSS - 0.0150
ACC - 0.9600
PPV - ALL: 1.0000  COVID-19: 1.0000  PNEUMONIA: 1.0000  NORMAL: 1.0000 
RECALL - ALL: 1.0000  COVID-19: 1.0000  PNEUMONIA: 1.0000  NORMAL: 1.0000 
F1 - ALL: 1.0000  COVID-19: 1.0000  PNEUMONIA: 1.0000  NORMAL: 1.0000 
Mask ratio's range: 0.8125 ~ 1.0

[val]
LOSS - 0.4592
ACC - 0.8133
PPV - ALL: 0.8332  COVID-19: 0.9390  PNEUMONIA: 0.7818  NORMAL: 0.7788 
RECALL - ALL: 0.8246  COVID-19: 0.7700  PNEUMONIA: 0.8600  NORMAL: 0.8438 
F1 - ALL: 0.8250  COVID-19: 0.8461  PNEUMONIA: 0.8190  NORMAL: 0.8100 

Epoch 19/19
----------
[train]
LOSS - 0.0115
ACC - 0.9600
PPV - ALL: 1.0000  COVID-19: 1.0000  PNEUMONIA: 1.0000  NORMAL: 1.0000 
RECALL - ALL: 1.0000  COVID-19: 1.0000  PNEUMONIA: 1.0000  NORMAL: 1.0000 
F1 - ALL: 1.0000  COVID-19: 1.0000  PNEUMONIA: 1.0000  NORMAL: 1.0000 
Mask ratio's range: 0.75 ~ 1.0

[val]
LOSS - 0.4631
ACC - 0.8100
PPV - ALL: 0.8288  COVID-19: 0.9277  PNEUMONIA: 0.7798  NORMAL: 0.7788 
RECALL - ALL: 0.8213  COVID-19: 0.7700  PNEUMONIA: 0.8500  NORMAL: 0.8438 
F1 - ALL: 0.8216  COVID-19: 0.8415  PNEUMONIA: 0.8134  NORMAL: 0.8100 


--------------------
[Best results]
ACC - 0.8267
PPV - ALL: 0.8402  COVID-19: 0.8925  PNEUMONIA: 0.8000  NORMAL: 0.8280 
RECALL - ALL: 0.8374  COVID-19: 0.8300  PNEUMONIA: 0.8800  NORMAL: 0.8021 
F1 - ALL: 0.8377  COVID-19: 0.8601  PNEUMONIA: 0.8381  NORMAL: 0.8148 

Training complete in 1m 30s
-------------------- 

--------------------
Model 3
--------------------

Epoch 0/19
----------
[train]
LOSS - 0.9902
ACC - 0.5333
PPV - ALL: 0.5548  COVID-19: 0.5714  PNEUMONIA: 0.5217  NORMAL: 0.5714 
RECALL - ALL: 0.5556  COVID-19: 0.5000  PNEUMONIA: 0.5000  NORMAL: 0.6667 
F1 - ALL: 0.5531  COVID-19: 0.5333  PNEUMONIA: 0.5106  NORMAL: 0.6154 
Mask ratio's range: 1.0 ~ 1.0

[val]
LOSS - 0.9684
ACC - 0.5367
PPV - ALL: 0.6399  COVID-19: 0.8684  PNEUMONIA: 0.5882  NORMAL: 0.4632 
RECALL - ALL: 0.5489  COVID-19: 0.3300  PNEUMONIA: 0.4000  NORMAL: 0.9167 
F1 - ALL: 0.5233  COVID-19: 0.4783  PNEUMONIA: 0.4762  NORMAL: 0.6154 

Epoch 1/19
----------
[train]
LOSS - 0.6022
ACC - 0.8933
PPV - ALL: 0.9363  COVID-19: 1.0000  PNEUMONIA: 0.9200  NORMAL: 0.8889 
RECALL - ALL: 0.9305  COVID-19: 0.8333  PNEUMONIA: 0.9583  NORMAL: 1.0000 
F1 - ALL: 0.9297  COVID-19: 0.9091  PNEUMONIA: 0.9388  NORMAL: 0.9412 
Mask ratio's range: 1.0 ~ 1.0

[val]
LOSS - 0.7117
ACC - 0.7867
PPV - ALL: 0.8022  COVID-19: 0.8690  PNEUMONIA: 0.7757  NORMAL: 0.7619 
RECALL - ALL: 0.7978  COVID-19: 0.7300  PNEUMONIA: 0.8300  NORMAL: 0.8333 
F1 - ALL: 0.7971  COVID-19: 0.7935  PNEUMONIA: 0.8019  NORMAL: 0.7960 

Epoch 2/19
----------
[train]
LOSS - 0.2429
ACC - 0.9600
PPV - ALL: 1.0000  COVID-19: 1.0000  PNEUMONIA: 1.0000  NORMAL: 1.0000 
RECALL - ALL: 1.0000  COVID-19: 1.0000  PNEUMONIA: 1.0000  NORMAL: 1.0000 
F1 - ALL: 1.0000  COVID-19: 1.0000  PNEUMONIA: 1.0000  NORMAL: 1.0000 
Mask ratio's range: 1.0 ~ 1.0

[val]
LOSS - 0.5699
ACC - 0.8233
PPV - ALL: 0.8362  COVID-19: 0.8660  PNEUMONIA: 0.7982  NORMAL: 0.8444 
RECALL - ALL: 0.8339  COVID-19: 0.8400  PNEUMONIA: 0.8700  NORMAL: 0.7917 
F1 - ALL: 0.8342  COVID-19: 0.8528  PNEUMONIA: 0.8326  NORMAL: 0.8172 

Epoch 3/19
----------
[train]
LOSS - 0.0866
ACC - 0.9600
PPV - ALL: 1.0000  COVID-19: 1.0000  PNEUMONIA: 1.0000  NORMAL: 1.0000 
RECALL - ALL: 1.0000  COVID-19: 1.0000  PNEUMONIA: 1.0000  NORMAL: 1.0000 
F1 - ALL: 1.0000  COVID-19: 1.0000  PNEUMONIA: 1.0000  NORMAL: 1.0000 
Mask ratio's range: 1.0 ~ 1.0

[val]
LOSS - 0.4983
ACC - 0.8167
PPV - ALL: 0.8292  COVID-19: 0.8485  PNEUMONIA: 0.7963  NORMAL: 0.8427 
RECALL - ALL: 0.8271  COVID-19: 0.8400  PNEUMONIA: 0.8600  NORMAL: 0.7812 
F1 - ALL: 0.8273  COVID-19: 0.8442  PNEUMONIA: 0.8269  NORMAL: 0.8108 

Epoch 4/19
----------
[train]
LOSS - 0.0367
ACC - 0.9600
PPV - ALL: 1.0000  COVID-19: 1.0000  PNEUMONIA: 1.0000  NORMAL: 1.0000 
RECALL - ALL: 1.0000  COVID-19: 1.0000  PNEUMONIA: 1.0000  NORMAL: 1.0000 
F1 - ALL: 1.0000  COVID-19: 1.0000  PNEUMONIA: 1.0000  NORMAL: 1.0000 
Mask ratio's range: 1.0 ~ 1.0

[val]
LOSS - 0.4677
ACC - 0.8200
PPV - ALL: 0.8329  COVID-19: 0.8500  PNEUMONIA: 0.7963  NORMAL: 0.8523 
RECALL - ALL: 0.8304  COVID-19: 0.8500  PNEUMONIA: 0.8600  NORMAL: 0.7812 
F1 - ALL: 0.8307  COVID-19: 0.8500  PNEUMONIA: 0.8269  NORMAL: 0.8152 

Epoch 5/19
----------
[train]
LOSS - 0.0205
ACC - 0.9600
PPV - ALL: 1.0000  COVID-19: 1.0000  PNEUMONIA: 1.0000  NORMAL: 1.0000 
RECALL - ALL: 1.0000  COVID-19: 1.0000  PNEUMONIA: 1.0000  NORMAL: 1.0000 
F1 - ALL: 1.0000  COVID-19: 1.0000  PNEUMONIA: 1.0000  NORMAL: 1.0000 
Mask ratio's range: 1.0 ~ 1.0

[val]
LOSS - 0.4556
ACC - 0.8200
PPV - ALL: 0.8324  COVID-19: 0.8431  PNEUMONIA: 0.8019  NORMAL: 0.8523 
RECALL - ALL: 0.8304  COVID-19: 0.8600  PNEUMONIA: 0.8500  NORMAL: 0.7812 
F1 - ALL: 0.8306  COVID-19: 0.8515  PNEUMONIA: 0.8252  NORMAL: 0.8152 

Epoch 6/19
----------
[train]
LOSS - 0.0142
ACC - 0.9600
PPV - ALL: 1.0000  COVID-19: 1.0000  PNEUMONIA: 1.0000  NORMAL: 1.0000 
RECALL - ALL: 1.0000  COVID-19: 1.0000  PNEUMONIA: 1.0000  NORMAL: 1.0000 
F1 - ALL: 1.0000  COVID-19: 1.0000  PNEUMONIA: 1.0000  NORMAL: 1.0000 
Mask ratio's range: 1.0 ~ 1.0

[val]
LOSS - 0.4490
ACC - 0.8200
PPV - ALL: 0.8324  COVID-19: 0.8431  PNEUMONIA: 0.8019  NORMAL: 0.8523 
RECALL - ALL: 0.8304  COVID-19: 0.8600  PNEUMONIA: 0.8500  NORMAL: 0.7812 
F1 - ALL: 0.8306  COVID-19: 0.8515  PNEUMONIA: 0.8252  NORMAL: 0.8152 

Epoch 7/19
----------
[train]
LOSS - 0.0114
ACC - 0.9600
PPV - ALL: 1.0000  COVID-19: 1.0000  PNEUMONIA: 1.0000  NORMAL: 1.0000 
RECALL - ALL: 1.0000  COVID-19: 1.0000  PNEUMONIA: 1.0000  NORMAL: 1.0000 
F1 - ALL: 1.0000  COVID-19: 1.0000  PNEUMONIA: 1.0000  NORMAL: 1.0000 
Mask ratio's range: 0.9375 ~ 1.0

[val]
LOSS - 0.4410
ACC - 0.8200
PPV - ALL: 0.8324  COVID-19: 0.8431  PNEUMONIA: 0.8019  NORMAL: 0.8523 
RECALL - ALL: 0.8304  COVID-19: 0.8600  PNEUMONIA: 0.8500  NORMAL: 0.7812 
F1 - ALL: 0.8306  COVID-19: 0.8515  PNEUMONIA: 0.8252  NORMAL: 0.8152 

Epoch 8/19
----------
[train]
LOSS - 0.0111
ACC - 0.9600
PPV - ALL: 1.0000  COVID-19: 1.0000  PNEUMONIA: 1.0000  NORMAL: 1.0000 
RECALL - ALL: 1.0000  COVID-19: 1.0000  PNEUMONIA: 1.0000  NORMAL: 1.0000 
F1 - ALL: 1.0000  COVID-19: 1.0000  PNEUMONIA: 1.0000  NORMAL: 1.0000 
Mask ratio's range: 0.9375 ~ 1.0

[val]
LOSS - 0.4363
ACC - 0.8200
PPV - ALL: 0.8324  COVID-19: 0.8431  PNEUMONIA: 0.8019  NORMAL: 0.8523 
RECALL - ALL: 0.8304  COVID-19: 0.8600  PNEUMONIA: 0.8500  NORMAL: 0.7812 
F1 - ALL: 0.8306  COVID-19: 0.8515  PNEUMONIA: 0.8252  NORMAL: 0.8152 

Epoch 9/19
----------
[train]
LOSS - 0.0102
ACC - 0.9600
PPV - ALL: 1.0000  COVID-19: 1.0000  PNEUMONIA: 1.0000  NORMAL: 1.0000 
RECALL - ALL: 1.0000  COVID-19: 1.0000  PNEUMONIA: 1.0000  NORMAL: 1.0000 
F1 - ALL: 1.0000  COVID-19: 1.0000  PNEUMONIA: 1.0000  NORMAL: 1.0000 
Mask ratio's range: 0.9375 ~ 1.0

[val]
LOSS - 0.4329
ACC - 0.8200
PPV - ALL: 0.8324  COVID-19: 0.8431  PNEUMONIA: 0.8019  NORMAL: 0.8523 
RECALL - ALL: 0.8304  COVID-19: 0.8600  PNEUMONIA: 0.8500  NORMAL: 0.7812 
F1 - ALL: 0.8306  COVID-19: 0.8515  PNEUMONIA: 0.8252  NORMAL: 0.8152 

Epoch 10/19
----------
[train]
LOSS - 0.0108
ACC - 0.9600
PPV - ALL: 1.0000  COVID-19: 1.0000  PNEUMONIA: 1.0000  NORMAL: 1.0000 
RECALL - ALL: 1.0000  COVID-19: 1.0000  PNEUMONIA: 1.0000  NORMAL: 1.0000 
F1 - ALL: 1.0000  COVID-19: 1.0000  PNEUMONIA: 1.0000  NORMAL: 1.0000 
Mask ratio's range: 0.8125 ~ 1.0

[val]
LOSS - 0.4329
ACC - 0.8233
PPV - ALL: 0.8355  COVID-19: 0.8431  PNEUMONIA: 0.8095  NORMAL: 0.8539 
RECALL - ALL: 0.8339  COVID-19: 0.8600  PNEUMONIA: 0.8500  NORMAL: 0.7917 
F1 - ALL: 0.8341  COVID-19: 0.8515  PNEUMONIA: 0.8293  NORMAL: 0.8216 

Epoch 11/19
----------
[train]
LOSS - 0.0323
ACC - 0.9600
PPV - ALL: 1.0000  COVID-19: 1.0000  PNEUMONIA: 1.0000  NORMAL: 1.0000 
RECALL - ALL: 1.0000  COVID-19: 1.0000  PNEUMONIA: 1.0000  NORMAL: 1.0000 
F1 - ALL: 1.0000  COVID-19: 1.0000  PNEUMONIA: 1.0000  NORMAL: 1.0000 
Mask ratio's range: 0.8125 ~ 1.0

[val]
LOSS - 0.4244
ACC - 0.8233
PPV - ALL: 0.8359  COVID-19: 0.8500  PNEUMONIA: 0.8037  NORMAL: 0.8539 
RECALL - ALL: 0.8339  COVID-19: 0.8500  PNEUMONIA: 0.8600  NORMAL: 0.7917 
F1 - ALL: 0.8342  COVID-19: 0.8500  PNEUMONIA: 0.8309  NORMAL: 0.8216 

Epoch 12/19
----------
[train]
LOSS - 0.0168
ACC - 0.9600
PPV - ALL: 1.0000  COVID-19: 1.0000  PNEUMONIA: 1.0000  NORMAL: 1.0000 
RECALL - ALL: 1.0000  COVID-19: 1.0000  PNEUMONIA: 1.0000  NORMAL: 1.0000 
F1 - ALL: 1.0000  COVID-19: 1.0000  PNEUMONIA: 1.0000  NORMAL: 1.0000 
Mask ratio's range: 0.75 ~ 1.0

[val]
LOSS - 0.4200
ACC - 0.8267
PPV - ALL: 0.8393  COVID-19: 0.8586  PNEUMONIA: 0.8037  NORMAL: 0.8556 
RECALL - ALL: 0.8374  COVID-19: 0.8500  PNEUMONIA: 0.8600  NORMAL: 0.8021 
F1 - ALL: 0.8377  COVID-19: 0.8543  PNEUMONIA: 0.8309  NORMAL: 0.8280 

Epoch 13/19
----------
[train]
LOSS - 0.0152
ACC - 0.9600
PPV - ALL: 1.0000  COVID-19: 1.0000  PNEUMONIA: 1.0000  NORMAL: 1.0000 
RECALL - ALL: 1.0000  COVID-19: 1.0000  PNEUMONIA: 1.0000  NORMAL: 1.0000 
F1 - ALL: 1.0000  COVID-19: 1.0000  PNEUMONIA: 1.0000  NORMAL: 1.0000 
Mask ratio's range: 0.75 ~ 1.0

[val]
LOSS - 0.4208
ACC - 0.8333
PPV - ALL: 0.8464  COVID-19: 0.8763  PNEUMONIA: 0.8073  NORMAL: 0.8556 
RECALL - ALL: 0.8440  COVID-19: 0.8500  PNEUMONIA: 0.8800  NORMAL: 0.8021 
F1 - ALL: 0.8443  COVID-19: 0.8629  PNEUMONIA: 0.8421  NORMAL: 0.8280 

Epoch 14/19
----------
[train]
LOSS - 0.0174
ACC - 0.9600
PPV - ALL: 1.0000  COVID-19: 1.0000  PNEUMONIA: 1.0000  NORMAL: 1.0000 
RECALL - ALL: 1.0000  COVID-19: 1.0000  PNEUMONIA: 1.0000  NORMAL: 1.0000 
F1 - ALL: 1.0000  COVID-19: 1.0000  PNEUMONIA: 1.0000  NORMAL: 1.0000 
Mask ratio's range: 0.75 ~ 1.0

[val]
LOSS - 0.4170
ACC - 0.8367
PPV - ALL: 0.8499  COVID-19: 0.8854  PNEUMONIA: 0.8073  NORMAL: 0.8571 
RECALL - ALL: 0.8475  COVID-19: 0.8500  PNEUMONIA: 0.8800  NORMAL: 0.8125 
F1 - ALL: 0.8479  COVID-19: 0.8673  PNEUMONIA: 0.8421  NORMAL: 0.8342 

Epoch 15/19
----------
[train]
LOSS - 0.0143
ACC - 0.9600
PPV - ALL: 1.0000  COVID-19: 1.0000  PNEUMONIA: 1.0000  NORMAL: 1.0000 
RECALL - ALL: 1.0000  COVID-19: 1.0000  PNEUMONIA: 1.0000  NORMAL: 1.0000 
F1 - ALL: 1.0000  COVID-19: 1.0000  PNEUMONIA: 1.0000  NORMAL: 1.0000 
Mask ratio's range: 0.75 ~ 1.0

[val]
LOSS - 0.4191
ACC - 0.8300
PPV - ALL: 0.8443  COVID-19: 0.8830  PNEUMONIA: 0.7928  NORMAL: 0.8571 
RECALL - ALL: 0.8408  COVID-19: 0.8300  PNEUMONIA: 0.8800  NORMAL: 0.8125 
F1 - ALL: 0.8413  COVID-19: 0.8557  PNEUMONIA: 0.8341  NORMAL: 0.8342 

Epoch 16/19
----------
[train]
LOSS - 0.0227
ACC - 0.9600
PPV - ALL: 1.0000  COVID-19: 1.0000  PNEUMONIA: 1.0000  NORMAL: 1.0000 
RECALL - ALL: 1.0000  COVID-19: 1.0000  PNEUMONIA: 1.0000  NORMAL: 1.0000 
F1 - ALL: 1.0000  COVID-19: 1.0000  PNEUMONIA: 1.0000  NORMAL: 1.0000 
Mask ratio's range: 0.75 ~ 1.0

[val]
LOSS - 0.4162
ACC - 0.8267
PPV - ALL: 0.8407  COVID-19: 0.8737  PNEUMONIA: 0.7928  NORMAL: 0.8556 
RECALL - ALL: 0.8374  COVID-19: 0.8300  PNEUMONIA: 0.8800  NORMAL: 0.8021 
F1 - ALL: 0.8378  COVID-19: 0.8513  PNEUMONIA: 0.8341  NORMAL: 0.8280 

Epoch 17/19
----------
[train]
LOSS - 0.0158
ACC - 0.9600
PPV - ALL: 1.0000  COVID-19: 1.0000  PNEUMONIA: 1.0000  NORMAL: 1.0000 
RECALL - ALL: 1.0000  COVID-19: 1.0000  PNEUMONIA: 1.0000  NORMAL: 1.0000 
F1 - ALL: 1.0000  COVID-19: 1.0000  PNEUMONIA: 1.0000  NORMAL: 1.0000 
Mask ratio's range: 0.75 ~ 1.0

[val]
LOSS - 0.4245
ACC - 0.8200
PPV - ALL: 0.8360  COVID-19: 0.8791  PNEUMONIA: 0.7719  NORMAL: 0.8571 
RECALL - ALL: 0.8308  COVID-19: 0.8000  PNEUMONIA: 0.8800  NORMAL: 0.8125 
F1 - ALL: 0.8314  COVID-19: 0.8377  PNEUMONIA: 0.8224  NORMAL: 0.8342 

Epoch 18/19
----------
[train]
LOSS - 0.0126
ACC - 0.9600
PPV - ALL: 1.0000  COVID-19: 1.0000  PNEUMONIA: 1.0000  NORMAL: 1.0000 
RECALL - ALL: 1.0000  COVID-19: 1.0000  PNEUMONIA: 1.0000  NORMAL: 1.0000 
F1 - ALL: 1.0000  COVID-19: 1.0000  PNEUMONIA: 1.0000  NORMAL: 1.0000 
Mask ratio's range: 0.75 ~ 1.0

[val]
LOSS - 0.4306
ACC - 0.8233
PPV - ALL: 0.8413  COVID-19: 0.8977  PNEUMONIA: 0.7692  NORMAL: 0.8571 
RECALL - ALL: 0.8342  COVID-19: 0.7900  PNEUMONIA: 0.9000  NORMAL: 0.8125 
F1 - ALL: 0.8347  COVID-19: 0.8404  PNEUMONIA: 0.8295  NORMAL: 0.8342 

Epoch 19/19
----------
[train]
LOSS - 0.0125
ACC - 0.9600
PPV - ALL: 1.0000  COVID-19: 1.0000  PNEUMONIA: 1.0000  NORMAL: 1.0000 
RECALL - ALL: 1.0000  COVID-19: 1.0000  PNEUMONIA: 1.0000  NORMAL: 1.0000 
F1 - ALL: 1.0000  COVID-19: 1.0000  PNEUMONIA: 1.0000  NORMAL: 1.0000 
Mask ratio's range: 0.75 ~ 1.0

[val]
LOSS - 0.4321
ACC - 0.8200
PPV - ALL: 0.8360  COVID-19: 0.8791  PNEUMONIA: 0.7719  NORMAL: 0.8571 
RECALL - ALL: 0.8308  COVID-19: 0.8000  PNEUMONIA: 0.8800  NORMAL: 0.8125 
F1 - ALL: 0.8314  COVID-19: 0.8377  PNEUMONIA: 0.8224  NORMAL: 0.8342 


--------------------
[Best results]
ACC - 0.8367
PPV - ALL: 0.8499  COVID-19: 0.8854  PNEUMONIA: 0.8073  NORMAL: 0.8571 
RECALL - ALL: 0.8475  COVID-19: 0.8500  PNEUMONIA: 0.8800  NORMAL: 0.8125 
F1 - ALL: 0.8479  COVID-19: 0.8673  PNEUMONIA: 0.8421  NORMAL: 0.8342 

Training complete in 1m 30s
-------------------- 

--------------------
Model 4
--------------------

Epoch 0/19
----------
[train]
LOSS - 1.0112
ACC - 0.5067
PPV - ALL: 0.5267  COVID-19: 0.4583  PNEUMONIA: 0.5217  NORMAL: 0.6000 
RECALL - ALL: 0.5278  COVID-19: 0.4583  PNEUMONIA: 0.5000  NORMAL: 0.6250 
F1 - ALL: 0.5270  COVID-19: 0.4583  PNEUMONIA: 0.5106  NORMAL: 0.6122 
Mask ratio's range: 1.0 ~ 1.0

[val]
LOSS - 0.9903
ACC - 0.5333
PPV - ALL: 0.7216  COVID-19: 1.0000  PNEUMONIA: 0.7160  NORMAL: 0.4488 
RECALL - ALL: 0.5461  COVID-19: 0.1000  PNEUMONIA: 0.5800  NORMAL: 0.9583 
F1 - ALL: 0.4780  COVID-19: 0.1818  PNEUMONIA: 0.6409  NORMAL: 0.6113 

Epoch 1/19
----------
[train]
LOSS - 0.6352
ACC - 0.9067
PPV - ALL: 0.9477  COVID-19: 1.0000  PNEUMONIA: 0.9200  NORMAL: 0.9231 
RECALL - ALL: 0.9444  COVID-19: 0.8750  PNEUMONIA: 0.9583  NORMAL: 1.0000 
F1 - ALL: 0.9440  COVID-19: 0.9333  PNEUMONIA: 0.9388  NORMAL: 0.9600 
Mask ratio's range: 1.0 ~ 1.0

[val]
LOSS - 0.7602
ACC - 0.7567
PPV - ALL: 0.7701  COVID-19: 0.7857  PNEUMONIA: 0.7156  NORMAL: 0.8090 
RECALL - ALL: 0.7667  COVID-19: 0.7700  PNEUMONIA: 0.7800  NORMAL: 0.7500 
F1 - ALL: 0.7675  COVID-19: 0.7778  PNEUMONIA: 0.7464  NORMAL: 0.7784 

Epoch 2/19
----------
[train]
LOSS - 0.2771
ACC - 0.9467
PPV - ALL: 0.9867  COVID-19: 1.0000  PNEUMONIA: 1.0000  NORMAL: 0.9600 
RECALL - ALL: 0.9861  COVID-19: 1.0000  PNEUMONIA: 0.9583  NORMAL: 1.0000 
F1 - ALL: 0.9861  COVID-19: 1.0000  PNEUMONIA: 0.9787  NORMAL: 0.9796 
Mask ratio's range: 1.0 ~ 1.0

[val]
LOSS - 0.6213
ACC - 0.7700
PPV - ALL: 0.7941  COVID-19: 0.8816  PNEUMONIA: 0.7049  NORMAL: 0.7959 
RECALL - ALL: 0.7808  COVID-19: 0.6700  PNEUMONIA: 0.8600  NORMAL: 0.8125 
F1 - ALL: 0.7801  COVID-19: 0.7614  PNEUMONIA: 0.7748  NORMAL: 0.8041 

Epoch 3/19
----------
[train]
LOSS - 0.1017
ACC - 0.9600
PPV - ALL: 1.0000  COVID-19: 1.0000  PNEUMONIA: 1.0000  NORMAL: 1.0000 
RECALL - ALL: 1.0000  COVID-19: 1.0000  PNEUMONIA: 1.0000  NORMAL: 1.0000 
F1 - ALL: 1.0000  COVID-19: 1.0000  PNEUMONIA: 1.0000  NORMAL: 1.0000 
Mask ratio's range: 1.0 ~ 1.0

[val]
LOSS - 0.5625
ACC - 0.7767
PPV - ALL: 0.7966  COVID-19: 0.8444  PNEUMONIA: 0.7083  NORMAL: 0.8372 
RECALL - ALL: 0.7867  COVID-19: 0.7600  PNEUMONIA: 0.8500  NORMAL: 0.7500 
F1 - ALL: 0.7880  COVID-19: 0.8000  PNEUMONIA: 0.7727  NORMAL: 0.7912 

Epoch 4/19
----------
[train]
LOSS - 0.0415
ACC - 0.9600
PPV - ALL: 1.0000  COVID-19: 1.0000  PNEUMONIA: 1.0000  NORMAL: 1.0000 
RECALL - ALL: 1.0000  COVID-19: 1.0000  PNEUMONIA: 1.0000  NORMAL: 1.0000 
F1 - ALL: 1.0000  COVID-19: 1.0000  PNEUMONIA: 1.0000  NORMAL: 1.0000 
Mask ratio's range: 1.0 ~ 1.0

[val]
LOSS - 0.5316
ACC - 0.7767
PPV - ALL: 0.7913  COVID-19: 0.8132  PNEUMONIA: 0.7345  NORMAL: 0.8261 
RECALL - ALL: 0.7872  COVID-19: 0.7400  PNEUMONIA: 0.8300  NORMAL: 0.7917 
F1 - ALL: 0.7876  COVID-19: 0.7749  PNEUMONIA: 0.7793  NORMAL: 0.8085 

Epoch 5/19
----------
[train]
LOSS - 0.0243
ACC - 0.9600
PPV - ALL: 1.0000  COVID-19: 1.0000  PNEUMONIA: 1.0000  NORMAL: 1.0000 
RECALL - ALL: 1.0000  COVID-19: 1.0000  PNEUMONIA: 1.0000  NORMAL: 1.0000 
F1 - ALL: 1.0000  COVID-19: 1.0000  PNEUMONIA: 1.0000  NORMAL: 1.0000 
Mask ratio's range: 0.9375 ~ 1.0

[val]
LOSS - 0.5201
ACC - 0.7767
PPV - ALL: 0.7922  COVID-19: 0.8152  PNEUMONIA: 0.7281  NORMAL: 0.8333 
RECALL - ALL: 0.7871  COVID-19: 0.7500  PNEUMONIA: 0.8300  NORMAL: 0.7812 
F1 - ALL: 0.7878  COVID-19: 0.7812  PNEUMONIA: 0.7757  NORMAL: 0.8064 

Epoch 6/19
----------
[train]
LOSS - 0.0179
ACC - 0.9600
PPV - ALL: 1.0000  COVID-19: 1.0000  PNEUMONIA: 1.0000  NORMAL: 1.0000 
RECALL - ALL: 1.0000  COVID-19: 1.0000  PNEUMONIA: 1.0000  NORMAL: 1.0000 
F1 - ALL: 1.0000  COVID-19: 1.0000  PNEUMONIA: 1.0000  NORMAL: 1.0000 
Mask ratio's range: 0.9375 ~ 1.0

[val]
LOSS - 0.5154
ACC - 0.7700
PPV - ALL: 0.7846  COVID-19: 0.7857  PNEUMONIA: 0.7273  NORMAL: 0.8409 
RECALL - ALL: 0.7803  COVID-19: 0.7700  PNEUMONIA: 0.8000  NORMAL: 0.7708 
F1 - ALL: 0.7813  COVID-19: 0.7778  PNEUMONIA: 0.7619  NORMAL: 0.8043 

Epoch 7/19
----------
[train]
LOSS - 0.0163
ACC - 0.9600
PPV - ALL: 1.0000  COVID-19: 1.0000  PNEUMONIA: 1.0000  NORMAL: 1.0000 
RECALL - ALL: 1.0000  COVID-19: 1.0000  PNEUMONIA: 1.0000  NORMAL: 1.0000 
F1 - ALL: 1.0000  COVID-19: 1.0000  PNEUMONIA: 1.0000  NORMAL: 1.0000 
Mask ratio's range: 0.875 ~ 1.0

[val]
LOSS - 0.5122
ACC - 0.7767
PPV - ALL: 0.7904  COVID-19: 0.8105  PNEUMONIA: 0.7364  NORMAL: 0.8242 
RECALL - ALL: 0.7871  COVID-19: 0.7700  PNEUMONIA: 0.8100  NORMAL: 0.7812 
F1 - ALL: 0.7877  COVID-19: 0.7897  PNEUMONIA: 0.7714  NORMAL: 0.8021 

Epoch 8/19
----------
[train]
LOSS - 0.0126
ACC - 0.9600
PPV - ALL: 1.0000  COVID-19: 1.0000  PNEUMONIA: 1.0000  NORMAL: 1.0000 
RECALL - ALL: 1.0000  COVID-19: 1.0000  PNEUMONIA: 1.0000  NORMAL: 1.0000 
F1 - ALL: 1.0000  COVID-19: 1.0000  PNEUMONIA: 1.0000  NORMAL: 1.0000 
Mask ratio's range: 0.875 ~ 1.0

[val]
LOSS - 0.5119
ACC - 0.7767
PPV - ALL: 0.7896  COVID-19: 0.8000  PNEUMONIA: 0.7407  NORMAL: 0.8280 
RECALL - ALL: 0.7874  COVID-19: 0.7600  PNEUMONIA: 0.8000  NORMAL: 0.8021 
F1 - ALL: 0.7878  COVID-19: 0.7795  PNEUMONIA: 0.7692  NORMAL: 0.8148 

Epoch 9/19
----------
[train]
LOSS - 0.0165
ACC - 0.9600
PPV - ALL: 1.0000  COVID-19: 1.0000  PNEUMONIA: 1.0000  NORMAL: 1.0000 
RECALL - ALL: 1.0000  COVID-19: 1.0000  PNEUMONIA: 1.0000  NORMAL: 1.0000 
F1 - ALL: 1.0000  COVID-19: 1.0000  PNEUMONIA: 1.0000  NORMAL: 1.0000 
Mask ratio's range: 0.875 ~ 1.0

[val]
LOSS - 0.5034
ACC - 0.7800
PPV - ALL: 0.7925  COVID-19: 0.8085  PNEUMONIA: 0.7500  NORMAL: 0.8191 
RECALL - ALL: 0.7907  COVID-19: 0.7600  PNEUMONIA: 0.8100  NORMAL: 0.8021 
F1 - ALL: 0.7909  COVID-19: 0.7835  PNEUMONIA: 0.7788  NORMAL: 0.8105 

Epoch 10/19
----------
[train]
LOSS - 0.0137
ACC - 0.9600
PPV - ALL: 1.0000  COVID-19: 1.0000  PNEUMONIA: 1.0000  NORMAL: 1.0000 
RECALL - ALL: 1.0000  COVID-19: 1.0000  PNEUMONIA: 1.0000  NORMAL: 1.0000 
F1 - ALL: 1.0000  COVID-19: 1.0000  PNEUMONIA: 1.0000  NORMAL: 1.0000 
Mask ratio's range: 0.875 ~ 1.0

[val]
LOSS - 0.5068
ACC - 0.7700
PPV - ALL: 0.7818  COVID-19: 0.7835  PNEUMONIA: 0.7429  NORMAL: 0.8191 
RECALL - ALL: 0.7807  COVID-19: 0.7600  PNEUMONIA: 0.7800  NORMAL: 0.8021 
F1 - ALL: 0.7810  COVID-19: 0.7716  PNEUMONIA: 0.7610  NORMAL: 0.8105 

Epoch 11/19
----------
[train]
LOSS - 0.0155
ACC - 0.9600
PPV - ALL: 1.0000  COVID-19: 1.0000  PNEUMONIA: 1.0000  NORMAL: 1.0000 
RECALL - ALL: 1.0000  COVID-19: 1.0000  PNEUMONIA: 1.0000  NORMAL: 1.0000 
F1 - ALL: 1.0000  COVID-19: 1.0000  PNEUMONIA: 1.0000  NORMAL: 1.0000 
Mask ratio's range: 0.875 ~ 1.0

[val]
LOSS - 0.5058
ACC - 0.7700
PPV - ALL: 0.7821  COVID-19: 0.7778  PNEUMONIA: 0.7404  NORMAL: 0.8280 
RECALL - ALL: 0.7807  COVID-19: 0.7700  PNEUMONIA: 0.7700  NORMAL: 0.8021 
F1 - ALL: 0.7812  COVID-19: 0.7739  PNEUMONIA: 0.7549  NORMAL: 0.8148 

Epoch 12/19
----------
[train]
LOSS - 0.0177
ACC - 0.9600
PPV - ALL: 1.0000  COVID-19: 1.0000  PNEUMONIA: 1.0000  NORMAL: 1.0000 
RECALL - ALL: 1.0000  COVID-19: 1.0000  PNEUMONIA: 1.0000  NORMAL: 1.0000 
F1 - ALL: 1.0000  COVID-19: 1.0000  PNEUMONIA: 1.0000  NORMAL: 1.0000 
Mask ratio's range: 0.8125 ~ 1.0

[val]
LOSS - 0.5062
ACC - 0.7633
PPV - ALL: 0.7744  COVID-19: 0.7755  PNEUMONIA: 0.7353  NORMAL: 0.8125 
RECALL - ALL: 0.7742  COVID-19: 0.7600  PNEUMONIA: 0.7500  NORMAL: 0.8125 
F1 - ALL: 0.7743  COVID-19: 0.7677  PNEUMONIA: 0.7426  NORMAL: 0.8125 

Epoch 13/19
----------
[train]
LOSS - 0.0096
ACC - 0.9600
PPV - ALL: 1.0000  COVID-19: 1.0000  PNEUMONIA: 1.0000  NORMAL: 1.0000 
RECALL - ALL: 1.0000  COVID-19: 1.0000  PNEUMONIA: 1.0000  NORMAL: 1.0000 
F1 - ALL: 1.0000  COVID-19: 1.0000  PNEUMONIA: 1.0000  NORMAL: 1.0000 
Mask ratio's range: 0.8125 ~ 1.0

[val]
LOSS - 0.4996
ACC - 0.7667
PPV - ALL: 0.7785  COVID-19: 0.7812  PNEUMONIA: 0.7333  NORMAL: 0.8211 
RECALL - ALL: 0.7775  COVID-19: 0.7500  PNEUMONIA: 0.7700  NORMAL: 0.8125 
F1 - ALL: 0.7778  COVID-19: 0.7653  PNEUMONIA: 0.7512  NORMAL: 0.8168 

Epoch 14/19
----------
[train]
LOSS - 0.0100
ACC - 0.9600
PPV - ALL: 1.0000  COVID-19: 1.0000  PNEUMONIA: 1.0000  NORMAL: 1.0000 
RECALL - ALL: 1.0000  COVID-19: 1.0000  PNEUMONIA: 1.0000  NORMAL: 1.0000 
F1 - ALL: 1.0000  COVID-19: 1.0000  PNEUMONIA: 1.0000  NORMAL: 1.0000 
Mask ratio's range: 0.8125 ~ 1.0

[val]
LOSS - 0.5032
ACC - 0.7600
PPV - ALL: 0.7703  COVID-19: 0.7708  PNEUMONIA: 0.7500  NORMAL: 0.7900 
RECALL - ALL: 0.7710  COVID-19: 0.7400  PNEUMONIA: 0.7500  NORMAL: 0.8229 
F1 - ALL: 0.7704  COVID-19: 0.7551  PNEUMONIA: 0.7500  NORMAL: 0.8061 

Epoch 15/19
----------
[train]
LOSS - 0.0120
ACC - 0.9600
PPV - ALL: 1.0000  COVID-19: 1.0000  PNEUMONIA: 1.0000  NORMAL: 1.0000 
RECALL - ALL: 1.0000  COVID-19: 1.0000  PNEUMONIA: 1.0000  NORMAL: 1.0000 
F1 - ALL: 1.0000  COVID-19: 1.0000  PNEUMONIA: 1.0000  NORMAL: 1.0000 
Mask ratio's range: 0.8125 ~ 1.0

[val]
LOSS - 0.5044
ACC - 0.7600
PPV - ALL: 0.7705  COVID-19: 0.7789  PNEUMONIA: 0.7426  NORMAL: 0.7900 
RECALL - ALL: 0.7710  COVID-19: 0.7400  PNEUMONIA: 0.7500  NORMAL: 0.8229 
F1 - ALL: 0.7705  COVID-19: 0.7590  PNEUMONIA: 0.7463  NORMAL: 0.8061 

Epoch 16/19
----------
[train]
LOSS - 0.0096
ACC - 0.9600
PPV - ALL: 1.0000  COVID-19: 1.0000  PNEUMONIA: 1.0000  NORMAL: 1.0000 
RECALL - ALL: 1.0000  COVID-19: 1.0000  PNEUMONIA: 1.0000  NORMAL: 1.0000 
F1 - ALL: 1.0000  COVID-19: 1.0000  PNEUMONIA: 1.0000  NORMAL: 1.0000 
Mask ratio's range: 0.8125 ~ 1.0

[val]
LOSS - 0.5030
ACC - 0.7700
PPV - ALL: 0.7817  COVID-19: 0.7835  PNEUMONIA: 0.7404  NORMAL: 0.8211 
RECALL - ALL: 0.7808  COVID-19: 0.7600  PNEUMONIA: 0.7700  NORMAL: 0.8125 
F1 - ALL: 0.7811  COVID-19: 0.7716  PNEUMONIA: 0.7549  NORMAL: 0.8168 

Epoch 17/19
----------
[train]
LOSS - 0.0131
ACC - 0.9600
PPV - ALL: 1.0000  COVID-19: 1.0000  PNEUMONIA: 1.0000  NORMAL: 1.0000 
RECALL - ALL: 1.0000  COVID-19: 1.0000  PNEUMONIA: 1.0000  NORMAL: 1.0000 
F1 - ALL: 1.0000  COVID-19: 1.0000  PNEUMONIA: 1.0000  NORMAL: 1.0000 
Mask ratio's range: 0.8125 ~ 1.0

[val]
LOSS - 0.5050
ACC - 0.7600
PPV - ALL: 0.7706  COVID-19: 0.7732  PNEUMONIA: 0.7426  NORMAL: 0.7959 
RECALL - ALL: 0.7708  COVID-19: 0.7500  PNEUMONIA: 0.7500  NORMAL: 0.8125 
F1 - ALL: 0.7706  COVID-19: 0.7614  PNEUMONIA: 0.7463  NORMAL: 0.8041 

Epoch 18/19
----------
[train]
LOSS - 0.0157
ACC - 0.9600
PPV - ALL: 1.0000  COVID-19: 1.0000  PNEUMONIA: 1.0000  NORMAL: 1.0000 
RECALL - ALL: 1.0000  COVID-19: 1.0000  PNEUMONIA: 1.0000  NORMAL: 1.0000 
F1 - ALL: 1.0000  COVID-19: 1.0000  PNEUMONIA: 1.0000  NORMAL: 1.0000 
Mask ratio's range: 0.8125 ~ 1.0

[val]
LOSS - 0.5021
ACC - 0.7633
PPV - ALL: 0.7738  COVID-19: 0.7872  PNEUMONIA: 0.7500  NORMAL: 0.7843 
RECALL - ALL: 0.7744  COVID-19: 0.7400  PNEUMONIA: 0.7500  NORMAL: 0.8333 
F1 - ALL: 0.7737  COVID-19: 0.7629  PNEUMONIA: 0.7500  NORMAL: 0.8081 

Epoch 19/19
----------
[train]
LOSS - 0.0082
ACC - 0.9600
PPV - ALL: 1.0000  COVID-19: 1.0000  PNEUMONIA: 1.0000  NORMAL: 1.0000 
RECALL - ALL: 1.0000  COVID-19: 1.0000  PNEUMONIA: 1.0000  NORMAL: 1.0000 
F1 - ALL: 1.0000  COVID-19: 1.0000  PNEUMONIA: 1.0000  NORMAL: 1.0000 
Mask ratio's range: 0.8125 ~ 0.9375

[val]
LOSS - 0.4975
ACC - 0.7700
PPV - ALL: 0.7804  COVID-19: 0.7872  PNEUMONIA: 0.7600  NORMAL: 0.7941 
RECALL - ALL: 0.7813  COVID-19: 0.7400  PNEUMONIA: 0.7600  NORMAL: 0.8438 
F1 - ALL: 0.7804  COVID-19: 0.7629  PNEUMONIA: 0.7600  NORMAL: 0.8182 


--------------------
[Best results]
ACC - 0.7800
PPV - ALL: 0.7925  COVID-19: 0.8085  PNEUMONIA: 0.7500  NORMAL: 0.8191 
RECALL - ALL: 0.7907  COVID-19: 0.7600  PNEUMONIA: 0.8100  NORMAL: 0.8021 
F1 - ALL: 0.7909  COVID-19: 0.7835  PNEUMONIA: 0.7788  NORMAL: 0.8105 

Training complete in 1m 31s
-------------------- 

--------------------
Model 5
--------------------

Epoch 0/19
----------
[train]
LOSS - 1.0431
ACC - 0.3333
PPV - ALL: 0.3523  COVID-19: 0.4286  PNEUMONIA: 0.3158  NORMAL: 0.3125 
RECALL - ALL: 0.3472  COVID-19: 0.3750  PNEUMONIA: 0.2500  NORMAL: 0.4167 
F1 - ALL: 0.3454  COVID-19: 0.4000  PNEUMONIA: 0.2791  NORMAL: 0.3572 
Mask ratio's range: 1.0 ~ 1.0

[val]
LOSS - 0.9491
ACC - 0.6267
PPV - ALL: 0.6429  COVID-19: 0.6848  PNEUMONIA: 0.5439  NORMAL: 0.7000 
RECALL - ALL: 0.6354  COVID-19: 0.6300  PNEUMONIA: 0.6200  NORMAL: 0.6562 
F1 - ALL: 0.6377  COVID-19: 0.6563  PNEUMONIA: 0.5795  NORMAL: 0.6774 

Epoch 1/19
----------
[train]
LOSS - 0.6655
ACC - 0.8933
PPV - ALL: 0.9316  COVID-19: 0.9565  PNEUMONIA: 0.9583  NORMAL: 0.8800 
RECALL - ALL: 0.9306  COVID-19: 0.9167  PNEUMONIA: 0.9583  NORMAL: 0.9167 
F1 - ALL: 0.9308  COVID-19: 0.9362  PNEUMONIA: 0.9583  NORMAL: 0.8980 
Mask ratio's range: 1.0 ~ 1.0

[val]
LOSS - 0.7718
ACC - 0.7300
PPV - ALL: 0.7704  COVID-19: 0.9180  PNEUMONIA: 0.7290  NORMAL: 0.6641 
RECALL - ALL: 0.7418  COVID-19: 0.5600  PNEUMONIA: 0.7800  NORMAL: 0.8854 
F1 - ALL: 0.7360  COVID-19: 0.6956  PNEUMONIA: 0.7536  NORMAL: 0.7589 

Epoch 2/19
----------
[train]
LOSS - 0.3088
ACC - 0.9600
PPV - ALL: 1.0000  COVID-19: 1.0000  PNEUMONIA: 1.0000  NORMAL: 1.0000 
RECALL - ALL: 1.0000  COVID-19: 1.0000  PNEUMONIA: 1.0000  NORMAL: 1.0000 
F1 - ALL: 1.0000  COVID-19: 1.0000  PNEUMONIA: 1.0000  NORMAL: 1.0000 
Mask ratio's range: 1.0 ~ 1.0

[val]
LOSS - 0.6232
ACC - 0.7667
PPV - ALL: 0.7783  COVID-19: 0.7978  PNEUMONIA: 0.7778  NORMAL: 0.7593 
RECALL - ALL: 0.7781  COVID-19: 0.7100  PNEUMONIA: 0.7700  NORMAL: 0.8542 
F1 - ALL: 0.7764  COVID-19: 0.7513  PNEUMONIA: 0.7739  NORMAL: 0.8040 

Epoch 3/19
----------
[train]
LOSS - 0.1084
ACC - 0.9600
PPV - ALL: 1.0000  COVID-19: 1.0000  PNEUMONIA: 1.0000  NORMAL: 1.0000 
RECALL - ALL: 1.0000  COVID-19: 1.0000  PNEUMONIA: 1.0000  NORMAL: 1.0000 
F1 - ALL: 1.0000  COVID-19: 1.0000  PNEUMONIA: 1.0000  NORMAL: 1.0000 
Mask ratio's range: 1.0 ~ 1.0

[val]
LOSS - 0.5484
ACC - 0.7900
PPV - ALL: 0.8077  COVID-19: 0.8765  PNEUMONIA: 0.7921  NORMAL: 0.7544 
RECALL - ALL: 0.8019  COVID-19: 0.7100  PNEUMONIA: 0.8000  NORMAL: 0.8958 
F1 - ALL: 0.7998  COVID-19: 0.7845  PNEUMONIA: 0.7960  NORMAL: 0.8190 

Epoch 4/19
----------
[train]
LOSS - 0.0442
ACC - 0.9600
PPV - ALL: 1.0000  COVID-19: 1.0000  PNEUMONIA: 1.0000  NORMAL: 1.0000 
RECALL - ALL: 1.0000  COVID-19: 1.0000  PNEUMONIA: 1.0000  NORMAL: 1.0000 
F1 - ALL: 1.0000  COVID-19: 1.0000  PNEUMONIA: 1.0000  NORMAL: 1.0000 
Mask ratio's range: 1.0 ~ 1.0

[val]
LOSS - 0.5231
ACC - 0.7767
PPV - ALL: 0.7913  COVID-19: 0.8434  PNEUMONIA: 0.7619  NORMAL: 0.7685 
RECALL - ALL: 0.7882  COVID-19: 0.7000  PNEUMONIA: 0.8000  NORMAL: 0.8646 
F1 - ALL: 0.7864  COVID-19: 0.7650  PNEUMONIA: 0.7805  NORMAL: 0.8137 

Epoch 5/19
----------
[train]
LOSS - 0.0231
ACC - 0.9600
PPV - ALL: 1.0000  COVID-19: 1.0000  PNEUMONIA: 1.0000  NORMAL: 1.0000 
RECALL - ALL: 1.0000  COVID-19: 1.0000  PNEUMONIA: 1.0000  NORMAL: 1.0000 
F1 - ALL: 1.0000  COVID-19: 1.0000  PNEUMONIA: 1.0000  NORMAL: 1.0000 
Mask ratio's range: 1.0 ~ 1.0

[val]
LOSS - 0.5031
ACC - 0.7833
PPV - ALL: 0.7953  COVID-19: 0.8132  PNEUMONIA: 0.8021  NORMAL: 0.7706 
RECALL - ALL: 0.7950  COVID-19: 0.7400  PNEUMONIA: 0.7700  NORMAL: 0.8750 
F1 - ALL: 0.7934  COVID-19: 0.7749  PNEUMONIA: 0.7857  NORMAL: 0.8195 

Epoch 6/19
----------
[train]
LOSS - 0.0230
ACC - 0.9600
PPV - ALL: 1.0000  COVID-19: 1.0000  PNEUMONIA: 1.0000  NORMAL: 1.0000 
RECALL - ALL: 1.0000  COVID-19: 1.0000  PNEUMONIA: 1.0000  NORMAL: 1.0000 
F1 - ALL: 1.0000  COVID-19: 1.0000  PNEUMONIA: 1.0000  NORMAL: 1.0000 
Mask ratio's range: 0.9375 ~ 1.0

[val]
LOSS - 0.4921
ACC - 0.7933
PPV - ALL: 0.8057  COVID-19: 0.8333  PNEUMONIA: 0.8061  NORMAL: 0.7778 
RECALL - ALL: 0.8050  COVID-19: 0.7500  PNEUMONIA: 0.7900  NORMAL: 0.8750 
F1 - ALL: 0.8037  COVID-19: 0.7895  PNEUMONIA: 0.7980  NORMAL: 0.8235 

Epoch 7/19
----------
[train]
LOSS - 0.0140
ACC - 0.9600
PPV - ALL: 1.0000  COVID-19: 1.0000  PNEUMONIA: 1.0000  NORMAL: 1.0000 
RECALL - ALL: 1.0000  COVID-19: 1.0000  PNEUMONIA: 1.0000  NORMAL: 1.0000 
F1 - ALL: 1.0000  COVID-19: 1.0000  PNEUMONIA: 1.0000  NORMAL: 1.0000 
Mask ratio's range: 0.9375 ~ 1.0

[val]
LOSS - 0.4940
ACC - 0.7833
PPV - ALL: 0.7949  COVID-19: 0.8132  PNEUMONIA: 0.7938  NORMAL: 0.7778 
RECALL - ALL: 0.7950  COVID-19: 0.7400  PNEUMONIA: 0.7700  NORMAL: 0.8750 
F1 - ALL: 0.7934  COVID-19: 0.7749  PNEUMONIA: 0.7817  NORMAL: 0.8235 

Epoch 8/19
----------
[train]
LOSS - 0.0152
ACC - 0.9600
PPV - ALL: 1.0000  COVID-19: 1.0000  PNEUMONIA: 1.0000  NORMAL: 1.0000 
RECALL - ALL: 1.0000  COVID-19: 1.0000  PNEUMONIA: 1.0000  NORMAL: 1.0000 
F1 - ALL: 1.0000  COVID-19: 1.0000  PNEUMONIA: 1.0000  NORMAL: 1.0000 
Mask ratio's range: 0.9375 ~ 1.0

[val]
LOSS - 0.4916
ACC - 0.7833
PPV - ALL: 0.7944  COVID-19: 0.8085  PNEUMONIA: 0.7917  NORMAL: 0.7830 
RECALL - ALL: 0.7949  COVID-19: 0.7600  PNEUMONIA: 0.7600  NORMAL: 0.8646 
F1 - ALL: 0.7936  COVID-19: 0.7835  PNEUMONIA: 0.7755  NORMAL: 0.8218 

Epoch 9/19
----------
[train]
LOSS - 0.0153
ACC - 0.9600
PPV - ALL: 1.0000  COVID-19: 1.0000  PNEUMONIA: 1.0000  NORMAL: 1.0000 
RECALL - ALL: 1.0000  COVID-19: 1.0000  PNEUMONIA: 1.0000  NORMAL: 1.0000 
F1 - ALL: 1.0000  COVID-19: 1.0000  PNEUMONIA: 1.0000  NORMAL: 1.0000 
Mask ratio's range: 0.9375 ~ 1.0

[val]
LOSS - 0.4901
ACC - 0.7867
PPV - ALL: 0.7988  COVID-19: 0.8085  PNEUMONIA: 0.8172  NORMAL: 0.7706 
RECALL - ALL: 0.7983  COVID-19: 0.7600  PNEUMONIA: 0.7600  NORMAL: 0.8750 
F1 - ALL: 0.7969  COVID-19: 0.7835  PNEUMONIA: 0.7876  NORMAL: 0.8195 

Epoch 10/19
----------
[train]
LOSS - 0.0140
ACC - 0.9600
PPV - ALL: 1.0000  COVID-19: 1.0000  PNEUMONIA: 1.0000  NORMAL: 1.0000 
RECALL - ALL: 1.0000  COVID-19: 1.0000  PNEUMONIA: 1.0000  NORMAL: 1.0000 
F1 - ALL: 1.0000  COVID-19: 1.0000  PNEUMONIA: 1.0000  NORMAL: 1.0000 
Mask ratio's range: 0.875 ~ 1.0

[val]
LOSS - 0.4895
ACC - 0.7867
PPV - ALL: 0.7988  COVID-19: 0.8152  PNEUMONIA: 0.8105  NORMAL: 0.7706 
RECALL - ALL: 0.7983  COVID-19: 0.7500  PNEUMONIA: 0.7700  NORMAL: 0.8750 
F1 - ALL: 0.7968  COVID-19: 0.7812  PNEUMONIA: 0.7897  NORMAL: 0.8195 

Epoch 11/19
----------
[train]
LOSS - 0.0182
ACC - 0.9600
PPV - ALL: 1.0000  COVID-19: 1.0000  PNEUMONIA: 1.0000  NORMAL: 1.0000 
RECALL - ALL: 1.0000  COVID-19: 1.0000  PNEUMONIA: 1.0000  NORMAL: 1.0000 
F1 - ALL: 1.0000  COVID-19: 1.0000  PNEUMONIA: 1.0000  NORMAL: 1.0000 
Mask ratio's range: 0.875 ~ 1.0

[val]
LOSS - 0.4975
ACC - 0.7833
PPV - ALL: 0.7952  COVID-19: 0.8065  PNEUMONIA: 0.8085  NORMAL: 0.7706 
RECALL - ALL: 0.7950  COVID-19: 0.7500  PNEUMONIA: 0.7600  NORMAL: 0.8750 
F1 - ALL: 0.7934  COVID-19: 0.7772  PNEUMONIA: 0.7835  NORMAL: 0.8195 

Epoch 12/19
----------
[train]
LOSS - 0.0102
ACC - 0.9600
PPV - ALL: 1.0000  COVID-19: 1.0000  PNEUMONIA: 1.0000  NORMAL: 1.0000 
RECALL - ALL: 1.0000  COVID-19: 1.0000  PNEUMONIA: 1.0000  NORMAL: 1.0000 
F1 - ALL: 1.0000  COVID-19: 1.0000  PNEUMONIA: 1.0000  NORMAL: 1.0000 
Mask ratio's range: 0.875 ~ 1.0

[val]
LOSS - 0.4928
ACC - 0.7800
PPV - ALL: 0.7918  COVID-19: 0.8111  PNEUMONIA: 0.7938  NORMAL: 0.7706 
RECALL - ALL: 0.7917  COVID-19: 0.7300  PNEUMONIA: 0.7700  NORMAL: 0.8750 
F1 - ALL: 0.7899  COVID-19: 0.7684  PNEUMONIA: 0.7817  NORMAL: 0.8195 

Epoch 13/19
----------
[train]
LOSS - 0.0112
ACC - 0.9600
PPV - ALL: 1.0000  COVID-19: 1.0000  PNEUMONIA: 1.0000  NORMAL: 1.0000 
RECALL - ALL: 1.0000  COVID-19: 1.0000  PNEUMONIA: 1.0000  NORMAL: 1.0000 
F1 - ALL: 1.0000  COVID-19: 1.0000  PNEUMONIA: 1.0000  NORMAL: 1.0000 
Mask ratio's range: 0.875 ~ 1.0

[val]
LOSS - 0.4904
ACC - 0.7833
PPV - ALL: 0.7961  COVID-19: 0.8276  PNEUMONIA: 0.7879  NORMAL: 0.7727 
RECALL - ALL: 0.7951  COVID-19: 0.7200  PNEUMONIA: 0.7800  NORMAL: 0.8854 
F1 - ALL: 0.7931  COVID-19: 0.7701  PNEUMONIA: 0.7839  NORMAL: 0.8252 

Epoch 14/19
----------
[train]
LOSS - 0.0136
ACC - 0.9600
PPV - ALL: 1.0000  COVID-19: 1.0000  PNEUMONIA: 1.0000  NORMAL: 1.0000 
RECALL - ALL: 1.0000  COVID-19: 1.0000  PNEUMONIA: 1.0000  NORMAL: 1.0000 
F1 - ALL: 1.0000  COVID-19: 1.0000  PNEUMONIA: 1.0000  NORMAL: 1.0000 
Mask ratio's range: 0.875 ~ 1.0

[val]
LOSS - 0.4974
ACC - 0.7867
PPV - ALL: 0.8013  COVID-19: 0.8471  PNEUMONIA: 0.7980  NORMAL: 0.7589 
RECALL - ALL: 0.7985  COVID-19: 0.7200  PNEUMONIA: 0.7900  NORMAL: 0.8854 
F1 - ALL: 0.7966  COVID-19: 0.7784  PNEUMONIA: 0.7940  NORMAL: 0.8173 

Epoch 15/19
----------
[train]
LOSS - 0.0095
ACC - 0.9600
PPV - ALL: 1.0000  COVID-19: 1.0000  PNEUMONIA: 1.0000  NORMAL: 1.0000 
RECALL - ALL: 1.0000  COVID-19: 1.0000  PNEUMONIA: 1.0000  NORMAL: 1.0000 
F1 - ALL: 1.0000  COVID-19: 1.0000  PNEUMONIA: 1.0000  NORMAL: 1.0000 
Mask ratio's range: 0.875 ~ 1.0

[val]
LOSS - 0.4993
ACC - 0.7900
PPV - ALL: 0.8042  COVID-19: 0.8488  PNEUMONIA: 0.7980  NORMAL: 0.7658 
RECALL - ALL: 0.8018  COVID-19: 0.7300  PNEUMONIA: 0.7900  NORMAL: 0.8854 
F1 - ALL: 0.8001  COVID-19: 0.7849  PNEUMONIA: 0.7940  NORMAL: 0.8213 

Epoch 16/19
----------
[train]
LOSS - 0.0084
ACC - 0.9600
PPV - ALL: 1.0000  COVID-19: 1.0000  PNEUMONIA: 1.0000  NORMAL: 1.0000 
RECALL - ALL: 1.0000  COVID-19: 1.0000  PNEUMONIA: 1.0000  NORMAL: 1.0000 
F1 - ALL: 1.0000  COVID-19: 1.0000  PNEUMONIA: 1.0000  NORMAL: 1.0000 
Mask ratio's range: 0.875 ~ 1.0

[val]
LOSS - 0.4942
ACC - 0.7867
PPV - ALL: 0.7990  COVID-19: 0.8222  PNEUMONIA: 0.8021  NORMAL: 0.7727 
RECALL - ALL: 0.7985  COVID-19: 0.7400  PNEUMONIA: 0.7700  NORMAL: 0.8854 
F1 - ALL: 0.7966  COVID-19: 0.7789  PNEUMONIA: 0.7857  NORMAL: 0.8252 

Epoch 17/19
----------
[train]
LOSS - 0.0134
ACC - 0.9600
PPV - ALL: 1.0000  COVID-19: 1.0000  PNEUMONIA: 1.0000  NORMAL: 1.0000 
RECALL - ALL: 1.0000  COVID-19: 1.0000  PNEUMONIA: 1.0000  NORMAL: 1.0000 
F1 - ALL: 1.0000  COVID-19: 1.0000  PNEUMONIA: 1.0000  NORMAL: 1.0000 
Mask ratio's range: 0.875 ~ 1.0

[val]
LOSS - 0.4983
ACC - 0.7867
PPV - ALL: 0.7990  COVID-19: 0.8222  PNEUMONIA: 0.8021  NORMAL: 0.7727 
RECALL - ALL: 0.7985  COVID-19: 0.7400  PNEUMONIA: 0.7700  NORMAL: 0.8854 
F1 - ALL: 0.7966  COVID-19: 0.7789  PNEUMONIA: 0.7857  NORMAL: 0.8252 

Epoch 18/19
----------
[train]
LOSS - 0.0130
ACC - 0.9600
PPV - ALL: 1.0000  COVID-19: 1.0000  PNEUMONIA: 1.0000  NORMAL: 1.0000 
RECALL - ALL: 1.0000  COVID-19: 1.0000  PNEUMONIA: 1.0000  NORMAL: 1.0000 
F1 - ALL: 1.0000  COVID-19: 1.0000  PNEUMONIA: 1.0000  NORMAL: 1.0000 
Mask ratio's range: 0.8125 ~ 1.0

[val]
LOSS - 0.5185
ACC - 0.7800
PPV - ALL: 0.7928  COVID-19: 0.8256  PNEUMONIA: 0.7800  NORMAL: 0.7727 
RECALL - ALL: 0.7918  COVID-19: 0.7100  PNEUMONIA: 0.7800  NORMAL: 0.8854 
F1 - ALL: 0.7895  COVID-19: 0.7634  PNEUMONIA: 0.7800  NORMAL: 0.8252 

Epoch 19/19
----------
[train]
LOSS - 0.0248
ACC - 0.9600
PPV - ALL: 1.0000  COVID-19: 1.0000  PNEUMONIA: 1.0000  NORMAL: 1.0000 
RECALL - ALL: 1.0000  COVID-19: 1.0000  PNEUMONIA: 1.0000  NORMAL: 1.0000 
F1 - ALL: 1.0000  COVID-19: 1.0000  PNEUMONIA: 1.0000  NORMAL: 1.0000 
Mask ratio's range: 0.8125 ~ 1.0

[val]
LOSS - 0.5058
ACC - 0.7767
PPV - ALL: 0.7895  COVID-19: 0.8214  PNEUMONIA: 0.7745  NORMAL: 0.7727 
RECALL - ALL: 0.7885  COVID-19: 0.6900  PNEUMONIA: 0.7900  NORMAL: 0.8854 
F1 - ALL: 0.7858  COVID-19: 0.7500  PNEUMONIA: 0.7822  NORMAL: 0.8252 


--------------------
[Best results]
ACC - 0.7933
PPV - ALL: 0.8057  COVID-19: 0.8333  PNEUMONIA: 0.8061  NORMAL: 0.7778 
RECALL - ALL: 0.8050  COVID-19: 0.7500  PNEUMONIA: 0.7900  NORMAL: 0.8750 
F1 - ALL: 0.8037  COVID-19: 0.7895  PNEUMONIA: 0.7980  NORMAL: 0.8235 

Training complete in 1m 31s
-------------------- 

[Mean results]
ACC - 0.8080 (0.02)
PPV - ALL: 0.8209 (0.02)  COVID-19: 0.8576 (0.03)  PNEUMONIA: 0.7884 (0.02)  NORMAL: 0.8168 (0.03) 
RECALL - ALL: 0.8190 (0.02)  COVID-19: 0.7960 (0.04)  PNEUMONIA: 0.8340 (0.04)  NORMAL: 0.8271 (0.03) 
F1 - ALL: 0.8189 (0.02)  COVID-19: 0.8255 (0.03)  PNEUMONIA: 0.8102 (0.03)  NORMAL: 0.8211 (0.01) 

