--------------------
Model 1
--------------------

Epoch 0/19
----------
[train]
LOSS - 1.0226
ACC - 0.4000
PPV - ALL: 0.4222  COVID-19: 0.4737  PNEUMONIA: 0.4000  NORMAL: 0.3929 
RECALL - ALL: 0.4167  COVID-19: 0.3750  PNEUMONIA: 0.4167  NORMAL: 0.4583 
F1 - ALL: 0.4166  COVID-19: 0.4186  PNEUMONIA: 0.4082  NORMAL: 0.4231 
Mask ratio's range: 1.0 ~ 1.0

[val]
LOSS - 1.0073
ACC - 0.4367
PPV - ALL: 0.6585  COVID-19: 1.0000  PNEUMONIA: 0.5882  NORMAL: 0.3872 
RECALL - ALL: 0.4493  COVID-19: 0.1000  PNEUMONIA: 0.3000  NORMAL: 0.9479 
F1 - ALL: 0.3763  COVID-19: 0.1818  PNEUMONIA: 0.3973  NORMAL: 0.5498 

Epoch 1/19
----------
[train]
LOSS - 0.6938
ACC - 0.8933
PPV - ALL: 0.9338  COVID-19: 1.0000  PNEUMONIA: 0.9167  NORMAL: 0.8846 
RECALL - ALL: 0.9306  COVID-19: 0.9167  PNEUMONIA: 0.9167  NORMAL: 0.9583 
F1 - ALL: 0.9311  COVID-19: 0.9565  PNEUMONIA: 0.9167  NORMAL: 0.9200 
Mask ratio's range: 1.0 ~ 1.0

[val]
LOSS - 0.8369
ACC - 0.7067
PPV - ALL: 0.7425  COVID-19: 0.8824  PNEUMONIA: 0.6279  NORMAL: 0.7172 
RECALL - ALL: 0.7165  COVID-19: 0.6000  PNEUMONIA: 0.8100  NORMAL: 0.7396 
F1 - ALL: 0.7166  COVID-19: 0.7143  PNEUMONIA: 0.7074  NORMAL: 0.7282 

Epoch 2/19
----------
[train]
LOSS - 0.3380
ACC - 0.9600
PPV - ALL: 1.0000  COVID-19: 1.0000  PNEUMONIA: 1.0000  NORMAL: 1.0000 
RECALL - ALL: 1.0000  COVID-19: 1.0000  PNEUMONIA: 1.0000  NORMAL: 1.0000 
F1 - ALL: 1.0000  COVID-19: 1.0000  PNEUMONIA: 1.0000  NORMAL: 1.0000 
Mask ratio's range: 1.0 ~ 1.0

[val]
LOSS - 0.6948
ACC - 0.7533
PPV - ALL: 0.7762  COVID-19: 0.8784  PNEUMONIA: 0.7222  NORMAL: 0.7281 
RECALL - ALL: 0.7649  COVID-19: 0.6500  PNEUMONIA: 0.7800  NORMAL: 0.8646 
F1 - ALL: 0.7625  COVID-19: 0.7471  PNEUMONIA: 0.7500  NORMAL: 0.7905 

Epoch 3/19
----------
[train]
LOSS - 0.1336
ACC - 0.9600
PPV - ALL: 1.0000  COVID-19: 1.0000  PNEUMONIA: 1.0000  NORMAL: 1.0000 
RECALL - ALL: 1.0000  COVID-19: 1.0000  PNEUMONIA: 1.0000  NORMAL: 1.0000 
F1 - ALL: 1.0000  COVID-19: 1.0000  PNEUMONIA: 1.0000  NORMAL: 1.0000 
Mask ratio's range: 1.0 ~ 1.0

[val]
LOSS - 0.6002
ACC - 0.7833
PPV - ALL: 0.7972  COVID-19: 0.8409  PNEUMONIA: 0.7568  NORMAL: 0.7938 
RECALL - ALL: 0.7940  COVID-19: 0.7400  PNEUMONIA: 0.8400  NORMAL: 0.8021 
F1 - ALL: 0.7938  COVID-19: 0.7872  PNEUMONIA: 0.7962  NORMAL: 0.7979 

Epoch 4/19
----------
[train]
LOSS - 0.0553
ACC - 0.9600
PPV - ALL: 1.0000  COVID-19: 1.0000  PNEUMONIA: 1.0000  NORMAL: 1.0000 
RECALL - ALL: 1.0000  COVID-19: 1.0000  PNEUMONIA: 1.0000  NORMAL: 1.0000 
F1 - ALL: 1.0000  COVID-19: 1.0000  PNEUMONIA: 1.0000  NORMAL: 1.0000 
Mask ratio's range: 0.9375 ~ 1.0

[val]
LOSS - 0.5748
ACC - 0.7900
PPV - ALL: 0.8052  COVID-19: 0.8721  PNEUMONIA: 0.7593  NORMAL: 0.7843 
RECALL - ALL: 0.8011  COVID-19: 0.7500  PNEUMONIA: 0.8200  NORMAL: 0.8333 
F1 - ALL: 0.8010  COVID-19: 0.8065  PNEUMONIA: 0.7885  NORMAL: 0.8081 

Epoch 5/19
----------
[train]
LOSS - 0.0362
ACC - 0.9600
PPV - ALL: 1.0000  COVID-19: 1.0000  PNEUMONIA: 1.0000  NORMAL: 1.0000 
RECALL - ALL: 1.0000  COVID-19: 1.0000  PNEUMONIA: 1.0000  NORMAL: 1.0000 
F1 - ALL: 1.0000  COVID-19: 1.0000  PNEUMONIA: 1.0000  NORMAL: 1.0000 
Mask ratio's range: 0.9375 ~ 1.0

[val]
LOSS - 0.5635
ACC - 0.7900
PPV - ALL: 0.8040  COVID-19: 0.8636  PNEUMONIA: 0.7642  NORMAL: 0.7843 
RECALL - ALL: 0.8011  COVID-19: 0.7600  PNEUMONIA: 0.8100  NORMAL: 0.8333 
F1 - ALL: 0.8010  COVID-19: 0.8085  PNEUMONIA: 0.7864  NORMAL: 0.8081 

Epoch 6/19
----------
[train]
LOSS - 0.0350
ACC - 0.9600
PPV - ALL: 1.0000  COVID-19: 1.0000  PNEUMONIA: 1.0000  NORMAL: 1.0000 
RECALL - ALL: 1.0000  COVID-19: 1.0000  PNEUMONIA: 1.0000  NORMAL: 1.0000 
F1 - ALL: 1.0000  COVID-19: 1.0000  PNEUMONIA: 1.0000  NORMAL: 1.0000 
Mask ratio's range: 0.9375 ~ 1.0

[val]
LOSS - 0.5488
ACC - 0.7900
PPV - ALL: 0.8036  COVID-19: 0.8556  PNEUMONIA: 0.7593  NORMAL: 0.7959 
RECALL - ALL: 0.8008  COVID-19: 0.7700  PNEUMONIA: 0.8200  NORMAL: 0.8125 
F1 - ALL: 0.8010  COVID-19: 0.8105  PNEUMONIA: 0.7885  NORMAL: 0.8041 

Epoch 7/19
----------
[train]
LOSS - 0.0204
ACC - 0.9600
PPV - ALL: 1.0000  COVID-19: 1.0000  PNEUMONIA: 1.0000  NORMAL: 1.0000 
RECALL - ALL: 1.0000  COVID-19: 1.0000  PNEUMONIA: 1.0000  NORMAL: 1.0000 
F1 - ALL: 1.0000  COVID-19: 1.0000  PNEUMONIA: 1.0000  NORMAL: 1.0000 
Mask ratio's range: 0.9375 ~ 1.0

[val]
LOSS - 0.5361
ACC - 0.8000
PPV - ALL: 0.8137  COVID-19: 0.8667  PNEUMONIA: 0.7664  NORMAL: 0.8081 
RECALL - ALL: 0.8111  COVID-19: 0.7800  PNEUMONIA: 0.8200  NORMAL: 0.8333 
F1 - ALL: 0.8113  COVID-19: 0.8211  PNEUMONIA: 0.7923  NORMAL: 0.8205 

Epoch 8/19
----------
[train]
LOSS - 0.0196
ACC - 0.9600
PPV - ALL: 1.0000  COVID-19: 1.0000  PNEUMONIA: 1.0000  NORMAL: 1.0000 
RECALL - ALL: 1.0000  COVID-19: 1.0000  PNEUMONIA: 1.0000  NORMAL: 1.0000 
F1 - ALL: 1.0000  COVID-19: 1.0000  PNEUMONIA: 1.0000  NORMAL: 1.0000 
Mask ratio's range: 0.9375 ~ 1.0

[val]
LOSS - 0.5372
ACC - 0.7833
PPV - ALL: 0.7991  COVID-19: 0.8605  PNEUMONIA: 0.7387  NORMAL: 0.7980 
RECALL - ALL: 0.7943  COVID-19: 0.7400  PNEUMONIA: 0.8200  NORMAL: 0.8229 
F1 - ALL: 0.7944  COVID-19: 0.7957  PNEUMONIA: 0.7772  NORMAL: 0.8103 

Epoch 9/19
----------
[train]
LOSS - 0.0193
ACC - 0.9600
PPV - ALL: 1.0000  COVID-19: 1.0000  PNEUMONIA: 1.0000  NORMAL: 1.0000 
RECALL - ALL: 1.0000  COVID-19: 1.0000  PNEUMONIA: 1.0000  NORMAL: 1.0000 
F1 - ALL: 1.0000  COVID-19: 1.0000  PNEUMONIA: 1.0000  NORMAL: 1.0000 
Mask ratio's range: 0.875 ~ 1.0

[val]
LOSS - 0.5408
ACC - 0.7867
PPV - ALL: 0.8031  COVID-19: 0.8621  PNEUMONIA: 0.7368  NORMAL: 0.8105 
RECALL - ALL: 0.7974  COVID-19: 0.7500  PNEUMONIA: 0.8400  NORMAL: 0.8021 
F1 - ALL: 0.7978  COVID-19: 0.8022  PNEUMONIA: 0.7850  NORMAL: 0.8063 

Epoch 10/19
----------
[train]
LOSS - 0.0272
ACC - 0.9600
PPV - ALL: 1.0000  COVID-19: 1.0000  PNEUMONIA: 1.0000  NORMAL: 1.0000 
RECALL - ALL: 1.0000  COVID-19: 1.0000  PNEUMONIA: 1.0000  NORMAL: 1.0000 
F1 - ALL: 1.0000  COVID-19: 1.0000  PNEUMONIA: 1.0000  NORMAL: 1.0000 
Mask ratio's range: 0.875 ~ 1.0

[val]
LOSS - 0.5372
ACC - 0.7833
PPV - ALL: 0.8022  COVID-19: 0.8675  PNEUMONIA: 0.7265  NORMAL: 0.8125 
RECALL - ALL: 0.7942  COVID-19: 0.7200  PNEUMONIA: 0.8500  NORMAL: 0.8125 
F1 - ALL: 0.7943  COVID-19: 0.7869  PNEUMONIA: 0.7834  NORMAL: 0.8125 

Epoch 11/19
----------
[train]
LOSS - 0.0201
ACC - 0.9600
PPV - ALL: 1.0000  COVID-19: 1.0000  PNEUMONIA: 1.0000  NORMAL: 1.0000 
RECALL - ALL: 1.0000  COVID-19: 1.0000  PNEUMONIA: 1.0000  NORMAL: 1.0000 
F1 - ALL: 1.0000  COVID-19: 1.0000  PNEUMONIA: 1.0000  NORMAL: 1.0000 
Mask ratio's range: 0.875 ~ 0.9375

[val]
LOSS - 0.5569
ACC - 0.7633
PPV - ALL: 0.7896  COVID-19: 0.8590  PNEUMONIA: 0.6875  NORMAL: 0.8222 
RECALL - ALL: 0.7736  COVID-19: 0.6700  PNEUMONIA: 0.8800  NORMAL: 0.7708 
F1 - ALL: 0.7735  COVID-19: 0.7528  PNEUMONIA: 0.7719  NORMAL: 0.7957 

Epoch 12/19
----------
[train]
LOSS - 0.0246
ACC - 0.9600
PPV - ALL: 1.0000  COVID-19: 1.0000  PNEUMONIA: 1.0000  NORMAL: 1.0000 
RECALL - ALL: 1.0000  COVID-19: 1.0000  PNEUMONIA: 1.0000  NORMAL: 1.0000 
F1 - ALL: 1.0000  COVID-19: 1.0000  PNEUMONIA: 1.0000  NORMAL: 1.0000 
Mask ratio's range: 0.8125 ~ 0.9375

[val]
LOSS - 0.5597
ACC - 0.7633
PPV - ALL: 0.7883  COVID-19: 0.8553  PNEUMONIA: 0.6905  NORMAL: 0.8191 
RECALL - ALL: 0.7740  COVID-19: 0.6500  PNEUMONIA: 0.8700  NORMAL: 0.8021 
F1 - ALL: 0.7730  COVID-19: 0.7387  PNEUMONIA: 0.7699  NORMAL: 0.8105 

Epoch 13/19
----------
[train]
LOSS - 0.0305
ACC - 0.9600
PPV - ALL: 1.0000  COVID-19: 1.0000  PNEUMONIA: 1.0000  NORMAL: 1.0000 
RECALL - ALL: 1.0000  COVID-19: 1.0000  PNEUMONIA: 1.0000  NORMAL: 1.0000 
F1 - ALL: 1.0000  COVID-19: 1.0000  PNEUMONIA: 1.0000  NORMAL: 1.0000 
Mask ratio's range: 0.6875 ~ 0.875

[val]
LOSS - 0.5661
ACC - 0.7567
PPV - ALL: 0.7870  COVID-19: 0.8630  PNEUMONIA: 0.6718  NORMAL: 0.8261 
RECALL - ALL: 0.7672  COVID-19: 0.6300  PNEUMONIA: 0.8800  NORMAL: 0.7917 
F1 - ALL: 0.7662  COVID-19: 0.7283  PNEUMONIA: 0.7619  NORMAL: 0.8085 

Epoch 14/19
----------
[train]
LOSS - 0.0419
ACC - 0.9600
PPV - ALL: 1.0000  COVID-19: 1.0000  PNEUMONIA: 1.0000  NORMAL: 1.0000 
RECALL - ALL: 1.0000  COVID-19: 1.0000  PNEUMONIA: 1.0000  NORMAL: 1.0000 
F1 - ALL: 1.0000  COVID-19: 1.0000  PNEUMONIA: 1.0000  NORMAL: 1.0000 
Mask ratio's range: 0.625 ~ 0.875

[val]
LOSS - 0.6034
ACC - 0.7433
PPV - ALL: 0.7777  COVID-19: 0.8611  PNEUMONIA: 0.6519  NORMAL: 0.8202 
RECALL - ALL: 0.7535  COVID-19: 0.6200  PNEUMONIA: 0.8800  NORMAL: 0.7604 
F1 - ALL: 0.7530  COVID-19: 0.7209  PNEUMONIA: 0.7490  NORMAL: 0.7892 

Epoch 15/19
----------
[train]
LOSS - 0.0390
ACC - 0.9600
PPV - ALL: 1.0000  COVID-19: 1.0000  PNEUMONIA: 1.0000  NORMAL: 1.0000 
RECALL - ALL: 1.0000  COVID-19: 1.0000  PNEUMONIA: 1.0000  NORMAL: 1.0000 
F1 - ALL: 1.0000  COVID-19: 1.0000  PNEUMONIA: 1.0000  NORMAL: 1.0000 
Mask ratio's range: 0.625 ~ 0.875

[val]
LOSS - 0.6114
ACC - 0.7267
PPV - ALL: 0.7649  COVID-19: 0.8571  PNEUMONIA: 0.6331  NORMAL: 0.8046 
RECALL - ALL: 0.7364  COVID-19: 0.6000  PNEUMONIA: 0.8800  NORMAL: 0.7292 
F1 - ALL: 0.7358  COVID-19: 0.7059  PNEUMONIA: 0.7364  NORMAL: 0.7650 

Epoch 16/19
----------
[train]
LOSS - 0.0499
ACC - 0.9600
PPV - ALL: 1.0000  COVID-19: 1.0000  PNEUMONIA: 1.0000  NORMAL: 1.0000 
RECALL - ALL: 1.0000  COVID-19: 1.0000  PNEUMONIA: 1.0000  NORMAL: 1.0000 
F1 - ALL: 1.0000  COVID-19: 1.0000  PNEUMONIA: 1.0000  NORMAL: 1.0000 
Mask ratio's range: 0.5625 ~ 0.875

[val]
LOSS - 0.6543
ACC - 0.7067
PPV - ALL: 0.7640  COVID-19: 0.8793  PNEUMONIA: 0.5987  NORMAL: 0.8140 
RECALL - ALL: 0.7164  COVID-19: 0.5100  PNEUMONIA: 0.9100  NORMAL: 0.7292 
F1 - ALL: 0.7124  COVID-19: 0.6456  PNEUMONIA: 0.7222  NORMAL: 0.7693 

Epoch 17/19
----------
[train]
LOSS - 0.0496
ACC - 0.9600
PPV - ALL: 1.0000  COVID-19: 1.0000  PNEUMONIA: 1.0000  NORMAL: 1.0000 
RECALL - ALL: 1.0000  COVID-19: 1.0000  PNEUMONIA: 1.0000  NORMAL: 1.0000 
F1 - ALL: 1.0000  COVID-19: 1.0000  PNEUMONIA: 1.0000  NORMAL: 1.0000 
Mask ratio's range: 0.5625 ~ 0.75

[val]
LOSS - 0.7164
ACC - 0.7033
PPV - ALL: 0.7624  COVID-19: 0.8929  PNEUMONIA: 0.5987  NORMAL: 0.7955 
RECALL - ALL: 0.7131  COVID-19: 0.5000  PNEUMONIA: 0.9100  NORMAL: 0.7292 
F1 - ALL: 0.7080  COVID-19: 0.6410  PNEUMONIA: 0.7222  NORMAL: 0.7609 

Epoch 18/19
----------
[train]
LOSS - 0.0451
ACC - 0.9600
PPV - ALL: 1.0000  COVID-19: 1.0000  PNEUMONIA: 1.0000  NORMAL: 1.0000 
RECALL - ALL: 1.0000  COVID-19: 1.0000  PNEUMONIA: 1.0000  NORMAL: 1.0000 
F1 - ALL: 1.0000  COVID-19: 1.0000  PNEUMONIA: 1.0000  NORMAL: 1.0000 
Mask ratio's range: 0.5625 ~ 0.75

[val]
LOSS - 0.7685
ACC - 0.6800
PPV - ALL: 0.7524  COVID-19: 0.8776  PNEUMONIA: 0.5679  NORMAL: 0.8118 
RECALL - ALL: 0.6896  COVID-19: 0.4300  PNEUMONIA: 0.9200  NORMAL: 0.7188 
F1 - ALL: 0.6807  COVID-19: 0.5772  PNEUMONIA: 0.7023  NORMAL: 0.7625 

Epoch 19/19
----------
[train]
LOSS - 0.0464
ACC - 0.9600
PPV - ALL: 1.0000  COVID-19: 1.0000  PNEUMONIA: 1.0000  NORMAL: 1.0000 
RECALL - ALL: 1.0000  COVID-19: 1.0000  PNEUMONIA: 1.0000  NORMAL: 1.0000 
F1 - ALL: 1.0000  COVID-19: 1.0000  PNEUMONIA: 1.0000  NORMAL: 1.0000 
Mask ratio's range: 0.5 ~ 0.6875

[val]
LOSS - 0.8002
ACC - 0.6800
PPV - ALL: 0.7595  COVID-19: 0.8936  PNEUMONIA: 0.5636  NORMAL: 0.8214 
RECALL - ALL: 0.6896  COVID-19: 0.4200  PNEUMONIA: 0.9300  NORMAL: 0.7188 
F1 - ALL: 0.6800  COVID-19: 0.5714  PNEUMONIA: 0.7019  NORMAL: 0.7667 


--------------------
[Best results]
ACC - 0.8000
PPV - ALL: 0.8137  COVID-19: 0.8667  PNEUMONIA: 0.7664  NORMAL: 0.8081 
RECALL - ALL: 0.8111  COVID-19: 0.7800  PNEUMONIA: 0.8200  NORMAL: 0.8333 
F1 - ALL: 0.8113  COVID-19: 0.8211  PNEUMONIA: 0.7923  NORMAL: 0.8205 

Training complete in 1m 30s
-------------------- 

--------------------
Model 2
--------------------

Epoch 0/19
----------
[train]
LOSS - 1.0195
ACC - 0.4133
PPV - ALL: 0.4462  COVID-19: 0.3214  PNEUMONIA: 0.5556  NORMAL: 0.4615 
RECALL - ALL: 0.4306  COVID-19: 0.3750  PNEUMONIA: 0.4167  NORMAL: 0.5000 
F1 - ALL: 0.4341  COVID-19: 0.3461  PNEUMONIA: 0.4762  NORMAL: 0.4800 
Mask ratio's range: 1.0 ~ 1.0

[val]
LOSS - 0.9858
ACC - 0.5500
PPV - ALL: 0.7028  COVID-19: 1.0000  PNEUMONIA: 0.5743  NORMAL: 0.5342 
RECALL - ALL: 0.5608  COVID-19: 0.0200  PNEUMONIA: 0.8500  NORMAL: 0.8125 
F1 - ALL: 0.4564  COVID-19: 0.0392  PNEUMONIA: 0.6855  NORMAL: 0.6446 

Epoch 1/19
----------
[train]
LOSS - 0.6956
ACC - 0.8533
PPV - ALL: 0.9013  COVID-19: 0.9474  PNEUMONIA: 0.9565  NORMAL: 0.8000 
RECALL - ALL: 0.8889  COVID-19: 0.7500  PNEUMONIA: 0.9167  NORMAL: 1.0000 
F1 - ALL: 0.8874  COVID-19: 0.8372  PNEUMONIA: 0.9362  NORMAL: 0.8889 
Mask ratio's range: 1.0 ~ 1.0

[val]
LOSS - 0.7608
ACC - 0.7767
PPV - ALL: 0.7914  COVID-19: 0.7615  PNEUMONIA: 0.8434  NORMAL: 0.7692 
RECALL - ALL: 0.7878  COVID-19: 0.8300  PNEUMONIA: 0.7000  NORMAL: 0.8333 
F1 - ALL: 0.7864  COVID-19: 0.7943  PNEUMONIA: 0.7650  NORMAL: 0.8000 

Epoch 2/19
----------
[train]
LOSS - 0.2863
ACC - 0.9600
PPV - ALL: 1.0000  COVID-19: 1.0000  PNEUMONIA: 1.0000  NORMAL: 1.0000 
RECALL - ALL: 1.0000  COVID-19: 1.0000  PNEUMONIA: 1.0000  NORMAL: 1.0000 
F1 - ALL: 1.0000  COVID-19: 1.0000  PNEUMONIA: 1.0000  NORMAL: 1.0000 
Mask ratio's range: 1.0 ~ 1.0

[val]
LOSS - 0.6003
ACC - 0.7700
PPV - ALL: 0.8044  COVID-19: 0.9394  PNEUMONIA: 0.7097  NORMAL: 0.7642 
RECALL - ALL: 0.7813  COVID-19: 0.6200  PNEUMONIA: 0.8800  NORMAL: 0.8438 
F1 - ALL: 0.7782  COVID-19: 0.7470  PNEUMONIA: 0.7857  NORMAL: 0.8020 

Epoch 3/19
----------
[train]
LOSS - 0.1051
ACC - 0.9600
PPV - ALL: 1.0000  COVID-19: 1.0000  PNEUMONIA: 1.0000  NORMAL: 1.0000 
RECALL - ALL: 1.0000  COVID-19: 1.0000  PNEUMONIA: 1.0000  NORMAL: 1.0000 
F1 - ALL: 1.0000  COVID-19: 1.0000  PNEUMONIA: 1.0000  NORMAL: 1.0000 
Mask ratio's range: 1.0 ~ 1.0

[val]
LOSS - 0.5159
ACC - 0.8067
PPV - ALL: 0.8174  COVID-19: 0.8350  PNEUMONIA: 0.8020  NORMAL: 0.8152 
RECALL - ALL: 0.8171  COVID-19: 0.8600  PNEUMONIA: 0.8100  NORMAL: 0.7812 
F1 - ALL: 0.8170  COVID-19: 0.8473  PNEUMONIA: 0.8060  NORMAL: 0.7978 

Epoch 4/19
----------
[train]
LOSS - 0.0489
ACC - 0.9600
PPV - ALL: 1.0000  COVID-19: 1.0000  PNEUMONIA: 1.0000  NORMAL: 1.0000 
RECALL - ALL: 1.0000  COVID-19: 1.0000  PNEUMONIA: 1.0000  NORMAL: 1.0000 
F1 - ALL: 1.0000  COVID-19: 1.0000  PNEUMONIA: 1.0000  NORMAL: 1.0000 
Mask ratio's range: 0.875 ~ 1.0

[val]
LOSS - 0.5289
ACC - 0.8233
PPV - ALL: 0.8374  COVID-19: 0.8913  PNEUMONIA: 0.7928  NORMAL: 0.8280 
RECALL - ALL: 0.8340  COVID-19: 0.8200  PNEUMONIA: 0.8800  NORMAL: 0.8021 
F1 - ALL: 0.8344  COVID-19: 0.8542  PNEUMONIA: 0.8341  NORMAL: 0.8148 

Epoch 5/19
----------
[train]
LOSS - 0.0434
ACC - 0.9600
PPV - ALL: 1.0000  COVID-19: 1.0000  PNEUMONIA: 1.0000  NORMAL: 1.0000 
RECALL - ALL: 1.0000  COVID-19: 1.0000  PNEUMONIA: 1.0000  NORMAL: 1.0000 
F1 - ALL: 1.0000  COVID-19: 1.0000  PNEUMONIA: 1.0000  NORMAL: 1.0000 
Mask ratio's range: 0.875 ~ 1.0

[val]
LOSS - 0.4893
ACC - 0.8100
PPV - ALL: 0.8279  COVID-19: 0.9059  PNEUMONIA: 0.7672  NORMAL: 0.8105 
RECALL - ALL: 0.8207  COVID-19: 0.7700  PNEUMONIA: 0.8900  NORMAL: 0.8021 
F1 - ALL: 0.8209  COVID-19: 0.8324  PNEUMONIA: 0.8241  NORMAL: 0.8063 

Epoch 6/19
----------
[train]
LOSS - 0.0451
ACC - 0.9600
PPV - ALL: 1.0000  COVID-19: 1.0000  PNEUMONIA: 1.0000  NORMAL: 1.0000 
RECALL - ALL: 1.0000  COVID-19: 1.0000  PNEUMONIA: 1.0000  NORMAL: 1.0000 
F1 - ALL: 1.0000  COVID-19: 1.0000  PNEUMONIA: 1.0000  NORMAL: 1.0000 
Mask ratio's range: 0.75 ~ 1.0

[val]
LOSS - 0.5270
ACC - 0.8200
PPV - ALL: 0.8342  COVID-19: 0.9011  PNEUMONIA: 0.7909  NORMAL: 0.8105 
RECALL - ALL: 0.8307  COVID-19: 0.8200  PNEUMONIA: 0.8700  NORMAL: 0.8021 
F1 - ALL: 0.8312  COVID-19: 0.8586  PNEUMONIA: 0.8286  NORMAL: 0.8063 

Epoch 7/19
----------
[train]
LOSS - 0.0479
ACC - 0.9600
PPV - ALL: 1.0000  COVID-19: 1.0000  PNEUMONIA: 1.0000  NORMAL: 1.0000 
RECALL - ALL: 1.0000  COVID-19: 1.0000  PNEUMONIA: 1.0000  NORMAL: 1.0000 
F1 - ALL: 1.0000  COVID-19: 1.0000  PNEUMONIA: 1.0000  NORMAL: 1.0000 
Mask ratio's range: 0.75 ~ 1.0

[val]
LOSS - 0.4931
ACC - 0.8233
PPV - ALL: 0.8421  COVID-19: 0.9405  PNEUMONIA: 0.7857  NORMAL: 0.8000 
RECALL - ALL: 0.8344  COVID-19: 0.7900  PNEUMONIA: 0.8800  NORMAL: 0.8333 
F1 - ALL: 0.8351  COVID-19: 0.8587  PNEUMONIA: 0.8302  NORMAL: 0.8163 

Epoch 8/19
----------
[train]
LOSS - 0.0417
ACC - 0.9600
PPV - ALL: 1.0000  COVID-19: 1.0000  PNEUMONIA: 1.0000  NORMAL: 1.0000 
RECALL - ALL: 1.0000  COVID-19: 1.0000  PNEUMONIA: 1.0000  NORMAL: 1.0000 
F1 - ALL: 1.0000  COVID-19: 1.0000  PNEUMONIA: 1.0000  NORMAL: 1.0000 
Mask ratio's range: 0.75 ~ 0.9375

[val]
LOSS - 0.4862
ACC - 0.8133
PPV - ALL: 0.8351  COVID-19: 0.9500  PNEUMONIA: 0.7838  NORMAL: 0.7714 
RECALL - ALL: 0.8246  COVID-19: 0.7600  PNEUMONIA: 0.8700  NORMAL: 0.8438 
F1 - ALL: 0.8250  COVID-19: 0.8444  PNEUMONIA: 0.8247  NORMAL: 0.8060 

Epoch 9/19
----------
[train]
LOSS - 0.0395
ACC - 0.9600
PPV - ALL: 1.0000  COVID-19: 1.0000  PNEUMONIA: 1.0000  NORMAL: 1.0000 
RECALL - ALL: 1.0000  COVID-19: 1.0000  PNEUMONIA: 1.0000  NORMAL: 1.0000 
F1 - ALL: 1.0000  COVID-19: 1.0000  PNEUMONIA: 1.0000  NORMAL: 1.0000 
Mask ratio's range: 0.75 ~ 0.875

[val]
LOSS - 0.4770
ACC - 0.8100
PPV - ALL: 0.8330  COVID-19: 0.9487  PNEUMONIA: 0.7909  NORMAL: 0.7593 
RECALL - ALL: 0.8214  COVID-19: 0.7400  PNEUMONIA: 0.8700  NORMAL: 0.8542 
F1 - ALL: 0.8214  COVID-19: 0.8315  PNEUMONIA: 0.8286  NORMAL: 0.8040 

Epoch 10/19
----------
[train]
LOSS - 0.0778
ACC - 0.9600
PPV - ALL: 1.0000  COVID-19: 1.0000  PNEUMONIA: 1.0000  NORMAL: 1.0000 
RECALL - ALL: 1.0000  COVID-19: 1.0000  PNEUMONIA: 1.0000  NORMAL: 1.0000 
F1 - ALL: 1.0000  COVID-19: 1.0000  PNEUMONIA: 1.0000  NORMAL: 1.0000 
Mask ratio's range: 0.625 ~ 0.875

[val]
LOSS - 0.4616
ACC - 0.8167
PPV - ALL: 0.8383  COVID-19: 0.9500  PNEUMONIA: 0.8056  NORMAL: 0.7593 
RECALL - ALL: 0.8281  COVID-19: 0.7600  PNEUMONIA: 0.8700  NORMAL: 0.8542 
F1 - ALL: 0.8283  COVID-19: 0.8444  PNEUMONIA: 0.8366  NORMAL: 0.8040 

Epoch 11/19
----------
[train]
LOSS - 0.0705
ACC - 0.9600
PPV - ALL: 1.0000  COVID-19: 1.0000  PNEUMONIA: 1.0000  NORMAL: 1.0000 
RECALL - ALL: 1.0000  COVID-19: 1.0000  PNEUMONIA: 1.0000  NORMAL: 1.0000 
F1 - ALL: 1.0000  COVID-19: 1.0000  PNEUMONIA: 1.0000  NORMAL: 1.0000 
Mask ratio's range: 0.5625 ~ 0.875

[val]
LOSS - 0.5074
ACC - 0.7933
PPV - ALL: 0.8201  COVID-19: 0.9452  PNEUMONIA: 0.7719  NORMAL: 0.7431 
RECALL - ALL: 0.8046  COVID-19: 0.6900  PNEUMONIA: 0.8800  NORMAL: 0.8438 
F1 - ALL: 0.8035  COVID-19: 0.7977  PNEUMONIA: 0.8224  NORMAL: 0.7903 

Epoch 12/19
----------
[train]
LOSS - 0.0829
ACC - 0.9600
PPV - ALL: 1.0000  COVID-19: 1.0000  PNEUMONIA: 1.0000  NORMAL: 1.0000 
RECALL - ALL: 1.0000  COVID-19: 1.0000  PNEUMONIA: 1.0000  NORMAL: 1.0000 
F1 - ALL: 1.0000  COVID-19: 1.0000  PNEUMONIA: 1.0000  NORMAL: 1.0000 
Mask ratio's range: 0.4375 ~ 0.8125

[val]
LOSS - 0.5473
ACC - 0.7800
PPV - ALL: 0.8129  COVID-19: 0.9559  PNEUMONIA: 0.7699  NORMAL: 0.7130 
RECALL - ALL: 0.7914  COVID-19: 0.6500  PNEUMONIA: 0.8700  NORMAL: 0.8542 
F1 - ALL: 0.7893  COVID-19: 0.7738  PNEUMONIA: 0.8169  NORMAL: 0.7772 

Epoch 13/19
----------
[train]
LOSS - 0.0543
ACC - 0.9600
PPV - ALL: 1.0000  COVID-19: 1.0000  PNEUMONIA: 1.0000  NORMAL: 1.0000 
RECALL - ALL: 1.0000  COVID-19: 1.0000  PNEUMONIA: 1.0000  NORMAL: 1.0000 
F1 - ALL: 1.0000  COVID-19: 1.0000  PNEUMONIA: 1.0000  NORMAL: 1.0000 
Mask ratio's range: 0.4375 ~ 0.8125

[val]
LOSS - 0.5622
ACC - 0.7633
PPV - ALL: 0.7976  COVID-19: 0.9385  PNEUMONIA: 0.7311  NORMAL: 0.7232 
RECALL - ALL: 0.7746  COVID-19: 0.6100  PNEUMONIA: 0.8700  NORMAL: 0.8438 
F1 - ALL: 0.7709  COVID-19: 0.7394  PNEUMONIA: 0.7945  NORMAL: 0.7789 

Epoch 14/19
----------
[train]
LOSS - 0.0477
ACC - 0.9600
PPV - ALL: 1.0000  COVID-19: 1.0000  PNEUMONIA: 1.0000  NORMAL: 1.0000 
RECALL - ALL: 1.0000  COVID-19: 1.0000  PNEUMONIA: 1.0000  NORMAL: 1.0000 
F1 - ALL: 1.0000  COVID-19: 1.0000  PNEUMONIA: 1.0000  NORMAL: 1.0000 
Mask ratio's range: 0.4375 ~ 0.8125

[val]
LOSS - 0.5726
ACC - 0.7733
PPV - ALL: 0.8088  COVID-19: 0.9538  PNEUMONIA: 0.7250  NORMAL: 0.7477 
RECALL - ALL: 0.7849  COVID-19: 0.6200  PNEUMONIA: 0.8700  NORMAL: 0.8646 
F1 - ALL: 0.7814  COVID-19: 0.7515  PNEUMONIA: 0.7909  NORMAL: 0.8019 

Epoch 15/19
----------
[train]
LOSS - 0.0429
ACC - 0.9600
PPV - ALL: 1.0000  COVID-19: 1.0000  PNEUMONIA: 1.0000  NORMAL: 1.0000 
RECALL - ALL: 1.0000  COVID-19: 1.0000  PNEUMONIA: 1.0000  NORMAL: 1.0000 
F1 - ALL: 1.0000  COVID-19: 1.0000  PNEUMONIA: 1.0000  NORMAL: 1.0000 
Mask ratio's range: 0.4375 ~ 0.8125

[val]
LOSS - 0.5651
ACC - 0.7700
PPV - ALL: 0.8061  COVID-19: 0.9538  PNEUMONIA: 0.7190  NORMAL: 0.7455 
RECALL - ALL: 0.7814  COVID-19: 0.6200  PNEUMONIA: 0.8700  NORMAL: 0.8542 
F1 - ALL: 0.7783  COVID-19: 0.7515  PNEUMONIA: 0.7873  NORMAL: 0.7962 

Epoch 16/19
----------
[train]
LOSS - 0.0375
ACC - 0.9600
PPV - ALL: 1.0000  COVID-19: 1.0000  PNEUMONIA: 1.0000  NORMAL: 1.0000 
RECALL - ALL: 1.0000  COVID-19: 1.0000  PNEUMONIA: 1.0000  NORMAL: 1.0000 
F1 - ALL: 1.0000  COVID-19: 1.0000  PNEUMONIA: 1.0000  NORMAL: 1.0000 
Mask ratio's range: 0.4375 ~ 0.8125

[val]
LOSS - 0.5576
ACC - 0.7800
PPV - ALL: 0.8134  COVID-19: 0.9552  PNEUMONIA: 0.7373  NORMAL: 0.7477 
RECALL - ALL: 0.7915  COVID-19: 0.6400  PNEUMONIA: 0.8700  NORMAL: 0.8646 
F1 - ALL: 0.7889  COVID-19: 0.7665  PNEUMONIA: 0.7982  NORMAL: 0.8019 

Epoch 17/19
----------
[train]
LOSS - 0.0337
ACC - 0.9600
PPV - ALL: 1.0000  COVID-19: 1.0000  PNEUMONIA: 1.0000  NORMAL: 1.0000 
RECALL - ALL: 1.0000  COVID-19: 1.0000  PNEUMONIA: 1.0000  NORMAL: 1.0000 
F1 - ALL: 1.0000  COVID-19: 1.0000  PNEUMONIA: 1.0000  NORMAL: 1.0000 
Mask ratio's range: 0.4375 ~ 0.8125

[val]
LOSS - 0.5486
ACC - 0.7967
PPV - ALL: 0.8248  COVID-19: 0.9589  PNEUMONIA: 0.7679  NORMAL: 0.7477 
RECALL - ALL: 0.8082  COVID-19: 0.7000  PNEUMONIA: 0.8600  NORMAL: 0.8646 
F1 - ALL: 0.8075  COVID-19: 0.8092  PNEUMONIA: 0.8113  NORMAL: 0.8019 

Epoch 18/19
----------
[train]
LOSS - 0.0364
ACC - 0.9600
PPV - ALL: 1.0000  COVID-19: 1.0000  PNEUMONIA: 1.0000  NORMAL: 1.0000 
RECALL - ALL: 1.0000  COVID-19: 1.0000  PNEUMONIA: 1.0000  NORMAL: 1.0000 
F1 - ALL: 1.0000  COVID-19: 1.0000  PNEUMONIA: 1.0000  NORMAL: 1.0000 
Mask ratio's range: 0.4375 ~ 0.75

[val]
LOSS - 0.5548
ACC - 0.7933
PPV - ALL: 0.8229  COVID-19: 0.9577  PNEUMONIA: 0.7565  NORMAL: 0.7545 
RECALL - ALL: 0.8049  COVID-19: 0.6800  PNEUMONIA: 0.8700  NORMAL: 0.8646 
F1 - ALL: 0.8035  COVID-19: 0.7953  PNEUMONIA: 0.8093  NORMAL: 0.8058 

Epoch 19/19
----------
[train]
LOSS - 0.0338
ACC - 0.9600
PPV - ALL: 1.0000  COVID-19: 1.0000  PNEUMONIA: 1.0000  NORMAL: 1.0000 
RECALL - ALL: 1.0000  COVID-19: 1.0000  PNEUMONIA: 1.0000  NORMAL: 1.0000 
F1 - ALL: 1.0000  COVID-19: 1.0000  PNEUMONIA: 1.0000  NORMAL: 1.0000 
Mask ratio's range: 0.4375 ~ 0.6875

[val]
LOSS - 0.5890
ACC - 0.7833
PPV - ALL: 0.8162  COVID-19: 0.9552  PNEUMONIA: 0.7565  NORMAL: 0.7368 
RECALL - ALL: 0.7950  COVID-19: 0.6400  PNEUMONIA: 0.8700  NORMAL: 0.8750 
F1 - ALL: 0.7919  COVID-19: 0.7665  PNEUMONIA: 0.8093  NORMAL: 0.8000 


--------------------
[Best results]
ACC - 0.8233
PPV - ALL: 0.8374  COVID-19: 0.8913  PNEUMONIA: 0.7928  NORMAL: 0.8280 
RECALL - ALL: 0.8340  COVID-19: 0.8200  PNEUMONIA: 0.8800  NORMAL: 0.8021 
F1 - ALL: 0.8344  COVID-19: 0.8542  PNEUMONIA: 0.8341  NORMAL: 0.8148 

Training complete in 1m 29s
-------------------- 

--------------------
Model 3
--------------------

Epoch 0/19
----------
[train]
LOSS - 0.9902
ACC - 0.5333
PPV - ALL: 0.5548  COVID-19: 0.5714  PNEUMONIA: 0.5217  NORMAL: 0.5714 
RECALL - ALL: 0.5556  COVID-19: 0.5000  PNEUMONIA: 0.5000  NORMAL: 0.6667 
F1 - ALL: 0.5531  COVID-19: 0.5333  PNEUMONIA: 0.5106  NORMAL: 0.6154 
Mask ratio's range: 1.0 ~ 1.0

[val]
LOSS - 0.9684
ACC - 0.5367
PPV - ALL: 0.6399  COVID-19: 0.8684  PNEUMONIA: 0.5882  NORMAL: 0.4632 
RECALL - ALL: 0.5489  COVID-19: 0.3300  PNEUMONIA: 0.4000  NORMAL: 0.9167 
F1 - ALL: 0.5233  COVID-19: 0.4783  PNEUMONIA: 0.4762  NORMAL: 0.6154 

Epoch 1/19
----------
[train]
LOSS - 0.6022
ACC - 0.8933
PPV - ALL: 0.9363  COVID-19: 1.0000  PNEUMONIA: 0.9200  NORMAL: 0.8889 
RECALL - ALL: 0.9305  COVID-19: 0.8333  PNEUMONIA: 0.9583  NORMAL: 1.0000 
F1 - ALL: 0.9297  COVID-19: 0.9091  PNEUMONIA: 0.9388  NORMAL: 0.9412 
Mask ratio's range: 1.0 ~ 1.0

[val]
LOSS - 0.7117
ACC - 0.7867
PPV - ALL: 0.8022  COVID-19: 0.8690  PNEUMONIA: 0.7757  NORMAL: 0.7619 
RECALL - ALL: 0.7978  COVID-19: 0.7300  PNEUMONIA: 0.8300  NORMAL: 0.8333 
F1 - ALL: 0.7971  COVID-19: 0.7935  PNEUMONIA: 0.8019  NORMAL: 0.7960 

Epoch 2/19
----------
[train]
LOSS - 0.2429
ACC - 0.9600
PPV - ALL: 1.0000  COVID-19: 1.0000  PNEUMONIA: 1.0000  NORMAL: 1.0000 
RECALL - ALL: 1.0000  COVID-19: 1.0000  PNEUMONIA: 1.0000  NORMAL: 1.0000 
F1 - ALL: 1.0000  COVID-19: 1.0000  PNEUMONIA: 1.0000  NORMAL: 1.0000 
Mask ratio's range: 1.0 ~ 1.0

[val]
LOSS - 0.5699
ACC - 0.8233
PPV - ALL: 0.8362  COVID-19: 0.8660  PNEUMONIA: 0.7982  NORMAL: 0.8444 
RECALL - ALL: 0.8339  COVID-19: 0.8400  PNEUMONIA: 0.8700  NORMAL: 0.7917 
F1 - ALL: 0.8342  COVID-19: 0.8528  PNEUMONIA: 0.8326  NORMAL: 0.8172 

Epoch 3/19
----------
[train]
LOSS - 0.0866
ACC - 0.9600
PPV - ALL: 1.0000  COVID-19: 1.0000  PNEUMONIA: 1.0000  NORMAL: 1.0000 
RECALL - ALL: 1.0000  COVID-19: 1.0000  PNEUMONIA: 1.0000  NORMAL: 1.0000 
F1 - ALL: 1.0000  COVID-19: 1.0000  PNEUMONIA: 1.0000  NORMAL: 1.0000 
Mask ratio's range: 1.0 ~ 1.0

[val]
LOSS - 0.4983
ACC - 0.8167
PPV - ALL: 0.8292  COVID-19: 0.8485  PNEUMONIA: 0.7963  NORMAL: 0.8427 
RECALL - ALL: 0.8271  COVID-19: 0.8400  PNEUMONIA: 0.8600  NORMAL: 0.7812 
F1 - ALL: 0.8273  COVID-19: 0.8442  PNEUMONIA: 0.8269  NORMAL: 0.8108 

Epoch 4/19
----------
[train]
LOSS - 0.0367
ACC - 0.9600
PPV - ALL: 1.0000  COVID-19: 1.0000  PNEUMONIA: 1.0000  NORMAL: 1.0000 
RECALL - ALL: 1.0000  COVID-19: 1.0000  PNEUMONIA: 1.0000  NORMAL: 1.0000 
F1 - ALL: 1.0000  COVID-19: 1.0000  PNEUMONIA: 1.0000  NORMAL: 1.0000 
Mask ratio's range: 1.0 ~ 1.0

[val]
LOSS - 0.4677
ACC - 0.8200
PPV - ALL: 0.8329  COVID-19: 0.8500  PNEUMONIA: 0.7963  NORMAL: 0.8523 
RECALL - ALL: 0.8304  COVID-19: 0.8500  PNEUMONIA: 0.8600  NORMAL: 0.7812 
F1 - ALL: 0.8307  COVID-19: 0.8500  PNEUMONIA: 0.8269  NORMAL: 0.8152 

Epoch 5/19
----------
[train]
LOSS - 0.0365
ACC - 0.9600
PPV - ALL: 1.0000  COVID-19: 1.0000  PNEUMONIA: 1.0000  NORMAL: 1.0000 
RECALL - ALL: 1.0000  COVID-19: 1.0000  PNEUMONIA: 1.0000  NORMAL: 1.0000 
F1 - ALL: 1.0000  COVID-19: 1.0000  PNEUMONIA: 1.0000  NORMAL: 1.0000 
Mask ratio's range: 0.8125 ~ 1.0

[val]
LOSS - 0.4523
ACC - 0.8233
PPV - ALL: 0.8358  COVID-19: 0.8515  PNEUMONIA: 0.8019  NORMAL: 0.8539 
RECALL - ALL: 0.8339  COVID-19: 0.8600  PNEUMONIA: 0.8500  NORMAL: 0.7917 
F1 - ALL: 0.8342  COVID-19: 0.8557  PNEUMONIA: 0.8252  NORMAL: 0.8216 

Epoch 6/19
----------
[train]
LOSS - 0.0268
ACC - 0.9600
PPV - ALL: 1.0000  COVID-19: 1.0000  PNEUMONIA: 1.0000  NORMAL: 1.0000 
RECALL - ALL: 1.0000  COVID-19: 1.0000  PNEUMONIA: 1.0000  NORMAL: 1.0000 
F1 - ALL: 1.0000  COVID-19: 1.0000  PNEUMONIA: 1.0000  NORMAL: 1.0000 
Mask ratio's range: 0.75 ~ 1.0

[val]
LOSS - 0.4443
ACC - 0.8233
PPV - ALL: 0.8362  COVID-19: 0.8586  PNEUMONIA: 0.7944  NORMAL: 0.8556 
RECALL - ALL: 0.8340  COVID-19: 0.8500  PNEUMONIA: 0.8500  NORMAL: 0.8021 
F1 - ALL: 0.8345  COVID-19: 0.8543  PNEUMONIA: 0.8213  NORMAL: 0.8280 

Epoch 7/19
----------
[train]
LOSS - 0.0513
ACC - 0.9600
PPV - ALL: 1.0000  COVID-19: 1.0000  PNEUMONIA: 1.0000  NORMAL: 1.0000 
RECALL - ALL: 1.0000  COVID-19: 1.0000  PNEUMONIA: 1.0000  NORMAL: 1.0000 
F1 - ALL: 1.0000  COVID-19: 1.0000  PNEUMONIA: 1.0000  NORMAL: 1.0000 
Mask ratio's range: 0.75 ~ 1.0

[val]
LOSS - 0.4323
ACC - 0.8267
PPV - ALL: 0.8398  COVID-19: 0.8660  PNEUMONIA: 0.7963  NORMAL: 0.8571 
RECALL - ALL: 0.8375  COVID-19: 0.8400  PNEUMONIA: 0.8600  NORMAL: 0.8125 
F1 - ALL: 0.8380  COVID-19: 0.8528  PNEUMONIA: 0.8269  NORMAL: 0.8342 

Epoch 8/19
----------
[train]
LOSS - 0.0611
ACC - 0.9600
PPV - ALL: 1.0000  COVID-19: 1.0000  PNEUMONIA: 1.0000  NORMAL: 1.0000 
RECALL - ALL: 1.0000  COVID-19: 1.0000  PNEUMONIA: 1.0000  NORMAL: 1.0000 
F1 - ALL: 1.0000  COVID-19: 1.0000  PNEUMONIA: 1.0000  NORMAL: 1.0000 
Mask ratio's range: 0.6875 ~ 0.9375

[val]
LOSS - 0.4374
ACC - 0.8100
PPV - ALL: 0.8251  COVID-19: 0.8667  PNEUMONIA: 0.7699  NORMAL: 0.8387 
RECALL - ALL: 0.8208  COVID-19: 0.7800  PNEUMONIA: 0.8700  NORMAL: 0.8125 
F1 - ALL: 0.8211  COVID-19: 0.8211  PNEUMONIA: 0.8169  NORMAL: 0.8254 

Epoch 9/19
----------
[train]
LOSS - 0.0569
ACC - 0.9600
PPV - ALL: 1.0000  COVID-19: 1.0000  PNEUMONIA: 1.0000  NORMAL: 1.0000 
RECALL - ALL: 1.0000  COVID-19: 1.0000  PNEUMONIA: 1.0000  NORMAL: 1.0000 
F1 - ALL: 1.0000  COVID-19: 1.0000  PNEUMONIA: 1.0000  NORMAL: 1.0000 
Mask ratio's range: 0.625 ~ 0.875

[val]
LOSS - 0.4635
ACC - 0.8067
PPV - ALL: 0.8259  COVID-19: 0.9024  PNEUMONIA: 0.7627  NORMAL: 0.8125 
RECALL - ALL: 0.8175  COVID-19: 0.7400  PNEUMONIA: 0.9000  NORMAL: 0.8125 
F1 - ALL: 0.8171  COVID-19: 0.8132  PNEUMONIA: 0.8257  NORMAL: 0.8125 

Epoch 10/19
----------
[train]
LOSS - 0.0693
ACC - 0.9600
PPV - ALL: 1.0000  COVID-19: 1.0000  PNEUMONIA: 1.0000  NORMAL: 1.0000 
RECALL - ALL: 1.0000  COVID-19: 1.0000  PNEUMONIA: 1.0000  NORMAL: 1.0000 
F1 - ALL: 1.0000  COVID-19: 1.0000  PNEUMONIA: 1.0000  NORMAL: 1.0000 
Mask ratio's range: 0.625 ~ 0.8125

[val]
LOSS - 0.4946
ACC - 0.8033
PPV - ALL: 0.8253  COVID-19: 0.9231  PNEUMONIA: 0.7607  NORMAL: 0.7921 
RECALL - ALL: 0.8144  COVID-19: 0.7200  PNEUMONIA: 0.8900  NORMAL: 0.8333 
F1 - ALL: 0.8138  COVID-19: 0.8090  PNEUMONIA: 0.8203  NORMAL: 0.8122 

Epoch 11/19
----------
[train]
LOSS - 0.0471
ACC - 0.9600
PPV - ALL: 1.0000  COVID-19: 1.0000  PNEUMONIA: 1.0000  NORMAL: 1.0000 
RECALL - ALL: 1.0000  COVID-19: 1.0000  PNEUMONIA: 1.0000  NORMAL: 1.0000 
F1 - ALL: 1.0000  COVID-19: 1.0000  PNEUMONIA: 1.0000  NORMAL: 1.0000 
Mask ratio's range: 0.5625 ~ 0.8125

[val]
LOSS - 0.5006
ACC - 0.7967
PPV - ALL: 0.8299  COVID-19: 0.9714  PNEUMONIA: 0.7339  NORMAL: 0.7843 
RECALL - ALL: 0.8078  COVID-19: 0.6800  PNEUMONIA: 0.9100  NORMAL: 0.8333 
F1 - ALL: 0.8069  COVID-19: 0.8000  PNEUMONIA: 0.8125  NORMAL: 0.8081 

Epoch 12/19
----------
[train]
LOSS - 0.0583
ACC - 0.9600
PPV - ALL: 1.0000  COVID-19: 1.0000  PNEUMONIA: 1.0000  NORMAL: 1.0000 
RECALL - ALL: 1.0000  COVID-19: 1.0000  PNEUMONIA: 1.0000  NORMAL: 1.0000 
F1 - ALL: 1.0000  COVID-19: 1.0000  PNEUMONIA: 1.0000  NORMAL: 1.0000 
Mask ratio's range: 0.5 ~ 0.75

[val]
LOSS - 0.5612
ACC - 0.7833
PPV - ALL: 0.8183  COVID-19: 0.9706  PNEUMONIA: 0.7295  NORMAL: 0.7547 
RECALL - ALL: 0.7944  COVID-19: 0.6600  PNEUMONIA: 0.8900  NORMAL: 0.8333 
F1 - ALL: 0.7932  COVID-19: 0.7857  PNEUMONIA: 0.8018  NORMAL: 0.7921 

Epoch 13/19
----------
[train]
LOSS - 0.0484
ACC - 0.9600
PPV - ALL: 1.0000  COVID-19: 1.0000  PNEUMONIA: 1.0000  NORMAL: 1.0000 
RECALL - ALL: 1.0000  COVID-19: 1.0000  PNEUMONIA: 1.0000  NORMAL: 1.0000 
F1 - ALL: 1.0000  COVID-19: 1.0000  PNEUMONIA: 1.0000  NORMAL: 1.0000 
Mask ratio's range: 0.5 ~ 0.75

[val]
LOSS - 0.5415
ACC - 0.7867
PPV - ALL: 0.8214  COVID-19: 0.9706  PNEUMONIA: 0.7317  NORMAL: 0.7619 
RECALL - ALL: 0.7978  COVID-19: 0.6600  PNEUMONIA: 0.9000  NORMAL: 0.8333 
F1 - ALL: 0.7963  COVID-19: 0.7857  PNEUMONIA: 0.8072  NORMAL: 0.7960 

Epoch 14/19
----------
[train]
LOSS - 0.0433
ACC - 0.9600
PPV - ALL: 1.0000  COVID-19: 1.0000  PNEUMONIA: 1.0000  NORMAL: 1.0000 
RECALL - ALL: 1.0000  COVID-19: 1.0000  PNEUMONIA: 1.0000  NORMAL: 1.0000 
F1 - ALL: 1.0000  COVID-19: 1.0000  PNEUMONIA: 1.0000  NORMAL: 1.0000 
Mask ratio's range: 0.4375 ~ 0.6875

[val]
LOSS - 0.5500
ACC - 0.7833
PPV - ALL: 0.8148  COVID-19: 0.9571  PNEUMONIA: 0.7395  NORMAL: 0.7477 
RECALL - ALL: 0.7944  COVID-19: 0.6700  PNEUMONIA: 0.8800  NORMAL: 0.8333 
F1 - ALL: 0.7934  COVID-19: 0.7882  PNEUMONIA: 0.8037  NORMAL: 0.7882 

Epoch 15/19
----------
[train]
LOSS - 0.0438
ACC - 0.9600
PPV - ALL: 1.0000  COVID-19: 1.0000  PNEUMONIA: 1.0000  NORMAL: 1.0000 
RECALL - ALL: 1.0000  COVID-19: 1.0000  PNEUMONIA: 1.0000  NORMAL: 1.0000 
F1 - ALL: 1.0000  COVID-19: 1.0000  PNEUMONIA: 1.0000  NORMAL: 1.0000 
Mask ratio's range: 0.4375 ~ 0.625

[val]
LOSS - 0.5887
ACC - 0.7833
PPV - ALL: 0.8179  COVID-19: 0.9706  PNEUMONIA: 0.7355  NORMAL: 0.7477 
RECALL - ALL: 0.7944  COVID-19: 0.6600  PNEUMONIA: 0.8900  NORMAL: 0.8333 
F1 - ALL: 0.7931  COVID-19: 0.7857  PNEUMONIA: 0.8054  NORMAL: 0.7882 

Epoch 16/19
----------
[train]
LOSS - 0.0540
ACC - 0.9600
PPV - ALL: 1.0000  COVID-19: 1.0000  PNEUMONIA: 1.0000  NORMAL: 1.0000 
RECALL - ALL: 1.0000  COVID-19: 1.0000  PNEUMONIA: 1.0000  NORMAL: 1.0000 
F1 - ALL: 1.0000  COVID-19: 1.0000  PNEUMONIA: 1.0000  NORMAL: 1.0000 
Mask ratio's range: 0.4375 ~ 0.625

[val]
LOSS - 0.6458
ACC - 0.7733
PPV - ALL: 0.8184  COVID-19: 1.0000  PNEUMONIA: 0.7295  NORMAL: 0.7257 
RECALL - ALL: 0.7847  COVID-19: 0.6100  PNEUMONIA: 0.8900  NORMAL: 0.8542 
F1 - ALL: 0.7814  COVID-19: 0.7578  PNEUMONIA: 0.8018  NORMAL: 0.7847 

Epoch 17/19
----------
[train]
LOSS - 0.0263
ACC - 0.9600
PPV - ALL: 1.0000  COVID-19: 1.0000  PNEUMONIA: 1.0000  NORMAL: 1.0000 
RECALL - ALL: 1.0000  COVID-19: 1.0000  PNEUMONIA: 1.0000  NORMAL: 1.0000 
F1 - ALL: 1.0000  COVID-19: 1.0000  PNEUMONIA: 1.0000  NORMAL: 1.0000 
Mask ratio's range: 0.4375 ~ 0.625

[val]
LOSS - 0.6267
ACC - 0.7667
PPV - ALL: 0.8101  COVID-19: 0.9836  PNEUMONIA: 0.7273  NORMAL: 0.7193 
RECALL - ALL: 0.7781  COVID-19: 0.6000  PNEUMONIA: 0.8800  NORMAL: 0.8542 
F1 - ALL: 0.7742  COVID-19: 0.7453  PNEUMONIA: 0.7964  NORMAL: 0.7810 

Epoch 18/19
----------
[train]
LOSS - 0.0521
ACC - 0.9600
PPV - ALL: 1.0000  COVID-19: 1.0000  PNEUMONIA: 1.0000  NORMAL: 1.0000 
RECALL - ALL: 1.0000  COVID-19: 1.0000  PNEUMONIA: 1.0000  NORMAL: 1.0000 
F1 - ALL: 1.0000  COVID-19: 1.0000  PNEUMONIA: 1.0000  NORMAL: 1.0000 
Mask ratio's range: 0.3125 ~ 0.625

[val]
LOSS - 0.6465
ACC - 0.7600
PPV - ALL: 0.8058  COVID-19: 0.9831  PNEUMONIA: 0.7333  NORMAL: 0.7009 
RECALL - ALL: 0.7714  COVID-19: 0.5800  PNEUMONIA: 0.8800  NORMAL: 0.8542 
F1 - ALL: 0.7665  COVID-19: 0.7296  PNEUMONIA: 0.8000  NORMAL: 0.7700 

Epoch 19/19
----------
[train]
LOSS - 0.0413
ACC - 0.9600
PPV - ALL: 1.0000  COVID-19: 1.0000  PNEUMONIA: 1.0000  NORMAL: 1.0000 
RECALL - ALL: 1.0000  COVID-19: 1.0000  PNEUMONIA: 1.0000  NORMAL: 1.0000 
F1 - ALL: 1.0000  COVID-19: 1.0000  PNEUMONIA: 1.0000  NORMAL: 1.0000 
Mask ratio's range: 0.3125 ~ 0.625

[val]
LOSS - 0.6489
ACC - 0.7600
PPV - ALL: 0.8050  COVID-19: 0.9833  PNEUMONIA: 0.7273  NORMAL: 0.7043 
RECALL - ALL: 0.7713  COVID-19: 0.5900  PNEUMONIA: 0.8800  NORMAL: 0.8438 
F1 - ALL: 0.7672  COVID-19: 0.7375  PNEUMONIA: 0.7964  NORMAL: 0.7678 


--------------------
[Best results]
ACC - 0.8267
PPV - ALL: 0.8398  COVID-19: 0.8660  PNEUMONIA: 0.7963  NORMAL: 0.8571 
RECALL - ALL: 0.8375  COVID-19: 0.8400  PNEUMONIA: 0.8600  NORMAL: 0.8125 
F1 - ALL: 0.8380  COVID-19: 0.8528  PNEUMONIA: 0.8269  NORMAL: 0.8342 

Training complete in 1m 29s
-------------------- 

--------------------
Model 4
--------------------

Epoch 0/19
----------
[train]
LOSS - 1.0112
ACC - 0.5067
PPV - ALL: 0.5267  COVID-19: 0.4583  PNEUMONIA: 0.5217  NORMAL: 0.6000 
RECALL - ALL: 0.5278  COVID-19: 0.4583  PNEUMONIA: 0.5000  NORMAL: 0.6250 
F1 - ALL: 0.5270  COVID-19: 0.4583  PNEUMONIA: 0.5106  NORMAL: 0.6122 
Mask ratio's range: 1.0 ~ 1.0

[val]
LOSS - 0.9903
ACC - 0.5333
PPV - ALL: 0.7216  COVID-19: 1.0000  PNEUMONIA: 0.7160  NORMAL: 0.4488 
RECALL - ALL: 0.5461  COVID-19: 0.1000  PNEUMONIA: 0.5800  NORMAL: 0.9583 
F1 - ALL: 0.4780  COVID-19: 0.1818  PNEUMONIA: 0.6409  NORMAL: 0.6113 

Epoch 1/19
----------
[train]
LOSS - 0.6352
ACC - 0.9067
PPV - ALL: 0.9477  COVID-19: 1.0000  PNEUMONIA: 0.9200  NORMAL: 0.9231 
RECALL - ALL: 0.9444  COVID-19: 0.8750  PNEUMONIA: 0.9583  NORMAL: 1.0000 
F1 - ALL: 0.9440  COVID-19: 0.9333  PNEUMONIA: 0.9388  NORMAL: 0.9600 
Mask ratio's range: 1.0 ~ 1.0

[val]
LOSS - 0.7602
ACC - 0.7567
PPV - ALL: 0.7701  COVID-19: 0.7857  PNEUMONIA: 0.7156  NORMAL: 0.8090 
RECALL - ALL: 0.7667  COVID-19: 0.7700  PNEUMONIA: 0.7800  NORMAL: 0.7500 
F1 - ALL: 0.7675  COVID-19: 0.7778  PNEUMONIA: 0.7464  NORMAL: 0.7784 

Epoch 2/19
----------
[train]
LOSS - 0.2771
ACC - 0.9467
PPV - ALL: 0.9867  COVID-19: 1.0000  PNEUMONIA: 1.0000  NORMAL: 0.9600 
RECALL - ALL: 0.9861  COVID-19: 1.0000  PNEUMONIA: 0.9583  NORMAL: 1.0000 
F1 - ALL: 0.9861  COVID-19: 1.0000  PNEUMONIA: 0.9787  NORMAL: 0.9796 
Mask ratio's range: 1.0 ~ 1.0

[val]
LOSS - 0.6213
ACC - 0.7700
PPV - ALL: 0.7941  COVID-19: 0.8816  PNEUMONIA: 0.7049  NORMAL: 0.7959 
RECALL - ALL: 0.7808  COVID-19: 0.6700  PNEUMONIA: 0.8600  NORMAL: 0.8125 
F1 - ALL: 0.7801  COVID-19: 0.7614  PNEUMONIA: 0.7748  NORMAL: 0.8041 

Epoch 3/19
----------
[train]
LOSS - 0.1017
ACC - 0.9600
PPV - ALL: 1.0000  COVID-19: 1.0000  PNEUMONIA: 1.0000  NORMAL: 1.0000 
RECALL - ALL: 1.0000  COVID-19: 1.0000  PNEUMONIA: 1.0000  NORMAL: 1.0000 
F1 - ALL: 1.0000  COVID-19: 1.0000  PNEUMONIA: 1.0000  NORMAL: 1.0000 
Mask ratio's range: 1.0 ~ 1.0

[val]
LOSS - 0.5625
ACC - 0.7767
PPV - ALL: 0.7966  COVID-19: 0.8444  PNEUMONIA: 0.7083  NORMAL: 0.8372 
RECALL - ALL: 0.7867  COVID-19: 0.7600  PNEUMONIA: 0.8500  NORMAL: 0.7500 
F1 - ALL: 0.7880  COVID-19: 0.8000  PNEUMONIA: 0.7727  NORMAL: 0.7912 

Epoch 4/19
----------
[train]
LOSS - 0.0544
ACC - 0.9600
PPV - ALL: 1.0000  COVID-19: 1.0000  PNEUMONIA: 1.0000  NORMAL: 1.0000 
RECALL - ALL: 1.0000  COVID-19: 1.0000  PNEUMONIA: 1.0000  NORMAL: 1.0000 
F1 - ALL: 1.0000  COVID-19: 1.0000  PNEUMONIA: 1.0000  NORMAL: 1.0000 
Mask ratio's range: 0.875 ~ 1.0

[val]
LOSS - 0.5283
ACC - 0.7800
PPV - ALL: 0.7926  COVID-19: 0.8065  PNEUMONIA: 0.7523  NORMAL: 0.8191 
RECALL - ALL: 0.7907  COVID-19: 0.7500  PNEUMONIA: 0.8200  NORMAL: 0.8021 
F1 - ALL: 0.7908  COVID-19: 0.7772  PNEUMONIA: 0.7847  NORMAL: 0.8105 

Epoch 5/19
----------
[train]
LOSS - 0.0360
ACC - 0.9600
PPV - ALL: 1.0000  COVID-19: 1.0000  PNEUMONIA: 1.0000  NORMAL: 1.0000 
RECALL - ALL: 1.0000  COVID-19: 1.0000  PNEUMONIA: 1.0000  NORMAL: 1.0000 
F1 - ALL: 1.0000  COVID-19: 1.0000  PNEUMONIA: 1.0000  NORMAL: 1.0000 
Mask ratio's range: 0.875 ~ 1.0

[val]
LOSS - 0.5153
ACC - 0.7800
PPV - ALL: 0.7940  COVID-19: 0.8172  PNEUMONIA: 0.7387  NORMAL: 0.8261 
RECALL - ALL: 0.7906  COVID-19: 0.7600  PNEUMONIA: 0.8200  NORMAL: 0.7917 
F1 - ALL: 0.7911  COVID-19: 0.7876  PNEUMONIA: 0.7772  NORMAL: 0.8085 

Epoch 6/19
----------
[train]
LOSS - 0.0274
ACC - 0.9600
PPV - ALL: 1.0000  COVID-19: 1.0000  PNEUMONIA: 1.0000  NORMAL: 1.0000 
RECALL - ALL: 1.0000  COVID-19: 1.0000  PNEUMONIA: 1.0000  NORMAL: 1.0000 
F1 - ALL: 1.0000  COVID-19: 1.0000  PNEUMONIA: 1.0000  NORMAL: 1.0000 
Mask ratio's range: 0.875 ~ 1.0

[val]
LOSS - 0.5113
ACC - 0.7700
PPV - ALL: 0.7815  COVID-19: 0.7755  PNEUMONIA: 0.7500  NORMAL: 0.8191 
RECALL - ALL: 0.7807  COVID-19: 0.7600  PNEUMONIA: 0.7800  NORMAL: 0.8021 
F1 - ALL: 0.7810  COVID-19: 0.7677  PNEUMONIA: 0.7647  NORMAL: 0.8105 

Epoch 7/19
----------
[train]
LOSS - 0.0301
ACC - 0.9600
PPV - ALL: 1.0000  COVID-19: 1.0000  PNEUMONIA: 1.0000  NORMAL: 1.0000 
RECALL - ALL: 1.0000  COVID-19: 1.0000  PNEUMONIA: 1.0000  NORMAL: 1.0000 
F1 - ALL: 1.0000  COVID-19: 1.0000  PNEUMONIA: 1.0000  NORMAL: 1.0000 
Mask ratio's range: 0.8125 ~ 1.0

[val]
LOSS - 0.5071
ACC - 0.7667
PPV - ALL: 0.7783  COVID-19: 0.7755  PNEUMONIA: 0.7404  NORMAL: 0.8191 
RECALL - ALL: 0.7774  COVID-19: 0.7600  PNEUMONIA: 0.7700  NORMAL: 0.8021 
F1 - ALL: 0.7777  COVID-19: 0.7677  PNEUMONIA: 0.7549  NORMAL: 0.8105 

Epoch 8/19
----------
[train]
LOSS - 0.0355
ACC - 0.9600
PPV - ALL: 1.0000  COVID-19: 1.0000  PNEUMONIA: 1.0000  NORMAL: 1.0000 
RECALL - ALL: 1.0000  COVID-19: 1.0000  PNEUMONIA: 1.0000  NORMAL: 1.0000 
F1 - ALL: 1.0000  COVID-19: 1.0000  PNEUMONIA: 1.0000  NORMAL: 1.0000 
Mask ratio's range: 0.8125 ~ 0.9375

[val]
LOSS - 0.5299
ACC - 0.7767
PPV - ALL: 0.7882  COVID-19: 0.8132  PNEUMONIA: 0.7573  NORMAL: 0.7941 
RECALL - ALL: 0.7879  COVID-19: 0.7400  PNEUMONIA: 0.7800  NORMAL: 0.8438 
F1 - ALL: 0.7872  COVID-19: 0.7749  PNEUMONIA: 0.7685  NORMAL: 0.8182 

Epoch 9/19
----------
[train]
LOSS - 0.0289
ACC - 0.9600
PPV - ALL: 1.0000  COVID-19: 1.0000  PNEUMONIA: 1.0000  NORMAL: 1.0000 
RECALL - ALL: 1.0000  COVID-19: 1.0000  PNEUMONIA: 1.0000  NORMAL: 1.0000 
F1 - ALL: 1.0000  COVID-19: 1.0000  PNEUMONIA: 1.0000  NORMAL: 1.0000 
Mask ratio's range: 0.8125 ~ 0.9375

[val]
LOSS - 0.5498
ACC - 0.7700
PPV - ALL: 0.7816  COVID-19: 0.8111  PNEUMONIA: 0.7624  NORMAL: 0.7714 
RECALL - ALL: 0.7813  COVID-19: 0.7300  PNEUMONIA: 0.7700  NORMAL: 0.8438 
F1 - ALL: 0.7802  COVID-19: 0.7684  PNEUMONIA: 0.7662  NORMAL: 0.8060 

Epoch 10/19
----------
[train]
LOSS - 0.0570
ACC - 0.9600
PPV - ALL: 1.0000  COVID-19: 1.0000  PNEUMONIA: 1.0000  NORMAL: 1.0000 
RECALL - ALL: 1.0000  COVID-19: 1.0000  PNEUMONIA: 1.0000  NORMAL: 1.0000 
F1 - ALL: 1.0000  COVID-19: 1.0000  PNEUMONIA: 1.0000  NORMAL: 1.0000 
Mask ratio's range: 0.75 ~ 0.9375

[val]
LOSS - 0.5869
ACC - 0.7733
PPV - ALL: 0.7861  COVID-19: 0.8295  PNEUMONIA: 0.7624  NORMAL: 0.7664 
RECALL - ALL: 0.7847  COVID-19: 0.7300  PNEUMONIA: 0.7700  NORMAL: 0.8542 
F1 - ALL: 0.7836  COVID-19: 0.7766  PNEUMONIA: 0.7662  NORMAL: 0.8079 

Epoch 11/19
----------
[train]
LOSS - 0.0315
ACC - 0.9600
PPV - ALL: 1.0000  COVID-19: 1.0000  PNEUMONIA: 1.0000  NORMAL: 1.0000 
RECALL - ALL: 1.0000  COVID-19: 1.0000  PNEUMONIA: 1.0000  NORMAL: 1.0000 
F1 - ALL: 1.0000  COVID-19: 1.0000  PNEUMONIA: 1.0000  NORMAL: 1.0000 
Mask ratio's range: 0.6875 ~ 0.875

[val]
LOSS - 0.5483
ACC - 0.7767
PPV - ALL: 0.7903  COVID-19: 0.8391  PNEUMONIA: 0.7358  NORMAL: 0.7961 
RECALL - ALL: 0.7881  COVID-19: 0.7300  PNEUMONIA: 0.7800  NORMAL: 0.8542 
F1 - ALL: 0.7874  COVID-19: 0.7808  PNEUMONIA: 0.7573  NORMAL: 0.8241 

Epoch 12/19
----------
[train]
LOSS - 0.0442
ACC - 0.9600
PPV - ALL: 1.0000  COVID-19: 1.0000  PNEUMONIA: 1.0000  NORMAL: 1.0000 
RECALL - ALL: 1.0000  COVID-19: 1.0000  PNEUMONIA: 1.0000  NORMAL: 1.0000 
F1 - ALL: 1.0000  COVID-19: 1.0000  PNEUMONIA: 1.0000  NORMAL: 1.0000 
Mask ratio's range: 0.625 ~ 0.875

[val]
LOSS - 0.5607
ACC - 0.7667
PPV - ALL: 0.7791  COVID-19: 0.8202  PNEUMONIA: 0.7404  NORMAL: 0.7767 
RECALL - ALL: 0.7778  COVID-19: 0.7300  PNEUMONIA: 0.7700  NORMAL: 0.8333 
F1 - ALL: 0.7771  COVID-19: 0.7725  PNEUMONIA: 0.7549  NORMAL: 0.8040 

Epoch 13/19
----------
[train]
LOSS - 0.0366
ACC - 0.9600
PPV - ALL: 1.0000  COVID-19: 1.0000  PNEUMONIA: 1.0000  NORMAL: 1.0000 
RECALL - ALL: 1.0000  COVID-19: 1.0000  PNEUMONIA: 1.0000  NORMAL: 1.0000 
F1 - ALL: 1.0000  COVID-19: 1.0000  PNEUMONIA: 1.0000  NORMAL: 1.0000 
Mask ratio's range: 0.625 ~ 0.875

[val]
LOSS - 0.5619
ACC - 0.7733
PPV - ALL: 0.7866  COVID-19: 0.8295  PNEUMONIA: 0.7383  NORMAL: 0.7921 
RECALL - ALL: 0.7844  COVID-19: 0.7300  PNEUMONIA: 0.7900  NORMAL: 0.8333 
F1 - ALL: 0.7840  COVID-19: 0.7766  PNEUMONIA: 0.7633  NORMAL: 0.8122 

Epoch 14/19
----------
[train]
LOSS - 0.0345
ACC - 0.9600
PPV - ALL: 1.0000  COVID-19: 1.0000  PNEUMONIA: 1.0000  NORMAL: 1.0000 
RECALL - ALL: 1.0000  COVID-19: 1.0000  PNEUMONIA: 1.0000  NORMAL: 1.0000 
F1 - ALL: 1.0000  COVID-19: 1.0000  PNEUMONIA: 1.0000  NORMAL: 1.0000 
Mask ratio's range: 0.625 ~ 0.875

[val]
LOSS - 0.5607
ACC - 0.7800
PPV - ALL: 0.7953  COVID-19: 0.8571  PNEUMONIA: 0.7477  NORMAL: 0.7810 
RECALL - ALL: 0.7914  COVID-19: 0.7200  PNEUMONIA: 0.8000  NORMAL: 0.8542 
F1 - ALL: 0.7905  COVID-19: 0.7826  PNEUMONIA: 0.7730  NORMAL: 0.8160 

Epoch 15/19
----------
[train]
LOSS - 0.0516
ACC - 0.9600
PPV - ALL: 1.0000  COVID-19: 1.0000  PNEUMONIA: 1.0000  NORMAL: 1.0000 
RECALL - ALL: 1.0000  COVID-19: 1.0000  PNEUMONIA: 1.0000  NORMAL: 1.0000 
F1 - ALL: 1.0000  COVID-19: 1.0000  PNEUMONIA: 1.0000  NORMAL: 1.0000 
Mask ratio's range: 0.5625 ~ 0.8125

[val]
LOSS - 0.6105
ACC - 0.7767
PPV - ALL: 0.7943  COVID-19: 0.8780  PNEUMONIA: 0.7573  NORMAL: 0.7477 
RECALL - ALL: 0.7882  COVID-19: 0.7200  PNEUMONIA: 0.7800  NORMAL: 0.8646 
F1 - ALL: 0.7872  COVID-19: 0.7912  PNEUMONIA: 0.7685  NORMAL: 0.8019 

Epoch 16/19
----------
[train]
LOSS - 0.0259
ACC - 0.9600
PPV - ALL: 1.0000  COVID-19: 1.0000  PNEUMONIA: 1.0000  NORMAL: 1.0000 
RECALL - ALL: 1.0000  COVID-19: 1.0000  PNEUMONIA: 1.0000  NORMAL: 1.0000 
F1 - ALL: 1.0000  COVID-19: 1.0000  PNEUMONIA: 1.0000  NORMAL: 1.0000 
Mask ratio's range: 0.5625 ~ 0.8125

[val]
LOSS - 0.5496
ACC - 0.7767
PPV - ALL: 0.7946  COVID-19: 0.8780  PNEUMONIA: 0.7647  NORMAL: 0.7411 
RECALL - ALL: 0.7882  COVID-19: 0.7200  PNEUMONIA: 0.7800  NORMAL: 0.8646 
F1 - ALL: 0.7872  COVID-19: 0.7912  PNEUMONIA: 0.7723  NORMAL: 0.7981 

Epoch 17/19
----------
[train]
LOSS - 0.0403
ACC - 0.9600
PPV - ALL: 1.0000  COVID-19: 1.0000  PNEUMONIA: 1.0000  NORMAL: 1.0000 
RECALL - ALL: 1.0000  COVID-19: 1.0000  PNEUMONIA: 1.0000  NORMAL: 1.0000 
F1 - ALL: 1.0000  COVID-19: 1.0000  PNEUMONIA: 1.0000  NORMAL: 1.0000 
Mask ratio's range: 0.5 ~ 0.8125

[val]
LOSS - 0.5797
ACC - 0.7700
PPV - ALL: 0.7932  COVID-19: 0.8831  PNEUMONIA: 0.7812  NORMAL: 0.7154 
RECALL - ALL: 0.7822  COVID-19: 0.6800  PNEUMONIA: 0.7500  NORMAL: 0.9167 
F1 - ALL: 0.7791  COVID-19: 0.7684  PNEUMONIA: 0.7653  NORMAL: 0.8036 

Epoch 18/19
----------
[train]
LOSS - 0.0421
ACC - 0.9600
PPV - ALL: 1.0000  COVID-19: 1.0000  PNEUMONIA: 1.0000  NORMAL: 1.0000 
RECALL - ALL: 1.0000  COVID-19: 1.0000  PNEUMONIA: 1.0000  NORMAL: 1.0000 
F1 - ALL: 1.0000  COVID-19: 1.0000  PNEUMONIA: 1.0000  NORMAL: 1.0000 
Mask ratio's range: 0.5 ~ 0.75

[val]
LOSS - 0.6376
ACC - 0.7633
PPV - ALL: 0.7950  COVID-19: 0.9143  PNEUMONIA: 0.7778  NORMAL: 0.6929 
RECALL - ALL: 0.7756  COVID-19: 0.6400  PNEUMONIA: 0.7700  NORMAL: 0.9167 
F1 - ALL: 0.7720  COVID-19: 0.7529  PNEUMONIA: 0.7739  NORMAL: 0.7892 

Epoch 19/19
----------
[train]
LOSS - 0.0441
ACC - 0.9600
PPV - ALL: 1.0000  COVID-19: 1.0000  PNEUMONIA: 1.0000  NORMAL: 1.0000 
RECALL - ALL: 1.0000  COVID-19: 1.0000  PNEUMONIA: 1.0000  NORMAL: 1.0000 
F1 - ALL: 1.0000  COVID-19: 1.0000  PNEUMONIA: 1.0000  NORMAL: 1.0000 
Mask ratio's range: 0.5 ~ 0.6875

[val]
LOSS - 0.6524
ACC - 0.7533
PPV - ALL: 0.7881  COVID-19: 0.9118  PNEUMONIA: 0.7755  NORMAL: 0.6769 
RECALL - ALL: 0.7656  COVID-19: 0.6200  PNEUMONIA: 0.7600  NORMAL: 0.9167 
F1 - ALL: 0.7615  COVID-19: 0.7381  PNEUMONIA: 0.7677  NORMAL: 0.7788 


--------------------
[Best results]
ACC - 0.7800
PPV - ALL: 0.7926  COVID-19: 0.8065  PNEUMONIA: 0.7523  NORMAL: 0.8191 
RECALL - ALL: 0.7907  COVID-19: 0.7500  PNEUMONIA: 0.8200  NORMAL: 0.8021 
F1 - ALL: 0.7908  COVID-19: 0.7772  PNEUMONIA: 0.7847  NORMAL: 0.8105 

Training complete in 1m 30s
-------------------- 

--------------------
Model 5
--------------------

Epoch 0/19
----------
[train]
LOSS - 1.0431
ACC - 0.3333
PPV - ALL: 0.3523  COVID-19: 0.4286  PNEUMONIA: 0.3158  NORMAL: 0.3125 
RECALL - ALL: 0.3472  COVID-19: 0.3750  PNEUMONIA: 0.2500  NORMAL: 0.4167 
F1 - ALL: 0.3454  COVID-19: 0.4000  PNEUMONIA: 0.2791  NORMAL: 0.3572 
Mask ratio's range: 1.0 ~ 1.0

[val]
LOSS - 0.9491
ACC - 0.6267
PPV - ALL: 0.6429  COVID-19: 0.6848  PNEUMONIA: 0.5439  NORMAL: 0.7000 
RECALL - ALL: 0.6354  COVID-19: 0.6300  PNEUMONIA: 0.6200  NORMAL: 0.6562 
F1 - ALL: 0.6377  COVID-19: 0.6563  PNEUMONIA: 0.5795  NORMAL: 0.6774 

Epoch 1/19
----------
[train]
LOSS - 0.6655
ACC - 0.8933
PPV - ALL: 0.9316  COVID-19: 0.9565  PNEUMONIA: 0.9583  NORMAL: 0.8800 
RECALL - ALL: 0.9306  COVID-19: 0.9167  PNEUMONIA: 0.9583  NORMAL: 0.9167 
F1 - ALL: 0.9308  COVID-19: 0.9362  PNEUMONIA: 0.9583  NORMAL: 0.8980 
Mask ratio's range: 1.0 ~ 1.0

[val]
LOSS - 0.7718
ACC - 0.7300
PPV - ALL: 0.7704  COVID-19: 0.9180  PNEUMONIA: 0.7290  NORMAL: 0.6641 
RECALL - ALL: 0.7418  COVID-19: 0.5600  PNEUMONIA: 0.7800  NORMAL: 0.8854 
F1 - ALL: 0.7360  COVID-19: 0.6956  PNEUMONIA: 0.7536  NORMAL: 0.7589 

Epoch 2/19
----------
[train]
LOSS - 0.3088
ACC - 0.9600
PPV - ALL: 1.0000  COVID-19: 1.0000  PNEUMONIA: 1.0000  NORMAL: 1.0000 
RECALL - ALL: 1.0000  COVID-19: 1.0000  PNEUMONIA: 1.0000  NORMAL: 1.0000 
F1 - ALL: 1.0000  COVID-19: 1.0000  PNEUMONIA: 1.0000  NORMAL: 1.0000 
Mask ratio's range: 1.0 ~ 1.0

[val]
LOSS - 0.6232
ACC - 0.7667
PPV - ALL: 0.7783  COVID-19: 0.7978  PNEUMONIA: 0.7778  NORMAL: 0.7593 
RECALL - ALL: 0.7781  COVID-19: 0.7100  PNEUMONIA: 0.7700  NORMAL: 0.8542 
F1 - ALL: 0.7764  COVID-19: 0.7513  PNEUMONIA: 0.7739  NORMAL: 0.8040 

Epoch 3/19
----------
[train]
LOSS - 0.1084
ACC - 0.9600
PPV - ALL: 1.0000  COVID-19: 1.0000  PNEUMONIA: 1.0000  NORMAL: 1.0000 
RECALL - ALL: 1.0000  COVID-19: 1.0000  PNEUMONIA: 1.0000  NORMAL: 1.0000 
F1 - ALL: 1.0000  COVID-19: 1.0000  PNEUMONIA: 1.0000  NORMAL: 1.0000 
Mask ratio's range: 1.0 ~ 1.0

[val]
LOSS - 0.5484
ACC - 0.7900
PPV - ALL: 0.8077  COVID-19: 0.8765  PNEUMONIA: 0.7921  NORMAL: 0.7544 
RECALL - ALL: 0.8019  COVID-19: 0.7100  PNEUMONIA: 0.8000  NORMAL: 0.8958 
F1 - ALL: 0.7998  COVID-19: 0.7845  PNEUMONIA: 0.7960  NORMAL: 0.8190 

Epoch 4/19
----------
[train]
LOSS - 0.0521
ACC - 0.9600
PPV - ALL: 1.0000  COVID-19: 1.0000  PNEUMONIA: 1.0000  NORMAL: 1.0000 
RECALL - ALL: 1.0000  COVID-19: 1.0000  PNEUMONIA: 1.0000  NORMAL: 1.0000 
F1 - ALL: 1.0000  COVID-19: 1.0000  PNEUMONIA: 1.0000  NORMAL: 1.0000 
Mask ratio's range: 0.9375 ~ 1.0

[val]
LOSS - 0.5383
ACC - 0.7767
PPV - ALL: 0.7905  COVID-19: 0.8333  PNEUMONIA: 0.7745  NORMAL: 0.7636 
RECALL - ALL: 0.7883  COVID-19: 0.7000  PNEUMONIA: 0.7900  NORMAL: 0.8750 
F1 - ALL: 0.7862  COVID-19: 0.7609  PNEUMONIA: 0.7822  NORMAL: 0.8155 

Epoch 5/19
----------
[train]
LOSS - 0.0412
ACC - 0.9600
PPV - ALL: 1.0000  COVID-19: 1.0000  PNEUMONIA: 1.0000  NORMAL: 1.0000 
RECALL - ALL: 1.0000  COVID-19: 1.0000  PNEUMONIA: 1.0000  NORMAL: 1.0000 
F1 - ALL: 1.0000  COVID-19: 1.0000  PNEUMONIA: 1.0000  NORMAL: 1.0000 
Mask ratio's range: 0.875 ~ 1.0

[val]
LOSS - 0.5043
ACC - 0.7833
PPV - ALL: 0.7953  COVID-19: 0.8132  PNEUMONIA: 0.8021  NORMAL: 0.7706 
RECALL - ALL: 0.7950  COVID-19: 0.7400  PNEUMONIA: 0.7700  NORMAL: 0.8750 
F1 - ALL: 0.7934  COVID-19: 0.7749  PNEUMONIA: 0.7857  NORMAL: 0.8195 

Epoch 6/19
----------
[train]
LOSS - 0.0496
ACC - 0.9600
PPV - ALL: 1.0000  COVID-19: 1.0000  PNEUMONIA: 1.0000  NORMAL: 1.0000 
RECALL - ALL: 1.0000  COVID-19: 1.0000  PNEUMONIA: 1.0000  NORMAL: 1.0000 
F1 - ALL: 1.0000  COVID-19: 1.0000  PNEUMONIA: 1.0000  NORMAL: 1.0000 
Mask ratio's range: 0.875 ~ 1.0

[val]
LOSS - 0.5081
ACC - 0.7833
PPV - ALL: 0.7967  COVID-19: 0.8372  PNEUMONIA: 0.7822  NORMAL: 0.7706 
RECALL - ALL: 0.7950  COVID-19: 0.7200  PNEUMONIA: 0.7900  NORMAL: 0.8750 
F1 - ALL: 0.7933  COVID-19: 0.7742  PNEUMONIA: 0.7861  NORMAL: 0.8195 

Epoch 7/19
----------
[train]
LOSS - 0.0504
ACC - 0.9600
PPV - ALL: 1.0000  COVID-19: 1.0000  PNEUMONIA: 1.0000  NORMAL: 1.0000 
RECALL - ALL: 1.0000  COVID-19: 1.0000  PNEUMONIA: 1.0000  NORMAL: 1.0000 
F1 - ALL: 1.0000  COVID-19: 1.0000  PNEUMONIA: 1.0000  NORMAL: 1.0000 
Mask ratio's range: 0.8125 ~ 1.0

[val]
LOSS - 0.5428
ACC - 0.7867
PPV - ALL: 0.8041  COVID-19: 0.8750  PNEUMONIA: 0.7714  NORMAL: 0.7658 
RECALL - ALL: 0.7985  COVID-19: 0.7000  PNEUMONIA: 0.8100  NORMAL: 0.8854 
F1 - ALL: 0.7964  COVID-19: 0.7778  PNEUMONIA: 0.7902  NORMAL: 0.8213 

Epoch 8/19
----------
[train]
LOSS - 0.0518
ACC - 0.9600
PPV - ALL: 1.0000  COVID-19: 1.0000  PNEUMONIA: 1.0000  NORMAL: 1.0000 
RECALL - ALL: 1.0000  COVID-19: 1.0000  PNEUMONIA: 1.0000  NORMAL: 1.0000 
F1 - ALL: 1.0000  COVID-19: 1.0000  PNEUMONIA: 1.0000  NORMAL: 1.0000 
Mask ratio's range: 0.8125 ~ 0.9375

[val]
LOSS - 0.5504
ACC - 0.7733
PPV - ALL: 0.7927  COVID-19: 0.8684  PNEUMONIA: 0.7642  NORMAL: 0.7456 
RECALL - ALL: 0.7851  COVID-19: 0.6600  PNEUMONIA: 0.8100  NORMAL: 0.8854 
F1 - ALL: 0.7820  COVID-19: 0.7500  PNEUMONIA: 0.7864  NORMAL: 0.8095 

Epoch 9/19
----------
[train]
LOSS - 0.0489
ACC - 0.9600
PPV - ALL: 1.0000  COVID-19: 1.0000  PNEUMONIA: 1.0000  NORMAL: 1.0000 
RECALL - ALL: 1.0000  COVID-19: 1.0000  PNEUMONIA: 1.0000  NORMAL: 1.0000 
F1 - ALL: 1.0000  COVID-19: 1.0000  PNEUMONIA: 1.0000  NORMAL: 1.0000 
Mask ratio's range: 0.75 ~ 0.9375

[val]
LOSS - 0.5510
ACC - 0.7833
PPV - ALL: 0.8021  COVID-19: 0.8701  PNEUMONIA: 0.7885  NORMAL: 0.7478 
RECALL - ALL: 0.7953  COVID-19: 0.6700  PNEUMONIA: 0.8200  NORMAL: 0.8958 
F1 - ALL: 0.7920  COVID-19: 0.7571  PNEUMONIA: 0.8039  NORMAL: 0.8151 

Epoch 10/19
----------
[train]
LOSS - 0.0458
ACC - 0.9600
PPV - ALL: 1.0000  COVID-19: 1.0000  PNEUMONIA: 1.0000  NORMAL: 1.0000 
RECALL - ALL: 1.0000  COVID-19: 1.0000  PNEUMONIA: 1.0000  NORMAL: 1.0000 
F1 - ALL: 1.0000  COVID-19: 1.0000  PNEUMONIA: 1.0000  NORMAL: 1.0000 
Mask ratio's range: 0.6875 ~ 0.9375

[val]
LOSS - 0.5883
ACC - 0.7700
PPV - ALL: 0.7903  COVID-19: 0.8667  PNEUMONIA: 0.7692  NORMAL: 0.7350 
RECALL - ALL: 0.7819  COVID-19: 0.6500  PNEUMONIA: 0.8000  NORMAL: 0.8958 
F1 - ALL: 0.7782  COVID-19: 0.7429  PNEUMONIA: 0.7843  NORMAL: 0.8075 

Epoch 11/19
----------
[train]
LOSS - 0.0620
ACC - 0.9600
PPV - ALL: 1.0000  COVID-19: 1.0000  PNEUMONIA: 1.0000  NORMAL: 1.0000 
RECALL - ALL: 1.0000  COVID-19: 1.0000  PNEUMONIA: 1.0000  NORMAL: 1.0000 
F1 - ALL: 1.0000  COVID-19: 1.0000  PNEUMONIA: 1.0000  NORMAL: 1.0000 
Mask ratio's range: 0.5625 ~ 0.9375

[val]
LOSS - 0.6173
ACC - 0.7633
PPV - ALL: 0.7907  COVID-19: 0.8955  PNEUMONIA: 0.7455  NORMAL: 0.7311 
RECALL - ALL: 0.7754  COVID-19: 0.6000  PNEUMONIA: 0.8200  NORMAL: 0.9062 
F1 - ALL: 0.7696  COVID-19: 0.7186  PNEUMONIA: 0.7810  NORMAL: 0.8093 

Epoch 12/19
----------
[train]
LOSS - 0.0706
ACC - 0.9600
PPV - ALL: 1.0000  COVID-19: 1.0000  PNEUMONIA: 1.0000  NORMAL: 1.0000 
RECALL - ALL: 1.0000  COVID-19: 1.0000  PNEUMONIA: 1.0000  NORMAL: 1.0000 
F1 - ALL: 1.0000  COVID-19: 1.0000  PNEUMONIA: 1.0000  NORMAL: 1.0000 
Mask ratio's range: 0.5 ~ 0.9375

[val]
LOSS - 0.7209
ACC - 0.7567
PPV - ALL: 0.7911  COVID-19: 0.9206  PNEUMONIA: 0.7455  NORMAL: 0.7073 
RECALL - ALL: 0.7687  COVID-19: 0.5800  PNEUMONIA: 0.8200  NORMAL: 0.9062 
F1 - ALL: 0.7624  COVID-19: 0.7116  PNEUMONIA: 0.7810  NORMAL: 0.7945 

Epoch 13/19
----------
[train]
LOSS - 0.0624
ACC - 0.9600
PPV - ALL: 1.0000  COVID-19: 1.0000  PNEUMONIA: 1.0000  NORMAL: 1.0000 
RECALL - ALL: 1.0000  COVID-19: 1.0000  PNEUMONIA: 1.0000  NORMAL: 1.0000 
F1 - ALL: 1.0000  COVID-19: 1.0000  PNEUMONIA: 1.0000  NORMAL: 1.0000 
Mask ratio's range: 0.4375 ~ 0.875

[val]
LOSS - 0.7029
ACC - 0.7433
PPV - ALL: 0.7863  COVID-19: 0.9298  PNEUMONIA: 0.7523  NORMAL: 0.6769 
RECALL - ALL: 0.7556  COVID-19: 0.5300  PNEUMONIA: 0.8200  NORMAL: 0.9167 
F1 - ALL: 0.7462  COVID-19: 0.6752  PNEUMONIA: 0.7847  NORMAL: 0.7788 

Epoch 14/19
----------
[train]
LOSS - 0.0492
ACC - 0.9600
PPV - ALL: 1.0000  COVID-19: 1.0000  PNEUMONIA: 1.0000  NORMAL: 1.0000 
RECALL - ALL: 1.0000  COVID-19: 1.0000  PNEUMONIA: 1.0000  NORMAL: 1.0000 
F1 - ALL: 1.0000  COVID-19: 1.0000  PNEUMONIA: 1.0000  NORMAL: 1.0000 
Mask ratio's range: 0.4375 ~ 0.8125

[val]
LOSS - 0.7636
ACC - 0.7367
PPV - ALL: 0.7856  COVID-19: 0.9259  PNEUMONIA: 0.7788  NORMAL: 0.6522 
RECALL - ALL: 0.7492  COVID-19: 0.5000  PNEUMONIA: 0.8100  NORMAL: 0.9375 
F1 - ALL: 0.7375  COVID-19: 0.6493  PNEUMONIA: 0.7941  NORMAL: 0.7692 

Epoch 15/19
----------
[train]
LOSS - 0.0354
ACC - 0.9600
PPV - ALL: 1.0000  COVID-19: 1.0000  PNEUMONIA: 1.0000  NORMAL: 1.0000 
RECALL - ALL: 1.0000  COVID-19: 1.0000  PNEUMONIA: 1.0000  NORMAL: 1.0000 
F1 - ALL: 1.0000  COVID-19: 1.0000  PNEUMONIA: 1.0000  NORMAL: 1.0000 
Mask ratio's range: 0.4375 ~ 0.75

[val]
LOSS - 0.7334
ACC - 0.7400
PPV - ALL: 0.7800  COVID-19: 0.8966  PNEUMONIA: 0.7767  NORMAL: 0.6667 
RECALL - ALL: 0.7525  COVID-19: 0.5200  PNEUMONIA: 0.8000  NORMAL: 0.9375 
F1 - ALL: 0.7419  COVID-19: 0.6582  PNEUMONIA: 0.7882  NORMAL: 0.7792 

Epoch 16/19
----------
[train]
LOSS - 0.0335
ACC - 0.9600
PPV - ALL: 1.0000  COVID-19: 1.0000  PNEUMONIA: 1.0000  NORMAL: 1.0000 
RECALL - ALL: 1.0000  COVID-19: 1.0000  PNEUMONIA: 1.0000  NORMAL: 1.0000 
F1 - ALL: 1.0000  COVID-19: 1.0000  PNEUMONIA: 1.0000  NORMAL: 1.0000 
Mask ratio's range: 0.375 ~ 0.75

[val]
LOSS - 0.7197
ACC - 0.7467
PPV - ALL: 0.7845  COVID-19: 0.9000  PNEUMONIA: 0.7767  NORMAL: 0.6767 
RECALL - ALL: 0.7592  COVID-19: 0.5400  PNEUMONIA: 0.8000  NORMAL: 0.9375 
F1 - ALL: 0.7497  COVID-19: 0.6750  PNEUMONIA: 0.7882  NORMAL: 0.7860 

Epoch 17/19
----------
[train]
LOSS - 0.0397
ACC - 0.9600
PPV - ALL: 1.0000  COVID-19: 1.0000  PNEUMONIA: 1.0000  NORMAL: 1.0000 
RECALL - ALL: 1.0000  COVID-19: 1.0000  PNEUMONIA: 1.0000  NORMAL: 1.0000 
F1 - ALL: 1.0000  COVID-19: 1.0000  PNEUMONIA: 1.0000  NORMAL: 1.0000 
Mask ratio's range: 0.375 ~ 0.75

[val]
LOSS - 0.7262
ACC - 0.7433
PPV - ALL: 0.7864  COVID-19: 0.9153  PNEUMONIA: 0.7822  NORMAL: 0.6618 
RECALL - ALL: 0.7558  COVID-19: 0.5400  PNEUMONIA: 0.7900  NORMAL: 0.9375 
F1 - ALL: 0.7471  COVID-19: 0.6793  PNEUMONIA: 0.7861  NORMAL: 0.7759 

Epoch 18/19
----------
[train]
LOSS - 0.0682
ACC - 0.9600
PPV - ALL: 1.0000  COVID-19: 1.0000  PNEUMONIA: 1.0000  NORMAL: 1.0000 
RECALL - ALL: 1.0000  COVID-19: 1.0000  PNEUMONIA: 1.0000  NORMAL: 1.0000 
F1 - ALL: 1.0000  COVID-19: 1.0000  PNEUMONIA: 1.0000  NORMAL: 1.0000 
Mask ratio's range: 0.375 ~ 0.75

[val]
LOSS - 0.7560
ACC - 0.7633
PPV - ALL: 0.8044  COVID-19: 0.9365  PNEUMONIA: 0.8000  NORMAL: 0.6767 
RECALL - ALL: 0.7758  COVID-19: 0.5900  PNEUMONIA: 0.8000  NORMAL: 0.9375 
F1 - ALL: 0.7700  COVID-19: 0.7239  PNEUMONIA: 0.8000  NORMAL: 0.7860 

Epoch 19/19
----------
[train]
LOSS - 0.0426
ACC - 0.9600
PPV - ALL: 1.0000  COVID-19: 1.0000  PNEUMONIA: 1.0000  NORMAL: 1.0000 
RECALL - ALL: 1.0000  COVID-19: 1.0000  PNEUMONIA: 1.0000  NORMAL: 1.0000 
F1 - ALL: 1.0000  COVID-19: 1.0000  PNEUMONIA: 1.0000  NORMAL: 1.0000 
Mask ratio's range: 0.375 ~ 0.6875

[val]
LOSS - 0.7221
ACC - 0.7567
PPV - ALL: 0.8014  COVID-19: 0.9344  PNEUMONIA: 0.8081  NORMAL: 0.6618 
RECALL - ALL: 0.7692  COVID-19: 0.5700  PNEUMONIA: 0.8000  NORMAL: 0.9375 
F1 - ALL: 0.7627  COVID-19: 0.7081  PNEUMONIA: 0.8040  NORMAL: 0.7759 


--------------------
[Best results]
ACC - 0.7900
PPV - ALL: 0.8077  COVID-19: 0.8765  PNEUMONIA: 0.7921  NORMAL: 0.7544 
RECALL - ALL: 0.8019  COVID-19: 0.7100  PNEUMONIA: 0.8000  NORMAL: 0.8958 
F1 - ALL: 0.7998  COVID-19: 0.7845  PNEUMONIA: 0.7960  NORMAL: 0.8190 

Training complete in 1m 31s
-------------------- 

[Mean results]
ACC - 0.8040 (0.02)
PPV - ALL: 0.8182 (0.02)  COVID-19: 0.8614 (0.03)  PNEUMONIA: 0.7800 (0.02)  NORMAL: 0.8133 (0.03) 
RECALL - ALL: 0.8151 (0.02)  COVID-19: 0.7800 (0.05)  PNEUMONIA: 0.8360 (0.03)  NORMAL: 0.8292 (0.04) 
F1 - ALL: 0.8149 (0.02)  COVID-19: 0.8180 (0.03)  PNEUMONIA: 0.8068 (0.02)  NORMAL: 0.8198 (0.01) 

