--------------------
Model 1
--------------------

Epoch 0/19
----------
[train]
LOSS - 1.0096
ACC - 0.4267
PPV - ALL: 0.4461  COVID-19: 0.4800  PNEUMONIA: 0.4444  NORMAL: 0.4138 
RECALL - ALL: 0.4444  COVID-19: 0.5000  PNEUMONIA: 0.3333  NORMAL: 0.5000 
F1 - ALL: 0.4412  COVID-19: 0.4898  PNEUMONIA: 0.3809  NORMAL: 0.4528 
Mask ratio's range: 1.0 ~ 1.0

[val]
LOSS - 1.0142
ACC - 0.4533
PPV - ALL: 0.7486  COVID-19: 1.0000  PNEUMONIA: 0.8667  NORMAL: 0.3790 
RECALL - ALL: 0.4664  COVID-19: 0.0300  PNEUMONIA: 0.3900  NORMAL: 0.9792 
F1 - ALL: 0.3809  COVID-19: 0.0583  PNEUMONIA: 0.5379  NORMAL: 0.5465 

Epoch 1/19
----------
[train]
LOSS - 0.7087
ACC - 0.8400
PPV - ALL: 0.8805  COVID-19: 1.0000  PNEUMONIA: 0.8636  NORMAL: 0.7778 
RECALL - ALL: 0.8750  COVID-19: 0.9583  PNEUMONIA: 0.7917  NORMAL: 0.8750 
F1 - ALL: 0.8761  COVID-19: 0.9787  PNEUMONIA: 0.8261  NORMAL: 0.8235 
Mask ratio's range: 1.0 ~ 1.0

[val]
LOSS - 0.8010
ACC - 0.7800
PPV - ALL: 0.7956  COVID-19: 0.8681  PNEUMONIA: 0.7979  NORMAL: 0.7207 
RECALL - ALL: 0.7911  COVID-19: 0.7900  PNEUMONIA: 0.7500  NORMAL: 0.8333 
F1 - ALL: 0.7911  COVID-19: 0.8272  PNEUMONIA: 0.7732  NORMAL: 0.7729 

Epoch 2/19
----------
[train]
LOSS - 0.3301
ACC - 0.9600
PPV - ALL: 1.0000  COVID-19: 1.0000  PNEUMONIA: 1.0000  NORMAL: 1.0000 
RECALL - ALL: 1.0000  COVID-19: 1.0000  PNEUMONIA: 1.0000  NORMAL: 1.0000 
F1 - ALL: 1.0000  COVID-19: 1.0000  PNEUMONIA: 1.0000  NORMAL: 1.0000 
Mask ratio's range: 1.0 ~ 1.0

[val]
LOSS - 0.6457
ACC - 0.7933
PPV - ALL: 0.8158  COVID-19: 0.9221  PNEUMONIA: 0.7685  NORMAL: 0.7568 
RECALL - ALL: 0.8050  COVID-19: 0.7100  PNEUMONIA: 0.8300  NORMAL: 0.8750 
F1 - ALL: 0.8040  COVID-19: 0.8023  PNEUMONIA: 0.7981  NORMAL: 0.8116 

Epoch 3/19
----------
[train]
LOSS - 0.1273
ACC - 0.9600
PPV - ALL: 1.0000  COVID-19: 1.0000  PNEUMONIA: 1.0000  NORMAL: 1.0000 
RECALL - ALL: 1.0000  COVID-19: 1.0000  PNEUMONIA: 1.0000  NORMAL: 1.0000 
F1 - ALL: 1.0000  COVID-19: 1.0000  PNEUMONIA: 1.0000  NORMAL: 1.0000 
Mask ratio's range: 1.0 ~ 1.0

[val]
LOSS - 0.5714
ACC - 0.7867
PPV - ALL: 0.7977  COVID-19: 0.8163  PNEUMONIA: 0.7788  NORMAL: 0.7979 
RECALL - ALL: 0.7971  COVID-19: 0.8000  PNEUMONIA: 0.8100  NORMAL: 0.7812 
F1 - ALL: 0.7972  COVID-19: 0.8081  PNEUMONIA: 0.7941  NORMAL: 0.7895 

Epoch 4/19
----------
[train]
LOSS - 0.0579
ACC - 0.9600
PPV - ALL: 1.0000  COVID-19: 1.0000  PNEUMONIA: 1.0000  NORMAL: 1.0000 
RECALL - ALL: 1.0000  COVID-19: 1.0000  PNEUMONIA: 1.0000  NORMAL: 1.0000 
F1 - ALL: 1.0000  COVID-19: 1.0000  PNEUMONIA: 1.0000  NORMAL: 1.0000 
Mask ratio's range: 0.9375 ~ 1.0

[val]
LOSS - 0.5137
ACC - 0.8133
PPV - ALL: 0.8251  COVID-19: 0.8737  PNEUMONIA: 0.8058  NORMAL: 0.7959 
RECALL - ALL: 0.8242  COVID-19: 0.8300  PNEUMONIA: 0.8300  NORMAL: 0.8125 
F1 - ALL: 0.8244  COVID-19: 0.8513  PNEUMONIA: 0.8177  NORMAL: 0.8041 

Epoch 5/19
----------
[train]
LOSS - 0.0284
ACC - 0.9600
PPV - ALL: 1.0000  COVID-19: 1.0000  PNEUMONIA: 1.0000  NORMAL: 1.0000 
RECALL - ALL: 1.0000  COVID-19: 1.0000  PNEUMONIA: 1.0000  NORMAL: 1.0000 
F1 - ALL: 1.0000  COVID-19: 1.0000  PNEUMONIA: 1.0000  NORMAL: 1.0000 
Mask ratio's range: 0.9375 ~ 1.0

[val]
LOSS - 0.4976
ACC - 0.8067
PPV - ALL: 0.8177  COVID-19: 0.8571  PNEUMONIA: 0.7961  NORMAL: 0.8000 
RECALL - ALL: 0.8172  COVID-19: 0.8400  PNEUMONIA: 0.8200  NORMAL: 0.7917 
F1 - ALL: 0.8174  COVID-19: 0.8485  PNEUMONIA: 0.8079  NORMAL: 0.7958 

Epoch 6/19
----------
[train]
LOSS - 0.0194
ACC - 0.9600
PPV - ALL: 1.0000  COVID-19: 1.0000  PNEUMONIA: 1.0000  NORMAL: 1.0000 
RECALL - ALL: 1.0000  COVID-19: 1.0000  PNEUMONIA: 1.0000  NORMAL: 1.0000 
F1 - ALL: 1.0000  COVID-19: 1.0000  PNEUMONIA: 1.0000  NORMAL: 1.0000 
Mask ratio's range: 0.9375 ~ 1.0

[val]
LOSS - 0.4854
ACC - 0.8100
PPV - ALL: 0.8206  COVID-19: 0.8416  PNEUMONIA: 0.8182  NORMAL: 0.8021 
RECALL - ALL: 0.8207  COVID-19: 0.8500  PNEUMONIA: 0.8100  NORMAL: 0.8021 
F1 - ALL: 0.8207  COVID-19: 0.8458  PNEUMONIA: 0.8141  NORMAL: 0.8021 

Epoch 7/19
----------
[train]
LOSS - 0.0175
ACC - 0.9600
PPV - ALL: 1.0000  COVID-19: 1.0000  PNEUMONIA: 1.0000  NORMAL: 1.0000 
RECALL - ALL: 1.0000  COVID-19: 1.0000  PNEUMONIA: 1.0000  NORMAL: 1.0000 
F1 - ALL: 1.0000  COVID-19: 1.0000  PNEUMONIA: 1.0000  NORMAL: 1.0000 
Mask ratio's range: 0.9375 ~ 1.0

[val]
LOSS - 0.4813
ACC - 0.8067
PPV - ALL: 0.8174  COVID-19: 0.8485  PNEUMONIA: 0.8100  NORMAL: 0.7938 
RECALL - ALL: 0.8174  COVID-19: 0.8400  PNEUMONIA: 0.8100  NORMAL: 0.8021 
F1 - ALL: 0.8174  COVID-19: 0.8442  PNEUMONIA: 0.8100  NORMAL: 0.7979 

Epoch 8/19
----------
[train]
LOSS - 0.0158
ACC - 0.9600
PPV - ALL: 1.0000  COVID-19: 1.0000  PNEUMONIA: 1.0000  NORMAL: 1.0000 
RECALL - ALL: 1.0000  COVID-19: 1.0000  PNEUMONIA: 1.0000  NORMAL: 1.0000 
F1 - ALL: 1.0000  COVID-19: 1.0000  PNEUMONIA: 1.0000  NORMAL: 1.0000 
Mask ratio's range: 0.9375 ~ 1.0

[val]
LOSS - 0.4717
ACC - 0.8133
PPV - ALL: 0.8244  COVID-19: 0.8571  PNEUMONIA: 0.8182  NORMAL: 0.7980 
RECALL - ALL: 0.8243  COVID-19: 0.8400  PNEUMONIA: 0.8100  NORMAL: 0.8229 
F1 - ALL: 0.8243  COVID-19: 0.8485  PNEUMONIA: 0.8141  NORMAL: 0.8103 

Epoch 9/19
----------
[train]
LOSS - 0.0096
ACC - 0.9600
PPV - ALL: 1.0000  COVID-19: 1.0000  PNEUMONIA: 1.0000  NORMAL: 1.0000 
RECALL - ALL: 1.0000  COVID-19: 1.0000  PNEUMONIA: 1.0000  NORMAL: 1.0000 
F1 - ALL: 1.0000  COVID-19: 1.0000  PNEUMONIA: 1.0000  NORMAL: 1.0000 
Mask ratio's range: 0.9375 ~ 1.0

[val]
LOSS - 0.4729
ACC - 0.8033
PPV - ALL: 0.8142  COVID-19: 0.8485  PNEUMONIA: 0.7941  NORMAL: 0.8000 
RECALL - ALL: 0.8139  COVID-19: 0.8400  PNEUMONIA: 0.8100  NORMAL: 0.7917 
F1 - ALL: 0.8140  COVID-19: 0.8442  PNEUMONIA: 0.8020  NORMAL: 0.7958 

Epoch 10/19
----------
[train]
LOSS - 0.0115
ACC - 0.9600
PPV - ALL: 1.0000  COVID-19: 1.0000  PNEUMONIA: 1.0000  NORMAL: 1.0000 
RECALL - ALL: 1.0000  COVID-19: 1.0000  PNEUMONIA: 1.0000  NORMAL: 1.0000 
F1 - ALL: 1.0000  COVID-19: 1.0000  PNEUMONIA: 1.0000  NORMAL: 1.0000 
Mask ratio's range: 0.9375 ~ 1.0

[val]
LOSS - 0.4796
ACC - 0.8100
PPV - ALL: 0.8212  COVID-19: 0.8557  PNEUMONIA: 0.8119  NORMAL: 0.7959 
RECALL - ALL: 0.8208  COVID-19: 0.8300  PNEUMONIA: 0.8200  NORMAL: 0.8125 
F1 - ALL: 0.8209  COVID-19: 0.8427  PNEUMONIA: 0.8159  NORMAL: 0.8041 

Epoch 11/19
----------
[train]
LOSS - 0.0118
ACC - 0.9600
PPV - ALL: 1.0000  COVID-19: 1.0000  PNEUMONIA: 1.0000  NORMAL: 1.0000 
RECALL - ALL: 1.0000  COVID-19: 1.0000  PNEUMONIA: 1.0000  NORMAL: 1.0000 
F1 - ALL: 1.0000  COVID-19: 1.0000  PNEUMONIA: 1.0000  NORMAL: 1.0000 
Mask ratio's range: 0.9375 ~ 1.0

[val]
LOSS - 0.4903
ACC - 0.8167
PPV - ALL: 0.8276  COVID-19: 0.8586  PNEUMONIA: 0.8182  NORMAL: 0.8061 
RECALL - ALL: 0.8276  COVID-19: 0.8500  PNEUMONIA: 0.8100  NORMAL: 0.8229 
F1 - ALL: 0.8276  COVID-19: 0.8543  PNEUMONIA: 0.8141  NORMAL: 0.8144 

Epoch 12/19
----------
[train]
LOSS - 0.0111
ACC - 0.9600
PPV - ALL: 1.0000  COVID-19: 1.0000  PNEUMONIA: 1.0000  NORMAL: 1.0000 
RECALL - ALL: 1.0000  COVID-19: 1.0000  PNEUMONIA: 1.0000  NORMAL: 1.0000 
F1 - ALL: 1.0000  COVID-19: 1.0000  PNEUMONIA: 1.0000  NORMAL: 1.0000 
Mask ratio's range: 0.9375 ~ 1.0

[val]
LOSS - 0.4842
ACC - 0.8100
PPV - ALL: 0.8210  COVID-19: 0.8571  PNEUMONIA: 0.8039  NORMAL: 0.8021 
RECALL - ALL: 0.8207  COVID-19: 0.8400  PNEUMONIA: 0.8200  NORMAL: 0.8021 
F1 - ALL: 0.8208  COVID-19: 0.8485  PNEUMONIA: 0.8119  NORMAL: 0.8021 

Epoch 13/19
----------
[train]
LOSS - 0.0135
ACC - 0.9600
PPV - ALL: 1.0000  COVID-19: 1.0000  PNEUMONIA: 1.0000  NORMAL: 1.0000 
RECALL - ALL: 1.0000  COVID-19: 1.0000  PNEUMONIA: 1.0000  NORMAL: 1.0000 
F1 - ALL: 1.0000  COVID-19: 1.0000  PNEUMONIA: 1.0000  NORMAL: 1.0000 
Mask ratio's range: 0.9375 ~ 1.0

[val]
LOSS - 0.5048
ACC - 0.8167
PPV - ALL: 0.8280  COVID-19: 0.8660  PNEUMONIA: 0.8200  NORMAL: 0.7980 
RECALL - ALL: 0.8276  COVID-19: 0.8400  PNEUMONIA: 0.8200  NORMAL: 0.8229 
F1 - ALL: 0.8277  COVID-19: 0.8528  PNEUMONIA: 0.8200  NORMAL: 0.8103 

Epoch 14/19
----------
[train]
LOSS - 0.0063
ACC - 0.9600
PPV - ALL: 1.0000  COVID-19: 1.0000  PNEUMONIA: 1.0000  NORMAL: 1.0000 
RECALL - ALL: 1.0000  COVID-19: 1.0000  PNEUMONIA: 1.0000  NORMAL: 1.0000 
F1 - ALL: 1.0000  COVID-19: 1.0000  PNEUMONIA: 1.0000  NORMAL: 1.0000 
Mask ratio's range: 0.9375 ~ 1.0

[val]
LOSS - 0.4658
ACC - 0.8233
PPV - ALL: 0.8361  COVID-19: 0.8925  PNEUMONIA: 0.8218  NORMAL: 0.7941 
RECALL - ALL: 0.8346  COVID-19: 0.8300  PNEUMONIA: 0.8300  NORMAL: 0.8438 
F1 - ALL: 0.8347  COVID-19: 0.8601  PNEUMONIA: 0.8259  NORMAL: 0.8182 

Epoch 15/19
----------
[train]
LOSS - 0.0150
ACC - 0.9600
PPV - ALL: 1.0000  COVID-19: 1.0000  PNEUMONIA: 1.0000  NORMAL: 1.0000 
RECALL - ALL: 1.0000  COVID-19: 1.0000  PNEUMONIA: 1.0000  NORMAL: 1.0000 
F1 - ALL: 1.0000  COVID-19: 1.0000  PNEUMONIA: 1.0000  NORMAL: 1.0000 
Mask ratio's range: 0.875 ~ 1.0

[val]
LOSS - 0.4632
ACC - 0.8167
PPV - ALL: 0.8294  COVID-19: 0.8817  PNEUMONIA: 0.8200  NORMAL: 0.7864 
RECALL - ALL: 0.8279  COVID-19: 0.8200  PNEUMONIA: 0.8200  NORMAL: 0.8438 
F1 - ALL: 0.8279  COVID-19: 0.8497  PNEUMONIA: 0.8200  NORMAL: 0.8141 

Epoch 16/19
----------
[train]
LOSS - 0.0124
ACC - 0.9600
PPV - ALL: 1.0000  COVID-19: 1.0000  PNEUMONIA: 1.0000  NORMAL: 1.0000 
RECALL - ALL: 1.0000  COVID-19: 1.0000  PNEUMONIA: 1.0000  NORMAL: 1.0000 
F1 - ALL: 1.0000  COVID-19: 1.0000  PNEUMONIA: 1.0000  NORMAL: 1.0000 
Mask ratio's range: 0.875 ~ 1.0

[val]
LOSS - 0.4624
ACC - 0.8200
PPV - ALL: 0.8332  COVID-19: 0.8913  PNEUMONIA: 0.8218  NORMAL: 0.7864 
RECALL - ALL: 0.8313  COVID-19: 0.8200  PNEUMONIA: 0.8300  NORMAL: 0.8438 
F1 - ALL: 0.8314  COVID-19: 0.8542  PNEUMONIA: 0.8259  NORMAL: 0.8141 

Epoch 17/19
----------
[train]
LOSS - 0.0309
ACC - 0.9600
PPV - ALL: 1.0000  COVID-19: 1.0000  PNEUMONIA: 1.0000  NORMAL: 1.0000 
RECALL - ALL: 1.0000  COVID-19: 1.0000  PNEUMONIA: 1.0000  NORMAL: 1.0000 
F1 - ALL: 1.0000  COVID-19: 1.0000  PNEUMONIA: 1.0000  NORMAL: 1.0000 
Mask ratio's range: 0.875 ~ 1.0

[val]
LOSS - 0.4911
ACC - 0.8167
PPV - ALL: 0.8302  COVID-19: 0.8901  PNEUMONIA: 0.8218  NORMAL: 0.7788 
RECALL - ALL: 0.8279  COVID-19: 0.8100  PNEUMONIA: 0.8300  NORMAL: 0.8438 
F1 - ALL: 0.8280  COVID-19: 0.8482  PNEUMONIA: 0.8259  NORMAL: 0.8100 

Epoch 18/19
----------
[train]
LOSS - 0.0474
ACC - 0.9600
PPV - ALL: 1.0000  COVID-19: 1.0000  PNEUMONIA: 1.0000  NORMAL: 1.0000 
RECALL - ALL: 1.0000  COVID-19: 1.0000  PNEUMONIA: 1.0000  NORMAL: 1.0000 
F1 - ALL: 1.0000  COVID-19: 1.0000  PNEUMONIA: 1.0000  NORMAL: 1.0000 
Mask ratio's range: 0.875 ~ 1.0

[val]
LOSS - 0.4988
ACC - 0.8000
PPV - ALL: 0.8184  COVID-19: 0.9012  PNEUMONIA: 0.7905  NORMAL: 0.7636 
RECALL - ALL: 0.8117  COVID-19: 0.7300  PNEUMONIA: 0.8300  NORMAL: 0.8750 
F1 - ALL: 0.8106  COVID-19: 0.8066  PNEUMONIA: 0.8098  NORMAL: 0.8155 

Epoch 19/19
----------
[train]
LOSS - 0.0493
ACC - 0.9600
PPV - ALL: 1.0000  COVID-19: 1.0000  PNEUMONIA: 1.0000  NORMAL: 1.0000 
RECALL - ALL: 1.0000  COVID-19: 1.0000  PNEUMONIA: 1.0000  NORMAL: 1.0000 
F1 - ALL: 1.0000  COVID-19: 1.0000  PNEUMONIA: 1.0000  NORMAL: 1.0000 
Mask ratio's range: 0.8125 ~ 1.0

[val]
LOSS - 0.5468
ACC - 0.7900
PPV - ALL: 0.8141  COVID-19: 0.9091  PNEUMONIA: 0.8081  NORMAL: 0.7250 
RECALL - ALL: 0.8021  COVID-19: 0.7000  PNEUMONIA: 0.8000  NORMAL: 0.9062 
F1 - ALL: 0.8002  COVID-19: 0.7910  PNEUMONIA: 0.8040  NORMAL: 0.8055 


--------------------
[Best results]
ACC - 0.8233
PPV - ALL: 0.8361  COVID-19: 0.8925  PNEUMONIA: 0.8218  NORMAL: 0.7941 
RECALL - ALL: 0.8346  COVID-19: 0.8300  PNEUMONIA: 0.8300  NORMAL: 0.8438 
F1 - ALL: 0.8347  COVID-19: 0.8601  PNEUMONIA: 0.8259  NORMAL: 0.8182 

Training complete in 1m 30s
-------------------- 

--------------------
Model 2
--------------------

Epoch 0/19
----------
[train]
LOSS - 1.0009
ACC - 0.4933
PPV - ALL: 0.5258  COVID-19: 0.4074  PNEUMONIA: 0.6316  NORMAL: 0.5385 
RECALL - ALL: 0.5139  COVID-19: 0.4583  PNEUMONIA: 0.5000  NORMAL: 0.5833 
F1 - ALL: 0.5165  COVID-19: 0.4314  PNEUMONIA: 0.5581  NORMAL: 0.5600 
Mask ratio's range: 1.0 ~ 1.0

[val]
LOSS - 0.9602
ACC - 0.5867
PPV - ALL: 0.7252  COVID-19: 1.0000  PNEUMONIA: 0.5090  NORMAL: 0.6667 
RECALL - ALL: 0.5972  COVID-19: 0.1500  PNEUMONIA: 0.8500  NORMAL: 0.7917 
F1 - ALL: 0.5405  COVID-19: 0.2609  PNEUMONIA: 0.6367  NORMAL: 0.7238 

Epoch 1/19
----------
[train]
LOSS - 0.6710
ACC - 0.8800
PPV - ALL: 0.9193  COVID-19: 0.9524  PNEUMONIA: 0.9167  NORMAL: 0.8889 
RECALL - ALL: 0.9167  COVID-19: 0.8333  PNEUMONIA: 0.9167  NORMAL: 1.0000 
F1 - ALL: 0.9156  COVID-19: 0.8889  PNEUMONIA: 0.9167  NORMAL: 0.9412 
Mask ratio's range: 1.0 ~ 1.0

[val]
LOSS - 0.7636
ACC - 0.7733
PPV - ALL: 0.7907  COVID-19: 0.8000  PNEUMONIA: 0.7168  NORMAL: 0.8554 
RECALL - ALL: 0.7832  COVID-19: 0.8000  PNEUMONIA: 0.8100  NORMAL: 0.7396 
F1 - ALL: 0.7846  COVID-19: 0.8000  PNEUMONIA: 0.7606  NORMAL: 0.7933 

Epoch 2/19
----------
[train]
LOSS - 0.3237
ACC - 0.9600
PPV - ALL: 1.0000  COVID-19: 1.0000  PNEUMONIA: 1.0000  NORMAL: 1.0000 
RECALL - ALL: 1.0000  COVID-19: 1.0000  PNEUMONIA: 1.0000  NORMAL: 1.0000 
F1 - ALL: 1.0000  COVID-19: 1.0000  PNEUMONIA: 1.0000  NORMAL: 1.0000 
Mask ratio's range: 1.0 ~ 1.0

[val]
LOSS - 0.6256
ACC - 0.7800
PPV - ALL: 0.8048  COVID-19: 0.8734  PNEUMONIA: 0.7040  NORMAL: 0.8370 
RECALL - ALL: 0.7907  COVID-19: 0.6900  PNEUMONIA: 0.8800  NORMAL: 0.8021 
F1 - ALL: 0.7908  COVID-19: 0.7709  PNEUMONIA: 0.7822  NORMAL: 0.8192 

Epoch 3/19
----------
[train]
LOSS - 0.1188
ACC - 0.9600
PPV - ALL: 1.0000  COVID-19: 1.0000  PNEUMONIA: 1.0000  NORMAL: 1.0000 
RECALL - ALL: 1.0000  COVID-19: 1.0000  PNEUMONIA: 1.0000  NORMAL: 1.0000 
F1 - ALL: 1.0000  COVID-19: 1.0000  PNEUMONIA: 1.0000  NORMAL: 1.0000 
Mask ratio's range: 1.0 ~ 1.0

[val]
LOSS - 0.5434
ACC - 0.8000
PPV - ALL: 0.8130  COVID-19: 0.8200  PNEUMONIA: 0.7798  NORMAL: 0.8391 
RECALL - ALL: 0.8101  COVID-19: 0.8200  PNEUMONIA: 0.8500  NORMAL: 0.7604 
F1 - ALL: 0.8104  COVID-19: 0.8200  PNEUMONIA: 0.8134  NORMAL: 0.7978 

Epoch 4/19
----------
[train]
LOSS - 0.0474
ACC - 0.9600
PPV - ALL: 1.0000  COVID-19: 1.0000  PNEUMONIA: 1.0000  NORMAL: 1.0000 
RECALL - ALL: 1.0000  COVID-19: 1.0000  PNEUMONIA: 1.0000  NORMAL: 1.0000 
F1 - ALL: 1.0000  COVID-19: 1.0000  PNEUMONIA: 1.0000  NORMAL: 1.0000 
Mask ratio's range: 1.0 ~ 1.0

[val]
LOSS - 0.5115
ACC - 0.7933
PPV - ALL: 0.8061  COVID-19: 0.8200  PNEUMONIA: 0.7706  NORMAL: 0.8276 
RECALL - ALL: 0.8033  COVID-19: 0.8200  PNEUMONIA: 0.8400  NORMAL: 0.7500 
F1 - ALL: 0.8036  COVID-19: 0.8200  PNEUMONIA: 0.8038  NORMAL: 0.7869 

Epoch 5/19
----------
[train]
LOSS - 0.0253
ACC - 0.9600
PPV - ALL: 1.0000  COVID-19: 1.0000  PNEUMONIA: 1.0000  NORMAL: 1.0000 
RECALL - ALL: 1.0000  COVID-19: 1.0000  PNEUMONIA: 1.0000  NORMAL: 1.0000 
F1 - ALL: 1.0000  COVID-19: 1.0000  PNEUMONIA: 1.0000  NORMAL: 1.0000 
Mask ratio's range: 1.0 ~ 1.0

[val]
LOSS - 0.4968
ACC - 0.7967
PPV - ALL: 0.8105  COVID-19: 0.8265  PNEUMONIA: 0.7658  NORMAL: 0.8391 
RECALL - ALL: 0.8068  COVID-19: 0.8100  PNEUMONIA: 0.8500  NORMAL: 0.7604 
F1 - ALL: 0.8072  COVID-19: 0.8182  PNEUMONIA: 0.8057  NORMAL: 0.7978 

Epoch 6/19
----------
[train]
LOSS - 0.0170
ACC - 0.9600
PPV - ALL: 1.0000  COVID-19: 1.0000  PNEUMONIA: 1.0000  NORMAL: 1.0000 
RECALL - ALL: 1.0000  COVID-19: 1.0000  PNEUMONIA: 1.0000  NORMAL: 1.0000 
F1 - ALL: 1.0000  COVID-19: 1.0000  PNEUMONIA: 1.0000  NORMAL: 1.0000 
Mask ratio's range: 0.9375 ~ 1.0

[val]
LOSS - 0.4950
ACC - 0.8000
PPV - ALL: 0.8134  COVID-19: 0.8283  PNEUMONIA: 0.7727  NORMAL: 0.8391 
RECALL - ALL: 0.8101  COVID-19: 0.8200  PNEUMONIA: 0.8500  NORMAL: 0.7604 
F1 - ALL: 0.8105  COVID-19: 0.8241  PNEUMONIA: 0.8095  NORMAL: 0.7978 

Epoch 7/19
----------
[train]
LOSS - 0.0174
ACC - 0.9600
PPV - ALL: 1.0000  COVID-19: 1.0000  PNEUMONIA: 1.0000  NORMAL: 1.0000 
RECALL - ALL: 1.0000  COVID-19: 1.0000  PNEUMONIA: 1.0000  NORMAL: 1.0000 
F1 - ALL: 1.0000  COVID-19: 1.0000  PNEUMONIA: 1.0000  NORMAL: 1.0000 
Mask ratio's range: 0.875 ~ 1.0

[val]
LOSS - 0.5139
ACC - 0.8100
PPV - ALL: 0.8236  COVID-19: 0.8384  PNEUMONIA: 0.7818  NORMAL: 0.8506 
RECALL - ALL: 0.8203  COVID-19: 0.8300  PNEUMONIA: 0.8600  NORMAL: 0.7708 
F1 - ALL: 0.8206  COVID-19: 0.8342  PNEUMONIA: 0.8190  NORMAL: 0.8087 

Epoch 8/19
----------
[train]
LOSS - 0.0117
ACC - 0.9600
PPV - ALL: 1.0000  COVID-19: 1.0000  PNEUMONIA: 1.0000  NORMAL: 1.0000 
RECALL - ALL: 1.0000  COVID-19: 1.0000  PNEUMONIA: 1.0000  NORMAL: 1.0000 
F1 - ALL: 1.0000  COVID-19: 1.0000  PNEUMONIA: 1.0000  NORMAL: 1.0000 
Mask ratio's range: 0.875 ~ 1.0

[val]
LOSS - 0.4941
ACC - 0.8067
PPV - ALL: 0.8207  COVID-19: 0.8367  PNEUMONIA: 0.7748  NORMAL: 0.8506 
RECALL - ALL: 0.8169  COVID-19: 0.8200  PNEUMONIA: 0.8600  NORMAL: 0.7708 
F1 - ALL: 0.8174  COVID-19: 0.8283  PNEUMONIA: 0.8152  NORMAL: 0.8087 

Epoch 9/19
----------
[train]
LOSS - 0.0128
ACC - 0.9600
PPV - ALL: 1.0000  COVID-19: 1.0000  PNEUMONIA: 1.0000  NORMAL: 1.0000 
RECALL - ALL: 1.0000  COVID-19: 1.0000  PNEUMONIA: 1.0000  NORMAL: 1.0000 
F1 - ALL: 1.0000  COVID-19: 1.0000  PNEUMONIA: 1.0000  NORMAL: 1.0000 
Mask ratio's range: 0.875 ~ 1.0

[val]
LOSS - 0.4980
ACC - 0.8033
PPV - ALL: 0.8179  COVID-19: 0.8351  PNEUMONIA: 0.7679  NORMAL: 0.8506 
RECALL - ALL: 0.8136  COVID-19: 0.8100  PNEUMONIA: 0.8600  NORMAL: 0.7708 
F1 - ALL: 0.8141  COVID-19: 0.8224  PNEUMONIA: 0.8113  NORMAL: 0.8087 

Epoch 10/19
----------
[train]
LOSS - 0.0140
ACC - 0.9600
PPV - ALL: 1.0000  COVID-19: 1.0000  PNEUMONIA: 1.0000  NORMAL: 1.0000 
RECALL - ALL: 1.0000  COVID-19: 1.0000  PNEUMONIA: 1.0000  NORMAL: 1.0000 
F1 - ALL: 1.0000  COVID-19: 1.0000  PNEUMONIA: 1.0000  NORMAL: 1.0000 
Mask ratio's range: 0.875 ~ 1.0

[val]
LOSS - 0.5053
ACC - 0.8067
PPV - ALL: 0.8214  COVID-19: 0.8438  PNEUMONIA: 0.7699  NORMAL: 0.8506 
RECALL - ALL: 0.8169  COVID-19: 0.8100  PNEUMONIA: 0.8700  NORMAL: 0.7708 
F1 - ALL: 0.8174  COVID-19: 0.8266  PNEUMONIA: 0.8169  NORMAL: 0.8087 

Epoch 11/19
----------
[train]
LOSS - 0.0124
ACC - 0.9600
PPV - ALL: 1.0000  COVID-19: 1.0000  PNEUMONIA: 1.0000  NORMAL: 1.0000 
RECALL - ALL: 1.0000  COVID-19: 1.0000  PNEUMONIA: 1.0000  NORMAL: 1.0000 
F1 - ALL: 1.0000  COVID-19: 1.0000  PNEUMONIA: 1.0000  NORMAL: 1.0000 
Mask ratio's range: 0.875 ~ 1.0

[val]
LOSS - 0.4944
ACC - 0.7967
PPV - ALL: 0.8123  COVID-19: 0.8316  PNEUMONIA: 0.7565  NORMAL: 0.8488 
RECALL - ALL: 0.8068  COVID-19: 0.7900  PNEUMONIA: 0.8700  NORMAL: 0.7604 
F1 - ALL: 0.8073  COVID-19: 0.8103  PNEUMONIA: 0.8093  NORMAL: 0.8022 

Epoch 12/19
----------
[train]
LOSS - 0.0125
ACC - 0.9600
PPV - ALL: 1.0000  COVID-19: 1.0000  PNEUMONIA: 1.0000  NORMAL: 1.0000 
RECALL - ALL: 1.0000  COVID-19: 1.0000  PNEUMONIA: 1.0000  NORMAL: 1.0000 
F1 - ALL: 1.0000  COVID-19: 1.0000  PNEUMONIA: 1.0000  NORMAL: 1.0000 
Mask ratio's range: 0.875 ~ 1.0

[val]
LOSS - 0.4859
ACC - 0.8067
PPV - ALL: 0.8214  COVID-19: 0.8438  PNEUMONIA: 0.7699  NORMAL: 0.8506 
RECALL - ALL: 0.8169  COVID-19: 0.8100  PNEUMONIA: 0.8700  NORMAL: 0.7708 
F1 - ALL: 0.8174  COVID-19: 0.8266  PNEUMONIA: 0.8169  NORMAL: 0.8087 

Epoch 13/19
----------
[train]
LOSS - 0.0132
ACC - 0.9600
PPV - ALL: 1.0000  COVID-19: 1.0000  PNEUMONIA: 1.0000  NORMAL: 1.0000 
RECALL - ALL: 1.0000  COVID-19: 1.0000  PNEUMONIA: 1.0000  NORMAL: 1.0000 
F1 - ALL: 1.0000  COVID-19: 1.0000  PNEUMONIA: 1.0000  NORMAL: 1.0000 
Mask ratio's range: 0.875 ~ 1.0

[val]
LOSS - 0.4919
ACC - 0.8033
PPV - ALL: 0.8186  COVID-19: 0.8421  PNEUMONIA: 0.7632  NORMAL: 0.8506 
RECALL - ALL: 0.8136  COVID-19: 0.8000  PNEUMONIA: 0.8700  NORMAL: 0.7708 
F1 - ALL: 0.8141  COVID-19: 0.8205  PNEUMONIA: 0.8131  NORMAL: 0.8087 

Epoch 14/19
----------
[train]
LOSS - 0.0141
ACC - 0.9600
PPV - ALL: 1.0000  COVID-19: 1.0000  PNEUMONIA: 1.0000  NORMAL: 1.0000 
RECALL - ALL: 1.0000  COVID-19: 1.0000  PNEUMONIA: 1.0000  NORMAL: 1.0000 
F1 - ALL: 1.0000  COVID-19: 1.0000  PNEUMONIA: 1.0000  NORMAL: 1.0000 
Mask ratio's range: 0.875 ~ 1.0

[val]
LOSS - 0.4904
ACC - 0.8000
PPV - ALL: 0.8195  COVID-19: 0.8478  PNEUMONIA: 0.7417  NORMAL: 0.8690 
RECALL - ALL: 0.8101  COVID-19: 0.7800  PNEUMONIA: 0.8900  NORMAL: 0.7604 
F1 - ALL: 0.8109  COVID-19: 0.8125  PNEUMONIA: 0.8091  NORMAL: 0.8111 

Epoch 15/19
----------
[train]
LOSS - 0.0143
ACC - 0.9600
PPV - ALL: 1.0000  COVID-19: 1.0000  PNEUMONIA: 1.0000  NORMAL: 1.0000 
RECALL - ALL: 1.0000  COVID-19: 1.0000  PNEUMONIA: 1.0000  NORMAL: 1.0000 
F1 - ALL: 1.0000  COVID-19: 1.0000  PNEUMONIA: 1.0000  NORMAL: 1.0000 
Mask ratio's range: 0.875 ~ 1.0

[val]
LOSS - 0.4909
ACC - 0.8000
PPV - ALL: 0.8190  COVID-19: 0.8571  PNEUMONIA: 0.7395  NORMAL: 0.8605 
RECALL - ALL: 0.8103  COVID-19: 0.7800  PNEUMONIA: 0.8800  NORMAL: 0.7708 
F1 - ALL: 0.8112  COVID-19: 0.8167  PNEUMONIA: 0.8037  NORMAL: 0.8132 

Epoch 16/19
----------
[train]
LOSS - 0.0206
ACC - 0.9600
PPV - ALL: 1.0000  COVID-19: 1.0000  PNEUMONIA: 1.0000  NORMAL: 1.0000 
RECALL - ALL: 1.0000  COVID-19: 1.0000  PNEUMONIA: 1.0000  NORMAL: 1.0000 
F1 - ALL: 1.0000  COVID-19: 1.0000  PNEUMONIA: 1.0000  NORMAL: 1.0000 
Mask ratio's range: 0.75 ~ 1.0

[val]
LOSS - 0.5267
ACC - 0.7933
PPV - ALL: 0.8155  COVID-19: 0.8523  PNEUMONIA: 0.7236  NORMAL: 0.8706 
RECALL - ALL: 0.8036  COVID-19: 0.7500  PNEUMONIA: 0.8900  NORMAL: 0.7708 
F1 - ALL: 0.8046  COVID-19: 0.7979  PNEUMONIA: 0.7982  NORMAL: 0.8177 

Epoch 17/19
----------
[train]
LOSS - 0.0200
ACC - 0.9600
PPV - ALL: 1.0000  COVID-19: 1.0000  PNEUMONIA: 1.0000  NORMAL: 1.0000 
RECALL - ALL: 1.0000  COVID-19: 1.0000  PNEUMONIA: 1.0000  NORMAL: 1.0000 
F1 - ALL: 1.0000  COVID-19: 1.0000  PNEUMONIA: 1.0000  NORMAL: 1.0000 
Mask ratio's range: 0.75 ~ 1.0

[val]
LOSS - 0.5111
ACC - 0.7867
PPV - ALL: 0.8088  COVID-19: 0.8488  PNEUMONIA: 0.7154  NORMAL: 0.8621 
RECALL - ALL: 0.7971  COVID-19: 0.7300  PNEUMONIA: 0.8800  NORMAL: 0.7812 
F1 - ALL: 0.7979  COVID-19: 0.7849  PNEUMONIA: 0.7892  NORMAL: 0.8197 

Epoch 18/19
----------
[train]
LOSS - 0.0227
ACC - 0.9600
PPV - ALL: 1.0000  COVID-19: 1.0000  PNEUMONIA: 1.0000  NORMAL: 1.0000 
RECALL - ALL: 1.0000  COVID-19: 1.0000  PNEUMONIA: 1.0000  NORMAL: 1.0000 
F1 - ALL: 1.0000  COVID-19: 1.0000  PNEUMONIA: 1.0000  NORMAL: 1.0000 
Mask ratio's range: 0.6875 ~ 0.9375

[val]
LOSS - 0.5138
ACC - 0.7833
PPV - ALL: 0.8061  COVID-19: 0.8571  PNEUMONIA: 0.7073  NORMAL: 0.8539 
RECALL - ALL: 0.7939  COVID-19: 0.7200  PNEUMONIA: 0.8700  NORMAL: 0.7917 
F1 - ALL: 0.7948  COVID-19: 0.7826  PNEUMONIA: 0.7803  NORMAL: 0.8216 

Epoch 19/19
----------
[train]
LOSS - 0.0285
ACC - 0.9600
PPV - ALL: 1.0000  COVID-19: 1.0000  PNEUMONIA: 1.0000  NORMAL: 1.0000 
RECALL - ALL: 1.0000  COVID-19: 1.0000  PNEUMONIA: 1.0000  NORMAL: 1.0000 
F1 - ALL: 1.0000  COVID-19: 1.0000  PNEUMONIA: 1.0000  NORMAL: 1.0000 
Mask ratio's range: 0.6875 ~ 0.9375

[val]
LOSS - 0.5210
ACC - 0.7767
PPV - ALL: 0.8014  COVID-19: 0.8519  PNEUMONIA: 0.6984  NORMAL: 0.8539 
RECALL - ALL: 0.7872  COVID-19: 0.6900  PNEUMONIA: 0.8800  NORMAL: 0.7917 
F1 - ALL: 0.7876  COVID-19: 0.7625  PNEUMONIA: 0.7788  NORMAL: 0.8216 


--------------------
[Best results]
ACC - 0.8100
PPV - ALL: 0.8236  COVID-19: 0.8384  PNEUMONIA: 0.7818  NORMAL: 0.8506 
RECALL - ALL: 0.8203  COVID-19: 0.8300  PNEUMONIA: 0.8600  NORMAL: 0.7708 
F1 - ALL: 0.8206  COVID-19: 0.8342  PNEUMONIA: 0.8190  NORMAL: 0.8087 

Training complete in 1m 30s
-------------------- 

--------------------
Model 3
--------------------

Epoch 0/19
----------
[train]
LOSS - 1.0367
ACC - 0.4000
PPV - ALL: 0.4427  COVID-19: 0.3750  PNEUMONIA: 0.6111  NORMAL: 0.3421 
RECALL - ALL: 0.4167  COVID-19: 0.2500  PNEUMONIA: 0.4583  NORMAL: 0.5417 
F1 - ALL: 0.4144  COVID-19: 0.3000  PNEUMONIA: 0.5238  NORMAL: 0.4194 
Mask ratio's range: 1.0 ~ 1.0

[val]
LOSS - 1.0457
ACC - 0.4700
PPV - ALL: 0.3231  COVID-19: 0.0000  PNEUMONIA: 0.4592  NORMAL: 0.5100 
RECALL - ALL: 0.4771  COVID-19: 0.0000  PNEUMONIA: 0.9000  NORMAL: 0.5312 
F1 - ALL: 0.3762  COVID-19: 0.0000  PNEUMONIA: 0.6081  NORMAL: 0.5204 

Epoch 1/19
----------
[train]
LOSS - 0.6542
ACC - 0.8933
PPV - ALL: 0.9379  COVID-19: 1.0000  PNEUMONIA: 0.9565  NORMAL: 0.8571 
RECALL - ALL: 0.9306  COVID-19: 0.8750  PNEUMONIA: 0.9167  NORMAL: 1.0000 
F1 - ALL: 0.9309  COVID-19: 0.9333  PNEUMONIA: 0.9362  NORMAL: 0.9231 
Mask ratio's range: 1.0 ~ 1.0

[val]
LOSS - 0.7776
ACC - 0.7333
PPV - ALL: 0.7658  COVID-19: 0.8889  PNEUMONIA: 0.6967  NORMAL: 0.7117 
RECALL - ALL: 0.7443  COVID-19: 0.5600  PNEUMONIA: 0.8500  NORMAL: 0.8229 
F1 - ALL: 0.7387  COVID-19: 0.6871  PNEUMONIA: 0.7658  NORMAL: 0.7633 

Epoch 2/19
----------
[train]
LOSS - 0.2733
ACC - 0.9467
PPV - ALL: 0.9867  COVID-19: 1.0000  PNEUMONIA: 0.9600  NORMAL: 1.0000 
RECALL - ALL: 0.9861  COVID-19: 0.9583  PNEUMONIA: 1.0000  NORMAL: 1.0000 
F1 - ALL: 0.9861  COVID-19: 0.9787  PNEUMONIA: 0.9796  NORMAL: 1.0000 
Mask ratio's range: 1.0 ~ 1.0

[val]
LOSS - 0.6296
ACC - 0.7800
PPV - ALL: 0.8013  COVID-19: 0.8875  PNEUMONIA: 0.7227  NORMAL: 0.7938 
RECALL - ALL: 0.7907  COVID-19: 0.7100  PNEUMONIA: 0.8600  NORMAL: 0.8021 
F1 - ALL: 0.7907  COVID-19: 0.7889  PNEUMONIA: 0.7854  NORMAL: 0.7979 

Epoch 3/19
----------
[train]
LOSS - 0.1046
ACC - 0.9600
PPV - ALL: 1.0000  COVID-19: 1.0000  PNEUMONIA: 1.0000  NORMAL: 1.0000 
RECALL - ALL: 1.0000  COVID-19: 1.0000  PNEUMONIA: 1.0000  NORMAL: 1.0000 
F1 - ALL: 1.0000  COVID-19: 1.0000  PNEUMONIA: 1.0000  NORMAL: 1.0000 
Mask ratio's range: 1.0 ~ 1.0

[val]
LOSS - 0.5544
ACC - 0.7967
PPV - ALL: 0.8118  COVID-19: 0.8571  PNEUMONIA: 0.7522  NORMAL: 0.8261 
RECALL - ALL: 0.8072  COVID-19: 0.7800  PNEUMONIA: 0.8500  NORMAL: 0.7917 
F1 - ALL: 0.8078  COVID-19: 0.8167  PNEUMONIA: 0.7981  NORMAL: 0.8085 

Epoch 4/19
----------
[train]
LOSS - 0.0414
ACC - 0.9600
PPV - ALL: 1.0000  COVID-19: 1.0000  PNEUMONIA: 1.0000  NORMAL: 1.0000 
RECALL - ALL: 1.0000  COVID-19: 1.0000  PNEUMONIA: 1.0000  NORMAL: 1.0000 
F1 - ALL: 1.0000  COVID-19: 1.0000  PNEUMONIA: 1.0000  NORMAL: 1.0000 
Mask ratio's range: 1.0 ~ 1.0

[val]
LOSS - 0.5162
ACC - 0.8033
PPV - ALL: 0.8167  COVID-19: 0.8384  PNEUMONIA: 0.7727  NORMAL: 0.8391 
RECALL - ALL: 0.8135  COVID-19: 0.8300  PNEUMONIA: 0.8500  NORMAL: 0.7604 
F1 - ALL: 0.8138  COVID-19: 0.8342  PNEUMONIA: 0.8095  NORMAL: 0.7978 

Epoch 5/19
----------
[train]
LOSS - 0.0224
ACC - 0.9600
PPV - ALL: 1.0000  COVID-19: 1.0000  PNEUMONIA: 1.0000  NORMAL: 1.0000 
RECALL - ALL: 1.0000  COVID-19: 1.0000  PNEUMONIA: 1.0000  NORMAL: 1.0000 
F1 - ALL: 1.0000  COVID-19: 1.0000  PNEUMONIA: 1.0000  NORMAL: 1.0000 
Mask ratio's range: 1.0 ~ 1.0

[val]
LOSS - 0.5028
ACC - 0.8100
PPV - ALL: 0.8232  COVID-19: 0.8617  PNEUMONIA: 0.7798  NORMAL: 0.8280 
RECALL - ALL: 0.8207  COVID-19: 0.8100  PNEUMONIA: 0.8500  NORMAL: 0.8021 
F1 - ALL: 0.8211  COVID-19: 0.8351  PNEUMONIA: 0.8134  NORMAL: 0.8148 

Epoch 6/19
----------
[train]
LOSS - 0.0151
ACC - 0.9600
PPV - ALL: 1.0000  COVID-19: 1.0000  PNEUMONIA: 1.0000  NORMAL: 1.0000 
RECALL - ALL: 1.0000  COVID-19: 1.0000  PNEUMONIA: 1.0000  NORMAL: 1.0000 
F1 - ALL: 1.0000  COVID-19: 1.0000  PNEUMONIA: 1.0000  NORMAL: 1.0000 
Mask ratio's range: 1.0 ~ 1.0

[val]
LOSS - 0.4946
ACC - 0.8067
PPV - ALL: 0.8188  COVID-19: 0.8454  PNEUMONIA: 0.7850  NORMAL: 0.8261 
RECALL - ALL: 0.8172  COVID-19: 0.8200  PNEUMONIA: 0.8400  NORMAL: 0.7917 
F1 - ALL: 0.8175  COVID-19: 0.8325  PNEUMONIA: 0.8116  NORMAL: 0.8085 

Epoch 7/19
----------
[train]
LOSS - 0.0137
ACC - 0.9600
PPV - ALL: 1.0000  COVID-19: 1.0000  PNEUMONIA: 1.0000  NORMAL: 1.0000 
RECALL - ALL: 1.0000  COVID-19: 1.0000  PNEUMONIA: 1.0000  NORMAL: 1.0000 
F1 - ALL: 1.0000  COVID-19: 1.0000  PNEUMONIA: 1.0000  NORMAL: 1.0000 
Mask ratio's range: 0.9375 ~ 1.0

[val]
LOSS - 0.4891
ACC - 0.8133
PPV - ALL: 0.8261  COVID-19: 0.8485  PNEUMONIA: 0.7870  NORMAL: 0.8427 
RECALL - ALL: 0.8237  COVID-19: 0.8400  PNEUMONIA: 0.8500  NORMAL: 0.7812 
F1 - ALL: 0.8241  COVID-19: 0.8442  PNEUMONIA: 0.8173  NORMAL: 0.8108 

Epoch 8/19
----------
[train]
LOSS - 0.0217
ACC - 0.9600
PPV - ALL: 1.0000  COVID-19: 1.0000  PNEUMONIA: 1.0000  NORMAL: 1.0000 
RECALL - ALL: 1.0000  COVID-19: 1.0000  PNEUMONIA: 1.0000  NORMAL: 1.0000 
F1 - ALL: 1.0000  COVID-19: 1.0000  PNEUMONIA: 1.0000  NORMAL: 1.0000 
Mask ratio's range: 0.9375 ~ 1.0

[val]
LOSS - 0.4926
ACC - 0.8167
PPV - ALL: 0.8343  COVID-19: 0.9080  PNEUMONIA: 0.7652  NORMAL: 0.8298 
RECALL - ALL: 0.8275  COVID-19: 0.7900  PNEUMONIA: 0.8800  NORMAL: 0.8125 
F1 - ALL: 0.8282  COVID-19: 0.8449  PNEUMONIA: 0.8186  NORMAL: 0.8211 

Epoch 9/19
----------
[train]
LOSS - 0.0587
ACC - 0.9600
PPV - ALL: 1.0000  COVID-19: 1.0000  PNEUMONIA: 1.0000  NORMAL: 1.0000 
RECALL - ALL: 1.0000  COVID-19: 1.0000  PNEUMONIA: 1.0000  NORMAL: 1.0000 
F1 - ALL: 1.0000  COVID-19: 1.0000  PNEUMONIA: 1.0000  NORMAL: 1.0000 
Mask ratio's range: 0.875 ~ 1.0

[val]
LOSS - 0.4900
ACC - 0.8133
PPV - ALL: 0.8293  COVID-19: 0.8989  PNEUMONIA: 0.7679  NORMAL: 0.8211 
RECALL - ALL: 0.8242  COVID-19: 0.8000  PNEUMONIA: 0.8600  NORMAL: 0.8125 
F1 - ALL: 0.8249  COVID-19: 0.8466  PNEUMONIA: 0.8113  NORMAL: 0.8168 

Epoch 10/19
----------
[train]
LOSS - 0.0240
ACC - 0.9600
PPV - ALL: 1.0000  COVID-19: 1.0000  PNEUMONIA: 1.0000  NORMAL: 1.0000 
RECALL - ALL: 1.0000  COVID-19: 1.0000  PNEUMONIA: 1.0000  NORMAL: 1.0000 
F1 - ALL: 1.0000  COVID-19: 1.0000  PNEUMONIA: 1.0000  NORMAL: 1.0000 
Mask ratio's range: 0.875 ~ 1.0

[val]
LOSS - 0.5006
ACC - 0.8067
PPV - ALL: 0.8279  COVID-19: 0.9250  PNEUMONIA: 0.7607  NORMAL: 0.7980 
RECALL - ALL: 0.8176  COVID-19: 0.7400  PNEUMONIA: 0.8900  NORMAL: 0.8229 
F1 - ALL: 0.8176  COVID-19: 0.8222  PNEUMONIA: 0.8203  NORMAL: 0.8103 

Epoch 11/19
----------
[train]
LOSS - 0.0235
ACC - 0.9600
PPV - ALL: 1.0000  COVID-19: 1.0000  PNEUMONIA: 1.0000  NORMAL: 1.0000 
RECALL - ALL: 1.0000  COVID-19: 1.0000  PNEUMONIA: 1.0000  NORMAL: 1.0000 
F1 - ALL: 1.0000  COVID-19: 1.0000  PNEUMONIA: 1.0000  NORMAL: 1.0000 
Mask ratio's range: 0.8125 ~ 1.0

[val]
LOSS - 0.5186
ACC - 0.7967
PPV - ALL: 0.8235  COVID-19: 0.9467  PNEUMONIA: 0.7417  NORMAL: 0.7822 
RECALL - ALL: 0.8076  COVID-19: 0.7100  PNEUMONIA: 0.8900  NORMAL: 0.8229 
F1 - ALL: 0.8075  COVID-19: 0.8114  PNEUMONIA: 0.8091  NORMAL: 0.8020 

Epoch 12/19
----------
[train]
LOSS - 0.0319
ACC - 0.9600
PPV - ALL: 1.0000  COVID-19: 1.0000  PNEUMONIA: 1.0000  NORMAL: 1.0000 
RECALL - ALL: 1.0000  COVID-19: 1.0000  PNEUMONIA: 1.0000  NORMAL: 1.0000 
F1 - ALL: 1.0000  COVID-19: 1.0000  PNEUMONIA: 1.0000  NORMAL: 1.0000 
Mask ratio's range: 0.8125 ~ 1.0

[val]
LOSS - 0.5277
ACC - 0.8000
PPV - ALL: 0.8258  COVID-19: 0.9474  PNEUMONIA: 0.7479  NORMAL: 0.7822 
RECALL - ALL: 0.8110  COVID-19: 0.7200  PNEUMONIA: 0.8900  NORMAL: 0.8229 
F1 - ALL: 0.8110  COVID-19: 0.8182  PNEUMONIA: 0.8128  NORMAL: 0.8020 

Epoch 13/19
----------
[train]
LOSS - 0.0402
ACC - 0.9600
PPV - ALL: 1.0000  COVID-19: 1.0000  PNEUMONIA: 1.0000  NORMAL: 1.0000 
RECALL - ALL: 1.0000  COVID-19: 1.0000  PNEUMONIA: 1.0000  NORMAL: 1.0000 
F1 - ALL: 1.0000  COVID-19: 1.0000  PNEUMONIA: 1.0000  NORMAL: 1.0000 
Mask ratio's range: 0.6875 ~ 0.9375

[val]
LOSS - 0.5236
ACC - 0.8000
PPV - ALL: 0.8211  COVID-19: 0.9241  PNEUMONIA: 0.7699  NORMAL: 0.7692 
RECALL - ALL: 0.8111  COVID-19: 0.7300  PNEUMONIA: 0.8700  NORMAL: 0.8333 
F1 - ALL: 0.8109  COVID-19: 0.8157  PNEUMONIA: 0.8169  NORMAL: 0.8000 

Epoch 14/19
----------
[train]
LOSS - 0.0370
ACC - 0.9600
PPV - ALL: 1.0000  COVID-19: 1.0000  PNEUMONIA: 1.0000  NORMAL: 1.0000 
RECALL - ALL: 1.0000  COVID-19: 1.0000  PNEUMONIA: 1.0000  NORMAL: 1.0000 
F1 - ALL: 1.0000  COVID-19: 1.0000  PNEUMONIA: 1.0000  NORMAL: 1.0000 
Mask ratio's range: 0.6875 ~ 0.9375

[val]
LOSS - 0.5350
ACC - 0.8000
PPV - ALL: 0.8192  COVID-19: 0.9136  PNEUMONIA: 0.7798  NORMAL: 0.7642 
RECALL - ALL: 0.8113  COVID-19: 0.7400  PNEUMONIA: 0.8500  NORMAL: 0.8438 
F1 - ALL: 0.8110  COVID-19: 0.8177  PNEUMONIA: 0.8134  NORMAL: 0.8020 

Epoch 15/19
----------
[train]
LOSS - 0.0197
ACC - 0.9600
PPV - ALL: 1.0000  COVID-19: 1.0000  PNEUMONIA: 1.0000  NORMAL: 1.0000 
RECALL - ALL: 1.0000  COVID-19: 1.0000  PNEUMONIA: 1.0000  NORMAL: 1.0000 
F1 - ALL: 1.0000  COVID-19: 1.0000  PNEUMONIA: 1.0000  NORMAL: 1.0000 
Mask ratio's range: 0.6875 ~ 0.9375

[val]
LOSS - 0.5140
ACC - 0.8100
PPV - ALL: 0.8280  COVID-19: 0.9157  PNEUMONIA: 0.8019  NORMAL: 0.7664 
RECALL - ALL: 0.8214  COVID-19: 0.7600  PNEUMONIA: 0.8500  NORMAL: 0.8542 
F1 - ALL: 0.8212  COVID-19: 0.8306  PNEUMONIA: 0.8252  NORMAL: 0.8079 

Epoch 16/19
----------
[train]
LOSS - 0.0505
ACC - 0.9600
PPV - ALL: 1.0000  COVID-19: 1.0000  PNEUMONIA: 1.0000  NORMAL: 1.0000 
RECALL - ALL: 1.0000  COVID-19: 1.0000  PNEUMONIA: 1.0000  NORMAL: 1.0000 
F1 - ALL: 1.0000  COVID-19: 1.0000  PNEUMONIA: 1.0000  NORMAL: 1.0000 
Mask ratio's range: 0.625 ~ 0.9375

[val]
LOSS - 0.5340
ACC - 0.7933
PPV - ALL: 0.8134  COVID-19: 0.9125  PNEUMONIA: 0.7778  NORMAL: 0.7500 
RECALL - ALL: 0.8046  COVID-19: 0.7300  PNEUMONIA: 0.8400  NORMAL: 0.8438 
F1 - ALL: 0.8043  COVID-19: 0.8111  PNEUMONIA: 0.8077  NORMAL: 0.7941 

Epoch 17/19
----------
[train]
LOSS - 0.0295
ACC - 0.9600
PPV - ALL: 1.0000  COVID-19: 1.0000  PNEUMONIA: 1.0000  NORMAL: 1.0000 
RECALL - ALL: 1.0000  COVID-19: 1.0000  PNEUMONIA: 1.0000  NORMAL: 1.0000 
F1 - ALL: 1.0000  COVID-19: 1.0000  PNEUMONIA: 1.0000  NORMAL: 1.0000 
Mask ratio's range: 0.5625 ~ 0.9375

[val]
LOSS - 0.5446
ACC - 0.7933
PPV - ALL: 0.8127  COVID-19: 0.9012  PNEUMONIA: 0.7981  NORMAL: 0.7387 
RECALL - ALL: 0.8047  COVID-19: 0.7300  PNEUMONIA: 0.8300  NORMAL: 0.8542 
F1 - ALL: 0.8042  COVID-19: 0.8066  PNEUMONIA: 0.8137  NORMAL: 0.7923 

Epoch 18/19
----------
[train]
LOSS - 0.0268
ACC - 0.9600
PPV - ALL: 1.0000  COVID-19: 1.0000  PNEUMONIA: 1.0000  NORMAL: 1.0000 
RECALL - ALL: 1.0000  COVID-19: 1.0000  PNEUMONIA: 1.0000  NORMAL: 1.0000 
F1 - ALL: 1.0000  COVID-19: 1.0000  PNEUMONIA: 1.0000  NORMAL: 1.0000 
Mask ratio's range: 0.5625 ~ 0.9375

[val]
LOSS - 0.5668
ACC - 0.8000
PPV - ALL: 0.8207  COVID-19: 0.9114  PNEUMONIA: 0.8095  NORMAL: 0.7411 
RECALL - ALL: 0.8115  COVID-19: 0.7200  PNEUMONIA: 0.8500  NORMAL: 0.8646 
F1 - ALL: 0.8106  COVID-19: 0.8045  PNEUMONIA: 0.8293  NORMAL: 0.7981 

Epoch 19/19
----------
[train]
LOSS - 0.0241
ACC - 0.9600
PPV - ALL: 1.0000  COVID-19: 1.0000  PNEUMONIA: 1.0000  NORMAL: 1.0000 
RECALL - ALL: 1.0000  COVID-19: 1.0000  PNEUMONIA: 1.0000  NORMAL: 1.0000 
F1 - ALL: 1.0000  COVID-19: 1.0000  PNEUMONIA: 1.0000  NORMAL: 1.0000 
Mask ratio's range: 0.5625 ~ 0.875

[val]
LOSS - 0.5623
ACC - 0.7933
PPV - ALL: 0.8145  COVID-19: 0.9114  PNEUMONIA: 0.8000  NORMAL: 0.7321 
RECALL - ALL: 0.8047  COVID-19: 0.7200  PNEUMONIA: 0.8400  NORMAL: 0.8542 
F1 - ALL: 0.8042  COVID-19: 0.8045  PNEUMONIA: 0.8195  NORMAL: 0.7885 


--------------------
[Best results]
ACC - 0.8167
PPV - ALL: 0.8343  COVID-19: 0.9080  PNEUMONIA: 0.7652  NORMAL: 0.8298 
RECALL - ALL: 0.8275  COVID-19: 0.7900  PNEUMONIA: 0.8800  NORMAL: 0.8125 
F1 - ALL: 0.8282  COVID-19: 0.8449  PNEUMONIA: 0.8186  NORMAL: 0.8211 

Training complete in 1m 30s
-------------------- 

--------------------
Model 4
--------------------

Epoch 0/19
----------
[train]
LOSS - 0.9908
ACC - 0.4400
PPV - ALL: 0.4673  COVID-19: 0.5333  PNEUMONIA: 0.4211  NORMAL: 0.4474 
RECALL - ALL: 0.4583  COVID-19: 0.3333  PNEUMONIA: 0.3333  NORMAL: 0.7083 
F1 - ALL: 0.4436  COVID-19: 0.4102  PNEUMONIA: 0.3721  NORMAL: 0.5484 
Mask ratio's range: 1.0 ~ 1.0

[val]
LOSS - 0.9554
ACC - 0.5900
PPV - ALL: 0.7147  COVID-19: 0.8571  PNEUMONIA: 0.4688  NORMAL: 0.8182 
RECALL - ALL: 0.5963  COVID-19: 0.4200  PNEUMONIA: 0.9000  NORMAL: 0.4688 
F1 - ALL: 0.5921  COVID-19: 0.5637  PNEUMONIA: 0.6165  NORMAL: 0.5961 

Epoch 1/19
----------
[train]
LOSS - 0.6054
ACC - 0.9200
PPV - ALL: 0.9599  COVID-19: 1.0000  PNEUMONIA: 0.9565  NORMAL: 0.9231 
RECALL - ALL: 0.9583  COVID-19: 0.9583  PNEUMONIA: 0.9167  NORMAL: 1.0000 
F1 - ALL: 0.9583  COVID-19: 0.9787  PNEUMONIA: 0.9362  NORMAL: 0.9600 
Mask ratio's range: 1.0 ~ 1.0

[val]
LOSS - 0.7584
ACC - 0.7267
PPV - ALL: 0.7512  COVID-19: 0.8406  PNEUMONIA: 0.6723  NORMAL: 0.7407 
RECALL - ALL: 0.7378  COVID-19: 0.5800  PNEUMONIA: 0.8000  NORMAL: 0.8333 
F1 - ALL: 0.7338  COVID-19: 0.6864  PNEUMONIA: 0.7306  NORMAL: 0.7843 

Epoch 2/19
----------
[train]
LOSS - 0.2426
ACC - 0.9600
PPV - ALL: 1.0000  COVID-19: 1.0000  PNEUMONIA: 1.0000  NORMAL: 1.0000 
RECALL - ALL: 1.0000  COVID-19: 1.0000  PNEUMONIA: 1.0000  NORMAL: 1.0000 
F1 - ALL: 1.0000  COVID-19: 1.0000  PNEUMONIA: 1.0000  NORMAL: 1.0000 
Mask ratio's range: 1.0 ~ 1.0

[val]
LOSS - 0.6343
ACC - 0.7467
PPV - ALL: 0.7787  COVID-19: 0.8421  PNEUMONIA: 0.6567  NORMAL: 0.8372 
RECALL - ALL: 0.7567  COVID-19: 0.6400  PNEUMONIA: 0.8800  NORMAL: 0.7500 
F1 - ALL: 0.7569  COVID-19: 0.7273  PNEUMONIA: 0.7521  NORMAL: 0.7912 

Epoch 3/19
----------
[train]
LOSS - 0.0879
ACC - 0.9600
PPV - ALL: 1.0000  COVID-19: 1.0000  PNEUMONIA: 1.0000  NORMAL: 1.0000 
RECALL - ALL: 1.0000  COVID-19: 1.0000  PNEUMONIA: 1.0000  NORMAL: 1.0000 
F1 - ALL: 1.0000  COVID-19: 1.0000  PNEUMONIA: 1.0000  NORMAL: 1.0000 
Mask ratio's range: 1.0 ~ 1.0

[val]
LOSS - 0.5553
ACC - 0.7633
PPV - ALL: 0.7819  COVID-19: 0.8293  PNEUMONIA: 0.7059  NORMAL: 0.8105 
RECALL - ALL: 0.7740  COVID-19: 0.6800  PNEUMONIA: 0.8400  NORMAL: 0.8021 
F1 - ALL: 0.7736  COVID-19: 0.7473  PNEUMONIA: 0.7671  NORMAL: 0.8063 

Epoch 4/19
----------
[train]
LOSS - 0.0389
ACC - 0.9600
PPV - ALL: 1.0000  COVID-19: 1.0000  PNEUMONIA: 1.0000  NORMAL: 1.0000 
RECALL - ALL: 1.0000  COVID-19: 1.0000  PNEUMONIA: 1.0000  NORMAL: 1.0000 
F1 - ALL: 1.0000  COVID-19: 1.0000  PNEUMONIA: 1.0000  NORMAL: 1.0000 
Mask ratio's range: 0.9375 ~ 1.0

[val]
LOSS - 0.5232
ACC - 0.7633
PPV - ALL: 0.7827  COVID-19: 0.8214  PNEUMONIA: 0.7025  NORMAL: 0.8242 
RECALL - ALL: 0.7737  COVID-19: 0.6900  PNEUMONIA: 0.8500  NORMAL: 0.7812 
F1 - ALL: 0.7738  COVID-19: 0.7500  PNEUMONIA: 0.7692  NORMAL: 0.8021 

Epoch 5/19
----------
[train]
LOSS - 0.0214
ACC - 0.9600
PPV - ALL: 1.0000  COVID-19: 1.0000  PNEUMONIA: 1.0000  NORMAL: 1.0000 
RECALL - ALL: 1.0000  COVID-19: 1.0000  PNEUMONIA: 1.0000  NORMAL: 1.0000 
F1 - ALL: 1.0000  COVID-19: 1.0000  PNEUMONIA: 1.0000  NORMAL: 1.0000 
Mask ratio's range: 0.9375 ~ 1.0

[val]
LOSS - 0.5239
ACC - 0.7533
PPV - ALL: 0.7736  COVID-19: 0.8046  PNEUMONIA: 0.6885  NORMAL: 0.8276 
RECALL - ALL: 0.7633  COVID-19: 0.7000  PNEUMONIA: 0.8400  NORMAL: 0.7500 
F1 - ALL: 0.7641  COVID-19: 0.7487  PNEUMONIA: 0.7567  NORMAL: 0.7869 

Epoch 6/19
----------
[train]
LOSS - 0.0224
ACC - 0.9600
PPV - ALL: 1.0000  COVID-19: 1.0000  PNEUMONIA: 1.0000  NORMAL: 1.0000 
RECALL - ALL: 1.0000  COVID-19: 1.0000  PNEUMONIA: 1.0000  NORMAL: 1.0000 
F1 - ALL: 1.0000  COVID-19: 1.0000  PNEUMONIA: 1.0000  NORMAL: 1.0000 
Mask ratio's range: 0.9375 ~ 1.0

[val]
LOSS - 0.5111
ACC - 0.7533
PPV - ALL: 0.7736  COVID-19: 0.8068  PNEUMONIA: 0.6885  NORMAL: 0.8256 
RECALL - ALL: 0.7632  COVID-19: 0.7100  PNEUMONIA: 0.8400  NORMAL: 0.7396 
F1 - ALL: 0.7641  COVID-19: 0.7553  PNEUMONIA: 0.7567  NORMAL: 0.7802 

Epoch 7/19
----------
[train]
LOSS - 0.0176
ACC - 0.9600
PPV - ALL: 1.0000  COVID-19: 1.0000  PNEUMONIA: 1.0000  NORMAL: 1.0000 
RECALL - ALL: 1.0000  COVID-19: 1.0000  PNEUMONIA: 1.0000  NORMAL: 1.0000 
F1 - ALL: 1.0000  COVID-19: 1.0000  PNEUMONIA: 1.0000  NORMAL: 1.0000 
Mask ratio's range: 0.9375 ~ 1.0

[val]
LOSS - 0.5032
ACC - 0.7600
PPV - ALL: 0.7799  COVID-19: 0.8161  PNEUMONIA: 0.6942  NORMAL: 0.8295 
RECALL - ALL: 0.7701  COVID-19: 0.7100  PNEUMONIA: 0.8400  NORMAL: 0.7604 
F1 - ALL: 0.7710  COVID-19: 0.7594  PNEUMONIA: 0.7602  NORMAL: 0.7934 

Epoch 8/19
----------
[train]
LOSS - 0.0163
ACC - 0.9600
PPV - ALL: 1.0000  COVID-19: 1.0000  PNEUMONIA: 1.0000  NORMAL: 1.0000 
RECALL - ALL: 1.0000  COVID-19: 1.0000  PNEUMONIA: 1.0000  NORMAL: 1.0000 
F1 - ALL: 1.0000  COVID-19: 1.0000  PNEUMONIA: 1.0000  NORMAL: 1.0000 
Mask ratio's range: 0.875 ~ 1.0

[val]
LOSS - 0.4998
ACC - 0.7800
PPV - ALL: 0.7970  COVID-19: 0.8276  PNEUMONIA: 0.7265  NORMAL: 0.8370 
RECALL - ALL: 0.7907  COVID-19: 0.7200  PNEUMONIA: 0.8500  NORMAL: 0.8021 
F1 - ALL: 0.7909  COVID-19: 0.7701  PNEUMONIA: 0.7834  NORMAL: 0.8192 

Epoch 9/19
----------
[train]
LOSS - 0.0156
ACC - 0.9600
PPV - ALL: 1.0000  COVID-19: 1.0000  PNEUMONIA: 1.0000  NORMAL: 1.0000 
RECALL - ALL: 1.0000  COVID-19: 1.0000  PNEUMONIA: 1.0000  NORMAL: 1.0000 
F1 - ALL: 1.0000  COVID-19: 1.0000  PNEUMONIA: 1.0000  NORMAL: 1.0000 
Mask ratio's range: 0.875 ~ 1.0

[val]
LOSS - 0.5144
ACC - 0.7667
PPV - ALL: 0.7809  COVID-19: 0.7935  PNEUMONIA: 0.7232  NORMAL: 0.8261 
RECALL - ALL: 0.7772  COVID-19: 0.7300  PNEUMONIA: 0.8100  NORMAL: 0.7917 
F1 - ALL: 0.7777  COVID-19: 0.7604  PNEUMONIA: 0.7641  NORMAL: 0.8085 

Epoch 10/19
----------
[train]
LOSS - 0.0216
ACC - 0.9600
PPV - ALL: 1.0000  COVID-19: 1.0000  PNEUMONIA: 1.0000  NORMAL: 1.0000 
RECALL - ALL: 1.0000  COVID-19: 1.0000  PNEUMONIA: 1.0000  NORMAL: 1.0000 
F1 - ALL: 1.0000  COVID-19: 1.0000  PNEUMONIA: 1.0000  NORMAL: 1.0000 
Mask ratio's range: 0.875 ~ 1.0

[val]
LOSS - 0.5318
ACC - 0.7667
PPV - ALL: 0.7829  COVID-19: 0.8161  PNEUMONIA: 0.7155  NORMAL: 0.8172 
RECALL - ALL: 0.7772  COVID-19: 0.7100  PNEUMONIA: 0.8300  NORMAL: 0.7917 
F1 - ALL: 0.7774  COVID-19: 0.7594  PNEUMONIA: 0.7685  NORMAL: 0.8042 

Epoch 11/19
----------
[train]
LOSS - 0.0132
ACC - 0.9600
PPV - ALL: 1.0000  COVID-19: 1.0000  PNEUMONIA: 1.0000  NORMAL: 1.0000 
RECALL - ALL: 1.0000  COVID-19: 1.0000  PNEUMONIA: 1.0000  NORMAL: 1.0000 
F1 - ALL: 1.0000  COVID-19: 1.0000  PNEUMONIA: 1.0000  NORMAL: 1.0000 
Mask ratio's range: 0.875 ~ 1.0

[val]
LOSS - 0.5018
ACC - 0.7600
PPV - ALL: 0.7736  COVID-19: 0.7766  PNEUMONIA: 0.7182  NORMAL: 0.8261 
RECALL - ALL: 0.7706  COVID-19: 0.7300  PNEUMONIA: 0.7900  NORMAL: 0.7917 
F1 - ALL: 0.7712  COVID-19: 0.7526  PNEUMONIA: 0.7524  NORMAL: 0.8085 

Epoch 12/19
----------
[train]
LOSS - 0.0161
ACC - 0.9600
PPV - ALL: 1.0000  COVID-19: 1.0000  PNEUMONIA: 1.0000  NORMAL: 1.0000 
RECALL - ALL: 1.0000  COVID-19: 1.0000  PNEUMONIA: 1.0000  NORMAL: 1.0000 
F1 - ALL: 1.0000  COVID-19: 1.0000  PNEUMONIA: 1.0000  NORMAL: 1.0000 
Mask ratio's range: 0.875 ~ 1.0

[val]
LOSS - 0.4961
ACC - 0.7667
PPV - ALL: 0.7807  COVID-19: 0.7935  PNEUMONIA: 0.7207  NORMAL: 0.8280 
RECALL - ALL: 0.7774  COVID-19: 0.7300  PNEUMONIA: 0.8000  NORMAL: 0.8021 
F1 - ALL: 0.7778  COVID-19: 0.7604  PNEUMONIA: 0.7583  NORMAL: 0.8148 

Epoch 13/19
----------
[train]
LOSS - 0.0203
ACC - 0.9600
PPV - ALL: 1.0000  COVID-19: 1.0000  PNEUMONIA: 1.0000  NORMAL: 1.0000 
RECALL - ALL: 1.0000  COVID-19: 1.0000  PNEUMONIA: 1.0000  NORMAL: 1.0000 
F1 - ALL: 1.0000  COVID-19: 1.0000  PNEUMONIA: 1.0000  NORMAL: 1.0000 
Mask ratio's range: 0.875 ~ 1.0

[val]
LOSS - 0.5079
ACC - 0.7733
PPV - ALL: 0.7873  COVID-19: 0.8068  PNEUMONIA: 0.7321  NORMAL: 0.8229 
RECALL - ALL: 0.7843  COVID-19: 0.7100  PNEUMONIA: 0.8200  NORMAL: 0.8229 
F1 - ALL: 0.7839  COVID-19: 0.7553  PNEUMONIA: 0.7736  NORMAL: 0.8229 

Epoch 14/19
----------
[train]
LOSS - 0.0130
ACC - 0.9600
PPV - ALL: 1.0000  COVID-19: 1.0000  PNEUMONIA: 1.0000  NORMAL: 1.0000 
RECALL - ALL: 1.0000  COVID-19: 1.0000  PNEUMONIA: 1.0000  NORMAL: 1.0000 
F1 - ALL: 1.0000  COVID-19: 1.0000  PNEUMONIA: 1.0000  NORMAL: 1.0000 
Mask ratio's range: 0.875 ~ 1.0

[val]
LOSS - 0.5064
ACC - 0.7667
PPV - ALL: 0.7807  COVID-19: 0.7978  PNEUMONIA: 0.7232  NORMAL: 0.8211 
RECALL - ALL: 0.7775  COVID-19: 0.7100  PNEUMONIA: 0.8100  NORMAL: 0.8125 
F1 - ALL: 0.7774  COVID-19: 0.7513  PNEUMONIA: 0.7641  NORMAL: 0.8168 

Epoch 15/19
----------
[train]
LOSS - 0.0204
ACC - 0.9600
PPV - ALL: 1.0000  COVID-19: 1.0000  PNEUMONIA: 1.0000  NORMAL: 1.0000 
RECALL - ALL: 1.0000  COVID-19: 1.0000  PNEUMONIA: 1.0000  NORMAL: 1.0000 
F1 - ALL: 1.0000  COVID-19: 1.0000  PNEUMONIA: 1.0000  NORMAL: 1.0000 
Mask ratio's range: 0.8125 ~ 1.0

[val]
LOSS - 0.5119
ACC - 0.7700
PPV - ALL: 0.7814  COVID-19: 0.7826  PNEUMONIA: 0.7453  NORMAL: 0.8163 
RECALL - ALL: 0.7811  COVID-19: 0.7200  PNEUMONIA: 0.7900  NORMAL: 0.8333 
F1 - ALL: 0.7806  COVID-19: 0.7500  PNEUMONIA: 0.7670  NORMAL: 0.8247 

Epoch 16/19
----------
[train]
LOSS - 0.0170
ACC - 0.9600
PPV - ALL: 1.0000  COVID-19: 1.0000  PNEUMONIA: 1.0000  NORMAL: 1.0000 
RECALL - ALL: 1.0000  COVID-19: 1.0000  PNEUMONIA: 1.0000  NORMAL: 1.0000 
F1 - ALL: 1.0000  COVID-19: 1.0000  PNEUMONIA: 1.0000  NORMAL: 1.0000 
Mask ratio's range: 0.8125 ~ 1.0

[val]
LOSS - 0.5096
ACC - 0.7833
PPV - ALL: 0.7942  COVID-19: 0.7935  PNEUMONIA: 0.7692  NORMAL: 0.8200 
RECALL - ALL: 0.7947  COVID-19: 0.7300  PNEUMONIA: 0.8000  NORMAL: 0.8542 
F1 - ALL: 0.7938  COVID-19: 0.7604  PNEUMONIA: 0.7843  NORMAL: 0.8368 

Epoch 17/19
----------
[train]
LOSS - 0.0168
ACC - 0.9600
PPV - ALL: 1.0000  COVID-19: 1.0000  PNEUMONIA: 1.0000  NORMAL: 1.0000 
RECALL - ALL: 1.0000  COVID-19: 1.0000  PNEUMONIA: 1.0000  NORMAL: 1.0000 
F1 - ALL: 1.0000  COVID-19: 1.0000  PNEUMONIA: 1.0000  NORMAL: 1.0000 
Mask ratio's range: 0.75 ~ 1.0

[val]
LOSS - 0.4944
ACC - 0.7867
PPV - ALL: 0.7983  COVID-19: 0.8090  PNEUMONIA: 0.7642  NORMAL: 0.8218 
RECALL - ALL: 0.7982  COVID-19: 0.7200  PNEUMONIA: 0.8100  NORMAL: 0.8646 
F1 - ALL: 0.7970  COVID-19: 0.7619  PNEUMONIA: 0.7864  NORMAL: 0.8427 

Epoch 18/19
----------
[train]
LOSS - 0.0205
ACC - 0.9600
PPV - ALL: 1.0000  COVID-19: 1.0000  PNEUMONIA: 1.0000  NORMAL: 1.0000 
RECALL - ALL: 1.0000  COVID-19: 1.0000  PNEUMONIA: 1.0000  NORMAL: 1.0000 
F1 - ALL: 1.0000  COVID-19: 1.0000  PNEUMONIA: 1.0000  NORMAL: 1.0000 
Mask ratio's range: 0.75 ~ 1.0

[val]
LOSS - 0.5425
ACC - 0.7800
PPV - ALL: 0.7920  COVID-19: 0.7978  PNEUMONIA: 0.7500  NORMAL: 0.8283 
RECALL - ALL: 0.7914  COVID-19: 0.7100  PNEUMONIA: 0.8100  NORMAL: 0.8542 
F1 - ALL: 0.7904  COVID-19: 0.7513  PNEUMONIA: 0.7788  NORMAL: 0.8411 

Epoch 19/19
----------
[train]
LOSS - 0.0199
ACC - 0.9600
PPV - ALL: 1.0000  COVID-19: 1.0000  PNEUMONIA: 1.0000  NORMAL: 1.0000 
RECALL - ALL: 1.0000  COVID-19: 1.0000  PNEUMONIA: 1.0000  NORMAL: 1.0000 
F1 - ALL: 1.0000  COVID-19: 1.0000  PNEUMONIA: 1.0000  NORMAL: 1.0000 
Mask ratio's range: 0.75 ~ 0.9375

[val]
LOSS - 0.5154
ACC - 0.7733
PPV - ALL: 0.7853  COVID-19: 0.8023  PNEUMONIA: 0.7477  NORMAL: 0.8058 
RECALL - ALL: 0.7849  COVID-19: 0.6900  PNEUMONIA: 0.8000  NORMAL: 0.8646 
F1 - ALL: 0.7830  COVID-19: 0.7419  PNEUMONIA: 0.7730  NORMAL: 0.8342 


--------------------
[Best results]
ACC - 0.7867
PPV - ALL: 0.7983  COVID-19: 0.8090  PNEUMONIA: 0.7642  NORMAL: 0.8218 
RECALL - ALL: 0.7982  COVID-19: 0.7200  PNEUMONIA: 0.8100  NORMAL: 0.8646 
F1 - ALL: 0.7970  COVID-19: 0.7619  PNEUMONIA: 0.7864  NORMAL: 0.8427 

Training complete in 1m 31s
-------------------- 

--------------------
Model 5
--------------------

Epoch 0/19
----------
[train]
LOSS - 1.0377
ACC - 0.3733
PPV - ALL: 0.3876  COVID-19: 0.3333  PNEUMONIA: 0.4545  NORMAL: 0.3750 
RECALL - ALL: 0.3889  COVID-19: 0.2500  PNEUMONIA: 0.4167  NORMAL: 0.5000 
F1 - ALL: 0.3830  COVID-19: 0.2857  PNEUMONIA: 0.4348  NORMAL: 0.4286 
Mask ratio's range: 1.0 ~ 1.0

[val]
LOSS - 1.0338
ACC - 0.4433
PPV - ALL: 0.5384  COVID-19: 0.6667  PNEUMONIA: 0.5278  NORMAL: 0.4208 
RECALL - ALL: 0.4563  COVID-19: 0.0200  PNEUMONIA: 0.3800  NORMAL: 0.9688 
F1 - ALL: 0.3558  COVID-19: 0.0388  PNEUMONIA: 0.4419  NORMAL: 0.5867 

Epoch 1/19
----------
[train]
LOSS - 0.6397
ACC - 0.9067
PPV - ALL: 0.9444  COVID-19: 0.9565  PNEUMONIA: 0.9167  NORMAL: 0.9600 
RECALL - ALL: 0.9445  COVID-19: 0.9167  PNEUMONIA: 0.9167  NORMAL: 1.0000 
F1 - ALL: 0.9442  COVID-19: 0.9362  PNEUMONIA: 0.9167  NORMAL: 0.9796 
Mask ratio's range: 1.0 ~ 1.0

[val]
LOSS - 0.8116
ACC - 0.7300
PPV - ALL: 0.7576  COVID-19: 0.8615  PNEUMONIA: 0.7217  NORMAL: 0.6897 
RECALL - ALL: 0.7411  COVID-19: 0.5600  PNEUMONIA: 0.8300  NORMAL: 0.8333 
F1 - ALL: 0.7352  COVID-19: 0.6788  PNEUMONIA: 0.7721  NORMAL: 0.7547 

Epoch 2/19
----------
[train]
LOSS - 0.2783
ACC - 0.9600
PPV - ALL: 1.0000  COVID-19: 1.0000  PNEUMONIA: 1.0000  NORMAL: 1.0000 
RECALL - ALL: 1.0000  COVID-19: 1.0000  PNEUMONIA: 1.0000  NORMAL: 1.0000 
F1 - ALL: 1.0000  COVID-19: 1.0000  PNEUMONIA: 1.0000  NORMAL: 1.0000 
Mask ratio's range: 1.0 ~ 1.0

[val]
LOSS - 0.6708
ACC - 0.7367
PPV - ALL: 0.7610  COVID-19: 0.8529  PNEUMONIA: 0.7232  NORMAL: 0.7069 
RECALL - ALL: 0.7481  COVID-19: 0.5800  PNEUMONIA: 0.8100  NORMAL: 0.8542 
F1 - ALL: 0.7427  COVID-19: 0.6905  PNEUMONIA: 0.7641  NORMAL: 0.7736 

Epoch 3/19
----------
[train]
LOSS - 0.1013
ACC - 0.9600
PPV - ALL: 1.0000  COVID-19: 1.0000  PNEUMONIA: 1.0000  NORMAL: 1.0000 
RECALL - ALL: 1.0000  COVID-19: 1.0000  PNEUMONIA: 1.0000  NORMAL: 1.0000 
F1 - ALL: 1.0000  COVID-19: 1.0000  PNEUMONIA: 1.0000  NORMAL: 1.0000 
Mask ratio's range: 1.0 ~ 1.0

[val]
LOSS - 0.5878
ACC - 0.7600
PPV - ALL: 0.7775  COVID-19: 0.8462  PNEUMONIA: 0.7411  NORMAL: 0.7453 
RECALL - ALL: 0.7710  COVID-19: 0.6600  PNEUMONIA: 0.8300  NORMAL: 0.8229 
F1 - ALL: 0.7689  COVID-19: 0.7416  PNEUMONIA: 0.7830  NORMAL: 0.7822 

Epoch 4/19
----------
[train]
LOSS - 0.0420
ACC - 0.9600
PPV - ALL: 1.0000  COVID-19: 1.0000  PNEUMONIA: 1.0000  NORMAL: 1.0000 
RECALL - ALL: 1.0000  COVID-19: 1.0000  PNEUMONIA: 1.0000  NORMAL: 1.0000 
F1 - ALL: 1.0000  COVID-19: 1.0000  PNEUMONIA: 1.0000  NORMAL: 1.0000 
Mask ratio's range: 1.0 ~ 1.0

[val]
LOSS - 0.5519
ACC - 0.7733
PPV - ALL: 0.7896  COVID-19: 0.8500  PNEUMONIA: 0.7568  NORMAL: 0.7619 
RECALL - ALL: 0.7844  COVID-19: 0.6800  PNEUMONIA: 0.8400  NORMAL: 0.8333 
F1 - ALL: 0.7826  COVID-19: 0.7556  PNEUMONIA: 0.7962  NORMAL: 0.7960 

Epoch 5/19
----------
[train]
LOSS - 0.0246
ACC - 0.9600
PPV - ALL: 1.0000  COVID-19: 1.0000  PNEUMONIA: 1.0000  NORMAL: 1.0000 
RECALL - ALL: 1.0000  COVID-19: 1.0000  PNEUMONIA: 1.0000  NORMAL: 1.0000 
F1 - ALL: 1.0000  COVID-19: 1.0000  PNEUMONIA: 1.0000  NORMAL: 1.0000 
Mask ratio's range: 0.9375 ~ 1.0

[val]
LOSS - 0.5333
ACC - 0.7767
PPV - ALL: 0.7921  COVID-19: 0.8554  PNEUMONIA: 0.7685  NORMAL: 0.7524 
RECALL - ALL: 0.7876  COVID-19: 0.7100  PNEUMONIA: 0.8300  NORMAL: 0.8229 
F1 - ALL: 0.7867  COVID-19: 0.7759  PNEUMONIA: 0.7981  NORMAL: 0.7861 

Epoch 6/19
----------
[train]
LOSS - 0.0173
ACC - 0.9600
PPV - ALL: 1.0000  COVID-19: 1.0000  PNEUMONIA: 1.0000  NORMAL: 1.0000 
RECALL - ALL: 1.0000  COVID-19: 1.0000  PNEUMONIA: 1.0000  NORMAL: 1.0000 
F1 - ALL: 1.0000  COVID-19: 1.0000  PNEUMONIA: 1.0000  NORMAL: 1.0000 
Mask ratio's range: 0.9375 ~ 1.0

[val]
LOSS - 0.5265
ACC - 0.7833
PPV - ALL: 0.7986  COVID-19: 0.8554  PNEUMONIA: 0.7905  NORMAL: 0.7500 
RECALL - ALL: 0.7946  COVID-19: 0.7100  PNEUMONIA: 0.8300  NORMAL: 0.8438 
F1 - ALL: 0.7933  COVID-19: 0.7759  PNEUMONIA: 0.8098  NORMAL: 0.7941 

Epoch 7/19
----------
[train]
LOSS - 0.0137
ACC - 0.9600
PPV - ALL: 1.0000  COVID-19: 1.0000  PNEUMONIA: 1.0000  NORMAL: 1.0000 
RECALL - ALL: 1.0000  COVID-19: 1.0000  PNEUMONIA: 1.0000  NORMAL: 1.0000 
F1 - ALL: 1.0000  COVID-19: 1.0000  PNEUMONIA: 1.0000  NORMAL: 1.0000 
Mask ratio's range: 0.9375 ~ 1.0

[val]
LOSS - 0.5214
ACC - 0.7800
PPV - ALL: 0.7956  COVID-19: 0.8537  PNEUMONIA: 0.7830  NORMAL: 0.7500 
RECALL - ALL: 0.7913  COVID-19: 0.7000  PNEUMONIA: 0.8300  NORMAL: 0.8438 
F1 - ALL: 0.7897  COVID-19: 0.7692  PNEUMONIA: 0.8058  NORMAL: 0.7941 

Epoch 8/19
----------
[train]
LOSS - 0.0178
ACC - 0.9600
PPV - ALL: 1.0000  COVID-19: 1.0000  PNEUMONIA: 1.0000  NORMAL: 1.0000 
RECALL - ALL: 1.0000  COVID-19: 1.0000  PNEUMONIA: 1.0000  NORMAL: 1.0000 
F1 - ALL: 1.0000  COVID-19: 1.0000  PNEUMONIA: 1.0000  NORMAL: 1.0000 
Mask ratio's range: 0.9375 ~ 1.0

[val]
LOSS - 0.5188
ACC - 0.7767
PPV - ALL: 0.7925  COVID-19: 0.8519  PNEUMONIA: 0.7757  NORMAL: 0.7500 
RECALL - ALL: 0.7879  COVID-19: 0.6900  PNEUMONIA: 0.8300  NORMAL: 0.8438 
F1 - ALL: 0.7862  COVID-19: 0.7625  PNEUMONIA: 0.8019  NORMAL: 0.7941 

Epoch 9/19
----------
[train]
LOSS - 0.0181
ACC - 0.9600
PPV - ALL: 1.0000  COVID-19: 1.0000  PNEUMONIA: 1.0000  NORMAL: 1.0000 
RECALL - ALL: 1.0000  COVID-19: 1.0000  PNEUMONIA: 1.0000  NORMAL: 1.0000 
F1 - ALL: 1.0000  COVID-19: 1.0000  PNEUMONIA: 1.0000  NORMAL: 1.0000 
Mask ratio's range: 0.9375 ~ 1.0

[val]
LOSS - 0.5293
ACC - 0.7800
PPV - ALL: 0.7945  COVID-19: 0.8471  PNEUMONIA: 0.7864  NORMAL: 0.7500 
RECALL - ALL: 0.7913  COVID-19: 0.7200  PNEUMONIA: 0.8100  NORMAL: 0.8438 
F1 - ALL: 0.7902  COVID-19: 0.7784  PNEUMONIA: 0.7980  NORMAL: 0.7941 

Epoch 10/19
----------
[train]
LOSS - 0.0126
ACC - 0.9600
PPV - ALL: 1.0000  COVID-19: 1.0000  PNEUMONIA: 1.0000  NORMAL: 1.0000 
RECALL - ALL: 1.0000  COVID-19: 1.0000  PNEUMONIA: 1.0000  NORMAL: 1.0000 
F1 - ALL: 1.0000  COVID-19: 1.0000  PNEUMONIA: 1.0000  NORMAL: 1.0000 
Mask ratio's range: 0.9375 ~ 1.0

[val]
LOSS - 0.5240
ACC - 0.7833
PPV - ALL: 0.7985  COVID-19: 0.8571  PNEUMONIA: 0.7885  NORMAL: 0.7500 
RECALL - ALL: 0.7946  COVID-19: 0.7200  PNEUMONIA: 0.8200  NORMAL: 0.8438 
F1 - ALL: 0.7935  COVID-19: 0.7826  PNEUMONIA: 0.8039  NORMAL: 0.7941 

Epoch 11/19
----------
[train]
LOSS - 0.0100
ACC - 0.9600
PPV - ALL: 1.0000  COVID-19: 1.0000  PNEUMONIA: 1.0000  NORMAL: 1.0000 
RECALL - ALL: 1.0000  COVID-19: 1.0000  PNEUMONIA: 1.0000  NORMAL: 1.0000 
F1 - ALL: 1.0000  COVID-19: 1.0000  PNEUMONIA: 1.0000  NORMAL: 1.0000 
Mask ratio's range: 0.9375 ~ 1.0

[val]
LOSS - 0.5140
ACC - 0.7833
PPV - ALL: 0.7985  COVID-19: 0.8571  PNEUMONIA: 0.7885  NORMAL: 0.7500 
RECALL - ALL: 0.7946  COVID-19: 0.7200  PNEUMONIA: 0.8200  NORMAL: 0.8438 
F1 - ALL: 0.7935  COVID-19: 0.7826  PNEUMONIA: 0.8039  NORMAL: 0.7941 

Epoch 12/19
----------
[train]
LOSS - 0.0118
ACC - 0.9600
PPV - ALL: 1.0000  COVID-19: 1.0000  PNEUMONIA: 1.0000  NORMAL: 1.0000 
RECALL - ALL: 1.0000  COVID-19: 1.0000  PNEUMONIA: 1.0000  NORMAL: 1.0000 
F1 - ALL: 1.0000  COVID-19: 1.0000  PNEUMONIA: 1.0000  NORMAL: 1.0000 
Mask ratio's range: 0.9375 ~ 1.0

[val]
LOSS - 0.5192
ACC - 0.7767
PPV - ALL: 0.7898  COVID-19: 0.8295  PNEUMONIA: 0.7921  NORMAL: 0.7477 
RECALL - ALL: 0.7878  COVID-19: 0.7300  PNEUMONIA: 0.8000  NORMAL: 0.8333 
F1 - ALL: 0.7869  COVID-19: 0.7766  PNEUMONIA: 0.7960  NORMAL: 0.7882 

Epoch 13/19
----------
[train]
LOSS - 0.0188
ACC - 0.9600
PPV - ALL: 1.0000  COVID-19: 1.0000  PNEUMONIA: 1.0000  NORMAL: 1.0000 
RECALL - ALL: 1.0000  COVID-19: 1.0000  PNEUMONIA: 1.0000  NORMAL: 1.0000 
F1 - ALL: 1.0000  COVID-19: 1.0000  PNEUMONIA: 1.0000  NORMAL: 1.0000 
Mask ratio's range: 0.9375 ~ 1.0

[val]
LOSS - 0.5153
ACC - 0.7867
PPV - ALL: 0.8001  COVID-19: 0.8295  PNEUMONIA: 0.8163  NORMAL: 0.7545 
RECALL - ALL: 0.7982  COVID-19: 0.7300  PNEUMONIA: 0.8000  NORMAL: 0.8646 
F1 - ALL: 0.7968  COVID-19: 0.7766  PNEUMONIA: 0.8081  NORMAL: 0.8058 

Epoch 14/19
----------
[train]
LOSS - 0.0158
ACC - 0.9600
PPV - ALL: 1.0000  COVID-19: 1.0000  PNEUMONIA: 1.0000  NORMAL: 1.0000 
RECALL - ALL: 1.0000  COVID-19: 1.0000  PNEUMONIA: 1.0000  NORMAL: 1.0000 
F1 - ALL: 1.0000  COVID-19: 1.0000  PNEUMONIA: 1.0000  NORMAL: 1.0000 
Mask ratio's range: 0.9375 ~ 1.0

[val]
LOSS - 0.5267
ACC - 0.7900
PPV - ALL: 0.8033  COVID-19: 0.8261  PNEUMONIA: 0.8316  NORMAL: 0.7523 
RECALL - ALL: 0.8014  COVID-19: 0.7600  PNEUMONIA: 0.7900  NORMAL: 0.8542 
F1 - ALL: 0.8007  COVID-19: 0.7917  PNEUMONIA: 0.8103  NORMAL: 0.8000 

Epoch 15/19
----------
[train]
LOSS - 0.0111
ACC - 0.9600
PPV - ALL: 1.0000  COVID-19: 1.0000  PNEUMONIA: 1.0000  NORMAL: 1.0000 
RECALL - ALL: 1.0000  COVID-19: 1.0000  PNEUMONIA: 1.0000  NORMAL: 1.0000 
F1 - ALL: 1.0000  COVID-19: 1.0000  PNEUMONIA: 1.0000  NORMAL: 1.0000 
Mask ratio's range: 0.9375 ~ 1.0

[val]
LOSS - 0.5081
ACC - 0.7833
PPV - ALL: 0.7970  COVID-19: 0.8152  PNEUMONIA: 0.8280  NORMAL: 0.7477 
RECALL - ALL: 0.7949  COVID-19: 0.7500  PNEUMONIA: 0.7700  NORMAL: 0.8646 
F1 - ALL: 0.7937  COVID-19: 0.7812  PNEUMONIA: 0.7979  NORMAL: 0.8019 

Epoch 16/19
----------
[train]
LOSS - 0.0182
ACC - 0.9600
PPV - ALL: 1.0000  COVID-19: 1.0000  PNEUMONIA: 1.0000  NORMAL: 1.0000 
RECALL - ALL: 1.0000  COVID-19: 1.0000  PNEUMONIA: 1.0000  NORMAL: 1.0000 
F1 - ALL: 1.0000  COVID-19: 1.0000  PNEUMONIA: 1.0000  NORMAL: 1.0000 
Mask ratio's range: 0.8125 ~ 1.0

[val]
LOSS - 0.5075
ACC - 0.7833
PPV - ALL: 0.7963  COVID-19: 0.8132  PNEUMONIA: 0.8211  NORMAL: 0.7545 
RECALL - ALL: 0.7949  COVID-19: 0.7400  PNEUMONIA: 0.7800  NORMAL: 0.8646 
F1 - ALL: 0.7936  COVID-19: 0.7749  PNEUMONIA: 0.8000  NORMAL: 0.8058 

Epoch 17/19
----------
[train]
LOSS - 0.0138
ACC - 0.9600
PPV - ALL: 1.0000  COVID-19: 1.0000  PNEUMONIA: 1.0000  NORMAL: 1.0000 
RECALL - ALL: 1.0000  COVID-19: 1.0000  PNEUMONIA: 1.0000  NORMAL: 1.0000 
F1 - ALL: 1.0000  COVID-19: 1.0000  PNEUMONIA: 1.0000  NORMAL: 1.0000 
Mask ratio's range: 0.8125 ~ 1.0

[val]
LOSS - 0.5045
ACC - 0.7800
PPV - ALL: 0.7937  COVID-19: 0.8276  PNEUMONIA: 0.8081  NORMAL: 0.7455 
RECALL - ALL: 0.7914  COVID-19: 0.7200  PNEUMONIA: 0.8000  NORMAL: 0.8542 
F1 - ALL: 0.7901  COVID-19: 0.7701  PNEUMONIA: 0.8040  NORMAL: 0.7962 

Epoch 18/19
----------
[train]
LOSS - 0.0255
ACC - 0.9600
PPV - ALL: 1.0000  COVID-19: 1.0000  PNEUMONIA: 1.0000  NORMAL: 1.0000 
RECALL - ALL: 1.0000  COVID-19: 1.0000  PNEUMONIA: 1.0000  NORMAL: 1.0000 
F1 - ALL: 1.0000  COVID-19: 1.0000  PNEUMONIA: 1.0000  NORMAL: 1.0000 
Mask ratio's range: 0.8125 ~ 1.0

[val]
LOSS - 0.4989
ACC - 0.7733
PPV - ALL: 0.7870  COVID-19: 0.8161  PNEUMONIA: 0.8061  NORMAL: 0.7387 
RECALL - ALL: 0.7847  COVID-19: 0.7100  PNEUMONIA: 0.7900  NORMAL: 0.8542 
F1 - ALL: 0.7832  COVID-19: 0.7594  PNEUMONIA: 0.7980  NORMAL: 0.7923 

Epoch 19/19
----------
[train]
LOSS - 0.0159
ACC - 0.9600
PPV - ALL: 1.0000  COVID-19: 1.0000  PNEUMONIA: 1.0000  NORMAL: 1.0000 
RECALL - ALL: 1.0000  COVID-19: 1.0000  PNEUMONIA: 1.0000  NORMAL: 1.0000 
F1 - ALL: 1.0000  COVID-19: 1.0000  PNEUMONIA: 1.0000  NORMAL: 1.0000 
Mask ratio's range: 0.8125 ~ 1.0

[val]
LOSS - 0.5116
ACC - 0.7700
PPV - ALL: 0.7841  COVID-19: 0.8235  PNEUMONIA: 0.7900  NORMAL: 0.7387 
RECALL - ALL: 0.7814  COVID-19: 0.7000  PNEUMONIA: 0.7900  NORMAL: 0.8542 
F1 - ALL: 0.7797  COVID-19: 0.7567  PNEUMONIA: 0.7900  NORMAL: 0.7923 


--------------------
[Best results]
ACC - 0.7900
PPV - ALL: 0.8033  COVID-19: 0.8261  PNEUMONIA: 0.8316  NORMAL: 0.7523 
RECALL - ALL: 0.8014  COVID-19: 0.7600  PNEUMONIA: 0.7900  NORMAL: 0.8542 
F1 - ALL: 0.8007  COVID-19: 0.7917  PNEUMONIA: 0.8103  NORMAL: 0.8000 

Training complete in 1m 31s
-------------------- 

[Mean results]
ACC - 0.8053 (0.01)
PPV - ALL: 0.8191 (0.02)  COVID-19: 0.8548 (0.04)  PNEUMONIA: 0.7929 (0.03)  NORMAL: 0.8097 (0.03) 
RECALL - ALL: 0.8164 (0.01)  COVID-19: 0.7860 (0.04)  PNEUMONIA: 0.8340 (0.03)  NORMAL: 0.8292 (0.03) 
F1 - ALL: 0.8162 (0.01)  COVID-19: 0.8186 (0.04)  PNEUMONIA: 0.8120 (0.01)  NORMAL: 0.8181 (0.01) 

