--------------------
Model 1
--------------------

Epoch 0/19
----------
[train]
LOSS - 1.0096
ACC - 0.4267
PPV - ALL: 0.4461  COVID-19: 0.4800  PNEUMONIA: 0.4444  NORMAL: 0.4138 
RECALL - ALL: 0.4444  COVID-19: 0.5000  PNEUMONIA: 0.3333  NORMAL: 0.5000 
F1 - ALL: 0.4412  COVID-19: 0.4898  PNEUMONIA: 0.3809  NORMAL: 0.4528 
Mask ratio's range: 1.0 ~ 1.0

[val]
LOSS - 1.0142
ACC - 0.4533
PPV - ALL: 0.7486  COVID-19: 1.0000  PNEUMONIA: 0.8667  NORMAL: 0.3790 
RECALL - ALL: 0.4664  COVID-19: 0.0300  PNEUMONIA: 0.3900  NORMAL: 0.9792 
F1 - ALL: 0.3809  COVID-19: 0.0583  PNEUMONIA: 0.5379  NORMAL: 0.5465 

Epoch 1/19
----------
[train]
LOSS - 0.7087
ACC - 0.8400
PPV - ALL: 0.8805  COVID-19: 1.0000  PNEUMONIA: 0.8636  NORMAL: 0.7778 
RECALL - ALL: 0.8750  COVID-19: 0.9583  PNEUMONIA: 0.7917  NORMAL: 0.8750 
F1 - ALL: 0.8761  COVID-19: 0.9787  PNEUMONIA: 0.8261  NORMAL: 0.8235 
Mask ratio's range: 1.0 ~ 1.0

[val]
LOSS - 0.8010
ACC - 0.7800
PPV - ALL: 0.7956  COVID-19: 0.8681  PNEUMONIA: 0.7979  NORMAL: 0.7207 
RECALL - ALL: 0.7911  COVID-19: 0.7900  PNEUMONIA: 0.7500  NORMAL: 0.8333 
F1 - ALL: 0.7911  COVID-19: 0.8272  PNEUMONIA: 0.7732  NORMAL: 0.7729 

Epoch 2/19
----------
[train]
LOSS - 0.3301
ACC - 0.9600
PPV - ALL: 1.0000  COVID-19: 1.0000  PNEUMONIA: 1.0000  NORMAL: 1.0000 
RECALL - ALL: 1.0000  COVID-19: 1.0000  PNEUMONIA: 1.0000  NORMAL: 1.0000 
F1 - ALL: 1.0000  COVID-19: 1.0000  PNEUMONIA: 1.0000  NORMAL: 1.0000 
Mask ratio's range: 1.0 ~ 1.0

[val]
LOSS - 0.6457
ACC - 0.7933
PPV - ALL: 0.8158  COVID-19: 0.9221  PNEUMONIA: 0.7685  NORMAL: 0.7568 
RECALL - ALL: 0.8050  COVID-19: 0.7100  PNEUMONIA: 0.8300  NORMAL: 0.8750 
F1 - ALL: 0.8040  COVID-19: 0.8023  PNEUMONIA: 0.7981  NORMAL: 0.8116 

Epoch 3/19
----------
[train]
LOSS - 0.1273
ACC - 0.9600
PPV - ALL: 1.0000  COVID-19: 1.0000  PNEUMONIA: 1.0000  NORMAL: 1.0000 
RECALL - ALL: 1.0000  COVID-19: 1.0000  PNEUMONIA: 1.0000  NORMAL: 1.0000 
F1 - ALL: 1.0000  COVID-19: 1.0000  PNEUMONIA: 1.0000  NORMAL: 1.0000 
Mask ratio's range: 1.0 ~ 1.0

[val]
LOSS - 0.5714
ACC - 0.7867
PPV - ALL: 0.7977  COVID-19: 0.8163  PNEUMONIA: 0.7788  NORMAL: 0.7979 
RECALL - ALL: 0.7971  COVID-19: 0.8000  PNEUMONIA: 0.8100  NORMAL: 0.7812 
F1 - ALL: 0.7972  COVID-19: 0.8081  PNEUMONIA: 0.7941  NORMAL: 0.7895 

Epoch 4/19
----------
[train]
LOSS - 0.0544
ACC - 0.9600
PPV - ALL: 1.0000  COVID-19: 1.0000  PNEUMONIA: 1.0000  NORMAL: 1.0000 
RECALL - ALL: 1.0000  COVID-19: 1.0000  PNEUMONIA: 1.0000  NORMAL: 1.0000 
F1 - ALL: 1.0000  COVID-19: 1.0000  PNEUMONIA: 1.0000  NORMAL: 1.0000 
Mask ratio's range: 0.9375 ~ 1.0

[val]
LOSS - 0.5146
ACC - 0.8100
PPV - ALL: 0.8220  COVID-19: 0.8723  PNEUMONIA: 0.8058  NORMAL: 0.7879 
RECALL - ALL: 0.8208  COVID-19: 0.8200  PNEUMONIA: 0.8300  NORMAL: 0.8125 
F1 - ALL: 0.8210  COVID-19: 0.8453  PNEUMONIA: 0.8177  NORMAL: 0.8000 

Epoch 5/19
----------
[train]
LOSS - 0.0289
ACC - 0.9600
PPV - ALL: 1.0000  COVID-19: 1.0000  PNEUMONIA: 1.0000  NORMAL: 1.0000 
RECALL - ALL: 1.0000  COVID-19: 1.0000  PNEUMONIA: 1.0000  NORMAL: 1.0000 
F1 - ALL: 1.0000  COVID-19: 1.0000  PNEUMONIA: 1.0000  NORMAL: 1.0000 
Mask ratio's range: 0.9375 ~ 1.0

[val]
LOSS - 0.5068
ACC - 0.8067
PPV - ALL: 0.8184  COVID-19: 0.8646  PNEUMONIA: 0.7905  NORMAL: 0.8000 
RECALL - ALL: 0.8172  COVID-19: 0.8300  PNEUMONIA: 0.8300  NORMAL: 0.7917 
F1 - ALL: 0.8175  COVID-19: 0.8469  PNEUMONIA: 0.8098  NORMAL: 0.7958 

Epoch 6/19
----------
[train]
LOSS - 0.0196
ACC - 0.9600
PPV - ALL: 1.0000  COVID-19: 1.0000  PNEUMONIA: 1.0000  NORMAL: 1.0000 
RECALL - ALL: 1.0000  COVID-19: 1.0000  PNEUMONIA: 1.0000  NORMAL: 1.0000 
F1 - ALL: 1.0000  COVID-19: 1.0000  PNEUMONIA: 1.0000  NORMAL: 1.0000 
Mask ratio's range: 0.875 ~ 1.0

[val]
LOSS - 0.4881
ACC - 0.8100
PPV - ALL: 0.8206  COVID-19: 0.8416  PNEUMONIA: 0.8182  NORMAL: 0.8021 
RECALL - ALL: 0.8207  COVID-19: 0.8500  PNEUMONIA: 0.8100  NORMAL: 0.8021 
F1 - ALL: 0.8207  COVID-19: 0.8458  PNEUMONIA: 0.8141  NORMAL: 0.8021 

Epoch 7/19
----------
[train]
LOSS - 0.0213
ACC - 0.9600
PPV - ALL: 1.0000  COVID-19: 1.0000  PNEUMONIA: 1.0000  NORMAL: 1.0000 
RECALL - ALL: 1.0000  COVID-19: 1.0000  PNEUMONIA: 1.0000  NORMAL: 1.0000 
F1 - ALL: 1.0000  COVID-19: 1.0000  PNEUMONIA: 1.0000  NORMAL: 1.0000 
Mask ratio's range: 0.875 ~ 1.0

[val]
LOSS - 0.4924
ACC - 0.8033
PPV - ALL: 0.8147  COVID-19: 0.8542  PNEUMONIA: 0.7961  NORMAL: 0.7938 
RECALL - ALL: 0.8140  COVID-19: 0.8200  PNEUMONIA: 0.8200  NORMAL: 0.8021 
F1 - ALL: 0.8142  COVID-19: 0.8368  PNEUMONIA: 0.8079  NORMAL: 0.7979 

Epoch 8/19
----------
[train]
LOSS - 0.0355
ACC - 0.9600
PPV - ALL: 1.0000  COVID-19: 1.0000  PNEUMONIA: 1.0000  NORMAL: 1.0000 
RECALL - ALL: 1.0000  COVID-19: 1.0000  PNEUMONIA: 1.0000  NORMAL: 1.0000 
F1 - ALL: 1.0000  COVID-19: 1.0000  PNEUMONIA: 1.0000  NORMAL: 1.0000 
Mask ratio's range: 0.875 ~ 1.0

[val]
LOSS - 0.4853
ACC - 0.8100
PPV - ALL: 0.8231  COVID-19: 0.8791  PNEUMONIA: 0.7981  NORMAL: 0.7921 
RECALL - ALL: 0.8211  COVID-19: 0.8000  PNEUMONIA: 0.8300  NORMAL: 0.8333 
F1 - ALL: 0.8212  COVID-19: 0.8377  PNEUMONIA: 0.8137  NORMAL: 0.8122 

Epoch 9/19
----------
[train]
LOSS - 0.0298
ACC - 0.9600
PPV - ALL: 1.0000  COVID-19: 1.0000  PNEUMONIA: 1.0000  NORMAL: 1.0000 
RECALL - ALL: 1.0000  COVID-19: 1.0000  PNEUMONIA: 1.0000  NORMAL: 1.0000 
F1 - ALL: 1.0000  COVID-19: 1.0000  PNEUMONIA: 1.0000  NORMAL: 1.0000 
Mask ratio's range: 0.8125 ~ 1.0

[val]
LOSS - 0.4728
ACC - 0.8067
PPV - ALL: 0.8189  COVID-19: 0.8723  PNEUMONIA: 0.7885  NORMAL: 0.7959 
RECALL - ALL: 0.8175  COVID-19: 0.8200  PNEUMONIA: 0.8200  NORMAL: 0.8125 
F1 - ALL: 0.8178  COVID-19: 0.8453  PNEUMONIA: 0.8039  NORMAL: 0.8041 

Epoch 10/19
----------
[train]
LOSS - 0.0602
ACC - 0.9600
PPV - ALL: 1.0000  COVID-19: 1.0000  PNEUMONIA: 1.0000  NORMAL: 1.0000 
RECALL - ALL: 1.0000  COVID-19: 1.0000  PNEUMONIA: 1.0000  NORMAL: 1.0000 
F1 - ALL: 1.0000  COVID-19: 1.0000  PNEUMONIA: 1.0000  NORMAL: 1.0000 
Mask ratio's range: 0.8125 ~ 1.0

[val]
LOSS - 0.4702
ACC - 0.8067
PPV - ALL: 0.8222  COVID-19: 0.8953  PNEUMONIA: 0.7890  NORMAL: 0.7822 
RECALL - ALL: 0.8176  COVID-19: 0.7700  PNEUMONIA: 0.8600  NORMAL: 0.8229 
F1 - ALL: 0.8176  COVID-19: 0.8279  PNEUMONIA: 0.8230  NORMAL: 0.8020 

Epoch 11/19
----------
[train]
LOSS - 0.0379
ACC - 0.9600
PPV - ALL: 1.0000  COVID-19: 1.0000  PNEUMONIA: 1.0000  NORMAL: 1.0000 
RECALL - ALL: 1.0000  COVID-19: 1.0000  PNEUMONIA: 1.0000  NORMAL: 1.0000 
F1 - ALL: 1.0000  COVID-19: 1.0000  PNEUMONIA: 1.0000  NORMAL: 1.0000 
Mask ratio's range: 0.8125 ~ 0.9375

[val]
LOSS - 0.4742
ACC - 0.8167
PPV - ALL: 0.8339  COVID-19: 0.9167  PNEUMONIA: 0.8019  NORMAL: 0.7830 
RECALL - ALL: 0.8282  COVID-19: 0.7700  PNEUMONIA: 0.8500  NORMAL: 0.8646 
F1 - ALL: 0.8280  COVID-19: 0.8370  PNEUMONIA: 0.8252  NORMAL: 0.8218 

Epoch 12/19
----------
[train]
LOSS - 0.0641
ACC - 0.9600
PPV - ALL: 1.0000  COVID-19: 1.0000  PNEUMONIA: 1.0000  NORMAL: 1.0000 
RECALL - ALL: 1.0000  COVID-19: 1.0000  PNEUMONIA: 1.0000  NORMAL: 1.0000 
F1 - ALL: 1.0000  COVID-19: 1.0000  PNEUMONIA: 1.0000  NORMAL: 1.0000 
Mask ratio's range: 0.75 ~ 0.9375

[val]
LOSS - 0.5024
ACC - 0.8000
PPV - ALL: 0.8215  COVID-19: 0.9231  PNEUMONIA: 0.7798  NORMAL: 0.7615 
RECALL - ALL: 0.8115  COVID-19: 0.7200  PNEUMONIA: 0.8500  NORMAL: 0.8646 
F1 - ALL: 0.8107  COVID-19: 0.8090  PNEUMONIA: 0.8134  NORMAL: 0.8098 

Epoch 13/19
----------
[train]
LOSS - 0.0524
ACC - 0.9600
PPV - ALL: 1.0000  COVID-19: 1.0000  PNEUMONIA: 1.0000  NORMAL: 1.0000 
RECALL - ALL: 1.0000  COVID-19: 1.0000  PNEUMONIA: 1.0000  NORMAL: 1.0000 
F1 - ALL: 1.0000  COVID-19: 1.0000  PNEUMONIA: 1.0000  NORMAL: 1.0000 
Mask ratio's range: 0.625 ~ 0.8125

[val]
LOSS - 0.5153
ACC - 0.8067
PPV - ALL: 0.8306  COVID-19: 0.9481  PNEUMONIA: 0.7870  NORMAL: 0.7568 
RECALL - ALL: 0.8183  COVID-19: 0.7300  PNEUMONIA: 0.8500  NORMAL: 0.8750 
F1 - ALL: 0.8179  COVID-19: 0.8249  PNEUMONIA: 0.8173  NORMAL: 0.8116 

Epoch 14/19
----------
[train]
LOSS - 0.0440
ACC - 0.9600
PPV - ALL: 1.0000  COVID-19: 1.0000  PNEUMONIA: 1.0000  NORMAL: 1.0000 
RECALL - ALL: 1.0000  COVID-19: 1.0000  PNEUMONIA: 1.0000  NORMAL: 1.0000 
F1 - ALL: 1.0000  COVID-19: 1.0000  PNEUMONIA: 1.0000  NORMAL: 1.0000 
Mask ratio's range: 0.5 ~ 0.8125

[val]
LOSS - 0.5176
ACC - 0.8000
PPV - ALL: 0.8260  COVID-19: 0.9459  PNEUMONIA: 0.7798  NORMAL: 0.7522 
RECALL - ALL: 0.8118  COVID-19: 0.7000  PNEUMONIA: 0.8500  NORMAL: 0.8854 
F1 - ALL: 0.8105  COVID-19: 0.8046  PNEUMONIA: 0.8134  NORMAL: 0.8134 

Epoch 15/19
----------
[train]
LOSS - 0.0341
ACC - 0.9600
PPV - ALL: 1.0000  COVID-19: 1.0000  PNEUMONIA: 1.0000  NORMAL: 1.0000 
RECALL - ALL: 1.0000  COVID-19: 1.0000  PNEUMONIA: 1.0000  NORMAL: 1.0000 
F1 - ALL: 1.0000  COVID-19: 1.0000  PNEUMONIA: 1.0000  NORMAL: 1.0000 
Mask ratio's range: 0.4375 ~ 0.8125

[val]
LOSS - 0.5204
ACC - 0.8167
PPV - ALL: 0.8402  COVID-19: 0.9481  PNEUMONIA: 0.8113  NORMAL: 0.7611 
RECALL - ALL: 0.8286  COVID-19: 0.7300  PNEUMONIA: 0.8600  NORMAL: 0.8958 
F1 - ALL: 0.8276  COVID-19: 0.8249  PNEUMONIA: 0.8349  NORMAL: 0.8230 

Epoch 16/19
----------
[train]
LOSS - 0.0294
ACC - 0.9600
PPV - ALL: 1.0000  COVID-19: 1.0000  PNEUMONIA: 1.0000  NORMAL: 1.0000 
RECALL - ALL: 1.0000  COVID-19: 1.0000  PNEUMONIA: 1.0000  NORMAL: 1.0000 
F1 - ALL: 1.0000  COVID-19: 1.0000  PNEUMONIA: 1.0000  NORMAL: 1.0000 
Mask ratio's range: 0.4375 ~ 0.75

[val]
LOSS - 0.5031
ACC - 0.8233
PPV - ALL: 0.8435  COVID-19: 0.9383  PNEUMONIA: 0.8286  NORMAL: 0.7636 
RECALL - ALL: 0.8350  COVID-19: 0.7600  PNEUMONIA: 0.8700  NORMAL: 0.8750 
F1 - ALL: 0.8347  COVID-19: 0.8398  PNEUMONIA: 0.8488  NORMAL: 0.8155 

Epoch 17/19
----------
[train]
LOSS - 0.0318
ACC - 0.9600
PPV - ALL: 1.0000  COVID-19: 1.0000  PNEUMONIA: 1.0000  NORMAL: 1.0000 
RECALL - ALL: 1.0000  COVID-19: 1.0000  PNEUMONIA: 1.0000  NORMAL: 1.0000 
F1 - ALL: 1.0000  COVID-19: 1.0000  PNEUMONIA: 1.0000  NORMAL: 1.0000 
Mask ratio's range: 0.4375 ~ 0.75

[val]
LOSS - 0.5106
ACC - 0.8233
PPV - ALL: 0.8432  COVID-19: 0.9383  PNEUMONIA: 0.8208  NORMAL: 0.7706 
RECALL - ALL: 0.8350  COVID-19: 0.7600  PNEUMONIA: 0.8700  NORMAL: 0.8750 
F1 - ALL: 0.8347  COVID-19: 0.8398  PNEUMONIA: 0.8447  NORMAL: 0.8195 

Epoch 18/19
----------
[train]
LOSS - 0.0334
ACC - 0.9600
PPV - ALL: 1.0000  COVID-19: 1.0000  PNEUMONIA: 1.0000  NORMAL: 1.0000 
RECALL - ALL: 1.0000  COVID-19: 1.0000  PNEUMONIA: 1.0000  NORMAL: 1.0000 
F1 - ALL: 1.0000  COVID-19: 1.0000  PNEUMONIA: 1.0000  NORMAL: 1.0000 
Mask ratio's range: 0.4375 ~ 0.75

[val]
LOSS - 0.5316
ACC - 0.8133
PPV - ALL: 0.8371  COVID-19: 0.9474  PNEUMONIA: 0.7982  NORMAL: 0.7658 
RECALL - ALL: 0.8251  COVID-19: 0.7200  PNEUMONIA: 0.8700  NORMAL: 0.8854 
F1 - ALL: 0.8240  COVID-19: 0.8182  PNEUMONIA: 0.8326  NORMAL: 0.8213 

Epoch 19/19
----------
[train]
LOSS - 0.0365
ACC - 0.9600
PPV - ALL: 1.0000  COVID-19: 1.0000  PNEUMONIA: 1.0000  NORMAL: 1.0000 
RECALL - ALL: 1.0000  COVID-19: 1.0000  PNEUMONIA: 1.0000  NORMAL: 1.0000 
F1 - ALL: 1.0000  COVID-19: 1.0000  PNEUMONIA: 1.0000  NORMAL: 1.0000 
Mask ratio's range: 0.4375 ~ 0.75

[val]
LOSS - 0.5331
ACC - 0.7967
PPV - ALL: 0.8237  COVID-19: 0.9444  PNEUMONIA: 0.7699  NORMAL: 0.7568 
RECALL - ALL: 0.8083  COVID-19: 0.6800  PNEUMONIA: 0.8700  NORMAL: 0.8750 
F1 - ALL: 0.8064  COVID-19: 0.7907  PNEUMONIA: 0.8169  NORMAL: 0.8116 


--------------------
[Best results]
ACC - 0.8233
PPV - ALL: 0.8435  COVID-19: 0.9383  PNEUMONIA: 0.8286  NORMAL: 0.7636 
RECALL - ALL: 0.8350  COVID-19: 0.7600  PNEUMONIA: 0.8700  NORMAL: 0.8750 
F1 - ALL: 0.8347  COVID-19: 0.8398  PNEUMONIA: 0.8488  NORMAL: 0.8155 

Training complete in 1m 30s
-------------------- 

--------------------
Model 2
--------------------

Epoch 0/19
----------
[train]
LOSS - 1.0009
ACC - 0.4933
PPV - ALL: 0.5258  COVID-19: 0.4074  PNEUMONIA: 0.6316  NORMAL: 0.5385 
RECALL - ALL: 0.5139  COVID-19: 0.4583  PNEUMONIA: 0.5000  NORMAL: 0.5833 
F1 - ALL: 0.5165  COVID-19: 0.4314  PNEUMONIA: 0.5581  NORMAL: 0.5600 
Mask ratio's range: 1.0 ~ 1.0

[val]
LOSS - 0.9602
ACC - 0.5867
PPV - ALL: 0.7252  COVID-19: 1.0000  PNEUMONIA: 0.5090  NORMAL: 0.6667 
RECALL - ALL: 0.5972  COVID-19: 0.1500  PNEUMONIA: 0.8500  NORMAL: 0.7917 
F1 - ALL: 0.5405  COVID-19: 0.2609  PNEUMONIA: 0.6367  NORMAL: 0.7238 

Epoch 1/19
----------
[train]
LOSS - 0.6710
ACC - 0.8800
PPV - ALL: 0.9193  COVID-19: 0.9524  PNEUMONIA: 0.9167  NORMAL: 0.8889 
RECALL - ALL: 0.9167  COVID-19: 0.8333  PNEUMONIA: 0.9167  NORMAL: 1.0000 
F1 - ALL: 0.9156  COVID-19: 0.8889  PNEUMONIA: 0.9167  NORMAL: 0.9412 
Mask ratio's range: 1.0 ~ 1.0

[val]
LOSS - 0.7636
ACC - 0.7733
PPV - ALL: 0.7907  COVID-19: 0.8000  PNEUMONIA: 0.7168  NORMAL: 0.8554 
RECALL - ALL: 0.7832  COVID-19: 0.8000  PNEUMONIA: 0.8100  NORMAL: 0.7396 
F1 - ALL: 0.7846  COVID-19: 0.8000  PNEUMONIA: 0.7606  NORMAL: 0.7933 

Epoch 2/19
----------
[train]
LOSS - 0.3237
ACC - 0.9600
PPV - ALL: 1.0000  COVID-19: 1.0000  PNEUMONIA: 1.0000  NORMAL: 1.0000 
RECALL - ALL: 1.0000  COVID-19: 1.0000  PNEUMONIA: 1.0000  NORMAL: 1.0000 
F1 - ALL: 1.0000  COVID-19: 1.0000  PNEUMONIA: 1.0000  NORMAL: 1.0000 
Mask ratio's range: 1.0 ~ 1.0

[val]
LOSS - 0.6256
ACC - 0.7800
PPV - ALL: 0.8048  COVID-19: 0.8734  PNEUMONIA: 0.7040  NORMAL: 0.8370 
RECALL - ALL: 0.7907  COVID-19: 0.6900  PNEUMONIA: 0.8800  NORMAL: 0.8021 
F1 - ALL: 0.7908  COVID-19: 0.7709  PNEUMONIA: 0.7822  NORMAL: 0.8192 

Epoch 3/19
----------
[train]
LOSS - 0.1188
ACC - 0.9600
PPV - ALL: 1.0000  COVID-19: 1.0000  PNEUMONIA: 1.0000  NORMAL: 1.0000 
RECALL - ALL: 1.0000  COVID-19: 1.0000  PNEUMONIA: 1.0000  NORMAL: 1.0000 
F1 - ALL: 1.0000  COVID-19: 1.0000  PNEUMONIA: 1.0000  NORMAL: 1.0000 
Mask ratio's range: 1.0 ~ 1.0

[val]
LOSS - 0.5434
ACC - 0.8000
PPV - ALL: 0.8130  COVID-19: 0.8200  PNEUMONIA: 0.7798  NORMAL: 0.8391 
RECALL - ALL: 0.8101  COVID-19: 0.8200  PNEUMONIA: 0.8500  NORMAL: 0.7604 
F1 - ALL: 0.8104  COVID-19: 0.8200  PNEUMONIA: 0.8134  NORMAL: 0.7978 

Epoch 4/19
----------
[train]
LOSS - 0.0477
ACC - 0.9600
PPV - ALL: 1.0000  COVID-19: 1.0000  PNEUMONIA: 1.0000  NORMAL: 1.0000 
RECALL - ALL: 1.0000  COVID-19: 1.0000  PNEUMONIA: 1.0000  NORMAL: 1.0000 
F1 - ALL: 1.0000  COVID-19: 1.0000  PNEUMONIA: 1.0000  NORMAL: 1.0000 
Mask ratio's range: 0.9375 ~ 1.0

[val]
LOSS - 0.5132
ACC - 0.7933
PPV - ALL: 0.8061  COVID-19: 0.8200  PNEUMONIA: 0.7706  NORMAL: 0.8276 
RECALL - ALL: 0.8033  COVID-19: 0.8200  PNEUMONIA: 0.8400  NORMAL: 0.7500 
F1 - ALL: 0.8036  COVID-19: 0.8200  PNEUMONIA: 0.8038  NORMAL: 0.7869 

Epoch 5/19
----------
[train]
LOSS - 0.0296
ACC - 0.9600
PPV - ALL: 1.0000  COVID-19: 1.0000  PNEUMONIA: 1.0000  NORMAL: 1.0000 
RECALL - ALL: 1.0000  COVID-19: 1.0000  PNEUMONIA: 1.0000  NORMAL: 1.0000 
F1 - ALL: 1.0000  COVID-19: 1.0000  PNEUMONIA: 1.0000  NORMAL: 1.0000 
Mask ratio's range: 0.875 ~ 1.0

[val]
LOSS - 0.5076
ACC - 0.7967
PPV - ALL: 0.8105  COVID-19: 0.8265  PNEUMONIA: 0.7658  NORMAL: 0.8391 
RECALL - ALL: 0.8068  COVID-19: 0.8100  PNEUMONIA: 0.8500  NORMAL: 0.7604 
F1 - ALL: 0.8072  COVID-19: 0.8182  PNEUMONIA: 0.8057  NORMAL: 0.7978 

Epoch 6/19
----------
[train]
LOSS - 0.0310
ACC - 0.9600
PPV - ALL: 1.0000  COVID-19: 1.0000  PNEUMONIA: 1.0000  NORMAL: 1.0000 
RECALL - ALL: 1.0000  COVID-19: 1.0000  PNEUMONIA: 1.0000  NORMAL: 1.0000 
F1 - ALL: 1.0000  COVID-19: 1.0000  PNEUMONIA: 1.0000  NORMAL: 1.0000 
Mask ratio's range: 0.8125 ~ 1.0

[val]
LOSS - 0.5210
ACC - 0.8000
PPV - ALL: 0.8147  COVID-19: 0.8421  PNEUMONIA: 0.7611  NORMAL: 0.8409 
RECALL - ALL: 0.8103  COVID-19: 0.8000  PNEUMONIA: 0.8600  NORMAL: 0.7708 
F1 - ALL: 0.8108  COVID-19: 0.8205  PNEUMONIA: 0.8075  NORMAL: 0.8043 

Epoch 7/19
----------
[train]
LOSS - 0.0391
ACC - 0.9600
PPV - ALL: 1.0000  COVID-19: 1.0000  PNEUMONIA: 1.0000  NORMAL: 1.0000 
RECALL - ALL: 1.0000  COVID-19: 1.0000  PNEUMONIA: 1.0000  NORMAL: 1.0000 
F1 - ALL: 1.0000  COVID-19: 1.0000  PNEUMONIA: 1.0000  NORMAL: 1.0000 
Mask ratio's range: 0.8125 ~ 0.9375

[val]
LOSS - 0.5114
ACC - 0.8033
PPV - ALL: 0.8183  COVID-19: 0.8511  PNEUMONIA: 0.7611  NORMAL: 0.8427 
RECALL - ALL: 0.8137  COVID-19: 0.8000  PNEUMONIA: 0.8600  NORMAL: 0.7812 
F1 - ALL: 0.8144  COVID-19: 0.8248  PNEUMONIA: 0.8075  NORMAL: 0.8108 

Epoch 8/19
----------
[train]
LOSS - 0.0328
ACC - 0.9600
PPV - ALL: 1.0000  COVID-19: 1.0000  PNEUMONIA: 1.0000  NORMAL: 1.0000 
RECALL - ALL: 1.0000  COVID-19: 1.0000  PNEUMONIA: 1.0000  NORMAL: 1.0000 
F1 - ALL: 1.0000  COVID-19: 1.0000  PNEUMONIA: 1.0000  NORMAL: 1.0000 
Mask ratio's range: 0.75 ~ 0.9375

[val]
LOSS - 0.4948
ACC - 0.7933
PPV - ALL: 0.8113  COVID-19: 0.8636  PNEUMONIA: 0.7350  NORMAL: 0.8352 
RECALL - ALL: 0.8039  COVID-19: 0.7600  PNEUMONIA: 0.8600  NORMAL: 0.7917 
F1 - ALL: 0.8047  COVID-19: 0.8085  PNEUMONIA: 0.7926  NORMAL: 0.8129 

Epoch 9/19
----------
[train]
LOSS - 0.0370
ACC - 0.9600
PPV - ALL: 1.0000  COVID-19: 1.0000  PNEUMONIA: 1.0000  NORMAL: 1.0000 
RECALL - ALL: 1.0000  COVID-19: 1.0000  PNEUMONIA: 1.0000  NORMAL: 1.0000 
F1 - ALL: 1.0000  COVID-19: 1.0000  PNEUMONIA: 1.0000  NORMAL: 1.0000 
Mask ratio's range: 0.75 ~ 0.9375

[val]
LOSS - 0.4930
ACC - 0.8033
PPV - ALL: 0.8224  COVID-19: 0.8941  PNEUMONIA: 0.7414  NORMAL: 0.8316 
RECALL - ALL: 0.8143  COVID-19: 0.7600  PNEUMONIA: 0.8600  NORMAL: 0.8229 
F1 - ALL: 0.8150  COVID-19: 0.8216  PNEUMONIA: 0.7963  NORMAL: 0.8272 

Epoch 10/19
----------
[train]
LOSS - 0.0354
ACC - 0.9600
PPV - ALL: 1.0000  COVID-19: 1.0000  PNEUMONIA: 1.0000  NORMAL: 1.0000 
RECALL - ALL: 1.0000  COVID-19: 1.0000  PNEUMONIA: 1.0000  NORMAL: 1.0000 
F1 - ALL: 1.0000  COVID-19: 1.0000  PNEUMONIA: 1.0000  NORMAL: 1.0000 
Mask ratio's range: 0.6875 ~ 0.875

[val]
LOSS - 0.5114
ACC - 0.7933
PPV - ALL: 0.8144  COVID-19: 0.9024  PNEUMONIA: 0.7265  NORMAL: 0.8144 
RECALL - ALL: 0.8043  COVID-19: 0.7400  PNEUMONIA: 0.8500  NORMAL: 0.8229 
F1 - ALL: 0.8051  COVID-19: 0.8132  PNEUMONIA: 0.7834  NORMAL: 0.8186 

Epoch 11/19
----------
[train]
LOSS - 0.0326
ACC - 0.9600
PPV - ALL: 1.0000  COVID-19: 1.0000  PNEUMONIA: 1.0000  NORMAL: 1.0000 
RECALL - ALL: 1.0000  COVID-19: 1.0000  PNEUMONIA: 1.0000  NORMAL: 1.0000 
F1 - ALL: 1.0000  COVID-19: 1.0000  PNEUMONIA: 1.0000  NORMAL: 1.0000 
Mask ratio's range: 0.6875 ~ 0.8125

[val]
LOSS - 0.5115
ACC - 0.7900
PPV - ALL: 0.8153  COVID-19: 0.9211  PNEUMONIA: 0.7227  NORMAL: 0.8020 
RECALL - ALL: 0.8013  COVID-19: 0.7000  PNEUMONIA: 0.8600  NORMAL: 0.8438 
F1 - ALL: 0.8011  COVID-19: 0.7955  PNEUMONIA: 0.7854  NORMAL: 0.8224 

Epoch 12/19
----------
[train]
LOSS - 0.0369
ACC - 0.9600
PPV - ALL: 1.0000  COVID-19: 1.0000  PNEUMONIA: 1.0000  NORMAL: 1.0000 
RECALL - ALL: 1.0000  COVID-19: 1.0000  PNEUMONIA: 1.0000  NORMAL: 1.0000 
F1 - ALL: 1.0000  COVID-19: 1.0000  PNEUMONIA: 1.0000  NORMAL: 1.0000 
Mask ratio's range: 0.6875 ~ 0.8125

[val]
LOSS - 0.4973
ACC - 0.7900
PPV - ALL: 0.8155  COVID-19: 0.9200  PNEUMONIA: 0.7227  NORMAL: 0.8039 
RECALL - ALL: 0.8014  COVID-19: 0.6900  PNEUMONIA: 0.8600  NORMAL: 0.8542 
F1 - ALL: 0.8008  COVID-19: 0.7886  PNEUMONIA: 0.7854  NORMAL: 0.8283 

Epoch 13/19
----------
[train]
LOSS - 0.0448
ACC - 0.9600
PPV - ALL: 1.0000  COVID-19: 1.0000  PNEUMONIA: 1.0000  NORMAL: 1.0000 
RECALL - ALL: 1.0000  COVID-19: 1.0000  PNEUMONIA: 1.0000  NORMAL: 1.0000 
F1 - ALL: 1.0000  COVID-19: 1.0000  PNEUMONIA: 1.0000  NORMAL: 1.0000 
Mask ratio's range: 0.5625 ~ 0.8125

[val]
LOSS - 0.5266
ACC - 0.7800
PPV - ALL: 0.8110  COVID-19: 0.9429  PNEUMONIA: 0.7143  NORMAL: 0.7757 
RECALL - ALL: 0.7915  COVID-19: 0.6600  PNEUMONIA: 0.8500  NORMAL: 0.8646 
F1 - ALL: 0.7902  COVID-19: 0.7765  PNEUMONIA: 0.7763  NORMAL: 0.8177 

Epoch 14/19
----------
[train]
LOSS - 0.0381
ACC - 0.9600
PPV - ALL: 1.0000  COVID-19: 1.0000  PNEUMONIA: 1.0000  NORMAL: 1.0000 
RECALL - ALL: 1.0000  COVID-19: 1.0000  PNEUMONIA: 1.0000  NORMAL: 1.0000 
F1 - ALL: 1.0000  COVID-19: 1.0000  PNEUMONIA: 1.0000  NORMAL: 1.0000 
Mask ratio's range: 0.5625 ~ 0.8125

[val]
LOSS - 0.5320
ACC - 0.7767
PPV - ALL: 0.8087  COVID-19: 0.9420  PNEUMONIA: 0.7083  NORMAL: 0.7757 
RECALL - ALL: 0.7882  COVID-19: 0.6500  PNEUMONIA: 0.8500  NORMAL: 0.8646 
F1 - ALL: 0.7865  COVID-19: 0.7692  PNEUMONIA: 0.7727  NORMAL: 0.8177 

Epoch 15/19
----------
[train]
LOSS - 0.0515
ACC - 0.9600
PPV - ALL: 1.0000  COVID-19: 1.0000  PNEUMONIA: 1.0000  NORMAL: 1.0000 
RECALL - ALL: 1.0000  COVID-19: 1.0000  PNEUMONIA: 1.0000  NORMAL: 1.0000 
F1 - ALL: 1.0000  COVID-19: 1.0000  PNEUMONIA: 1.0000  NORMAL: 1.0000 
Mask ratio's range: 0.5625 ~ 0.75

[val]
LOSS - 0.5505
ACC - 0.7733
PPV - ALL: 0.8060  COVID-19: 0.9412  PNEUMONIA: 0.7083  NORMAL: 0.7685 
RECALL - ALL: 0.7849  COVID-19: 0.6400  PNEUMONIA: 0.8500  NORMAL: 0.8646 
F1 - ALL: 0.7828  COVID-19: 0.7619  PNEUMONIA: 0.7727  NORMAL: 0.8137 

Epoch 16/19
----------
[train]
LOSS - 0.0365
ACC - 0.9600
PPV - ALL: 1.0000  COVID-19: 1.0000  PNEUMONIA: 1.0000  NORMAL: 1.0000 
RECALL - ALL: 1.0000  COVID-19: 1.0000  PNEUMONIA: 1.0000  NORMAL: 1.0000 
F1 - ALL: 1.0000  COVID-19: 1.0000  PNEUMONIA: 1.0000  NORMAL: 1.0000 
Mask ratio's range: 0.5 ~ 0.75

[val]
LOSS - 0.5838
ACC - 0.7800
PPV - ALL: 0.8146  COVID-19: 0.9545  PNEUMONIA: 0.7167  NORMAL: 0.7727 
RECALL - ALL: 0.7918  COVID-19: 0.6300  PNEUMONIA: 0.8600  NORMAL: 0.8854 
F1 - ALL: 0.7887  COVID-19: 0.7590  PNEUMONIA: 0.7818  NORMAL: 0.8252 

Epoch 17/19
----------
[train]
LOSS - 0.0330
ACC - 0.9600
PPV - ALL: 1.0000  COVID-19: 1.0000  PNEUMONIA: 1.0000  NORMAL: 1.0000 
RECALL - ALL: 1.0000  COVID-19: 1.0000  PNEUMONIA: 1.0000  NORMAL: 1.0000 
F1 - ALL: 1.0000  COVID-19: 1.0000  PNEUMONIA: 1.0000  NORMAL: 1.0000 
Mask ratio's range: 0.5 ~ 0.75

[val]
LOSS - 0.5718
ACC - 0.7667
PPV - ALL: 0.8050  COVID-19: 0.9531  PNEUMONIA: 0.6935  NORMAL: 0.7685 
RECALL - ALL: 0.7782  COVID-19: 0.6100  PNEUMONIA: 0.8600  NORMAL: 0.8646 
F1 - ALL: 0.7751  COVID-19: 0.7439  PNEUMONIA: 0.7678  NORMAL: 0.8137 

Epoch 18/19
----------
[train]
LOSS - 0.0386
ACC - 0.9600
PPV - ALL: 1.0000  COVID-19: 1.0000  PNEUMONIA: 1.0000  NORMAL: 1.0000 
RECALL - ALL: 1.0000  COVID-19: 1.0000  PNEUMONIA: 1.0000  NORMAL: 1.0000 
F1 - ALL: 1.0000  COVID-19: 1.0000  PNEUMONIA: 1.0000  NORMAL: 1.0000 
Mask ratio's range: 0.4375 ~ 0.75

[val]
LOSS - 0.5759
ACC - 0.7700
PPV - ALL: 0.8109  COVID-19: 0.9683  PNEUMONIA: 0.6960  NORMAL: 0.7685 
RECALL - ALL: 0.7815  COVID-19: 0.6100  PNEUMONIA: 0.8700  NORMAL: 0.8646 
F1 - ALL: 0.7785  COVID-19: 0.7485  PNEUMONIA: 0.7733  NORMAL: 0.8137 

Epoch 19/19
----------
[train]
LOSS - 0.0306
ACC - 0.9600
PPV - ALL: 1.0000  COVID-19: 1.0000  PNEUMONIA: 1.0000  NORMAL: 1.0000 
RECALL - ALL: 1.0000  COVID-19: 1.0000  PNEUMONIA: 1.0000  NORMAL: 1.0000 
F1 - ALL: 1.0000  COVID-19: 1.0000  PNEUMONIA: 1.0000  NORMAL: 1.0000 
Mask ratio's range: 0.4375 ~ 0.75

[val]
LOSS - 0.5957
ACC - 0.7667
PPV - ALL: 0.8131  COVID-19: 0.9833  PNEUMONIA: 0.6875  NORMAL: 0.7685 
RECALL - ALL: 0.7782  COVID-19: 0.5900  PNEUMONIA: 0.8800  NORMAL: 0.8646 
F1 - ALL: 0.7744  COVID-19: 0.7375  PNEUMONIA: 0.7719  NORMAL: 0.8137 


--------------------
[Best results]
ACC - 0.8033
PPV - ALL: 0.8183  COVID-19: 0.8511  PNEUMONIA: 0.7611  NORMAL: 0.8427 
RECALL - ALL: 0.8137  COVID-19: 0.8000  PNEUMONIA: 0.8600  NORMAL: 0.7812 
F1 - ALL: 0.8144  COVID-19: 0.8248  PNEUMONIA: 0.8075  NORMAL: 0.8108 

Training complete in 1m 30s
-------------------- 

--------------------
Model 3
--------------------

Epoch 0/19
----------
[train]
LOSS - 1.0367
ACC - 0.4000
PPV - ALL: 0.4427  COVID-19: 0.3750  PNEUMONIA: 0.6111  NORMAL: 0.3421 
RECALL - ALL: 0.4167  COVID-19: 0.2500  PNEUMONIA: 0.4583  NORMAL: 0.5417 
F1 - ALL: 0.4144  COVID-19: 0.3000  PNEUMONIA: 0.5238  NORMAL: 0.4194 
Mask ratio's range: 1.0 ~ 1.0

[val]
LOSS - 1.0457
ACC - 0.4700
PPV - ALL: 0.3231  COVID-19: 0.0000  PNEUMONIA: 0.4592  NORMAL: 0.5100 
RECALL - ALL: 0.4771  COVID-19: 0.0000  PNEUMONIA: 0.9000  NORMAL: 0.5312 
F1 - ALL: 0.3762  COVID-19: 0.0000  PNEUMONIA: 0.6081  NORMAL: 0.5204 

Epoch 1/19
----------
[train]
LOSS - 0.6542
ACC - 0.8933
PPV - ALL: 0.9379  COVID-19: 1.0000  PNEUMONIA: 0.9565  NORMAL: 0.8571 
RECALL - ALL: 0.9306  COVID-19: 0.8750  PNEUMONIA: 0.9167  NORMAL: 1.0000 
F1 - ALL: 0.9309  COVID-19: 0.9333  PNEUMONIA: 0.9362  NORMAL: 0.9231 
Mask ratio's range: 1.0 ~ 1.0

[val]
LOSS - 0.7776
ACC - 0.7333
PPV - ALL: 0.7658  COVID-19: 0.8889  PNEUMONIA: 0.6967  NORMAL: 0.7117 
RECALL - ALL: 0.7443  COVID-19: 0.5600  PNEUMONIA: 0.8500  NORMAL: 0.8229 
F1 - ALL: 0.7387  COVID-19: 0.6871  PNEUMONIA: 0.7658  NORMAL: 0.7633 

Epoch 2/19
----------
[train]
LOSS - 0.2733
ACC - 0.9467
PPV - ALL: 0.9867  COVID-19: 1.0000  PNEUMONIA: 0.9600  NORMAL: 1.0000 
RECALL - ALL: 0.9861  COVID-19: 0.9583  PNEUMONIA: 1.0000  NORMAL: 1.0000 
F1 - ALL: 0.9861  COVID-19: 0.9787  PNEUMONIA: 0.9796  NORMAL: 1.0000 
Mask ratio's range: 1.0 ~ 1.0

[val]
LOSS - 0.6296
ACC - 0.7800
PPV - ALL: 0.8013  COVID-19: 0.8875  PNEUMONIA: 0.7227  NORMAL: 0.7938 
RECALL - ALL: 0.7907  COVID-19: 0.7100  PNEUMONIA: 0.8600  NORMAL: 0.8021 
F1 - ALL: 0.7907  COVID-19: 0.7889  PNEUMONIA: 0.7854  NORMAL: 0.7979 

Epoch 3/19
----------
[train]
LOSS - 0.1046
ACC - 0.9600
PPV - ALL: 1.0000  COVID-19: 1.0000  PNEUMONIA: 1.0000  NORMAL: 1.0000 
RECALL - ALL: 1.0000  COVID-19: 1.0000  PNEUMONIA: 1.0000  NORMAL: 1.0000 
F1 - ALL: 1.0000  COVID-19: 1.0000  PNEUMONIA: 1.0000  NORMAL: 1.0000 
Mask ratio's range: 1.0 ~ 1.0

[val]
LOSS - 0.5544
ACC - 0.7967
PPV - ALL: 0.8118  COVID-19: 0.8571  PNEUMONIA: 0.7522  NORMAL: 0.8261 
RECALL - ALL: 0.8072  COVID-19: 0.7800  PNEUMONIA: 0.8500  NORMAL: 0.7917 
F1 - ALL: 0.8078  COVID-19: 0.8167  PNEUMONIA: 0.7981  NORMAL: 0.8085 

Epoch 4/19
----------
[train]
LOSS - 0.0475
ACC - 0.9600
PPV - ALL: 1.0000  COVID-19: 1.0000  PNEUMONIA: 1.0000  NORMAL: 1.0000 
RECALL - ALL: 1.0000  COVID-19: 1.0000  PNEUMONIA: 1.0000  NORMAL: 1.0000 
F1 - ALL: 1.0000  COVID-19: 1.0000  PNEUMONIA: 1.0000  NORMAL: 1.0000 
Mask ratio's range: 0.9375 ~ 1.0

[val]
LOSS - 0.5157
ACC - 0.8067
PPV - ALL: 0.8202  COVID-19: 0.8469  PNEUMONIA: 0.7727  NORMAL: 0.8409 
RECALL - ALL: 0.8169  COVID-19: 0.8300  PNEUMONIA: 0.8500  NORMAL: 0.7708 
F1 - ALL: 0.8174  COVID-19: 0.8384  PNEUMONIA: 0.8095  NORMAL: 0.8043 

Epoch 5/19
----------
[train]
LOSS - 0.0347
ACC - 0.9600
PPV - ALL: 1.0000  COVID-19: 1.0000  PNEUMONIA: 1.0000  NORMAL: 1.0000 
RECALL - ALL: 1.0000  COVID-19: 1.0000  PNEUMONIA: 1.0000  NORMAL: 1.0000 
F1 - ALL: 1.0000  COVID-19: 1.0000  PNEUMONIA: 1.0000  NORMAL: 1.0000 
Mask ratio's range: 0.875 ~ 1.0

[val]
LOSS - 0.5033
ACC - 0.8067
PPV - ALL: 0.8200  COVID-19: 0.8696  PNEUMONIA: 0.7778  NORMAL: 0.8125 
RECALL - ALL: 0.8175  COVID-19: 0.8000  PNEUMONIA: 0.8400  NORMAL: 0.8125 
F1 - ALL: 0.8178  COVID-19: 0.8333  PNEUMONIA: 0.8077  NORMAL: 0.8125 

Epoch 6/19
----------
[train]
LOSS - 0.0378
ACC - 0.9600
PPV - ALL: 1.0000  COVID-19: 1.0000  PNEUMONIA: 1.0000  NORMAL: 1.0000 
RECALL - ALL: 1.0000  COVID-19: 1.0000  PNEUMONIA: 1.0000  NORMAL: 1.0000 
F1 - ALL: 1.0000  COVID-19: 1.0000  PNEUMONIA: 1.0000  NORMAL: 1.0000 
Mask ratio's range: 0.75 ~ 1.0

[val]
LOSS - 0.4948
ACC - 0.8100
PPV - ALL: 0.8240  COVID-19: 0.8804  PNEUMONIA: 0.7706  NORMAL: 0.8211 
RECALL - ALL: 0.8208  COVID-19: 0.8100  PNEUMONIA: 0.8400  NORMAL: 0.8125 
F1 - ALL: 0.8214  COVID-19: 0.8437  PNEUMONIA: 0.8038  NORMAL: 0.8168 

Epoch 7/19
----------
[train]
LOSS - 0.0306
ACC - 0.9600
PPV - ALL: 1.0000  COVID-19: 1.0000  PNEUMONIA: 1.0000  NORMAL: 1.0000 
RECALL - ALL: 1.0000  COVID-19: 1.0000  PNEUMONIA: 1.0000  NORMAL: 1.0000 
F1 - ALL: 1.0000  COVID-19: 1.0000  PNEUMONIA: 1.0000  NORMAL: 1.0000 
Mask ratio's range: 0.6875 ~ 1.0

[val]
LOSS - 0.4832
ACC - 0.8067
PPV - ALL: 0.8213  COVID-19: 0.8791  PNEUMONIA: 0.7636  NORMAL: 0.8211 
RECALL - ALL: 0.8175  COVID-19: 0.8000  PNEUMONIA: 0.8400  NORMAL: 0.8125 
F1 - ALL: 0.8182  COVID-19: 0.8377  PNEUMONIA: 0.8000  NORMAL: 0.8168 

Epoch 8/19
----------
[train]
LOSS - 0.0395
ACC - 0.9600
PPV - ALL: 1.0000  COVID-19: 1.0000  PNEUMONIA: 1.0000  NORMAL: 1.0000 
RECALL - ALL: 1.0000  COVID-19: 1.0000  PNEUMONIA: 1.0000  NORMAL: 1.0000 
F1 - ALL: 1.0000  COVID-19: 1.0000  PNEUMONIA: 1.0000  NORMAL: 1.0000 
Mask ratio's range: 0.625 ~ 0.9375

[val]
LOSS - 0.4931
ACC - 0.8067
PPV - ALL: 0.8242  COVID-19: 0.9048  PNEUMONIA: 0.7699  NORMAL: 0.7980 
RECALL - ALL: 0.8176  COVID-19: 0.7600  PNEUMONIA: 0.8700  NORMAL: 0.8229 
F1 - ALL: 0.8178  COVID-19: 0.8261  PNEUMONIA: 0.8169  NORMAL: 0.8103 

Epoch 9/19
----------
[train]
LOSS - 0.0636
ACC - 0.9600
PPV - ALL: 1.0000  COVID-19: 1.0000  PNEUMONIA: 1.0000  NORMAL: 1.0000 
RECALL - ALL: 1.0000  COVID-19: 1.0000  PNEUMONIA: 1.0000  NORMAL: 1.0000 
F1 - ALL: 1.0000  COVID-19: 1.0000  PNEUMONIA: 1.0000  NORMAL: 1.0000 
Mask ratio's range: 0.625 ~ 0.9375

[val]
LOSS - 0.5223
ACC - 0.8000
PPV - ALL: 0.8211  COVID-19: 0.9241  PNEUMONIA: 0.7699  NORMAL: 0.7692 
RECALL - ALL: 0.8111  COVID-19: 0.7300  PNEUMONIA: 0.8700  NORMAL: 0.8333 
F1 - ALL: 0.8109  COVID-19: 0.8157  PNEUMONIA: 0.8169  NORMAL: 0.8000 

Epoch 10/19
----------
[train]
LOSS - 0.0448
ACC - 0.9600
PPV - ALL: 1.0000  COVID-19: 1.0000  PNEUMONIA: 1.0000  NORMAL: 1.0000 
RECALL - ALL: 1.0000  COVID-19: 1.0000  PNEUMONIA: 1.0000  NORMAL: 1.0000 
F1 - ALL: 1.0000  COVID-19: 1.0000  PNEUMONIA: 1.0000  NORMAL: 1.0000 
Mask ratio's range: 0.5 ~ 0.9375

[val]
LOSS - 0.5406
ACC - 0.7967
PPV - ALL: 0.8226  COVID-19: 0.9459  PNEUMONIA: 0.7672  NORMAL: 0.7547 
RECALL - ALL: 0.8078  COVID-19: 0.7000  PNEUMONIA: 0.8900  NORMAL: 0.8333 
F1 - ALL: 0.8069  COVID-19: 0.8046  PNEUMONIA: 0.8241  NORMAL: 0.7921 

Epoch 11/19
----------
[train]
LOSS - 0.0384
ACC - 0.9600
PPV - ALL: 1.0000  COVID-19: 1.0000  PNEUMONIA: 1.0000  NORMAL: 1.0000 
RECALL - ALL: 1.0000  COVID-19: 1.0000  PNEUMONIA: 1.0000  NORMAL: 1.0000 
F1 - ALL: 1.0000  COVID-19: 1.0000  PNEUMONIA: 1.0000  NORMAL: 1.0000 
Mask ratio's range: 0.5 ~ 0.875

[val]
LOSS - 0.5414
ACC - 0.7967
PPV - ALL: 0.8226  COVID-19: 0.9459  PNEUMONIA: 0.7672  NORMAL: 0.7547 
RECALL - ALL: 0.8078  COVID-19: 0.7000  PNEUMONIA: 0.8900  NORMAL: 0.8333 
F1 - ALL: 0.8069  COVID-19: 0.8046  PNEUMONIA: 0.8241  NORMAL: 0.7921 

Epoch 12/19
----------
[train]
LOSS - 0.0448
ACC - 0.9600
PPV - ALL: 1.0000  COVID-19: 1.0000  PNEUMONIA: 1.0000  NORMAL: 1.0000 
RECALL - ALL: 1.0000  COVID-19: 1.0000  PNEUMONIA: 1.0000  NORMAL: 1.0000 
F1 - ALL: 1.0000  COVID-19: 1.0000  PNEUMONIA: 1.0000  NORMAL: 1.0000 
Mask ratio's range: 0.5 ~ 0.875

[val]
LOSS - 0.5586
ACC - 0.7900
PPV - ALL: 0.8178  COVID-19: 0.9444  PNEUMONIA: 0.7542  NORMAL: 0.7547 
RECALL - ALL: 0.8011  COVID-19: 0.6800  PNEUMONIA: 0.8900  NORMAL: 0.8333 
F1 - ALL: 0.7998  COVID-19: 0.7907  PNEUMONIA: 0.8165  NORMAL: 0.7921 

Epoch 13/19
----------
[train]
LOSS - 0.0535
ACC - 0.9600
PPV - ALL: 1.0000  COVID-19: 1.0000  PNEUMONIA: 1.0000  NORMAL: 1.0000 
RECALL - ALL: 1.0000  COVID-19: 1.0000  PNEUMONIA: 1.0000  NORMAL: 1.0000 
F1 - ALL: 1.0000  COVID-19: 1.0000  PNEUMONIA: 1.0000  NORMAL: 1.0000 
Mask ratio's range: 0.5 ~ 0.875

[val]
LOSS - 0.5505
ACC - 0.7900
PPV - ALL: 0.8176  COVID-19: 0.9444  PNEUMONIA: 0.7607  NORMAL: 0.7477 
RECALL - ALL: 0.8011  COVID-19: 0.6800  PNEUMONIA: 0.8900  NORMAL: 0.8333 
F1 - ALL: 0.7997  COVID-19: 0.7907  PNEUMONIA: 0.8203  NORMAL: 0.7882 

Epoch 14/19
----------
[train]
LOSS - 0.0308
ACC - 0.9600
PPV - ALL: 1.0000  COVID-19: 1.0000  PNEUMONIA: 1.0000  NORMAL: 1.0000 
RECALL - ALL: 1.0000  COVID-19: 1.0000  PNEUMONIA: 1.0000  NORMAL: 1.0000 
F1 - ALL: 1.0000  COVID-19: 1.0000  PNEUMONIA: 1.0000  NORMAL: 1.0000 
Mask ratio's range: 0.5 ~ 0.8125

[val]
LOSS - 0.5668
ACC - 0.7933
PPV - ALL: 0.8200  COVID-19: 0.9452  PNEUMONIA: 0.7672  NORMAL: 0.7477 
RECALL - ALL: 0.8044  COVID-19: 0.6900  PNEUMONIA: 0.8900  NORMAL: 0.8333 
F1 - ALL: 0.8033  COVID-19: 0.7977  PNEUMONIA: 0.8241  NORMAL: 0.7882 

Epoch 15/19
----------
[train]
LOSS - 0.0322
ACC - 0.9600
PPV - ALL: 1.0000  COVID-19: 1.0000  PNEUMONIA: 1.0000  NORMAL: 1.0000 
RECALL - ALL: 1.0000  COVID-19: 1.0000  PNEUMONIA: 1.0000  NORMAL: 1.0000 
F1 - ALL: 1.0000  COVID-19: 1.0000  PNEUMONIA: 1.0000  NORMAL: 1.0000 
Mask ratio's range: 0.5 ~ 0.8125

[val]
LOSS - 0.5600
ACC - 0.7933
PPV - ALL: 0.8200  COVID-19: 0.9452  PNEUMONIA: 0.7672  NORMAL: 0.7477 
RECALL - ALL: 0.8044  COVID-19: 0.6900  PNEUMONIA: 0.8900  NORMAL: 0.8333 
F1 - ALL: 0.8033  COVID-19: 0.7977  PNEUMONIA: 0.8241  NORMAL: 0.7882 

Epoch 16/19
----------
[train]
LOSS - 0.0427
ACC - 0.9600
PPV - ALL: 1.0000  COVID-19: 1.0000  PNEUMONIA: 1.0000  NORMAL: 1.0000 
RECALL - ALL: 1.0000  COVID-19: 1.0000  PNEUMONIA: 1.0000  NORMAL: 1.0000 
F1 - ALL: 1.0000  COVID-19: 1.0000  PNEUMONIA: 1.0000  NORMAL: 1.0000 
Mask ratio's range: 0.5 ~ 0.75

[val]
LOSS - 0.5767
ACC - 0.7900
PPV - ALL: 0.8176  COVID-19: 0.9444  PNEUMONIA: 0.7607  NORMAL: 0.7477 
RECALL - ALL: 0.8011  COVID-19: 0.6800  PNEUMONIA: 0.8900  NORMAL: 0.8333 
F1 - ALL: 0.7997  COVID-19: 0.7907  PNEUMONIA: 0.8203  NORMAL: 0.7882 

Epoch 17/19
----------
[train]
LOSS - 0.0264
ACC - 0.9600
PPV - ALL: 1.0000  COVID-19: 1.0000  PNEUMONIA: 1.0000  NORMAL: 1.0000 
RECALL - ALL: 1.0000  COVID-19: 1.0000  PNEUMONIA: 1.0000  NORMAL: 1.0000 
F1 - ALL: 1.0000  COVID-19: 1.0000  PNEUMONIA: 1.0000  NORMAL: 1.0000 
Mask ratio's range: 0.5 ~ 0.75

[val]
LOSS - 0.5624
ACC - 0.7933
PPV - ALL: 0.8200  COVID-19: 0.9452  PNEUMONIA: 0.7672  NORMAL: 0.7477 
RECALL - ALL: 0.8044  COVID-19: 0.6900  PNEUMONIA: 0.8900  NORMAL: 0.8333 
F1 - ALL: 0.8033  COVID-19: 0.7977  PNEUMONIA: 0.8241  NORMAL: 0.7882 

Epoch 18/19
----------
[train]
LOSS - 0.0314
ACC - 0.9600
PPV - ALL: 1.0000  COVID-19: 1.0000  PNEUMONIA: 1.0000  NORMAL: 1.0000 
RECALL - ALL: 1.0000  COVID-19: 1.0000  PNEUMONIA: 1.0000  NORMAL: 1.0000 
F1 - ALL: 1.0000  COVID-19: 1.0000  PNEUMONIA: 1.0000  NORMAL: 1.0000 
Mask ratio's range: 0.5 ~ 0.75

[val]
LOSS - 0.5693
ACC - 0.7933
PPV - ALL: 0.8228  COVID-19: 0.9577  PNEUMONIA: 0.7607  NORMAL: 0.7500 
RECALL - ALL: 0.8046  COVID-19: 0.6800  PNEUMONIA: 0.8900  NORMAL: 0.8438 
F1 - ALL: 0.8032  COVID-19: 0.7953  PNEUMONIA: 0.8203  NORMAL: 0.7941 

Epoch 19/19
----------
[train]
LOSS - 0.0287
ACC - 0.9600
PPV - ALL: 1.0000  COVID-19: 1.0000  PNEUMONIA: 1.0000  NORMAL: 1.0000 
RECALL - ALL: 1.0000  COVID-19: 1.0000  PNEUMONIA: 1.0000  NORMAL: 1.0000 
F1 - ALL: 1.0000  COVID-19: 1.0000  PNEUMONIA: 1.0000  NORMAL: 1.0000 
Mask ratio's range: 0.5 ~ 0.75

[val]
LOSS - 0.5576
ACC - 0.8000
PPV - ALL: 0.8256  COVID-19: 0.9459  PNEUMONIA: 0.7739  NORMAL: 0.7570 
RECALL - ALL: 0.8113  COVID-19: 0.7000  PNEUMONIA: 0.8900  NORMAL: 0.8438 
F1 - ALL: 0.8102  COVID-19: 0.8046  PNEUMONIA: 0.8279  NORMAL: 0.7980 


--------------------
[Best results]
ACC - 0.8100
PPV - ALL: 0.8240  COVID-19: 0.8804  PNEUMONIA: 0.7706  NORMAL: 0.8211 
RECALL - ALL: 0.8208  COVID-19: 0.8100  PNEUMONIA: 0.8400  NORMAL: 0.8125 
F1 - ALL: 0.8214  COVID-19: 0.8437  PNEUMONIA: 0.8038  NORMAL: 0.8168 

Training complete in 1m 30s
-------------------- 

--------------------
Model 4
--------------------

Epoch 0/19
----------
[train]
LOSS - 0.9908
ACC - 0.4400
PPV - ALL: 0.4673  COVID-19: 0.5333  PNEUMONIA: 0.4211  NORMAL: 0.4474 
RECALL - ALL: 0.4583  COVID-19: 0.3333  PNEUMONIA: 0.3333  NORMAL: 0.7083 
F1 - ALL: 0.4436  COVID-19: 0.4102  PNEUMONIA: 0.3721  NORMAL: 0.5484 
Mask ratio's range: 1.0 ~ 1.0

[val]
LOSS - 0.9554
ACC - 0.5900
PPV - ALL: 0.7147  COVID-19: 0.8571  PNEUMONIA: 0.4688  NORMAL: 0.8182 
RECALL - ALL: 0.5963  COVID-19: 0.4200  PNEUMONIA: 0.9000  NORMAL: 0.4688 
F1 - ALL: 0.5921  COVID-19: 0.5637  PNEUMONIA: 0.6165  NORMAL: 0.5961 

Epoch 1/19
----------
[train]
LOSS - 0.6054
ACC - 0.9200
PPV - ALL: 0.9599  COVID-19: 1.0000  PNEUMONIA: 0.9565  NORMAL: 0.9231 
RECALL - ALL: 0.9583  COVID-19: 0.9583  PNEUMONIA: 0.9167  NORMAL: 1.0000 
F1 - ALL: 0.9583  COVID-19: 0.9787  PNEUMONIA: 0.9362  NORMAL: 0.9600 
Mask ratio's range: 1.0 ~ 1.0

[val]
LOSS - 0.7584
ACC - 0.7267
PPV - ALL: 0.7512  COVID-19: 0.8406  PNEUMONIA: 0.6723  NORMAL: 0.7407 
RECALL - ALL: 0.7378  COVID-19: 0.5800  PNEUMONIA: 0.8000  NORMAL: 0.8333 
F1 - ALL: 0.7338  COVID-19: 0.6864  PNEUMONIA: 0.7306  NORMAL: 0.7843 

Epoch 2/19
----------
[train]
LOSS - 0.2426
ACC - 0.9600
PPV - ALL: 1.0000  COVID-19: 1.0000  PNEUMONIA: 1.0000  NORMAL: 1.0000 
RECALL - ALL: 1.0000  COVID-19: 1.0000  PNEUMONIA: 1.0000  NORMAL: 1.0000 
F1 - ALL: 1.0000  COVID-19: 1.0000  PNEUMONIA: 1.0000  NORMAL: 1.0000 
Mask ratio's range: 1.0 ~ 1.0

[val]
LOSS - 0.6343
ACC - 0.7467
PPV - ALL: 0.7787  COVID-19: 0.8421  PNEUMONIA: 0.6567  NORMAL: 0.8372 
RECALL - ALL: 0.7567  COVID-19: 0.6400  PNEUMONIA: 0.8800  NORMAL: 0.7500 
F1 - ALL: 0.7569  COVID-19: 0.7273  PNEUMONIA: 0.7521  NORMAL: 0.7912 

Epoch 3/19
----------
[train]
LOSS - 0.0893
ACC - 0.9600
PPV - ALL: 1.0000  COVID-19: 1.0000  PNEUMONIA: 1.0000  NORMAL: 1.0000 
RECALL - ALL: 1.0000  COVID-19: 1.0000  PNEUMONIA: 1.0000  NORMAL: 1.0000 
F1 - ALL: 1.0000  COVID-19: 1.0000  PNEUMONIA: 1.0000  NORMAL: 1.0000 
Mask ratio's range: 0.9375 ~ 1.0

[val]
LOSS - 0.5555
ACC - 0.7633
PPV - ALL: 0.7819  COVID-19: 0.8293  PNEUMONIA: 0.7059  NORMAL: 0.8105 
RECALL - ALL: 0.7740  COVID-19: 0.6800  PNEUMONIA: 0.8400  NORMAL: 0.8021 
F1 - ALL: 0.7736  COVID-19: 0.7473  PNEUMONIA: 0.7671  NORMAL: 0.8063 

Epoch 4/19
----------
[train]
LOSS - 0.0425
ACC - 0.9600
PPV - ALL: 1.0000  COVID-19: 1.0000  PNEUMONIA: 1.0000  NORMAL: 1.0000 
RECALL - ALL: 1.0000  COVID-19: 1.0000  PNEUMONIA: 1.0000  NORMAL: 1.0000 
F1 - ALL: 1.0000  COVID-19: 1.0000  PNEUMONIA: 1.0000  NORMAL: 1.0000 
Mask ratio's range: 0.9375 ~ 1.0

[val]
LOSS - 0.5313
ACC - 0.7633
PPV - ALL: 0.7827  COVID-19: 0.8214  PNEUMONIA: 0.7025  NORMAL: 0.8242 
RECALL - ALL: 0.7737  COVID-19: 0.6900  PNEUMONIA: 0.8500  NORMAL: 0.7812 
F1 - ALL: 0.7738  COVID-19: 0.7500  PNEUMONIA: 0.7692  NORMAL: 0.8021 

Epoch 5/19
----------
[train]
LOSS - 0.0344
ACC - 0.9600
PPV - ALL: 1.0000  COVID-19: 1.0000  PNEUMONIA: 1.0000  NORMAL: 1.0000 
RECALL - ALL: 1.0000  COVID-19: 1.0000  PNEUMONIA: 1.0000  NORMAL: 1.0000 
F1 - ALL: 1.0000  COVID-19: 1.0000  PNEUMONIA: 1.0000  NORMAL: 1.0000 
Mask ratio's range: 0.875 ~ 1.0

[val]
LOSS - 0.5538
ACC - 0.7600
PPV - ALL: 0.7787  COVID-19: 0.8046  PNEUMONIA: 0.7000  NORMAL: 0.8315 
RECALL - ALL: 0.7703  COVID-19: 0.7000  PNEUMONIA: 0.8400  NORMAL: 0.7708 
F1 - ALL: 0.7708  COVID-19: 0.7487  PNEUMONIA: 0.7636  NORMAL: 0.8000 

Epoch 6/19
----------
[train]
LOSS - 0.0273
ACC - 0.9600
PPV - ALL: 1.0000  COVID-19: 1.0000  PNEUMONIA: 1.0000  NORMAL: 1.0000 
RECALL - ALL: 1.0000  COVID-19: 1.0000  PNEUMONIA: 1.0000  NORMAL: 1.0000 
F1 - ALL: 1.0000  COVID-19: 1.0000  PNEUMONIA: 1.0000  NORMAL: 1.0000 
Mask ratio's range: 0.875 ~ 1.0

[val]
LOSS - 0.5176
ACC - 0.7567
PPV - ALL: 0.7737  COVID-19: 0.7955  PNEUMONIA: 0.7034  NORMAL: 0.8222 
RECALL - ALL: 0.7669  COVID-19: 0.7000  PNEUMONIA: 0.8300  NORMAL: 0.7708 
F1 - ALL: 0.7673  COVID-19: 0.7447  PNEUMONIA: 0.7615  NORMAL: 0.7957 

Epoch 7/19
----------
[train]
LOSS - 0.0321
ACC - 0.9600
PPV - ALL: 1.0000  COVID-19: 1.0000  PNEUMONIA: 1.0000  NORMAL: 1.0000 
RECALL - ALL: 1.0000  COVID-19: 1.0000  PNEUMONIA: 1.0000  NORMAL: 1.0000 
F1 - ALL: 1.0000  COVID-19: 1.0000  PNEUMONIA: 1.0000  NORMAL: 1.0000 
Mask ratio's range: 0.8125 ~ 1.0

[val]
LOSS - 0.5086
ACC - 0.7633
PPV - ALL: 0.7800  COVID-19: 0.8046  PNEUMONIA: 0.7094  NORMAL: 0.8261 
RECALL - ALL: 0.7739  COVID-19: 0.7000  PNEUMONIA: 0.8300  NORMAL: 0.7917 
F1 - ALL: 0.7741  COVID-19: 0.7487  PNEUMONIA: 0.7650  NORMAL: 0.8085 

Epoch 8/19
----------
[train]
LOSS - 0.0280
ACC - 0.9600
PPV - ALL: 1.0000  COVID-19: 1.0000  PNEUMONIA: 1.0000  NORMAL: 1.0000 
RECALL - ALL: 1.0000  COVID-19: 1.0000  PNEUMONIA: 1.0000  NORMAL: 1.0000 
F1 - ALL: 1.0000  COVID-19: 1.0000  PNEUMONIA: 1.0000  NORMAL: 1.0000 
Mask ratio's range: 0.8125 ~ 1.0

[val]
LOSS - 0.5228
ACC - 0.7733
PPV - ALL: 0.7884  COVID-19: 0.8161  PNEUMONIA: 0.7281  NORMAL: 0.8211 
RECALL - ALL: 0.7842  COVID-19: 0.7100  PNEUMONIA: 0.8300  NORMAL: 0.8125 
F1 - ALL: 0.7840  COVID-19: 0.7594  PNEUMONIA: 0.7757  NORMAL: 0.8168 

Epoch 9/19
----------
[train]
LOSS - 0.0343
ACC - 0.9600
PPV - ALL: 1.0000  COVID-19: 1.0000  PNEUMONIA: 1.0000  NORMAL: 1.0000 
RECALL - ALL: 1.0000  COVID-19: 1.0000  PNEUMONIA: 1.0000  NORMAL: 1.0000 
F1 - ALL: 1.0000  COVID-19: 1.0000  PNEUMONIA: 1.0000  NORMAL: 1.0000 
Mask ratio's range: 0.8125 ~ 0.9375

[val]
LOSS - 0.5189
ACC - 0.7633
PPV - ALL: 0.7800  COVID-19: 0.8095  PNEUMONIA: 0.7094  NORMAL: 0.8211 
RECALL - ALL: 0.7742  COVID-19: 0.6800  PNEUMONIA: 0.8300  NORMAL: 0.8125 
F1 - ALL: 0.7736  COVID-19: 0.7391  PNEUMONIA: 0.7650  NORMAL: 0.8168 

Epoch 10/19
----------
[train]
LOSS - 0.0353
ACC - 0.9600
PPV - ALL: 1.0000  COVID-19: 1.0000  PNEUMONIA: 1.0000  NORMAL: 1.0000 
RECALL - ALL: 1.0000  COVID-19: 1.0000  PNEUMONIA: 1.0000  NORMAL: 1.0000 
F1 - ALL: 1.0000  COVID-19: 1.0000  PNEUMONIA: 1.0000  NORMAL: 1.0000 
Mask ratio's range: 0.75 ~ 0.9375

[val]
LOSS - 0.5504
ACC - 0.7700
PPV - ALL: 0.7895  COVID-19: 0.8481  PNEUMONIA: 0.7143  NORMAL: 0.8061 
RECALL - ALL: 0.7810  COVID-19: 0.6700  PNEUMONIA: 0.8500  NORMAL: 0.8229 
F1 - ALL: 0.7798  COVID-19: 0.7486  PNEUMONIA: 0.7763  NORMAL: 0.8144 

Epoch 11/19
----------
[train]
LOSS - 0.0350
ACC - 0.9600
PPV - ALL: 1.0000  COVID-19: 1.0000  PNEUMONIA: 1.0000  NORMAL: 1.0000 
RECALL - ALL: 1.0000  COVID-19: 1.0000  PNEUMONIA: 1.0000  NORMAL: 1.0000 
F1 - ALL: 1.0000  COVID-19: 1.0000  PNEUMONIA: 1.0000  NORMAL: 1.0000 
Mask ratio's range: 0.75 ~ 0.875

[val]
LOSS - 0.5749
ACC - 0.7700
PPV - ALL: 0.7911  COVID-19: 0.8667  PNEUMONIA: 0.7203  NORMAL: 0.7864 
RECALL - ALL: 0.7813  COVID-19: 0.6500  PNEUMONIA: 0.8500  NORMAL: 0.8438 
F1 - ALL: 0.7789  COVID-19: 0.7429  PNEUMONIA: 0.7798  NORMAL: 0.8141 

Epoch 12/19
----------
[train]
LOSS - 0.0359
ACC - 0.9600
PPV - ALL: 1.0000  COVID-19: 1.0000  PNEUMONIA: 1.0000  NORMAL: 1.0000 
RECALL - ALL: 1.0000  COVID-19: 1.0000  PNEUMONIA: 1.0000  NORMAL: 1.0000 
F1 - ALL: 1.0000  COVID-19: 1.0000  PNEUMONIA: 1.0000  NORMAL: 1.0000 
Mask ratio's range: 0.75 ~ 0.875

[val]
LOSS - 0.5680
ACC - 0.7700
PPV - ALL: 0.7908  COVID-19: 0.8649  PNEUMONIA: 0.7288  NORMAL: 0.7788 
RECALL - ALL: 0.7813  COVID-19: 0.6400  PNEUMONIA: 0.8600  NORMAL: 0.8438 
F1 - ALL: 0.7782  COVID-19: 0.7356  PNEUMONIA: 0.7890  NORMAL: 0.8100 

Epoch 13/19
----------
[train]
LOSS - 0.0329
ACC - 0.9600
PPV - ALL: 1.0000  COVID-19: 1.0000  PNEUMONIA: 1.0000  NORMAL: 1.0000 
RECALL - ALL: 1.0000  COVID-19: 1.0000  PNEUMONIA: 1.0000  NORMAL: 1.0000 
F1 - ALL: 1.0000  COVID-19: 1.0000  PNEUMONIA: 1.0000  NORMAL: 1.0000 
Mask ratio's range: 0.6875 ~ 0.875

[val]
LOSS - 0.5582
ACC - 0.7600
PPV - ALL: 0.7810  COVID-19: 0.8649  PNEUMONIA: 0.7281  NORMAL: 0.7500 
RECALL - ALL: 0.7713  COVID-19: 0.6400  PNEUMONIA: 0.8300  NORMAL: 0.8438 
F1 - ALL: 0.7685  COVID-19: 0.7356  PNEUMONIA: 0.7757  NORMAL: 0.7941 

Epoch 14/19
----------
[train]
LOSS - 0.0331
ACC - 0.9600
PPV - ALL: 1.0000  COVID-19: 1.0000  PNEUMONIA: 1.0000  NORMAL: 1.0000 
RECALL - ALL: 1.0000  COVID-19: 1.0000  PNEUMONIA: 1.0000  NORMAL: 1.0000 
F1 - ALL: 1.0000  COVID-19: 1.0000  PNEUMONIA: 1.0000  NORMAL: 1.0000 
Mask ratio's range: 0.6875 ~ 0.8125

[val]
LOSS - 0.5451
ACC - 0.7633
PPV - ALL: 0.7845  COVID-19: 0.8630  PNEUMONIA: 0.7241  NORMAL: 0.7664 
RECALL - ALL: 0.7747  COVID-19: 0.6300  PNEUMONIA: 0.8400  NORMAL: 0.8542 
F1 - ALL: 0.7713  COVID-19: 0.7283  PNEUMONIA: 0.7778  NORMAL: 0.8079 

Epoch 15/19
----------
[train]
LOSS - 0.0323
ACC - 0.9600
PPV - ALL: 1.0000  COVID-19: 1.0000  PNEUMONIA: 1.0000  NORMAL: 1.0000 
RECALL - ALL: 1.0000  COVID-19: 1.0000  PNEUMONIA: 1.0000  NORMAL: 1.0000 
F1 - ALL: 1.0000  COVID-19: 1.0000  PNEUMONIA: 1.0000  NORMAL: 1.0000 
Mask ratio's range: 0.6875 ~ 0.8125

[val]
LOSS - 0.5608
ACC - 0.7600
PPV - ALL: 0.7794  COVID-19: 0.8533  PNEUMONIA: 0.7257  NORMAL: 0.7593 
RECALL - ALL: 0.7714  COVID-19: 0.6400  PNEUMONIA: 0.8200  NORMAL: 0.8542 
F1 - ALL: 0.7685  COVID-19: 0.7314  PNEUMONIA: 0.7700  NORMAL: 0.8040 

Epoch 16/19
----------
[train]
LOSS - 0.0296
ACC - 0.9600
PPV - ALL: 1.0000  COVID-19: 1.0000  PNEUMONIA: 1.0000  NORMAL: 1.0000 
RECALL - ALL: 1.0000  COVID-19: 1.0000  PNEUMONIA: 1.0000  NORMAL: 1.0000 
F1 - ALL: 1.0000  COVID-19: 1.0000  PNEUMONIA: 1.0000  NORMAL: 1.0000 
Mask ratio's range: 0.625 ~ 0.8125

[val]
LOSS - 0.5353
ACC - 0.7600
PPV - ALL: 0.7815  COVID-19: 0.8630  PNEUMONIA: 0.7130  NORMAL: 0.7685 
RECALL - ALL: 0.7715  COVID-19: 0.6300  PNEUMONIA: 0.8200  NORMAL: 0.8646 
F1 - ALL: 0.7683  COVID-19: 0.7283  PNEUMONIA: 0.7628  NORMAL: 0.8137 

Epoch 17/19
----------
[train]
LOSS - 0.0337
ACC - 0.9600
PPV - ALL: 1.0000  COVID-19: 1.0000  PNEUMONIA: 1.0000  NORMAL: 1.0000 
RECALL - ALL: 1.0000  COVID-19: 1.0000  PNEUMONIA: 1.0000  NORMAL: 1.0000 
F1 - ALL: 1.0000  COVID-19: 1.0000  PNEUMONIA: 1.0000  NORMAL: 1.0000 
Mask ratio's range: 0.625 ~ 0.8125

[val]
LOSS - 0.5225
ACC - 0.7667
PPV - ALL: 0.7869  COVID-19: 0.8630  PNEUMONIA: 0.7455  NORMAL: 0.7522 
RECALL - ALL: 0.7785  COVID-19: 0.6300  PNEUMONIA: 0.8200  NORMAL: 0.8854 
F1 - ALL: 0.7742  COVID-19: 0.7283  PNEUMONIA: 0.7810  NORMAL: 0.8134 

Epoch 18/19
----------
[train]
LOSS - 0.0281
ACC - 0.9600
PPV - ALL: 1.0000  COVID-19: 1.0000  PNEUMONIA: 1.0000  NORMAL: 1.0000 
RECALL - ALL: 1.0000  COVID-19: 1.0000  PNEUMONIA: 1.0000  NORMAL: 1.0000 
F1 - ALL: 1.0000  COVID-19: 1.0000  PNEUMONIA: 1.0000  NORMAL: 1.0000 
Mask ratio's range: 0.625 ~ 0.8125

[val]
LOSS - 0.5507
ACC - 0.7700
PPV - ALL: 0.7917  COVID-19: 0.8750  PNEUMONIA: 0.7545  NORMAL: 0.7456 
RECALL - ALL: 0.7818  COVID-19: 0.6300  PNEUMONIA: 0.8300  NORMAL: 0.8854 
F1 - ALL: 0.7775  COVID-19: 0.7326  PNEUMONIA: 0.7905  NORMAL: 0.8095 

Epoch 19/19
----------
[train]
LOSS - 0.0272
ACC - 0.9600
PPV - ALL: 1.0000  COVID-19: 1.0000  PNEUMONIA: 1.0000  NORMAL: 1.0000 
RECALL - ALL: 1.0000  COVID-19: 1.0000  PNEUMONIA: 1.0000  NORMAL: 1.0000 
F1 - ALL: 1.0000  COVID-19: 1.0000  PNEUMONIA: 1.0000  NORMAL: 1.0000 
Mask ratio's range: 0.625 ~ 0.75

[val]
LOSS - 0.5610
ACC - 0.7600
PPV - ALL: 0.7877  COVID-19: 0.8955  PNEUMONIA: 0.7411  NORMAL: 0.7265 
RECALL - ALL: 0.7718  COVID-19: 0.6000  PNEUMONIA: 0.8300  NORMAL: 0.8854 
F1 - ALL: 0.7666  COVID-19: 0.7186  PNEUMONIA: 0.7830  NORMAL: 0.7981 


--------------------
[Best results]
ACC - 0.7733
PPV - ALL: 0.7884  COVID-19: 0.8161  PNEUMONIA: 0.7281  NORMAL: 0.8211 
RECALL - ALL: 0.7842  COVID-19: 0.7100  PNEUMONIA: 0.8300  NORMAL: 0.8125 
F1 - ALL: 0.7840  COVID-19: 0.7594  PNEUMONIA: 0.7757  NORMAL: 0.8168 

Training complete in 1m 31s
-------------------- 

--------------------
Model 5
--------------------

Epoch 0/19
----------
[train]
LOSS - 1.0377
ACC - 0.3733
PPV - ALL: 0.3876  COVID-19: 0.3333  PNEUMONIA: 0.4545  NORMAL: 0.3750 
RECALL - ALL: 0.3889  COVID-19: 0.2500  PNEUMONIA: 0.4167  NORMAL: 0.5000 
F1 - ALL: 0.3830  COVID-19: 0.2857  PNEUMONIA: 0.4348  NORMAL: 0.4286 
Mask ratio's range: 1.0 ~ 1.0

[val]
LOSS - 1.0338
ACC - 0.4433
PPV - ALL: 0.5384  COVID-19: 0.6667  PNEUMONIA: 0.5278  NORMAL: 0.4208 
RECALL - ALL: 0.4563  COVID-19: 0.0200  PNEUMONIA: 0.3800  NORMAL: 0.9688 
F1 - ALL: 0.3558  COVID-19: 0.0388  PNEUMONIA: 0.4419  NORMAL: 0.5867 

Epoch 1/19
----------
[train]
LOSS - 0.6397
ACC - 0.9067
PPV - ALL: 0.9444  COVID-19: 0.9565  PNEUMONIA: 0.9167  NORMAL: 0.9600 
RECALL - ALL: 0.9445  COVID-19: 0.9167  PNEUMONIA: 0.9167  NORMAL: 1.0000 
F1 - ALL: 0.9442  COVID-19: 0.9362  PNEUMONIA: 0.9167  NORMAL: 0.9796 
Mask ratio's range: 1.0 ~ 1.0

[val]
LOSS - 0.8116
ACC - 0.7300
PPV - ALL: 0.7576  COVID-19: 0.8615  PNEUMONIA: 0.7217  NORMAL: 0.6897 
RECALL - ALL: 0.7411  COVID-19: 0.5600  PNEUMONIA: 0.8300  NORMAL: 0.8333 
F1 - ALL: 0.7352  COVID-19: 0.6788  PNEUMONIA: 0.7721  NORMAL: 0.7547 

Epoch 2/19
----------
[train]
LOSS - 0.2783
ACC - 0.9600
PPV - ALL: 1.0000  COVID-19: 1.0000  PNEUMONIA: 1.0000  NORMAL: 1.0000 
RECALL - ALL: 1.0000  COVID-19: 1.0000  PNEUMONIA: 1.0000  NORMAL: 1.0000 
F1 - ALL: 1.0000  COVID-19: 1.0000  PNEUMONIA: 1.0000  NORMAL: 1.0000 
Mask ratio's range: 1.0 ~ 1.0

[val]
LOSS - 0.6708
ACC - 0.7367
PPV - ALL: 0.7610  COVID-19: 0.8529  PNEUMONIA: 0.7232  NORMAL: 0.7069 
RECALL - ALL: 0.7481  COVID-19: 0.5800  PNEUMONIA: 0.8100  NORMAL: 0.8542 
F1 - ALL: 0.7427  COVID-19: 0.6905  PNEUMONIA: 0.7641  NORMAL: 0.7736 

Epoch 3/19
----------
[train]
LOSS - 0.1033
ACC - 0.9600
PPV - ALL: 1.0000  COVID-19: 1.0000  PNEUMONIA: 1.0000  NORMAL: 1.0000 
RECALL - ALL: 1.0000  COVID-19: 1.0000  PNEUMONIA: 1.0000  NORMAL: 1.0000 
F1 - ALL: 1.0000  COVID-19: 1.0000  PNEUMONIA: 1.0000  NORMAL: 1.0000 
Mask ratio's range: 0.9375 ~ 1.0

[val]
LOSS - 0.5882
ACC - 0.7600
PPV - ALL: 0.7775  COVID-19: 0.8462  PNEUMONIA: 0.7411  NORMAL: 0.7453 
RECALL - ALL: 0.7710  COVID-19: 0.6600  PNEUMONIA: 0.8300  NORMAL: 0.8229 
F1 - ALL: 0.7689  COVID-19: 0.7416  PNEUMONIA: 0.7830  NORMAL: 0.7822 

Epoch 4/19
----------
[train]
LOSS - 0.0430
ACC - 0.9600
PPV - ALL: 1.0000  COVID-19: 1.0000  PNEUMONIA: 1.0000  NORMAL: 1.0000 
RECALL - ALL: 1.0000  COVID-19: 1.0000  PNEUMONIA: 1.0000  NORMAL: 1.0000 
F1 - ALL: 1.0000  COVID-19: 1.0000  PNEUMONIA: 1.0000  NORMAL: 1.0000 
Mask ratio's range: 0.9375 ~ 1.0

[val]
LOSS - 0.5518
ACC - 0.7733
PPV - ALL: 0.7894  COVID-19: 0.8519  PNEUMONIA: 0.7615  NORMAL: 0.7547 
RECALL - ALL: 0.7844  COVID-19: 0.6900  PNEUMONIA: 0.8300  NORMAL: 0.8333 
F1 - ALL: 0.7830  COVID-19: 0.7625  PNEUMONIA: 0.7943  NORMAL: 0.7921 

Epoch 5/19
----------
[train]
LOSS - 0.0328
ACC - 0.9600
PPV - ALL: 1.0000  COVID-19: 1.0000  PNEUMONIA: 1.0000  NORMAL: 1.0000 
RECALL - ALL: 1.0000  COVID-19: 1.0000  PNEUMONIA: 1.0000  NORMAL: 1.0000 
F1 - ALL: 1.0000  COVID-19: 1.0000  PNEUMONIA: 1.0000  NORMAL: 1.0000 
Mask ratio's range: 0.875 ~ 1.0

[val]
LOSS - 0.5504
ACC - 0.7733
PPV - ALL: 0.7890  COVID-19: 0.8554  PNEUMONIA: 0.7664  NORMAL: 0.7453 
RECALL - ALL: 0.7843  COVID-19: 0.7100  PNEUMONIA: 0.8200  NORMAL: 0.8229 
F1 - ALL: 0.7835  COVID-19: 0.7759  PNEUMONIA: 0.7923  NORMAL: 0.7822 

Epoch 6/19
----------
[train]
LOSS - 0.0299
ACC - 0.9600
PPV - ALL: 1.0000  COVID-19: 1.0000  PNEUMONIA: 1.0000  NORMAL: 1.0000 
RECALL - ALL: 1.0000  COVID-19: 1.0000  PNEUMONIA: 1.0000  NORMAL: 1.0000 
F1 - ALL: 1.0000  COVID-19: 1.0000  PNEUMONIA: 1.0000  NORMAL: 1.0000 
Mask ratio's range: 0.875 ~ 1.0

[val]
LOSS - 0.5418
ACC - 0.7833
PPV - ALL: 0.7986  COVID-19: 0.8554  PNEUMONIA: 0.7905  NORMAL: 0.7500 
RECALL - ALL: 0.7946  COVID-19: 0.7100  PNEUMONIA: 0.8300  NORMAL: 0.8438 
F1 - ALL: 0.7933  COVID-19: 0.7759  PNEUMONIA: 0.8098  NORMAL: 0.7941 

Epoch 7/19
----------
[train]
LOSS - 0.0234
ACC - 0.9600
PPV - ALL: 1.0000  COVID-19: 1.0000  PNEUMONIA: 1.0000  NORMAL: 1.0000 
RECALL - ALL: 1.0000  COVID-19: 1.0000  PNEUMONIA: 1.0000  NORMAL: 1.0000 
F1 - ALL: 1.0000  COVID-19: 1.0000  PNEUMONIA: 1.0000  NORMAL: 1.0000 
Mask ratio's range: 0.875 ~ 1.0

[val]
LOSS - 0.5199
ACC - 0.7733
PPV - ALL: 0.7884  COVID-19: 0.8434  PNEUMONIA: 0.7788  NORMAL: 0.7431 
RECALL - ALL: 0.7846  COVID-19: 0.7000  PNEUMONIA: 0.8100  NORMAL: 0.8438 
F1 - ALL: 0.7831  COVID-19: 0.7650  PNEUMONIA: 0.7941  NORMAL: 0.7903 

Epoch 8/19
----------
[train]
LOSS - 0.0191
ACC - 0.9600
PPV - ALL: 1.0000  COVID-19: 1.0000  PNEUMONIA: 1.0000  NORMAL: 1.0000 
RECALL - ALL: 1.0000  COVID-19: 1.0000  PNEUMONIA: 1.0000  NORMAL: 1.0000 
F1 - ALL: 1.0000  COVID-19: 1.0000  PNEUMONIA: 1.0000  NORMAL: 1.0000 
Mask ratio's range: 0.8125 ~ 1.0

[val]
LOSS - 0.5186
ACC - 0.7767
PPV - ALL: 0.7917  COVID-19: 0.8434  PNEUMONIA: 0.7885  NORMAL: 0.7431 
RECALL - ALL: 0.7879  COVID-19: 0.7000  PNEUMONIA: 0.8200  NORMAL: 0.8438 
F1 - ALL: 0.7864  COVID-19: 0.7650  PNEUMONIA: 0.8039  NORMAL: 0.7903 

Epoch 9/19
----------
[train]
LOSS - 0.0360
ACC - 0.9600
PPV - ALL: 1.0000  COVID-19: 1.0000  PNEUMONIA: 1.0000  NORMAL: 1.0000 
RECALL - ALL: 1.0000  COVID-19: 1.0000  PNEUMONIA: 1.0000  NORMAL: 1.0000 
F1 - ALL: 1.0000  COVID-19: 1.0000  PNEUMONIA: 1.0000  NORMAL: 1.0000 
Mask ratio's range: 0.8125 ~ 1.0

[val]
LOSS - 0.5246
ACC - 0.7867
PPV - ALL: 0.8028  COVID-19: 0.8554  PNEUMONIA: 0.8119  NORMAL: 0.7411 
RECALL - ALL: 0.7982  COVID-19: 0.7100  PNEUMONIA: 0.8200  NORMAL: 0.8646 
F1 - ALL: 0.7966  COVID-19: 0.7759  PNEUMONIA: 0.8159  NORMAL: 0.7981 

Epoch 10/19
----------
[train]
LOSS - 0.0249
ACC - 0.9600
PPV - ALL: 1.0000  COVID-19: 1.0000  PNEUMONIA: 1.0000  NORMAL: 1.0000 
RECALL - ALL: 1.0000  COVID-19: 1.0000  PNEUMONIA: 1.0000  NORMAL: 1.0000 
F1 - ALL: 1.0000  COVID-19: 1.0000  PNEUMONIA: 1.0000  NORMAL: 1.0000 
Mask ratio's range: 0.75 ~ 1.0

[val]
LOSS - 0.5267
ACC - 0.7767
PPV - ALL: 0.7929  COVID-19: 0.8537  PNEUMONIA: 0.7885  NORMAL: 0.7364 
RECALL - ALL: 0.7879  COVID-19: 0.7000  PNEUMONIA: 0.8200  NORMAL: 0.8438 
F1 - ALL: 0.7865  COVID-19: 0.7692  PNEUMONIA: 0.8039  NORMAL: 0.7865 

Epoch 11/19
----------
[train]
LOSS - 0.0240
ACC - 0.9600
PPV - ALL: 1.0000  COVID-19: 1.0000  PNEUMONIA: 1.0000  NORMAL: 1.0000 
RECALL - ALL: 1.0000  COVID-19: 1.0000  PNEUMONIA: 1.0000  NORMAL: 1.0000 
F1 - ALL: 1.0000  COVID-19: 1.0000  PNEUMONIA: 1.0000  NORMAL: 1.0000 
Mask ratio's range: 0.75 ~ 1.0

[val]
LOSS - 0.5397
ACC - 0.7800
PPV - ALL: 0.7984  COVID-19: 0.8734  PNEUMONIA: 0.7830  NORMAL: 0.7387 
RECALL - ALL: 0.7914  COVID-19: 0.6900  PNEUMONIA: 0.8300  NORMAL: 0.8542 
F1 - ALL: 0.7897  COVID-19: 0.7709  PNEUMONIA: 0.8058  NORMAL: 0.7923 

Epoch 12/19
----------
[train]
LOSS - 0.0390
ACC - 0.9600
PPV - ALL: 1.0000  COVID-19: 1.0000  PNEUMONIA: 1.0000  NORMAL: 1.0000 
RECALL - ALL: 1.0000  COVID-19: 1.0000  PNEUMONIA: 1.0000  NORMAL: 1.0000 
F1 - ALL: 1.0000  COVID-19: 1.0000  PNEUMONIA: 1.0000  NORMAL: 1.0000 
Mask ratio's range: 0.75 ~ 1.0

[val]
LOSS - 0.5370
ACC - 0.7633
PPV - ALL: 0.7838  COVID-19: 0.8649  PNEUMONIA: 0.7545  NORMAL: 0.7321 
RECALL - ALL: 0.7747  COVID-19: 0.6400  PNEUMONIA: 0.8300  NORMAL: 0.8542 
F1 - ALL: 0.7715  COVID-19: 0.7356  PNEUMONIA: 0.7905  NORMAL: 0.7885 

Epoch 13/19
----------
[train]
LOSS - 0.0319
ACC - 0.9600
PPV - ALL: 1.0000  COVID-19: 1.0000  PNEUMONIA: 1.0000  NORMAL: 1.0000 
RECALL - ALL: 1.0000  COVID-19: 1.0000  PNEUMONIA: 1.0000  NORMAL: 1.0000 
F1 - ALL: 1.0000  COVID-19: 1.0000  PNEUMONIA: 1.0000  NORMAL: 1.0000 
Mask ratio's range: 0.75 ~ 1.0

[val]
LOSS - 0.5317
ACC - 0.7600
PPV - ALL: 0.7829  COVID-19: 0.8750  PNEUMONIA: 0.7281  NORMAL: 0.7455 
RECALL - ALL: 0.7714  COVID-19: 0.6300  PNEUMONIA: 0.8300  NORMAL: 0.8542 
F1 - ALL: 0.7682  COVID-19: 0.7326  PNEUMONIA: 0.7757  NORMAL: 0.7962 

Epoch 14/19
----------
[train]
LOSS - 0.0221
ACC - 0.9600
PPV - ALL: 1.0000  COVID-19: 1.0000  PNEUMONIA: 1.0000  NORMAL: 1.0000 
RECALL - ALL: 1.0000  COVID-19: 1.0000  PNEUMONIA: 1.0000  NORMAL: 1.0000 
F1 - ALL: 1.0000  COVID-19: 1.0000  PNEUMONIA: 1.0000  NORMAL: 1.0000 
Mask ratio's range: 0.75 ~ 1.0

[val]
LOSS - 0.5477
ACC - 0.7600
PPV - ALL: 0.7830  COVID-19: 0.8732  PNEUMONIA: 0.7304  NORMAL: 0.7455 
RECALL - ALL: 0.7714  COVID-19: 0.6200  PNEUMONIA: 0.8400  NORMAL: 0.8542 
F1 - ALL: 0.7676  COVID-19: 0.7251  PNEUMONIA: 0.7814  NORMAL: 0.7962 

Epoch 15/19
----------
[train]
LOSS - 0.0355
ACC - 0.9600
PPV - ALL: 1.0000  COVID-19: 1.0000  PNEUMONIA: 1.0000  NORMAL: 1.0000 
RECALL - ALL: 1.0000  COVID-19: 1.0000  PNEUMONIA: 1.0000  NORMAL: 1.0000 
F1 - ALL: 1.0000  COVID-19: 1.0000  PNEUMONIA: 1.0000  NORMAL: 1.0000 
Mask ratio's range: 0.75 ~ 0.9375

[val]
LOSS - 0.5329
ACC - 0.7733
PPV - ALL: 0.7951  COVID-19: 0.8767  PNEUMONIA: 0.7736  NORMAL: 0.7350 
RECALL - ALL: 0.7853  COVID-19: 0.6400  PNEUMONIA: 0.8200  NORMAL: 0.8958 
F1 - ALL: 0.7812  COVID-19: 0.7399  PNEUMONIA: 0.7961  NORMAL: 0.8075 

Epoch 16/19
----------
[train]
LOSS - 0.0259
ACC - 0.9600
PPV - ALL: 1.0000  COVID-19: 1.0000  PNEUMONIA: 1.0000  NORMAL: 1.0000 
RECALL - ALL: 1.0000  COVID-19: 1.0000  PNEUMONIA: 1.0000  NORMAL: 1.0000 
F1 - ALL: 1.0000  COVID-19: 1.0000  PNEUMONIA: 1.0000  NORMAL: 1.0000 
Mask ratio's range: 0.6875 ~ 0.875

[val]
LOSS - 0.5597
ACC - 0.7600
PPV - ALL: 0.7839  COVID-19: 0.8696  PNEUMONIA: 0.7593  NORMAL: 0.7227 
RECALL - ALL: 0.7719  COVID-19: 0.6000  PNEUMONIA: 0.8200  NORMAL: 0.8958 
F1 - ALL: 0.7662  COVID-19: 0.7101  PNEUMONIA: 0.7885  NORMAL: 0.8000 

Epoch 17/19
----------
[train]
LOSS - 0.0217
ACC - 0.9600
PPV - ALL: 1.0000  COVID-19: 1.0000  PNEUMONIA: 1.0000  NORMAL: 1.0000 
RECALL - ALL: 1.0000  COVID-19: 1.0000  PNEUMONIA: 1.0000  NORMAL: 1.0000 
F1 - ALL: 1.0000  COVID-19: 1.0000  PNEUMONIA: 1.0000  NORMAL: 1.0000 
Mask ratio's range: 0.6875 ~ 0.875

[val]
LOSS - 0.5747
ACC - 0.7567
PPV - ALL: 0.7812  COVID-19: 0.8676  PNEUMONIA: 0.7593  NORMAL: 0.7167 
RECALL - ALL: 0.7686  COVID-19: 0.5900  PNEUMONIA: 0.8200  NORMAL: 0.8958 
F1 - ALL: 0.7624  COVID-19: 0.7024  PNEUMONIA: 0.7885  NORMAL: 0.7963 

Epoch 18/19
----------
[train]
LOSS - 0.0383
ACC - 0.9600
PPV - ALL: 1.0000  COVID-19: 1.0000  PNEUMONIA: 1.0000  NORMAL: 1.0000 
RECALL - ALL: 1.0000  COVID-19: 1.0000  PNEUMONIA: 1.0000  NORMAL: 1.0000 
F1 - ALL: 1.0000  COVID-19: 1.0000  PNEUMONIA: 1.0000  NORMAL: 1.0000 
Mask ratio's range: 0.6875 ~ 0.8125

[val]
LOSS - 0.5863
ACC - 0.7567
PPV - ALL: 0.7837  COVID-19: 0.8788  PNEUMONIA: 0.7593  NORMAL: 0.7131 
RECALL - ALL: 0.7687  COVID-19: 0.5800  PNEUMONIA: 0.8200  NORMAL: 0.9062 
F1 - ALL: 0.7618  COVID-19: 0.6988  PNEUMONIA: 0.7885  NORMAL: 0.7981 

Epoch 19/19
----------
[train]
LOSS - 0.0243
ACC - 0.9600
PPV - ALL: 1.0000  COVID-19: 1.0000  PNEUMONIA: 1.0000  NORMAL: 1.0000 
RECALL - ALL: 1.0000  COVID-19: 1.0000  PNEUMONIA: 1.0000  NORMAL: 1.0000 
F1 - ALL: 1.0000  COVID-19: 1.0000  PNEUMONIA: 1.0000  NORMAL: 1.0000 
Mask ratio's range: 0.625 ~ 0.8125

[val]
LOSS - 0.6144
ACC - 0.7467
PPV - ALL: 0.7812  COVID-19: 0.9032  PNEUMONIA: 0.7523  NORMAL: 0.6880 
RECALL - ALL: 0.7586  COVID-19: 0.5600  PNEUMONIA: 0.8200  NORMAL: 0.8958 
F1 - ALL: 0.7515  COVID-19: 0.6914  PNEUMONIA: 0.7847  NORMAL: 0.7783 


--------------------
[Best results]
ACC - 0.7867
PPV - ALL: 0.8028  COVID-19: 0.8554  PNEUMONIA: 0.8119  NORMAL: 0.7411 
RECALL - ALL: 0.7982  COVID-19: 0.7100  PNEUMONIA: 0.8200  NORMAL: 0.8646 
F1 - ALL: 0.7966  COVID-19: 0.7759  PNEUMONIA: 0.8159  NORMAL: 0.7981 

Training complete in 1m 31s
-------------------- 

[Mean results]
ACC - 0.7993 (0.02)
PPV - ALL: 0.8154 (0.02)  COVID-19: 0.8683 (0.04)  PNEUMONIA: 0.7801 (0.04)  NORMAL: 0.7979 (0.04) 
RECALL - ALL: 0.8104 (0.02)  COVID-19: 0.7580 (0.04)  PNEUMONIA: 0.8440 (0.02)  NORMAL: 0.8292 (0.04) 
F1 - ALL: 0.8102 (0.02)  COVID-19: 0.8087 (0.03)  PNEUMONIA: 0.8103 (0.02)  NORMAL: 0.8116 (0.01) 

