--------------------
Model 1
--------------------

Epoch 0/19
----------
[train]
LOSS - 1.0096
ACC - 0.4267
PPV - ALL: 0.4461  COVID-19: 0.4800  PNEUMONIA: 0.4444  NORMAL: 0.4138 
RECALL - ALL: 0.4444  COVID-19: 0.5000  PNEUMONIA: 0.3333  NORMAL: 0.5000 
F1 - ALL: 0.4412  COVID-19: 0.4898  PNEUMONIA: 0.3809  NORMAL: 0.4528 
Mask ratio's range: 1.0 ~ 1.0

[val]
LOSS - 1.0142
ACC - 0.4533
PPV - ALL: 0.7486  COVID-19: 1.0000  PNEUMONIA: 0.8667  NORMAL: 0.3790 
RECALL - ALL: 0.4664  COVID-19: 0.0300  PNEUMONIA: 0.3900  NORMAL: 0.9792 
F1 - ALL: 0.3809  COVID-19: 0.0583  PNEUMONIA: 0.5379  NORMAL: 0.5465 

Epoch 1/19
----------
[train]
LOSS - 0.7087
ACC - 0.8400
PPV - ALL: 0.8805  COVID-19: 1.0000  PNEUMONIA: 0.8636  NORMAL: 0.7778 
RECALL - ALL: 0.8750  COVID-19: 0.9583  PNEUMONIA: 0.7917  NORMAL: 0.8750 
F1 - ALL: 0.8761  COVID-19: 0.9787  PNEUMONIA: 0.8261  NORMAL: 0.8235 
Mask ratio's range: 1.0 ~ 1.0

[val]
LOSS - 0.8010
ACC - 0.7800
PPV - ALL: 0.7956  COVID-19: 0.8681  PNEUMONIA: 0.7979  NORMAL: 0.7207 
RECALL - ALL: 0.7911  COVID-19: 0.7900  PNEUMONIA: 0.7500  NORMAL: 0.8333 
F1 - ALL: 0.7911  COVID-19: 0.8272  PNEUMONIA: 0.7732  NORMAL: 0.7729 

Epoch 2/19
----------
[train]
LOSS - 0.3301
ACC - 0.9600
PPV - ALL: 1.0000  COVID-19: 1.0000  PNEUMONIA: 1.0000  NORMAL: 1.0000 
RECALL - ALL: 1.0000  COVID-19: 1.0000  PNEUMONIA: 1.0000  NORMAL: 1.0000 
F1 - ALL: 1.0000  COVID-19: 1.0000  PNEUMONIA: 1.0000  NORMAL: 1.0000 
Mask ratio's range: 1.0 ~ 1.0

[val]
LOSS - 0.6457
ACC - 0.7933
PPV - ALL: 0.8158  COVID-19: 0.9221  PNEUMONIA: 0.7685  NORMAL: 0.7568 
RECALL - ALL: 0.8050  COVID-19: 0.7100  PNEUMONIA: 0.8300  NORMAL: 0.8750 
F1 - ALL: 0.8040  COVID-19: 0.8023  PNEUMONIA: 0.7981  NORMAL: 0.8116 

Epoch 3/19
----------
[train]
LOSS - 0.1273
ACC - 0.9600
PPV - ALL: 1.0000  COVID-19: 1.0000  PNEUMONIA: 1.0000  NORMAL: 1.0000 
RECALL - ALL: 1.0000  COVID-19: 1.0000  PNEUMONIA: 1.0000  NORMAL: 1.0000 
F1 - ALL: 1.0000  COVID-19: 1.0000  PNEUMONIA: 1.0000  NORMAL: 1.0000 
Mask ratio's range: 1.0 ~ 1.0

[val]
LOSS - 0.5714
ACC - 0.7867
PPV - ALL: 0.7977  COVID-19: 0.8163  PNEUMONIA: 0.7788  NORMAL: 0.7979 
RECALL - ALL: 0.7971  COVID-19: 0.8000  PNEUMONIA: 0.8100  NORMAL: 0.7812 
F1 - ALL: 0.7972  COVID-19: 0.8081  PNEUMONIA: 0.7941  NORMAL: 0.7895 

Epoch 4/19
----------
[train]
LOSS - 0.0561
ACC - 0.9600
PPV - ALL: 1.0000  COVID-19: 1.0000  PNEUMONIA: 1.0000  NORMAL: 1.0000 
RECALL - ALL: 1.0000  COVID-19: 1.0000  PNEUMONIA: 1.0000  NORMAL: 1.0000 
F1 - ALL: 1.0000  COVID-19: 1.0000  PNEUMONIA: 1.0000  NORMAL: 1.0000 
Mask ratio's range: 0.9375 ~ 1.0

[val]
LOSS - 0.5140
ACC - 0.8133
PPV - ALL: 0.8251  COVID-19: 0.8737  PNEUMONIA: 0.8058  NORMAL: 0.7959 
RECALL - ALL: 0.8242  COVID-19: 0.8300  PNEUMONIA: 0.8300  NORMAL: 0.8125 
F1 - ALL: 0.8244  COVID-19: 0.8513  PNEUMONIA: 0.8177  NORMAL: 0.8041 

Epoch 5/19
----------
[train]
LOSS - 0.0301
ACC - 0.9600
PPV - ALL: 1.0000  COVID-19: 1.0000  PNEUMONIA: 1.0000  NORMAL: 1.0000 
RECALL - ALL: 1.0000  COVID-19: 1.0000  PNEUMONIA: 1.0000  NORMAL: 1.0000 
F1 - ALL: 1.0000  COVID-19: 1.0000  PNEUMONIA: 1.0000  NORMAL: 1.0000 
Mask ratio's range: 0.9375 ~ 1.0

[val]
LOSS - 0.5115
ACC - 0.8100
PPV - ALL: 0.8214  COVID-19: 0.8660  PNEUMONIA: 0.7981  NORMAL: 0.8000 
RECALL - ALL: 0.8206  COVID-19: 0.8400  PNEUMONIA: 0.8300  NORMAL: 0.7917 
F1 - ALL: 0.8208  COVID-19: 0.8528  PNEUMONIA: 0.8137  NORMAL: 0.7958 

Epoch 6/19
----------
[train]
LOSS - 0.0207
ACC - 0.9600
PPV - ALL: 1.0000  COVID-19: 1.0000  PNEUMONIA: 1.0000  NORMAL: 1.0000 
RECALL - ALL: 1.0000  COVID-19: 1.0000  PNEUMONIA: 1.0000  NORMAL: 1.0000 
F1 - ALL: 1.0000  COVID-19: 1.0000  PNEUMONIA: 1.0000  NORMAL: 1.0000 
Mask ratio's range: 0.875 ~ 1.0

[val]
LOSS - 0.4887
ACC - 0.8100
PPV - ALL: 0.8206  COVID-19: 0.8416  PNEUMONIA: 0.8182  NORMAL: 0.8021 
RECALL - ALL: 0.8207  COVID-19: 0.8500  PNEUMONIA: 0.8100  NORMAL: 0.8021 
F1 - ALL: 0.8207  COVID-19: 0.8458  PNEUMONIA: 0.8141  NORMAL: 0.8021 

Epoch 7/19
----------
[train]
LOSS - 0.0251
ACC - 0.9600
PPV - ALL: 1.0000  COVID-19: 1.0000  PNEUMONIA: 1.0000  NORMAL: 1.0000 
RECALL - ALL: 1.0000  COVID-19: 1.0000  PNEUMONIA: 1.0000  NORMAL: 1.0000 
F1 - ALL: 1.0000  COVID-19: 1.0000  PNEUMONIA: 1.0000  NORMAL: 1.0000 
Mask ratio's range: 0.875 ~ 1.0

[val]
LOSS - 0.4970
ACC - 0.8000
PPV - ALL: 0.8111  COVID-19: 0.8454  PNEUMONIA: 0.7941  NORMAL: 0.7938 
RECALL - ALL: 0.8107  COVID-19: 0.8200  PNEUMONIA: 0.8100  NORMAL: 0.8021 
F1 - ALL: 0.8108  COVID-19: 0.8325  PNEUMONIA: 0.8020  NORMAL: 0.7979 

Epoch 8/19
----------
[train]
LOSS - 0.0463
ACC - 0.9600
PPV - ALL: 1.0000  COVID-19: 1.0000  PNEUMONIA: 1.0000  NORMAL: 1.0000 
RECALL - ALL: 1.0000  COVID-19: 1.0000  PNEUMONIA: 1.0000  NORMAL: 1.0000 
F1 - ALL: 1.0000  COVID-19: 1.0000  PNEUMONIA: 1.0000  NORMAL: 1.0000 
Mask ratio's range: 0.875 ~ 1.0

[val]
LOSS - 0.4882
ACC - 0.8000
PPV - ALL: 0.8127  COVID-19: 0.8696  PNEUMONIA: 0.7864  NORMAL: 0.7822 
RECALL - ALL: 0.8110  COVID-19: 0.8000  PNEUMONIA: 0.8100  NORMAL: 0.8229 
F1 - ALL: 0.8111  COVID-19: 0.8333  PNEUMONIA: 0.7980  NORMAL: 0.8020 

Epoch 9/19
----------
[train]
LOSS - 0.0381
ACC - 0.9600
PPV - ALL: 1.0000  COVID-19: 1.0000  PNEUMONIA: 1.0000  NORMAL: 1.0000 
RECALL - ALL: 1.0000  COVID-19: 1.0000  PNEUMONIA: 1.0000  NORMAL: 1.0000 
F1 - ALL: 1.0000  COVID-19: 1.0000  PNEUMONIA: 1.0000  NORMAL: 1.0000 
Mask ratio's range: 0.8125 ~ 1.0

[val]
LOSS - 0.4715
ACC - 0.8067
PPV - ALL: 0.8200  COVID-19: 0.8791  PNEUMONIA: 0.7850  NORMAL: 0.7959 
RECALL - ALL: 0.8175  COVID-19: 0.8000  PNEUMONIA: 0.8400  NORMAL: 0.8125 
F1 - ALL: 0.8178  COVID-19: 0.8377  PNEUMONIA: 0.8116  NORMAL: 0.8041 

Epoch 10/19
----------
[train]
LOSS - 0.0883
ACC - 0.9600
PPV - ALL: 1.0000  COVID-19: 1.0000  PNEUMONIA: 1.0000  NORMAL: 1.0000 
RECALL - ALL: 1.0000  COVID-19: 1.0000  PNEUMONIA: 1.0000  NORMAL: 1.0000 
F1 - ALL: 1.0000  COVID-19: 1.0000  PNEUMONIA: 1.0000  NORMAL: 1.0000 
Mask ratio's range: 0.8125 ~ 0.9375

[val]
LOSS - 0.4724
ACC - 0.8133
PPV - ALL: 0.8330  COVID-19: 0.9250  PNEUMONIA: 0.7909  NORMAL: 0.7830 
RECALL - ALL: 0.8249  COVID-19: 0.7400  PNEUMONIA: 0.8700  NORMAL: 0.8646 
F1 - ALL: 0.8242  COVID-19: 0.8222  PNEUMONIA: 0.8286  NORMAL: 0.8218 

Epoch 11/19
----------
[train]
LOSS - 0.0625
ACC - 0.9600
PPV - ALL: 1.0000  COVID-19: 1.0000  PNEUMONIA: 1.0000  NORMAL: 1.0000 
RECALL - ALL: 1.0000  COVID-19: 1.0000  PNEUMONIA: 1.0000  NORMAL: 1.0000 
F1 - ALL: 1.0000  COVID-19: 1.0000  PNEUMONIA: 1.0000  NORMAL: 1.0000 
Mask ratio's range: 0.75 ~ 0.9375

[val]
LOSS - 0.5200
ACC - 0.8133
PPV - ALL: 0.8327  COVID-19: 0.9259  PNEUMONIA: 0.8037  NORMAL: 0.7685 
RECALL - ALL: 0.8249  COVID-19: 0.7500  PNEUMONIA: 0.8600  NORMAL: 0.8646 
F1 - ALL: 0.8244  COVID-19: 0.8287  PNEUMONIA: 0.8309  NORMAL: 0.8137 

Epoch 12/19
----------
[train]
LOSS - 0.0755
ACC - 0.9600
PPV - ALL: 1.0000  COVID-19: 1.0000  PNEUMONIA: 1.0000  NORMAL: 1.0000 
RECALL - ALL: 1.0000  COVID-19: 1.0000  PNEUMONIA: 1.0000  NORMAL: 1.0000 
F1 - ALL: 1.0000  COVID-19: 1.0000  PNEUMONIA: 1.0000  NORMAL: 1.0000 
Mask ratio's range: 0.625 ~ 0.8125

[val]
LOSS - 0.5282
ACC - 0.8000
PPV - ALL: 0.8270  COVID-19: 0.9459  PNEUMONIA: 0.8000  NORMAL: 0.7350 
RECALL - ALL: 0.8119  COVID-19: 0.7000  PNEUMONIA: 0.8400  NORMAL: 0.8958 
F1 - ALL: 0.8105  COVID-19: 0.8046  PNEUMONIA: 0.8195  NORMAL: 0.8075 

Epoch 13/19
----------
[train]
LOSS - 0.0607
ACC - 0.9600
PPV - ALL: 1.0000  COVID-19: 1.0000  PNEUMONIA: 1.0000  NORMAL: 1.0000 
RECALL - ALL: 1.0000  COVID-19: 1.0000  PNEUMONIA: 1.0000  NORMAL: 1.0000 
F1 - ALL: 1.0000  COVID-19: 1.0000  PNEUMONIA: 1.0000  NORMAL: 1.0000 
Mask ratio's range: 0.4375 ~ 0.75

[val]
LOSS - 0.5522
ACC - 0.7933
PPV - ALL: 0.8233  COVID-19: 0.9437  PNEUMONIA: 0.8095  NORMAL: 0.7167 
RECALL - ALL: 0.8053  COVID-19: 0.6700  PNEUMONIA: 0.8500  NORMAL: 0.8958 
F1 - ALL: 0.8031  COVID-19: 0.7836  PNEUMONIA: 0.8293  NORMAL: 0.7963 

Epoch 14/19
----------
[train]
LOSS - 0.0501
ACC - 0.9600
PPV - ALL: 1.0000  COVID-19: 1.0000  PNEUMONIA: 1.0000  NORMAL: 1.0000 
RECALL - ALL: 1.0000  COVID-19: 1.0000  PNEUMONIA: 1.0000  NORMAL: 1.0000 
F1 - ALL: 1.0000  COVID-19: 1.0000  PNEUMONIA: 1.0000  NORMAL: 1.0000 
Mask ratio's range: 0.4375 ~ 0.75

[val]
LOSS - 0.5401
ACC - 0.8033
PPV - ALL: 0.8301  COVID-19: 0.9459  PNEUMONIA: 0.8095  NORMAL: 0.7350 
RECALL - ALL: 0.8153  COVID-19: 0.7000  PNEUMONIA: 0.8500  NORMAL: 0.8958 
F1 - ALL: 0.8138  COVID-19: 0.8046  PNEUMONIA: 0.8293  NORMAL: 0.8075 

Epoch 15/19
----------
[train]
LOSS - 0.0374
ACC - 0.9600
PPV - ALL: 1.0000  COVID-19: 1.0000  PNEUMONIA: 1.0000  NORMAL: 1.0000 
RECALL - ALL: 1.0000  COVID-19: 1.0000  PNEUMONIA: 1.0000  NORMAL: 1.0000 
F1 - ALL: 1.0000  COVID-19: 1.0000  PNEUMONIA: 1.0000  NORMAL: 1.0000 
Mask ratio's range: 0.4375 ~ 0.75

[val]
LOSS - 0.5453
ACC - 0.8100
PPV - ALL: 0.8353  COVID-19: 0.9459  PNEUMONIA: 0.8056  NORMAL: 0.7544 
RECALL - ALL: 0.8219  COVID-19: 0.7000  PNEUMONIA: 0.8700  NORMAL: 0.8958 
F1 - ALL: 0.8201  COVID-19: 0.8046  PNEUMONIA: 0.8366  NORMAL: 0.8190 

Epoch 16/19
----------
[train]
LOSS - 0.0343
ACC - 0.9600
PPV - ALL: 1.0000  COVID-19: 1.0000  PNEUMONIA: 1.0000  NORMAL: 1.0000 
RECALL - ALL: 1.0000  COVID-19: 1.0000  PNEUMONIA: 1.0000  NORMAL: 1.0000 
F1 - ALL: 1.0000  COVID-19: 1.0000  PNEUMONIA: 1.0000  NORMAL: 1.0000 
Mask ratio's range: 0.4375 ~ 0.6875

[val]
LOSS - 0.5350
ACC - 0.8000
PPV - ALL: 0.8267  COVID-19: 0.9444  PNEUMONIA: 0.7699  NORMAL: 0.7658 
RECALL - ALL: 0.8118  COVID-19: 0.6800  PNEUMONIA: 0.8700  NORMAL: 0.8854 
F1 - ALL: 0.8096  COVID-19: 0.7907  PNEUMONIA: 0.8169  NORMAL: 0.8213 

Epoch 17/19
----------
[train]
LOSS - 0.0475
ACC - 0.9600
PPV - ALL: 1.0000  COVID-19: 1.0000  PNEUMONIA: 1.0000  NORMAL: 1.0000 
RECALL - ALL: 1.0000  COVID-19: 1.0000  PNEUMONIA: 1.0000  NORMAL: 1.0000 
F1 - ALL: 1.0000  COVID-19: 1.0000  PNEUMONIA: 1.0000  NORMAL: 1.0000 
Mask ratio's range: 0.4375 ~ 0.6875

[val]
LOSS - 0.5602
ACC - 0.7967
PPV - ALL: 0.8242  COVID-19: 0.9437  PNEUMONIA: 0.7699  NORMAL: 0.7589 
RECALL - ALL: 0.8085  COVID-19: 0.6700  PNEUMONIA: 0.8700  NORMAL: 0.8854 
F1 - ALL: 0.8059  COVID-19: 0.7836  PNEUMONIA: 0.8169  NORMAL: 0.8173 

Epoch 18/19
----------
[train]
LOSS - 0.0321
ACC - 0.9600
PPV - ALL: 1.0000  COVID-19: 1.0000  PNEUMONIA: 1.0000  NORMAL: 1.0000 
RECALL - ALL: 1.0000  COVID-19: 1.0000  PNEUMONIA: 1.0000  NORMAL: 1.0000 
F1 - ALL: 1.0000  COVID-19: 1.0000  PNEUMONIA: 1.0000  NORMAL: 1.0000 
Mask ratio's range: 0.375 ~ 0.6875

[val]
LOSS - 0.5756
ACC - 0.7867
PPV - ALL: 0.8162  COVID-19: 0.9420  PNEUMONIA: 0.7565  NORMAL: 0.7500 
RECALL - ALL: 0.7983  COVID-19: 0.6500  PNEUMONIA: 0.8700  NORMAL: 0.8750 
F1 - ALL: 0.7954  COVID-19: 0.7692  PNEUMONIA: 0.8093  NORMAL: 0.8077 

Epoch 19/19
----------
[train]
LOSS - 0.0371
ACC - 0.9600
PPV - ALL: 1.0000  COVID-19: 1.0000  PNEUMONIA: 1.0000  NORMAL: 1.0000 
RECALL - ALL: 1.0000  COVID-19: 1.0000  PNEUMONIA: 1.0000  NORMAL: 1.0000 
F1 - ALL: 1.0000  COVID-19: 1.0000  PNEUMONIA: 1.0000  NORMAL: 1.0000 
Mask ratio's range: 0.375 ~ 0.625

[val]
LOSS - 0.5824
ACC - 0.7733
PPV - ALL: 0.8040  COVID-19: 0.9242  PNEUMONIA: 0.7311  NORMAL: 0.7568 
RECALL - ALL: 0.7850  COVID-19: 0.6100  PNEUMONIA: 0.8700  NORMAL: 0.8750 
F1 - ALL: 0.7803  COVID-19: 0.7349  PNEUMONIA: 0.7945  NORMAL: 0.8116 


--------------------
[Best results]
ACC - 0.8133
PPV - ALL: 0.8251  COVID-19: 0.8737  PNEUMONIA: 0.8058  NORMAL: 0.7959 
RECALL - ALL: 0.8242  COVID-19: 0.8300  PNEUMONIA: 0.8300  NORMAL: 0.8125 
F1 - ALL: 0.8244  COVID-19: 0.8513  PNEUMONIA: 0.8177  NORMAL: 0.8041 

Training complete in 1m 30s
-------------------- 

--------------------
Model 2
--------------------

Epoch 0/19
----------
[train]
LOSS - 1.0009
ACC - 0.4933
PPV - ALL: 0.5258  COVID-19: 0.4074  PNEUMONIA: 0.6316  NORMAL: 0.5385 
RECALL - ALL: 0.5139  COVID-19: 0.4583  PNEUMONIA: 0.5000  NORMAL: 0.5833 
F1 - ALL: 0.5165  COVID-19: 0.4314  PNEUMONIA: 0.5581  NORMAL: 0.5600 
Mask ratio's range: 1.0 ~ 1.0

[val]
LOSS - 0.9602
ACC - 0.5867
PPV - ALL: 0.7252  COVID-19: 1.0000  PNEUMONIA: 0.5090  NORMAL: 0.6667 
RECALL - ALL: 0.5972  COVID-19: 0.1500  PNEUMONIA: 0.8500  NORMAL: 0.7917 
F1 - ALL: 0.5405  COVID-19: 0.2609  PNEUMONIA: 0.6367  NORMAL: 0.7238 

Epoch 1/19
----------
[train]
LOSS - 0.6710
ACC - 0.8800
PPV - ALL: 0.9193  COVID-19: 0.9524  PNEUMONIA: 0.9167  NORMAL: 0.8889 
RECALL - ALL: 0.9167  COVID-19: 0.8333  PNEUMONIA: 0.9167  NORMAL: 1.0000 
F1 - ALL: 0.9156  COVID-19: 0.8889  PNEUMONIA: 0.9167  NORMAL: 0.9412 
Mask ratio's range: 1.0 ~ 1.0

[val]
LOSS - 0.7636
ACC - 0.7733
PPV - ALL: 0.7907  COVID-19: 0.8000  PNEUMONIA: 0.7168  NORMAL: 0.8554 
RECALL - ALL: 0.7832  COVID-19: 0.8000  PNEUMONIA: 0.8100  NORMAL: 0.7396 
F1 - ALL: 0.7846  COVID-19: 0.8000  PNEUMONIA: 0.7606  NORMAL: 0.7933 

Epoch 2/19
----------
[train]
LOSS - 0.3237
ACC - 0.9600
PPV - ALL: 1.0000  COVID-19: 1.0000  PNEUMONIA: 1.0000  NORMAL: 1.0000 
RECALL - ALL: 1.0000  COVID-19: 1.0000  PNEUMONIA: 1.0000  NORMAL: 1.0000 
F1 - ALL: 1.0000  COVID-19: 1.0000  PNEUMONIA: 1.0000  NORMAL: 1.0000 
Mask ratio's range: 1.0 ~ 1.0

[val]
LOSS - 0.6256
ACC - 0.7800
PPV - ALL: 0.8048  COVID-19: 0.8734  PNEUMONIA: 0.7040  NORMAL: 0.8370 
RECALL - ALL: 0.7907  COVID-19: 0.6900  PNEUMONIA: 0.8800  NORMAL: 0.8021 
F1 - ALL: 0.7908  COVID-19: 0.7709  PNEUMONIA: 0.7822  NORMAL: 0.8192 

Epoch 3/19
----------
[train]
LOSS - 0.1188
ACC - 0.9600
PPV - ALL: 1.0000  COVID-19: 1.0000  PNEUMONIA: 1.0000  NORMAL: 1.0000 
RECALL - ALL: 1.0000  COVID-19: 1.0000  PNEUMONIA: 1.0000  NORMAL: 1.0000 
F1 - ALL: 1.0000  COVID-19: 1.0000  PNEUMONIA: 1.0000  NORMAL: 1.0000 
Mask ratio's range: 1.0 ~ 1.0

[val]
LOSS - 0.5434
ACC - 0.8000
PPV - ALL: 0.8130  COVID-19: 0.8200  PNEUMONIA: 0.7798  NORMAL: 0.8391 
RECALL - ALL: 0.8101  COVID-19: 0.8200  PNEUMONIA: 0.8500  NORMAL: 0.7604 
F1 - ALL: 0.8104  COVID-19: 0.8200  PNEUMONIA: 0.8134  NORMAL: 0.7978 

Epoch 4/19
----------
[train]
LOSS - 0.0478
ACC - 0.9600
PPV - ALL: 1.0000  COVID-19: 1.0000  PNEUMONIA: 1.0000  NORMAL: 1.0000 
RECALL - ALL: 1.0000  COVID-19: 1.0000  PNEUMONIA: 1.0000  NORMAL: 1.0000 
F1 - ALL: 1.0000  COVID-19: 1.0000  PNEUMONIA: 1.0000  NORMAL: 1.0000 
Mask ratio's range: 0.9375 ~ 1.0

[val]
LOSS - 0.5141
ACC - 0.7933
PPV - ALL: 0.8061  COVID-19: 0.8200  PNEUMONIA: 0.7706  NORMAL: 0.8276 
RECALL - ALL: 0.8033  COVID-19: 0.8200  PNEUMONIA: 0.8400  NORMAL: 0.7500 
F1 - ALL: 0.8036  COVID-19: 0.8200  PNEUMONIA: 0.8038  NORMAL: 0.7869 

Epoch 5/19
----------
[train]
LOSS - 0.0317
ACC - 0.9600
PPV - ALL: 1.0000  COVID-19: 1.0000  PNEUMONIA: 1.0000  NORMAL: 1.0000 
RECALL - ALL: 1.0000  COVID-19: 1.0000  PNEUMONIA: 1.0000  NORMAL: 1.0000 
F1 - ALL: 1.0000  COVID-19: 1.0000  PNEUMONIA: 1.0000  NORMAL: 1.0000 
Mask ratio's range: 0.875 ~ 1.0

[val]
LOSS - 0.5130
ACC - 0.7967
PPV - ALL: 0.8105  COVID-19: 0.8265  PNEUMONIA: 0.7658  NORMAL: 0.8391 
RECALL - ALL: 0.8068  COVID-19: 0.8100  PNEUMONIA: 0.8500  NORMAL: 0.7604 
F1 - ALL: 0.8072  COVID-19: 0.8182  PNEUMONIA: 0.8057  NORMAL: 0.7978 

Epoch 6/19
----------
[train]
LOSS - 0.0378
ACC - 0.9600
PPV - ALL: 1.0000  COVID-19: 1.0000  PNEUMONIA: 1.0000  NORMAL: 1.0000 
RECALL - ALL: 1.0000  COVID-19: 1.0000  PNEUMONIA: 1.0000  NORMAL: 1.0000 
F1 - ALL: 1.0000  COVID-19: 1.0000  PNEUMONIA: 1.0000  NORMAL: 1.0000 
Mask ratio's range: 0.8125 ~ 1.0

[val]
LOSS - 0.5347
ACC - 0.8000
PPV - ALL: 0.8147  COVID-19: 0.8421  PNEUMONIA: 0.7611  NORMAL: 0.8409 
RECALL - ALL: 0.8103  COVID-19: 0.8000  PNEUMONIA: 0.8600  NORMAL: 0.7708 
F1 - ALL: 0.8108  COVID-19: 0.8205  PNEUMONIA: 0.8075  NORMAL: 0.8043 

Epoch 7/19
----------
[train]
LOSS - 0.0521
ACC - 0.9600
PPV - ALL: 1.0000  COVID-19: 1.0000  PNEUMONIA: 1.0000  NORMAL: 1.0000 
RECALL - ALL: 1.0000  COVID-19: 1.0000  PNEUMONIA: 1.0000  NORMAL: 1.0000 
F1 - ALL: 1.0000  COVID-19: 1.0000  PNEUMONIA: 1.0000  NORMAL: 1.0000 
Mask ratio's range: 0.75 ~ 0.9375

[val]
LOSS - 0.5367
ACC - 0.8000
PPV - ALL: 0.8188  COVID-19: 0.8736  PNEUMONIA: 0.7350  NORMAL: 0.8478 
RECALL - ALL: 0.8108  COVID-19: 0.7600  PNEUMONIA: 0.8600  NORMAL: 0.8125 
F1 - ALL: 0.8118  COVID-19: 0.8129  PNEUMONIA: 0.7926  NORMAL: 0.8298 

Epoch 8/19
----------
[train]
LOSS - 0.0425
ACC - 0.9600
PPV - ALL: 1.0000  COVID-19: 1.0000  PNEUMONIA: 1.0000  NORMAL: 1.0000 
RECALL - ALL: 1.0000  COVID-19: 1.0000  PNEUMONIA: 1.0000  NORMAL: 1.0000 
F1 - ALL: 1.0000  COVID-19: 1.0000  PNEUMONIA: 1.0000  NORMAL: 1.0000 
Mask ratio's range: 0.75 ~ 0.9375

[val]
LOSS - 0.5045
ACC - 0.7867
PPV - ALL: 0.8099  COVID-19: 0.8987  PNEUMONIA: 0.7167  NORMAL: 0.8144 
RECALL - ALL: 0.7976  COVID-19: 0.7100  PNEUMONIA: 0.8600  NORMAL: 0.8229 
F1 - ALL: 0.7979  COVID-19: 0.7933  PNEUMONIA: 0.7818  NORMAL: 0.8186 

Epoch 9/19
----------
[train]
LOSS - 0.0620
ACC - 0.9600
PPV - ALL: 1.0000  COVID-19: 1.0000  PNEUMONIA: 1.0000  NORMAL: 1.0000 
RECALL - ALL: 1.0000  COVID-19: 1.0000  PNEUMONIA: 1.0000  NORMAL: 1.0000 
F1 - ALL: 1.0000  COVID-19: 1.0000  PNEUMONIA: 1.0000  NORMAL: 1.0000 
Mask ratio's range: 0.6875 ~ 0.875

[val]
LOSS - 0.5680
ACC - 0.7900
PPV - ALL: 0.8162  COVID-19: 0.9342  PNEUMONIA: 0.7203  NORMAL: 0.7941 
RECALL - ALL: 0.8013  COVID-19: 0.7100  PNEUMONIA: 0.8500  NORMAL: 0.8438 
F1 - ALL: 0.8016  COVID-19: 0.8068  PNEUMONIA: 0.7798  NORMAL: 0.8182 

Epoch 10/19
----------
[train]
LOSS - 0.0428
ACC - 0.9600
PPV - ALL: 1.0000  COVID-19: 1.0000  PNEUMONIA: 1.0000  NORMAL: 1.0000 
RECALL - ALL: 1.0000  COVID-19: 1.0000  PNEUMONIA: 1.0000  NORMAL: 1.0000 
F1 - ALL: 1.0000  COVID-19: 1.0000  PNEUMONIA: 1.0000  NORMAL: 1.0000 
Mask ratio's range: 0.6875 ~ 0.8125

[val]
LOSS - 0.5314
ACC - 0.7867
PPV - ALL: 0.8155  COVID-19: 0.9452  PNEUMONIA: 0.7203  NORMAL: 0.7810 
RECALL - ALL: 0.7981  COVID-19: 0.6900  PNEUMONIA: 0.8500  NORMAL: 0.8542 
F1 - ALL: 0.7978  COVID-19: 0.7977  PNEUMONIA: 0.7798  NORMAL: 0.8160 

Epoch 11/19
----------
[train]
LOSS - 0.0445
ACC - 0.9600
PPV - ALL: 1.0000  COVID-19: 1.0000  PNEUMONIA: 1.0000  NORMAL: 1.0000 
RECALL - ALL: 1.0000  COVID-19: 1.0000  PNEUMONIA: 1.0000  NORMAL: 1.0000 
F1 - ALL: 1.0000  COVID-19: 1.0000  PNEUMONIA: 1.0000  NORMAL: 1.0000 
Mask ratio's range: 0.625 ~ 0.8125

[val]
LOSS - 0.5409
ACC - 0.7767
PPV - ALL: 0.8097  COVID-19: 0.9412  PNEUMONIA: 0.7049  NORMAL: 0.7830 
RECALL - ALL: 0.7882  COVID-19: 0.6400  PNEUMONIA: 0.8600  NORMAL: 0.8646 
F1 - ALL: 0.7862  COVID-19: 0.7619  PNEUMONIA: 0.7748  NORMAL: 0.8218 

Epoch 12/19
----------
[train]
LOSS - 0.0692
ACC - 0.9600
PPV - ALL: 1.0000  COVID-19: 1.0000  PNEUMONIA: 1.0000  NORMAL: 1.0000 
RECALL - ALL: 1.0000  COVID-19: 1.0000  PNEUMONIA: 1.0000  NORMAL: 1.0000 
F1 - ALL: 1.0000  COVID-19: 1.0000  PNEUMONIA: 1.0000  NORMAL: 1.0000 
Mask ratio's range: 0.5625 ~ 0.8125

[val]
LOSS - 0.5495
ACC - 0.7767
PPV - ALL: 0.8129  COVID-19: 0.9545  PNEUMONIA: 0.6992  NORMAL: 0.7850 
RECALL - ALL: 0.7883  COVID-19: 0.6300  PNEUMONIA: 0.8600  NORMAL: 0.8750 
F1 - ALL: 0.7860  COVID-19: 0.7590  PNEUMONIA: 0.7713  NORMAL: 0.8276 

Epoch 13/19
----------
[train]
LOSS - 0.0610
ACC - 0.9600
PPV - ALL: 1.0000  COVID-19: 1.0000  PNEUMONIA: 1.0000  NORMAL: 1.0000 
RECALL - ALL: 1.0000  COVID-19: 1.0000  PNEUMONIA: 1.0000  NORMAL: 1.0000 
F1 - ALL: 1.0000  COVID-19: 1.0000  PNEUMONIA: 1.0000  NORMAL: 1.0000 
Mask ratio's range: 0.5 ~ 0.8125

[val]
LOSS - 0.6025
ACC - 0.7667
PPV - ALL: 0.8084  COVID-19: 0.9677  PNEUMONIA: 0.6960  NORMAL: 0.7615 
RECALL - ALL: 0.7782  COVID-19: 0.6000  PNEUMONIA: 0.8700  NORMAL: 0.8646 
F1 - ALL: 0.7746  COVID-19: 0.7407  PNEUMONIA: 0.7733  NORMAL: 0.8098 

Epoch 14/19
----------
[train]
LOSS - 0.0547
ACC - 0.9600
PPV - ALL: 1.0000  COVID-19: 1.0000  PNEUMONIA: 1.0000  NORMAL: 1.0000 
RECALL - ALL: 1.0000  COVID-19: 1.0000  PNEUMONIA: 1.0000  NORMAL: 1.0000 
F1 - ALL: 1.0000  COVID-19: 1.0000  PNEUMONIA: 1.0000  NORMAL: 1.0000 
Mask ratio's range: 0.5 ~ 0.75

[val]
LOSS - 0.6042
ACC - 0.7667
PPV - ALL: 0.8055  COVID-19: 0.9524  PNEUMONIA: 0.6935  NORMAL: 0.7706 
RECALL - ALL: 0.7783  COVID-19: 0.6000  PNEUMONIA: 0.8600  NORMAL: 0.8750 
F1 - ALL: 0.7745  COVID-19: 0.7362  PNEUMONIA: 0.7678  NORMAL: 0.8195 

Epoch 15/19
----------
[train]
LOSS - 0.0592
ACC - 0.9600
PPV - ALL: 1.0000  COVID-19: 1.0000  PNEUMONIA: 1.0000  NORMAL: 1.0000 
RECALL - ALL: 1.0000  COVID-19: 1.0000  PNEUMONIA: 1.0000  NORMAL: 1.0000 
F1 - ALL: 1.0000  COVID-19: 1.0000  PNEUMONIA: 1.0000  NORMAL: 1.0000 
Mask ratio's range: 0.4375 ~ 0.75

[val]
LOSS - 0.6268
ACC - 0.7533
PPV - ALL: 0.8057  COVID-19: 0.9818  PNEUMONIA: 0.6718  NORMAL: 0.7636 
RECALL - ALL: 0.7650  COVID-19: 0.5400  PNEUMONIA: 0.8800  NORMAL: 0.8750 
F1 - ALL: 0.7581  COVID-19: 0.6968  PNEUMONIA: 0.7619  NORMAL: 0.8155 

Epoch 16/19
----------
[train]
LOSS - 0.0377
ACC - 0.9600
PPV - ALL: 1.0000  COVID-19: 1.0000  PNEUMONIA: 1.0000  NORMAL: 1.0000 
RECALL - ALL: 1.0000  COVID-19: 1.0000  PNEUMONIA: 1.0000  NORMAL: 1.0000 
F1 - ALL: 1.0000  COVID-19: 1.0000  PNEUMONIA: 1.0000  NORMAL: 1.0000 
Mask ratio's range: 0.4375 ~ 0.75

[val]
LOSS - 0.6573
ACC - 0.7567
PPV - ALL: 0.8088  COVID-19: 0.9818  PNEUMONIA: 0.6718  NORMAL: 0.7727 
RECALL - ALL: 0.7685  COVID-19: 0.5400  PNEUMONIA: 0.8800  NORMAL: 0.8854 
F1 - ALL: 0.7613  COVID-19: 0.6968  PNEUMONIA: 0.7619  NORMAL: 0.8252 

Epoch 17/19
----------
[train]
LOSS - 0.0376
ACC - 0.9600
PPV - ALL: 1.0000  COVID-19: 1.0000  PNEUMONIA: 1.0000  NORMAL: 1.0000 
RECALL - ALL: 1.0000  COVID-19: 1.0000  PNEUMONIA: 1.0000  NORMAL: 1.0000 
F1 - ALL: 1.0000  COVID-19: 1.0000  PNEUMONIA: 1.0000  NORMAL: 1.0000 
Mask ratio's range: 0.4375 ~ 0.75

[val]
LOSS - 0.6475
ACC - 0.7567
PPV - ALL: 0.8082  COVID-19: 0.9821  PNEUMONIA: 0.6718  NORMAL: 0.7706 
RECALL - ALL: 0.7683  COVID-19: 0.5500  PNEUMONIA: 0.8800  NORMAL: 0.8750 
F1 - ALL: 0.7622  COVID-19: 0.7051  PNEUMONIA: 0.7619  NORMAL: 0.8195 

Epoch 18/19
----------
[train]
LOSS - 0.0432
ACC - 0.9600
PPV - ALL: 1.0000  COVID-19: 1.0000  PNEUMONIA: 1.0000  NORMAL: 1.0000 
RECALL - ALL: 1.0000  COVID-19: 1.0000  PNEUMONIA: 1.0000  NORMAL: 1.0000 
F1 - ALL: 1.0000  COVID-19: 1.0000  PNEUMONIA: 1.0000  NORMAL: 1.0000 
Mask ratio's range: 0.375 ~ 0.75

[val]
LOSS - 0.6568
ACC - 0.7500
PPV - ALL: 0.8045  COVID-19: 0.9811  PNEUMONIA: 0.6667  NORMAL: 0.7658 
RECALL - ALL: 0.7618  COVID-19: 0.5200  PNEUMONIA: 0.8800  NORMAL: 0.8854 
F1 - ALL: 0.7532  COVID-19: 0.6797  PNEUMONIA: 0.7586  NORMAL: 0.8213 

Epoch 19/19
----------
[train]
LOSS - 0.0350
ACC - 0.9600
PPV - ALL: 1.0000  COVID-19: 1.0000  PNEUMONIA: 1.0000  NORMAL: 1.0000 
RECALL - ALL: 1.0000  COVID-19: 1.0000  PNEUMONIA: 1.0000  NORMAL: 1.0000 
F1 - ALL: 1.0000  COVID-19: 1.0000  PNEUMONIA: 1.0000  NORMAL: 1.0000 
Mask ratio's range: 0.3125 ~ 0.6875

[val]
LOSS - 0.6732
ACC - 0.7433
PPV - ALL: 0.8017  COVID-19: 0.9804  PNEUMONIA: 0.6519  NORMAL: 0.7727 
RECALL - ALL: 0.7551  COVID-19: 0.5000  PNEUMONIA: 0.8800  NORMAL: 0.8854 
F1 - ALL: 0.7455  COVID-19: 0.6623  PNEUMONIA: 0.7490  NORMAL: 0.8252 


--------------------
[Best results]
ACC - 0.8000
PPV - ALL: 0.8130  COVID-19: 0.8200  PNEUMONIA: 0.7798  NORMAL: 0.8391 
RECALL - ALL: 0.8101  COVID-19: 0.8200  PNEUMONIA: 0.8500  NORMAL: 0.7604 
F1 - ALL: 0.8104  COVID-19: 0.8200  PNEUMONIA: 0.8134  NORMAL: 0.7978 

Training complete in 1m 29s
-------------------- 

--------------------
Model 3
--------------------

Epoch 0/19
----------
[train]
LOSS - 1.0367
ACC - 0.4000
PPV - ALL: 0.4427  COVID-19: 0.3750  PNEUMONIA: 0.6111  NORMAL: 0.3421 
RECALL - ALL: 0.4167  COVID-19: 0.2500  PNEUMONIA: 0.4583  NORMAL: 0.5417 
F1 - ALL: 0.4144  COVID-19: 0.3000  PNEUMONIA: 0.5238  NORMAL: 0.4194 
Mask ratio's range: 1.0 ~ 1.0

[val]
LOSS - 1.0457
ACC - 0.4700
PPV - ALL: 0.3231  COVID-19: 0.0000  PNEUMONIA: 0.4592  NORMAL: 0.5100 
RECALL - ALL: 0.4771  COVID-19: 0.0000  PNEUMONIA: 0.9000  NORMAL: 0.5312 
F1 - ALL: 0.3762  COVID-19: 0.0000  PNEUMONIA: 0.6081  NORMAL: 0.5204 

Epoch 1/19
----------
[train]
LOSS - 0.6542
ACC - 0.8933
PPV - ALL: 0.9379  COVID-19: 1.0000  PNEUMONIA: 0.9565  NORMAL: 0.8571 
RECALL - ALL: 0.9306  COVID-19: 0.8750  PNEUMONIA: 0.9167  NORMAL: 1.0000 
F1 - ALL: 0.9309  COVID-19: 0.9333  PNEUMONIA: 0.9362  NORMAL: 0.9231 
Mask ratio's range: 1.0 ~ 1.0

[val]
LOSS - 0.7776
ACC - 0.7333
PPV - ALL: 0.7658  COVID-19: 0.8889  PNEUMONIA: 0.6967  NORMAL: 0.7117 
RECALL - ALL: 0.7443  COVID-19: 0.5600  PNEUMONIA: 0.8500  NORMAL: 0.8229 
F1 - ALL: 0.7387  COVID-19: 0.6871  PNEUMONIA: 0.7658  NORMAL: 0.7633 

Epoch 2/19
----------
[train]
LOSS - 0.2733
ACC - 0.9467
PPV - ALL: 0.9867  COVID-19: 1.0000  PNEUMONIA: 0.9600  NORMAL: 1.0000 
RECALL - ALL: 0.9861  COVID-19: 0.9583  PNEUMONIA: 1.0000  NORMAL: 1.0000 
F1 - ALL: 0.9861  COVID-19: 0.9787  PNEUMONIA: 0.9796  NORMAL: 1.0000 
Mask ratio's range: 1.0 ~ 1.0

[val]
LOSS - 0.6296
ACC - 0.7800
PPV - ALL: 0.8013  COVID-19: 0.8875  PNEUMONIA: 0.7227  NORMAL: 0.7938 
RECALL - ALL: 0.7907  COVID-19: 0.7100  PNEUMONIA: 0.8600  NORMAL: 0.8021 
F1 - ALL: 0.7907  COVID-19: 0.7889  PNEUMONIA: 0.7854  NORMAL: 0.7979 

Epoch 3/19
----------
[train]
LOSS - 0.1046
ACC - 0.9600
PPV - ALL: 1.0000  COVID-19: 1.0000  PNEUMONIA: 1.0000  NORMAL: 1.0000 
RECALL - ALL: 1.0000  COVID-19: 1.0000  PNEUMONIA: 1.0000  NORMAL: 1.0000 
F1 - ALL: 1.0000  COVID-19: 1.0000  PNEUMONIA: 1.0000  NORMAL: 1.0000 
Mask ratio's range: 1.0 ~ 1.0

[val]
LOSS - 0.5544
ACC - 0.7967
PPV - ALL: 0.8118  COVID-19: 0.8571  PNEUMONIA: 0.7522  NORMAL: 0.8261 
RECALL - ALL: 0.8072  COVID-19: 0.7800  PNEUMONIA: 0.8500  NORMAL: 0.7917 
F1 - ALL: 0.8078  COVID-19: 0.8167  PNEUMONIA: 0.7981  NORMAL: 0.8085 

Epoch 4/19
----------
[train]
LOSS - 0.0506
ACC - 0.9600
PPV - ALL: 1.0000  COVID-19: 1.0000  PNEUMONIA: 1.0000  NORMAL: 1.0000 
RECALL - ALL: 1.0000  COVID-19: 1.0000  PNEUMONIA: 1.0000  NORMAL: 1.0000 
F1 - ALL: 1.0000  COVID-19: 1.0000  PNEUMONIA: 1.0000  NORMAL: 1.0000 
Mask ratio's range: 0.9375 ~ 1.0

[val]
LOSS - 0.5155
ACC - 0.8067
PPV - ALL: 0.8202  COVID-19: 0.8469  PNEUMONIA: 0.7727  NORMAL: 0.8409 
RECALL - ALL: 0.8169  COVID-19: 0.8300  PNEUMONIA: 0.8500  NORMAL: 0.7708 
F1 - ALL: 0.8174  COVID-19: 0.8384  PNEUMONIA: 0.8095  NORMAL: 0.8043 

Epoch 5/19
----------
[train]
LOSS - 0.0430
ACC - 0.9600
PPV - ALL: 1.0000  COVID-19: 1.0000  PNEUMONIA: 1.0000  NORMAL: 1.0000 
RECALL - ALL: 1.0000  COVID-19: 1.0000  PNEUMONIA: 1.0000  NORMAL: 1.0000 
F1 - ALL: 1.0000  COVID-19: 1.0000  PNEUMONIA: 1.0000  NORMAL: 1.0000 
Mask ratio's range: 0.8125 ~ 1.0

[val]
LOSS - 0.5033
ACC - 0.8000
PPV - ALL: 0.8143  COVID-19: 0.8667  PNEUMONIA: 0.7636  NORMAL: 0.8125 
RECALL - ALL: 0.8108  COVID-19: 0.7800  PNEUMONIA: 0.8400  NORMAL: 0.8125 
F1 - ALL: 0.8112  COVID-19: 0.8211  PNEUMONIA: 0.8000  NORMAL: 0.8125 

Epoch 6/19
----------
[train]
LOSS - 0.0469
ACC - 0.9600
PPV - ALL: 1.0000  COVID-19: 1.0000  PNEUMONIA: 1.0000  NORMAL: 1.0000 
RECALL - ALL: 1.0000  COVID-19: 1.0000  PNEUMONIA: 1.0000  NORMAL: 1.0000 
F1 - ALL: 1.0000  COVID-19: 1.0000  PNEUMONIA: 1.0000  NORMAL: 1.0000 
Mask ratio's range: 0.75 ~ 1.0

[val]
LOSS - 0.4946
ACC - 0.8133
PPV - ALL: 0.8280  COVID-19: 0.8901  PNEUMONIA: 0.7727  NORMAL: 0.8211 
RECALL - ALL: 0.8242  COVID-19: 0.8100  PNEUMONIA: 0.8500  NORMAL: 0.8125 
F1 - ALL: 0.8248  COVID-19: 0.8482  PNEUMONIA: 0.8095  NORMAL: 0.8168 

Epoch 7/19
----------
[train]
LOSS - 0.0581
ACC - 0.9600
PPV - ALL: 1.0000  COVID-19: 1.0000  PNEUMONIA: 1.0000  NORMAL: 1.0000 
RECALL - ALL: 1.0000  COVID-19: 1.0000  PNEUMONIA: 1.0000  NORMAL: 1.0000 
F1 - ALL: 1.0000  COVID-19: 1.0000  PNEUMONIA: 1.0000  NORMAL: 1.0000 
Mask ratio's range: 0.6875 ~ 0.9375

[val]
LOSS - 0.5282
ACC - 0.8067
PPV - ALL: 0.8227  COVID-19: 0.8953  PNEUMONIA: 0.7727  NORMAL: 0.8000 
RECALL - ALL: 0.8178  COVID-19: 0.7700  PNEUMONIA: 0.8500  NORMAL: 0.8333 
F1 - ALL: 0.8179  COVID-19: 0.8279  PNEUMONIA: 0.8095  NORMAL: 0.8163 

Epoch 8/19
----------
[train]
LOSS - 0.0491
ACC - 0.9600
PPV - ALL: 1.0000  COVID-19: 1.0000  PNEUMONIA: 1.0000  NORMAL: 1.0000 
RECALL - ALL: 1.0000  COVID-19: 1.0000  PNEUMONIA: 1.0000  NORMAL: 1.0000 
F1 - ALL: 1.0000  COVID-19: 1.0000  PNEUMONIA: 1.0000  NORMAL: 1.0000 
Mask ratio's range: 0.625 ~ 0.9375

[val]
LOSS - 0.5088
ACC - 0.8067
PPV - ALL: 0.8284  COVID-19: 0.9367  PNEUMONIA: 0.7719  NORMAL: 0.7767 
RECALL - ALL: 0.8178  COVID-19: 0.7400  PNEUMONIA: 0.8800  NORMAL: 0.8333 
F1 - ALL: 0.8177  COVID-19: 0.8268  PNEUMONIA: 0.8224  NORMAL: 0.8040 

Epoch 9/19
----------
[train]
LOSS - 0.0763
ACC - 0.9600
PPV - ALL: 1.0000  COVID-19: 1.0000  PNEUMONIA: 1.0000  NORMAL: 1.0000 
RECALL - ALL: 1.0000  COVID-19: 1.0000  PNEUMONIA: 1.0000  NORMAL: 1.0000 
F1 - ALL: 1.0000  COVID-19: 1.0000  PNEUMONIA: 1.0000  NORMAL: 1.0000 
Mask ratio's range: 0.5 ~ 0.9375

[val]
LOSS - 0.5462
ACC - 0.7967
PPV - ALL: 0.8210  COVID-19: 0.9333  PNEUMONIA: 0.7909  NORMAL: 0.7387 
RECALL - ALL: 0.8081  COVID-19: 0.7000  PNEUMONIA: 0.8700  NORMAL: 0.8542 
F1 - ALL: 0.8070  COVID-19: 0.8000  PNEUMONIA: 0.8286  NORMAL: 0.7923 

Epoch 10/19
----------
[train]
LOSS - 0.0580
ACC - 0.9600
PPV - ALL: 1.0000  COVID-19: 1.0000  PNEUMONIA: 1.0000  NORMAL: 1.0000 
RECALL - ALL: 1.0000  COVID-19: 1.0000  PNEUMONIA: 1.0000  NORMAL: 1.0000 
F1 - ALL: 1.0000  COVID-19: 1.0000  PNEUMONIA: 1.0000  NORMAL: 1.0000 
Mask ratio's range: 0.5 ~ 0.875

[val]
LOSS - 0.5680
ACC - 0.7933
PPV - ALL: 0.8207  COVID-19: 0.9444  PNEUMONIA: 0.7857  NORMAL: 0.7321 
RECALL - ALL: 0.8047  COVID-19: 0.6800  PNEUMONIA: 0.8800  NORMAL: 0.8542 
F1 - ALL: 0.8031  COVID-19: 0.7907  PNEUMONIA: 0.8302  NORMAL: 0.7885 

Epoch 11/19
----------
[train]
LOSS - 0.0519
ACC - 0.9600
PPV - ALL: 1.0000  COVID-19: 1.0000  PNEUMONIA: 1.0000  NORMAL: 1.0000 
RECALL - ALL: 1.0000  COVID-19: 1.0000  PNEUMONIA: 1.0000  NORMAL: 1.0000 
F1 - ALL: 1.0000  COVID-19: 1.0000  PNEUMONIA: 1.0000  NORMAL: 1.0000 
Mask ratio's range: 0.5 ~ 0.8125

[val]
LOSS - 0.5687
ACC - 0.7933
PPV - ALL: 0.8206  COVID-19: 0.9444  PNEUMONIA: 0.7788  NORMAL: 0.7387 
RECALL - ALL: 0.8047  COVID-19: 0.6800  PNEUMONIA: 0.8800  NORMAL: 0.8542 
F1 - ALL: 0.8031  COVID-19: 0.7907  PNEUMONIA: 0.8263  NORMAL: 0.7923 

Epoch 12/19
----------
[train]
LOSS - 0.0694
ACC - 0.9600
PPV - ALL: 1.0000  COVID-19: 1.0000  PNEUMONIA: 1.0000  NORMAL: 1.0000 
RECALL - ALL: 1.0000  COVID-19: 1.0000  PNEUMONIA: 1.0000  NORMAL: 1.0000 
F1 - ALL: 1.0000  COVID-19: 1.0000  PNEUMONIA: 1.0000  NORMAL: 1.0000 
Mask ratio's range: 0.5 ~ 0.8125

[val]
LOSS - 0.5916
ACC - 0.7900
PPV - ALL: 0.8185  COVID-19: 0.9429  PNEUMONIA: 0.7739  NORMAL: 0.7387 
RECALL - ALL: 0.8014  COVID-19: 0.6600  PNEUMONIA: 0.8900  NORMAL: 0.8542 
F1 - ALL: 0.7989  COVID-19: 0.7765  PNEUMONIA: 0.8279  NORMAL: 0.7923 

Epoch 13/19
----------
[train]
LOSS - 0.0665
ACC - 0.9600
PPV - ALL: 1.0000  COVID-19: 1.0000  PNEUMONIA: 1.0000  NORMAL: 1.0000 
RECALL - ALL: 1.0000  COVID-19: 1.0000  PNEUMONIA: 1.0000  NORMAL: 1.0000 
F1 - ALL: 1.0000  COVID-19: 1.0000  PNEUMONIA: 1.0000  NORMAL: 1.0000 
Mask ratio's range: 0.5 ~ 0.75

[val]
LOSS - 0.5948
ACC - 0.7900
PPV - ALL: 0.8189  COVID-19: 0.9429  PNEUMONIA: 0.7857  NORMAL: 0.7281 
RECALL - ALL: 0.8015  COVID-19: 0.6600  PNEUMONIA: 0.8800  NORMAL: 0.8646 
F1 - ALL: 0.7991  COVID-19: 0.7765  PNEUMONIA: 0.8302  NORMAL: 0.7905 

Epoch 14/19
----------
[train]
LOSS - 0.0408
ACC - 0.9600
PPV - ALL: 1.0000  COVID-19: 1.0000  PNEUMONIA: 1.0000  NORMAL: 1.0000 
RECALL - ALL: 1.0000  COVID-19: 1.0000  PNEUMONIA: 1.0000  NORMAL: 1.0000 
F1 - ALL: 1.0000  COVID-19: 1.0000  PNEUMONIA: 1.0000  NORMAL: 1.0000 
Mask ratio's range: 0.4375 ~ 0.75

[val]
LOSS - 0.5991
ACC - 0.8000
PPV - ALL: 0.8272  COVID-19: 0.9437  PNEUMONIA: 0.7946  NORMAL: 0.7434 
RECALL - ALL: 0.8117  COVID-19: 0.6700  PNEUMONIA: 0.8900  NORMAL: 0.8750 
F1 - ALL: 0.8090  COVID-19: 0.7836  PNEUMONIA: 0.8396  NORMAL: 0.8038 

Epoch 15/19
----------
[train]
LOSS - 0.0422
ACC - 0.9600
PPV - ALL: 1.0000  COVID-19: 1.0000  PNEUMONIA: 1.0000  NORMAL: 1.0000 
RECALL - ALL: 1.0000  COVID-19: 1.0000  PNEUMONIA: 1.0000  NORMAL: 1.0000 
F1 - ALL: 1.0000  COVID-19: 1.0000  PNEUMONIA: 1.0000  NORMAL: 1.0000 
Mask ratio's range: 0.4375 ~ 0.75

[val]
LOSS - 0.5928
ACC - 0.7933
PPV - ALL: 0.8217  COVID-19: 0.9437  PNEUMONIA: 0.7909  NORMAL: 0.7304 
RECALL - ALL: 0.8050  COVID-19: 0.6700  PNEUMONIA: 0.8700  NORMAL: 0.8750 
F1 - ALL: 0.8028  COVID-19: 0.7836  PNEUMONIA: 0.8286  NORMAL: 0.7962 

Epoch 16/19
----------
[train]
LOSS - 0.0505
ACC - 0.9600
PPV - ALL: 1.0000  COVID-19: 1.0000  PNEUMONIA: 1.0000  NORMAL: 1.0000 
RECALL - ALL: 1.0000  COVID-19: 1.0000  PNEUMONIA: 1.0000  NORMAL: 1.0000 
F1 - ALL: 1.0000  COVID-19: 1.0000  PNEUMONIA: 1.0000  NORMAL: 1.0000 
Mask ratio's range: 0.4375 ~ 0.75

[val]
LOSS - 0.6294
ACC - 0.7933
PPV - ALL: 0.8218  COVID-19: 0.9429  PNEUMONIA: 0.7857  NORMAL: 0.7368 
RECALL - ALL: 0.8050  COVID-19: 0.6600  PNEUMONIA: 0.8800  NORMAL: 0.8750 
F1 - ALL: 0.8022  COVID-19: 0.7765  PNEUMONIA: 0.8302  NORMAL: 0.8000 

Epoch 17/19
----------
[train]
LOSS - 0.0314
ACC - 0.9600
PPV - ALL: 1.0000  COVID-19: 1.0000  PNEUMONIA: 1.0000  NORMAL: 1.0000 
RECALL - ALL: 1.0000  COVID-19: 1.0000  PNEUMONIA: 1.0000  NORMAL: 1.0000 
F1 - ALL: 1.0000  COVID-19: 1.0000  PNEUMONIA: 1.0000  NORMAL: 1.0000 
Mask ratio's range: 0.4375 ~ 0.75

[val]
LOSS - 0.6192
ACC - 0.8000
PPV - ALL: 0.8271  COVID-19: 0.9437  PNEUMONIA: 0.7876  NORMAL: 0.7500 
RECALL - ALL: 0.8117  COVID-19: 0.6700  PNEUMONIA: 0.8900  NORMAL: 0.8750 
F1 - ALL: 0.8090  COVID-19: 0.7836  PNEUMONIA: 0.8357  NORMAL: 0.8077 

Epoch 18/19
----------
[train]
LOSS - 0.0353
ACC - 0.9600
PPV - ALL: 1.0000  COVID-19: 1.0000  PNEUMONIA: 1.0000  NORMAL: 1.0000 
RECALL - ALL: 1.0000  COVID-19: 1.0000  PNEUMONIA: 1.0000  NORMAL: 1.0000 
F1 - ALL: 1.0000  COVID-19: 1.0000  PNEUMONIA: 1.0000  NORMAL: 1.0000 
Mask ratio's range: 0.375 ~ 0.75

[val]
LOSS - 0.6303
ACC - 0.7967
PPV - ALL: 0.8245  COVID-19: 0.9429  PNEUMONIA: 0.7807  NORMAL: 0.7500 
RECALL - ALL: 0.8083  COVID-19: 0.6600  PNEUMONIA: 0.8900  NORMAL: 0.8750 
F1 - ALL: 0.8053  COVID-19: 0.7765  PNEUMONIA: 0.8318  NORMAL: 0.8077 

Epoch 19/19
----------
[train]
LOSS - 0.0349
ACC - 0.9600
PPV - ALL: 1.0000  COVID-19: 1.0000  PNEUMONIA: 1.0000  NORMAL: 1.0000 
RECALL - ALL: 1.0000  COVID-19: 1.0000  PNEUMONIA: 1.0000  NORMAL: 1.0000 
F1 - ALL: 1.0000  COVID-19: 1.0000  PNEUMONIA: 1.0000  NORMAL: 1.0000 
Mask ratio's range: 0.375 ~ 0.75

[val]
LOSS - 0.6220
ACC - 0.7933
PPV - ALL: 0.8244  COVID-19: 0.9559  PNEUMONIA: 0.7739  NORMAL: 0.7434 
RECALL - ALL: 0.8050  COVID-19: 0.6500  PNEUMONIA: 0.8900  NORMAL: 0.8750 
F1 - ALL: 0.8018  COVID-19: 0.7738  PNEUMONIA: 0.8279  NORMAL: 0.8038 


--------------------
[Best results]
ACC - 0.8133
PPV - ALL: 0.8280  COVID-19: 0.8901  PNEUMONIA: 0.7727  NORMAL: 0.8211 
RECALL - ALL: 0.8242  COVID-19: 0.8100  PNEUMONIA: 0.8500  NORMAL: 0.8125 
F1 - ALL: 0.8248  COVID-19: 0.8482  PNEUMONIA: 0.8095  NORMAL: 0.8168 

Training complete in 1m 30s
-------------------- 

--------------------
Model 4
--------------------

Epoch 0/19
----------
[train]
LOSS - 0.9908
ACC - 0.4400
PPV - ALL: 0.4673  COVID-19: 0.5333  PNEUMONIA: 0.4211  NORMAL: 0.4474 
RECALL - ALL: 0.4583  COVID-19: 0.3333  PNEUMONIA: 0.3333  NORMAL: 0.7083 
F1 - ALL: 0.4436  COVID-19: 0.4102  PNEUMONIA: 0.3721  NORMAL: 0.5484 
Mask ratio's range: 1.0 ~ 1.0

[val]
LOSS - 0.9554
ACC - 0.5900
PPV - ALL: 0.7147  COVID-19: 0.8571  PNEUMONIA: 0.4688  NORMAL: 0.8182 
RECALL - ALL: 0.5963  COVID-19: 0.4200  PNEUMONIA: 0.9000  NORMAL: 0.4688 
F1 - ALL: 0.5921  COVID-19: 0.5637  PNEUMONIA: 0.6165  NORMAL: 0.5961 

Epoch 1/19
----------
[train]
LOSS - 0.6054
ACC - 0.9200
PPV - ALL: 0.9599  COVID-19: 1.0000  PNEUMONIA: 0.9565  NORMAL: 0.9231 
RECALL - ALL: 0.9583  COVID-19: 0.9583  PNEUMONIA: 0.9167  NORMAL: 1.0000 
F1 - ALL: 0.9583  COVID-19: 0.9787  PNEUMONIA: 0.9362  NORMAL: 0.9600 
Mask ratio's range: 1.0 ~ 1.0

[val]
LOSS - 0.7584
ACC - 0.7267
PPV - ALL: 0.7512  COVID-19: 0.8406  PNEUMONIA: 0.6723  NORMAL: 0.7407 
RECALL - ALL: 0.7378  COVID-19: 0.5800  PNEUMONIA: 0.8000  NORMAL: 0.8333 
F1 - ALL: 0.7338  COVID-19: 0.6864  PNEUMONIA: 0.7306  NORMAL: 0.7843 

Epoch 2/19
----------
[train]
LOSS - 0.2426
ACC - 0.9600
PPV - ALL: 1.0000  COVID-19: 1.0000  PNEUMONIA: 1.0000  NORMAL: 1.0000 
RECALL - ALL: 1.0000  COVID-19: 1.0000  PNEUMONIA: 1.0000  NORMAL: 1.0000 
F1 - ALL: 1.0000  COVID-19: 1.0000  PNEUMONIA: 1.0000  NORMAL: 1.0000 
Mask ratio's range: 1.0 ~ 1.0

[val]
LOSS - 0.6343
ACC - 0.7467
PPV - ALL: 0.7787  COVID-19: 0.8421  PNEUMONIA: 0.6567  NORMAL: 0.8372 
RECALL - ALL: 0.7567  COVID-19: 0.6400  PNEUMONIA: 0.8800  NORMAL: 0.7500 
F1 - ALL: 0.7569  COVID-19: 0.7273  PNEUMONIA: 0.7521  NORMAL: 0.7912 

Epoch 3/19
----------
[train]
LOSS - 0.0900
ACC - 0.9600
PPV - ALL: 1.0000  COVID-19: 1.0000  PNEUMONIA: 1.0000  NORMAL: 1.0000 
RECALL - ALL: 1.0000  COVID-19: 1.0000  PNEUMONIA: 1.0000  NORMAL: 1.0000 
F1 - ALL: 1.0000  COVID-19: 1.0000  PNEUMONIA: 1.0000  NORMAL: 1.0000 
Mask ratio's range: 0.9375 ~ 1.0

[val]
LOSS - 0.5557
ACC - 0.7667
PPV - ALL: 0.7846  COVID-19: 0.8293  PNEUMONIA: 0.7119  NORMAL: 0.8125 
RECALL - ALL: 0.7775  COVID-19: 0.6800  PNEUMONIA: 0.8400  NORMAL: 0.8125 
F1 - ALL: 0.7768  COVID-19: 0.7473  PNEUMONIA: 0.7707  NORMAL: 0.8125 

Epoch 4/19
----------
[train]
LOSS - 0.0452
ACC - 0.9600
PPV - ALL: 1.0000  COVID-19: 1.0000  PNEUMONIA: 1.0000  NORMAL: 1.0000 
RECALL - ALL: 1.0000  COVID-19: 1.0000  PNEUMONIA: 1.0000  NORMAL: 1.0000 
F1 - ALL: 1.0000  COVID-19: 1.0000  PNEUMONIA: 1.0000  NORMAL: 1.0000 
Mask ratio's range: 0.9375 ~ 1.0

[val]
LOSS - 0.5353
ACC - 0.7667
PPV - ALL: 0.7853  COVID-19: 0.8214  PNEUMONIA: 0.7083  NORMAL: 0.8261 
RECALL - ALL: 0.7772  COVID-19: 0.6900  PNEUMONIA: 0.8500  NORMAL: 0.7917 
F1 - ALL: 0.7771  COVID-19: 0.7500  PNEUMONIA: 0.7727  NORMAL: 0.8085 

Epoch 5/19
----------
[train]
LOSS - 0.0416
ACC - 0.9600
PPV - ALL: 1.0000  COVID-19: 1.0000  PNEUMONIA: 1.0000  NORMAL: 1.0000 
RECALL - ALL: 1.0000  COVID-19: 1.0000  PNEUMONIA: 1.0000  NORMAL: 1.0000 
F1 - ALL: 1.0000  COVID-19: 1.0000  PNEUMONIA: 1.0000  NORMAL: 1.0000 
Mask ratio's range: 0.875 ~ 1.0

[val]
LOSS - 0.5649
ACC - 0.7633
PPV - ALL: 0.7814  COVID-19: 0.8140  PNEUMONIA: 0.7059  NORMAL: 0.8242 
RECALL - ALL: 0.7737  COVID-19: 0.7000  PNEUMONIA: 0.8400  NORMAL: 0.7812 
F1 - ALL: 0.7740  COVID-19: 0.7527  PNEUMONIA: 0.7671  NORMAL: 0.8021 

Epoch 6/19
----------
[train]
LOSS - 0.0326
ACC - 0.9600
PPV - ALL: 1.0000  COVID-19: 1.0000  PNEUMONIA: 1.0000  NORMAL: 1.0000 
RECALL - ALL: 1.0000  COVID-19: 1.0000  PNEUMONIA: 1.0000  NORMAL: 1.0000 
F1 - ALL: 1.0000  COVID-19: 1.0000  PNEUMONIA: 1.0000  NORMAL: 1.0000 
Mask ratio's range: 0.875 ~ 1.0

[val]
LOSS - 0.5174
ACC - 0.7667
PPV - ALL: 0.7810  COVID-19: 0.7912  PNEUMONIA: 0.7257  NORMAL: 0.8261 
RECALL - ALL: 0.7772  COVID-19: 0.7200  PNEUMONIA: 0.8200  NORMAL: 0.7917 
F1 - ALL: 0.7775  COVID-19: 0.7539  PNEUMONIA: 0.7700  NORMAL: 0.8085 

Epoch 7/19
----------
[train]
LOSS - 0.0357
ACC - 0.9600
PPV - ALL: 1.0000  COVID-19: 1.0000  PNEUMONIA: 1.0000  NORMAL: 1.0000 
RECALL - ALL: 1.0000  COVID-19: 1.0000  PNEUMONIA: 1.0000  NORMAL: 1.0000 
F1 - ALL: 1.0000  COVID-19: 1.0000  PNEUMONIA: 1.0000  NORMAL: 1.0000 
Mask ratio's range: 0.875 ~ 1.0

[val]
LOSS - 0.5100
ACC - 0.7700
PPV - ALL: 0.7836  COVID-19: 0.8000  PNEUMONIA: 0.7297  NORMAL: 0.8211 
RECALL - ALL: 0.7808  COVID-19: 0.7200  PNEUMONIA: 0.8100  NORMAL: 0.8125 
F1 - ALL: 0.7808  COVID-19: 0.7579  PNEUMONIA: 0.7678  NORMAL: 0.8168 

Epoch 8/19
----------
[train]
LOSS - 0.0460
ACC - 0.9600
PPV - ALL: 1.0000  COVID-19: 1.0000  PNEUMONIA: 1.0000  NORMAL: 1.0000 
RECALL - ALL: 1.0000  COVID-19: 1.0000  PNEUMONIA: 1.0000  NORMAL: 1.0000 
F1 - ALL: 1.0000  COVID-19: 1.0000  PNEUMONIA: 1.0000  NORMAL: 1.0000 
Mask ratio's range: 0.75 ~ 0.9375

[val]
LOSS - 0.5416
ACC - 0.7633
PPV - ALL: 0.7763  COVID-19: 0.7955  PNEUMONIA: 0.7273  NORMAL: 0.8061 
RECALL - ALL: 0.7743  COVID-19: 0.7000  PNEUMONIA: 0.8000  NORMAL: 0.8229 
F1 - ALL: 0.7737  COVID-19: 0.7447  PNEUMONIA: 0.7619  NORMAL: 0.8144 

Epoch 9/19
----------
[train]
LOSS - 0.0535
ACC - 0.9600
PPV - ALL: 1.0000  COVID-19: 1.0000  PNEUMONIA: 1.0000  NORMAL: 1.0000 
RECALL - ALL: 1.0000  COVID-19: 1.0000  PNEUMONIA: 1.0000  NORMAL: 1.0000 
F1 - ALL: 1.0000  COVID-19: 1.0000  PNEUMONIA: 1.0000  NORMAL: 1.0000 
Mask ratio's range: 0.75 ~ 0.875

[val]
LOSS - 0.5296
ACC - 0.7700
PPV - ALL: 0.7835  COVID-19: 0.8148  PNEUMONIA: 0.7431  NORMAL: 0.7925 
RECALL - ALL: 0.7817  COVID-19: 0.6600  PNEUMONIA: 0.8100  NORMAL: 0.8750 
F1 - ALL: 0.7787  COVID-19: 0.7293  PNEUMONIA: 0.7751  NORMAL: 0.8317 

Epoch 10/19
----------
[train]
LOSS - 0.0383
ACC - 0.9600
PPV - ALL: 1.0000  COVID-19: 1.0000  PNEUMONIA: 1.0000  NORMAL: 1.0000 
RECALL - ALL: 1.0000  COVID-19: 1.0000  PNEUMONIA: 1.0000  NORMAL: 1.0000 
F1 - ALL: 1.0000  COVID-19: 1.0000  PNEUMONIA: 1.0000  NORMAL: 1.0000 
Mask ratio's range: 0.75 ~ 0.875

[val]
LOSS - 0.5533
ACC - 0.7633
PPV - ALL: 0.7827  COVID-19: 0.8493  PNEUMONIA: 0.7304  NORMAL: 0.7685 
RECALL - ALL: 0.7749  COVID-19: 0.6200  PNEUMONIA: 0.8400  NORMAL: 0.8646 
F1 - ALL: 0.7706  COVID-19: 0.7168  PNEUMONIA: 0.7814  NORMAL: 0.8137 

Epoch 11/19
----------
[train]
LOSS - 0.0563
ACC - 0.9600
PPV - ALL: 1.0000  COVID-19: 1.0000  PNEUMONIA: 1.0000  NORMAL: 1.0000 
RECALL - ALL: 1.0000  COVID-19: 1.0000  PNEUMONIA: 1.0000  NORMAL: 1.0000 
F1 - ALL: 1.0000  COVID-19: 1.0000  PNEUMONIA: 1.0000  NORMAL: 1.0000 
Mask ratio's range: 0.6875 ~ 0.875

[val]
LOSS - 0.5891
ACC - 0.7667
PPV - ALL: 0.7912  COVID-19: 0.8824  PNEUMONIA: 0.7411  NORMAL: 0.7500 
RECALL - ALL: 0.7787  COVID-19: 0.6000  PNEUMONIA: 0.8300  NORMAL: 0.9062 
F1 - ALL: 0.7727  COVID-19: 0.7143  PNEUMONIA: 0.7830  NORMAL: 0.8207 

Epoch 12/19
----------
[train]
LOSS - 0.0521
ACC - 0.9600
PPV - ALL: 1.0000  COVID-19: 1.0000  PNEUMONIA: 1.0000  NORMAL: 1.0000 
RECALL - ALL: 1.0000  COVID-19: 1.0000  PNEUMONIA: 1.0000  NORMAL: 1.0000 
F1 - ALL: 1.0000  COVID-19: 1.0000  PNEUMONIA: 1.0000  NORMAL: 1.0000 
Mask ratio's range: 0.625 ~ 0.8125

[val]
LOSS - 0.6012
ACC - 0.7633
PPV - ALL: 0.7840  COVID-19: 0.8611  PNEUMONIA: 0.7387  NORMAL: 0.7522 
RECALL - ALL: 0.7751  COVID-19: 0.6200  PNEUMONIA: 0.8200  NORMAL: 0.8854 
F1 - ALL: 0.7705  COVID-19: 0.7209  PNEUMONIA: 0.7772  NORMAL: 0.8134 

Epoch 13/19
----------
[train]
LOSS - 0.0423
ACC - 0.9600
PPV - ALL: 1.0000  COVID-19: 1.0000  PNEUMONIA: 1.0000  NORMAL: 1.0000 
RECALL - ALL: 1.0000  COVID-19: 1.0000  PNEUMONIA: 1.0000  NORMAL: 1.0000 
F1 - ALL: 1.0000  COVID-19: 1.0000  PNEUMONIA: 1.0000  NORMAL: 1.0000 
Mask ratio's range: 0.625 ~ 0.75

[val]
LOSS - 0.5711
ACC - 0.7667
PPV - ALL: 0.7891  COVID-19: 0.8714  PNEUMONIA: 0.7500  NORMAL: 0.7458 
RECALL - ALL: 0.7789  COVID-19: 0.6100  PNEUMONIA: 0.8100  NORMAL: 0.9167 
F1 - ALL: 0.7730  COVID-19: 0.7176  PNEUMONIA: 0.7788  NORMAL: 0.8225 

Epoch 14/19
----------
[train]
LOSS - 0.0415
ACC - 0.9600
PPV - ALL: 1.0000  COVID-19: 1.0000  PNEUMONIA: 1.0000  NORMAL: 1.0000 
RECALL - ALL: 1.0000  COVID-19: 1.0000  PNEUMONIA: 1.0000  NORMAL: 1.0000 
F1 - ALL: 1.0000  COVID-19: 1.0000  PNEUMONIA: 1.0000  NORMAL: 1.0000 
Mask ratio's range: 0.625 ~ 0.75

[val]
LOSS - 0.5859
ACC - 0.7633
PPV - ALL: 0.7883  COVID-19: 0.8824  PNEUMONIA: 0.7431  NORMAL: 0.7395 
RECALL - ALL: 0.7756  COVID-19: 0.6000  PNEUMONIA: 0.8100  NORMAL: 0.9167 
F1 - ALL: 0.7693  COVID-19: 0.7143  PNEUMONIA: 0.7751  NORMAL: 0.8186 

Epoch 15/19
----------
[train]
LOSS - 0.0317
ACC - 0.9600
PPV - ALL: 1.0000  COVID-19: 1.0000  PNEUMONIA: 1.0000  NORMAL: 1.0000 
RECALL - ALL: 1.0000  COVID-19: 1.0000  PNEUMONIA: 1.0000  NORMAL: 1.0000 
F1 - ALL: 1.0000  COVID-19: 1.0000  PNEUMONIA: 1.0000  NORMAL: 1.0000 
Mask ratio's range: 0.625 ~ 0.75

[val]
LOSS - 0.5753
ACC - 0.7600
PPV - ALL: 0.7860  COVID-19: 0.8806  PNEUMONIA: 0.7523  NORMAL: 0.7250 
RECALL - ALL: 0.7721  COVID-19: 0.5900  PNEUMONIA: 0.8200  NORMAL: 0.9062 
F1 - ALL: 0.7656  COVID-19: 0.7066  PNEUMONIA: 0.7847  NORMAL: 0.8055 

Epoch 16/19
----------
[train]
LOSS - 0.0271
ACC - 0.9600
PPV - ALL: 1.0000  COVID-19: 1.0000  PNEUMONIA: 1.0000  NORMAL: 1.0000 
RECALL - ALL: 1.0000  COVID-19: 1.0000  PNEUMONIA: 1.0000  NORMAL: 1.0000 
F1 - ALL: 1.0000  COVID-19: 1.0000  PNEUMONIA: 1.0000  NORMAL: 1.0000 
Mask ratio's range: 0.625 ~ 0.75

[val]
LOSS - 0.5737
ACC - 0.7700
PPV - ALL: 0.7937  COVID-19: 0.8857  PNEUMONIA: 0.7477  NORMAL: 0.7478 
RECALL - ALL: 0.7819  COVID-19: 0.6200  PNEUMONIA: 0.8300  NORMAL: 0.8958 
F1 - ALL: 0.7771  COVID-19: 0.7294  PNEUMONIA: 0.7867  NORMAL: 0.8151 

Epoch 17/19
----------
[train]
LOSS - 0.0375
ACC - 0.9600
PPV - ALL: 1.0000  COVID-19: 1.0000  PNEUMONIA: 1.0000  NORMAL: 1.0000 
RECALL - ALL: 1.0000  COVID-19: 1.0000  PNEUMONIA: 1.0000  NORMAL: 1.0000 
F1 - ALL: 1.0000  COVID-19: 1.0000  PNEUMONIA: 1.0000  NORMAL: 1.0000 
Mask ratio's range: 0.625 ~ 0.75

[val]
LOSS - 0.5451
ACC - 0.7700
PPV - ALL: 0.7938  COVID-19: 0.8857  PNEUMONIA: 0.7500  NORMAL: 0.7456 
RECALL - ALL: 0.7818  COVID-19: 0.6200  PNEUMONIA: 0.8400  NORMAL: 0.8854 
F1 - ALL: 0.7771  COVID-19: 0.7294  PNEUMONIA: 0.7925  NORMAL: 0.8095 

Epoch 18/19
----------
[train]
LOSS - 0.0352
ACC - 0.9600
PPV - ALL: 1.0000  COVID-19: 1.0000  PNEUMONIA: 1.0000  NORMAL: 1.0000 
RECALL - ALL: 1.0000  COVID-19: 1.0000  PNEUMONIA: 1.0000  NORMAL: 1.0000 
F1 - ALL: 1.0000  COVID-19: 1.0000  PNEUMONIA: 1.0000  NORMAL: 1.0000 
Mask ratio's range: 0.5625 ~ 0.75

[val]
LOSS - 0.5909
ACC - 0.7733
PPV - ALL: 0.7992  COVID-19: 0.8955  PNEUMONIA: 0.7544  NORMAL: 0.7478 
RECALL - ALL: 0.7853  COVID-19: 0.6000  PNEUMONIA: 0.8600  NORMAL: 0.8958 
F1 - ALL: 0.7791  COVID-19: 0.7186  PNEUMONIA: 0.8037  NORMAL: 0.8151 

Epoch 19/19
----------
[train]
LOSS - 0.0333
ACC - 0.9600
PPV - ALL: 1.0000  COVID-19: 1.0000  PNEUMONIA: 1.0000  NORMAL: 1.0000 
RECALL - ALL: 1.0000  COVID-19: 1.0000  PNEUMONIA: 1.0000  NORMAL: 1.0000 
F1 - ALL: 1.0000  COVID-19: 1.0000  PNEUMONIA: 1.0000  NORMAL: 1.0000 
Mask ratio's range: 0.5 ~ 0.75

[val]
LOSS - 0.5962
ACC - 0.7600
PPV - ALL: 0.7939  COVID-19: 0.9180  PNEUMONIA: 0.7373  NORMAL: 0.7265 
RECALL - ALL: 0.7718  COVID-19: 0.5600  PNEUMONIA: 0.8700  NORMAL: 0.8854 
F1 - ALL: 0.7640  COVID-19: 0.6956  PNEUMONIA: 0.7982  NORMAL: 0.7981 


--------------------
[Best results]
ACC - 0.7733
PPV - ALL: 0.7992  COVID-19: 0.8955  PNEUMONIA: 0.7544  NORMAL: 0.7478 
RECALL - ALL: 0.7853  COVID-19: 0.6000  PNEUMONIA: 0.8600  NORMAL: 0.8958 
F1 - ALL: 0.7791  COVID-19: 0.7186  PNEUMONIA: 0.8037  NORMAL: 0.8151 

Training complete in 1m 31s
-------------------- 

--------------------
Model 5
--------------------

Epoch 0/19
----------
[train]
LOSS - 1.0377
ACC - 0.3733
PPV - ALL: 0.3876  COVID-19: 0.3333  PNEUMONIA: 0.4545  NORMAL: 0.3750 
RECALL - ALL: 0.3889  COVID-19: 0.2500  PNEUMONIA: 0.4167  NORMAL: 0.5000 
F1 - ALL: 0.3830  COVID-19: 0.2857  PNEUMONIA: 0.4348  NORMAL: 0.4286 
Mask ratio's range: 1.0 ~ 1.0

[val]
LOSS - 1.0338
ACC - 0.4433
PPV - ALL: 0.5384  COVID-19: 0.6667  PNEUMONIA: 0.5278  NORMAL: 0.4208 
RECALL - ALL: 0.4563  COVID-19: 0.0200  PNEUMONIA: 0.3800  NORMAL: 0.9688 
F1 - ALL: 0.3558  COVID-19: 0.0388  PNEUMONIA: 0.4419  NORMAL: 0.5867 

Epoch 1/19
----------
[train]
LOSS - 0.6397
ACC - 0.9067
PPV - ALL: 0.9444  COVID-19: 0.9565  PNEUMONIA: 0.9167  NORMAL: 0.9600 
RECALL - ALL: 0.9445  COVID-19: 0.9167  PNEUMONIA: 0.9167  NORMAL: 1.0000 
F1 - ALL: 0.9442  COVID-19: 0.9362  PNEUMONIA: 0.9167  NORMAL: 0.9796 
Mask ratio's range: 1.0 ~ 1.0

[val]
LOSS - 0.8116
ACC - 0.7300
PPV - ALL: 0.7576  COVID-19: 0.8615  PNEUMONIA: 0.7217  NORMAL: 0.6897 
RECALL - ALL: 0.7411  COVID-19: 0.5600  PNEUMONIA: 0.8300  NORMAL: 0.8333 
F1 - ALL: 0.7352  COVID-19: 0.6788  PNEUMONIA: 0.7721  NORMAL: 0.7547 

Epoch 2/19
----------
[train]
LOSS - 0.2783
ACC - 0.9600
PPV - ALL: 1.0000  COVID-19: 1.0000  PNEUMONIA: 1.0000  NORMAL: 1.0000 
RECALL - ALL: 1.0000  COVID-19: 1.0000  PNEUMONIA: 1.0000  NORMAL: 1.0000 
F1 - ALL: 1.0000  COVID-19: 1.0000  PNEUMONIA: 1.0000  NORMAL: 1.0000 
Mask ratio's range: 1.0 ~ 1.0

[val]
LOSS - 0.6708
ACC - 0.7367
PPV - ALL: 0.7610  COVID-19: 0.8529  PNEUMONIA: 0.7232  NORMAL: 0.7069 
RECALL - ALL: 0.7481  COVID-19: 0.5800  PNEUMONIA: 0.8100  NORMAL: 0.8542 
F1 - ALL: 0.7427  COVID-19: 0.6905  PNEUMONIA: 0.7641  NORMAL: 0.7736 

Epoch 3/19
----------
[train]
LOSS - 0.1043
ACC - 0.9600
PPV - ALL: 1.0000  COVID-19: 1.0000  PNEUMONIA: 1.0000  NORMAL: 1.0000 
RECALL - ALL: 1.0000  COVID-19: 1.0000  PNEUMONIA: 1.0000  NORMAL: 1.0000 
F1 - ALL: 1.0000  COVID-19: 1.0000  PNEUMONIA: 1.0000  NORMAL: 1.0000 
Mask ratio's range: 0.9375 ~ 1.0

[val]
LOSS - 0.5883
ACC - 0.7600
PPV - ALL: 0.7775  COVID-19: 0.8462  PNEUMONIA: 0.7411  NORMAL: 0.7453 
RECALL - ALL: 0.7710  COVID-19: 0.6600  PNEUMONIA: 0.8300  NORMAL: 0.8229 
F1 - ALL: 0.7689  COVID-19: 0.7416  PNEUMONIA: 0.7830  NORMAL: 0.7822 

Epoch 4/19
----------
[train]
LOSS - 0.0435
ACC - 0.9600
PPV - ALL: 1.0000  COVID-19: 1.0000  PNEUMONIA: 1.0000  NORMAL: 1.0000 
RECALL - ALL: 1.0000  COVID-19: 1.0000  PNEUMONIA: 1.0000  NORMAL: 1.0000 
F1 - ALL: 1.0000  COVID-19: 1.0000  PNEUMONIA: 1.0000  NORMAL: 1.0000 
Mask ratio's range: 0.9375 ~ 1.0

[val]
LOSS - 0.5518
ACC - 0.7733
PPV - ALL: 0.7894  COVID-19: 0.8519  PNEUMONIA: 0.7615  NORMAL: 0.7547 
RECALL - ALL: 0.7844  COVID-19: 0.6900  PNEUMONIA: 0.8300  NORMAL: 0.8333 
F1 - ALL: 0.7830  COVID-19: 0.7625  PNEUMONIA: 0.7943  NORMAL: 0.7921 

Epoch 5/19
----------
[train]
LOSS - 0.0378
ACC - 0.9600
PPV - ALL: 1.0000  COVID-19: 1.0000  PNEUMONIA: 1.0000  NORMAL: 1.0000 
RECALL - ALL: 1.0000  COVID-19: 1.0000  PNEUMONIA: 1.0000  NORMAL: 1.0000 
F1 - ALL: 1.0000  COVID-19: 1.0000  PNEUMONIA: 1.0000  NORMAL: 1.0000 
Mask ratio's range: 0.875 ~ 1.0

[val]
LOSS - 0.5585
ACC - 0.7733
PPV - ALL: 0.7890  COVID-19: 0.8554  PNEUMONIA: 0.7664  NORMAL: 0.7453 
RECALL - ALL: 0.7843  COVID-19: 0.7100  PNEUMONIA: 0.8200  NORMAL: 0.8229 
F1 - ALL: 0.7835  COVID-19: 0.7759  PNEUMONIA: 0.7923  NORMAL: 0.7822 

Epoch 6/19
----------
[train]
LOSS - 0.0362
ACC - 0.9600
PPV - ALL: 1.0000  COVID-19: 1.0000  PNEUMONIA: 1.0000  NORMAL: 1.0000 
RECALL - ALL: 1.0000  COVID-19: 1.0000  PNEUMONIA: 1.0000  NORMAL: 1.0000 
F1 - ALL: 1.0000  COVID-19: 1.0000  PNEUMONIA: 1.0000  NORMAL: 1.0000 
Mask ratio's range: 0.875 ~ 1.0

[val]
LOSS - 0.5485
ACC - 0.7800
PPV - ALL: 0.7957  COVID-19: 0.8554  PNEUMONIA: 0.7885  NORMAL: 0.7431 
RECALL - ALL: 0.7913  COVID-19: 0.7100  PNEUMONIA: 0.8200  NORMAL: 0.8438 
F1 - ALL: 0.7900  COVID-19: 0.7759  PNEUMONIA: 0.8039  NORMAL: 0.7903 

Epoch 7/19
----------
[train]
LOSS - 0.0298
ACC - 0.9600
PPV - ALL: 1.0000  COVID-19: 1.0000  PNEUMONIA: 1.0000  NORMAL: 1.0000 
RECALL - ALL: 1.0000  COVID-19: 1.0000  PNEUMONIA: 1.0000  NORMAL: 1.0000 
F1 - ALL: 1.0000  COVID-19: 1.0000  PNEUMONIA: 1.0000  NORMAL: 1.0000 
Mask ratio's range: 0.8125 ~ 1.0

[val]
LOSS - 0.5216
ACC - 0.7767
PPV - ALL: 0.7910  COVID-19: 0.8353  PNEUMONIA: 0.7921  NORMAL: 0.7455 
RECALL - ALL: 0.7881  COVID-19: 0.7100  PNEUMONIA: 0.8000  NORMAL: 0.8542 
F1 - ALL: 0.7866  COVID-19: 0.7676  PNEUMONIA: 0.7960  NORMAL: 0.7962 

Epoch 8/19
----------
[train]
LOSS - 0.0259
ACC - 0.9600
PPV - ALL: 1.0000  COVID-19: 1.0000  PNEUMONIA: 1.0000  NORMAL: 1.0000 
RECALL - ALL: 1.0000  COVID-19: 1.0000  PNEUMONIA: 1.0000  NORMAL: 1.0000 
F1 - ALL: 1.0000  COVID-19: 1.0000  PNEUMONIA: 1.0000  NORMAL: 1.0000 
Mask ratio's range: 0.8125 ~ 1.0

[val]
LOSS - 0.5238
ACC - 0.7800
PPV - ALL: 0.7943  COVID-19: 0.8333  PNEUMONIA: 0.8020  NORMAL: 0.7477 
RECALL - ALL: 0.7915  COVID-19: 0.7000  PNEUMONIA: 0.8100  NORMAL: 0.8646 
F1 - ALL: 0.7896  COVID-19: 0.7609  PNEUMONIA: 0.8060  NORMAL: 0.8019 

Epoch 9/19
----------
[train]
LOSS - 0.0396
ACC - 0.9600
PPV - ALL: 1.0000  COVID-19: 1.0000  PNEUMONIA: 1.0000  NORMAL: 1.0000 
RECALL - ALL: 1.0000  COVID-19: 1.0000  PNEUMONIA: 1.0000  NORMAL: 1.0000 
F1 - ALL: 1.0000  COVID-19: 1.0000  PNEUMONIA: 1.0000  NORMAL: 1.0000 
Mask ratio's range: 0.8125 ~ 1.0

[val]
LOSS - 0.5392
ACC - 0.7800
PPV - ALL: 0.7949  COVID-19: 0.8333  PNEUMONIA: 0.8081  NORMAL: 0.7434 
RECALL - ALL: 0.7917  COVID-19: 0.7000  PNEUMONIA: 0.8000  NORMAL: 0.8750 
F1 - ALL: 0.7896  COVID-19: 0.7609  PNEUMONIA: 0.8040  NORMAL: 0.8038 

Epoch 10/19
----------
[train]
LOSS - 0.0221
ACC - 0.9600
PPV - ALL: 1.0000  COVID-19: 1.0000  PNEUMONIA: 1.0000  NORMAL: 1.0000 
RECALL - ALL: 1.0000  COVID-19: 1.0000  PNEUMONIA: 1.0000  NORMAL: 1.0000 
F1 - ALL: 1.0000  COVID-19: 1.0000  PNEUMONIA: 1.0000  NORMAL: 1.0000 
Mask ratio's range: 0.8125 ~ 1.0

[val]
LOSS - 0.5461
ACC - 0.7767
PPV - ALL: 0.7942  COVID-19: 0.8519  PNEUMONIA: 0.7980  NORMAL: 0.7328 
RECALL - ALL: 0.7885  COVID-19: 0.6900  PNEUMONIA: 0.7900  NORMAL: 0.8854 
F1 - ALL: 0.7861  COVID-19: 0.7625  PNEUMONIA: 0.7940  NORMAL: 0.8019 

Epoch 11/19
----------
[train]
LOSS - 0.0619
ACC - 0.9600
PPV - ALL: 1.0000  COVID-19: 1.0000  PNEUMONIA: 1.0000  NORMAL: 1.0000 
RECALL - ALL: 1.0000  COVID-19: 1.0000  PNEUMONIA: 1.0000  NORMAL: 1.0000 
F1 - ALL: 1.0000  COVID-19: 1.0000  PNEUMONIA: 1.0000  NORMAL: 1.0000 
Mask ratio's range: 0.75 ~ 0.875

[val]
LOSS - 0.5801
ACC - 0.7700
PPV - ALL: 0.7905  COVID-19: 0.8571  PNEUMONIA: 0.8000  NORMAL: 0.7143 
RECALL - ALL: 0.7818  COVID-19: 0.6600  PNEUMONIA: 0.8000  NORMAL: 0.8854 
F1 - ALL: 0.7788  COVID-19: 0.7457  PNEUMONIA: 0.8000  NORMAL: 0.7907 

Epoch 12/19
----------
[train]
LOSS - 0.0521
ACC - 0.9600
PPV - ALL: 1.0000  COVID-19: 1.0000  PNEUMONIA: 1.0000  NORMAL: 1.0000 
RECALL - ALL: 1.0000  COVID-19: 1.0000  PNEUMONIA: 1.0000  NORMAL: 1.0000 
F1 - ALL: 1.0000  COVID-19: 1.0000  PNEUMONIA: 1.0000  NORMAL: 1.0000 
Mask ratio's range: 0.75 ~ 0.875

[val]
LOSS - 0.5946
ACC - 0.7667
PPV - ALL: 0.7895  COVID-19: 0.8630  PNEUMONIA: 0.7900  NORMAL: 0.7154 
RECALL - ALL: 0.7789  COVID-19: 0.6300  PNEUMONIA: 0.7900  NORMAL: 0.9167 
F1 - ALL: 0.7740  COVID-19: 0.7283  PNEUMONIA: 0.7900  NORMAL: 0.8036 

Epoch 13/19
----------
[train]
LOSS - 0.0674
ACC - 0.9600
PPV - ALL: 1.0000  COVID-19: 1.0000  PNEUMONIA: 1.0000  NORMAL: 1.0000 
RECALL - ALL: 1.0000  COVID-19: 1.0000  PNEUMONIA: 1.0000  NORMAL: 1.0000 
F1 - ALL: 1.0000  COVID-19: 1.0000  PNEUMONIA: 1.0000  NORMAL: 1.0000 
Mask ratio's range: 0.6875 ~ 0.8125

[val]
LOSS - 0.6384
ACC - 0.7567
PPV - ALL: 0.7877  COVID-19: 0.8939  PNEUMONIA: 0.7788  NORMAL: 0.6905 
RECALL - ALL: 0.7687  COVID-19: 0.5900  PNEUMONIA: 0.8100  NORMAL: 0.9062 
F1 - ALL: 0.7629  COVID-19: 0.7108  PNEUMONIA: 0.7941  NORMAL: 0.7838 

Epoch 14/19
----------
[train]
LOSS - 0.0449
ACC - 0.9600
PPV - ALL: 1.0000  COVID-19: 1.0000  PNEUMONIA: 1.0000  NORMAL: 1.0000 
RECALL - ALL: 1.0000  COVID-19: 1.0000  PNEUMONIA: 1.0000  NORMAL: 1.0000 
F1 - ALL: 1.0000  COVID-19: 1.0000  PNEUMONIA: 1.0000  NORMAL: 1.0000 
Mask ratio's range: 0.625 ~ 0.8125

[val]
LOSS - 0.6921
ACC - 0.7500
PPV - ALL: 0.7871  COVID-19: 0.9194  PNEUMONIA: 0.7570  NORMAL: 0.6850 
RECALL - ALL: 0.7621  COVID-19: 0.5700  PNEUMONIA: 0.8100  NORMAL: 0.9062 
F1 - ALL: 0.7555  COVID-19: 0.7037  PNEUMONIA: 0.7826  NORMAL: 0.7802 

Epoch 15/19
----------
[train]
LOSS - 0.0433
ACC - 0.9600
PPV - ALL: 1.0000  COVID-19: 1.0000  PNEUMONIA: 1.0000  NORMAL: 1.0000 
RECALL - ALL: 1.0000  COVID-19: 1.0000  PNEUMONIA: 1.0000  NORMAL: 1.0000 
F1 - ALL: 1.0000  COVID-19: 1.0000  PNEUMONIA: 1.0000  NORMAL: 1.0000 
Mask ratio's range: 0.5 ~ 0.8125

[val]
LOSS - 0.6751
ACC - 0.7467
PPV - ALL: 0.7888  COVID-19: 0.9322  PNEUMONIA: 0.7547  NORMAL: 0.6794 
RECALL - ALL: 0.7590  COVID-19: 0.5500  PNEUMONIA: 0.8000  NORMAL: 0.9271 
F1 - ALL: 0.7509  COVID-19: 0.6918  PNEUMONIA: 0.7767  NORMAL: 0.7842 

Epoch 16/19
----------
[train]
LOSS - 0.0349
ACC - 0.9600
PPV - ALL: 1.0000  COVID-19: 1.0000  PNEUMONIA: 1.0000  NORMAL: 1.0000 
RECALL - ALL: 1.0000  COVID-19: 1.0000  PNEUMONIA: 1.0000  NORMAL: 1.0000 
F1 - ALL: 1.0000  COVID-19: 1.0000  PNEUMONIA: 1.0000  NORMAL: 1.0000 
Mask ratio's range: 0.5 ~ 0.8125

[val]
LOSS - 0.6946
ACC - 0.7467
PPV - ALL: 0.7903  COVID-19: 0.9322  PNEUMONIA: 0.7670  NORMAL: 0.6716 
RECALL - ALL: 0.7592  COVID-19: 0.5500  PNEUMONIA: 0.7900  NORMAL: 0.9375 
F1 - ALL: 0.7509  COVID-19: 0.6918  PNEUMONIA: 0.7783  NORMAL: 0.7826 

Epoch 17/19
----------
[train]
LOSS - 0.0389
ACC - 0.9600
PPV - ALL: 1.0000  COVID-19: 1.0000  PNEUMONIA: 1.0000  NORMAL: 1.0000 
RECALL - ALL: 1.0000  COVID-19: 1.0000  PNEUMONIA: 1.0000  NORMAL: 1.0000 
F1 - ALL: 1.0000  COVID-19: 1.0000  PNEUMONIA: 1.0000  NORMAL: 1.0000 
Mask ratio's range: 0.5 ~ 0.8125

[val]
LOSS - 0.6871
ACC - 0.7433
PPV - ALL: 0.7809  COVID-19: 0.9016  PNEUMONIA: 0.7692  NORMAL: 0.6718 
RECALL - ALL: 0.7556  COVID-19: 0.5500  PNEUMONIA: 0.8000  NORMAL: 0.9167 
F1 - ALL: 0.7476  COVID-19: 0.6832  PNEUMONIA: 0.7843  NORMAL: 0.7754 

Epoch 18/19
----------
[train]
LOSS - 0.0478
ACC - 0.9600
PPV - ALL: 1.0000  COVID-19: 1.0000  PNEUMONIA: 1.0000  NORMAL: 1.0000 
RECALL - ALL: 1.0000  COVID-19: 1.0000  PNEUMONIA: 1.0000  NORMAL: 1.0000 
F1 - ALL: 1.0000  COVID-19: 1.0000  PNEUMONIA: 1.0000  NORMAL: 1.0000 
Mask ratio's range: 0.4375 ~ 0.75

[val]
LOSS - 0.6834
ACC - 0.7533
PPV - ALL: 0.7918  COVID-19: 0.9194  PNEUMONIA: 0.7767  NORMAL: 0.6794 
RECALL - ALL: 0.7657  COVID-19: 0.5700  PNEUMONIA: 0.8000  NORMAL: 0.9271 
F1 - ALL: 0.7587  COVID-19: 0.7037  PNEUMONIA: 0.7882  NORMAL: 0.7842 

Epoch 19/19
----------
[train]
LOSS - 0.0372
ACC - 0.9600
PPV - ALL: 1.0000  COVID-19: 1.0000  PNEUMONIA: 1.0000  NORMAL: 1.0000 
RECALL - ALL: 1.0000  COVID-19: 1.0000  PNEUMONIA: 1.0000  NORMAL: 1.0000 
F1 - ALL: 1.0000  COVID-19: 1.0000  PNEUMONIA: 1.0000  NORMAL: 1.0000 
Mask ratio's range: 0.4375 ~ 0.75

[val]
LOSS - 0.7152
ACC - 0.7433
PPV - ALL: 0.7918  COVID-19: 0.9444  PNEUMONIA: 0.7570  NORMAL: 0.6741 
RECALL - ALL: 0.7560  COVID-19: 0.5100  PNEUMONIA: 0.8100  NORMAL: 0.9479 
F1 - ALL: 0.7443  COVID-19: 0.6623  PNEUMONIA: 0.7826  NORMAL: 0.7879 


--------------------
[Best results]
ACC - 0.7800
PPV - ALL: 0.7957  COVID-19: 0.8554  PNEUMONIA: 0.7885  NORMAL: 0.7431 
RECALL - ALL: 0.7913  COVID-19: 0.7100  PNEUMONIA: 0.8200  NORMAL: 0.8438 
F1 - ALL: 0.7900  COVID-19: 0.7759  PNEUMONIA: 0.8039  NORMAL: 0.7903 

Training complete in 1m 31s
-------------------- 

[Mean results]
ACC - 0.7960 (0.02)
PPV - ALL: 0.8122 (0.01)  COVID-19: 0.8669 (0.03)  PNEUMONIA: 0.7802 (0.02)  NORMAL: 0.7894 (0.04) 
RECALL - ALL: 0.8070 (0.02)  COVID-19: 0.7540 (0.09)  PNEUMONIA: 0.8420 (0.01)  NORMAL: 0.8250 (0.04) 
F1 - ALL: 0.8058 (0.02)  COVID-19: 0.8028 (0.05)  PNEUMONIA: 0.8096 (0.01)  NORMAL: 0.8048 (0.01) 

