--------------------
Model 1
--------------------

Epoch 0/19
----------
[train]
LOSS - 1.0096
ACC - 0.4267
PPV - ALL: 0.4461  COVID-19: 0.4800  PNEUMONIA: 0.4444  NORMAL: 0.4138 
RECALL - ALL: 0.4444  COVID-19: 0.5000  PNEUMONIA: 0.3333  NORMAL: 0.5000 
F1 - ALL: 0.4412  COVID-19: 0.4898  PNEUMONIA: 0.3809  NORMAL: 0.4528 
Mask ratio's range: 1.0 ~ 1.0

[val]
LOSS - 1.0142
ACC - 0.4533
PPV - ALL: 0.7486  COVID-19: 1.0000  PNEUMONIA: 0.8667  NORMAL: 0.3790 
RECALL - ALL: 0.4664  COVID-19: 0.0300  PNEUMONIA: 0.3900  NORMAL: 0.9792 
F1 - ALL: 0.3809  COVID-19: 0.0583  PNEUMONIA: 0.5379  NORMAL: 0.5465 

Epoch 1/19
----------
[train]
LOSS - 0.7087
ACC - 0.8400
PPV - ALL: 0.8805  COVID-19: 1.0000  PNEUMONIA: 0.8636  NORMAL: 0.7778 
RECALL - ALL: 0.8750  COVID-19: 0.9583  PNEUMONIA: 0.7917  NORMAL: 0.8750 
F1 - ALL: 0.8761  COVID-19: 0.9787  PNEUMONIA: 0.8261  NORMAL: 0.8235 
Mask ratio's range: 1.0 ~ 1.0

[val]
LOSS - 0.8010
ACC - 0.7800
PPV - ALL: 0.7956  COVID-19: 0.8681  PNEUMONIA: 0.7979  NORMAL: 0.7207 
RECALL - ALL: 0.7911  COVID-19: 0.7900  PNEUMONIA: 0.7500  NORMAL: 0.8333 
F1 - ALL: 0.7911  COVID-19: 0.8272  PNEUMONIA: 0.7732  NORMAL: 0.7729 

Epoch 2/19
----------
[train]
LOSS - 0.3301
ACC - 0.9600
PPV - ALL: 1.0000  COVID-19: 1.0000  PNEUMONIA: 1.0000  NORMAL: 1.0000 
RECALL - ALL: 1.0000  COVID-19: 1.0000  PNEUMONIA: 1.0000  NORMAL: 1.0000 
F1 - ALL: 1.0000  COVID-19: 1.0000  PNEUMONIA: 1.0000  NORMAL: 1.0000 
Mask ratio's range: 1.0 ~ 1.0

[val]
LOSS - 0.6457
ACC - 0.7933
PPV - ALL: 0.8158  COVID-19: 0.9221  PNEUMONIA: 0.7685  NORMAL: 0.7568 
RECALL - ALL: 0.8050  COVID-19: 0.7100  PNEUMONIA: 0.8300  NORMAL: 0.8750 
F1 - ALL: 0.8040  COVID-19: 0.8023  PNEUMONIA: 0.7981  NORMAL: 0.8116 

Epoch 3/19
----------
[train]
LOSS - 0.1273
ACC - 0.9600
PPV - ALL: 1.0000  COVID-19: 1.0000  PNEUMONIA: 1.0000  NORMAL: 1.0000 
RECALL - ALL: 1.0000  COVID-19: 1.0000  PNEUMONIA: 1.0000  NORMAL: 1.0000 
F1 - ALL: 1.0000  COVID-19: 1.0000  PNEUMONIA: 1.0000  NORMAL: 1.0000 
Mask ratio's range: 1.0 ~ 1.0

[val]
LOSS - 0.5714
ACC - 0.7867
PPV - ALL: 0.7977  COVID-19: 0.8163  PNEUMONIA: 0.7788  NORMAL: 0.7979 
RECALL - ALL: 0.7971  COVID-19: 0.8000  PNEUMONIA: 0.8100  NORMAL: 0.7812 
F1 - ALL: 0.7972  COVID-19: 0.8081  PNEUMONIA: 0.7941  NORMAL: 0.7895 

Epoch 4/19
----------
[train]
LOSS - 0.0561
ACC - 0.9600
PPV - ALL: 1.0000  COVID-19: 1.0000  PNEUMONIA: 1.0000  NORMAL: 1.0000 
RECALL - ALL: 1.0000  COVID-19: 1.0000  PNEUMONIA: 1.0000  NORMAL: 1.0000 
F1 - ALL: 1.0000  COVID-19: 1.0000  PNEUMONIA: 1.0000  NORMAL: 1.0000 
Mask ratio's range: 0.9375 ~ 1.0

[val]
LOSS - 0.5140
ACC - 0.8133
PPV - ALL: 0.8251  COVID-19: 0.8737  PNEUMONIA: 0.8058  NORMAL: 0.7959 
RECALL - ALL: 0.8242  COVID-19: 0.8300  PNEUMONIA: 0.8300  NORMAL: 0.8125 
F1 - ALL: 0.8244  COVID-19: 0.8513  PNEUMONIA: 0.8177  NORMAL: 0.8041 

Epoch 5/19
----------
[train]
LOSS - 0.0280
ACC - 0.9600
PPV - ALL: 1.0000  COVID-19: 1.0000  PNEUMONIA: 1.0000  NORMAL: 1.0000 
RECALL - ALL: 1.0000  COVID-19: 1.0000  PNEUMONIA: 1.0000  NORMAL: 1.0000 
F1 - ALL: 1.0000  COVID-19: 1.0000  PNEUMONIA: 1.0000  NORMAL: 1.0000 
Mask ratio's range: 0.9375 ~ 1.0

[val]
LOSS - 0.4980
ACC - 0.8100
PPV - ALL: 0.8214  COVID-19: 0.8660  PNEUMONIA: 0.7981  NORMAL: 0.8000 
RECALL - ALL: 0.8206  COVID-19: 0.8400  PNEUMONIA: 0.8300  NORMAL: 0.7917 
F1 - ALL: 0.8208  COVID-19: 0.8528  PNEUMONIA: 0.8137  NORMAL: 0.7958 

Epoch 6/19
----------
[train]
LOSS - 0.0190
ACC - 0.9600
PPV - ALL: 1.0000  COVID-19: 1.0000  PNEUMONIA: 1.0000  NORMAL: 1.0000 
RECALL - ALL: 1.0000  COVID-19: 1.0000  PNEUMONIA: 1.0000  NORMAL: 1.0000 
F1 - ALL: 1.0000  COVID-19: 1.0000  PNEUMONIA: 1.0000  NORMAL: 1.0000 
Mask ratio's range: 0.9375 ~ 1.0

[val]
LOSS - 0.4858
ACC - 0.8100
PPV - ALL: 0.8206  COVID-19: 0.8416  PNEUMONIA: 0.8182  NORMAL: 0.8021 
RECALL - ALL: 0.8207  COVID-19: 0.8500  PNEUMONIA: 0.8100  NORMAL: 0.8021 
F1 - ALL: 0.8207  COVID-19: 0.8458  PNEUMONIA: 0.8141  NORMAL: 0.8021 

Epoch 7/19
----------
[train]
LOSS - 0.0166
ACC - 0.9600
PPV - ALL: 1.0000  COVID-19: 1.0000  PNEUMONIA: 1.0000  NORMAL: 1.0000 
RECALL - ALL: 1.0000  COVID-19: 1.0000  PNEUMONIA: 1.0000  NORMAL: 1.0000 
F1 - ALL: 1.0000  COVID-19: 1.0000  PNEUMONIA: 1.0000  NORMAL: 1.0000 
Mask ratio's range: 0.9375 ~ 1.0

[val]
LOSS - 0.4813
ACC - 0.8033
PPV - ALL: 0.8142  COVID-19: 0.8469  PNEUMONIA: 0.8020  NORMAL: 0.7938 
RECALL - ALL: 0.8140  COVID-19: 0.8300  PNEUMONIA: 0.8100  NORMAL: 0.8021 
F1 - ALL: 0.8141  COVID-19: 0.8384  PNEUMONIA: 0.8060  NORMAL: 0.7979 

Epoch 8/19
----------
[train]
LOSS - 0.0150
ACC - 0.9600
PPV - ALL: 1.0000  COVID-19: 1.0000  PNEUMONIA: 1.0000  NORMAL: 1.0000 
RECALL - ALL: 1.0000  COVID-19: 1.0000  PNEUMONIA: 1.0000  NORMAL: 1.0000 
F1 - ALL: 1.0000  COVID-19: 1.0000  PNEUMONIA: 1.0000  NORMAL: 1.0000 
Mask ratio's range: 0.9375 ~ 1.0

[val]
LOSS - 0.4722
ACC - 0.8167
PPV - ALL: 0.8280  COVID-19: 0.8660  PNEUMONIA: 0.8200  NORMAL: 0.7980 
RECALL - ALL: 0.8276  COVID-19: 0.8400  PNEUMONIA: 0.8200  NORMAL: 0.8229 
F1 - ALL: 0.8277  COVID-19: 0.8528  PNEUMONIA: 0.8200  NORMAL: 0.8103 

Epoch 9/19
----------
[train]
LOSS - 0.0096
ACC - 0.9600
PPV - ALL: 1.0000  COVID-19: 1.0000  PNEUMONIA: 1.0000  NORMAL: 1.0000 
RECALL - ALL: 1.0000  COVID-19: 1.0000  PNEUMONIA: 1.0000  NORMAL: 1.0000 
F1 - ALL: 1.0000  COVID-19: 1.0000  PNEUMONIA: 1.0000  NORMAL: 1.0000 
Mask ratio's range: 0.9375 ~ 1.0

[val]
LOSS - 0.4731
ACC - 0.8033
PPV - ALL: 0.8142  COVID-19: 0.8485  PNEUMONIA: 0.7941  NORMAL: 0.8000 
RECALL - ALL: 0.8139  COVID-19: 0.8400  PNEUMONIA: 0.8100  NORMAL: 0.7917 
F1 - ALL: 0.8140  COVID-19: 0.8442  PNEUMONIA: 0.8020  NORMAL: 0.7958 

Epoch 10/19
----------
[train]
LOSS - 0.0108
ACC - 0.9600
PPV - ALL: 1.0000  COVID-19: 1.0000  PNEUMONIA: 1.0000  NORMAL: 1.0000 
RECALL - ALL: 1.0000  COVID-19: 1.0000  PNEUMONIA: 1.0000  NORMAL: 1.0000 
F1 - ALL: 1.0000  COVID-19: 1.0000  PNEUMONIA: 1.0000  NORMAL: 1.0000 
Mask ratio's range: 0.9375 ~ 1.0

[val]
LOSS - 0.4772
ACC - 0.8133
PPV - ALL: 0.8247  COVID-19: 0.8646  PNEUMONIA: 0.8137  NORMAL: 0.7959 
RECALL - ALL: 0.8242  COVID-19: 0.8300  PNEUMONIA: 0.8300  NORMAL: 0.8125 
F1 - ALL: 0.8243  COVID-19: 0.8469  PNEUMONIA: 0.8218  NORMAL: 0.8041 

Epoch 11/19
----------
[train]
LOSS - 0.0108
ACC - 0.9600
PPV - ALL: 1.0000  COVID-19: 1.0000  PNEUMONIA: 1.0000  NORMAL: 1.0000 
RECALL - ALL: 1.0000  COVID-19: 1.0000  PNEUMONIA: 1.0000  NORMAL: 1.0000 
F1 - ALL: 1.0000  COVID-19: 1.0000  PNEUMONIA: 1.0000  NORMAL: 1.0000 
Mask ratio's range: 0.9375 ~ 1.0

[val]
LOSS - 0.4851
ACC - 0.8100
PPV - ALL: 0.8209  COVID-19: 0.8485  PNEUMONIA: 0.8182  NORMAL: 0.7959 
RECALL - ALL: 0.8208  COVID-19: 0.8400  PNEUMONIA: 0.8100  NORMAL: 0.8125 
F1 - ALL: 0.8208  COVID-19: 0.8442  PNEUMONIA: 0.8141  NORMAL: 0.8041 

Epoch 12/19
----------
[train]
LOSS - 0.0102
ACC - 0.9600
PPV - ALL: 1.0000  COVID-19: 1.0000  PNEUMONIA: 1.0000  NORMAL: 1.0000 
RECALL - ALL: 1.0000  COVID-19: 1.0000  PNEUMONIA: 1.0000  NORMAL: 1.0000 
F1 - ALL: 1.0000  COVID-19: 1.0000  PNEUMONIA: 1.0000  NORMAL: 1.0000 
Mask ratio's range: 0.9375 ~ 1.0

[val]
LOSS - 0.4807
ACC - 0.8067
PPV - ALL: 0.8175  COVID-19: 0.8485  PNEUMONIA: 0.8020  NORMAL: 0.8021 
RECALL - ALL: 0.8174  COVID-19: 0.8400  PNEUMONIA: 0.8100  NORMAL: 0.8021 
F1 - ALL: 0.8174  COVID-19: 0.8442  PNEUMONIA: 0.8060  NORMAL: 0.8021 

Epoch 13/19
----------
[train]
LOSS - 0.0125
ACC - 0.9600
PPV - ALL: 1.0000  COVID-19: 1.0000  PNEUMONIA: 1.0000  NORMAL: 1.0000 
RECALL - ALL: 1.0000  COVID-19: 1.0000  PNEUMONIA: 1.0000  NORMAL: 1.0000 
F1 - ALL: 1.0000  COVID-19: 1.0000  PNEUMONIA: 1.0000  NORMAL: 1.0000 
Mask ratio's range: 0.9375 ~ 1.0

[val]
LOSS - 0.4997
ACC - 0.8167
PPV - ALL: 0.8280  COVID-19: 0.8660  PNEUMONIA: 0.8200  NORMAL: 0.7980 
RECALL - ALL: 0.8276  COVID-19: 0.8400  PNEUMONIA: 0.8200  NORMAL: 0.8229 
F1 - ALL: 0.8277  COVID-19: 0.8528  PNEUMONIA: 0.8200  NORMAL: 0.8103 

Epoch 14/19
----------
[train]
LOSS - 0.0062
ACC - 0.9600
PPV - ALL: 1.0000  COVID-19: 1.0000  PNEUMONIA: 1.0000  NORMAL: 1.0000 
RECALL - ALL: 1.0000  COVID-19: 1.0000  PNEUMONIA: 1.0000  NORMAL: 1.0000 
F1 - ALL: 1.0000  COVID-19: 1.0000  PNEUMONIA: 1.0000  NORMAL: 1.0000 
Mask ratio's range: 0.9375 ~ 1.0

[val]
LOSS - 0.4652
ACC - 0.8167
PPV - ALL: 0.8285  COVID-19: 0.8737  PNEUMONIA: 0.8137  NORMAL: 0.7980 
RECALL - ALL: 0.8276  COVID-19: 0.8300  PNEUMONIA: 0.8300  NORMAL: 0.8229 
F1 - ALL: 0.8278  COVID-19: 0.8513  PNEUMONIA: 0.8218  NORMAL: 0.8103 

Epoch 15/19
----------
[train]
LOSS - 0.0102
ACC - 0.9600
PPV - ALL: 1.0000  COVID-19: 1.0000  PNEUMONIA: 1.0000  NORMAL: 1.0000 
RECALL - ALL: 1.0000  COVID-19: 1.0000  PNEUMONIA: 1.0000  NORMAL: 1.0000 
F1 - ALL: 1.0000  COVID-19: 1.0000  PNEUMONIA: 1.0000  NORMAL: 1.0000 
Mask ratio's range: 0.875 ~ 1.0

[val]
LOSS - 0.4626
ACC - 0.8167
PPV - ALL: 0.8294  COVID-19: 0.8817  PNEUMONIA: 0.8200  NORMAL: 0.7864 
RECALL - ALL: 0.8279  COVID-19: 0.8200  PNEUMONIA: 0.8200  NORMAL: 0.8438 
F1 - ALL: 0.8279  COVID-19: 0.8497  PNEUMONIA: 0.8200  NORMAL: 0.8141 

Epoch 16/19
----------
[train]
LOSS - 0.0117
ACC - 0.9600
PPV - ALL: 1.0000  COVID-19: 1.0000  PNEUMONIA: 1.0000  NORMAL: 1.0000 
RECALL - ALL: 1.0000  COVID-19: 1.0000  PNEUMONIA: 1.0000  NORMAL: 1.0000 
F1 - ALL: 1.0000  COVID-19: 1.0000  PNEUMONIA: 1.0000  NORMAL: 1.0000 
Mask ratio's range: 0.875 ~ 1.0

[val]
LOSS - 0.4613
ACC - 0.8200
PPV - ALL: 0.8332  COVID-19: 0.8913  PNEUMONIA: 0.8218  NORMAL: 0.7864 
RECALL - ALL: 0.8313  COVID-19: 0.8200  PNEUMONIA: 0.8300  NORMAL: 0.8438 
F1 - ALL: 0.8314  COVID-19: 0.8542  PNEUMONIA: 0.8259  NORMAL: 0.8141 

Epoch 17/19
----------
[train]
LOSS - 0.0279
ACC - 0.9600
PPV - ALL: 1.0000  COVID-19: 1.0000  PNEUMONIA: 1.0000  NORMAL: 1.0000 
RECALL - ALL: 1.0000  COVID-19: 1.0000  PNEUMONIA: 1.0000  NORMAL: 1.0000 
F1 - ALL: 1.0000  COVID-19: 1.0000  PNEUMONIA: 1.0000  NORMAL: 1.0000 
Mask ratio's range: 0.875 ~ 1.0

[val]
LOSS - 0.4900
ACC - 0.8167
PPV - ALL: 0.8302  COVID-19: 0.8901  PNEUMONIA: 0.8218  NORMAL: 0.7788 
RECALL - ALL: 0.8279  COVID-19: 0.8100  PNEUMONIA: 0.8300  NORMAL: 0.8438 
F1 - ALL: 0.8280  COVID-19: 0.8482  PNEUMONIA: 0.8259  NORMAL: 0.8100 

Epoch 18/19
----------
[train]
LOSS - 0.0077
ACC - 0.9600
PPV - ALL: 1.0000  COVID-19: 1.0000  PNEUMONIA: 1.0000  NORMAL: 1.0000 
RECALL - ALL: 1.0000  COVID-19: 1.0000  PNEUMONIA: 1.0000  NORMAL: 1.0000 
F1 - ALL: 1.0000  COVID-19: 1.0000  PNEUMONIA: 1.0000  NORMAL: 1.0000 
Mask ratio's range: 0.875 ~ 1.0

[val]
LOSS - 0.4718
ACC - 0.8167
PPV - ALL: 0.8325  COVID-19: 0.9080  PNEUMONIA: 0.8137  NORMAL: 0.7757 
RECALL - ALL: 0.8282  COVID-19: 0.7900  PNEUMONIA: 0.8300  NORMAL: 0.8646 
F1 - ALL: 0.8281  COVID-19: 0.8449  PNEUMONIA: 0.8218  NORMAL: 0.8177 

Epoch 19/19
----------
[train]
LOSS - 0.0459
ACC - 0.9600
PPV - ALL: 1.0000  COVID-19: 1.0000  PNEUMONIA: 1.0000  NORMAL: 1.0000 
RECALL - ALL: 1.0000  COVID-19: 1.0000  PNEUMONIA: 1.0000  NORMAL: 1.0000 
F1 - ALL: 1.0000  COVID-19: 1.0000  PNEUMONIA: 1.0000  NORMAL: 1.0000 
Mask ratio's range: 0.875 ~ 1.0

[val]
LOSS - 0.4850
ACC - 0.8167
PPV - ALL: 0.8318  COVID-19: 0.8977  PNEUMONIA: 0.8200  NORMAL: 0.7778 
RECALL - ALL: 0.8283  COVID-19: 0.7900  PNEUMONIA: 0.8200  NORMAL: 0.8750 
F1 - ALL: 0.8280  COVID-19: 0.8404  PNEUMONIA: 0.8200  NORMAL: 0.8235 


--------------------
[Best results]
ACC - 0.8200
PPV - ALL: 0.8332  COVID-19: 0.8913  PNEUMONIA: 0.8218  NORMAL: 0.7864 
RECALL - ALL: 0.8313  COVID-19: 0.8200  PNEUMONIA: 0.8300  NORMAL: 0.8438 
F1 - ALL: 0.8314  COVID-19: 0.8542  PNEUMONIA: 0.8259  NORMAL: 0.8141 

Training complete in 1m 30s
-------------------- 

--------------------
Model 2
--------------------

Epoch 0/19
----------
[train]
LOSS - 1.0009
ACC - 0.4933
PPV - ALL: 0.5258  COVID-19: 0.4074  PNEUMONIA: 0.6316  NORMAL: 0.5385 
RECALL - ALL: 0.5139  COVID-19: 0.4583  PNEUMONIA: 0.5000  NORMAL: 0.5833 
F1 - ALL: 0.5165  COVID-19: 0.4314  PNEUMONIA: 0.5581  NORMAL: 0.5600 
Mask ratio's range: 1.0 ~ 1.0

[val]
LOSS - 0.9602
ACC - 0.5867
PPV - ALL: 0.7252  COVID-19: 1.0000  PNEUMONIA: 0.5090  NORMAL: 0.6667 
RECALL - ALL: 0.5972  COVID-19: 0.1500  PNEUMONIA: 0.8500  NORMAL: 0.7917 
F1 - ALL: 0.5405  COVID-19: 0.2609  PNEUMONIA: 0.6367  NORMAL: 0.7238 

Epoch 1/19
----------
[train]
LOSS - 0.6710
ACC - 0.8800
PPV - ALL: 0.9193  COVID-19: 0.9524  PNEUMONIA: 0.9167  NORMAL: 0.8889 
RECALL - ALL: 0.9167  COVID-19: 0.8333  PNEUMONIA: 0.9167  NORMAL: 1.0000 
F1 - ALL: 0.9156  COVID-19: 0.8889  PNEUMONIA: 0.9167  NORMAL: 0.9412 
Mask ratio's range: 1.0 ~ 1.0

[val]
LOSS - 0.7636
ACC - 0.7733
PPV - ALL: 0.7907  COVID-19: 0.8000  PNEUMONIA: 0.7168  NORMAL: 0.8554 
RECALL - ALL: 0.7832  COVID-19: 0.8000  PNEUMONIA: 0.8100  NORMAL: 0.7396 
F1 - ALL: 0.7846  COVID-19: 0.8000  PNEUMONIA: 0.7606  NORMAL: 0.7933 

Epoch 2/19
----------
[train]
LOSS - 0.3237
ACC - 0.9600
PPV - ALL: 1.0000  COVID-19: 1.0000  PNEUMONIA: 1.0000  NORMAL: 1.0000 
RECALL - ALL: 1.0000  COVID-19: 1.0000  PNEUMONIA: 1.0000  NORMAL: 1.0000 
F1 - ALL: 1.0000  COVID-19: 1.0000  PNEUMONIA: 1.0000  NORMAL: 1.0000 
Mask ratio's range: 1.0 ~ 1.0

[val]
LOSS - 0.6256
ACC - 0.7800
PPV - ALL: 0.8048  COVID-19: 0.8734  PNEUMONIA: 0.7040  NORMAL: 0.8370 
RECALL - ALL: 0.7907  COVID-19: 0.6900  PNEUMONIA: 0.8800  NORMAL: 0.8021 
F1 - ALL: 0.7908  COVID-19: 0.7709  PNEUMONIA: 0.7822  NORMAL: 0.8192 

Epoch 3/19
----------
[train]
LOSS - 0.1188
ACC - 0.9600
PPV - ALL: 1.0000  COVID-19: 1.0000  PNEUMONIA: 1.0000  NORMAL: 1.0000 
RECALL - ALL: 1.0000  COVID-19: 1.0000  PNEUMONIA: 1.0000  NORMAL: 1.0000 
F1 - ALL: 1.0000  COVID-19: 1.0000  PNEUMONIA: 1.0000  NORMAL: 1.0000 
Mask ratio's range: 1.0 ~ 1.0

[val]
LOSS - 0.5434
ACC - 0.8000
PPV - ALL: 0.8130  COVID-19: 0.8200  PNEUMONIA: 0.7798  NORMAL: 0.8391 
RECALL - ALL: 0.8101  COVID-19: 0.8200  PNEUMONIA: 0.8500  NORMAL: 0.7604 
F1 - ALL: 0.8104  COVID-19: 0.8200  PNEUMONIA: 0.8134  NORMAL: 0.7978 

Epoch 4/19
----------
[train]
LOSS - 0.0474
ACC - 0.9600
PPV - ALL: 1.0000  COVID-19: 1.0000  PNEUMONIA: 1.0000  NORMAL: 1.0000 
RECALL - ALL: 1.0000  COVID-19: 1.0000  PNEUMONIA: 1.0000  NORMAL: 1.0000 
F1 - ALL: 1.0000  COVID-19: 1.0000  PNEUMONIA: 1.0000  NORMAL: 1.0000 
Mask ratio's range: 1.0 ~ 1.0

[val]
LOSS - 0.5115
ACC - 0.7933
PPV - ALL: 0.8061  COVID-19: 0.8200  PNEUMONIA: 0.7706  NORMAL: 0.8276 
RECALL - ALL: 0.8033  COVID-19: 0.8200  PNEUMONIA: 0.8400  NORMAL: 0.7500 
F1 - ALL: 0.8036  COVID-19: 0.8200  PNEUMONIA: 0.8038  NORMAL: 0.7869 

Epoch 5/19
----------
[train]
LOSS - 0.0253
ACC - 0.9600
PPV - ALL: 1.0000  COVID-19: 1.0000  PNEUMONIA: 1.0000  NORMAL: 1.0000 
RECALL - ALL: 1.0000  COVID-19: 1.0000  PNEUMONIA: 1.0000  NORMAL: 1.0000 
F1 - ALL: 1.0000  COVID-19: 1.0000  PNEUMONIA: 1.0000  NORMAL: 1.0000 
Mask ratio's range: 1.0 ~ 1.0

[val]
LOSS - 0.4968
ACC - 0.7967
PPV - ALL: 0.8105  COVID-19: 0.8265  PNEUMONIA: 0.7658  NORMAL: 0.8391 
RECALL - ALL: 0.8068  COVID-19: 0.8100  PNEUMONIA: 0.8500  NORMAL: 0.7604 
F1 - ALL: 0.8072  COVID-19: 0.8182  PNEUMONIA: 0.8057  NORMAL: 0.7978 

Epoch 6/19
----------
[train]
LOSS - 0.0169
ACC - 0.9600
PPV - ALL: 1.0000  COVID-19: 1.0000  PNEUMONIA: 1.0000  NORMAL: 1.0000 
RECALL - ALL: 1.0000  COVID-19: 1.0000  PNEUMONIA: 1.0000  NORMAL: 1.0000 
F1 - ALL: 1.0000  COVID-19: 1.0000  PNEUMONIA: 1.0000  NORMAL: 1.0000 
Mask ratio's range: 0.9375 ~ 1.0

[val]
LOSS - 0.4944
ACC - 0.8000
PPV - ALL: 0.8134  COVID-19: 0.8283  PNEUMONIA: 0.7727  NORMAL: 0.8391 
RECALL - ALL: 0.8101  COVID-19: 0.8200  PNEUMONIA: 0.8500  NORMAL: 0.7604 
F1 - ALL: 0.8105  COVID-19: 0.8241  PNEUMONIA: 0.8095  NORMAL: 0.7978 

Epoch 7/19
----------
[train]
LOSS - 0.0162
ACC - 0.9600
PPV - ALL: 1.0000  COVID-19: 1.0000  PNEUMONIA: 1.0000  NORMAL: 1.0000 
RECALL - ALL: 1.0000  COVID-19: 1.0000  PNEUMONIA: 1.0000  NORMAL: 1.0000 
F1 - ALL: 1.0000  COVID-19: 1.0000  PNEUMONIA: 1.0000  NORMAL: 1.0000 
Mask ratio's range: 0.875 ~ 1.0

[val]
LOSS - 0.5068
ACC - 0.8100
PPV - ALL: 0.8236  COVID-19: 0.8384  PNEUMONIA: 0.7818  NORMAL: 0.8506 
RECALL - ALL: 0.8203  COVID-19: 0.8300  PNEUMONIA: 0.8600  NORMAL: 0.7708 
F1 - ALL: 0.8206  COVID-19: 0.8342  PNEUMONIA: 0.8190  NORMAL: 0.8087 

Epoch 8/19
----------
[train]
LOSS - 0.0114
ACC - 0.9600
PPV - ALL: 1.0000  COVID-19: 1.0000  PNEUMONIA: 1.0000  NORMAL: 1.0000 
RECALL - ALL: 1.0000  COVID-19: 1.0000  PNEUMONIA: 1.0000  NORMAL: 1.0000 
F1 - ALL: 1.0000  COVID-19: 1.0000  PNEUMONIA: 1.0000  NORMAL: 1.0000 
Mask ratio's range: 0.875 ~ 1.0

[val]
LOSS - 0.4923
ACC - 0.8067
PPV - ALL: 0.8207  COVID-19: 0.8367  PNEUMONIA: 0.7748  NORMAL: 0.8506 
RECALL - ALL: 0.8169  COVID-19: 0.8200  PNEUMONIA: 0.8600  NORMAL: 0.7708 
F1 - ALL: 0.8174  COVID-19: 0.8283  PNEUMONIA: 0.8152  NORMAL: 0.8087 

Epoch 9/19
----------
[train]
LOSS - 0.0119
ACC - 0.9600
PPV - ALL: 1.0000  COVID-19: 1.0000  PNEUMONIA: 1.0000  NORMAL: 1.0000 
RECALL - ALL: 1.0000  COVID-19: 1.0000  PNEUMONIA: 1.0000  NORMAL: 1.0000 
F1 - ALL: 1.0000  COVID-19: 1.0000  PNEUMONIA: 1.0000  NORMAL: 1.0000 
Mask ratio's range: 0.875 ~ 1.0

[val]
LOSS - 0.4940
ACC - 0.8033
PPV - ALL: 0.8179  COVID-19: 0.8351  PNEUMONIA: 0.7679  NORMAL: 0.8506 
RECALL - ALL: 0.8136  COVID-19: 0.8100  PNEUMONIA: 0.8600  NORMAL: 0.7708 
F1 - ALL: 0.8141  COVID-19: 0.8224  PNEUMONIA: 0.8113  NORMAL: 0.8087 

Epoch 10/19
----------
[train]
LOSS - 0.0127
ACC - 0.9600
PPV - ALL: 1.0000  COVID-19: 1.0000  PNEUMONIA: 1.0000  NORMAL: 1.0000 
RECALL - ALL: 1.0000  COVID-19: 1.0000  PNEUMONIA: 1.0000  NORMAL: 1.0000 
F1 - ALL: 1.0000  COVID-19: 1.0000  PNEUMONIA: 1.0000  NORMAL: 1.0000 
Mask ratio's range: 0.875 ~ 1.0

[val]
LOSS - 0.5000
ACC - 0.8067
PPV - ALL: 0.8214  COVID-19: 0.8438  PNEUMONIA: 0.7699  NORMAL: 0.8506 
RECALL - ALL: 0.8169  COVID-19: 0.8100  PNEUMONIA: 0.8700  NORMAL: 0.7708 
F1 - ALL: 0.8174  COVID-19: 0.8266  PNEUMONIA: 0.8169  NORMAL: 0.8087 

Epoch 11/19
----------
[train]
LOSS - 0.0113
ACC - 0.9600
PPV - ALL: 1.0000  COVID-19: 1.0000  PNEUMONIA: 1.0000  NORMAL: 1.0000 
RECALL - ALL: 1.0000  COVID-19: 1.0000  PNEUMONIA: 1.0000  NORMAL: 1.0000 
F1 - ALL: 1.0000  COVID-19: 1.0000  PNEUMONIA: 1.0000  NORMAL: 1.0000 
Mask ratio's range: 0.875 ~ 1.0

[val]
LOSS - 0.4915
ACC - 0.8000
PPV - ALL: 0.8151  COVID-19: 0.8333  PNEUMONIA: 0.7632  NORMAL: 0.8488 
RECALL - ALL: 0.8101  COVID-19: 0.8000  PNEUMONIA: 0.8700  NORMAL: 0.7604 
F1 - ALL: 0.8105  COVID-19: 0.8163  PNEUMONIA: 0.8131  NORMAL: 0.8022 

Epoch 12/19
----------
[train]
LOSS - 0.0110
ACC - 0.9600
PPV - ALL: 1.0000  COVID-19: 1.0000  PNEUMONIA: 1.0000  NORMAL: 1.0000 
RECALL - ALL: 1.0000  COVID-19: 1.0000  PNEUMONIA: 1.0000  NORMAL: 1.0000 
F1 - ALL: 1.0000  COVID-19: 1.0000  PNEUMONIA: 1.0000  NORMAL: 1.0000 
Mask ratio's range: 0.875 ~ 1.0

[val]
LOSS - 0.4836
ACC - 0.8033
PPV - ALL: 0.8179  COVID-19: 0.8351  PNEUMONIA: 0.7679  NORMAL: 0.8506 
RECALL - ALL: 0.8136  COVID-19: 0.8100  PNEUMONIA: 0.8600  NORMAL: 0.7708 
F1 - ALL: 0.8141  COVID-19: 0.8224  PNEUMONIA: 0.8113  NORMAL: 0.8087 

Epoch 13/19
----------
[train]
LOSS - 0.0120
ACC - 0.9600
PPV - ALL: 1.0000  COVID-19: 1.0000  PNEUMONIA: 1.0000  NORMAL: 1.0000 
RECALL - ALL: 1.0000  COVID-19: 1.0000  PNEUMONIA: 1.0000  NORMAL: 1.0000 
F1 - ALL: 1.0000  COVID-19: 1.0000  PNEUMONIA: 1.0000  NORMAL: 1.0000 
Mask ratio's range: 0.875 ~ 1.0

[val]
LOSS - 0.4880
ACC - 0.8100
PPV - ALL: 0.8243  COVID-19: 0.8454  PNEUMONIA: 0.7768  NORMAL: 0.8506 
RECALL - ALL: 0.8203  COVID-19: 0.8200  PNEUMONIA: 0.8700  NORMAL: 0.7708 
F1 - ALL: 0.8207  COVID-19: 0.8325  PNEUMONIA: 0.8208  NORMAL: 0.8087 

Epoch 14/19
----------
[train]
LOSS - 0.0127
ACC - 0.9600
PPV - ALL: 1.0000  COVID-19: 1.0000  PNEUMONIA: 1.0000  NORMAL: 1.0000 
RECALL - ALL: 1.0000  COVID-19: 1.0000  PNEUMONIA: 1.0000  NORMAL: 1.0000 
F1 - ALL: 1.0000  COVID-19: 1.0000  PNEUMONIA: 1.0000  NORMAL: 1.0000 
Mask ratio's range: 0.875 ~ 1.0

[val]
LOSS - 0.4865
ACC - 0.8000
PPV - ALL: 0.8184  COVID-19: 0.8404  PNEUMONIA: 0.7458  NORMAL: 0.8690 
RECALL - ALL: 0.8101  COVID-19: 0.7900  PNEUMONIA: 0.8800  NORMAL: 0.7604 
F1 - ALL: 0.8110  COVID-19: 0.8144  PNEUMONIA: 0.8074  NORMAL: 0.8111 

Epoch 15/19
----------
[train]
LOSS - 0.0093
ACC - 0.9600
PPV - ALL: 1.0000  COVID-19: 1.0000  PNEUMONIA: 1.0000  NORMAL: 1.0000 
RECALL - ALL: 1.0000  COVID-19: 1.0000  PNEUMONIA: 1.0000  NORMAL: 1.0000 
F1 - ALL: 1.0000  COVID-19: 1.0000  PNEUMONIA: 1.0000  NORMAL: 1.0000 
Mask ratio's range: 0.875 ~ 1.0

[val]
LOSS - 0.4866
ACC - 0.8067
PPV - ALL: 0.8248  COVID-19: 0.8511  PNEUMONIA: 0.7542  NORMAL: 0.8690 
RECALL - ALL: 0.8168  COVID-19: 0.8000  PNEUMONIA: 0.8900  NORMAL: 0.7604 
F1 - ALL: 0.8175  COVID-19: 0.8248  PNEUMONIA: 0.8165  NORMAL: 0.8111 

Epoch 16/19
----------
[train]
LOSS - 0.0140
ACC - 0.9600
PPV - ALL: 1.0000  COVID-19: 1.0000  PNEUMONIA: 1.0000  NORMAL: 1.0000 
RECALL - ALL: 1.0000  COVID-19: 1.0000  PNEUMONIA: 1.0000  NORMAL: 1.0000 
F1 - ALL: 1.0000  COVID-19: 1.0000  PNEUMONIA: 1.0000  NORMAL: 1.0000 
Mask ratio's range: 0.875 ~ 1.0

[val]
LOSS - 0.4929
ACC - 0.7933
PPV - ALL: 0.8143  COVID-19: 0.8444  PNEUMONIA: 0.7295  NORMAL: 0.8690 
RECALL - ALL: 0.8035  COVID-19: 0.7600  PNEUMONIA: 0.8900  NORMAL: 0.7604 
F1 - ALL: 0.8043  COVID-19: 0.8000  PNEUMONIA: 0.8018  NORMAL: 0.8111 

Epoch 17/19
----------
[train]
LOSS - 0.0153
ACC - 0.9600
PPV - ALL: 1.0000  COVID-19: 1.0000  PNEUMONIA: 1.0000  NORMAL: 1.0000 
RECALL - ALL: 1.0000  COVID-19: 1.0000  PNEUMONIA: 1.0000  NORMAL: 1.0000 
F1 - ALL: 1.0000  COVID-19: 1.0000  PNEUMONIA: 1.0000  NORMAL: 1.0000 
Mask ratio's range: 0.75 ~ 1.0

[val]
LOSS - 0.5080
ACC - 0.8000
PPV - ALL: 0.8191  COVID-19: 0.8556  PNEUMONIA: 0.7395  NORMAL: 0.8621 
RECALL - ALL: 0.8104  COVID-19: 0.7700  PNEUMONIA: 0.8800  NORMAL: 0.7812 
F1 - ALL: 0.8113  COVID-19: 0.8105  PNEUMONIA: 0.8037  NORMAL: 0.8197 

Epoch 18/19
----------
[train]
LOSS - 0.0141
ACC - 0.9600
PPV - ALL: 1.0000  COVID-19: 1.0000  PNEUMONIA: 1.0000  NORMAL: 1.0000 
RECALL - ALL: 1.0000  COVID-19: 1.0000  PNEUMONIA: 1.0000  NORMAL: 1.0000 
F1 - ALL: 1.0000  COVID-19: 1.0000  PNEUMONIA: 1.0000  NORMAL: 1.0000 
Mask ratio's range: 0.75 ~ 1.0

[val]
LOSS - 0.4965
ACC - 0.7967
PPV - ALL: 0.8164  COVID-19: 0.8539  PNEUMONIA: 0.7333  NORMAL: 0.8621 
RECALL - ALL: 0.8071  COVID-19: 0.7600  PNEUMONIA: 0.8800  NORMAL: 0.7812 
F1 - ALL: 0.8080  COVID-19: 0.8042  PNEUMONIA: 0.8000  NORMAL: 0.8197 

Epoch 19/19
----------
[train]
LOSS - 0.0238
ACC - 0.9600
PPV - ALL: 1.0000  COVID-19: 1.0000  PNEUMONIA: 1.0000  NORMAL: 1.0000 
RECALL - ALL: 1.0000  COVID-19: 1.0000  PNEUMONIA: 1.0000  NORMAL: 1.0000 
F1 - ALL: 1.0000  COVID-19: 1.0000  PNEUMONIA: 1.0000  NORMAL: 1.0000 
Mask ratio's range: 0.6875 ~ 1.0

[val]
LOSS - 0.5060
ACC - 0.7867
PPV - ALL: 0.8088  COVID-19: 0.8506  PNEUMONIA: 0.7154  NORMAL: 0.8605 
RECALL - ALL: 0.7969  COVID-19: 0.7400  PNEUMONIA: 0.8800  NORMAL: 0.7708 
F1 - ALL: 0.7980  COVID-19: 0.7915  PNEUMONIA: 0.7892  NORMAL: 0.8132 


--------------------
[Best results]
ACC - 0.8100
PPV - ALL: 0.8236  COVID-19: 0.8384  PNEUMONIA: 0.7818  NORMAL: 0.8506 
RECALL - ALL: 0.8203  COVID-19: 0.8300  PNEUMONIA: 0.8600  NORMAL: 0.7708 
F1 - ALL: 0.8206  COVID-19: 0.8342  PNEUMONIA: 0.8190  NORMAL: 0.8087 

Training complete in 1m 29s
-------------------- 

--------------------
Model 3
--------------------

Epoch 0/19
----------
[train]
LOSS - 1.0367
ACC - 0.4000
PPV - ALL: 0.4427  COVID-19: 0.3750  PNEUMONIA: 0.6111  NORMAL: 0.3421 
RECALL - ALL: 0.4167  COVID-19: 0.2500  PNEUMONIA: 0.4583  NORMAL: 0.5417 
F1 - ALL: 0.4144  COVID-19: 0.3000  PNEUMONIA: 0.5238  NORMAL: 0.4194 
Mask ratio's range: 1.0 ~ 1.0

[val]
LOSS - 1.0457
ACC - 0.4700
PPV - ALL: 0.3231  COVID-19: 0.0000  PNEUMONIA: 0.4592  NORMAL: 0.5100 
RECALL - ALL: 0.4771  COVID-19: 0.0000  PNEUMONIA: 0.9000  NORMAL: 0.5312 
F1 - ALL: 0.3762  COVID-19: 0.0000  PNEUMONIA: 0.6081  NORMAL: 0.5204 

Epoch 1/19
----------
[train]
LOSS - 0.6542
ACC - 0.8933
PPV - ALL: 0.9379  COVID-19: 1.0000  PNEUMONIA: 0.9565  NORMAL: 0.8571 
RECALL - ALL: 0.9306  COVID-19: 0.8750  PNEUMONIA: 0.9167  NORMAL: 1.0000 
F1 - ALL: 0.9309  COVID-19: 0.9333  PNEUMONIA: 0.9362  NORMAL: 0.9231 
Mask ratio's range: 1.0 ~ 1.0

[val]
LOSS - 0.7776
ACC - 0.7333
PPV - ALL: 0.7658  COVID-19: 0.8889  PNEUMONIA: 0.6967  NORMAL: 0.7117 
RECALL - ALL: 0.7443  COVID-19: 0.5600  PNEUMONIA: 0.8500  NORMAL: 0.8229 
F1 - ALL: 0.7387  COVID-19: 0.6871  PNEUMONIA: 0.7658  NORMAL: 0.7633 

Epoch 2/19
----------
[train]
LOSS - 0.2733
ACC - 0.9467
PPV - ALL: 0.9867  COVID-19: 1.0000  PNEUMONIA: 0.9600  NORMAL: 1.0000 
RECALL - ALL: 0.9861  COVID-19: 0.9583  PNEUMONIA: 1.0000  NORMAL: 1.0000 
F1 - ALL: 0.9861  COVID-19: 0.9787  PNEUMONIA: 0.9796  NORMAL: 1.0000 
Mask ratio's range: 1.0 ~ 1.0

[val]
LOSS - 0.6296
ACC - 0.7800
PPV - ALL: 0.8013  COVID-19: 0.8875  PNEUMONIA: 0.7227  NORMAL: 0.7938 
RECALL - ALL: 0.7907  COVID-19: 0.7100  PNEUMONIA: 0.8600  NORMAL: 0.8021 
F1 - ALL: 0.7907  COVID-19: 0.7889  PNEUMONIA: 0.7854  NORMAL: 0.7979 

Epoch 3/19
----------
[train]
LOSS - 0.1046
ACC - 0.9600
PPV - ALL: 1.0000  COVID-19: 1.0000  PNEUMONIA: 1.0000  NORMAL: 1.0000 
RECALL - ALL: 1.0000  COVID-19: 1.0000  PNEUMONIA: 1.0000  NORMAL: 1.0000 
F1 - ALL: 1.0000  COVID-19: 1.0000  PNEUMONIA: 1.0000  NORMAL: 1.0000 
Mask ratio's range: 1.0 ~ 1.0

[val]
LOSS - 0.5544
ACC - 0.7967
PPV - ALL: 0.8118  COVID-19: 0.8571  PNEUMONIA: 0.7522  NORMAL: 0.8261 
RECALL - ALL: 0.8072  COVID-19: 0.7800  PNEUMONIA: 0.8500  NORMAL: 0.7917 
F1 - ALL: 0.8078  COVID-19: 0.8167  PNEUMONIA: 0.7981  NORMAL: 0.8085 

Epoch 4/19
----------
[train]
LOSS - 0.0414
ACC - 0.9600
PPV - ALL: 1.0000  COVID-19: 1.0000  PNEUMONIA: 1.0000  NORMAL: 1.0000 
RECALL - ALL: 1.0000  COVID-19: 1.0000  PNEUMONIA: 1.0000  NORMAL: 1.0000 
F1 - ALL: 1.0000  COVID-19: 1.0000  PNEUMONIA: 1.0000  NORMAL: 1.0000 
Mask ratio's range: 1.0 ~ 1.0

[val]
LOSS - 0.5162
ACC - 0.8033
PPV - ALL: 0.8167  COVID-19: 0.8384  PNEUMONIA: 0.7727  NORMAL: 0.8391 
RECALL - ALL: 0.8135  COVID-19: 0.8300  PNEUMONIA: 0.8500  NORMAL: 0.7604 
F1 - ALL: 0.8138  COVID-19: 0.8342  PNEUMONIA: 0.8095  NORMAL: 0.7978 

Epoch 5/19
----------
[train]
LOSS - 0.0224
ACC - 0.9600
PPV - ALL: 1.0000  COVID-19: 1.0000  PNEUMONIA: 1.0000  NORMAL: 1.0000 
RECALL - ALL: 1.0000  COVID-19: 1.0000  PNEUMONIA: 1.0000  NORMAL: 1.0000 
F1 - ALL: 1.0000  COVID-19: 1.0000  PNEUMONIA: 1.0000  NORMAL: 1.0000 
Mask ratio's range: 1.0 ~ 1.0

[val]
LOSS - 0.5028
ACC - 0.8100
PPV - ALL: 0.8232  COVID-19: 0.8617  PNEUMONIA: 0.7798  NORMAL: 0.8280 
RECALL - ALL: 0.8207  COVID-19: 0.8100  PNEUMONIA: 0.8500  NORMAL: 0.8021 
F1 - ALL: 0.8211  COVID-19: 0.8351  PNEUMONIA: 0.8134  NORMAL: 0.8148 

Epoch 6/19
----------
[train]
LOSS - 0.0151
ACC - 0.9600
PPV - ALL: 1.0000  COVID-19: 1.0000  PNEUMONIA: 1.0000  NORMAL: 1.0000 
RECALL - ALL: 1.0000  COVID-19: 1.0000  PNEUMONIA: 1.0000  NORMAL: 1.0000 
F1 - ALL: 1.0000  COVID-19: 1.0000  PNEUMONIA: 1.0000  NORMAL: 1.0000 
Mask ratio's range: 1.0 ~ 1.0

[val]
LOSS - 0.4946
ACC - 0.8067
PPV - ALL: 0.8188  COVID-19: 0.8454  PNEUMONIA: 0.7850  NORMAL: 0.8261 
RECALL - ALL: 0.8172  COVID-19: 0.8200  PNEUMONIA: 0.8400  NORMAL: 0.7917 
F1 - ALL: 0.8175  COVID-19: 0.8325  PNEUMONIA: 0.8116  NORMAL: 0.8085 

Epoch 7/19
----------
[train]
LOSS - 0.0132
ACC - 0.9600
PPV - ALL: 1.0000  COVID-19: 1.0000  PNEUMONIA: 1.0000  NORMAL: 1.0000 
RECALL - ALL: 1.0000  COVID-19: 1.0000  PNEUMONIA: 1.0000  NORMAL: 1.0000 
F1 - ALL: 1.0000  COVID-19: 1.0000  PNEUMONIA: 1.0000  NORMAL: 1.0000 
Mask ratio's range: 0.9375 ~ 1.0

[val]
LOSS - 0.4891
ACC - 0.8133
PPV - ALL: 0.8261  COVID-19: 0.8485  PNEUMONIA: 0.7870  NORMAL: 0.8427 
RECALL - ALL: 0.8237  COVID-19: 0.8400  PNEUMONIA: 0.8500  NORMAL: 0.7812 
F1 - ALL: 0.8241  COVID-19: 0.8442  PNEUMONIA: 0.8173  NORMAL: 0.8108 

Epoch 8/19
----------
[train]
LOSS - 0.0188
ACC - 0.9600
PPV - ALL: 1.0000  COVID-19: 1.0000  PNEUMONIA: 1.0000  NORMAL: 1.0000 
RECALL - ALL: 1.0000  COVID-19: 1.0000  PNEUMONIA: 1.0000  NORMAL: 1.0000 
F1 - ALL: 1.0000  COVID-19: 1.0000  PNEUMONIA: 1.0000  NORMAL: 1.0000 
Mask ratio's range: 0.9375 ~ 1.0

[val]
LOSS - 0.4912
ACC - 0.8100
PPV - ALL: 0.8262  COVID-19: 0.8876  PNEUMONIA: 0.7611  NORMAL: 0.8298 
RECALL - ALL: 0.8208  COVID-19: 0.7900  PNEUMONIA: 0.8600  NORMAL: 0.8125 
F1 - ALL: 0.8215  COVID-19: 0.8360  PNEUMONIA: 0.8075  NORMAL: 0.8211 

Epoch 9/19
----------
[train]
LOSS - 0.0488
ACC - 0.9600
PPV - ALL: 1.0000  COVID-19: 1.0000  PNEUMONIA: 1.0000  NORMAL: 1.0000 
RECALL - ALL: 1.0000  COVID-19: 1.0000  PNEUMONIA: 1.0000  NORMAL: 1.0000 
F1 - ALL: 1.0000  COVID-19: 1.0000  PNEUMONIA: 1.0000  NORMAL: 1.0000 
Mask ratio's range: 0.875 ~ 1.0

[val]
LOSS - 0.4891
ACC - 0.8167
PPV - ALL: 0.8329  COVID-19: 0.8989  PNEUMONIA: 0.7699  NORMAL: 0.8298 
RECALL - ALL: 0.8275  COVID-19: 0.8000  PNEUMONIA: 0.8700  NORMAL: 0.8125 
F1 - ALL: 0.8282  COVID-19: 0.8466  PNEUMONIA: 0.8169  NORMAL: 0.8211 

Epoch 10/19
----------
[train]
LOSS - 0.0179
ACC - 0.9600
PPV - ALL: 1.0000  COVID-19: 1.0000  PNEUMONIA: 1.0000  NORMAL: 1.0000 
RECALL - ALL: 1.0000  COVID-19: 1.0000  PNEUMONIA: 1.0000  NORMAL: 1.0000 
F1 - ALL: 1.0000  COVID-19: 1.0000  PNEUMONIA: 1.0000  NORMAL: 1.0000 
Mask ratio's range: 0.875 ~ 1.0

[val]
LOSS - 0.4964
ACC - 0.8033
PPV - ALL: 0.8230  COVID-19: 0.9146  PNEUMONIA: 0.7586  NORMAL: 0.7959 
RECALL - ALL: 0.8142  COVID-19: 0.7500  PNEUMONIA: 0.8800  NORMAL: 0.8125 
F1 - ALL: 0.8144  COVID-19: 0.8242  PNEUMONIA: 0.8148  NORMAL: 0.8041 

Epoch 11/19
----------
[train]
LOSS - 0.0198
ACC - 0.9600
PPV - ALL: 1.0000  COVID-19: 1.0000  PNEUMONIA: 1.0000  NORMAL: 1.0000 
RECALL - ALL: 1.0000  COVID-19: 1.0000  PNEUMONIA: 1.0000  NORMAL: 1.0000 
F1 - ALL: 1.0000  COVID-19: 1.0000  PNEUMONIA: 1.0000  NORMAL: 1.0000 
Mask ratio's range: 0.875 ~ 1.0

[val]
LOSS - 0.4981
ACC - 0.8033
PPV - ALL: 0.8240  COVID-19: 0.9136  PNEUMONIA: 0.7542  NORMAL: 0.8041 
RECALL - ALL: 0.8142  COVID-19: 0.7400  PNEUMONIA: 0.8900  NORMAL: 0.8125 
F1 - ALL: 0.8142  COVID-19: 0.8177  PNEUMONIA: 0.8165  NORMAL: 0.8083 

Epoch 12/19
----------
[train]
LOSS - 0.0252
ACC - 0.9600
PPV - ALL: 1.0000  COVID-19: 1.0000  PNEUMONIA: 1.0000  NORMAL: 1.0000 
RECALL - ALL: 1.0000  COVID-19: 1.0000  PNEUMONIA: 1.0000  NORMAL: 1.0000 
F1 - ALL: 1.0000  COVID-19: 1.0000  PNEUMONIA: 1.0000  NORMAL: 1.0000 
Mask ratio's range: 0.8125 ~ 1.0

[val]
LOSS - 0.5126
ACC - 0.8033
PPV - ALL: 0.8287  COVID-19: 0.9481  PNEUMONIA: 0.7479  NORMAL: 0.7900 
RECALL - ALL: 0.8143  COVID-19: 0.7300  PNEUMONIA: 0.8900  NORMAL: 0.8229 
F1 - ALL: 0.8146  COVID-19: 0.8249  PNEUMONIA: 0.8128  NORMAL: 0.8061 

Epoch 13/19
----------
[train]
LOSS - 0.0223
ACC - 0.9600
PPV - ALL: 1.0000  COVID-19: 1.0000  PNEUMONIA: 1.0000  NORMAL: 1.0000 
RECALL - ALL: 1.0000  COVID-19: 1.0000  PNEUMONIA: 1.0000  NORMAL: 1.0000 
F1 - ALL: 1.0000  COVID-19: 1.0000  PNEUMONIA: 1.0000  NORMAL: 1.0000 
Mask ratio's range: 0.6875 ~ 1.0

[val]
LOSS - 0.5013
ACC - 0.8133
PPV - ALL: 0.8329  COVID-19: 0.9268  PNEUMONIA: 0.7719  NORMAL: 0.8000 
RECALL - ALL: 0.8244  COVID-19: 0.7600  PNEUMONIA: 0.8800  NORMAL: 0.8333 
F1 - ALL: 0.8246  COVID-19: 0.8352  PNEUMONIA: 0.8224  NORMAL: 0.8163 

Epoch 14/19
----------
[train]
LOSS - 0.0323
ACC - 0.9600
PPV - ALL: 1.0000  COVID-19: 1.0000  PNEUMONIA: 1.0000  NORMAL: 1.0000 
RECALL - ALL: 1.0000  COVID-19: 1.0000  PNEUMONIA: 1.0000  NORMAL: 1.0000 
F1 - ALL: 1.0000  COVID-19: 1.0000  PNEUMONIA: 1.0000  NORMAL: 1.0000 
Mask ratio's range: 0.6875 ~ 1.0

[val]
LOSS - 0.5061
ACC - 0.8033
PPV - ALL: 0.8263  COVID-19: 0.9367  PNEUMONIA: 0.7521  NORMAL: 0.7900 
RECALL - ALL: 0.8143  COVID-19: 0.7400  PNEUMONIA: 0.8800  NORMAL: 0.8229 
F1 - ALL: 0.8146  COVID-19: 0.8268  PNEUMONIA: 0.8110  NORMAL: 0.8061 

Epoch 15/19
----------
[train]
LOSS - 0.0155
ACC - 0.9600
PPV - ALL: 1.0000  COVID-19: 1.0000  PNEUMONIA: 1.0000  NORMAL: 1.0000 
RECALL - ALL: 1.0000  COVID-19: 1.0000  PNEUMONIA: 1.0000  NORMAL: 1.0000 
F1 - ALL: 1.0000  COVID-19: 1.0000  PNEUMONIA: 1.0000  NORMAL: 1.0000 
Mask ratio's range: 0.6875 ~ 1.0

[val]
LOSS - 0.4951
ACC - 0.8133
PPV - ALL: 0.8303  COVID-19: 0.9176  PNEUMONIA: 0.7890  NORMAL: 0.7843 
RECALL - ALL: 0.8244  COVID-19: 0.7800  PNEUMONIA: 0.8600  NORMAL: 0.8333 
F1 - ALL: 0.8248  COVID-19: 0.8432  PNEUMONIA: 0.8230  NORMAL: 0.8081 

Epoch 16/19
----------
[train]
LOSS - 0.0310
ACC - 0.9600
PPV - ALL: 1.0000  COVID-19: 1.0000  PNEUMONIA: 1.0000  NORMAL: 1.0000 
RECALL - ALL: 1.0000  COVID-19: 1.0000  PNEUMONIA: 1.0000  NORMAL: 1.0000 
F1 - ALL: 1.0000  COVID-19: 1.0000  PNEUMONIA: 1.0000  NORMAL: 1.0000 
Mask ratio's range: 0.6875 ~ 0.9375

[val]
LOSS - 0.5086
ACC - 0.8133
PPV - ALL: 0.8322  COVID-19: 0.9277  PNEUMONIA: 0.7768  NORMAL: 0.7921 
RECALL - ALL: 0.8244  COVID-19: 0.7700  PNEUMONIA: 0.8700  NORMAL: 0.8333 
F1 - ALL: 0.8248  COVID-19: 0.8415  PNEUMONIA: 0.8208  NORMAL: 0.8122 

Epoch 17/19
----------
[train]
LOSS - 0.0120
ACC - 0.9600
PPV - ALL: 1.0000  COVID-19: 1.0000  PNEUMONIA: 1.0000  NORMAL: 1.0000 
RECALL - ALL: 1.0000  COVID-19: 1.0000  PNEUMONIA: 1.0000  NORMAL: 1.0000 
F1 - ALL: 1.0000  COVID-19: 1.0000  PNEUMONIA: 1.0000  NORMAL: 1.0000 
Mask ratio's range: 0.6875 ~ 0.9375

[val]
LOSS - 0.5038
ACC - 0.8100
PPV - ALL: 0.8249  COVID-19: 0.8977  PNEUMONIA: 0.7850  NORMAL: 0.7921 
RECALL - ALL: 0.8211  COVID-19: 0.7900  PNEUMONIA: 0.8400  NORMAL: 0.8333 
F1 - ALL: 0.8214  COVID-19: 0.8404  PNEUMONIA: 0.8116  NORMAL: 0.8122 

Epoch 18/19
----------
[train]
LOSS - 0.0178
ACC - 0.9600
PPV - ALL: 1.0000  COVID-19: 1.0000  PNEUMONIA: 1.0000  NORMAL: 1.0000 
RECALL - ALL: 1.0000  COVID-19: 1.0000  PNEUMONIA: 1.0000  NORMAL: 1.0000 
F1 - ALL: 1.0000  COVID-19: 1.0000  PNEUMONIA: 1.0000  NORMAL: 1.0000 
Mask ratio's range: 0.6875 ~ 0.9375

[val]
LOSS - 0.5103
ACC - 0.8100
PPV - ALL: 0.8261  COVID-19: 0.9070  PNEUMONIA: 0.7870  NORMAL: 0.7843 
RECALL - ALL: 0.8211  COVID-19: 0.7800  PNEUMONIA: 0.8500  NORMAL: 0.8333 
F1 - ALL: 0.8214  COVID-19: 0.8387  PNEUMONIA: 0.8173  NORMAL: 0.8081 

Epoch 19/19
----------
[train]
LOSS - 0.0163
ACC - 0.9600
PPV - ALL: 1.0000  COVID-19: 1.0000  PNEUMONIA: 1.0000  NORMAL: 1.0000 
RECALL - ALL: 1.0000  COVID-19: 1.0000  PNEUMONIA: 1.0000  NORMAL: 1.0000 
F1 - ALL: 1.0000  COVID-19: 1.0000  PNEUMONIA: 1.0000  NORMAL: 1.0000 
Mask ratio's range: 0.6875 ~ 0.9375

[val]
LOSS - 0.5176
ACC - 0.8133
PPV - ALL: 0.8303  COVID-19: 0.9176  PNEUMONIA: 0.7890  NORMAL: 0.7843 
RECALL - ALL: 0.8244  COVID-19: 0.7800  PNEUMONIA: 0.8600  NORMAL: 0.8333 
F1 - ALL: 0.8248  COVID-19: 0.8432  PNEUMONIA: 0.8230  NORMAL: 0.8081 


--------------------
[Best results]
ACC - 0.8167
PPV - ALL: 0.8329  COVID-19: 0.8989  PNEUMONIA: 0.7699  NORMAL: 0.8298 
RECALL - ALL: 0.8275  COVID-19: 0.8000  PNEUMONIA: 0.8700  NORMAL: 0.8125 
F1 - ALL: 0.8282  COVID-19: 0.8466  PNEUMONIA: 0.8169  NORMAL: 0.8211 

Training complete in 1m 30s
-------------------- 

--------------------
Model 4
--------------------

Epoch 0/19
----------
[train]
LOSS - 0.9908
ACC - 0.4400
PPV - ALL: 0.4673  COVID-19: 0.5333  PNEUMONIA: 0.4211  NORMAL: 0.4474 
RECALL - ALL: 0.4583  COVID-19: 0.3333  PNEUMONIA: 0.3333  NORMAL: 0.7083 
F1 - ALL: 0.4436  COVID-19: 0.4102  PNEUMONIA: 0.3721  NORMAL: 0.5484 
Mask ratio's range: 1.0 ~ 1.0

[val]
LOSS - 0.9554
ACC - 0.5900
PPV - ALL: 0.7147  COVID-19: 0.8571  PNEUMONIA: 0.4688  NORMAL: 0.8182 
RECALL - ALL: 0.5963  COVID-19: 0.4200  PNEUMONIA: 0.9000  NORMAL: 0.4688 
F1 - ALL: 0.5921  COVID-19: 0.5637  PNEUMONIA: 0.6165  NORMAL: 0.5961 

Epoch 1/19
----------
[train]
LOSS - 0.6054
ACC - 0.9200
PPV - ALL: 0.9599  COVID-19: 1.0000  PNEUMONIA: 0.9565  NORMAL: 0.9231 
RECALL - ALL: 0.9583  COVID-19: 0.9583  PNEUMONIA: 0.9167  NORMAL: 1.0000 
F1 - ALL: 0.9583  COVID-19: 0.9787  PNEUMONIA: 0.9362  NORMAL: 0.9600 
Mask ratio's range: 1.0 ~ 1.0

[val]
LOSS - 0.7584
ACC - 0.7267
PPV - ALL: 0.7512  COVID-19: 0.8406  PNEUMONIA: 0.6723  NORMAL: 0.7407 
RECALL - ALL: 0.7378  COVID-19: 0.5800  PNEUMONIA: 0.8000  NORMAL: 0.8333 
F1 - ALL: 0.7338  COVID-19: 0.6864  PNEUMONIA: 0.7306  NORMAL: 0.7843 

Epoch 2/19
----------
[train]
LOSS - 0.2426
ACC - 0.9600
PPV - ALL: 1.0000  COVID-19: 1.0000  PNEUMONIA: 1.0000  NORMAL: 1.0000 
RECALL - ALL: 1.0000  COVID-19: 1.0000  PNEUMONIA: 1.0000  NORMAL: 1.0000 
F1 - ALL: 1.0000  COVID-19: 1.0000  PNEUMONIA: 1.0000  NORMAL: 1.0000 
Mask ratio's range: 1.0 ~ 1.0

[val]
LOSS - 0.6343
ACC - 0.7467
PPV - ALL: 0.7787  COVID-19: 0.8421  PNEUMONIA: 0.6567  NORMAL: 0.8372 
RECALL - ALL: 0.7567  COVID-19: 0.6400  PNEUMONIA: 0.8800  NORMAL: 0.7500 
F1 - ALL: 0.7569  COVID-19: 0.7273  PNEUMONIA: 0.7521  NORMAL: 0.7912 

Epoch 3/19
----------
[train]
LOSS - 0.0879
ACC - 0.9600
PPV - ALL: 1.0000  COVID-19: 1.0000  PNEUMONIA: 1.0000  NORMAL: 1.0000 
RECALL - ALL: 1.0000  COVID-19: 1.0000  PNEUMONIA: 1.0000  NORMAL: 1.0000 
F1 - ALL: 1.0000  COVID-19: 1.0000  PNEUMONIA: 1.0000  NORMAL: 1.0000 
Mask ratio's range: 1.0 ~ 1.0

[val]
LOSS - 0.5553
ACC - 0.7633
PPV - ALL: 0.7819  COVID-19: 0.8293  PNEUMONIA: 0.7059  NORMAL: 0.8105 
RECALL - ALL: 0.7740  COVID-19: 0.6800  PNEUMONIA: 0.8400  NORMAL: 0.8021 
F1 - ALL: 0.7736  COVID-19: 0.7473  PNEUMONIA: 0.7671  NORMAL: 0.8063 

Epoch 4/19
----------
[train]
LOSS - 0.0384
ACC - 0.9600
PPV - ALL: 1.0000  COVID-19: 1.0000  PNEUMONIA: 1.0000  NORMAL: 1.0000 
RECALL - ALL: 1.0000  COVID-19: 1.0000  PNEUMONIA: 1.0000  NORMAL: 1.0000 
F1 - ALL: 1.0000  COVID-19: 1.0000  PNEUMONIA: 1.0000  NORMAL: 1.0000 
Mask ratio's range: 0.9375 ~ 1.0

[val]
LOSS - 0.5230
ACC - 0.7633
PPV - ALL: 0.7827  COVID-19: 0.8214  PNEUMONIA: 0.7025  NORMAL: 0.8242 
RECALL - ALL: 0.7737  COVID-19: 0.6900  PNEUMONIA: 0.8500  NORMAL: 0.7812 
F1 - ALL: 0.7738  COVID-19: 0.7500  PNEUMONIA: 0.7692  NORMAL: 0.8021 

Epoch 5/19
----------
[train]
LOSS - 0.0212
ACC - 0.9600
PPV - ALL: 1.0000  COVID-19: 1.0000  PNEUMONIA: 1.0000  NORMAL: 1.0000 
RECALL - ALL: 1.0000  COVID-19: 1.0000  PNEUMONIA: 1.0000  NORMAL: 1.0000 
F1 - ALL: 1.0000  COVID-19: 1.0000  PNEUMONIA: 1.0000  NORMAL: 1.0000 
Mask ratio's range: 0.9375 ~ 1.0

[val]
LOSS - 0.5241
ACC - 0.7500
PPV - ALL: 0.7710  COVID-19: 0.8046  PNEUMONIA: 0.6829  NORMAL: 0.8256 
RECALL - ALL: 0.7599  COVID-19: 0.7000  PNEUMONIA: 0.8400  NORMAL: 0.7396 
F1 - ALL: 0.7607  COVID-19: 0.7487  PNEUMONIA: 0.7533  NORMAL: 0.7802 

Epoch 6/19
----------
[train]
LOSS - 0.0204
ACC - 0.9600
PPV - ALL: 1.0000  COVID-19: 1.0000  PNEUMONIA: 1.0000  NORMAL: 1.0000 
RECALL - ALL: 1.0000  COVID-19: 1.0000  PNEUMONIA: 1.0000  NORMAL: 1.0000 
F1 - ALL: 1.0000  COVID-19: 1.0000  PNEUMONIA: 1.0000  NORMAL: 1.0000 
Mask ratio's range: 0.9375 ~ 1.0

[val]
LOSS - 0.5121
ACC - 0.7533
PPV - ALL: 0.7736  COVID-19: 0.8068  PNEUMONIA: 0.6885  NORMAL: 0.8256 
RECALL - ALL: 0.7632  COVID-19: 0.7100  PNEUMONIA: 0.8400  NORMAL: 0.7396 
F1 - ALL: 0.7641  COVID-19: 0.7553  PNEUMONIA: 0.7567  NORMAL: 0.7802 

Epoch 7/19
----------
[train]
LOSS - 0.0161
ACC - 0.9600
PPV - ALL: 1.0000  COVID-19: 1.0000  PNEUMONIA: 1.0000  NORMAL: 1.0000 
RECALL - ALL: 1.0000  COVID-19: 1.0000  PNEUMONIA: 1.0000  NORMAL: 1.0000 
F1 - ALL: 1.0000  COVID-19: 1.0000  PNEUMONIA: 1.0000  NORMAL: 1.0000 
Mask ratio's range: 0.9375 ~ 1.0

[val]
LOSS - 0.5043
ACC - 0.7567
PPV - ALL: 0.7762  COVID-19: 0.8068  PNEUMONIA: 0.6942  NORMAL: 0.8276 
RECALL - ALL: 0.7667  COVID-19: 0.7100  PNEUMONIA: 0.8400  NORMAL: 0.7500 
F1 - ALL: 0.7675  COVID-19: 0.7553  PNEUMONIA: 0.7602  NORMAL: 0.7869 

Epoch 8/19
----------
[train]
LOSS - 0.0149
ACC - 0.9600
PPV - ALL: 1.0000  COVID-19: 1.0000  PNEUMONIA: 1.0000  NORMAL: 1.0000 
RECALL - ALL: 1.0000  COVID-19: 1.0000  PNEUMONIA: 1.0000  NORMAL: 1.0000 
F1 - ALL: 1.0000  COVID-19: 1.0000  PNEUMONIA: 1.0000  NORMAL: 1.0000 
Mask ratio's range: 0.875 ~ 1.0

[val]
LOSS - 0.5017
ACC - 0.7700
PPV - ALL: 0.7891  COVID-19: 0.8256  PNEUMONIA: 0.7083  NORMAL: 0.8333 
RECALL - ALL: 0.7804  COVID-19: 0.7100  PNEUMONIA: 0.8500  NORMAL: 0.7812 
F1 - ALL: 0.7808  COVID-19: 0.7634  PNEUMONIA: 0.7727  NORMAL: 0.8064 

Epoch 9/19
----------
[train]
LOSS - 0.0141
ACC - 0.9600
PPV - ALL: 1.0000  COVID-19: 1.0000  PNEUMONIA: 1.0000  NORMAL: 1.0000 
RECALL - ALL: 1.0000  COVID-19: 1.0000  PNEUMONIA: 1.0000  NORMAL: 1.0000 
F1 - ALL: 1.0000  COVID-19: 1.0000  PNEUMONIA: 1.0000  NORMAL: 1.0000 
Mask ratio's range: 0.875 ~ 1.0

[val]
LOSS - 0.5124
ACC - 0.7633
PPV - ALL: 0.7789  COVID-19: 0.8000  PNEUMONIA: 0.7105  NORMAL: 0.8261 
RECALL - ALL: 0.7739  COVID-19: 0.7200  PNEUMONIA: 0.8100  NORMAL: 0.7917 
F1 - ALL: 0.7745  COVID-19: 0.7579  PNEUMONIA: 0.7570  NORMAL: 0.8085 

Epoch 10/19
----------
[train]
LOSS - 0.0191
ACC - 0.9600
PPV - ALL: 1.0000  COVID-19: 1.0000  PNEUMONIA: 1.0000  NORMAL: 1.0000 
RECALL - ALL: 1.0000  COVID-19: 1.0000  PNEUMONIA: 1.0000  NORMAL: 1.0000 
F1 - ALL: 1.0000  COVID-19: 1.0000  PNEUMONIA: 1.0000  NORMAL: 1.0000 
Mask ratio's range: 0.875 ~ 1.0

[val]
LOSS - 0.5274
ACC - 0.7667
PPV - ALL: 0.7839  COVID-19: 0.8161  PNEUMONIA: 0.7094  NORMAL: 0.8261 
RECALL - ALL: 0.7772  COVID-19: 0.7100  PNEUMONIA: 0.8300  NORMAL: 0.7917 
F1 - ALL: 0.7776  COVID-19: 0.7594  PNEUMONIA: 0.7650  NORMAL: 0.8085 

Epoch 11/19
----------
[train]
LOSS - 0.0110
ACC - 0.9600
PPV - ALL: 1.0000  COVID-19: 1.0000  PNEUMONIA: 1.0000  NORMAL: 1.0000 
RECALL - ALL: 1.0000  COVID-19: 1.0000  PNEUMONIA: 1.0000  NORMAL: 1.0000 
F1 - ALL: 1.0000  COVID-19: 1.0000  PNEUMONIA: 1.0000  NORMAL: 1.0000 
Mask ratio's range: 0.875 ~ 1.0

[val]
LOSS - 0.5014
ACC - 0.7600
PPV - ALL: 0.7753  COVID-19: 0.7912  PNEUMONIA: 0.7105  NORMAL: 0.8242 
RECALL - ALL: 0.7704  COVID-19: 0.7200  PNEUMONIA: 0.8100  NORMAL: 0.7812 
F1 - ALL: 0.7710  COVID-19: 0.7539  PNEUMONIA: 0.7570  NORMAL: 0.8021 

Epoch 12/19
----------
[train]
LOSS - 0.0147
ACC - 0.9600
PPV - ALL: 1.0000  COVID-19: 1.0000  PNEUMONIA: 1.0000  NORMAL: 1.0000 
RECALL - ALL: 1.0000  COVID-19: 1.0000  PNEUMONIA: 1.0000  NORMAL: 1.0000 
F1 - ALL: 1.0000  COVID-19: 1.0000  PNEUMONIA: 1.0000  NORMAL: 1.0000 
Mask ratio's range: 0.875 ~ 1.0

[val]
LOSS - 0.4965
ACC - 0.7667
PPV - ALL: 0.7817  COVID-19: 0.8022  PNEUMONIA: 0.7168  NORMAL: 0.8261 
RECALL - ALL: 0.7772  COVID-19: 0.7300  PNEUMONIA: 0.8100  NORMAL: 0.7917 
F1 - ALL: 0.7778  COVID-19: 0.7644  PNEUMONIA: 0.7606  NORMAL: 0.8085 

Epoch 13/19
----------
[train]
LOSS - 0.0178
ACC - 0.9600
PPV - ALL: 1.0000  COVID-19: 1.0000  PNEUMONIA: 1.0000  NORMAL: 1.0000 
RECALL - ALL: 1.0000  COVID-19: 1.0000  PNEUMONIA: 1.0000  NORMAL: 1.0000 
F1 - ALL: 1.0000  COVID-19: 1.0000  PNEUMONIA: 1.0000  NORMAL: 1.0000 
Mask ratio's range: 0.875 ~ 1.0

[val]
LOSS - 0.5056
ACC - 0.7767
PPV - ALL: 0.7912  COVID-19: 0.8161  PNEUMONIA: 0.7345  NORMAL: 0.8229 
RECALL - ALL: 0.7876  COVID-19: 0.7100  PNEUMONIA: 0.8300  NORMAL: 0.8229 
F1 - ALL: 0.7872  COVID-19: 0.7594  PNEUMONIA: 0.7793  NORMAL: 0.8229 

Epoch 14/19
----------
[train]
LOSS - 0.0120
ACC - 0.9600
PPV - ALL: 1.0000  COVID-19: 1.0000  PNEUMONIA: 1.0000  NORMAL: 1.0000 
RECALL - ALL: 1.0000  COVID-19: 1.0000  PNEUMONIA: 1.0000  NORMAL: 1.0000 
F1 - ALL: 1.0000  COVID-19: 1.0000  PNEUMONIA: 1.0000  NORMAL: 1.0000 
Mask ratio's range: 0.875 ~ 1.0

[val]
LOSS - 0.5021
ACC - 0.7633
PPV - ALL: 0.7770  COVID-19: 0.7912  PNEUMONIA: 0.7207  NORMAL: 0.8191 
RECALL - ALL: 0.7740  COVID-19: 0.7200  PNEUMONIA: 0.8000  NORMAL: 0.8021 
F1 - ALL: 0.7742  COVID-19: 0.7539  PNEUMONIA: 0.7583  NORMAL: 0.8105 

Epoch 15/19
----------
[train]
LOSS - 0.0189
ACC - 0.9600
PPV - ALL: 1.0000  COVID-19: 1.0000  PNEUMONIA: 1.0000  NORMAL: 1.0000 
RECALL - ALL: 1.0000  COVID-19: 1.0000  PNEUMONIA: 1.0000  NORMAL: 1.0000 
F1 - ALL: 1.0000  COVID-19: 1.0000  PNEUMONIA: 1.0000  NORMAL: 1.0000 
Mask ratio's range: 0.875 ~ 1.0

[val]
LOSS - 0.5121
ACC - 0.7700
PPV - ALL: 0.7819  COVID-19: 0.7826  PNEUMONIA: 0.7383  NORMAL: 0.8247 
RECALL - ALL: 0.7811  COVID-19: 0.7200  PNEUMONIA: 0.7900  NORMAL: 0.8333 
F1 - ALL: 0.7808  COVID-19: 0.7500  PNEUMONIA: 0.7633  NORMAL: 0.8290 

Epoch 16/19
----------
[train]
LOSS - 0.0159
ACC - 0.9600
PPV - ALL: 1.0000  COVID-19: 1.0000  PNEUMONIA: 1.0000  NORMAL: 1.0000 
RECALL - ALL: 1.0000  COVID-19: 1.0000  PNEUMONIA: 1.0000  NORMAL: 1.0000 
F1 - ALL: 1.0000  COVID-19: 1.0000  PNEUMONIA: 1.0000  NORMAL: 1.0000 
Mask ratio's range: 0.8125 ~ 1.0

[val]
LOSS - 0.5118
ACC - 0.7800
PPV - ALL: 0.7916  COVID-19: 0.7935  PNEUMONIA: 0.7547  NORMAL: 0.8265 
RECALL - ALL: 0.7913  COVID-19: 0.7300  PNEUMONIA: 0.8000  NORMAL: 0.8438 
F1 - ALL: 0.7907  COVID-19: 0.7604  PNEUMONIA: 0.7767  NORMAL: 0.8351 

Epoch 17/19
----------
[train]
LOSS - 0.0148
ACC - 0.9600
PPV - ALL: 1.0000  COVID-19: 1.0000  PNEUMONIA: 1.0000  NORMAL: 1.0000 
RECALL - ALL: 1.0000  COVID-19: 1.0000  PNEUMONIA: 1.0000  NORMAL: 1.0000 
F1 - ALL: 1.0000  COVID-19: 1.0000  PNEUMONIA: 1.0000  NORMAL: 1.0000 
Mask ratio's range: 0.75 ~ 1.0

[val]
LOSS - 0.4950
ACC - 0.7867
PPV - ALL: 0.7983  COVID-19: 0.8090  PNEUMONIA: 0.7642  NORMAL: 0.8218 
RECALL - ALL: 0.7982  COVID-19: 0.7200  PNEUMONIA: 0.8100  NORMAL: 0.8646 
F1 - ALL: 0.7970  COVID-19: 0.7619  PNEUMONIA: 0.7864  NORMAL: 0.8427 

Epoch 18/19
----------
[train]
LOSS - 0.0175
ACC - 0.9600
PPV - ALL: 1.0000  COVID-19: 1.0000  PNEUMONIA: 1.0000  NORMAL: 1.0000 
RECALL - ALL: 1.0000  COVID-19: 1.0000  PNEUMONIA: 1.0000  NORMAL: 1.0000 
F1 - ALL: 1.0000  COVID-19: 1.0000  PNEUMONIA: 1.0000  NORMAL: 1.0000 
Mask ratio's range: 0.75 ~ 1.0

[val]
LOSS - 0.5359
ACC - 0.7767
PPV - ALL: 0.7883  COVID-19: 0.7889  PNEUMONIA: 0.7477  NORMAL: 0.8283 
RECALL - ALL: 0.7881  COVID-19: 0.7100  PNEUMONIA: 0.8000  NORMAL: 0.8542 
F1 - ALL: 0.7872  COVID-19: 0.7474  PNEUMONIA: 0.7730  NORMAL: 0.8411 

Epoch 19/19
----------
[train]
LOSS - 0.0153
ACC - 0.9600
PPV - ALL: 1.0000  COVID-19: 1.0000  PNEUMONIA: 1.0000  NORMAL: 1.0000 
RECALL - ALL: 1.0000  COVID-19: 1.0000  PNEUMONIA: 1.0000  NORMAL: 1.0000 
F1 - ALL: 1.0000  COVID-19: 1.0000  PNEUMONIA: 1.0000  NORMAL: 1.0000 
Mask ratio's range: 0.75 ~ 1.0

[val]
LOSS - 0.5066
ACC - 0.7767
PPV - ALL: 0.7887  COVID-19: 0.8046  PNEUMONIA: 0.7477  NORMAL: 0.8137 
RECALL - ALL: 0.7882  COVID-19: 0.7000  PNEUMONIA: 0.8000  NORMAL: 0.8646 
F1 - ALL: 0.7867  COVID-19: 0.7487  PNEUMONIA: 0.7730  NORMAL: 0.8384 


--------------------
[Best results]
ACC - 0.7867
PPV - ALL: 0.7983  COVID-19: 0.8090  PNEUMONIA: 0.7642  NORMAL: 0.8218 
RECALL - ALL: 0.7982  COVID-19: 0.7200  PNEUMONIA: 0.8100  NORMAL: 0.8646 
F1 - ALL: 0.7970  COVID-19: 0.7619  PNEUMONIA: 0.7864  NORMAL: 0.8427 

Training complete in 1m 31s
-------------------- 

--------------------
Model 5
--------------------

Epoch 0/19
----------
[train]
LOSS - 1.0377
ACC - 0.3733
PPV - ALL: 0.3876  COVID-19: 0.3333  PNEUMONIA: 0.4545  NORMAL: 0.3750 
RECALL - ALL: 0.3889  COVID-19: 0.2500  PNEUMONIA: 0.4167  NORMAL: 0.5000 
F1 - ALL: 0.3830  COVID-19: 0.2857  PNEUMONIA: 0.4348  NORMAL: 0.4286 
Mask ratio's range: 1.0 ~ 1.0

[val]
LOSS - 1.0338
ACC - 0.4433
PPV - ALL: 0.5384  COVID-19: 0.6667  PNEUMONIA: 0.5278  NORMAL: 0.4208 
RECALL - ALL: 0.4563  COVID-19: 0.0200  PNEUMONIA: 0.3800  NORMAL: 0.9688 
F1 - ALL: 0.3558  COVID-19: 0.0388  PNEUMONIA: 0.4419  NORMAL: 0.5867 

Epoch 1/19
----------
[train]
LOSS - 0.6397
ACC - 0.9067
PPV - ALL: 0.9444  COVID-19: 0.9565  PNEUMONIA: 0.9167  NORMAL: 0.9600 
RECALL - ALL: 0.9445  COVID-19: 0.9167  PNEUMONIA: 0.9167  NORMAL: 1.0000 
F1 - ALL: 0.9442  COVID-19: 0.9362  PNEUMONIA: 0.9167  NORMAL: 0.9796 
Mask ratio's range: 1.0 ~ 1.0

[val]
LOSS - 0.8116
ACC - 0.7300
PPV - ALL: 0.7576  COVID-19: 0.8615  PNEUMONIA: 0.7217  NORMAL: 0.6897 
RECALL - ALL: 0.7411  COVID-19: 0.5600  PNEUMONIA: 0.8300  NORMAL: 0.8333 
F1 - ALL: 0.7352  COVID-19: 0.6788  PNEUMONIA: 0.7721  NORMAL: 0.7547 

Epoch 2/19
----------
[train]
LOSS - 0.2783
ACC - 0.9600
PPV - ALL: 1.0000  COVID-19: 1.0000  PNEUMONIA: 1.0000  NORMAL: 1.0000 
RECALL - ALL: 1.0000  COVID-19: 1.0000  PNEUMONIA: 1.0000  NORMAL: 1.0000 
F1 - ALL: 1.0000  COVID-19: 1.0000  PNEUMONIA: 1.0000  NORMAL: 1.0000 
Mask ratio's range: 1.0 ~ 1.0

[val]
LOSS - 0.6708
ACC - 0.7367
PPV - ALL: 0.7610  COVID-19: 0.8529  PNEUMONIA: 0.7232  NORMAL: 0.7069 
RECALL - ALL: 0.7481  COVID-19: 0.5800  PNEUMONIA: 0.8100  NORMAL: 0.8542 
F1 - ALL: 0.7427  COVID-19: 0.6905  PNEUMONIA: 0.7641  NORMAL: 0.7736 

Epoch 3/19
----------
[train]
LOSS - 0.1013
ACC - 0.9600
PPV - ALL: 1.0000  COVID-19: 1.0000  PNEUMONIA: 1.0000  NORMAL: 1.0000 
RECALL - ALL: 1.0000  COVID-19: 1.0000  PNEUMONIA: 1.0000  NORMAL: 1.0000 
F1 - ALL: 1.0000  COVID-19: 1.0000  PNEUMONIA: 1.0000  NORMAL: 1.0000 
Mask ratio's range: 1.0 ~ 1.0

[val]
LOSS - 0.5878
ACC - 0.7600
PPV - ALL: 0.7775  COVID-19: 0.8462  PNEUMONIA: 0.7411  NORMAL: 0.7453 
RECALL - ALL: 0.7710  COVID-19: 0.6600  PNEUMONIA: 0.8300  NORMAL: 0.8229 
F1 - ALL: 0.7689  COVID-19: 0.7416  PNEUMONIA: 0.7830  NORMAL: 0.7822 

Epoch 4/19
----------
[train]
LOSS - 0.0420
ACC - 0.9600
PPV - ALL: 1.0000  COVID-19: 1.0000  PNEUMONIA: 1.0000  NORMAL: 1.0000 
RECALL - ALL: 1.0000  COVID-19: 1.0000  PNEUMONIA: 1.0000  NORMAL: 1.0000 
F1 - ALL: 1.0000  COVID-19: 1.0000  PNEUMONIA: 1.0000  NORMAL: 1.0000 
Mask ratio's range: 1.0 ~ 1.0

[val]
LOSS - 0.5519
ACC - 0.7733
PPV - ALL: 0.7896  COVID-19: 0.8500  PNEUMONIA: 0.7568  NORMAL: 0.7619 
RECALL - ALL: 0.7844  COVID-19: 0.6800  PNEUMONIA: 0.8400  NORMAL: 0.8333 
F1 - ALL: 0.7826  COVID-19: 0.7556  PNEUMONIA: 0.7962  NORMAL: 0.7960 

Epoch 5/19
----------
[train]
LOSS - 0.0241
ACC - 0.9600
PPV - ALL: 1.0000  COVID-19: 1.0000  PNEUMONIA: 1.0000  NORMAL: 1.0000 
RECALL - ALL: 1.0000  COVID-19: 1.0000  PNEUMONIA: 1.0000  NORMAL: 1.0000 
F1 - ALL: 1.0000  COVID-19: 1.0000  PNEUMONIA: 1.0000  NORMAL: 1.0000 
Mask ratio's range: 0.9375 ~ 1.0

[val]
LOSS - 0.5333
ACC - 0.7767
PPV - ALL: 0.7921  COVID-19: 0.8554  PNEUMONIA: 0.7685  NORMAL: 0.7524 
RECALL - ALL: 0.7876  COVID-19: 0.7100  PNEUMONIA: 0.8300  NORMAL: 0.8229 
F1 - ALL: 0.7867  COVID-19: 0.7759  PNEUMONIA: 0.7981  NORMAL: 0.7861 

Epoch 6/19
----------
[train]
LOSS - 0.0169
ACC - 0.9600
PPV - ALL: 1.0000  COVID-19: 1.0000  PNEUMONIA: 1.0000  NORMAL: 1.0000 
RECALL - ALL: 1.0000  COVID-19: 1.0000  PNEUMONIA: 1.0000  NORMAL: 1.0000 
F1 - ALL: 1.0000  COVID-19: 1.0000  PNEUMONIA: 1.0000  NORMAL: 1.0000 
Mask ratio's range: 0.9375 ~ 1.0

[val]
LOSS - 0.5263
ACC - 0.7833
PPV - ALL: 0.7986  COVID-19: 0.8554  PNEUMONIA: 0.7905  NORMAL: 0.7500 
RECALL - ALL: 0.7946  COVID-19: 0.7100  PNEUMONIA: 0.8300  NORMAL: 0.8438 
F1 - ALL: 0.7933  COVID-19: 0.7759  PNEUMONIA: 0.8098  NORMAL: 0.7941 

Epoch 7/19
----------
[train]
LOSS - 0.0134
ACC - 0.9600
PPV - ALL: 1.0000  COVID-19: 1.0000  PNEUMONIA: 1.0000  NORMAL: 1.0000 
RECALL - ALL: 1.0000  COVID-19: 1.0000  PNEUMONIA: 1.0000  NORMAL: 1.0000 
F1 - ALL: 1.0000  COVID-19: 1.0000  PNEUMONIA: 1.0000  NORMAL: 1.0000 
Mask ratio's range: 0.9375 ~ 1.0

[val]
LOSS - 0.5211
ACC - 0.7800
PPV - ALL: 0.7956  COVID-19: 0.8537  PNEUMONIA: 0.7830  NORMAL: 0.7500 
RECALL - ALL: 0.7913  COVID-19: 0.7000  PNEUMONIA: 0.8300  NORMAL: 0.8438 
F1 - ALL: 0.7897  COVID-19: 0.7692  PNEUMONIA: 0.8058  NORMAL: 0.7941 

Epoch 8/19
----------
[train]
LOSS - 0.0160
ACC - 0.9600
PPV - ALL: 1.0000  COVID-19: 1.0000  PNEUMONIA: 1.0000  NORMAL: 1.0000 
RECALL - ALL: 1.0000  COVID-19: 1.0000  PNEUMONIA: 1.0000  NORMAL: 1.0000 
F1 - ALL: 1.0000  COVID-19: 1.0000  PNEUMONIA: 1.0000  NORMAL: 1.0000 
Mask ratio's range: 0.9375 ~ 1.0

[val]
LOSS - 0.5186
ACC - 0.7767
PPV - ALL: 0.7925  COVID-19: 0.8519  PNEUMONIA: 0.7757  NORMAL: 0.7500 
RECALL - ALL: 0.7879  COVID-19: 0.6900  PNEUMONIA: 0.8300  NORMAL: 0.8438 
F1 - ALL: 0.7862  COVID-19: 0.7625  PNEUMONIA: 0.8019  NORMAL: 0.7941 

Epoch 9/19
----------
[train]
LOSS - 0.0161
ACC - 0.9600
PPV - ALL: 1.0000  COVID-19: 1.0000  PNEUMONIA: 1.0000  NORMAL: 1.0000 
RECALL - ALL: 1.0000  COVID-19: 1.0000  PNEUMONIA: 1.0000  NORMAL: 1.0000 
F1 - ALL: 1.0000  COVID-19: 1.0000  PNEUMONIA: 1.0000  NORMAL: 1.0000 
Mask ratio's range: 0.9375 ~ 1.0

[val]
LOSS - 0.5256
ACC - 0.7800
PPV - ALL: 0.7945  COVID-19: 0.8471  PNEUMONIA: 0.7864  NORMAL: 0.7500 
RECALL - ALL: 0.7913  COVID-19: 0.7200  PNEUMONIA: 0.8100  NORMAL: 0.8438 
F1 - ALL: 0.7902  COVID-19: 0.7784  PNEUMONIA: 0.7980  NORMAL: 0.7941 

Epoch 10/19
----------
[train]
LOSS - 0.0116
ACC - 0.9600
PPV - ALL: 1.0000  COVID-19: 1.0000  PNEUMONIA: 1.0000  NORMAL: 1.0000 
RECALL - ALL: 1.0000  COVID-19: 1.0000  PNEUMONIA: 1.0000  NORMAL: 1.0000 
F1 - ALL: 1.0000  COVID-19: 1.0000  PNEUMONIA: 1.0000  NORMAL: 1.0000 
Mask ratio's range: 0.9375 ~ 1.0

[val]
LOSS - 0.5218
ACC - 0.7833
PPV - ALL: 0.7985  COVID-19: 0.8571  PNEUMONIA: 0.7885  NORMAL: 0.7500 
RECALL - ALL: 0.7946  COVID-19: 0.7200  PNEUMONIA: 0.8200  NORMAL: 0.8438 
F1 - ALL: 0.7935  COVID-19: 0.7826  PNEUMONIA: 0.8039  NORMAL: 0.7941 

Epoch 11/19
----------
[train]
LOSS - 0.0095
ACC - 0.9600
PPV - ALL: 1.0000  COVID-19: 1.0000  PNEUMONIA: 1.0000  NORMAL: 1.0000 
RECALL - ALL: 1.0000  COVID-19: 1.0000  PNEUMONIA: 1.0000  NORMAL: 1.0000 
F1 - ALL: 1.0000  COVID-19: 1.0000  PNEUMONIA: 1.0000  NORMAL: 1.0000 
Mask ratio's range: 0.9375 ~ 1.0

[val]
LOSS - 0.5132
ACC - 0.7867
PPV - ALL: 0.8015  COVID-19: 0.8571  PNEUMONIA: 0.7905  NORMAL: 0.7570 
RECALL - ALL: 0.7979  COVID-19: 0.7200  PNEUMONIA: 0.8300  NORMAL: 0.8438 
F1 - ALL: 0.7968  COVID-19: 0.7826  PNEUMONIA: 0.8098  NORMAL: 0.7980 

Epoch 12/19
----------
[train]
LOSS - 0.0109
ACC - 0.9600
PPV - ALL: 1.0000  COVID-19: 1.0000  PNEUMONIA: 1.0000  NORMAL: 1.0000 
RECALL - ALL: 1.0000  COVID-19: 1.0000  PNEUMONIA: 1.0000  NORMAL: 1.0000 
F1 - ALL: 1.0000  COVID-19: 1.0000  PNEUMONIA: 1.0000  NORMAL: 1.0000 
Mask ratio's range: 0.9375 ~ 1.0

[val]
LOSS - 0.5170
ACC - 0.7700
PPV - ALL: 0.7833  COVID-19: 0.8256  PNEUMONIA: 0.7767  NORMAL: 0.7477 
RECALL - ALL: 0.7811  COVID-19: 0.7100  PNEUMONIA: 0.8000  NORMAL: 0.8333 
F1 - ALL: 0.7799  COVID-19: 0.7634  PNEUMONIA: 0.7882  NORMAL: 0.7882 

Epoch 13/19
----------
[train]
LOSS - 0.0165
ACC - 0.9600
PPV - ALL: 1.0000  COVID-19: 1.0000  PNEUMONIA: 1.0000  NORMAL: 1.0000 
RECALL - ALL: 1.0000  COVID-19: 1.0000  PNEUMONIA: 1.0000  NORMAL: 1.0000 
F1 - ALL: 1.0000  COVID-19: 1.0000  PNEUMONIA: 1.0000  NORMAL: 1.0000 
Mask ratio's range: 0.9375 ~ 1.0

[val]
LOSS - 0.5142
ACC - 0.7800
PPV - ALL: 0.7932  COVID-19: 0.8295  PNEUMONIA: 0.8000  NORMAL: 0.7500 
RECALL - ALL: 0.7913  COVID-19: 0.7300  PNEUMONIA: 0.8000  NORMAL: 0.8438 
F1 - ALL: 0.7902  COVID-19: 0.7766  PNEUMONIA: 0.8000  NORMAL: 0.7941 

Epoch 14/19
----------
[train]
LOSS - 0.0138
ACC - 0.9600
PPV - ALL: 1.0000  COVID-19: 1.0000  PNEUMONIA: 1.0000  NORMAL: 1.0000 
RECALL - ALL: 1.0000  COVID-19: 1.0000  PNEUMONIA: 1.0000  NORMAL: 1.0000 
F1 - ALL: 1.0000  COVID-19: 1.0000  PNEUMONIA: 1.0000  NORMAL: 1.0000 
Mask ratio's range: 0.9375 ~ 1.0

[val]
LOSS - 0.5225
ACC - 0.7867
PPV - ALL: 0.7997  COVID-19: 0.8261  PNEUMONIA: 0.8229  NORMAL: 0.7500 
RECALL - ALL: 0.7979  COVID-19: 0.7600  PNEUMONIA: 0.7900  NORMAL: 0.8438 
F1 - ALL: 0.7973  COVID-19: 0.7917  PNEUMONIA: 0.8061  NORMAL: 0.7941 

Epoch 15/19
----------
[train]
LOSS - 0.0144
ACC - 0.9600
PPV - ALL: 1.0000  COVID-19: 1.0000  PNEUMONIA: 1.0000  NORMAL: 1.0000 
RECALL - ALL: 1.0000  COVID-19: 1.0000  PNEUMONIA: 1.0000  NORMAL: 1.0000 
F1 - ALL: 1.0000  COVID-19: 1.0000  PNEUMONIA: 1.0000  NORMAL: 1.0000 
Mask ratio's range: 0.875 ~ 1.0

[val]
LOSS - 0.5045
ACC - 0.7800
PPV - ALL: 0.7934  COVID-19: 0.8222  PNEUMONIA: 0.8125  NORMAL: 0.7455 
RECALL - ALL: 0.7914  COVID-19: 0.7400  PNEUMONIA: 0.7800  NORMAL: 0.8542 
F1 - ALL: 0.7903  COVID-19: 0.7789  PNEUMONIA: 0.7959  NORMAL: 0.7962 

Epoch 16/19
----------
[train]
LOSS - 0.0119
ACC - 0.9600
PPV - ALL: 1.0000  COVID-19: 1.0000  PNEUMONIA: 1.0000  NORMAL: 1.0000 
RECALL - ALL: 1.0000  COVID-19: 1.0000  PNEUMONIA: 1.0000  NORMAL: 1.0000 
F1 - ALL: 1.0000  COVID-19: 1.0000  PNEUMONIA: 1.0000  NORMAL: 1.0000 
Mask ratio's range: 0.875 ~ 1.0

[val]
LOSS - 0.5040
ACC - 0.7800
PPV - ALL: 0.7929  COVID-19: 0.8202  PNEUMONIA: 0.8061  NORMAL: 0.7523 
RECALL - ALL: 0.7914  COVID-19: 0.7300  PNEUMONIA: 0.7900  NORMAL: 0.8542 
F1 - ALL: 0.7902  COVID-19: 0.7725  PNEUMONIA: 0.7980  NORMAL: 0.8000 

Epoch 17/19
----------
[train]
LOSS - 0.0102
ACC - 0.9600
PPV - ALL: 1.0000  COVID-19: 1.0000  PNEUMONIA: 1.0000  NORMAL: 1.0000 
RECALL - ALL: 1.0000  COVID-19: 1.0000  PNEUMONIA: 1.0000  NORMAL: 1.0000 
F1 - ALL: 1.0000  COVID-19: 1.0000  PNEUMONIA: 1.0000  NORMAL: 1.0000 
Mask ratio's range: 0.8125 ~ 1.0

[val]
LOSS - 0.5001
ACC - 0.7867
PPV - ALL: 0.8005  COVID-19: 0.8391  PNEUMONIA: 0.8100  NORMAL: 0.7523 
RECALL - ALL: 0.7981  COVID-19: 0.7300  PNEUMONIA: 0.8100  NORMAL: 0.8542 
F1 - ALL: 0.7969  COVID-19: 0.7808  PNEUMONIA: 0.8100  NORMAL: 0.8000 

Epoch 18/19
----------
[train]
LOSS - 0.0239
ACC - 0.9600
PPV - ALL: 1.0000  COVID-19: 1.0000  PNEUMONIA: 1.0000  NORMAL: 1.0000 
RECALL - ALL: 1.0000  COVID-19: 1.0000  PNEUMONIA: 1.0000  NORMAL: 1.0000 
F1 - ALL: 1.0000  COVID-19: 1.0000  PNEUMONIA: 1.0000  NORMAL: 1.0000 
Mask ratio's range: 0.8125 ~ 1.0

[val]
LOSS - 0.4946
ACC - 0.7767
PPV - ALL: 0.7898  COVID-19: 0.8202  PNEUMONIA: 0.8061  NORMAL: 0.7431 
RECALL - ALL: 0.7879  COVID-19: 0.7300  PNEUMONIA: 0.7900  NORMAL: 0.8438 
F1 - ALL: 0.7869  COVID-19: 0.7725  PNEUMONIA: 0.7980  NORMAL: 0.7903 

Epoch 19/19
----------
[train]
LOSS - 0.0153
ACC - 0.9600
PPV - ALL: 1.0000  COVID-19: 1.0000  PNEUMONIA: 1.0000  NORMAL: 1.0000 
RECALL - ALL: 1.0000  COVID-19: 1.0000  PNEUMONIA: 1.0000  NORMAL: 1.0000 
F1 - ALL: 1.0000  COVID-19: 1.0000  PNEUMONIA: 1.0000  NORMAL: 1.0000 
Mask ratio's range: 0.8125 ~ 1.0

[val]
LOSS - 0.5058
ACC - 0.7700
PPV - ALL: 0.7835  COVID-19: 0.8161  PNEUMONIA: 0.7980  NORMAL: 0.7364 
RECALL - ALL: 0.7813  COVID-19: 0.7100  PNEUMONIA: 0.7900  NORMAL: 0.8438 
F1 - ALL: 0.7800  COVID-19: 0.7594  PNEUMONIA: 0.7940  NORMAL: 0.7865 


--------------------
[Best results]
ACC - 0.7867
PPV - ALL: 0.8015  COVID-19: 0.8571  PNEUMONIA: 0.7905  NORMAL: 0.7570 
RECALL - ALL: 0.7979  COVID-19: 0.7200  PNEUMONIA: 0.8300  NORMAL: 0.8438 
F1 - ALL: 0.7968  COVID-19: 0.7826  PNEUMONIA: 0.8098  NORMAL: 0.7980 

Training complete in 1m 31s
-------------------- 

[Mean results]
ACC - 0.8040 (0.01)
PPV - ALL: 0.8179 (0.02)  COVID-19: 0.8589 (0.03)  PNEUMONIA: 0.7856 (0.02)  NORMAL: 0.8091 (0.03) 
RECALL - ALL: 0.8150 (0.01)  COVID-19: 0.7780 (0.05)  PNEUMONIA: 0.8400 (0.02)  NORMAL: 0.8271 (0.03) 
F1 - ALL: 0.8148 (0.02)  COVID-19: 0.8159 (0.04)  PNEUMONIA: 0.8116 (0.01)  NORMAL: 0.8169 (0.01) 

