--------------------
Model 1
--------------------

Epoch 0/19
----------
[train]
LOSS - 1.0096
ACC - 0.4267
PPV - ALL: 0.4461  COVID-19: 0.4800  PNEUMONIA: 0.4444  NORMAL: 0.4138 
RECALL - ALL: 0.4444  COVID-19: 0.5000  PNEUMONIA: 0.3333  NORMAL: 0.5000 
F1 - ALL: 0.4412  COVID-19: 0.4898  PNEUMONIA: 0.3809  NORMAL: 0.4528 
Mask ratio's range: 1.0 ~ 1.0

[val]
LOSS - 1.0142
ACC - 0.4533
PPV - ALL: 0.7486  COVID-19: 1.0000  PNEUMONIA: 0.8667  NORMAL: 0.3790 
RECALL - ALL: 0.4664  COVID-19: 0.0300  PNEUMONIA: 0.3900  NORMAL: 0.9792 
F1 - ALL: 0.3809  COVID-19: 0.0583  PNEUMONIA: 0.5379  NORMAL: 0.5465 

Epoch 1/19
----------
[train]
LOSS - 0.7087
ACC - 0.8400
PPV - ALL: 0.8805  COVID-19: 1.0000  PNEUMONIA: 0.8636  NORMAL: 0.7778 
RECALL - ALL: 0.8750  COVID-19: 0.9583  PNEUMONIA: 0.7917  NORMAL: 0.8750 
F1 - ALL: 0.8761  COVID-19: 0.9787  PNEUMONIA: 0.8261  NORMAL: 0.8235 
Mask ratio's range: 1.0 ~ 1.0

[val]
LOSS - 0.8010
ACC - 0.7800
PPV - ALL: 0.7956  COVID-19: 0.8681  PNEUMONIA: 0.7979  NORMAL: 0.7207 
RECALL - ALL: 0.7911  COVID-19: 0.7900  PNEUMONIA: 0.7500  NORMAL: 0.8333 
F1 - ALL: 0.7911  COVID-19: 0.8272  PNEUMONIA: 0.7732  NORMAL: 0.7729 

Epoch 2/19
----------
[train]
LOSS - 0.3301
ACC - 0.9600
PPV - ALL: 1.0000  COVID-19: 1.0000  PNEUMONIA: 1.0000  NORMAL: 1.0000 
RECALL - ALL: 1.0000  COVID-19: 1.0000  PNEUMONIA: 1.0000  NORMAL: 1.0000 
F1 - ALL: 1.0000  COVID-19: 1.0000  PNEUMONIA: 1.0000  NORMAL: 1.0000 
Mask ratio's range: 1.0 ~ 1.0

[val]
LOSS - 0.6457
ACC - 0.7933
PPV - ALL: 0.8158  COVID-19: 0.9221  PNEUMONIA: 0.7685  NORMAL: 0.7568 
RECALL - ALL: 0.8050  COVID-19: 0.7100  PNEUMONIA: 0.8300  NORMAL: 0.8750 
F1 - ALL: 0.8040  COVID-19: 0.8023  PNEUMONIA: 0.7981  NORMAL: 0.8116 

Epoch 3/19
----------
[train]
LOSS - 0.1273
ACC - 0.9600
PPV - ALL: 1.0000  COVID-19: 1.0000  PNEUMONIA: 1.0000  NORMAL: 1.0000 
RECALL - ALL: 1.0000  COVID-19: 1.0000  PNEUMONIA: 1.0000  NORMAL: 1.0000 
F1 - ALL: 1.0000  COVID-19: 1.0000  PNEUMONIA: 1.0000  NORMAL: 1.0000 
Mask ratio's range: 1.0 ~ 1.0

[val]
LOSS - 0.5714
ACC - 0.7867
PPV - ALL: 0.7977  COVID-19: 0.8163  PNEUMONIA: 0.7788  NORMAL: 0.7979 
RECALL - ALL: 0.7971  COVID-19: 0.8000  PNEUMONIA: 0.8100  NORMAL: 0.7812 
F1 - ALL: 0.7972  COVID-19: 0.8081  PNEUMONIA: 0.7941  NORMAL: 0.7895 

Epoch 4/19
----------
[train]
LOSS - 0.0579
ACC - 0.9600
PPV - ALL: 1.0000  COVID-19: 1.0000  PNEUMONIA: 1.0000  NORMAL: 1.0000 
RECALL - ALL: 1.0000  COVID-19: 1.0000  PNEUMONIA: 1.0000  NORMAL: 1.0000 
F1 - ALL: 1.0000  COVID-19: 1.0000  PNEUMONIA: 1.0000  NORMAL: 1.0000 
Mask ratio's range: 0.9375 ~ 1.0

[val]
LOSS - 0.5137
ACC - 0.8133
PPV - ALL: 0.8251  COVID-19: 0.8737  PNEUMONIA: 0.8058  NORMAL: 0.7959 
RECALL - ALL: 0.8242  COVID-19: 0.8300  PNEUMONIA: 0.8300  NORMAL: 0.8125 
F1 - ALL: 0.8244  COVID-19: 0.8513  PNEUMONIA: 0.8177  NORMAL: 0.8041 

Epoch 5/19
----------
[train]
LOSS - 0.0313
ACC - 0.9600
PPV - ALL: 1.0000  COVID-19: 1.0000  PNEUMONIA: 1.0000  NORMAL: 1.0000 
RECALL - ALL: 1.0000  COVID-19: 1.0000  PNEUMONIA: 1.0000  NORMAL: 1.0000 
F1 - ALL: 1.0000  COVID-19: 1.0000  PNEUMONIA: 1.0000  NORMAL: 1.0000 
Mask ratio's range: 0.9375 ~ 1.0

[val]
LOSS - 0.5157
ACC - 0.8067
PPV - ALL: 0.8177  COVID-19: 0.8571  PNEUMONIA: 0.7961  NORMAL: 0.8000 
RECALL - ALL: 0.8172  COVID-19: 0.8400  PNEUMONIA: 0.8200  NORMAL: 0.7917 
F1 - ALL: 0.8174  COVID-19: 0.8485  PNEUMONIA: 0.8079  NORMAL: 0.7958 

Epoch 6/19
----------
[train]
LOSS - 0.0218
ACC - 0.9600
PPV - ALL: 1.0000  COVID-19: 1.0000  PNEUMONIA: 1.0000  NORMAL: 1.0000 
RECALL - ALL: 1.0000  COVID-19: 1.0000  PNEUMONIA: 1.0000  NORMAL: 1.0000 
F1 - ALL: 1.0000  COVID-19: 1.0000  PNEUMONIA: 1.0000  NORMAL: 1.0000 
Mask ratio's range: 0.875 ~ 1.0

[val]
LOSS - 0.4895
ACC - 0.8100
PPV - ALL: 0.8206  COVID-19: 0.8416  PNEUMONIA: 0.8182  NORMAL: 0.8021 
RECALL - ALL: 0.8207  COVID-19: 0.8500  PNEUMONIA: 0.8100  NORMAL: 0.8021 
F1 - ALL: 0.8207  COVID-19: 0.8458  PNEUMONIA: 0.8141  NORMAL: 0.8021 

Epoch 7/19
----------
[train]
LOSS - 0.0287
ACC - 0.9600
PPV - ALL: 1.0000  COVID-19: 1.0000  PNEUMONIA: 1.0000  NORMAL: 1.0000 
RECALL - ALL: 1.0000  COVID-19: 1.0000  PNEUMONIA: 1.0000  NORMAL: 1.0000 
F1 - ALL: 1.0000  COVID-19: 1.0000  PNEUMONIA: 1.0000  NORMAL: 1.0000 
Mask ratio's range: 0.875 ~ 1.0

[val]
LOSS - 0.5015
ACC - 0.8000
PPV - ALL: 0.8111  COVID-19: 0.8454  PNEUMONIA: 0.7941  NORMAL: 0.7938 
RECALL - ALL: 0.8107  COVID-19: 0.8200  PNEUMONIA: 0.8100  NORMAL: 0.8021 
F1 - ALL: 0.8108  COVID-19: 0.8325  PNEUMONIA: 0.8020  NORMAL: 0.7979 

Epoch 8/19
----------
[train]
LOSS - 0.0594
ACC - 0.9600
PPV - ALL: 1.0000  COVID-19: 1.0000  PNEUMONIA: 1.0000  NORMAL: 1.0000 
RECALL - ALL: 1.0000  COVID-19: 1.0000  PNEUMONIA: 1.0000  NORMAL: 1.0000 
F1 - ALL: 1.0000  COVID-19: 1.0000  PNEUMONIA: 1.0000  NORMAL: 1.0000 
Mask ratio's range: 0.875 ~ 1.0

[val]
LOSS - 0.4914
ACC - 0.8067
PPV - ALL: 0.8199  COVID-19: 0.8791  PNEUMONIA: 0.7885  NORMAL: 0.7921 
RECALL - ALL: 0.8178  COVID-19: 0.8000  PNEUMONIA: 0.8200  NORMAL: 0.8333 
F1 - ALL: 0.8179  COVID-19: 0.8377  PNEUMONIA: 0.8039  NORMAL: 0.8122 

Epoch 9/19
----------
[train]
LOSS - 0.0465
ACC - 0.9600
PPV - ALL: 1.0000  COVID-19: 1.0000  PNEUMONIA: 1.0000  NORMAL: 1.0000 
RECALL - ALL: 1.0000  COVID-19: 1.0000  PNEUMONIA: 1.0000  NORMAL: 1.0000 
F1 - ALL: 1.0000  COVID-19: 1.0000  PNEUMONIA: 1.0000  NORMAL: 1.0000 
Mask ratio's range: 0.8125 ~ 1.0

[val]
LOSS - 0.4702
ACC - 0.8067
PPV - ALL: 0.8217  COVID-19: 0.8864  PNEUMONIA: 0.7727  NORMAL: 0.8061 
RECALL - ALL: 0.8176  COVID-19: 0.7800  PNEUMONIA: 0.8500  NORMAL: 0.8229 
F1 - ALL: 0.8179  COVID-19: 0.8298  PNEUMONIA: 0.8095  NORMAL: 0.8144 

Epoch 10/19
----------
[train]
LOSS - 0.1037
ACC - 0.9600
PPV - ALL: 1.0000  COVID-19: 1.0000  PNEUMONIA: 1.0000  NORMAL: 1.0000 
RECALL - ALL: 1.0000  COVID-19: 1.0000  PNEUMONIA: 1.0000  NORMAL: 1.0000 
F1 - ALL: 1.0000  COVID-19: 1.0000  PNEUMONIA: 1.0000  NORMAL: 1.0000 
Mask ratio's range: 0.8125 ~ 0.9375

[val]
LOSS - 0.4762
ACC - 0.8100
PPV - ALL: 0.8299  COVID-19: 0.9250  PNEUMONIA: 0.7838  NORMAL: 0.7810 
RECALL - ALL: 0.8214  COVID-19: 0.7400  PNEUMONIA: 0.8700  NORMAL: 0.8542 
F1 - ALL: 0.8210  COVID-19: 0.8222  PNEUMONIA: 0.8247  NORMAL: 0.8160 

Epoch 11/19
----------
[train]
LOSS - 0.0898
ACC - 0.9600
PPV - ALL: 1.0000  COVID-19: 1.0000  PNEUMONIA: 1.0000  NORMAL: 1.0000 
RECALL - ALL: 1.0000  COVID-19: 1.0000  PNEUMONIA: 1.0000  NORMAL: 1.0000 
F1 - ALL: 1.0000  COVID-19: 1.0000  PNEUMONIA: 1.0000  NORMAL: 1.0000 
Mask ratio's range: 0.6875 ~ 0.875

[val]
LOSS - 0.5313
ACC - 0.8167
PPV - ALL: 0.8361  COVID-19: 0.9259  PNEUMONIA: 0.8208  NORMAL: 0.7615 
RECALL - ALL: 0.8282  COVID-19: 0.7500  PNEUMONIA: 0.8700  NORMAL: 0.8646 
F1 - ALL: 0.8277  COVID-19: 0.8287  PNEUMONIA: 0.8447  NORMAL: 0.8098 

Epoch 12/19
----------
[train]
LOSS - 0.0868
ACC - 0.9600
PPV - ALL: 1.0000  COVID-19: 1.0000  PNEUMONIA: 1.0000  NORMAL: 1.0000 
RECALL - ALL: 1.0000  COVID-19: 1.0000  PNEUMONIA: 1.0000  NORMAL: 1.0000 
F1 - ALL: 1.0000  COVID-19: 1.0000  PNEUMONIA: 1.0000  NORMAL: 1.0000 
Mask ratio's range: 0.5625 ~ 0.75

[val]
LOSS - 0.5679
ACC - 0.7867
PPV - ALL: 0.8202  COVID-19: 0.9429  PNEUMONIA: 0.8218  NORMAL: 0.6960 
RECALL - ALL: 0.7987  COVID-19: 0.6600  PNEUMONIA: 0.8300  NORMAL: 0.9062 
F1 - ALL: 0.7966  COVID-19: 0.7765  PNEUMONIA: 0.8259  NORMAL: 0.7873 

Epoch 13/19
----------
[train]
LOSS - 0.0574
ACC - 0.9600
PPV - ALL: 1.0000  COVID-19: 1.0000  PNEUMONIA: 1.0000  NORMAL: 1.0000 
RECALL - ALL: 1.0000  COVID-19: 1.0000  PNEUMONIA: 1.0000  NORMAL: 1.0000 
F1 - ALL: 1.0000  COVID-19: 1.0000  PNEUMONIA: 1.0000  NORMAL: 1.0000 
Mask ratio's range: 0.4375 ~ 0.75

[val]
LOSS - 0.5667
ACC - 0.7867
PPV - ALL: 0.8150  COVID-19: 0.9200  PNEUMONIA: 0.8283  NORMAL: 0.6967 
RECALL - ALL: 0.7985  COVID-19: 0.6900  PNEUMONIA: 0.8200  NORMAL: 0.8854 
F1 - ALL: 0.7975  COVID-19: 0.7886  PNEUMONIA: 0.8241  NORMAL: 0.7798 

Epoch 14/19
----------
[train]
LOSS - 0.0545
ACC - 0.9600
PPV - ALL: 1.0000  COVID-19: 1.0000  PNEUMONIA: 1.0000  NORMAL: 1.0000 
RECALL - ALL: 1.0000  COVID-19: 1.0000  PNEUMONIA: 1.0000  NORMAL: 1.0000 
F1 - ALL: 1.0000  COVID-19: 1.0000  PNEUMONIA: 1.0000  NORMAL: 1.0000 
Mask ratio's range: 0.4375 ~ 0.75

[val]
LOSS - 0.5409
ACC - 0.8067
PPV - ALL: 0.8336  COVID-19: 0.9467  PNEUMONIA: 0.8252  NORMAL: 0.7288 
RECALL - ALL: 0.8186  COVID-19: 0.7100  PNEUMONIA: 0.8500  NORMAL: 0.8958 
F1 - ALL: 0.8175  COVID-19: 0.8114  PNEUMONIA: 0.8374  NORMAL: 0.8037 

Epoch 15/19
----------
[train]
LOSS - 0.0448
ACC - 0.9600
PPV - ALL: 1.0000  COVID-19: 1.0000  PNEUMONIA: 1.0000  NORMAL: 1.0000 
RECALL - ALL: 1.0000  COVID-19: 1.0000  PNEUMONIA: 1.0000  NORMAL: 1.0000 
F1 - ALL: 1.0000  COVID-19: 1.0000  PNEUMONIA: 1.0000  NORMAL: 1.0000 
Mask ratio's range: 0.4375 ~ 0.6875

[val]
LOSS - 0.5409
ACC - 0.8067
PPV - ALL: 0.8317  COVID-19: 0.9467  PNEUMONIA: 0.7963  NORMAL: 0.7522 
RECALL - ALL: 0.8185  COVID-19: 0.7100  PNEUMONIA: 0.8600  NORMAL: 0.8854 
F1 - ALL: 0.8172  COVID-19: 0.8114  PNEUMONIA: 0.8269  NORMAL: 0.8134 

Epoch 16/19
----------
[train]
LOSS - 0.0414
ACC - 0.9600
PPV - ALL: 1.0000  COVID-19: 1.0000  PNEUMONIA: 1.0000  NORMAL: 1.0000 
RECALL - ALL: 1.0000  COVID-19: 1.0000  PNEUMONIA: 1.0000  NORMAL: 1.0000 
F1 - ALL: 1.0000  COVID-19: 1.0000  PNEUMONIA: 1.0000  NORMAL: 1.0000 
Mask ratio's range: 0.375 ~ 0.6875

[val]
LOSS - 0.5667
ACC - 0.7933
PPV - ALL: 0.8212  COVID-19: 0.9437  PNEUMONIA: 0.7699  NORMAL: 0.7500 
RECALL - ALL: 0.8050  COVID-19: 0.6700  PNEUMONIA: 0.8700  NORMAL: 0.8750 
F1 - ALL: 0.8027  COVID-19: 0.7836  PNEUMONIA: 0.8169  NORMAL: 0.8077 

Epoch 17/19
----------
[train]
LOSS - 0.0458
ACC - 0.9600
PPV - ALL: 1.0000  COVID-19: 1.0000  PNEUMONIA: 1.0000  NORMAL: 1.0000 
RECALL - ALL: 1.0000  COVID-19: 1.0000  PNEUMONIA: 1.0000  NORMAL: 1.0000 
F1 - ALL: 1.0000  COVID-19: 1.0000  PNEUMONIA: 1.0000  NORMAL: 1.0000 
Mask ratio's range: 0.375 ~ 0.6875

[val]
LOSS - 0.5821
ACC - 0.7867
PPV - ALL: 0.8163  COVID-19: 0.9420  PNEUMONIA: 0.7679  NORMAL: 0.7391 
RECALL - ALL: 0.7985  COVID-19: 0.6500  PNEUMONIA: 0.8600  NORMAL: 0.8854 
F1 - ALL: 0.7954  COVID-19: 0.7692  PNEUMONIA: 0.8113  NORMAL: 0.8057 

Epoch 18/19
----------
[train]
LOSS - 0.0422
ACC - 0.9600
PPV - ALL: 1.0000  COVID-19: 1.0000  PNEUMONIA: 1.0000  NORMAL: 1.0000 
RECALL - ALL: 1.0000  COVID-19: 1.0000  PNEUMONIA: 1.0000  NORMAL: 1.0000 
F1 - ALL: 1.0000  COVID-19: 1.0000  PNEUMONIA: 1.0000  NORMAL: 1.0000 
Mask ratio's range: 0.375 ~ 0.625

[val]
LOSS - 0.6116
ACC - 0.7767
PPV - ALL: 0.8087  COVID-19: 0.9394  PNEUMONIA: 0.7500  NORMAL: 0.7368 
RECALL - ALL: 0.7883  COVID-19: 0.6200  PNEUMONIA: 0.8700  NORMAL: 0.8750 
F1 - ALL: 0.7842  COVID-19: 0.7470  PNEUMONIA: 0.8056  NORMAL: 0.8000 

Epoch 19/19
----------
[train]
LOSS - 0.0389
ACC - 0.9600
PPV - ALL: 1.0000  COVID-19: 1.0000  PNEUMONIA: 1.0000  NORMAL: 1.0000 
RECALL - ALL: 1.0000  COVID-19: 1.0000  PNEUMONIA: 1.0000  NORMAL: 1.0000 
F1 - ALL: 1.0000  COVID-19: 1.0000  PNEUMONIA: 1.0000  NORMAL: 1.0000 
Mask ratio's range: 0.3125 ~ 0.625

[val]
LOSS - 0.6242
ACC - 0.7733
PPV - ALL: 0.8072  COVID-19: 0.9375  PNEUMONIA: 0.7273  NORMAL: 0.7568 
RECALL - ALL: 0.7850  COVID-19: 0.6000  PNEUMONIA: 0.8800  NORMAL: 0.8750 
F1 - ALL: 0.7799  COVID-19: 0.7317  PNEUMONIA: 0.7964  NORMAL: 0.8116 


--------------------
[Best results]
ACC - 0.8167
PPV - ALL: 0.8361  COVID-19: 0.9259  PNEUMONIA: 0.8208  NORMAL: 0.7615 
RECALL - ALL: 0.8282  COVID-19: 0.7500  PNEUMONIA: 0.8700  NORMAL: 0.8646 
F1 - ALL: 0.8277  COVID-19: 0.8287  PNEUMONIA: 0.8447  NORMAL: 0.8098 

Training complete in 1m 33s
-------------------- 

--------------------
Model 2
--------------------

Epoch 0/19
----------
[train]
LOSS - 1.0009
ACC - 0.4933
PPV - ALL: 0.5258  COVID-19: 0.4074  PNEUMONIA: 0.6316  NORMAL: 0.5385 
RECALL - ALL: 0.5139  COVID-19: 0.4583  PNEUMONIA: 0.5000  NORMAL: 0.5833 
F1 - ALL: 0.5165  COVID-19: 0.4314  PNEUMONIA: 0.5581  NORMAL: 0.5600 
Mask ratio's range: 1.0 ~ 1.0

[val]
LOSS - 0.9602
ACC - 0.5867
PPV - ALL: 0.7252  COVID-19: 1.0000  PNEUMONIA: 0.5090  NORMAL: 0.6667 
RECALL - ALL: 0.5972  COVID-19: 0.1500  PNEUMONIA: 0.8500  NORMAL: 0.7917 
F1 - ALL: 0.5405  COVID-19: 0.2609  PNEUMONIA: 0.6367  NORMAL: 0.7238 

Epoch 1/19
----------
[train]
LOSS - 0.6710
ACC - 0.8800
PPV - ALL: 0.9193  COVID-19: 0.9524  PNEUMONIA: 0.9167  NORMAL: 0.8889 
RECALL - ALL: 0.9167  COVID-19: 0.8333  PNEUMONIA: 0.9167  NORMAL: 1.0000 
F1 - ALL: 0.9156  COVID-19: 0.8889  PNEUMONIA: 0.9167  NORMAL: 0.9412 
Mask ratio's range: 1.0 ~ 1.0

[val]
LOSS - 0.7636
ACC - 0.7733
PPV - ALL: 0.7907  COVID-19: 0.8000  PNEUMONIA: 0.7168  NORMAL: 0.8554 
RECALL - ALL: 0.7832  COVID-19: 0.8000  PNEUMONIA: 0.8100  NORMAL: 0.7396 
F1 - ALL: 0.7846  COVID-19: 0.8000  PNEUMONIA: 0.7606  NORMAL: 0.7933 

Epoch 2/19
----------
[train]
LOSS - 0.3237
ACC - 0.9600
PPV - ALL: 1.0000  COVID-19: 1.0000  PNEUMONIA: 1.0000  NORMAL: 1.0000 
RECALL - ALL: 1.0000  COVID-19: 1.0000  PNEUMONIA: 1.0000  NORMAL: 1.0000 
F1 - ALL: 1.0000  COVID-19: 1.0000  PNEUMONIA: 1.0000  NORMAL: 1.0000 
Mask ratio's range: 1.0 ~ 1.0

[val]
LOSS - 0.6256
ACC - 0.7800
PPV - ALL: 0.8048  COVID-19: 0.8734  PNEUMONIA: 0.7040  NORMAL: 0.8370 
RECALL - ALL: 0.7907  COVID-19: 0.6900  PNEUMONIA: 0.8800  NORMAL: 0.8021 
F1 - ALL: 0.7908  COVID-19: 0.7709  PNEUMONIA: 0.7822  NORMAL: 0.8192 

Epoch 3/19
----------
[train]
LOSS - 0.1188
ACC - 0.9600
PPV - ALL: 1.0000  COVID-19: 1.0000  PNEUMONIA: 1.0000  NORMAL: 1.0000 
RECALL - ALL: 1.0000  COVID-19: 1.0000  PNEUMONIA: 1.0000  NORMAL: 1.0000 
F1 - ALL: 1.0000  COVID-19: 1.0000  PNEUMONIA: 1.0000  NORMAL: 1.0000 
Mask ratio's range: 1.0 ~ 1.0

[val]
LOSS - 0.5434
ACC - 0.8000
PPV - ALL: 0.8130  COVID-19: 0.8200  PNEUMONIA: 0.7798  NORMAL: 0.8391 
RECALL - ALL: 0.8101  COVID-19: 0.8200  PNEUMONIA: 0.8500  NORMAL: 0.7604 
F1 - ALL: 0.8104  COVID-19: 0.8200  PNEUMONIA: 0.8134  NORMAL: 0.7978 

Epoch 4/19
----------
[train]
LOSS - 0.0480
ACC - 0.9600
PPV - ALL: 1.0000  COVID-19: 1.0000  PNEUMONIA: 1.0000  NORMAL: 1.0000 
RECALL - ALL: 1.0000  COVID-19: 1.0000  PNEUMONIA: 1.0000  NORMAL: 1.0000 
F1 - ALL: 1.0000  COVID-19: 1.0000  PNEUMONIA: 1.0000  NORMAL: 1.0000 
Mask ratio's range: 0.9375 ~ 1.0

[val]
LOSS - 0.5149
ACC - 0.7933
PPV - ALL: 0.8061  COVID-19: 0.8200  PNEUMONIA: 0.7706  NORMAL: 0.8276 
RECALL - ALL: 0.8033  COVID-19: 0.8200  PNEUMONIA: 0.8400  NORMAL: 0.7500 
F1 - ALL: 0.8036  COVID-19: 0.8200  PNEUMONIA: 0.8038  NORMAL: 0.7869 

Epoch 5/19
----------
[train]
LOSS - 0.0338
ACC - 0.9600
PPV - ALL: 1.0000  COVID-19: 1.0000  PNEUMONIA: 1.0000  NORMAL: 1.0000 
RECALL - ALL: 1.0000  COVID-19: 1.0000  PNEUMONIA: 1.0000  NORMAL: 1.0000 
F1 - ALL: 1.0000  COVID-19: 1.0000  PNEUMONIA: 1.0000  NORMAL: 1.0000 
Mask ratio's range: 0.875 ~ 1.0

[val]
LOSS - 0.5183
ACC - 0.7967
PPV - ALL: 0.8105  COVID-19: 0.8265  PNEUMONIA: 0.7658  NORMAL: 0.8391 
RECALL - ALL: 0.8068  COVID-19: 0.8100  PNEUMONIA: 0.8500  NORMAL: 0.7604 
F1 - ALL: 0.8072  COVID-19: 0.8182  PNEUMONIA: 0.8057  NORMAL: 0.7978 

Epoch 6/19
----------
[train]
LOSS - 0.0473
ACC - 0.9600
PPV - ALL: 1.0000  COVID-19: 1.0000  PNEUMONIA: 1.0000  NORMAL: 1.0000 
RECALL - ALL: 1.0000  COVID-19: 1.0000  PNEUMONIA: 1.0000  NORMAL: 1.0000 
F1 - ALL: 1.0000  COVID-19: 1.0000  PNEUMONIA: 1.0000  NORMAL: 1.0000 
Mask ratio's range: 0.8125 ~ 1.0

[val]
LOSS - 0.5469
ACC - 0.8000
PPV - ALL: 0.8147  COVID-19: 0.8421  PNEUMONIA: 0.7611  NORMAL: 0.8409 
RECALL - ALL: 0.8103  COVID-19: 0.8000  PNEUMONIA: 0.8600  NORMAL: 0.7708 
F1 - ALL: 0.8108  COVID-19: 0.8205  PNEUMONIA: 0.8075  NORMAL: 0.8043 

Epoch 7/19
----------
[train]
LOSS - 0.0622
ACC - 0.9600
PPV - ALL: 1.0000  COVID-19: 1.0000  PNEUMONIA: 1.0000  NORMAL: 1.0000 
RECALL - ALL: 1.0000  COVID-19: 1.0000  PNEUMONIA: 1.0000  NORMAL: 1.0000 
F1 - ALL: 1.0000  COVID-19: 1.0000  PNEUMONIA: 1.0000  NORMAL: 1.0000 
Mask ratio's range: 0.75 ~ 0.9375

[val]
LOSS - 0.5461
ACC - 0.7900
PPV - ALL: 0.8126  COVID-19: 0.8889  PNEUMONIA: 0.7190  NORMAL: 0.8298 
RECALL - ALL: 0.8008  COVID-19: 0.7200  PNEUMONIA: 0.8700  NORMAL: 0.8125 
F1 - ALL: 0.8013  COVID-19: 0.7956  PNEUMONIA: 0.7873  NORMAL: 0.8211 

Epoch 8/19
----------
[train]
LOSS - 0.0608
ACC - 0.9600
PPV - ALL: 1.0000  COVID-19: 1.0000  PNEUMONIA: 1.0000  NORMAL: 1.0000 
RECALL - ALL: 1.0000  COVID-19: 1.0000  PNEUMONIA: 1.0000  NORMAL: 1.0000 
F1 - ALL: 1.0000  COVID-19: 1.0000  PNEUMONIA: 1.0000  NORMAL: 1.0000 
Mask ratio's range: 0.6875 ~ 0.875

[val]
LOSS - 0.5239
ACC - 0.7900
PPV - ALL: 0.8168  COVID-19: 0.9333  PNEUMONIA: 0.7250  NORMAL: 0.7921 
RECALL - ALL: 0.8011  COVID-19: 0.7000  PNEUMONIA: 0.8700  NORMAL: 0.8333 
F1 - ALL: 0.8010  COVID-19: 0.8000  PNEUMONIA: 0.7909  NORMAL: 0.8122 

Epoch 9/19
----------
[train]
LOSS - 0.0824
ACC - 0.9600
PPV - ALL: 1.0000  COVID-19: 1.0000  PNEUMONIA: 1.0000  NORMAL: 1.0000 
RECALL - ALL: 1.0000  COVID-19: 1.0000  PNEUMONIA: 1.0000  NORMAL: 1.0000 
F1 - ALL: 1.0000  COVID-19: 1.0000  PNEUMONIA: 1.0000  NORMAL: 1.0000 
Mask ratio's range: 0.625 ~ 0.8125

[val]
LOSS - 0.6061
ACC - 0.7800
PPV - ALL: 0.8136  COVID-19: 0.9565  PNEUMONIA: 0.7107  NORMAL: 0.7736 
RECALL - ALL: 0.7914  COVID-19: 0.6600  PNEUMONIA: 0.8600  NORMAL: 0.8542 
F1 - ALL: 0.7904  COVID-19: 0.7811  PNEUMONIA: 0.7783  NORMAL: 0.8119 

Epoch 10/19
----------
[train]
LOSS - 0.0783
ACC - 0.9600
PPV - ALL: 1.0000  COVID-19: 1.0000  PNEUMONIA: 1.0000  NORMAL: 1.0000 
RECALL - ALL: 1.0000  COVID-19: 1.0000  PNEUMONIA: 1.0000  NORMAL: 1.0000 
F1 - ALL: 1.0000  COVID-19: 1.0000  PNEUMONIA: 1.0000  NORMAL: 1.0000 
Mask ratio's range: 0.5625 ~ 0.8125

[val]
LOSS - 0.5861
ACC - 0.7867
PPV - ALL: 0.8191  COVID-19: 0.9559  PNEUMONIA: 0.7288  NORMAL: 0.7727 
RECALL - ALL: 0.7985  COVID-19: 0.6500  PNEUMONIA: 0.8600  NORMAL: 0.8854 
F1 - ALL: 0.7960  COVID-19: 0.7738  PNEUMONIA: 0.7890  NORMAL: 0.8252 

Epoch 11/19
----------
[train]
LOSS - 0.0634
ACC - 0.9600
PPV - ALL: 1.0000  COVID-19: 1.0000  PNEUMONIA: 1.0000  NORMAL: 1.0000 
RECALL - ALL: 1.0000  COVID-19: 1.0000  PNEUMONIA: 1.0000  NORMAL: 1.0000 
F1 - ALL: 1.0000  COVID-19: 1.0000  PNEUMONIA: 1.0000  NORMAL: 1.0000 
Mask ratio's range: 0.5 ~ 0.75

[val]
LOSS - 0.6179
ACC - 0.7700
PPV - ALL: 0.8063  COVID-19: 0.9531  PNEUMONIA: 0.7203  NORMAL: 0.7456 
RECALL - ALL: 0.7818  COVID-19: 0.6100  PNEUMONIA: 0.8500  NORMAL: 0.8854 
F1 - ALL: 0.7777  COVID-19: 0.7439  PNEUMONIA: 0.7798  NORMAL: 0.8095 

Epoch 12/19
----------
[train]
LOSS - 0.0741
ACC - 0.9600
PPV - ALL: 1.0000  COVID-19: 1.0000  PNEUMONIA: 1.0000  NORMAL: 1.0000 
RECALL - ALL: 1.0000  COVID-19: 1.0000  PNEUMONIA: 1.0000  NORMAL: 1.0000 
F1 - ALL: 1.0000  COVID-19: 1.0000  PNEUMONIA: 1.0000  NORMAL: 1.0000 
Mask ratio's range: 0.5 ~ 0.8125

[val]
LOSS - 0.6232
ACC - 0.7767
PPV - ALL: 0.8193  COVID-19: 0.9836  PNEUMONIA: 0.7154  NORMAL: 0.7589 
RECALL - ALL: 0.7885  COVID-19: 0.6000  PNEUMONIA: 0.8800  NORMAL: 0.8854 
F1 - ALL: 0.7839  COVID-19: 0.7453  PNEUMONIA: 0.7892  NORMAL: 0.8173 

Epoch 13/19
----------
[train]
LOSS - 0.0613
ACC - 0.9600
PPV - ALL: 1.0000  COVID-19: 1.0000  PNEUMONIA: 1.0000  NORMAL: 1.0000 
RECALL - ALL: 1.0000  COVID-19: 1.0000  PNEUMONIA: 1.0000  NORMAL: 1.0000 
F1 - ALL: 1.0000  COVID-19: 1.0000  PNEUMONIA: 1.0000  NORMAL: 1.0000 
Mask ratio's range: 0.4375 ~ 0.75

[val]
LOSS - 0.6504
ACC - 0.7633
PPV - ALL: 0.8107  COVID-19: 0.9825  PNEUMONIA: 0.7040  NORMAL: 0.7456 
RECALL - ALL: 0.7751  COVID-19: 0.5600  PNEUMONIA: 0.8800  NORMAL: 0.8854 
F1 - ALL: 0.7684  COVID-19: 0.7134  PNEUMONIA: 0.7822  NORMAL: 0.8095 

Epoch 14/19
----------
[train]
LOSS - 0.0659
ACC - 0.9600
PPV - ALL: 1.0000  COVID-19: 1.0000  PNEUMONIA: 1.0000  NORMAL: 1.0000 
RECALL - ALL: 1.0000  COVID-19: 1.0000  PNEUMONIA: 1.0000  NORMAL: 1.0000 
F1 - ALL: 1.0000  COVID-19: 1.0000  PNEUMONIA: 1.0000  NORMAL: 1.0000 
Mask ratio's range: 0.4375 ~ 0.6875

[val]
LOSS - 0.6823
ACC - 0.7533
PPV - ALL: 0.8058  COVID-19: 0.9815  PNEUMONIA: 0.6769  NORMAL: 0.7589 
RECALL - ALL: 0.7651  COVID-19: 0.5300  PNEUMONIA: 0.8800  NORMAL: 0.8854 
F1 - ALL: 0.7569  COVID-19: 0.6883  PNEUMONIA: 0.7652  NORMAL: 0.8173 

Epoch 15/19
----------
[train]
LOSS - 0.0668
ACC - 0.9600
PPV - ALL: 1.0000  COVID-19: 1.0000  PNEUMONIA: 1.0000  NORMAL: 1.0000 
RECALL - ALL: 1.0000  COVID-19: 1.0000  PNEUMONIA: 1.0000  NORMAL: 1.0000 
F1 - ALL: 1.0000  COVID-19: 1.0000  PNEUMONIA: 1.0000  NORMAL: 1.0000 
Mask ratio's range: 0.375 ~ 0.6875

[val]
LOSS - 0.7298
ACC - 0.7300
PPV - ALL: 0.7970  COVID-19: 1.0000  PNEUMONIA: 0.6519  NORMAL: 0.7391 
RECALL - ALL: 0.7418  COVID-19: 0.4600  PNEUMONIA: 0.8800  NORMAL: 0.8854 
F1 - ALL: 0.7283  COVID-19: 0.6301  PNEUMONIA: 0.7490  NORMAL: 0.8057 

Epoch 16/19
----------
[train]
LOSS - 0.0424
ACC - 0.9600
PPV - ALL: 1.0000  COVID-19: 1.0000  PNEUMONIA: 1.0000  NORMAL: 1.0000 
RECALL - ALL: 1.0000  COVID-19: 1.0000  PNEUMONIA: 1.0000  NORMAL: 1.0000 
F1 - ALL: 1.0000  COVID-19: 1.0000  PNEUMONIA: 1.0000  NORMAL: 1.0000 
Mask ratio's range: 0.3125 ~ 0.6875

[val]
LOSS - 0.7587
ACC - 0.7167
PPV - ALL: 0.7898  COVID-19: 1.0000  PNEUMONIA: 0.6304  NORMAL: 0.7391 
RECALL - ALL: 0.7285  COVID-19: 0.4300  PNEUMONIA: 0.8700  NORMAL: 0.8854 
F1 - ALL: 0.7127  COVID-19: 0.6014  PNEUMONIA: 0.7311  NORMAL: 0.8057 

Epoch 17/19
----------
[train]
LOSS - 0.0398
ACC - 0.9600
PPV - ALL: 1.0000  COVID-19: 1.0000  PNEUMONIA: 1.0000  NORMAL: 1.0000 
RECALL - ALL: 1.0000  COVID-19: 1.0000  PNEUMONIA: 1.0000  NORMAL: 1.0000 
F1 - ALL: 1.0000  COVID-19: 1.0000  PNEUMONIA: 1.0000  NORMAL: 1.0000 
Mask ratio's range: 0.3125 ~ 0.625

[val]
LOSS - 0.7681
ACC - 0.7233
PPV - ALL: 0.7951  COVID-19: 1.0000  PNEUMONIA: 0.6331  NORMAL: 0.7522 
RECALL - ALL: 0.7351  COVID-19: 0.4400  PNEUMONIA: 0.8800  NORMAL: 0.8854 
F1 - ALL: 0.7203  COVID-19: 0.6111  PNEUMONIA: 0.7364  NORMAL: 0.8134 

Epoch 18/19
----------
[train]
LOSS - 0.0481
ACC - 0.9600
PPV - ALL: 1.0000  COVID-19: 1.0000  PNEUMONIA: 1.0000  NORMAL: 1.0000 
RECALL - ALL: 1.0000  COVID-19: 1.0000  PNEUMONIA: 1.0000  NORMAL: 1.0000 
F1 - ALL: 1.0000  COVID-19: 1.0000  PNEUMONIA: 1.0000  NORMAL: 1.0000 
Mask ratio's range: 0.3125 ~ 0.5625

[val]
LOSS - 0.7852
ACC - 0.7233
PPV - ALL: 0.7946  COVID-19: 1.0000  PNEUMONIA: 0.6423  NORMAL: 0.7414 
RECALL - ALL: 0.7353  COVID-19: 0.4300  PNEUMONIA: 0.8800  NORMAL: 0.8958 
F1 - ALL: 0.7184  COVID-19: 0.6014  PNEUMONIA: 0.7426  NORMAL: 0.8113 

Epoch 19/19
----------
[train]
LOSS - 0.0371
ACC - 0.9600
PPV - ALL: 1.0000  COVID-19: 1.0000  PNEUMONIA: 1.0000  NORMAL: 1.0000 
RECALL - ALL: 1.0000  COVID-19: 1.0000  PNEUMONIA: 1.0000  NORMAL: 1.0000 
F1 - ALL: 1.0000  COVID-19: 1.0000  PNEUMONIA: 1.0000  NORMAL: 1.0000 
Mask ratio's range: 0.3125 ~ 0.5625

[val]
LOSS - 0.7838
ACC - 0.7100
PPV - ALL: 0.7877  COVID-19: 1.0000  PNEUMONIA: 0.6241  NORMAL: 0.7391 
RECALL - ALL: 0.7218  COVID-19: 0.4000  PNEUMONIA: 0.8800  NORMAL: 0.8854 
F1 - ALL: 0.7025  COVID-19: 0.5714  PNEUMONIA: 0.7303  NORMAL: 0.8057 


--------------------
[Best results]
ACC - 0.8000
PPV - ALL: 0.8130  COVID-19: 0.8200  PNEUMONIA: 0.7798  NORMAL: 0.8391 
RECALL - ALL: 0.8101  COVID-19: 0.8200  PNEUMONIA: 0.8500  NORMAL: 0.7604 
F1 - ALL: 0.8104  COVID-19: 0.8200  PNEUMONIA: 0.8134  NORMAL: 0.7978 

Training complete in 1m 32s
-------------------- 

--------------------
Model 3
--------------------

Epoch 0/19
----------
[train]
LOSS - 1.0367
ACC - 0.4000
PPV - ALL: 0.4427  COVID-19: 0.3750  PNEUMONIA: 0.6111  NORMAL: 0.3421 
RECALL - ALL: 0.4167  COVID-19: 0.2500  PNEUMONIA: 0.4583  NORMAL: 0.5417 
F1 - ALL: 0.4144  COVID-19: 0.3000  PNEUMONIA: 0.5238  NORMAL: 0.4194 
Mask ratio's range: 1.0 ~ 1.0

[val]
LOSS - 1.0457
ACC - 0.4700
PPV - ALL: 0.3231  COVID-19: 0.0000  PNEUMONIA: 0.4592  NORMAL: 0.5100 
RECALL - ALL: 0.4771  COVID-19: 0.0000  PNEUMONIA: 0.9000  NORMAL: 0.5312 
F1 - ALL: 0.3762  COVID-19: 0.0000  PNEUMONIA: 0.6081  NORMAL: 0.5204 

Epoch 1/19
----------
[train]
LOSS - 0.6542
ACC - 0.8933
PPV - ALL: 0.9379  COVID-19: 1.0000  PNEUMONIA: 0.9565  NORMAL: 0.8571 
RECALL - ALL: 0.9306  COVID-19: 0.8750  PNEUMONIA: 0.9167  NORMAL: 1.0000 
F1 - ALL: 0.9309  COVID-19: 0.9333  PNEUMONIA: 0.9362  NORMAL: 0.9231 
Mask ratio's range: 1.0 ~ 1.0

[val]
LOSS - 0.7776
ACC - 0.7333
PPV - ALL: 0.7658  COVID-19: 0.8889  PNEUMONIA: 0.6967  NORMAL: 0.7117 
RECALL - ALL: 0.7443  COVID-19: 0.5600  PNEUMONIA: 0.8500  NORMAL: 0.8229 
F1 - ALL: 0.7387  COVID-19: 0.6871  PNEUMONIA: 0.7658  NORMAL: 0.7633 

Epoch 2/19
----------
[train]
LOSS - 0.2733
ACC - 0.9467
PPV - ALL: 0.9867  COVID-19: 1.0000  PNEUMONIA: 0.9600  NORMAL: 1.0000 
RECALL - ALL: 0.9861  COVID-19: 0.9583  PNEUMONIA: 1.0000  NORMAL: 1.0000 
F1 - ALL: 0.9861  COVID-19: 0.9787  PNEUMONIA: 0.9796  NORMAL: 1.0000 
Mask ratio's range: 1.0 ~ 1.0

[val]
LOSS - 0.6296
ACC - 0.7800
PPV - ALL: 0.8013  COVID-19: 0.8875  PNEUMONIA: 0.7227  NORMAL: 0.7938 
RECALL - ALL: 0.7907  COVID-19: 0.7100  PNEUMONIA: 0.8600  NORMAL: 0.8021 
F1 - ALL: 0.7907  COVID-19: 0.7889  PNEUMONIA: 0.7854  NORMAL: 0.7979 

Epoch 3/19
----------
[train]
LOSS - 0.1046
ACC - 0.9600
PPV - ALL: 1.0000  COVID-19: 1.0000  PNEUMONIA: 1.0000  NORMAL: 1.0000 
RECALL - ALL: 1.0000  COVID-19: 1.0000  PNEUMONIA: 1.0000  NORMAL: 1.0000 
F1 - ALL: 1.0000  COVID-19: 1.0000  PNEUMONIA: 1.0000  NORMAL: 1.0000 
Mask ratio's range: 1.0 ~ 1.0

[val]
LOSS - 0.5544
ACC - 0.7967
PPV - ALL: 0.8118  COVID-19: 0.8571  PNEUMONIA: 0.7522  NORMAL: 0.8261 
RECALL - ALL: 0.8072  COVID-19: 0.7800  PNEUMONIA: 0.8500  NORMAL: 0.7917 
F1 - ALL: 0.8078  COVID-19: 0.8167  PNEUMONIA: 0.7981  NORMAL: 0.8085 

Epoch 4/19
----------
[train]
LOSS - 0.0536
ACC - 0.9600
PPV - ALL: 1.0000  COVID-19: 1.0000  PNEUMONIA: 1.0000  NORMAL: 1.0000 
RECALL - ALL: 1.0000  COVID-19: 1.0000  PNEUMONIA: 1.0000  NORMAL: 1.0000 
F1 - ALL: 1.0000  COVID-19: 1.0000  PNEUMONIA: 1.0000  NORMAL: 1.0000 
Mask ratio's range: 0.9375 ~ 1.0

[val]
LOSS - 0.5152
ACC - 0.8067
PPV - ALL: 0.8202  COVID-19: 0.8469  PNEUMONIA: 0.7727  NORMAL: 0.8409 
RECALL - ALL: 0.8169  COVID-19: 0.8300  PNEUMONIA: 0.8500  NORMAL: 0.7708 
F1 - ALL: 0.8174  COVID-19: 0.8384  PNEUMONIA: 0.8095  NORMAL: 0.8043 

Epoch 5/19
----------
[train]
LOSS - 0.0494
ACC - 0.9600
PPV - ALL: 1.0000  COVID-19: 1.0000  PNEUMONIA: 1.0000  NORMAL: 1.0000 
RECALL - ALL: 1.0000  COVID-19: 1.0000  PNEUMONIA: 1.0000  NORMAL: 1.0000 
F1 - ALL: 1.0000  COVID-19: 1.0000  PNEUMONIA: 1.0000  NORMAL: 1.0000 
Mask ratio's range: 0.8125 ~ 1.0

[val]
LOSS - 0.5047
ACC - 0.8000
PPV - ALL: 0.8160  COVID-19: 0.8851  PNEUMONIA: 0.7589  NORMAL: 0.8041 
RECALL - ALL: 0.8108  COVID-19: 0.7700  PNEUMONIA: 0.8500  NORMAL: 0.8125 
F1 - ALL: 0.8112  COVID-19: 0.8235  PNEUMONIA: 0.8019  NORMAL: 0.8083 

Epoch 6/19
----------
[train]
LOSS - 0.0551
ACC - 0.9600
PPV - ALL: 1.0000  COVID-19: 1.0000  PNEUMONIA: 1.0000  NORMAL: 1.0000 
RECALL - ALL: 1.0000  COVID-19: 1.0000  PNEUMONIA: 1.0000  NORMAL: 1.0000 
F1 - ALL: 1.0000  COVID-19: 1.0000  PNEUMONIA: 1.0000  NORMAL: 1.0000 
Mask ratio's range: 0.75 ~ 1.0

[val]
LOSS - 0.4946
ACC - 0.8067
PPV - ALL: 0.8225  COVID-19: 0.8876  PNEUMONIA: 0.7589  NORMAL: 0.8211 
RECALL - ALL: 0.8175  COVID-19: 0.7900  PNEUMONIA: 0.8500  NORMAL: 0.8125 
F1 - ALL: 0.8182  COVID-19: 0.8360  PNEUMONIA: 0.8019  NORMAL: 0.8168 

Epoch 7/19
----------
[train]
LOSS - 0.0683
ACC - 0.9600
PPV - ALL: 1.0000  COVID-19: 1.0000  PNEUMONIA: 1.0000  NORMAL: 1.0000 
RECALL - ALL: 1.0000  COVID-19: 1.0000  PNEUMONIA: 1.0000  NORMAL: 1.0000 
F1 - ALL: 1.0000  COVID-19: 1.0000  PNEUMONIA: 1.0000  NORMAL: 1.0000 
Mask ratio's range: 0.625 ~ 0.9375

[val]
LOSS - 0.5373
ACC - 0.8100
PPV - ALL: 0.8269  COVID-19: 0.9059  PNEUMONIA: 0.7748  NORMAL: 0.8000 
RECALL - ALL: 0.8211  COVID-19: 0.7700  PNEUMONIA: 0.8600  NORMAL: 0.8333 
F1 - ALL: 0.8213  COVID-19: 0.8324  PNEUMONIA: 0.8152  NORMAL: 0.8163 

Epoch 8/19
----------
[train]
LOSS - 0.0562
ACC - 0.9600
PPV - ALL: 1.0000  COVID-19: 1.0000  PNEUMONIA: 1.0000  NORMAL: 1.0000 
RECALL - ALL: 1.0000  COVID-19: 1.0000  PNEUMONIA: 1.0000  NORMAL: 1.0000 
F1 - ALL: 1.0000  COVID-19: 1.0000  PNEUMONIA: 1.0000  NORMAL: 1.0000 
Mask ratio's range: 0.625 ~ 0.9375

[val]
LOSS - 0.5260
ACC - 0.8033
PPV - ALL: 0.8261  COVID-19: 0.9351  PNEUMONIA: 0.7719  NORMAL: 0.7714 
RECALL - ALL: 0.8146  COVID-19: 0.7200  PNEUMONIA: 0.8800  NORMAL: 0.8438 
F1 - ALL: 0.8140  COVID-19: 0.8136  PNEUMONIA: 0.8224  NORMAL: 0.8060 

Epoch 9/19
----------
[train]
LOSS - 0.0976
ACC - 0.9600
PPV - ALL: 1.0000  COVID-19: 1.0000  PNEUMONIA: 1.0000  NORMAL: 1.0000 
RECALL - ALL: 1.0000  COVID-19: 1.0000  PNEUMONIA: 1.0000  NORMAL: 1.0000 
F1 - ALL: 1.0000  COVID-19: 1.0000  PNEUMONIA: 1.0000  NORMAL: 1.0000 
Mask ratio's range: 0.5 ~ 0.875

[val]
LOSS - 0.5848
ACC - 0.7900
PPV - ALL: 0.8188  COVID-19: 0.9437  PNEUMONIA: 0.7909  NORMAL: 0.7217 
RECALL - ALL: 0.8015  COVID-19: 0.6700  PNEUMONIA: 0.8700  NORMAL: 0.8646 
F1 - ALL: 0.7996  COVID-19: 0.7836  PNEUMONIA: 0.8286  NORMAL: 0.7867 

Epoch 10/19
----------
[train]
LOSS - 0.0669
ACC - 0.9600
PPV - ALL: 1.0000  COVID-19: 1.0000  PNEUMONIA: 1.0000  NORMAL: 1.0000 
RECALL - ALL: 1.0000  COVID-19: 1.0000  PNEUMONIA: 1.0000  NORMAL: 1.0000 
F1 - ALL: 1.0000  COVID-19: 1.0000  PNEUMONIA: 1.0000  NORMAL: 1.0000 
Mask ratio's range: 0.5 ~ 0.8125

[val]
LOSS - 0.5878
ACC - 0.7800
PPV - ALL: 0.8105  COVID-19: 0.9429  PNEUMONIA: 0.7818  NORMAL: 0.7069 
RECALL - ALL: 0.7914  COVID-19: 0.6600  PNEUMONIA: 0.8600  NORMAL: 0.8542 
F1 - ALL: 0.7897  COVID-19: 0.7765  PNEUMONIA: 0.8190  NORMAL: 0.7736 

Epoch 11/19
----------
[train]
LOSS - 0.0731
ACC - 0.9600
PPV - ALL: 1.0000  COVID-19: 1.0000  PNEUMONIA: 1.0000  NORMAL: 1.0000 
RECALL - ALL: 1.0000  COVID-19: 1.0000  PNEUMONIA: 1.0000  NORMAL: 1.0000 
F1 - ALL: 1.0000  COVID-19: 1.0000  PNEUMONIA: 1.0000  NORMAL: 1.0000 
Mask ratio's range: 0.5 ~ 0.75

[val]
LOSS - 0.6694
ACC - 0.7800
PPV - ALL: 0.8106  COVID-19: 0.9420  PNEUMONIA: 0.7768  NORMAL: 0.7130 
RECALL - ALL: 0.7914  COVID-19: 0.6500  PNEUMONIA: 0.8700  NORMAL: 0.8542 
F1 - ALL: 0.7891  COVID-19: 0.7692  PNEUMONIA: 0.8208  NORMAL: 0.7772 

Epoch 12/19
----------
[train]
LOSS - 0.0776
ACC - 0.9600
PPV - ALL: 1.0000  COVID-19: 1.0000  PNEUMONIA: 1.0000  NORMAL: 1.0000 
RECALL - ALL: 1.0000  COVID-19: 1.0000  PNEUMONIA: 1.0000  NORMAL: 1.0000 
F1 - ALL: 1.0000  COVID-19: 1.0000  PNEUMONIA: 1.0000  NORMAL: 1.0000 
Mask ratio's range: 0.5 ~ 0.75

[val]
LOSS - 0.6272
ACC - 0.7833
PPV - ALL: 0.8152  COVID-19: 0.9565  PNEUMONIA: 0.7699  NORMAL: 0.7193 
RECALL - ALL: 0.7947  COVID-19: 0.6600  PNEUMONIA: 0.8700  NORMAL: 0.8542 
F1 - ALL: 0.7930  COVID-19: 0.7811  PNEUMONIA: 0.8169  NORMAL: 0.7810 

Epoch 13/19
----------
[train]
LOSS - 0.0731
ACC - 0.9600
PPV - ALL: 1.0000  COVID-19: 1.0000  PNEUMONIA: 1.0000  NORMAL: 1.0000 
RECALL - ALL: 1.0000  COVID-19: 1.0000  PNEUMONIA: 1.0000  NORMAL: 1.0000 
F1 - ALL: 1.0000  COVID-19: 1.0000  PNEUMONIA: 1.0000  NORMAL: 1.0000 
Mask ratio's range: 0.4375 ~ 0.75

[val]
LOSS - 0.6240
ACC - 0.7867
PPV - ALL: 0.8210  COVID-19: 0.9706  PNEUMONIA: 0.7768  NORMAL: 0.7155 
RECALL - ALL: 0.7982  COVID-19: 0.6600  PNEUMONIA: 0.8700  NORMAL: 0.8646 
F1 - ALL: 0.7965  COVID-19: 0.7857  PNEUMONIA: 0.8208  NORMAL: 0.7830 

Epoch 14/19
----------
[train]
LOSS - 0.0604
ACC - 0.9600
PPV - ALL: 1.0000  COVID-19: 1.0000  PNEUMONIA: 1.0000  NORMAL: 1.0000 
RECALL - ALL: 1.0000  COVID-19: 1.0000  PNEUMONIA: 1.0000  NORMAL: 1.0000 
F1 - ALL: 1.0000  COVID-19: 1.0000  PNEUMONIA: 1.0000  NORMAL: 1.0000 
Mask ratio's range: 0.375 ~ 0.75

[val]
LOSS - 0.6598
ACC - 0.7767
PPV - ALL: 0.8152  COVID-19: 0.9688  PNEUMONIA: 0.7768  NORMAL: 0.7000 
RECALL - ALL: 0.7883  COVID-19: 0.6200  PNEUMONIA: 0.8700  NORMAL: 0.8750 
F1 - ALL: 0.7849  COVID-19: 0.7561  PNEUMONIA: 0.8208  NORMAL: 0.7778 

Epoch 15/19
----------
[train]
LOSS - 0.0557
ACC - 0.9600
PPV - ALL: 1.0000  COVID-19: 1.0000  PNEUMONIA: 1.0000  NORMAL: 1.0000 
RECALL - ALL: 1.0000  COVID-19: 1.0000  PNEUMONIA: 1.0000  NORMAL: 1.0000 
F1 - ALL: 1.0000  COVID-19: 1.0000  PNEUMONIA: 1.0000  NORMAL: 1.0000 
Mask ratio's range: 0.375 ~ 0.75

[val]
LOSS - 0.6691
ACC - 0.7667
PPV - ALL: 0.8095  COVID-19: 0.9672  PNEUMONIA: 0.7838  NORMAL: 0.6774 
RECALL - ALL: 0.7783  COVID-19: 0.5900  PNEUMONIA: 0.8700  NORMAL: 0.8750 
F1 - ALL: 0.7737  COVID-19: 0.7329  PNEUMONIA: 0.8247  NORMAL: 0.7636 

Epoch 16/19
----------
[train]
LOSS - 0.0598
ACC - 0.9600
PPV - ALL: 1.0000  COVID-19: 1.0000  PNEUMONIA: 1.0000  NORMAL: 1.0000 
RECALL - ALL: 1.0000  COVID-19: 1.0000  PNEUMONIA: 1.0000  NORMAL: 1.0000 
F1 - ALL: 1.0000  COVID-19: 1.0000  PNEUMONIA: 1.0000  NORMAL: 1.0000 
Mask ratio's range: 0.375 ~ 0.75

[val]
LOSS - 0.7072
ACC - 0.7667
PPV - ALL: 0.8133  COVID-19: 0.9831  PNEUMONIA: 0.7768  NORMAL: 0.6800 
RECALL - ALL: 0.7785  COVID-19: 0.5800  PNEUMONIA: 0.8700  NORMAL: 0.8854 
F1 - ALL: 0.7732  COVID-19: 0.7296  PNEUMONIA: 0.8208  NORMAL: 0.7692 

Epoch 17/19
----------
[train]
LOSS - 0.0441
ACC - 0.9600
PPV - ALL: 1.0000  COVID-19: 1.0000  PNEUMONIA: 1.0000  NORMAL: 1.0000 
RECALL - ALL: 1.0000  COVID-19: 1.0000  PNEUMONIA: 1.0000  NORMAL: 1.0000 
F1 - ALL: 1.0000  COVID-19: 1.0000  PNEUMONIA: 1.0000  NORMAL: 1.0000 
Mask ratio's range: 0.375 ~ 0.75

[val]
LOSS - 0.7393
ACC - 0.7767
PPV - ALL: 0.8186  COVID-19: 0.9677  PNEUMONIA: 0.8056  NORMAL: 0.6825 
RECALL - ALL: 0.7886  COVID-19: 0.6000  PNEUMONIA: 0.8700  NORMAL: 0.8958 
F1 - ALL: 0.7840  COVID-19: 0.7407  PNEUMONIA: 0.8366  NORMAL: 0.7747 

Epoch 18/19
----------
[train]
LOSS - 0.0388
ACC - 0.9600
PPV - ALL: 1.0000  COVID-19: 1.0000  PNEUMONIA: 1.0000  NORMAL: 1.0000 
RECALL - ALL: 1.0000  COVID-19: 1.0000  PNEUMONIA: 1.0000  NORMAL: 1.0000 
F1 - ALL: 1.0000  COVID-19: 1.0000  PNEUMONIA: 1.0000  NORMAL: 1.0000 
Mask ratio's range: 0.375 ~ 0.6875

[val]
LOSS - 0.6665
ACC - 0.7733
PPV - ALL: 0.8170  COVID-19: 0.9677  PNEUMONIA: 0.8113  NORMAL: 0.6719 
RECALL - ALL: 0.7853  COVID-19: 0.6000  PNEUMONIA: 0.8600  NORMAL: 0.8958 
F1 - ALL: 0.7812  COVID-19: 0.7407  PNEUMONIA: 0.8349  NORMAL: 0.7679 

Epoch 19/19
----------
[train]
LOSS - 0.0445
ACC - 0.9600
PPV - ALL: 1.0000  COVID-19: 1.0000  PNEUMONIA: 1.0000  NORMAL: 1.0000 
RECALL - ALL: 1.0000  COVID-19: 1.0000  PNEUMONIA: 1.0000  NORMAL: 1.0000 
F1 - ALL: 1.0000  COVID-19: 1.0000  PNEUMONIA: 1.0000  NORMAL: 1.0000 
Mask ratio's range: 0.3125 ~ 0.6875

[val]
LOSS - 0.6598
ACC - 0.7767
PPV - ALL: 0.8233  COVID-19: 0.9833  PNEUMONIA: 0.8148  NORMAL: 0.6719 
RECALL - ALL: 0.7886  COVID-19: 0.5900  PNEUMONIA: 0.8800  NORMAL: 0.8958 
F1 - ALL: 0.7838  COVID-19: 0.7375  PNEUMONIA: 0.8461  NORMAL: 0.7679 


--------------------
[Best results]
ACC - 0.8100
PPV - ALL: 0.8269  COVID-19: 0.9059  PNEUMONIA: 0.7748  NORMAL: 0.8000 
RECALL - ALL: 0.8211  COVID-19: 0.7700  PNEUMONIA: 0.8600  NORMAL: 0.8333 
F1 - ALL: 0.8213  COVID-19: 0.8324  PNEUMONIA: 0.8152  NORMAL: 0.8163 

Training complete in 1m 30s
-------------------- 

--------------------
Model 4
--------------------

Epoch 0/19
----------
[train]
LOSS - 0.9908
ACC - 0.4400
PPV - ALL: 0.4673  COVID-19: 0.5333  PNEUMONIA: 0.4211  NORMAL: 0.4474 
RECALL - ALL: 0.4583  COVID-19: 0.3333  PNEUMONIA: 0.3333  NORMAL: 0.7083 
F1 - ALL: 0.4436  COVID-19: 0.4102  PNEUMONIA: 0.3721  NORMAL: 0.5484 
Mask ratio's range: 1.0 ~ 1.0

[val]
LOSS - 0.9554
ACC - 0.5900
PPV - ALL: 0.7147  COVID-19: 0.8571  PNEUMONIA: 0.4688  NORMAL: 0.8182 
RECALL - ALL: 0.5963  COVID-19: 0.4200  PNEUMONIA: 0.9000  NORMAL: 0.4688 
F1 - ALL: 0.5921  COVID-19: 0.5637  PNEUMONIA: 0.6165  NORMAL: 0.5961 

Epoch 1/19
----------
[train]
LOSS - 0.6054
ACC - 0.9200
PPV - ALL: 0.9599  COVID-19: 1.0000  PNEUMONIA: 0.9565  NORMAL: 0.9231 
RECALL - ALL: 0.9583  COVID-19: 0.9583  PNEUMONIA: 0.9167  NORMAL: 1.0000 
F1 - ALL: 0.9583  COVID-19: 0.9787  PNEUMONIA: 0.9362  NORMAL: 0.9600 
Mask ratio's range: 1.0 ~ 1.0

[val]
LOSS - 0.7584
ACC - 0.7267
PPV - ALL: 0.7512  COVID-19: 0.8406  PNEUMONIA: 0.6723  NORMAL: 0.7407 
RECALL - ALL: 0.7378  COVID-19: 0.5800  PNEUMONIA: 0.8000  NORMAL: 0.8333 
F1 - ALL: 0.7338  COVID-19: 0.6864  PNEUMONIA: 0.7306  NORMAL: 0.7843 

Epoch 2/19
----------
[train]
LOSS - 0.2426
ACC - 0.9600
PPV - ALL: 1.0000  COVID-19: 1.0000  PNEUMONIA: 1.0000  NORMAL: 1.0000 
RECALL - ALL: 1.0000  COVID-19: 1.0000  PNEUMONIA: 1.0000  NORMAL: 1.0000 
F1 - ALL: 1.0000  COVID-19: 1.0000  PNEUMONIA: 1.0000  NORMAL: 1.0000 
Mask ratio's range: 1.0 ~ 1.0

[val]
LOSS - 0.6343
ACC - 0.7467
PPV - ALL: 0.7787  COVID-19: 0.8421  PNEUMONIA: 0.6567  NORMAL: 0.8372 
RECALL - ALL: 0.7567  COVID-19: 0.6400  PNEUMONIA: 0.8800  NORMAL: 0.7500 
F1 - ALL: 0.7569  COVID-19: 0.7273  PNEUMONIA: 0.7521  NORMAL: 0.7912 

Epoch 3/19
----------
[train]
LOSS - 0.0907
ACC - 0.9600
PPV - ALL: 1.0000  COVID-19: 1.0000  PNEUMONIA: 1.0000  NORMAL: 1.0000 
RECALL - ALL: 1.0000  COVID-19: 1.0000  PNEUMONIA: 1.0000  NORMAL: 1.0000 
F1 - ALL: 1.0000  COVID-19: 1.0000  PNEUMONIA: 1.0000  NORMAL: 1.0000 
Mask ratio's range: 0.9375 ~ 1.0

[val]
LOSS - 0.5560
ACC - 0.7700
PPV - ALL: 0.7872  COVID-19: 0.8293  PNEUMONIA: 0.7179  NORMAL: 0.8144 
RECALL - ALL: 0.7810  COVID-19: 0.6800  PNEUMONIA: 0.8400  NORMAL: 0.8229 
F1 - ALL: 0.7800  COVID-19: 0.7473  PNEUMONIA: 0.7742  NORMAL: 0.8186 

Epoch 4/19
----------
[train]
LOSS - 0.0479
ACC - 0.9600
PPV - ALL: 1.0000  COVID-19: 1.0000  PNEUMONIA: 1.0000  NORMAL: 1.0000 
RECALL - ALL: 1.0000  COVID-19: 1.0000  PNEUMONIA: 1.0000  NORMAL: 1.0000 
F1 - ALL: 1.0000  COVID-19: 1.0000  PNEUMONIA: 1.0000  NORMAL: 1.0000 
Mask ratio's range: 0.9375 ~ 1.0

[val]
LOSS - 0.5392
ACC - 0.7667
PPV - ALL: 0.7853  COVID-19: 0.8214  PNEUMONIA: 0.7083  NORMAL: 0.8261 
RECALL - ALL: 0.7772  COVID-19: 0.6900  PNEUMONIA: 0.8500  NORMAL: 0.7917 
F1 - ALL: 0.7771  COVID-19: 0.7500  PNEUMONIA: 0.7727  NORMAL: 0.8085 

Epoch 5/19
----------
[train]
LOSS - 0.0518
ACC - 0.9600
PPV - ALL: 1.0000  COVID-19: 1.0000  PNEUMONIA: 1.0000  NORMAL: 1.0000 
RECALL - ALL: 1.0000  COVID-19: 1.0000  PNEUMONIA: 1.0000  NORMAL: 1.0000 
F1 - ALL: 1.0000  COVID-19: 1.0000  PNEUMONIA: 1.0000  NORMAL: 1.0000 
Mask ratio's range: 0.875 ~ 1.0

[val]
LOSS - 0.5763
ACC - 0.7700
PPV - ALL: 0.7866  COVID-19: 0.8140  PNEUMONIA: 0.7179  NORMAL: 0.8280 
RECALL - ALL: 0.7807  COVID-19: 0.7000  PNEUMONIA: 0.8400  NORMAL: 0.8021 
F1 - ALL: 0.7806  COVID-19: 0.7527  PNEUMONIA: 0.7742  NORMAL: 0.8148 

Epoch 6/19
----------
[train]
LOSS - 0.0360
ACC - 0.9600
PPV - ALL: 1.0000  COVID-19: 1.0000  PNEUMONIA: 1.0000  NORMAL: 1.0000 
RECALL - ALL: 1.0000  COVID-19: 1.0000  PNEUMONIA: 1.0000  NORMAL: 1.0000 
F1 - ALL: 1.0000  COVID-19: 1.0000  PNEUMONIA: 1.0000  NORMAL: 1.0000 
Mask ratio's range: 0.875 ~ 1.0

[val]
LOSS - 0.5161
ACC - 0.7700
PPV - ALL: 0.7836  COVID-19: 0.8000  PNEUMONIA: 0.7297  NORMAL: 0.8211 
RECALL - ALL: 0.7808  COVID-19: 0.7200  PNEUMONIA: 0.8100  NORMAL: 0.8125 
F1 - ALL: 0.7808  COVID-19: 0.7579  PNEUMONIA: 0.7678  NORMAL: 0.8168 

Epoch 7/19
----------
[train]
LOSS - 0.0441
ACC - 0.9600
PPV - ALL: 1.0000  COVID-19: 1.0000  PNEUMONIA: 1.0000  NORMAL: 1.0000 
RECALL - ALL: 1.0000  COVID-19: 1.0000  PNEUMONIA: 1.0000  NORMAL: 1.0000 
F1 - ALL: 1.0000  COVID-19: 1.0000  PNEUMONIA: 1.0000  NORMAL: 1.0000 
Mask ratio's range: 0.875 ~ 1.0

[val]
LOSS - 0.5410
ACC - 0.7767
PPV - ALL: 0.7898  COVID-19: 0.8140  PNEUMONIA: 0.7455  NORMAL: 0.8100 
RECALL - ALL: 0.7879  COVID-19: 0.7000  PNEUMONIA: 0.8200  NORMAL: 0.8438 
F1 - ALL: 0.7868  COVID-19: 0.7527  PNEUMONIA: 0.7810  NORMAL: 0.8266 

Epoch 8/19
----------
[train]
LOSS - 0.0504
ACC - 0.9600
PPV - ALL: 1.0000  COVID-19: 1.0000  PNEUMONIA: 1.0000  NORMAL: 1.0000 
RECALL - ALL: 1.0000  COVID-19: 1.0000  PNEUMONIA: 1.0000  NORMAL: 1.0000 
F1 - ALL: 1.0000  COVID-19: 1.0000  PNEUMONIA: 1.0000  NORMAL: 1.0000 
Mask ratio's range: 0.75 ~ 0.9375

[val]
LOSS - 0.5475
ACC - 0.7667
PPV - ALL: 0.7801  COVID-19: 0.8171  PNEUMONIA: 0.7547  NORMAL: 0.7685 
RECALL - ALL: 0.7782  COVID-19: 0.6700  PNEUMONIA: 0.8000  NORMAL: 0.8646 
F1 - ALL: 0.7756  COVID-19: 0.7363  PNEUMONIA: 0.7767  NORMAL: 0.8137 

Epoch 9/19
----------
[train]
LOSS - 0.0401
ACC - 0.9600
PPV - ALL: 1.0000  COVID-19: 1.0000  PNEUMONIA: 1.0000  NORMAL: 1.0000 
RECALL - ALL: 1.0000  COVID-19: 1.0000  PNEUMONIA: 1.0000  NORMAL: 1.0000 
F1 - ALL: 1.0000  COVID-19: 1.0000  PNEUMONIA: 1.0000  NORMAL: 1.0000 
Mask ratio's range: 0.75 ~ 0.875

[val]
LOSS - 0.5440
ACC - 0.7600
PPV - ALL: 0.7740  COVID-19: 0.8101  PNEUMONIA: 0.7596  NORMAL: 0.7522 
RECALL - ALL: 0.7718  COVID-19: 0.6400  PNEUMONIA: 0.7900  NORMAL: 0.8854 
F1 - ALL: 0.7677  COVID-19: 0.7151  PNEUMONIA: 0.7745  NORMAL: 0.8134 

Epoch 10/19
----------
[train]
LOSS - 0.0539
ACC - 0.9600
PPV - ALL: 1.0000  COVID-19: 1.0000  PNEUMONIA: 1.0000  NORMAL: 1.0000 
RECALL - ALL: 1.0000  COVID-19: 1.0000  PNEUMONIA: 1.0000  NORMAL: 1.0000 
F1 - ALL: 1.0000  COVID-19: 1.0000  PNEUMONIA: 1.0000  NORMAL: 1.0000 
Mask ratio's range: 0.6875 ~ 0.8125

[val]
LOSS - 0.5735
ACC - 0.7600
PPV - ALL: 0.7783  COVID-19: 0.8356  PNEUMONIA: 0.7619  NORMAL: 0.7373 
RECALL - ALL: 0.7721  COVID-19: 0.6100  PNEUMONIA: 0.8000  NORMAL: 0.9062 
F1 - ALL: 0.7663  COVID-19: 0.7052  PNEUMONIA: 0.7805  NORMAL: 0.8131 

Epoch 11/19
----------
[train]
LOSS - 0.0677
ACC - 0.9600
PPV - ALL: 1.0000  COVID-19: 1.0000  PNEUMONIA: 1.0000  NORMAL: 1.0000 
RECALL - ALL: 1.0000  COVID-19: 1.0000  PNEUMONIA: 1.0000  NORMAL: 1.0000 
F1 - ALL: 1.0000  COVID-19: 1.0000  PNEUMONIA: 1.0000  NORMAL: 1.0000 
Mask ratio's range: 0.625 ~ 0.8125

[val]
LOSS - 0.6151
ACC - 0.7567
PPV - ALL: 0.7804  COVID-19: 0.8592  PNEUMONIA: 0.7700  NORMAL: 0.7120 
RECALL - ALL: 0.7690  COVID-19: 0.6100  PNEUMONIA: 0.7700  NORMAL: 0.9271 
F1 - ALL: 0.7630  COVID-19: 0.7135  PNEUMONIA: 0.7700  NORMAL: 0.8054 

Epoch 12/19
----------
[train]
LOSS - 0.0480
ACC - 0.9600
PPV - ALL: 1.0000  COVID-19: 1.0000  PNEUMONIA: 1.0000  NORMAL: 1.0000 
RECALL - ALL: 1.0000  COVID-19: 1.0000  PNEUMONIA: 1.0000  NORMAL: 1.0000 
F1 - ALL: 1.0000  COVID-19: 1.0000  PNEUMONIA: 1.0000  NORMAL: 1.0000 
Mask ratio's range: 0.5625 ~ 0.75

[val]
LOSS - 0.6345
ACC - 0.7433
PPV - ALL: 0.7664  COVID-19: 0.8429  PNEUMONIA: 0.7500  NORMAL: 0.7063 
RECALL - ALL: 0.7557  COVID-19: 0.5900  PNEUMONIA: 0.7500  NORMAL: 0.9271 
F1 - ALL: 0.7486  COVID-19: 0.6941  PNEUMONIA: 0.7500  NORMAL: 0.8018 

Epoch 13/19
----------
[train]
LOSS - 0.0422
ACC - 0.9600
PPV - ALL: 1.0000  COVID-19: 1.0000  PNEUMONIA: 1.0000  NORMAL: 1.0000 
RECALL - ALL: 1.0000  COVID-19: 1.0000  PNEUMONIA: 1.0000  NORMAL: 1.0000 
F1 - ALL: 1.0000  COVID-19: 1.0000  PNEUMONIA: 1.0000  NORMAL: 1.0000 
Mask ratio's range: 0.5625 ~ 0.75

[val]
LOSS - 0.6210
ACC - 0.7533
PPV - ALL: 0.7814  COVID-19: 0.8806  PNEUMONIA: 0.7596  NORMAL: 0.7040 
RECALL - ALL: 0.7656  COVID-19: 0.5900  PNEUMONIA: 0.7900  NORMAL: 0.9167 
F1 - ALL: 0.7592  COVID-19: 0.7066  PNEUMONIA: 0.7745  NORMAL: 0.7964 

Epoch 14/19
----------
[train]
LOSS - 0.0371
ACC - 0.9600
PPV - ALL: 1.0000  COVID-19: 1.0000  PNEUMONIA: 1.0000  NORMAL: 1.0000 
RECALL - ALL: 1.0000  COVID-19: 1.0000  PNEUMONIA: 1.0000  NORMAL: 1.0000 
F1 - ALL: 1.0000  COVID-19: 1.0000  PNEUMONIA: 1.0000  NORMAL: 1.0000 
Mask ratio's range: 0.5625 ~ 0.75

[val]
LOSS - 0.6018
ACC - 0.7533
PPV - ALL: 0.7806  COVID-19: 0.8788  PNEUMONIA: 0.7477  NORMAL: 0.7154 
RECALL - ALL: 0.7656  COVID-19: 0.5800  PNEUMONIA: 0.8000  NORMAL: 0.9167 
F1 - ALL: 0.7585  COVID-19: 0.6988  PNEUMONIA: 0.7730  NORMAL: 0.8036 

Epoch 15/19
----------
[train]
LOSS - 0.0356
ACC - 0.9600
PPV - ALL: 1.0000  COVID-19: 1.0000  PNEUMONIA: 1.0000  NORMAL: 1.0000 
RECALL - ALL: 1.0000  COVID-19: 1.0000  PNEUMONIA: 1.0000  NORMAL: 1.0000 
F1 - ALL: 1.0000  COVID-19: 1.0000  PNEUMONIA: 1.0000  NORMAL: 1.0000 
Mask ratio's range: 0.625 ~ 0.75

[val]
LOSS - 0.5789
ACC - 0.7567
PPV - ALL: 0.7810  COVID-19: 0.8657  PNEUMONIA: 0.7523  NORMAL: 0.7250 
RECALL - ALL: 0.7687  COVID-19: 0.5800  PNEUMONIA: 0.8200  NORMAL: 0.9062 
F1 - ALL: 0.7616  COVID-19: 0.6946  PNEUMONIA: 0.7847  NORMAL: 0.8055 

Epoch 16/19
----------
[train]
LOSS - 0.0339
ACC - 0.9600
PPV - ALL: 1.0000  COVID-19: 1.0000  PNEUMONIA: 1.0000  NORMAL: 1.0000 
RECALL - ALL: 1.0000  COVID-19: 1.0000  PNEUMONIA: 1.0000  NORMAL: 1.0000 
F1 - ALL: 1.0000  COVID-19: 1.0000  PNEUMONIA: 1.0000  NORMAL: 1.0000 
Mask ratio's range: 0.625 ~ 0.75

[val]
LOSS - 0.5851
ACC - 0.7633
PPV - ALL: 0.7884  COVID-19: 0.8841  PNEUMONIA: 0.7545  NORMAL: 0.7265 
RECALL - ALL: 0.7751  COVID-19: 0.6100  PNEUMONIA: 0.8300  NORMAL: 0.8854 
F1 - ALL: 0.7702  COVID-19: 0.7219  PNEUMONIA: 0.7905  NORMAL: 0.7981 

Epoch 17/19
----------
[train]
LOSS - 0.0402
ACC - 0.9600
PPV - ALL: 1.0000  COVID-19: 1.0000  PNEUMONIA: 1.0000  NORMAL: 1.0000 
RECALL - ALL: 1.0000  COVID-19: 1.0000  PNEUMONIA: 1.0000  NORMAL: 1.0000 
F1 - ALL: 1.0000  COVID-19: 1.0000  PNEUMONIA: 1.0000  NORMAL: 1.0000 
Mask ratio's range: 0.625 ~ 0.75

[val]
LOSS - 0.5630
ACC - 0.7767
PPV - ALL: 0.7998  COVID-19: 0.8857  PNEUMONIA: 0.7636  NORMAL: 0.7500 
RECALL - ALL: 0.7887  COVID-19: 0.6200  PNEUMONIA: 0.8400  NORMAL: 0.9062 
F1 - ALL: 0.7834  COVID-19: 0.7294  PNEUMONIA: 0.8000  NORMAL: 0.8207 

Epoch 18/19
----------
[train]
LOSS - 0.0358
ACC - 0.9600
PPV - ALL: 1.0000  COVID-19: 1.0000  PNEUMONIA: 1.0000  NORMAL: 1.0000 
RECALL - ALL: 1.0000  COVID-19: 1.0000  PNEUMONIA: 1.0000  NORMAL: 1.0000 
F1 - ALL: 1.0000  COVID-19: 1.0000  PNEUMONIA: 1.0000  NORMAL: 1.0000 
Mask ratio's range: 0.5625 ~ 0.75

[val]
LOSS - 0.6048
ACC - 0.7633
PPV - ALL: 0.7884  COVID-19: 0.8806  PNEUMONIA: 0.7456  NORMAL: 0.7391 
RECALL - ALL: 0.7751  COVID-19: 0.5900  PNEUMONIA: 0.8500  NORMAL: 0.8854 
F1 - ALL: 0.7689  COVID-19: 0.7066  PNEUMONIA: 0.7944  NORMAL: 0.8057 

Epoch 19/19
----------
[train]
LOSS - 0.0446
ACC - 0.9600
PPV - ALL: 1.0000  COVID-19: 1.0000  PNEUMONIA: 1.0000  NORMAL: 1.0000 
RECALL - ALL: 1.0000  COVID-19: 1.0000  PNEUMONIA: 1.0000  NORMAL: 1.0000 
F1 - ALL: 1.0000  COVID-19: 1.0000  PNEUMONIA: 1.0000  NORMAL: 1.0000 
Mask ratio's range: 0.5 ~ 0.6875

[val]
LOSS - 0.6168
ACC - 0.7633
PPV - ALL: 0.7965  COVID-19: 0.9194  PNEUMONIA: 0.7373  NORMAL: 0.7328 
RECALL - ALL: 0.7751  COVID-19: 0.5700  PNEUMONIA: 0.8700  NORMAL: 0.8854 
F1 - ALL: 0.7679  COVID-19: 0.7037  PNEUMONIA: 0.7982  NORMAL: 0.8019 


--------------------
[Best results]
ACC - 0.7767
PPV - ALL: 0.7898  COVID-19: 0.8140  PNEUMONIA: 0.7455  NORMAL: 0.8100 
RECALL - ALL: 0.7879  COVID-19: 0.7000  PNEUMONIA: 0.8200  NORMAL: 0.8438 
F1 - ALL: 0.7868  COVID-19: 0.7527  PNEUMONIA: 0.7810  NORMAL: 0.8266 

Training complete in 1m 31s
-------------------- 

--------------------
Model 5
--------------------

Epoch 0/19
----------
[train]
LOSS - 1.0377
ACC - 0.3733
PPV - ALL: 0.3876  COVID-19: 0.3333  PNEUMONIA: 0.4545  NORMAL: 0.3750 
RECALL - ALL: 0.3889  COVID-19: 0.2500  PNEUMONIA: 0.4167  NORMAL: 0.5000 
F1 - ALL: 0.3830  COVID-19: 0.2857  PNEUMONIA: 0.4348  NORMAL: 0.4286 
Mask ratio's range: 1.0 ~ 1.0

[val]
LOSS - 1.0338
ACC - 0.4433
PPV - ALL: 0.5384  COVID-19: 0.6667  PNEUMONIA: 0.5278  NORMAL: 0.4208 
RECALL - ALL: 0.4563  COVID-19: 0.0200  PNEUMONIA: 0.3800  NORMAL: 0.9688 
F1 - ALL: 0.3558  COVID-19: 0.0388  PNEUMONIA: 0.4419  NORMAL: 0.5867 

Epoch 1/19
----------
[train]
LOSS - 0.6397
ACC - 0.9067
PPV - ALL: 0.9444  COVID-19: 0.9565  PNEUMONIA: 0.9167  NORMAL: 0.9600 
RECALL - ALL: 0.9445  COVID-19: 0.9167  PNEUMONIA: 0.9167  NORMAL: 1.0000 
F1 - ALL: 0.9442  COVID-19: 0.9362  PNEUMONIA: 0.9167  NORMAL: 0.9796 
Mask ratio's range: 1.0 ~ 1.0

[val]
LOSS - 0.8116
ACC - 0.7300
PPV - ALL: 0.7576  COVID-19: 0.8615  PNEUMONIA: 0.7217  NORMAL: 0.6897 
RECALL - ALL: 0.7411  COVID-19: 0.5600  PNEUMONIA: 0.8300  NORMAL: 0.8333 
F1 - ALL: 0.7352  COVID-19: 0.6788  PNEUMONIA: 0.7721  NORMAL: 0.7547 

Epoch 2/19
----------
[train]
LOSS - 0.2783
ACC - 0.9600
PPV - ALL: 1.0000  COVID-19: 1.0000  PNEUMONIA: 1.0000  NORMAL: 1.0000 
RECALL - ALL: 1.0000  COVID-19: 1.0000  PNEUMONIA: 1.0000  NORMAL: 1.0000 
F1 - ALL: 1.0000  COVID-19: 1.0000  PNEUMONIA: 1.0000  NORMAL: 1.0000 
Mask ratio's range: 1.0 ~ 1.0

[val]
LOSS - 0.6708
ACC - 0.7367
PPV - ALL: 0.7610  COVID-19: 0.8529  PNEUMONIA: 0.7232  NORMAL: 0.7069 
RECALL - ALL: 0.7481  COVID-19: 0.5800  PNEUMONIA: 0.8100  NORMAL: 0.8542 
F1 - ALL: 0.7427  COVID-19: 0.6905  PNEUMONIA: 0.7641  NORMAL: 0.7736 

Epoch 3/19
----------
[train]
LOSS - 0.1053
ACC - 0.9600
PPV - ALL: 1.0000  COVID-19: 1.0000  PNEUMONIA: 1.0000  NORMAL: 1.0000 
RECALL - ALL: 1.0000  COVID-19: 1.0000  PNEUMONIA: 1.0000  NORMAL: 1.0000 
F1 - ALL: 1.0000  COVID-19: 1.0000  PNEUMONIA: 1.0000  NORMAL: 1.0000 
Mask ratio's range: 0.9375 ~ 1.0

[val]
LOSS - 0.5885
ACC - 0.7600
PPV - ALL: 0.7775  COVID-19: 0.8462  PNEUMONIA: 0.7411  NORMAL: 0.7453 
RECALL - ALL: 0.7710  COVID-19: 0.6600  PNEUMONIA: 0.8300  NORMAL: 0.8229 
F1 - ALL: 0.7689  COVID-19: 0.7416  PNEUMONIA: 0.7830  NORMAL: 0.7822 

Epoch 4/19
----------
[train]
LOSS - 0.0439
ACC - 0.9600
PPV - ALL: 1.0000  COVID-19: 1.0000  PNEUMONIA: 1.0000  NORMAL: 1.0000 
RECALL - ALL: 1.0000  COVID-19: 1.0000  PNEUMONIA: 1.0000  NORMAL: 1.0000 
F1 - ALL: 1.0000  COVID-19: 1.0000  PNEUMONIA: 1.0000  NORMAL: 1.0000 
Mask ratio's range: 0.9375 ~ 1.0

[val]
LOSS - 0.5515
ACC - 0.7733
PPV - ALL: 0.7894  COVID-19: 0.8519  PNEUMONIA: 0.7615  NORMAL: 0.7547 
RECALL - ALL: 0.7844  COVID-19: 0.6900  PNEUMONIA: 0.8300  NORMAL: 0.8333 
F1 - ALL: 0.7830  COVID-19: 0.7625  PNEUMONIA: 0.7943  NORMAL: 0.7921 

Epoch 5/19
----------
[train]
LOSS - 0.0428
ACC - 0.9600
PPV - ALL: 1.0000  COVID-19: 1.0000  PNEUMONIA: 1.0000  NORMAL: 1.0000 
RECALL - ALL: 1.0000  COVID-19: 1.0000  PNEUMONIA: 1.0000  NORMAL: 1.0000 
F1 - ALL: 1.0000  COVID-19: 1.0000  PNEUMONIA: 1.0000  NORMAL: 1.0000 
Mask ratio's range: 0.875 ~ 1.0

[val]
LOSS - 0.5667
ACC - 0.7733
PPV - ALL: 0.7890  COVID-19: 0.8554  PNEUMONIA: 0.7664  NORMAL: 0.7453 
RECALL - ALL: 0.7843  COVID-19: 0.7100  PNEUMONIA: 0.8200  NORMAL: 0.8229 
F1 - ALL: 0.7835  COVID-19: 0.7759  PNEUMONIA: 0.7923  NORMAL: 0.7822 

Epoch 6/19
----------
[train]
LOSS - 0.0420
ACC - 0.9600
PPV - ALL: 1.0000  COVID-19: 1.0000  PNEUMONIA: 1.0000  NORMAL: 1.0000 
RECALL - ALL: 1.0000  COVID-19: 1.0000  PNEUMONIA: 1.0000  NORMAL: 1.0000 
F1 - ALL: 1.0000  COVID-19: 1.0000  PNEUMONIA: 1.0000  NORMAL: 1.0000 
Mask ratio's range: 0.875 ~ 1.0

[val]
LOSS - 0.5543
ACC - 0.7767
PPV - ALL: 0.7916  COVID-19: 0.8452  PNEUMONIA: 0.7864  NORMAL: 0.7431 
RECALL - ALL: 0.7879  COVID-19: 0.7100  PNEUMONIA: 0.8100  NORMAL: 0.8438 
F1 - ALL: 0.7867  COVID-19: 0.7717  PNEUMONIA: 0.7980  NORMAL: 0.7903 

Epoch 7/19
----------
[train]
LOSS - 0.0343
ACC - 0.9600
PPV - ALL: 1.0000  COVID-19: 1.0000  PNEUMONIA: 1.0000  NORMAL: 1.0000 
RECALL - ALL: 1.0000  COVID-19: 1.0000  PNEUMONIA: 1.0000  NORMAL: 1.0000 
F1 - ALL: 1.0000  COVID-19: 1.0000  PNEUMONIA: 1.0000  NORMAL: 1.0000 
Mask ratio's range: 0.8125 ~ 1.0

[val]
LOSS - 0.5220
ACC - 0.7767
PPV - ALL: 0.7908  COVID-19: 0.8276  PNEUMONIA: 0.8061  NORMAL: 0.7387 
RECALL - ALL: 0.7881  COVID-19: 0.7200  PNEUMONIA: 0.7900  NORMAL: 0.8542 
F1 - ALL: 0.7868  COVID-19: 0.7701  PNEUMONIA: 0.7980  NORMAL: 0.7923 

Epoch 8/19
----------
[train]
LOSS - 0.0336
ACC - 0.9600
PPV - ALL: 1.0000  COVID-19: 1.0000  PNEUMONIA: 1.0000  NORMAL: 1.0000 
RECALL - ALL: 1.0000  COVID-19: 1.0000  PNEUMONIA: 1.0000  NORMAL: 1.0000 
F1 - ALL: 1.0000  COVID-19: 1.0000  PNEUMONIA: 1.0000  NORMAL: 1.0000 
Mask ratio's range: 0.8125 ~ 1.0

[val]
LOSS - 0.5520
ACC - 0.7767
PPV - ALL: 0.7915  COVID-19: 0.8313  PNEUMONIA: 0.8020  NORMAL: 0.7411 
RECALL - ALL: 0.7882  COVID-19: 0.6900  PNEUMONIA: 0.8100  NORMAL: 0.8646 
F1 - ALL: 0.7861  COVID-19: 0.7541  PNEUMONIA: 0.8060  NORMAL: 0.7981 

Epoch 9/19
----------
[train]
LOSS - 0.0447
ACC - 0.9600
PPV - ALL: 1.0000  COVID-19: 1.0000  PNEUMONIA: 1.0000  NORMAL: 1.0000 
RECALL - ALL: 1.0000  COVID-19: 1.0000  PNEUMONIA: 1.0000  NORMAL: 1.0000 
F1 - ALL: 1.0000  COVID-19: 1.0000  PNEUMONIA: 1.0000  NORMAL: 1.0000 
Mask ratio's range: 0.8125 ~ 1.0

[val]
LOSS - 0.5450
ACC - 0.7800
PPV - ALL: 0.7957  COVID-19: 0.8415  PNEUMONIA: 0.8000  NORMAL: 0.7456 
RECALL - ALL: 0.7918  COVID-19: 0.6900  PNEUMONIA: 0.8000  NORMAL: 0.8854 
F1 - ALL: 0.7893  COVID-19: 0.7583  PNEUMONIA: 0.8000  NORMAL: 0.8095 

Epoch 10/19
----------
[train]
LOSS - 0.0259
ACC - 0.9600
PPV - ALL: 1.0000  COVID-19: 1.0000  PNEUMONIA: 1.0000  NORMAL: 1.0000 
RECALL - ALL: 1.0000  COVID-19: 1.0000  PNEUMONIA: 1.0000  NORMAL: 1.0000 
F1 - ALL: 1.0000  COVID-19: 1.0000  PNEUMONIA: 1.0000  NORMAL: 1.0000 
Mask ratio's range: 0.8125 ~ 1.0

[val]
LOSS - 0.5544
ACC - 0.7767
PPV - ALL: 0.7958  COVID-19: 0.8481  PNEUMONIA: 0.8144  NORMAL: 0.7250 
RECALL - ALL: 0.7887  COVID-19: 0.6700  PNEUMONIA: 0.7900  NORMAL: 0.9062 
F1 - ALL: 0.7854  COVID-19: 0.7486  PNEUMONIA: 0.8020  NORMAL: 0.8055 

Epoch 11/19
----------
[train]
LOSS - 0.0674
ACC - 0.9600
PPV - ALL: 1.0000  COVID-19: 1.0000  PNEUMONIA: 1.0000  NORMAL: 1.0000 
RECALL - ALL: 1.0000  COVID-19: 1.0000  PNEUMONIA: 1.0000  NORMAL: 1.0000 
F1 - ALL: 1.0000  COVID-19: 1.0000  PNEUMONIA: 1.0000  NORMAL: 1.0000 
Mask ratio's range: 0.75 ~ 0.875

[val]
LOSS - 0.6438
ACC - 0.7800
PPV - ALL: 0.8069  COVID-19: 0.8933  PNEUMONIA: 0.8211  NORMAL: 0.7063 
RECALL - ALL: 0.7924  COVID-19: 0.6700  PNEUMONIA: 0.7800  NORMAL: 0.9271 
F1 - ALL: 0.7892  COVID-19: 0.7657  PNEUMONIA: 0.8000  NORMAL: 0.8018 

Epoch 12/19
----------
[train]
LOSS - 0.0629
ACC - 0.9600
PPV - ALL: 1.0000  COVID-19: 1.0000  PNEUMONIA: 1.0000  NORMAL: 1.0000 
RECALL - ALL: 1.0000  COVID-19: 1.0000  PNEUMONIA: 1.0000  NORMAL: 1.0000 
F1 - ALL: 1.0000  COVID-19: 1.0000  PNEUMONIA: 1.0000  NORMAL: 1.0000 
Mask ratio's range: 0.75 ~ 0.875

[val]
LOSS - 0.6411
ACC - 0.7833
PPV - ALL: 0.8132  COVID-19: 0.8933  PNEUMONIA: 0.8462  NORMAL: 0.7000 
RECALL - ALL: 0.7960  COVID-19: 0.6700  PNEUMONIA: 0.7700  NORMAL: 0.9479 
F1 - ALL: 0.7924  COVID-19: 0.7657  PNEUMONIA: 0.8063  NORMAL: 0.8053 

Epoch 13/19
----------
[train]
LOSS - 0.0877
ACC - 0.9600
PPV - ALL: 1.0000  COVID-19: 1.0000  PNEUMONIA: 1.0000  NORMAL: 1.0000 
RECALL - ALL: 1.0000  COVID-19: 1.0000  PNEUMONIA: 1.0000  NORMAL: 1.0000 
F1 - ALL: 1.0000  COVID-19: 1.0000  PNEUMONIA: 1.0000  NORMAL: 1.0000 
Mask ratio's range: 0.5625 ~ 0.8125

[val]
LOSS - 0.6595
ACC - 0.7633
PPV - ALL: 0.7907  COVID-19: 0.8630  PNEUMONIA: 0.8191  NORMAL: 0.6899 
RECALL - ALL: 0.7757  COVID-19: 0.6300  PNEUMONIA: 0.7700  NORMAL: 0.9271 
F1 - ALL: 0.7711  COVID-19: 0.7283  PNEUMONIA: 0.7938  NORMAL: 0.7911 

Epoch 14/19
----------
[train]
LOSS - 0.0555
ACC - 0.9600
PPV - ALL: 1.0000  COVID-19: 1.0000  PNEUMONIA: 1.0000  NORMAL: 1.0000 
RECALL - ALL: 1.0000  COVID-19: 1.0000  PNEUMONIA: 1.0000  NORMAL: 1.0000 
F1 - ALL: 1.0000  COVID-19: 1.0000  PNEUMONIA: 1.0000  NORMAL: 1.0000 
Mask ratio's range: 0.5625 ~ 0.8125

[val]
LOSS - 0.7264
ACC - 0.7600
PPV - ALL: 0.8013  COVID-19: 0.9333  PNEUMONIA: 0.7864  NORMAL: 0.6842 
RECALL - ALL: 0.7726  COVID-19: 0.5600  PNEUMONIA: 0.8100  NORMAL: 0.9479 
F1 - ALL: 0.7642  COVID-19: 0.7000  PNEUMONIA: 0.7980  NORMAL: 0.7947 

Epoch 15/19
----------
[train]
LOSS - 0.0444
ACC - 0.9600
PPV - ALL: 1.0000  COVID-19: 1.0000  PNEUMONIA: 1.0000  NORMAL: 1.0000 
RECALL - ALL: 1.0000  COVID-19: 1.0000  PNEUMONIA: 1.0000  NORMAL: 1.0000 
F1 - ALL: 1.0000  COVID-19: 1.0000  PNEUMONIA: 1.0000  NORMAL: 1.0000 
Mask ratio's range: 0.5 ~ 0.8125

[val]
LOSS - 0.7172
ACC - 0.7333
PPV - ALL: 0.7801  COVID-19: 0.9286  PNEUMONIA: 0.7524  NORMAL: 0.6593 
RECALL - ALL: 0.7457  COVID-19: 0.5200  PNEUMONIA: 0.7900  NORMAL: 0.9271 
F1 - ALL: 0.7360  COVID-19: 0.6667  PNEUMONIA: 0.7707  NORMAL: 0.7706 

Epoch 16/19
----------
[train]
LOSS - 0.0388
ACC - 0.9600
PPV - ALL: 1.0000  COVID-19: 1.0000  PNEUMONIA: 1.0000  NORMAL: 1.0000 
RECALL - ALL: 1.0000  COVID-19: 1.0000  PNEUMONIA: 1.0000  NORMAL: 1.0000 
F1 - ALL: 1.0000  COVID-19: 1.0000  PNEUMONIA: 1.0000  NORMAL: 1.0000 
Mask ratio's range: 0.4375 ~ 0.8125

[val]
LOSS - 0.7211
ACC - 0.7433
PPV - ALL: 0.7882  COVID-19: 0.9310  PNEUMONIA: 0.7670  NORMAL: 0.6667 
RECALL - ALL: 0.7558  COVID-19: 0.5400  PNEUMONIA: 0.7900  NORMAL: 0.9375 
F1 - ALL: 0.7470  COVID-19: 0.6835  PNEUMONIA: 0.7783  NORMAL: 0.7792 

Epoch 17/19
----------
[train]
LOSS - 0.0408
ACC - 0.9600
PPV - ALL: 1.0000  COVID-19: 1.0000  PNEUMONIA: 1.0000  NORMAL: 1.0000 
RECALL - ALL: 1.0000  COVID-19: 1.0000  PNEUMONIA: 1.0000  NORMAL: 1.0000 
F1 - ALL: 1.0000  COVID-19: 1.0000  PNEUMONIA: 1.0000  NORMAL: 1.0000 
Mask ratio's range: 0.4375 ~ 0.8125

[val]
LOSS - 0.7101
ACC - 0.7500
PPV - ALL: 0.7929  COVID-19: 0.9310  PNEUMONIA: 0.7736  NORMAL: 0.6742 
RECALL - ALL: 0.7624  COVID-19: 0.5400  PNEUMONIA: 0.8200  NORMAL: 0.9271 
F1 - ALL: 0.7534  COVID-19: 0.6835  PNEUMONIA: 0.7961  NORMAL: 0.7807 

Epoch 18/19
----------
[train]
LOSS - 0.0857
ACC - 0.9600
PPV - ALL: 1.0000  COVID-19: 1.0000  PNEUMONIA: 1.0000  NORMAL: 1.0000 
RECALL - ALL: 1.0000  COVID-19: 1.0000  PNEUMONIA: 1.0000  NORMAL: 1.0000 
F1 - ALL: 1.0000  COVID-19: 1.0000  PNEUMONIA: 1.0000  NORMAL: 1.0000 
Mask ratio's range: 0.4375 ~ 0.8125

[val]
LOSS - 0.7956
ACC - 0.7467
PPV - ALL: 0.7859  COVID-19: 0.9138  PNEUMONIA: 0.7593  NORMAL: 0.6846 
RECALL - ALL: 0.7590  COVID-19: 0.5300  PNEUMONIA: 0.8200  NORMAL: 0.9271 
F1 - ALL: 0.7490  COVID-19: 0.6709  PNEUMONIA: 0.7885  NORMAL: 0.7876 

Epoch 19/19
----------
[train]
LOSS - 0.0397
ACC - 0.9600
PPV - ALL: 1.0000  COVID-19: 1.0000  PNEUMONIA: 1.0000  NORMAL: 1.0000 
RECALL - ALL: 1.0000  COVID-19: 1.0000  PNEUMONIA: 1.0000  NORMAL: 1.0000 
F1 - ALL: 1.0000  COVID-19: 1.0000  PNEUMONIA: 1.0000  NORMAL: 1.0000 
Mask ratio's range: 0.375 ~ 0.8125

[val]
LOSS - 0.7689
ACC - 0.7267
PPV - ALL: 0.7690  COVID-19: 0.9057  PNEUMONIA: 0.7217  NORMAL: 0.6797 
RECALL - ALL: 0.7387  COVID-19: 0.4800  PNEUMONIA: 0.8300  NORMAL: 0.9062 
F1 - ALL: 0.7255  COVID-19: 0.6275  PNEUMONIA: 0.7721  NORMAL: 0.7768 


--------------------
[Best results]
ACC - 0.7833
PPV - ALL: 0.8132  COVID-19: 0.8933  PNEUMONIA: 0.8462  NORMAL: 0.7000 
RECALL - ALL: 0.7960  COVID-19: 0.6700  PNEUMONIA: 0.7700  NORMAL: 0.9479 
F1 - ALL: 0.7924  COVID-19: 0.7657  PNEUMONIA: 0.8063  NORMAL: 0.8053 

Training complete in 1m 32s
-------------------- 

[Mean results]
ACC - 0.7973 (0.02)
PPV - ALL: 0.8158 (0.02)  COVID-19: 0.8718 (0.05)  PNEUMONIA: 0.7934 (0.04)  NORMAL: 0.7821 (0.05) 
RECALL - ALL: 0.8087 (0.02)  COVID-19: 0.7420 (0.05)  PNEUMONIA: 0.8340 (0.04)  NORMAL: 0.8500 (0.06) 
F1 - ALL: 0.8077 (0.02)  COVID-19: 0.7999 (0.03)  PNEUMONIA: 0.8121 (0.02)  NORMAL: 0.8112 (0.01) 

